"No.","Time","Source","Destination","Protocol","Length","Info"
"1","0.000000","DeltaEle_ca:91:52","IntelCor_c3:41:78","EAPOL","135","Key (Message 2 of 4)"
"2","0.013694","DeltaEle_ca:91:52","IntelCor_c3:41:78","EAPOL","113","Key (Message 4 of 4)"
"3","0.029835","0.0.0.0","255.255.255.255","DHCP","342","DHCP Discover - Transaction ID 0xa1b"
"4","0.029987","10.10.10.1","10.10.10.123","DHCP","342","DHCP Offer    - Transaction ID 0xa1b"
"5","0.036242","0.0.0.0","255.255.255.255","DHCP","342","DHCP Request  - Transaction ID 0xa1b"
"6","0.136673","10.10.10.1","10.10.10.123","DHCP","342","DHCP ACK      - Transaction ID 0xa1b"
"7","0.142586","DeltaEle_ca:91:52","Broadcast","ARP","60","Who has 10.10.10.123? Tell 0.0.0.0"
"8","1.134889","DeltaEle_ca:91:52","Broadcast","ARP","60","Who has 10.10.10.1? Tell 10.10.10.123"
"9","1.134912","DavidEle_06:08:ba","DeltaEle_ca:91:52","ARP","42","10.10.10.1 is at 00:b5:6d:06:08:ba"
"10","1.161557","10.10.10.123","10.10.10.1","DNS","74","Standard query 0x0001 A www.fitbit.com"
"11","1.161637","10.10.10.1","10.10.10.123","DNS","153","Standard query response 0x0001 A www.fitbit.com CNAME www.fitbit.com.cdn.cloudflare.net A 104.16.65.50 A 104.16.66.50"
"12","1.181158","10.10.10.123","104.16.66.50","TCP","74","62997  >  80 [SYN] Seq=0 Win=8688 Len=0 MSS=1460 WS=1 TSval=1360590954 TSecr=0"
"13","1.182701","104.16.66.50","10.10.10.123","TCP","62","80  >  62997 [SYN, ACK] Seq=0 Ack=1 Win=29200 Len=0 MSS=1380 WS=1024"
"14","1.185988","10.10.10.123","104.16.66.50","TCP","54","62997  >  80 [ACK] Seq=1 Ack=1 Win=9660 Len=0"
"15","1.191924","10.10.10.123","104.16.66.50","TCP","150","62997  >  80 [PSH, ACK] Seq=1 Ack=1 Win=9660 Len=96 [TCP segment of a reassembled PDU]"
"16","1.192887","10.10.10.123","104.16.66.50","HTTP","78","GET /scale/register?serialNumber=20F85ECA9152&token=DPcheC1cFX7slXmno84l&ssid=IoTSoft HTTP/1.1 "
"17","1.193173","104.16.66.50","10.10.10.123","TCP","54","80  >  62997 [ACK] Seq=1 Ack=97 Win=29696 Len=0"
"18","1.194097","104.16.66.50","10.10.10.123","TCP","54","80  >  62997 [ACK] Seq=1 Ack=121 Win=29696 Len=0"
"19","1.490000","104.16.66.50","10.10.10.123","HTTP","659","HTTP/1.1 200 OK "
"20","1.514786","10.10.10.123","104.16.66.50","TCP","137","62997  >  80 [PSH, ACK] Seq=121 Ack=606 Win=9055 Len=83 [TCP segment of a reassembled PDU]"
"21","1.516105","104.16.66.50","10.10.10.123","TCP","54","80  >  62997 [ACK] Seq=606 Ack=204 Win=29696 Len=0"
"22","1.516865","10.10.10.123","104.16.66.50","HTTP","78","GET /scale/validate?serialNumber=20F85ECA9152&token=DPcheC1cFX7slXmno84l HTTP/1.1 "
"23","1.518157","104.16.66.50","10.10.10.123","TCP","54","80  >  62997 [ACK] Seq=606 Ack=228 Win=29696 Len=0"
"24","1.659353","104.16.66.50","10.10.10.123","TCP","674","80  >  62997 [PSH, ACK] Seq=606 Ack=228 Win=29696 Len=620 [TCP segment of a reassembled PDU]"
"25","1.659384","104.16.66.50","10.10.10.123","HTTP","59","HTTP/1.1 200 OK  (text/plain)"
"26","1.670839","10.10.10.123","104.16.66.50","TCP","54","62997  >  80 [FIN, PSH, ACK] Seq=228 Ack=1231 Win=8430 Len=0"
"27","1.672136","104.16.66.50","10.10.10.123","TCP","54","80  >  62997 [FIN, ACK] Seq=1231 Ack=229 Win=29696 Len=0"
"28","1.675001","10.10.10.123","104.16.66.50","TCP","54","62997  >  80 [ACK] Seq=229 Ack=1232 Win=8429 Len=0"
"29","1.691112","10.10.10.123","104.16.66.50","TCP","74","57766  >  80 [SYN] Seq=0 Win=8688 Len=0 MSS=1460 WS=1 TSval=1360591454 TSecr=0"
"30","1.692568","104.16.66.50","10.10.10.123","TCP","62","80  >  57766 [SYN, ACK] Seq=0 Ack=1 Win=29200 Len=0 MSS=1380 WS=1024"
"31","1.695377","10.10.10.123","104.16.66.50","TCP","54","57766  >  80 [ACK] Seq=1 Ack=1 Win=9660 Len=0"
"32","1.696318","10.10.10.123","104.16.66.50","TCP","83","57766  >  80 [PSH, ACK] Seq=1 Ack=1 Win=9660 Len=29 [TCP segment of a reassembled PDU]"
"33","1.697403","10.10.10.123","104.16.66.50","TCP","171","57766  >  80 [PSH, ACK] Seq=30 Ack=1 Win=9660 Len=117 [TCP segment of a reassembled PDU]"
"34","1.697747","104.16.66.50","10.10.10.123","TCP","54","80  >  57766 [ACK] Seq=1 Ack=30 Win=29696 Len=0"
"35","1.698669","104.16.66.50","10.10.10.123","TCP","54","80  >  57766 [ACK] Seq=1 Ack=147 Win=29696 Len=0"
"36","1.701429","10.10.10.123","104.16.66.50","HTTP","102","POST /scale/upload HTTP/1.1  (application/x-www-form-urlencoded)"
"37","1.702743","104.16.66.50","10.10.10.123","TCP","54","80  >  57766 [ACK] Seq=1 Ack=195 Win=29696 Len=0"
"38","1.982788","104.16.66.50","10.10.10.123","HTTP","779","HTTP/1.1 200 OK  (application/octet-stream)"
"39","1.991549","10.10.10.123","104.16.66.50","TCP","54","57766  >  80 [FIN, PSH, ACK] Seq=195 Ack=726 Win=8935 Len=0"
"40","1.993139","104.16.66.50","10.10.10.123","TCP","54","80  >  57766 [FIN, ACK] Seq=726 Ack=196 Win=29696 Len=0"
"41","1.995952","10.10.10.123","104.16.66.50","TCP","54","57766  >  80 [ACK] Seq=196 Ack=727 Win=8934 Len=0"
"42","2.034660","0.0.0.0","255.255.255.255","DHCP","342","DHCP Discover - Transaction ID 0xa1b"
"43","2.034925","10.10.10.1","10.10.10.123","DHCP","342","DHCP Offer    - Transaction ID 0xa1b"
"44","2.038793","0.0.0.0","255.255.255.255","DHCP","342","DHCP Request  - Transaction ID 0xa1b"
"45","2.120748","10.10.10.1","10.10.10.123","DHCP","342","DHCP ACK      - Transaction ID 0xa1b"
"46","2.124018","DeltaEle_ca:91:52","Broadcast","ARP","60","Who has 10.10.10.123? Tell 0.0.0.0"
"47","3.034671","DeltaEle_ca:91:52","Broadcast","ARP","60","Who has 10.10.10.1? Tell 10.10.10.123"
"48","3.034692","DavidEle_06:08:ba","DeltaEle_ca:91:52","ARP","42","10.10.10.1 is at 00:b5:6d:06:08:ba"
"49","11.567495","DeltaEle_ca:91:52","IntelCor_c3:41:78","EAPOL","113","Key (Group Message 2 of 2)"
