"No.","Time","Source","Destination","Protocol","Length","Info"
"1","0.000000","::","ff02::1:ffaa:fd4e","ICMPv6","78","Neighbor Solicitation for fe80::1e5f:2bff:feaa:fd4e"
"2","0.897113","0.0.0.0","255.255.255.255","DHCP","351","DHCP Discover - Transaction ID 0x23f788eb"
"3","0.897284","10.10.10.1","10.10.10.87","DHCP","342","DHCP Offer    - Transaction ID 0x23f788eb"
"4","0.898552","0.0.0.0","255.255.255.255","DHCP","363","DHCP Request  - Transaction ID 0x23f788eb"
"5","0.979736","10.10.10.1","10.10.10.87","DHCP","348","DHCP ACK      - Transaction ID 0x23f788eb"
"6","1.000089","fe80::1e5f:2bff:feaa:fd4e","ff02::2","ICMPv6","70","Router Solicitation from 1c:5f:2b:aa:fd:4e"
"7","1.368045","D-LinkIn_aa:fd:4e","Broadcast","ARP","60","Who has 10.10.10.1? Tell 10.10.10.87"
"8","1.368088","DavidEle_06:08:ba","D-LinkIn_aa:fd:4e","ARP","42","10.10.10.1 is at 00:b5:6d:06:08:ba"
"9","1.368302","10.10.10.87","10.10.10.1","DNS","74","Standard query 0x0002 A ntp1.dlink.com"
"10","1.368383","10.10.10.1","10.10.10.87","DNS","106","Standard query response 0x0002 A ntp1.dlink.com A 54.186.215.173 A 54.86.11.193"
"11","1.369254","10.10.10.87","54.186.215.173","NTP","90","NTP Version 3, client"
"12","1.535899","54.186.215.173","10.10.10.87","NTP","90","NTP Version 3, server"
"13","2.428128","10.10.10.87","224.0.0.22","IGMPv3","60","Membership Report / Join group 224.0.0.251 for any sources"
"14","2.678859","10.10.10.30","10.10.10.87","TCP","66","59129  >  80 [FIN, ACK] Seq=1 Ack=1 Win=843 Len=0 TSval=7784926 TSecr=4294944064"
"15","2.680003","D-LinkIn_aa:fd:4e","Broadcast","ARP","60","Who has 10.10.10.30? Tell 10.10.10.87"
"16","2.681761","SamsungE_ef:85:41","D-LinkIn_aa:fd:4e","ARP","42","10.10.10.30 is at 38:0b:40:ef:85:41"
"17","2.681955","10.10.10.87","10.10.10.30","TCP","60","80  >  59129 [RST] Seq=1 Win=0 Len=0"
"18","2.713355","10.10.10.87","224.0.0.251","MDNS","333","Standard query 0x0000 ANY a.0.5.6.c.a.e.f.f.f.1.6.7.8.c.7.0.0.0.0.0.0.0.0.0.0.0.0.0.8.e.f.ip6.arpa, ""QM"" question ANY dchgFD4E.local, ""QM"" question ANY 87.10.10.10.in-addr.arpa, ""QM"" question ANY dchg.local, ""QM"" question A 10.10.10.87 PTR dchgFD4E.local A 10.10.10.87 PTR dchg.local AAAA fe80::7c87:61ff:feac:650a PTR dchgFD4E.local AAAA fe80::7c87:61ff:feac:650a PTR dchg.local"
"19","2.965111","10.10.10.87","224.0.0.251","MDNS","333","Standard query 0x0000 ANY a.0.5.6.c.a.e.f.f.f.1.6.7.8.c.7.0.0.0.0.0.0.0.0.0.0.0.0.0.8.e.f.ip6.arpa, ""QM"" question ANY dchgFD4E.local, ""QM"" question ANY 87.10.10.10.in-addr.arpa, ""QM"" question ANY dchg.local, ""QM"" question A 10.10.10.87 PTR dchgFD4E.local A 10.10.10.87 PTR dchg.local AAAA fe80::7c87:61ff:feac:650a PTR dchgFD4E.local AAAA fe80::7c87:61ff:feac:650a PTR dchg.local"
"20","3.004049","fe80::7c87:61ff:feac:650a","ff02::2","ICMPv6","70","Router Solicitation from 1c:5f:2b:aa:fd:4e"
"21","3.217090","10.10.10.87","224.0.0.251","MDNS","333","Standard query 0x0000 ANY a.0.5.6.c.a.e.f.f.f.1.6.7.8.c.7.0.0.0.0.0.0.0.0.0.0.0.0.0.8.e.f.ip6.arpa, ""QM"" question ANY dchgFD4E.local, ""QM"" question ANY 87.10.10.10.in-addr.arpa, ""QM"" question ANY dchg.local, ""QM"" question A 10.10.10.87 PTR dchgFD4E.local A 10.10.10.87 PTR dchg.local AAAA fe80::7c87:61ff:feac:650a PTR dchgFD4E.local AAAA fe80::7c87:61ff:feac:650a PTR dchg.local"
"22","3.440840","10.10.10.87","224.0.0.251","MDNS","309","Standard query response 0x0000 PTR, cache flush dchg.local A, cache flush 10.10.10.87 PTR, cache flush dchgFD4E.local A, cache flush 10.10.10.87 PTR, cache flush dchg.local AAAA, cache flush fe80::7c87:61ff:feac:650a PTR, cache flush dchgFD4E.local AAAA, cache flush fe80::7c87:61ff:feac:650a"
"23","3.584113","fe80::7c87:61ff:feac:650a","ff02::16","ICMPv6","90","Multicast Listener Report Message v2"
"24","3.592147","10.10.10.87","224.0.0.22","IGMPv3","62","Membership Report / Join group 224.0.0.252 for any sources / Join group 224.0.0.251 for any sources"
"25","3.671549","10.10.10.87","224.0.0.251","MDNS","77","Standard query 0x0000 PTR _dhnap._tcp.local, ""QM"" question"
"26","3.760465","10.10.10.87","224.0.0.251","MDNS","299","Standard query 0x0000 ANY D-Link HNAP Service._dhnap._tcp.local, ""QM"" question SRV 0 0 80 dchg.local TXT"
"27","3.788673","10.10.10.87","224.0.0.251","MDNS","105","Standard query response 0x0000 PTR D-Link HNAP Service._dhnap._tcp.local"
"28","3.789732","10.10.10.87","224.0.0.251","MDNS","97","Standard query 0x0000 PTR D-Link HNAP Service._dhnap._tcp.local, ""QM"" question"
"29","3.984676","10.10.10.87","224.0.0.251","MDNS","299","Standard query 0x0000 ANY D-Link HNAP Service._dhnap._tcp.local, ""QM"" question SRV 0 0 80 dchg.local TXT"
"30","4.008108","10.10.10.87","10.10.10.1","DNS","74","Standard query 0x0002 AAAA wrpd.dlink.com"
"31","4.012014","10.10.10.1","10.10.10.87","DNS","395","Standard query response 0x0002 AAAA wrpd.dlink.com CNAME dualstack.ipv6-1927743757.us-west-2.elb.amazonaws.com AAAA 2620:108:700f::36f4:e8b7 AAAA 2620:108:700f::3270:7f24 NS ns-560.awsdns-06.net NS ns-1769.awsdns-29.co.uk NS ns-332.awsdns-41.com NS ns-1475.awsdns-56.org A 205.251.193.76 A 205.251.194.48 A 205.251.197.195 A 205.251.198.233"
"32","4.016505","10.10.10.87","10.10.10.1","DNS","113","Standard query 0x0003 AAAA dualstack.ipv6-1927743757.us-west-2.elb.amazonaws.com"
"33","4.016599","10.10.10.1","10.10.10.87","DNS","169","Standard query response 0x0003 AAAA dualstack.ipv6-1927743757.us-west-2.elb.amazonaws.com AAAA 2620:108:700f::3270:7f24 AAAA 2620:108:700f::36f4:e8b7"
"34","4.085529","10.10.10.87","10.10.10.1","DNS","74","Standard query 0x0004 A wrpd.dlink.com"
"35","4.089139","10.10.10.1","10.10.10.87","DNS","371","Standard query response 0x0004 A wrpd.dlink.com CNAME dualstack.ipv6-1927743757.us-west-2.elb.amazonaws.com A 50.112.127.36 A 54.244.232.183 NS ns-1769.awsdns-29.co.uk NS ns-1475.awsdns-56.org NS ns-332.awsdns-41.com NS ns-560.awsdns-06.net A 205.251.193.76 A 205.251.194.48 A 205.251.197.195 A 205.251.198.233"
"36","4.090024","10.10.10.87","50.112.127.36","TCP","74","60427  >  80 [SYN] Seq=0 Win=5840 Len=0 MSS=1460 SACK_PERM=1 TSval=4294896887 TSecr=0 WS=2"
"37","4.252716","10.10.10.87","224.0.0.251","MDNS","299","Standard query 0x0000 ANY D-Link HNAP Service._dhnap._tcp.local, ""QM"" question SRV 0 0 80 dchg.local TXT"
"38","4.255231","50.112.127.36","10.10.10.87","TCP","74","80  >  60427 [SYN, ACK] Seq=0 Ack=1 Win=14480 Len=0 MSS=1380 SACK_PERM=1 TSval=419432582 TSecr=4294896887 WS=256"
"39","4.255712","10.10.10.87","50.112.127.36","TCP","66","60427  >  80 [ACK] Seq=1 Ack=1 Win=5840 Len=0 TSval=4294896928 TSecr=419432582"
"40","4.256373","10.10.10.87","50.112.127.36","HTTP","203","GET /router/firmware/query.aspx?model=DCH-G020_Ax_Default_FW_0122_1C5F2BAAFD4E HTTP/1.1 "
"41","4.421106","50.112.127.36","10.10.10.87","TCP","66","80  >  60427 [ACK] Seq=1 Ack=138 Win=15616 Len=0 TSval=419432624 TSecr=4294896929"
"42","4.422322","50.112.127.36","10.10.10.87","HTTP","267","HTTP/1.1 404 Not Found  (text/plain)"
"43","4.422686","10.10.10.87","50.112.127.36","TCP","66","60427  >  80 [ACK] Seq=138 Ack=202 Win=6912 Len=0 TSval=4294896970 TSecr=419432624"
"44","4.438153","10.10.10.87","224.0.0.251","MDNS","388","Standard query response 0x0000 TXT, cache flush PTR D-Link HNAP Service._dhnap._tcp.local SRV, cache flush 0 0 80 dchg.local AAAA, cache flush fe80::7c87:61ff:feac:650a A, cache flush 10.10.10.87 PTR _dhnap._tcp.local"
"45","4.440380","10.10.10.87","224.0.0.251","MDNS","97","Standard query 0x0000 PTR D-Link HNAP Service._dhnap._tcp.local, ""QM"" question"
"46","4.654804","10.10.10.87","224.0.0.251","MDNS","249","Standard query response 0x0000 PTR, cache flush dchg.local PTR, cache flush dchgFD4E.local PTR, cache flush dchg.local AAAA, cache flush fe80::7c87:61ff:feac:650a PTR, cache flush dchgFD4E.local"
"47","4.655836","10.10.10.87","224.0.0.251","MDNS","84","Standard query response 0x0000 A, cache flush 10.10.10.87"
"48","5.000107","fe80::1e5f:2bff:feaa:fd4e","ff02::2","ICMPv6","70","Router Solicitation from 1c:5f:2b:aa:fd:4e"
"49","5.289761","10.10.10.87","50.112.127.36","TCP","66","60427  >  80 [FIN, ACK] Seq=138 Ack=202 Win=6912 Len=0 TSval=4294897187 TSecr=419432624"
"50","5.454620","50.112.127.36","10.10.10.87","TCP","66","80  >  60427 [FIN, ACK] Seq=202 Ack=139 Win=15616 Len=0 TSval=419432882 TSecr=4294897187"
"51","5.455028","10.10.10.87","50.112.127.36","TCP","66","60427  >  80 [ACK] Seq=139 Ack=203 Win=6912 Len=0 TSval=4294897228 TSecr=419432882"
"52","5.673889","10.10.10.87","224.0.0.251","MDNS","388","Standard query response 0x0000 TXT, cache flush PTR D-Link HNAP Service._dhnap._tcp.local SRV, cache flush 0 0 80 dchg.local AAAA, cache flush fe80::7c87:61ff:feac:650a A, cache flush 10.10.10.87 PTR _dhnap._tcp.local"
"53","5.676404","10.10.10.87","224.0.0.251","MDNS","97","Standard query 0x0000 PTR D-Link HNAP Service._dhnap._tcp.local, ""QM"" question"
"54","5.800088","fe80::1e5f:2bff:feaa:fd4e","ff02::16","ICMPv6","90","Multicast Listener Report Message v2"
"55","6.432131","10.10.10.87","224.0.0.22","IGMPv3","60","Membership Report / Join group 224.0.0.252 for any sources"
"56","6.890507","10.10.10.87","224.0.0.251","MDNS","293","Standard query response 0x0000 PTR, cache flush dchg.local A, cache flush 10.10.10.87 PTR, cache flush dchgFD4E.local PTR, cache flush dchg.local AAAA, cache flush fe80::7c87:61ff:feac:650a AAAA, cache flush fe80::7c87:61ff:feac:650a PTR, cache flush dchgFD4E.local"
"57","6.891381","10.10.10.87","224.0.0.251","MDNS","84","Standard query response 0x0000 A, cache flush 10.10.10.87"
"58","7.696401","SamsungE_ef:85:41","D-LinkIn_aa:fd:4e","ARP","42","Who has 10.10.10.87? Tell 10.10.10.30"
"59","7.696630","D-LinkIn_aa:fd:4e","SamsungE_ef:85:41","ARP","60","10.10.10.87 is at 1c:5f:2b:aa:fd:4e"
"60","7.822989","10.10.10.87","239.255.255.250","SSDP","268","NOTIFY * HTTP/1.1 "
"61","7.823678","10.10.10.87","239.255.255.250","SSDP","268","NOTIFY * HTTP/1.1 "
"62","7.824157","10.10.10.87","239.255.255.250","SSDP","277","NOTIFY * HTTP/1.1 "
"63","7.828176","10.10.10.87","224.0.0.22","IGMPv3","60","Membership Report / Join group 239.255.255.250 for any sources"
"64","7.833456","10.10.10.87","239.255.255.250","SSDP","277","NOTIFY * HTTP/1.1 "
"65","7.836595","10.10.10.87","239.255.255.250","SSDP","332","NOTIFY * HTTP/1.1 "
"66","7.840587","10.10.10.87","239.255.255.250","SSDP","332","NOTIFY * HTTP/1.1 "
"67","7.844551","10.10.10.87","239.255.255.250","SSDP","342","NOTIFY * HTTP/1.1 "
"68","7.848627","10.10.10.87","239.255.255.250","SSDP","342","NOTIFY * HTTP/1.1 "
"69","7.852483","10.10.10.87","239.255.255.250","SSDP","318","NOTIFY * HTTP/1.1 "
"70","7.856506","10.10.10.87","239.255.255.250","SSDP","318","NOTIFY * HTTP/1.1 "
"71","7.860587","10.10.10.87","239.255.255.250","SSDP","327","NOTIFY * HTTP/1.1 "
"72","7.861218","10.10.10.87","239.255.255.250","SSDP","327","NOTIFY * HTTP/1.1 "
"73","7.864588","10.10.10.87","239.255.255.250","SSDP","382","NOTIFY * HTTP/1.1 "
"74","7.868598","10.10.10.87","239.255.255.250","SSDP","382","NOTIFY * HTTP/1.1 "
"75","7.872620","10.10.10.87","239.255.255.250","SSDP","392","NOTIFY * HTTP/1.1 "
"76","7.876614","10.10.10.87","239.255.255.250","SSDP","392","NOTIFY * HTTP/1.1 "
"77","7.909933","10.10.10.87","224.0.0.251","MDNS","388","Standard query response 0x0000 TXT, cache flush PTR D-Link HNAP Service._dhnap._tcp.local SRV, cache flush 0 0 80 dchg.local AAAA, cache flush fe80::7c87:61ff:feac:650a A, cache flush 10.10.10.87 PTR _dhnap._tcp.local"
"78","7.912466","10.10.10.87","224.0.0.251","MDNS","97","Standard query 0x0000 PTR D-Link HNAP Service._dhnap._tcp.local, ""QM"" question"
"79","9.000423","fe80::1e5f:2bff:feaa:fd4e","ff02::2","ICMPv6","70","Router Solicitation from 1c:5f:2b:aa:fd:4e"
"80","9.012740","DavidEle_06:08:ba","D-LinkIn_aa:fd:4e","ARP","42","Who has 10.10.10.87? Tell 10.10.10.1"
"81","9.013403","D-LinkIn_aa:fd:4e","DavidEle_06:08:ba","ARP","60","10.10.10.87 is at 1c:5f:2b:aa:fd:4e"
"82","13.364244","fe80::7c87:61ff:feac:650a","ff02::16","ICMPv6","90","Multicast Listener Report Message v2"
"83","15.940208","10.10.10.87","224.0.0.22","IGMPv3","60","Membership Report / Join group 239.255.255.250 for any sources"
"84","48.271672","10.10.10.87","10.10.10.1","DNS","74","Standard query 0x0002 A ntp1.dlink.com"
"85","48.271769","10.10.10.1","10.10.10.87","DNS","106","Standard query response 0x0002 A ntp1.dlink.com A 54.86.11.193 A 54.186.215.173"
"86","48.273222","10.10.10.87","54.86.11.193","NTP","90","NTP Version 3, client"
"87","48.372709","54.86.11.193","10.10.10.87","NTP","90","NTP Version 3, server"
"88","53.268567","D-LinkIn_aa:fd:4e","DavidEle_06:08:ba","ARP","60","Who has 10.10.10.1? Tell 10.10.10.87"
"89","53.268594","DavidEle_06:08:ba","D-LinkIn_aa:fd:4e","ARP","42","10.10.10.1 is at 00:b5:6d:06:08:ba"
"90","70.375892","10.10.10.30","10.10.10.87","TCP","74","45525  >  80 [SYN] Seq=0 Win=65535 Len=0 MSS=1460 SACK_PERM=1 TSval=7798464 TSecr=0 WS=128"
"91","70.376753","D-LinkIn_aa:fd:4e","Broadcast","ARP","60","Who has 10.10.10.30? Tell 10.10.10.87"
"92","70.378551","SamsungE_ef:85:41","D-LinkIn_aa:fd:4e","ARP","42","10.10.10.30 is at 38:0b:40:ef:85:41"
"93","70.378891","10.10.10.87","10.10.10.30","TCP","74","80  >  45525 [SYN, ACK] Seq=0 Ack=1 Win=5792 Len=0 MSS=1460 SACK_PERM=1 TSval=4294913458 TSecr=7798464 WS=2"
"94","70.381388","10.10.10.30","10.10.10.87","TCP","66","45525  >  80 [ACK] Seq=1 Ack=1 Win=87680 Len=0 TSval=7798466 TSecr=4294913458"
"95","70.382367","10.10.10.30","10.10.10.87","HTTP/XML","759","POST /HNAP1/ HTTP/1.1 "
"96","70.382766","10.10.10.87","10.10.10.30","TCP","66","80  >  45525 [ACK] Seq=1 Ack=694 Win=7178 Len=0 TSval=4294913460 TSecr=7798467"
"97","70.792174","10.10.10.87","10.10.10.30","HTTP/XML","689","HTTP/1.1 200 OK "
"98","70.835718","10.10.10.30","10.10.10.87","TCP","66","45525  >  80 [ACK] Seq=694 Ack=624 Win=88960 Len=0 TSval=7798557 TSecr=4294913562"
"99","70.883894","10.10.10.30","10.10.10.87","HTTP/XML","869","POST /HNAP1/ HTTP/1.1 "
"100","70.884357","10.10.10.87","10.10.10.30","TCP","66","80  >  45525 [ACK] Seq=624 Ack=1497 Win=8784 Len=0 TSval=4294913585 TSecr=7798567"
"101","71.107111","10.10.10.87","10.10.10.30","HTTP/XML","581","HTTP/1.1 200 OK "
"102","71.165941","10.10.10.30","10.10.10.87","TCP","66","45525  >  80 [ACK] Seq=1497 Ack=1139 Win=90112 Len=0 TSval=7798619 TSecr=4294913641"
"103","82.149243","10.10.10.87","10.10.10.30","TCP","66","80  >  45525 [FIN, ACK] Seq=1139 Ack=1497 Win=8784 Len=0 TSval=4294916402 TSecr=7798619"
"104","82.238072","10.10.10.30","10.10.10.87","TCP","66","45525  >  80 [ACK] Seq=1497 Ack=1140 Win=90112 Len=0 TSval=7800838 TSecr=4294916402"
"105","89.190945","10.10.10.30","10.10.10.87","TCP","66","45525  >  80 [FIN, ACK] Seq=1497 Ack=1140 Win=90112 Len=0 TSval=7802227 TSecr=4294916402"
"106","89.191301","10.10.10.87","10.10.10.30","TCP","66","80  >  45525 [ACK] Seq=1140 Ack=1498 Win=8784 Len=0 TSval=4294918162 TSecr=7802227"
"107","89.192127","10.10.10.30","10.10.10.87","TCP","74","43661  >  80 [SYN] Seq=0 Win=65535 Len=0 MSS=1460 SACK_PERM=1 TSval=7802227 TSecr=0 WS=128"
"108","89.192548","10.10.10.87","10.10.10.30","TCP","74","80  >  43661 [SYN, ACK] Seq=0 Ack=1 Win=5792 Len=0 MSS=1460 SACK_PERM=1 TSval=4294918162 TSecr=7802227 WS=2"
"109","89.196838","10.10.10.30","10.10.10.87","TCP","66","43661  >  80 [ACK] Seq=1 Ack=1 Win=87680 Len=0 TSval=7802229 TSecr=4294918162"
"110","89.198812","10.10.10.30","10.10.10.87","HTTP/XML","757","POST /HNAP1/ HTTP/1.1 "
"111","89.199310","10.10.10.87","10.10.10.30","TCP","66","80  >  43661 [ACK] Seq=1 Ack=692 Win=7174 Len=0 TSval=4294918164 TSecr=7802230"
"112","89.474729","10.10.10.87","10.10.10.30","TCP","1514","80  >  43661 [ACK] Seq=1 Ack=692 Win=7174 Len=1448 TSval=4294918233 TSecr=7802230 [TCP segment of a reassembled PDU]"
"113","89.474782","10.10.10.87","10.10.10.30","TCP","1514","80  >  43661 [ACK] Seq=1449 Ack=692 Win=7174 Len=1448 TSval=4294918233 TSecr=7802230 [TCP segment of a reassembled PDU]"
"114","89.474857","10.10.10.87","10.10.10.30","HTTP/XML","838","HTTP/1.1 200 OK "
"115","89.595439","10.10.10.30","10.10.10.87","TCP","66","43661  >  80 [ACK] Seq=692 Ack=1449 Win=90496 Len=0 TSval=7802306 TSecr=4294918233"
"116","89.595501","10.10.10.30","10.10.10.87","TCP","66","43661  >  80 [ACK] Seq=692 Ack=2897 Win=93440 Len=0 TSval=7802308 TSecr=4294918233"
"117","89.596914","10.10.10.30","10.10.10.87","TCP","66","43661  >  80 [ACK] Seq=692 Ack=3669 Win=96384 Len=0 TSval=7802309 TSecr=4294918233"
"118","89.623741","10.10.10.30","10.10.10.87","HTTP/XML","957","POST /HNAP1/ HTTP/1.1 "
"119","89.624237","10.10.10.87","10.10.10.30","TCP","66","80  >  43661 [ACK] Seq=3669 Ack=1583 Win=8956 Len=0 TSval=4294918270 TSecr=7802315"
"120","89.952757","10.10.10.87","224.0.0.251","MDNS","388","Standard query response 0x0000 PTR _dhnap._tcp.local PTR D-Link HNAP Service._dhnap._tcp.local SRV, cache flush 0 0 80 dchg.local AAAA, cache flush fe80::7c87:61ff:feac:650a A, cache flush 10.10.10.87 TXT, cache flush"
"121","89.953562","10.10.10.87","224.0.0.251","MDNS","97","Standard query 0x0000 PTR D-Link HNAP Service._dhnap._tcp.local, ""QM"" question"
"122","90.040688","10.10.10.87","224.0.0.251","MDNS","309","Standard query response 0x0000 AAAA, cache flush fe80::7c87:61ff:feac:650a PTR, cache flush dchg.local AAAA, cache flush fe80::7c87:61ff:feac:650a PTR, cache flush dchgFD4E.local A, cache flush 10.10.10.87 PTR, cache flush dchg.local A, cache flush 10.10.10.87 PTR, cache flush dchgFD4E.local"
"123","90.066323","10.10.10.87","10.10.10.30","HTTP/XML","624","HTTP/1.1 200 OK "
"124","90.123015","10.10.10.30","10.10.10.87","TCP","66","43661  >  80 [ACK] Seq=1583 Ack=4227 Win=99200 Len=0 TSval=7802415 TSecr=4294918381"
"125","90.132433","10.10.10.30","10.10.10.87","HTTP/XML","936","POST /HNAP1/ HTTP/1.1 "
"126","90.132878","10.10.10.87","10.10.10.30","TCP","66","80  >  43661 [ACK] Seq=4227 Ack=2453 Win=10738 Len=0 TSval=4294918397 TSecr=7802416"
"127","90.548011","10.10.10.87","10.10.10.30","HTTP/XML","628","HTTP/1.1 200 OK "
"128","90.597232","10.10.10.30","10.10.10.87","TCP","66","43661  >  80 [ACK] Seq=2453 Ack=4789 Win=102144 Len=0 TSval=7802509 TSecr=4294918501"
"129","90.636443","10.10.10.30","10.10.10.87","HTTP/XML","749","POST /HNAP1/ HTTP/1.1 "
"130","90.636986","10.10.10.87","10.10.10.30","TCP","66","80  >  43661 [ACK] Seq=4789 Ack=3136 Win=12520 Len=0 TSval=4294918524 TSecr=7802517"
"131","90.860663","10.10.10.87","10.10.10.1","DNS","77","Standard query 0x0002 A api.dch.dlink.com"
"132","90.864684","10.10.10.1","10.10.10.87","DNS","373","Standard query response 0x0002 A api.dch.dlink.com CNAME eu-api-elb-1068129369.eu-central-1.elb.amazonaws.com A 52.28.38.154 A 52.29.29.242 NS ns-1689.awsdns-19.co.uk NS ns-613.awsdns-12.net NS ns-417.awsdns-52.com NS ns-1326.awsdns-37.org A 205.251.193.161 A 205.251.194.101 A 205.251.197.46 A 205.251.198.153"
"133","90.865665","10.10.10.87","52.28.38.154","TCP","74","34013  >  443 [SYN] Seq=0 Win=5840 Len=0 MSS=1460 SACK_PERM=1 TSval=4294918581 TSecr=0 WS=2"
"134","90.867896","52.28.38.154","10.10.10.87","TCP","74","443  >  34013 [SYN, ACK] Seq=0 Ack=1 Win=17898 Len=0 MSS=1380 SACK_PERM=1 TSval=630261861 TSecr=4294918581 WS=256"
"135","90.868286","10.10.10.87","52.28.38.154","TCP","66","34013  >  443 [ACK] Seq=1 Ack=1 Win=5840 Len=0 TSval=4294918581 TSecr=630261861"
"136","90.921339","10.10.10.87","52.28.38.154","TLSv1","273","Client Hello"
"137","90.923608","52.28.38.154","10.10.10.87","TCP","66","443  >  34013 [ACK] Seq=1 Ack=208 Win=19200 Len=0 TSval=630261874 TSecr=4294918595"
"138","90.925514","52.28.38.154","10.10.10.87","TLSv1","1434","Server Hello"
"139","90.925533","52.28.38.154","10.10.10.87","TCP","1434","443  >  34013 [ACK] Seq=1369 Ack=208 Win=19200 Len=1368 TSval=630261875 TSecr=4294918595 [TCP segment of a reassembled PDU]"
"140","90.925535","52.28.38.154","10.10.10.87","TLSv1","1147","Certificate, Server Key Exchange, Server Hello Done"
"141","90.926060","10.10.10.87","52.28.38.154","TCP","66","34013  >  443 [ACK] Seq=208 Ack=1369 Win=8576 Len=0 TSval=4294918596 TSecr=630261875"
"142","90.926091","10.10.10.87","52.28.38.154","TCP","66","34013  >  443 [ACK] Seq=208 Ack=3818 Win=14048 Len=0 TSval=4294918596 TSecr=630261875"
"143","90.926062","10.10.10.87","52.28.38.154","TCP","66","34013  >  443 [ACK] Seq=208 Ack=2737 Win=11312 Len=0 TSval=4294918596 TSecr=630261875"
"144","91.118756","10.10.10.87","52.28.38.154","TLSv1","200","Client Key Exchange, Change Cipher Spec, Encrypted Handshake Message"
"145","91.121794","52.28.38.154","10.10.10.87","TLSv1","300","New Session Ticket, Change Cipher Spec, Encrypted Handshake Message"
"146","91.122312","10.10.10.87","52.28.38.154","TCP","66","34013  >  443 [ACK] Seq=342 Ack=4052 Win=14048 Len=0 TSval=4294918645 TSecr=630261924"
"147","91.176729","10.10.10.87","52.28.38.154","TLSv1","572","Application Data, Application Data"
"148","91.215573","52.28.38.154","10.10.10.87","TCP","66","443  >  34013 [ACK] Seq=4052 Ack=848 Win=21248 Len=0 TSval=630261948 TSecr=4294918658"
"149","91.358281","52.28.38.154","10.10.10.87","TLSv1","615","Application Data"
"150","91.358306","52.28.38.154","10.10.10.87","TLSv1","103","Encrypted Alert"
"151","91.358794","10.10.10.87","52.28.38.154","TCP","66","34013  >  443 [ACK] Seq=848 Ack=4601 Win=16784 Len=0 TSval=4294918704 TSecr=630261983"
"152","91.358795","10.10.10.87","52.28.38.154","TCP","66","34013  >  443 [ACK] Seq=848 Ack=4638 Win=16784 Len=0 TSval=4294918704 TSecr=630261983"
"153","91.371483","10.10.10.87","52.28.38.154","TCP","66","34013  >  443 [RST, ACK] Seq=848 Ack=4638 Win=16784 Len=0 TSval=4294918707 TSecr=630261983"
"154","91.678477","10.10.10.87","224.0.0.251","MDNS","333","Standard query 0x0000 ANY a.0.5.6.c.a.e.f.f.f.1.6.7.8.c.7.0.0.0.0.0.0.0.0.0.0.0.0.0.8.e.f.ip6.arpa, ""QM"" question ANY dchgFD4E.local, ""QM"" question ANY 87.10.10.10.in-addr.arpa, ""QM"" question ANY dchg.local, ""QM"" question A 10.10.10.87 PTR dchgFD4E.local A 10.10.10.87 PTR dchg.local AAAA fe80::7c87:61ff:feac:650a PTR dchgFD4E.local AAAA fe80::7c87:61ff:feac:650a PTR dchg.local"
"155","91.930190","10.10.10.87","224.0.0.251","MDNS","333","Standard query 0x0000 ANY a.0.5.6.c.a.e.f.f.f.1.6.7.8.c.7.0.0.0.0.0.0.0.0.0.0.0.0.0.8.e.f.ip6.arpa, ""QM"" question ANY dchgFD4E.local, ""QM"" question ANY 87.10.10.10.in-addr.arpa, ""QM"" question ANY dchg.local, ""QM"" question A 10.10.10.87 PTR dchgFD4E.local A 10.10.10.87 PTR dchg.local AAAA fe80::7c87:61ff:feac:650a PTR dchgFD4E.local AAAA fe80::7c87:61ff:feac:650a PTR dchg.local"
"156","91.966234","10.10.10.87","52.28.38.154","TCP","74","34015  >  443 [SYN] Seq=0 Win=5840 Len=0 MSS=1460 SACK_PERM=1 TSval=4294918856 TSecr=0 WS=2"
"157","91.969027","52.28.38.154","10.10.10.87","TCP","74","443  >  34015 [SYN, ACK] Seq=0 Ack=1 Win=17898 Len=0 MSS=1380 SACK_PERM=1 TSval=630262136 TSecr=4294918856 WS=256"
"158","91.969459","10.10.10.87","52.28.38.154","TCP","66","34015  >  443 [ACK] Seq=1 Ack=1 Win=5840 Len=0 TSval=4294918857 TSecr=630262136"
"159","92.021337","10.10.10.87","52.28.38.154","TLSv1","273","Client Hello"
"160","92.023732","52.28.38.154","10.10.10.87","TCP","66","443  >  34015 [ACK] Seq=1 Ack=208 Win=19200 Len=0 TSval=630262150 TSecr=4294918870"
"161","92.025679","52.28.38.154","10.10.10.87","TLSv1","1434","Server Hello"
"162","92.025699","52.28.38.154","10.10.10.87","TCP","1434","443  >  34015 [ACK] Seq=1369 Ack=208 Win=19200 Len=1368 TSval=630262150 TSecr=4294918870 [TCP segment of a reassembled PDU]"
"163","92.025701","52.28.38.154","10.10.10.87","TLSv1","1147","Certificate, Server Key Exchange, Server Hello Done"
"164","92.026231","10.10.10.87","52.28.38.154","TCP","66","34015  >  443 [ACK] Seq=208 Ack=1369 Win=8576 Len=0 TSval=4294918871 TSecr=630262150"
"165","92.026241","10.10.10.87","52.28.38.154","TCP","66","34015  >  443 [ACK] Seq=208 Ack=3818 Win=14048 Len=0 TSval=4294918871 TSecr=630262150"
"166","92.026232","10.10.10.87","52.28.38.154","TCP","66","34015  >  443 [ACK] Seq=208 Ack=2737 Win=11312 Len=0 TSval=4294918871 TSecr=630262150"
"167","92.182090","10.10.10.87","224.0.0.251","MDNS","333","Standard query 0x0000 ANY a.0.5.6.c.a.e.f.f.f.1.6.7.8.c.7.0.0.0.0.0.0.0.0.0.0.0.0.0.8.e.f.ip6.arpa, ""QM"" question ANY dchgFD4E.local, ""QM"" question ANY 87.10.10.10.in-addr.arpa, ""QM"" question ANY dchg.local, ""QM"" question A 10.10.10.87 PTR dchgFD4E.local A 10.10.10.87 PTR dchg.local AAAA fe80::7c87:61ff:feac:650a PTR dchgFD4E.local AAAA fe80::7c87:61ff:feac:650a PTR dchg.local"
"168","92.210818","10.10.10.87","52.28.38.154","TLSv1","200","Client Key Exchange, Change Cipher Spec, Encrypted Handshake Message"
"169","92.214169","52.28.38.154","10.10.10.87","TLSv1","300","New Session Ticket, Change Cipher Spec, Encrypted Handshake Message"
"170","92.214665","10.10.10.87","52.28.38.154","TCP","66","34015  >  443 [ACK] Seq=342 Ack=4052 Win=14048 Len=0 TSval=4294918918 TSecr=630262197"
"171","92.268221","10.10.10.87","52.28.38.154","TLSv1","588","Application Data, Application Data"
"172","92.307971","52.28.38.154","10.10.10.87","TCP","66","443  >  34015 [ACK] Seq=4052 Ack=864 Win=21248 Len=0 TSval=630262221 TSecr=4294918931"
"173","92.308495","10.10.10.87","52.28.38.154","TLSv1","780","Application Data, Application Data"
"174","92.310976","52.28.38.154","10.10.10.87","TCP","66","443  >  34015 [ACK] Seq=4052 Ack=1578 Win=22784 Len=0 TSval=630262221 TSecr=4294918941"
"175","92.373583","10.10.10.87","52.28.38.154","TCP","74","34016  >  443 [SYN] Seq=0 Win=5840 Len=0 MSS=1460 SACK_PERM=1 TSval=4294918958 TSecr=0 WS=2"
"176","92.376211","52.28.38.154","10.10.10.87","TCP","74","443  >  34016 [SYN, ACK] Seq=0 Ack=1 Win=17898 Len=0 MSS=1380 SACK_PERM=1 TSval=630262238 TSecr=4294918958 WS=256"
"177","92.376619","10.10.10.87","52.28.38.154","TCP","66","34016  >  443 [ACK] Seq=1 Ack=1 Win=5840 Len=0 TSval=4294918958 TSecr=630262238"
"178","92.382427","10.10.10.87","224.0.0.251","MDNS","178","Standard query response 0x0000 PTR, cache flush dchg.local AAAA, cache flush fe80::7c87:61ff:feac:650a"
"179","92.387733","10.10.10.87","224.0.0.251","MDNS","267","Standard query response 0x0000 PTR, cache flush dchgFD4E.local A, cache flush 10.10.10.87 PTR, cache flush dchgFD4E.local A, cache flush 10.10.10.87 PTR, cache flush dchg.local AAAA, cache flush fe80::7c87:61ff:feac:650a"
"180","92.425536","10.10.10.87","52.28.38.154","TLSv1","273","Client Hello"
"181","92.428070","52.28.38.154","10.10.10.87","TCP","66","443  >  34016 [ACK] Seq=1 Ack=208 Win=19200 Len=0 TSval=630262251 TSecr=4294918971"
"182","92.429976","52.28.38.154","10.10.10.87","TLSv1","1434","Server Hello"
"183","92.429995","52.28.38.154","10.10.10.87","TCP","1434","443  >  34016 [ACK] Seq=1369 Ack=208 Win=19200 Len=1368 TSval=630262251 TSecr=4294918971 [TCP segment of a reassembled PDU]"
"184","92.429998","52.28.38.154","10.10.10.87","TLSv1","1147","Certificate, Server Key Exchange, Server Hello Done"
"185","92.430537","10.10.10.87","52.28.38.154","TCP","66","34016  >  443 [ACK] Seq=208 Ack=1369 Win=8576 Len=0 TSval=4294918972 TSecr=630262251"
"186","92.430538","10.10.10.87","52.28.38.154","TCP","66","34016  >  443 [ACK] Seq=208 Ack=2737 Win=11312 Len=0 TSval=4294918972 TSecr=630262251"
"187","92.430539","10.10.10.87","52.28.38.154","TCP","66","34016  >  443 [ACK] Seq=208 Ack=3818 Win=14048 Len=0 TSval=4294918972 TSecr=630262251"
"188","92.452085","10.10.10.87","10.10.10.1","DNS","74","Standard query 0x0002 A ntp1.dlink.com"
"189","92.452180","10.10.10.1","10.10.10.87","DNS","106","Standard query response 0x0002 A ntp1.dlink.com A 54.186.215.173 A 54.86.11.193"
"190","92.453708","10.10.10.87","54.186.215.173","NTP","90","NTP Version 3, client"
"191","92.502343","52.28.38.154","10.10.10.87","TLSv1","663","Application Data"
"192","92.502767","10.10.10.87","52.28.38.154","TCP","66","34015  >  443 [ACK] Seq=1578 Ack=4649 Win=16784 Len=0 TSval=4294918990 TSecr=630262269"
"193","92.582419","10.10.10.87","52.28.38.154","TLSv1","200","Client Key Exchange, Change Cipher Spec, Encrypted Handshake Message"
"194","92.585654","52.28.38.154","10.10.10.87","TLSv1","300","New Session Ticket, Change Cipher Spec, Encrypted Handshake Message"
"195","92.586088","10.10.10.87","52.28.38.154","TCP","66","34016  >  443 [ACK] Seq=342 Ack=4052 Win=14048 Len=0 TSval=4294919011 TSecr=630262290"
"196","92.622556","54.186.215.173","10.10.10.87","NTP","90","NTP Version 3, server"
"197","92.636425","10.10.10.87","52.28.38.154","TLSv1","460","Application Data, Application Data"
"198","92.639212","10.10.10.87","52.28.38.154","TCP","66","34015  >  443 [FIN, ACK] Seq=1578 Ack=4649 Win=16784 Len=0 TSval=4294919024 TSecr=630262269"
"199","92.641598","52.28.38.154","10.10.10.87","TLSv1","103","Encrypted Alert"
"200","92.641627","52.28.38.154","10.10.10.87","TCP","66","443  >  34015 [FIN, ACK] Seq=4686 Ack=1579 Win=22784 Len=0 TSval=630262304 TSecr=4294919024"
"201","92.642068","10.10.10.87","52.28.38.154","TCP","60","34015  >  443 [RST] Seq=1579 Win=0 Len=0"
"202","92.642069","10.10.10.87","52.28.38.154","TCP","60","34015  >  443 [RST] Seq=1579 Win=0 Len=0"
"203","92.645172","10.10.10.87","10.10.10.30","HTTP/XML","878","HTTP/1.1 200 OK "
"204","92.675813","52.28.38.154","10.10.10.87","TCP","66","443  >  34016 [ACK] Seq=4052 Ack=736 Win=21248 Len=0 TSval=630262313 TSecr=4294919023"
"205","92.705615","10.10.10.87","224.0.0.251","MDNS","299","Standard query 0x0000 ANY D-Link HNAP Service._dhnap._tcp.local, ""QM"" question SRV 0 0 80 dchg.local TXT"
"206","92.745128","10.10.10.30","10.10.10.87","TCP","66","43661  >  80 [ACK] Seq=3136 Ack=5601 Win=105088 Len=0 TSval=7802939 TSecr=4294919025"
"207","92.957613","10.10.10.87","224.0.0.251","MDNS","299","Standard query 0x0000 ANY D-Link HNAP Service._dhnap._tcp.local, ""QM"" question SRV 0 0 80 dchg.local TXT"
"208","93.209757","10.10.10.87","224.0.0.251","MDNS","299","Standard query 0x0000 ANY D-Link HNAP Service._dhnap._tcp.local, ""QM"" question SRV 0 0 80 dchg.local TXT"
"209","93.266315","10.10.10.87","10.10.10.1","DNS","80","Standard query 0x0002 A tzinfo.dch.dlink.com"
"210","93.270403","10.10.10.1","10.10.10.87","DNS","368","Standard query response 0x0002 A tzinfo.dch.dlink.com CNAME tzinfo-423124427.us-west-2.elb.amazonaws.com A 52.25.174.177 A 52.26.98.232 NS ns-1769.awsdns-29.co.uk NS ns-560.awsdns-06.net NS ns-332.awsdns-41.com NS ns-1475.awsdns-56.org A 205.251.193.76 A 205.251.194.48 A 205.251.197.195 A 205.251.198.233"
"211","93.271511","10.10.10.87","52.25.174.177","TCP","74","60105  >  80 [SYN] Seq=0 Win=5840 Len=0 MSS=1460 SACK_PERM=1 TSval=4294919182 TSecr=0 WS=2"
"212","93.299501","10.10.10.30","10.10.10.87","HTTP/XML","907","POST /HNAP1/ HTTP/1.1 "
"213","93.300006","10.10.10.87","10.10.10.30","TCP","66","80  >  43661 [ACK] Seq=5601 Ack=3977 Win=14302 Len=0 TSval=4294919189 TSecr=7803050"
"214","93.309992","52.28.38.154","10.10.10.87","TLSv1","471","Application Data"
"215","93.310016","52.28.38.154","10.10.10.87","TLSv1","103","Encrypted Alert"
"216","93.310462","10.10.10.87","52.28.38.154","TCP","66","34016  >  443 [ACK] Seq=736 Ack=4457 Win=16784 Len=0 TSval=4294919192 TSecr=630262471"
"217","93.310462","10.10.10.87","52.28.38.154","TCP","66","34016  >  443 [ACK] Seq=736 Ack=4494 Win=16784 Len=0 TSval=4294919192 TSecr=630262471"
"218","93.315410","10.10.10.87","10.10.10.1","DNS","79","Standard query 0x0003 A r0801.dch.dlink.com"
"219","93.315512","10.10.10.1","10.10.10.87","DNS","95","Standard query response 0x0003 A r0801.dch.dlink.com A 52.28.161.134"
"220","93.317754","10.10.10.87","52.28.161.134","TCP","74","33737  >  443 [SYN] Seq=0 Win=5840 Len=0 MSS=1460 SACK_PERM=1 TSval=4294919194 TSecr=0 WS=2"
"221","93.322305","52.28.161.134","10.10.10.87","TCP","66","443  >  33737 [SYN, ACK] Seq=0 Ack=1 Win=2048 Len=0 MSS=1380 SACK_PERM=1 WS=8"
"222","93.322756","10.10.10.87","52.28.161.134","TCP","60","33737  >  443 [ACK] Seq=1 Ack=1 Win=5840 Len=0"
"223","93.369315","10.10.10.87","52.28.161.134","TLSv1","261","Client Hello"
"224","93.371566","52.28.161.134","10.10.10.87","TCP","54","443  >  33737 [ACK] Seq=1 Ack=208 Win=3120 Len=0"
"225","93.371590","52.28.161.134","10.10.10.87","TLSv1","112","Server Hello"
"226","93.371938","52.28.161.134","10.10.10.87","TCP","1434","443  >  33737 [ACK] Seq=59 Ack=208 Win=3120 Len=1380 [TCP segment of a reassembled PDU]"
"227","93.371933","10.10.10.87","52.28.161.134","TCP","60","33737  >  443 [ACK] Seq=208 Ack=59 Win=5840 Len=0"
"228","93.371955","52.28.161.134","10.10.10.87","TCP","1434","443  >  33737 [ACK] Seq=1439 Ack=208 Win=3120 Len=1380 [TCP segment of a reassembled PDU]"
"229","93.371958","52.28.161.134","10.10.10.87","TLSv1","700","Certificate"
"230","93.372379","10.10.10.87","52.28.161.134","TCP","60","33737  >  443 [ACK] Seq=208 Ack=1439 Win=8600 Len=0"
"231","93.372396","10.10.10.87","52.28.161.134","TCP","60","33737  >  443 [ACK] Seq=208 Ack=3465 Win=14120 Len=0"
"232","93.372380","10.10.10.87","52.28.161.134","TCP","60","33737  >  443 [ACK] Seq=208 Ack=2819 Win=11360 Len=0"
"233","93.379961","52.28.161.134","10.10.10.87","TLSv1","390","Server Key Exchange"
"234","93.379985","52.28.161.134","10.10.10.87","TLSv1","63","Server Hello Done"
"235","93.380415","10.10.10.87","52.28.161.134","TCP","60","33737  >  443 [ACK] Seq=208 Ack=3801 Win=14120 Len=0"
"236","93.380416","10.10.10.87","52.28.161.134","TCP","60","33737  >  443 [ACK] Seq=208 Ack=3810 Win=14120 Len=0"
"237","93.411041","10.10.10.87","224.0.0.251","MDNS","388","Standard query response 0x0000 TXT, cache flush PTR D-Link HNAP Service._dhnap._tcp.local SRV, cache flush 0 0 80 dchg.local AAAA, cache flush fe80::7c87:61ff:feac:650a A, cache flush 10.10.10.87 PTR _dhnap._tcp.local"
"238","93.413335","10.10.10.87","224.0.0.251","MDNS","97","Standard query 0x0000 PTR D-Link HNAP Service._dhnap._tcp.local, ""QM"" question"
"239","93.439449","52.25.174.177","10.10.10.87","TCP","74","80  >  60105 [SYN, ACK] Seq=0 Ack=1 Win=17898 Len=0 MSS=1380 SACK_PERM=1 TSval=3054504564 TSecr=4294919182 WS=256"
"240","93.439938","10.10.10.87","52.25.174.177","TCP","66","60105  >  80 [ACK] Seq=1 Ack=1 Win=5840 Len=0 TSval=4294919224 TSecr=3054504564"
"241","93.440383","10.10.10.87","52.25.174.177","HTTP","265","GET /dst?timezone=Europe/Berlin&ts=1466080487&hash=7331e9eefad901935a3afc33a7908114 HTTP/1.1 "
"242","93.608325","52.25.174.177","10.10.10.87","TCP","66","80  >  60105 [ACK] Seq=1 Ack=200 Win=19200 Len=0 TSval=3054504607 TSecr=4294919224"
"243","93.618795","52.25.174.177","10.10.10.87","HTTP","271","HTTP/1.1 200 OK  (application/json)"
"244","93.619237","10.10.10.87","52.25.174.177","TCP","66","60105  >  80 [ACK] Seq=200 Ack=206 Win=6912 Len=0 TSval=4294919269 TSecr=3054504609"
"245","93.621740","10.10.10.87","52.25.174.177","TCP","66","60105  >  80 [FIN, ACK] Seq=200 Ack=206 Win=6912 Len=0 TSval=4294919270 TSecr=3054504609"
"246","93.643845","10.10.10.87","52.28.161.134","TLSv1","188","Client Key Exchange, Change Cipher Spec, Encrypted Handshake Message"
"247","93.648067","52.28.161.134","10.10.10.87","TLSv1","173","New Session Ticket"
"248","93.648094","52.28.161.134","10.10.10.87","TLSv1","60","Change Cipher Spec"
"249","93.648099","52.28.161.134","10.10.10.87","TLSv1","107","Encrypted Handshake Message"
"250","93.648512","10.10.10.87","52.28.161.134","TCP","60","33737  >  443 [ACK] Seq=342 Ack=3929 Win=14120 Len=0"
"251","93.648513","10.10.10.87","52.28.161.134","TCP","60","33737  >  443 [ACK] Seq=342 Ack=3935 Win=14120 Len=0"
"252","93.648514","10.10.10.87","52.28.161.134","TCP","60","33737  >  443 [ACK] Seq=342 Ack=3988 Win=14120 Len=0"
"253","93.651723","10.10.10.87","224.0.0.251","MDNS","249","Standard query response 0x0000 PTR, cache flush dchg.local PTR, cache flush dchgFD4E.local PTR, cache flush dchg.local AAAA, cache flush fe80::7c87:61ff:feac:650a PTR, cache flush dchgFD4E.local"
"254","93.652699","10.10.10.87","224.0.0.251","MDNS","84","Standard query response 0x0000 A, cache flush 10.10.10.87"
"255","93.700719","10.10.10.87","52.28.38.154","TCP","66","34016  >  443 [RST, ACK] Seq=736 Ack=4494 Win=16784 Len=0 TSval=4294919289 TSecr=630262471"
"256","93.701720","10.10.10.87","52.28.161.134","TLSv1","256","Application Data, Application Data"
"257","93.741124","52.28.161.134","10.10.10.87","TCP","54","443  >  33737 [ACK] Seq=3988 Ack=544 Win=3120 Len=0"
"258","93.789605","52.25.174.177","10.10.10.87","TCP","66","80  >  60105 [FIN, ACK] Seq=206 Ack=201 Win=19200 Len=0 TSval=3054504652 TSecr=4294919270"
"259","93.789996","10.10.10.87","52.25.174.177","TCP","66","60105  >  80 [ACK] Seq=201 Ack=207 Win=6912 Len=0 TSval=4294919312 TSecr=3054504652"
"260","93.938720","10.10.10.87","10.10.10.30","HTTP/XML","592","HTTP/1.1 200 OK "
"261","93.948945","10.10.10.30","10.10.10.87","TCP","66","43661  >  80 [ACK] Seq=3977 Ack=6127 Win=107904 Len=0 TSval=7803180 TSecr=4294919349"
"262","94.036365","10.10.10.87","224.0.0.251","MDNS","388","Standard query response 0x0000 PTR _dhnap._tcp.local PTR D-Link HNAP Service._dhnap._tcp.local SRV, cache flush 0 0 80 dchg.local AAAA, cache flush fe80::7c87:61ff:feac:650a A, cache flush 10.10.10.87 TXT, cache flush"
"263","94.037379","10.10.10.87","224.0.0.251","MDNS","97","Standard query 0x0000 PTR D-Link HNAP Service._dhnap._tcp.local, ""QM"" question"
"264","94.165987","10.10.10.87","224.0.0.251","MDNS","309","Standard query response 0x0000 AAAA, cache flush fe80::7c87:61ff:feac:650a PTR, cache flush dchg.local AAAA, cache flush fe80::7c87:61ff:feac:650a PTR, cache flush dchgFD4E.local A, cache flush 10.10.10.87 PTR, cache flush dchg.local A, cache flush 10.10.10.87 PTR, cache flush dchgFD4E.local"
"265","94.911926","52.28.161.134","10.10.10.87","TLSv1","91","Application Data"
"266","94.911987","52.28.161.134","10.10.10.87","TLSv1","1115","Application Data"
"267","94.912337","10.10.10.87","52.28.161.134","TCP","60","33737  >  443 [ACK] Seq=544 Ack=4025 Win=14120 Len=0"
"268","94.912337","10.10.10.87","52.28.161.134","TCP","60","33737  >  443 [ACK] Seq=544 Ack=5086 Win=16880 Len=0"
"269","95.164566","10.10.10.87","52.28.161.134","TCP","74","33738  >  443 [SYN] Seq=0 Win=5840 Len=0 MSS=1460 SACK_PERM=1 TSval=4294919655 TSecr=0 WS=2"
"270","95.167262","52.28.161.134","10.10.10.87","TCP","66","443  >  33738 [SYN, ACK] Seq=0 Ack=1 Win=2048 Len=0 MSS=1380 SACK_PERM=1 WS=8"
"271","95.167646","10.10.10.87","52.28.161.134","TCP","60","33738  >  443 [ACK] Seq=1 Ack=1 Win=5840 Len=0"
"272","95.234012","10.10.10.87","52.28.161.134","TLSv1","261","Client Hello"
"273","95.236588","52.28.161.134","10.10.10.87","TCP","54","443  >  33738 [ACK] Seq=1 Ack=208 Win=3120 Len=0"
"274","95.236611","52.28.161.134","10.10.10.87","TLSv1","112","Server Hello"
"275","95.237048","10.10.10.87","52.28.161.134","TCP","60","33738  >  443 [ACK] Seq=208 Ack=59 Win=5840 Len=0"
"276","95.237058","52.28.161.134","10.10.10.87","TCP","1434","443  >  33738 [ACK] Seq=59 Ack=208 Win=3120 Len=1380 [TCP segment of a reassembled PDU]"
"277","95.237069","52.28.161.134","10.10.10.87","TCP","1434","443  >  33738 [ACK] Seq=1439 Ack=208 Win=3120 Len=1380 [TCP segment of a reassembled PDU]"
"278","95.237072","52.28.161.134","10.10.10.87","TLSv1","700","Certificate"
"279","95.237438","10.10.10.87","52.28.161.134","TCP","60","33738  >  443 [ACK] Seq=208 Ack=1439 Win=8600 Len=0"
"280","95.237507","10.10.10.87","52.28.161.134","TCP","60","33738  >  443 [ACK] Seq=208 Ack=2819 Win=11360 Len=0"
"281","95.237519","10.10.10.87","52.28.161.134","TCP","60","33738  >  443 [ACK] Seq=208 Ack=3465 Win=14120 Len=0"
"282","95.244938","52.28.161.134","10.10.10.87","TLSv1","390","Server Key Exchange"
"283","95.244962","52.28.161.134","10.10.10.87","TLSv1","63","Server Hello Done"
"284","95.245295","10.10.10.87","52.28.161.134","TCP","60","33738  >  443 [ACK] Seq=208 Ack=3801 Win=14120 Len=0"
