"No.","Time","Source","Destination","Protocol","Length","Info"
"1","0.000000","D-LinkIn_c5:17:5a","IntelCor_c3:41:78","EAPOL","135","Key (Message 2 of 4)"
"2","0.004447","D-LinkIn_c5:17:5a","IntelCor_c3:41:78","EAPOL","113","Key (Message 4 of 4)"
"3","0.549528","fe80::6e72:20ff:fec5:175a","ff02::16","ICMPv6","90","Multicast Listener Report Message v2"
"4","1.657197","fe80::6e72:20ff:fec5:175a","ff02::2","ICMPv6","70","Router Solicitation from 6c:72:20:c5:17:5a"
"5","5.657287","fe80::6e72:20ff:fec5:175a","ff02::2","ICMPv6","70","Router Solicitation from 6c:72:20:c5:17:5a"
"6","15.019969","0.0.0.0","255.255.255.255","DHCP","351","DHCP Discover - Transaction ID 0x4a6371ea"
"7","17.371326","0.0.0.0","255.255.255.255","DHCP","363","DHCP Request  - Transaction ID 0x4a6371ea"
"8","17.605440","10.10.10.11","224.0.0.22","IGMPv3","54","Membership Report / Join group 224.0.0.251 for any sources"
"9","17.650230","10.10.10.11","224.0.0.251","MDNS","214","Standard query response 0x0000 PTR _dhnap._tcp.local PTR D-Link DCH-S160 Configuration Utility._http._tcp.local PTR _http._tcp.local PTR D-Link HNAP Service._dhnap._tcp.local"
"10","17.674879","10.10.10.11","224.0.0.251","MDNS","640","Standard query 0x0000 ANY D-Link HNAP Service._dhnap._tcp.local, ""QM"" question ANY dch175A.local, ""QM"" question ANY 11.10.10.10.in-addr.arpa, ""QM"" question ANY dch.local, ""QM"" question ANY a.5.7.1.5.c.e.f.f.f.0.2.2.7.e.6.0.0.0.0.0.0.0.0.0.0.0.0.0.8.e.f.ip6.arpa, ""QM"" question ANY D-Link DCH-S160 Configuration Utility._http._tcp.local, ""QM"" question A 10.10.10.11 PTR dch175A.local A 10.10.10.11 PTR dch.local AAAA fe80::6e72:20ff:fec5:175a PTR dch.local AAAA fe80::6e72:20ff:fec5:175a PTR dch175A.local SRV 0 0 80 dch.local TXT SRV 0 0 80 dch.local TXT"
"11","17.926749","10.10.10.11","224.0.0.251","MDNS","640","Standard query 0x0000 ANY D-Link HNAP Service._dhnap._tcp.local, ""QM"" question ANY dch175A.local, ""QM"" question ANY 11.10.10.10.in-addr.arpa, ""QM"" question ANY dch.local, ""QM"" question ANY a.5.7.1.5.c.e.f.f.f.0.2.2.7.e.6.0.0.0.0.0.0.0.0.0.0.0.0.0.8.e.f.ip6.arpa, ""QM"" question ANY D-Link DCH-S160 Configuration Utility._http._tcp.local, ""QM"" question A 10.10.10.11 PTR dch175A.local A 10.10.10.11 PTR dch.local AAAA fe80::6e72:20ff:fec5:175a PTR dch.local AAAA fe80::6e72:20ff:fec5:175a PTR dch175A.local SRV 0 0 80 dch.local TXT SRV 0 0 80 dch.local TXT"
"12","18.178822","10.10.10.11","224.0.0.251","MDNS","640","Standard query 0x0000 ANY D-Link HNAP Service._dhnap._tcp.local, ""QM"" question ANY dch175A.local, ""QM"" question ANY 11.10.10.10.in-addr.arpa, ""QM"" question ANY dch.local, ""QM"" question ANY a.5.7.1.5.c.e.f.f.f.0.2.2.7.e.6.0.0.0.0.0.0.0.0.0.0.0.0.0.8.e.f.ip6.arpa, ""QM"" question ANY D-Link DCH-S160 Configuration Utility._http._tcp.local, ""QM"" question A 10.10.10.11 PTR dch175A.local A 10.10.10.11 PTR dch.local AAAA fe80::6e72:20ff:fec5:175a PTR dch.local AAAA fe80::6e72:20ff:fec5:175a PTR dch175A.local SRV 0 0 80 dch.local TXT SRV 0 0 80 dch.local TXT"
"13","18.369463","192.168.0.60","224.0.0.22","IGMPv3","54","Membership Report / Join group 224.0.0.251 for any sources"
"14","18.418430","192.168.0.60","224.0.0.251","MDNS","214","Standard query response 0x0000 PTR _dhnap._tcp.local PTR D-Link DCH-S160 Configuration Utility._http._tcp.local PTR _http._tcp.local PTR D-Link HNAP Service._dhnap._tcp.local"
"15","18.438892","192.168.0.60","224.0.0.251","MDNS","641","Standard query 0x0000 ANY D-Link HNAP Service._dhnap._tcp.local, ""QM"" question ANY dch175A.local, ""QM"" question ANY 60.0.168.192.in-addr.arpa, ""QM"" question ANY dch.local, ""QM"" question ANY a.5.7.1.5.c.e.f.f.f.0.2.2.7.e.6.0.0.0.0.0.0.0.0.0.0.0.0.0.8.e.f.ip6.arpa, ""QM"" question ANY D-Link DCH-S160 Configuration Utility._http._tcp.local, ""QM"" question A 192.168.0.60 PTR dch175A.local A 192.168.0.60 PTR dch.local AAAA fe80::6e72:20ff:fec5:175a PTR dch.local AAAA fe80::6e72:20ff:fec5:175a PTR dch175A.local SRV 0 0 80 dch.local TXT SRV 0 0 80 dch.local TXT"
"16","18.445939","192.168.0.60","224.0.0.251","MDNS","142","Standard query response 0x0000 PTR _dhnap._tcp.local PTR D-Link HNAP Service._dhnap._tcp.local"
"17","18.449505","192.168.0.60","224.0.0.251","MDNS","159","Standard query response 0x0000 PTR _http._tcp.local PTR D-Link DCH-S160 Configuration Utility._http._tcp.local"
"18","18.473383","192.168.0.60","224.0.0.22","IGMPv3","54","Membership Report / Leave group 224.0.0.251"
"19","20.561425","192.168.0.60","224.0.0.22","IGMPv3","54","Membership Report / Join group 224.0.0.251 for any sources"
"20","20.702546","192.168.0.60","224.0.0.251","MDNS","332","Standard query 0x0000 ANY a.5.7.1.5.c.e.f.f.f.0.2.2.7.e.6.0.0.0.0.0.0.0.0.0.0.0.0.0.8.e.f.ip6.arpa, ""QM"" question ANY dch175A.local, ""QM"" question ANY 60.0.168.192.in-addr.arpa, ""QM"" question ANY dch.local, ""QM"" question A 192.168.0.60 PTR dch175A.local A 192.168.0.60 PTR dch.local AAAA fe80::6e72:20ff:fec5:175a PTR dch175A.local AAAA fe80::6e72:20ff:fec5:175a PTR dch.local"
"21","22.424401","D-LinkIn_c5:17:5a","Broadcast","XID","20","Basic Format; Type 1 LLC (Class I LLC); Window Size 0"
"22","24.438086","D-LinkIn_c5:17:5a","IntelCor_c3:41:78","EAPOL","135","Key (Message 2 of 4)"
"23","24.442695","D-LinkIn_c5:17:5a","IntelCor_c3:41:78","EAPOL","113","Key (Message 4 of 4)"
"24","24.601321","192.168.0.60","224.0.0.251","MDNS","292","Standard query response 0x0000 PTR, cache flush dch.local A, cache flush 192.168.0.60 PTR, cache flush dch175A.local PTR, cache flush dch.local AAAA, cache flush fe80::6e72:20ff:fec5:175a AAAA, cache flush fe80::6e72:20ff:fec5:175a PTR, cache flush dch175A.local"
"25","24.626400","192.168.0.60","224.0.0.251","MDNS","83","Standard query response 0x0000 A, cache flush 192.168.0.60"
"26","24.701751","D-LinkIn_c5:17:5a","Broadcast","ARP","42","Who has 192.168.0.80? Tell 192.168.0.60"
"27","25.477576","192.168.0.60","224.0.0.251","MDNS","483","Standard query response 0x0000 TXT, cache flush PTR D-Link HNAP Service._dhnap._tcp.local SRV, cache flush 0 0 80 dch.local AAAA, cache flush fe80::6e72:20ff:fec5:175a A, cache flush 192.168.0.60 TXT, cache flush PTR _dhnap._tcp.local PTR D-Link DCH-S160 Configuration Utility._http._tcp.local SRV, cache flush 0 0 80 dch.local PTR _http._tcp.local"
"28","25.701768","D-LinkIn_c5:17:5a","Broadcast","ARP","42","Who has 192.168.0.80? Tell 192.168.0.60"
"29","26.701786","D-LinkIn_c5:17:5a","Broadcast","ARP","42","Who has 192.168.0.80? Tell 192.168.0.60"
"30","30.540821","0.0.0.0","255.255.255.255","DHCP","351","DHCP Discover - Transaction ID 0x1e63b82d"
"31","30.687233","0.0.0.0","255.255.255.255","DHCP","363","DHCP Request  - Transaction ID 0x1e63b82d"
"32","30.924775","10.10.10.11","224.0.0.22","IGMPv3","54","Membership Report / Join group 224.0.0.251 for any sources"
"33","30.972255","10.10.10.11","224.0.0.251","MDNS","214","Standard query response 0x0000 PTR _dhnap._tcp.local PTR D-Link DCH-S160 Configuration Utility._http._tcp.local PTR _http._tcp.local PTR D-Link HNAP Service._dhnap._tcp.local"
"34","30.991294","10.10.10.11","224.0.0.251","MDNS","640","Standard query 0x0000 ANY D-Link HNAP Service._dhnap._tcp.local, ""QM"" question ANY dch175A.local, ""QM"" question ANY 11.10.10.10.in-addr.arpa, ""QM"" question ANY dch.local, ""QM"" question ANY a.5.7.1.5.c.e.f.f.f.0.2.2.7.e.6.0.0.0.0.0.0.0.0.0.0.0.0.0.8.e.f.ip6.arpa, ""QM"" question ANY D-Link DCH-S160 Configuration Utility._http._tcp.local, ""QM"" question A 10.10.10.11 PTR dch175A.local A 10.10.10.11 PTR dch.local AAAA fe80::6e72:20ff:fec5:175a PTR dch.local AAAA fe80::6e72:20ff:fec5:175a PTR dch175A.local SRV 0 0 80 dch.local TXT SRV 0 0 80 dch.local TXT"
"35","31.248476","10.10.10.11","224.0.0.251","MDNS","640","Standard query 0x0000 ANY D-Link HNAP Service._dhnap._tcp.local, ""QM"" question ANY dch175A.local, ""QM"" question ANY 11.10.10.10.in-addr.arpa, ""QM"" question ANY dch.local, ""QM"" question ANY a.5.7.1.5.c.e.f.f.f.0.2.2.7.e.6.0.0.0.0.0.0.0.0.0.0.0.0.0.8.e.f.ip6.arpa, ""QM"" question ANY D-Link DCH-S160 Configuration Utility._http._tcp.local, ""QM"" question A 10.10.10.11 PTR dch175A.local A 10.10.10.11 PTR dch.local AAAA fe80::6e72:20ff:fec5:175a PTR dch.local AAAA fe80::6e72:20ff:fec5:175a PTR dch175A.local SRV 0 0 80 dch.local TXT SRV 0 0 80 dch.local TXT"
"36","31.495287","10.10.10.11","224.0.0.251","MDNS","640","Standard query 0x0000 ANY D-Link HNAP Service._dhnap._tcp.local, ""QM"" question ANY dch175A.local, ""QM"" question ANY 11.10.10.10.in-addr.arpa, ""QM"" question ANY dch.local, ""QM"" question ANY a.5.7.1.5.c.e.f.f.f.0.2.2.7.e.6.0.0.0.0.0.0.0.0.0.0.0.0.0.8.e.f.ip6.arpa, ""QM"" question ANY D-Link DCH-S160 Configuration Utility._http._tcp.local, ""QM"" question A 10.10.10.11 PTR dch175A.local A 10.10.10.11 PTR dch.local AAAA fe80::6e72:20ff:fec5:175a PTR dch.local AAAA fe80::6e72:20ff:fec5:175a PTR dch175A.local SRV 0 0 80 dch.local TXT SRV 0 0 80 dch.local TXT"
"37","31.697957","10.10.10.11","224.0.0.251","MDNS","604","Standard query response 0x0000 TXT, cache flush A, cache flush 10.10.10.11 PTR, cache flush dch175A.local A, cache flush 10.10.10.11 PTR, cache flush dch.local AAAA, cache flush fe80::6e72:20ff:fec5:175a PTR, cache flush dch.local AAAA, cache flush fe80::6e72:20ff:fec5:175a PTR, cache flush dch175A.local SRV, cache flush 0 0 80 dch.local TXT, cache flush SRV, cache flush 0 0 80 dch.local"
"38","32.004527","10.10.10.11","224.0.0.251","MDNS","214","Standard query response 0x0000 PTR _dhnap._tcp.local PTR D-Link DCH-S160 Configuration Utility._http._tcp.local PTR _http._tcp.local PTR D-Link HNAP Service._dhnap._tcp.local"
"39","32.189927","D-LinkIn_c5:17:5a","Broadcast","ARP","42","Who has 10.10.10.1? Tell 10.10.10.11"
"40","32.189951","DavidEle_06:08:ba","D-LinkIn_c5:17:5a","ARP","42","10.10.10.1 is at 00:b5:6d:06:08:ba"
"41","32.191924","10.10.10.11","10.10.10.1","DNS","74","Standard query 0x0002 AAAA wrpd.dlink.com"
"42","32.219844","10.10.10.1","10.10.10.11","DNS","395","Standard query response 0x0002 AAAA wrpd.dlink.com CNAME dualstack.ipv6-1927743757.us-west-2.elb.amazonaws.com AAAA 2620:108:700f::36f4:e8b7 AAAA 2620:108:700f::3270:7d1a NS ns-1769.awsdns-29.co.uk NS ns-332.awsdns-41.com NS ns-560.awsdns-06.net NS ns-1475.awsdns-56.org A 205.251.193.76 A 205.251.194.48 A 205.251.197.195 A 205.251.198.233"
"43","32.224686","10.10.10.11","10.10.10.1","DNS","113","Standard query 0x0003 AAAA dualstack.ipv6-1927743757.us-west-2.elb.amazonaws.com"
"44","32.224776","10.10.10.1","10.10.10.11","DNS","169","Standard query response 0x0003 AAAA dualstack.ipv6-1927743757.us-west-2.elb.amazonaws.com AAAA 2620:108:700f::3270:7d1a AAAA 2620:108:700f::36f4:e8b7"
"45","32.227866","10.10.10.11","10.10.10.1","DNS","74","Standard query 0x0004 A wrpd.dlink.com"
"46","32.253883","10.10.10.1","10.10.10.11","DNS","371","Standard query response 0x0004 A wrpd.dlink.com CNAME dualstack.ipv6-1927743757.us-west-2.elb.amazonaws.com A 50.112.125.26 A 54.244.232.183 NS ns-332.awsdns-41.com NS ns-560.awsdns-06.net NS ns-1769.awsdns-29.co.uk NS ns-1475.awsdns-56.org A 205.251.193.76 A 205.251.194.48 A 205.251.197.195 A 205.251.198.233"
"47","32.261213","10.10.10.11","50.112.125.26","TCP","74","47407  >  80 [SYN] Seq=0 Win=5840 Len=0 MSS=1460 SACK_PERM=1 TSval=4294934999 TSecr=0 WS=2"
"48","32.426632","50.112.125.26","10.10.10.11","TCP","74","80  >  47407 [SYN, ACK] Seq=0 Ack=1 Win=14480 Len=0 MSS=1380 SACK_PERM=1 TSval=754399564 TSecr=4294934999 WS=256"
"49","32.428670","10.10.10.11","50.112.125.26","TCP","66","47407  >  80 [ACK] Seq=1 Ack=1 Win=5840 Len=0 TSval=4294935041 TSecr=754399564"
"50","32.429437","10.10.10.11","50.112.125.26","HTTP","203","GET /router/firmware/query.aspx?model=DCH-S160_Ax_Default_FW_0120_6C7220C5175A HTTP/1.1 "
"51","32.594661","50.112.125.26","10.10.10.11","TCP","66","80  >  47407 [ACK] Seq=1 Ack=138 Win=15616 Len=0 TSval=754399606 TSecr=4294935041"
"52","32.596797","50.112.125.26","10.10.10.11","HTTP","267","HTTP/1.1 404 Not Found  (text/plain)"
"53","32.600968","10.10.10.11","50.112.125.26","TCP","66","47407  >  80 [ACK] Seq=138 Ack=202 Win=5840 Len=0 TSval=4294935084 TSecr=754399606"
"54","32.723933","10.10.10.11","224.0.0.251","MDNS","604","Standard query response 0x0000 TXT, cache flush A, cache flush 10.10.10.11 A, cache flush 10.10.10.11 PTR, cache flush dch175A.local PTR, cache flush dch.local AAAA, cache flush fe80::6e72:20ff:fec5:175a AAAA, cache flush fe80::6e72:20ff:fec5:175a PTR, cache flush dch175A.local PTR, cache flush dch.local SRV, cache flush 0 0 80 dch.local TXT, cache flush SRV, cache flush 0 0 80 dch.local"
"55","33.284211","10.10.10.11","10.10.10.1","DNS","74","Standard query 0x0002 A ntp1.dlink.com"
"56","33.287741","10.10.10.1","10.10.10.11","DNS","256","Standard query response 0x0002 A ntp1.dlink.com A 54.186.215.173 A 54.86.11.193 NS ns2.p13.dynect.net NS ns3.p13.dynect.net NS ns4.p13.dynect.net NS ns1.p13.dynect.net A 208.78.70.13 A 204.13.250.13 A 208.78.71.13 A 204.13.251.13"
"57","33.291728","10.10.10.11","54.186.215.173","NTP","90","NTP Version 3, client"
"58","33.448190","10.10.10.11","50.112.125.26","TCP","66","47407  >  80 [FIN, ACK] Seq=138 Ack=202 Win=5840 Len=0 TSval=4294935296 TSecr=754399606"
"59","33.455958","54.186.215.173","10.10.10.11","NTP","90","NTP Version 3, server"
"60","33.613479","50.112.125.26","10.10.10.11","TCP","66","80  >  47407 [FIN, ACK] Seq=202 Ack=139 Win=15616 Len=0 TSval=754399860 TSecr=4294935296"
"61","33.616328","10.10.10.11","50.112.125.26","TCP","66","47407  >  80 [ACK] Seq=139 Ack=203 Win=5840 Len=0 TSval=4294935338 TSecr=754399860"
"62","34.016696","10.10.10.11","224.0.0.251","MDNS","683","Standard query response 0x0000 TXT, cache flush A, cache flush 10.10.10.11 A, cache flush 10.10.10.11 PTR, cache flush dch175A.local PTR, cache flush dch.local AAAA, cache flush fe80::6e72:20ff:fec5:175a AAAA, cache flush fe80::6e72:20ff:fec5:175a PTR, cache flush dch175A.local PTR, cache flush dch.local SRV, cache flush 0 0 80 dch.local TXT, cache flush SRV, cache flush 0 0 80 dch.local PTR D-Link DCH-S160 Configuration Utility._http._tcp.local PTR _http._tcp.local PTR D-Link HNAP Service._dhnap._tcp.local PTR _dhnap._tcp.local"
"63","34.371590","10.10.10.11","224.0.0.251","MDNS","334","Standard query response 0x0000 PTR _dhnap._tcp.local PTR D-Link HNAP Service._dhnap._tcp.local SRV, cache flush 0 0 80 dch.local TXT, cache flush"
"64","34.376010","10.10.10.11","224.0.0.251","MDNS","196","Standard query response 0x0000 PTR _http._tcp.local PTR D-Link DCH-S160 Configuration Utility._http._tcp.local SRV, cache flush 0 0 80 dch.local TXT, cache flush"
"65","34.716190","10.10.10.11","224.0.0.251","MDNS","307","Standard query response 0x0000 AAAA, cache flush fe80::6e72:20ff:fec5:175a PTR, cache flush dch.local AAAA, cache flush fe80::6e72:20ff:fec5:175a PTR, cache flush dch175A.local A, cache flush 10.10.10.11 PTR, cache flush dch.local A, cache flush 10.10.10.11 PTR, cache flush dch175A.local"
"66","34.722612","10.10.10.11","224.0.0.22","IGMPv3","54","Membership Report / Leave group 224.0.0.251"
"67","36.781967","10.10.10.11","224.0.0.22","IGMPv3","54","Membership Report / Join group 224.0.0.251 for any sources"
"68","36.808987","10.10.10.11","224.0.0.251","MDNS","77","Standard query 0x0000 PTR _dhnap._tcp.local, ""QM"" question"
"69","36.871145","10.10.10.11","224.0.0.251","MDNS","331","Standard query 0x0000 ANY a.5.7.1.5.c.e.f.f.f.0.2.2.7.e.6.0.0.0.0.0.0.0.0.0.0.0.0.0.8.e.f.ip6.arpa, ""QM"" question ANY dch175A.local, ""QM"" question ANY 11.10.10.10.in-addr.arpa, ""QM"" question ANY dch.local, ""QM"" question A 10.10.10.11 PTR dch175A.local A 10.10.10.11 PTR dch.local AAAA fe80::6e72:20ff:fec5:175a PTR dch175A.local AAAA fe80::6e72:20ff:fec5:175a PTR dch.local"
"70","37.123199","10.10.10.11","224.0.0.251","MDNS","331","Standard query 0x0000 ANY a.5.7.1.5.c.e.f.f.f.0.2.2.7.e.6.0.0.0.0.0.0.0.0.0.0.0.0.0.8.e.f.ip6.arpa, ""QM"" question ANY dch175A.local, ""QM"" question ANY 11.10.10.10.in-addr.arpa, ""QM"" question ANY dch.local, ""QM"" question A 10.10.10.11 PTR dch175A.local A 10.10.10.11 PTR dch.local AAAA fe80::6e72:20ff:fec5:175a PTR dch175A.local AAAA fe80::6e72:20ff:fec5:175a PTR dch.local"
"71","37.231414","DavidEle_06:08:ba","D-LinkIn_c5:17:5a","ARP","42","Who has 10.10.10.11? Tell 10.10.10.1"
"72","37.237233","D-LinkIn_c5:17:5a","DavidEle_06:08:ba","ARP","42","10.10.10.11 is at 6c:72:20:c5:17:5a"
"73","37.374955","10.10.10.11","224.0.0.251","MDNS","331","Standard query 0x0000 ANY a.5.7.1.5.c.e.f.f.f.0.2.2.7.e.6.0.0.0.0.0.0.0.0.0.0.0.0.0.8.e.f.ip6.arpa, ""QM"" question ANY dch175A.local, ""QM"" question ANY 11.10.10.10.in-addr.arpa, ""QM"" question ANY dch.local, ""QM"" question A 10.10.10.11 PTR dch175A.local A 10.10.10.11 PTR dch.local AAAA fe80::6e72:20ff:fec5:175a PTR dch175A.local AAAA fe80::6e72:20ff:fec5:175a PTR dch.local"
"74","37.575826","10.10.10.11","224.0.0.251","MDNS","227","Standard query response 0x0000 PTR, cache flush dch.local AAAA, cache flush fe80::6e72:20ff:fec5:175a PTR, cache flush dch175A.local AAAA, cache flush fe80::6e72:20ff:fec5:175a"
"75","37.579595","10.10.10.11","224.0.0.251","MDNS","155","Standard query response 0x0000 PTR, cache flush dch.local A, cache flush 10.10.10.11 PTR, cache flush dch175A.local A, cache flush 10.10.10.11"
"76","37.670525","10.10.10.11","224.0.0.251","MDNS","373","Standard query 0x0000 ANY D-Link DCH-S160 Configuration Utility._http._tcp.local, ""QM"" question ANY D-Link HNAP Service._dhnap._tcp.local, ""QM"" question SRV 0 0 80 dch.local TXT SRV 0 0 80 dch.local TXT"
"77","37.922677","10.10.10.11","224.0.0.251","MDNS","373","Standard query 0x0000 ANY D-Link DCH-S160 Configuration Utility._http._tcp.local, ""QM"" question ANY D-Link HNAP Service._dhnap._tcp.local, ""QM"" question SRV 0 0 80 dch.local TXT SRV 0 0 80 dch.local TXT"
"78","38.174732","10.10.10.11","224.0.0.251","MDNS","373","Standard query 0x0000 ANY D-Link DCH-S160 Configuration Utility._http._tcp.local, ""QM"" question ANY D-Link HNAP Service._dhnap._tcp.local, ""QM"" question SRV 0 0 80 dch.local TXT SRV 0 0 80 dch.local TXT"
"79","38.377488","10.10.10.11","224.0.0.251","MDNS","484","Standard query response 0x0000 TXT, cache flush PTR D-Link HNAP Service._dhnap._tcp.local SRV, cache flush 0 0 80 dch.local AAAA, cache flush fe80::6e72:20ff:fec5:175a A, cache flush 10.10.10.11 TXT, cache flush PTR _dhnap._tcp.local PTR D-Link DCH-S160 Configuration Utility._http._tcp.local SRV, cache flush 0 0 80 dch.local PTR _http._tcp.local"
"80","38.378352","10.10.10.11","224.0.0.251","MDNS","97","Standard query 0x0000 PTR D-Link HNAP Service._dhnap._tcp.local, ""QM"" question"
"81","38.621063","10.10.10.11","224.0.0.251","MDNS","263","Standard query response 0x0000 PTR, cache flush dch.local A, cache flush 10.10.10.11 PTR, cache flush dch175A.local PTR, cache flush dch.local AAAA, cache flush fe80::6e72:20ff:fec5:175a PTR, cache flush dch175A.local"
"82","39.420944","10.10.10.11","224.0.0.251","MDNS","484","Standard query response 0x0000 TXT, cache flush PTR D-Link HNAP Service._dhnap._tcp.local SRV, cache flush 0 0 80 dch.local AAAA, cache flush fe80::6e72:20ff:fec5:175a A, cache flush 10.10.10.11 TXT, cache flush PTR _dhnap._tcp.local PTR D-Link DCH-S160 Configuration Utility._http._tcp.local SRV, cache flush 0 0 80 dch.local PTR _http._tcp.local"
"83","39.422215","10.10.10.11","224.0.0.251","MDNS","97","Standard query 0x0000 PTR D-Link HNAP Service._dhnap._tcp.local, ""QM"" question"
"84","40.665154","10.10.10.11","224.0.0.251","MDNS","307","Standard query response 0x0000 PTR, cache flush dch.local A, cache flush 10.10.10.11 A, cache flush 10.10.10.11 PTR, cache flush dch175A.local PTR, cache flush dch.local AAAA, cache flush fe80::6e72:20ff:fec5:175a AAAA, cache flush fe80::6e72:20ff:fec5:175a PTR, cache flush dch175A.local"
"85","40.990060","10.10.10.11","224.0.0.22","IGMPv3","54","Membership Report / Join group 224.0.0.251 for any sources"
"86","41.459815","10.10.10.11","224.0.0.251","MDNS","450","Standard query response 0x0000 TXT, cache flush TXT, cache flush PTR _dhnap._tcp.local PTR D-Link DCH-S160 Configuration Utility._http._tcp.local SRV, cache flush 0 0 80 dch.local AAAA, cache flush fe80::6e72:20ff:fec5:175a A, cache flush 10.10.10.11 PTR _http._tcp.local"
"87","41.461106","10.10.10.11","224.0.0.251","MDNS","129","Standard query response 0x0000 SRV, cache flush 0 0 80 dch.local PTR D-Link HNAP Service._dhnap._tcp.local"
"88","41.462037","10.10.10.11","224.0.0.251","MDNS","97","Standard query 0x0000 PTR D-Link HNAP Service._dhnap._tcp.local, ""QM"" question"
"89","42.662664","10.10.10.11","224.0.0.251","MDNS","342","Standard query response 0x0000 PTR D-Link HNAP Service._dhnap._tcp.local TXT, cache flush SRV, cache flush 0 0 80 dch.local AAAA, cache flush fe80::6e72:20ff:fec5:175a A, cache flush 10.10.10.11"
"90","42.666198","10.10.10.11","224.0.0.251","MDNS","97","Standard query 0x0000 PTR D-Link HNAP Service._dhnap._tcp.local, ""QM"" question"
"91","83.666313","10.10.10.11","224.0.0.251","MDNS","484","Standard query response 0x0000 PTR _http._tcp.local PTR D-Link HNAP Service._dhnap._tcp.local SRV, cache flush 0 0 80 dch.local AAAA, cache flush fe80::6e72:20ff:fec5:175a A, cache flush 10.10.10.11 TXT, cache flush PTR _dhnap._tcp.local PTR D-Link DCH-S160 Configuration Utility._http._tcp.local SRV, cache flush 0 0 80 dch.local TXT, cache flush"
"92","83.674354","10.10.10.11","224.0.0.251","MDNS","97","Standard query 0x0000 PTR D-Link HNAP Service._dhnap._tcp.local, ""QM"" question"
"93","84.072928","10.10.10.11","224.0.0.251","MDNS","307","Standard query response 0x0000 AAAA, cache flush fe80::6e72:20ff:fec5:175a PTR, cache flush dch.local AAAA, cache flush fe80::6e72:20ff:fec5:175a PTR, cache flush dch175A.local A, cache flush 10.10.10.11 PTR, cache flush dch.local A, cache flush 10.10.10.11 PTR, cache flush dch175A.local"
"94","84.537228","10.10.10.11","10.10.10.1","DNS","77","Standard query 0x0002 A api.dch.dlink.com"
"95","84.588618","10.10.10.1","10.10.10.11","DNS","373","Standard query response 0x0002 A api.dch.dlink.com CNAME eu-api-elb-1068129369.eu-central-1.elb.amazonaws.com A 52.28.38.154 A 52.58.68.165 NS ns-1689.awsdns-19.co.uk NS ns-1326.awsdns-37.org NS ns-417.awsdns-52.com NS ns-613.awsdns-12.net A 205.251.193.161 A 205.251.194.101 A 205.251.197.46 A 205.251.198.153"
"96","84.592491","10.10.10.11","52.28.38.154","TCP","74","34025  >  443 [SYN] Seq=0 Win=5840 Len=0 MSS=1460 SACK_PERM=1 TSval=4294948082 TSecr=0 WS=2"
"97","84.594907","52.28.38.154","10.10.10.11","TCP","74","443  >  34025 [SYN, ACK] Seq=0 Ack=1 Win=17898 Len=0 MSS=1380 SACK_PERM=1 TSval=437598109 TSecr=4294948082 WS=256"
"98","84.596116","10.10.10.11","52.28.38.154","TCP","66","34025  >  443 [ACK] Seq=1 Ack=1 Win=5840 Len=0 TSval=4294948083 TSecr=437598109"
"99","84.646959","10.10.10.11","52.28.38.154","TLSv1","273","Client Hello"
"100","84.649240","52.28.38.154","10.10.10.11","TCP","66","443  >  34025 [ACK] Seq=1 Ack=208 Win=19200 Len=0 TSval=437598123 TSecr=4294948096"
"101","84.651021","52.28.38.154","10.10.10.11","TLSv1","1434","Server Hello"
"102","84.651104","52.28.38.154","10.10.10.11","TCP","1434","443  >  34025 [ACK] Seq=1369 Ack=208 Win=19200 Len=1368 TSval=437598123 TSecr=4294948096 [TCP segment of a reassembled PDU]"
"103","84.651149","52.28.38.154","10.10.10.11","TLSv1","1147","Certificate, Server Key Exchange, Server Hello Done"
"104","84.660269","52.28.38.154","10.10.10.11","TCP","1147","[TCP Retransmission] 443  >  34025 [PSH, ACK] Seq=2737 Ack=208 Win=19200 Len=1081 TSval=437598126 TSecr=4294948096"
"105","84.664347","10.10.10.11","52.28.38.154","TCP","66","34025  >  443 [ACK] Seq=208 Ack=1369 Win=8576 Len=0 TSval=4294948098 TSecr=437598123"
"106","84.664531","10.10.10.11","52.28.38.154","TCP","66","34025  >  443 [ACK] Seq=208 Ack=2737 Win=11312 Len=0 TSval=4294948100 TSecr=437598123"
"107","84.669227","10.10.10.11","52.28.38.154","TCP","66","34025  >  443 [ACK] Seq=208 Ack=3818 Win=14048 Len=0 TSval=4294948101 TSecr=437598123"
"108","84.669453","10.10.10.11","52.28.38.154","TCP","78","[TCP Dup ACK 107#1] 34025  >  443 [ACK] Seq=208 Ack=3818 Win=14048 Len=0 TSval=4294948101 TSecr=437598126 SLE=2737 SRE=3818"
"109","84.810860","10.10.10.11","52.28.38.154","TLSv1","200","Client Key Exchange, Change Cipher Spec, Encrypted Handshake Message"
"110","84.813897","52.28.38.154","10.10.10.11","TLSv1","300","New Session Ticket, Change Cipher Spec, Encrypted Handshake Message"
"111","84.815174","10.10.10.11","52.28.38.154","TCP","66","34025  >  443 [ACK] Seq=342 Ack=4052 Win=14048 Len=0 TSval=4294948138 TSecr=437598164"
"112","84.865693","10.10.10.11","52.28.38.154","TLSv1","588","Application Data, Application Data"
"113","84.907876","52.28.38.154","10.10.10.11","TCP","66","443  >  34025 [ACK] Seq=4052 Ack=864 Win=21248 Len=0 TSval=437598188 TSecr=4294948150"
"114","85.228408","52.28.38.154","10.10.10.11","TLSv1","615","Application Data"
"115","85.228437","52.28.38.154","10.10.10.11","TLSv1","103","Encrypted Alert"
"116","85.230834","10.10.10.11","52.28.38.154","TCP","66","34025  >  443 [ACK] Seq=864 Ack=4601 Win=14048 Len=0 TSval=4294948241 TSecr=437598268"
"117","85.230982","10.10.10.11","52.28.38.154","TCP","66","34025  >  443 [ACK] Seq=864 Ack=4638 Win=14048 Len=0 TSval=4294948242 TSecr=437598268"
"118","85.249099","10.10.10.11","52.28.38.154","TCP","66","34025  >  443 [RST, ACK] Seq=864 Ack=4638 Win=14048 Len=0 TSval=4294948246 TSecr=437598268"
"119","85.404157","10.10.10.11","224.0.0.251","MDNS","331","Standard query 0x0000 ANY a.5.7.1.5.c.e.f.f.f.0.2.2.7.e.6.0.0.0.0.0.0.0.0.0.0.0.0.0.8.e.f.ip6.arpa, ""QM"" question ANY dch175A.local, ""QM"" question ANY 11.10.10.10.in-addr.arpa, ""QM"" question ANY dch.local, ""QM"" question A 10.10.10.11 PTR dch175A.local A 10.10.10.11 PTR dch.local AAAA fe80::6e72:20ff:fec5:175a PTR dch175A.local AAAA fe80::6e72:20ff:fec5:175a PTR dch.local"
"120","85.643416","10.10.10.11","52.28.38.154","TCP","74","34027  >  443 [SYN] Seq=0 Win=5840 Len=0 MSS=1460 SACK_PERM=1 TSval=4294948345 TSecr=0 WS=2"
"121","85.645703","52.28.38.154","10.10.10.11","TCP","74","443  >  34027 [SYN, ACK] Seq=0 Ack=1 Win=17898 Len=0 MSS=1380 SACK_PERM=1 TSval=437598372 TSecr=4294948345 WS=256"
"122","85.646846","10.10.10.11","52.28.38.154","TCP","66","34027  >  443 [ACK] Seq=1 Ack=1 Win=5840 Len=0 TSval=4294948346 TSecr=437598372"
"123","85.655459","10.10.10.11","224.0.0.251","MDNS","331","Standard query 0x0000 ANY a.5.7.1.5.c.e.f.f.f.0.2.2.7.e.6.0.0.0.0.0.0.0.0.0.0.0.0.0.8.e.f.ip6.arpa, ""QM"" question ANY dch175A.local, ""QM"" question ANY 11.10.10.10.in-addr.arpa, ""QM"" question ANY dch.local, ""QM"" question A 10.10.10.11 PTR dch175A.local A 10.10.10.11 PTR dch.local AAAA fe80::6e72:20ff:fec5:175a PTR dch175A.local AAAA fe80::6e72:20ff:fec5:175a PTR dch.local"
"124","85.694629","10.10.10.11","52.28.38.154","TLSv1","273","Client Hello"
"125","85.697716","52.28.38.154","10.10.10.11","TCP","66","443  >  34027 [ACK] Seq=1 Ack=208 Win=19200 Len=0 TSval=437598385 TSecr=4294948358"
"126","85.698666","52.28.38.154","10.10.10.11","TLSv1","1434","Server Hello"
"127","85.698686","52.28.38.154","10.10.10.11","TCP","1434","443  >  34027 [ACK] Seq=1369 Ack=208 Win=19200 Len=1368 TSval=437598385 TSecr=4294948358 [TCP segment of a reassembled PDU]"
"128","85.698744","52.28.38.154","10.10.10.11","TLSv1","1147","Certificate, Server Key Exchange, Server Hello Done"
"129","85.703355","10.10.10.11","52.28.38.154","TCP","66","34027  >  443 [ACK] Seq=208 Ack=1369 Win=8576 Len=0 TSval=4294948359 TSecr=437598385"
"130","85.703557","10.10.10.11","52.28.38.154","TCP","66","34027  >  443 [ACK] Seq=208 Ack=2737 Win=11312 Len=0 TSval=4294948359 TSecr=437598385"
"131","85.703661","10.10.10.11","52.28.38.154","TCP","66","34027  >  443 [ACK] Seq=208 Ack=3818 Win=14048 Len=0 TSval=4294948360 TSecr=437598385"
"132","85.843665","10.10.10.11","52.28.38.154","TLSv1","200","Client Key Exchange, Change Cipher Spec, Encrypted Handshake Message"
"133","85.846497","52.28.38.154","10.10.10.11","TLSv1","300","New Session Ticket, Change Cipher Spec, Encrypted Handshake Message"
"134","85.847493","10.10.10.11","52.28.38.154","TCP","66","34027  >  443 [ACK] Seq=342 Ack=4052 Win=14048 Len=0 TSval=4294948396 TSecr=437598422"
"135","85.897236","10.10.10.11","52.28.38.154","TLSv1","588","Application Data, Application Data"
"136","85.907444","10.10.10.11","224.0.0.251","MDNS","331","Standard query 0x0000 ANY a.5.7.1.5.c.e.f.f.f.0.2.2.7.e.6.0.0.0.0.0.0.0.0.0.0.0.0.0.8.e.f.ip6.arpa, ""QM"" question ANY dch175A.local, ""QM"" question ANY 11.10.10.10.in-addr.arpa, ""QM"" question ANY dch.local, ""QM"" question A 10.10.10.11 PTR dch175A.local A 10.10.10.11 PTR dch.local AAAA fe80::6e72:20ff:fec5:175a PTR dch175A.local AAAA fe80::6e72:20ff:fec5:175a PTR dch.local"
"137","85.935577","52.28.38.154","10.10.10.11","TCP","66","443  >  34027 [ACK] Seq=4052 Ack=864 Win=21248 Len=0 TSval=437598445 TSecr=4294948408"
"138","85.936570","10.10.10.11","52.28.38.154","TLSv1","796","Application Data, Application Data"
"139","85.938697","52.28.38.154","10.10.10.11","TCP","66","443  >  34027 [ACK] Seq=4052 Ack=1594 Win=22784 Len=0 TSval=437598445 TSecr=4294948418"
"140","86.111011","10.10.10.11","224.0.0.251","MDNS","307","Standard query response 0x0000 PTR, cache flush dch.local A, cache flush 10.10.10.11 PTR, cache flush dch175A.local A, cache flush 10.10.10.11 PTR, cache flush dch.local AAAA, cache flush fe80::6e72:20ff:fec5:175a PTR, cache flush dch175A.local AAAA, cache flush fe80::6e72:20ff:fec5:175a"
"141","86.170999","10.10.10.11","224.0.0.251","MDNS","373","Standard query 0x0000 ANY D-Link DCH-S160 Configuration Utility._http._tcp.local, ""QM"" question ANY D-Link HNAP Service._dhnap._tcp.local, ""QM"" question SRV 0 0 80 dch.local TXT SRV 0 0 80 dch.local TXT"
"142","86.177909","52.28.38.154","10.10.10.11","TLSv1","663","Application Data"
"143","86.187932","10.10.10.11","52.28.38.154","TCP","66","34027  >  443 [ACK] Seq=1594 Ack=4649 Win=14048 Len=0 TSval=4294948479 TSecr=437598505"
"144","86.188116","10.10.10.11","52.28.38.154","TCP","66","34027  >  443 [FIN, ACK] Seq=1594 Ack=4649 Win=14048 Len=0 TSval=4294948480 TSecr=437598505"
"145","86.190072","52.28.38.154","10.10.10.11","TLSv1","103","Encrypted Alert"
"146","86.190101","52.28.38.154","10.10.10.11","TCP","66","443  >  34027 [FIN, ACK] Seq=4686 Ack=1595 Win=22784 Len=0 TSval=437598508 TSecr=4294948480"
"147","86.191129","10.10.10.11","52.28.38.154","TCP","54","34027  >  443 [RST] Seq=1595 Win=0 Len=0"
"148","86.191359","10.10.10.11","52.28.38.154","TCP","54","34027  >  443 [RST] Seq=1595 Win=0 Len=0"
"149","86.289670","10.10.10.11","52.28.38.154","TCP","74","34028  >  443 [SYN] Seq=0 Win=5840 Len=0 MSS=1460 SACK_PERM=1 TSval=4294948506 TSecr=0 WS=2"
"150","86.291894","52.28.38.154","10.10.10.11","TCP","74","443  >  34028 [SYN, ACK] Seq=0 Ack=1 Win=17898 Len=0 MSS=1380 SACK_PERM=1 TSval=437598534 TSecr=4294948506 WS=256"
"151","86.292563","10.10.10.11","52.28.38.154","TCP","66","34028  >  443 [ACK] Seq=1 Ack=1 Win=5840 Len=0 TSval=4294948507 TSecr=437598534"
"152","86.319567","10.10.10.11","10.10.10.1","DNS","74","Standard query 0x0002 A ntp1.dlink.com"
"153","86.319659","10.10.10.1","10.10.10.11","DNS","106","Standard query response 0x0002 A ntp1.dlink.com A 54.86.11.193 A 54.186.215.173"
"154","86.326641","10.10.10.11","54.86.11.193","NTP","90","NTP Version 3, client"
"155","86.339846","10.10.10.11","52.28.38.154","TLSv1","273","Client Hello"
"156","86.341950","52.28.38.154","10.10.10.11","TCP","66","443  >  34028 [ACK] Seq=1 Ack=208 Win=19200 Len=0 TSval=437598546 TSecr=4294948519"
"157","86.343814","52.28.38.154","10.10.10.11","TLSv1","1434","Server Hello"
"158","86.343842","52.28.38.154","10.10.10.11","TCP","1434","443  >  34028 [ACK] Seq=1369 Ack=208 Win=19200 Len=1368 TSval=437598547 TSecr=4294948519 [TCP segment of a reassembled PDU]"
"159","86.343863","52.28.38.154","10.10.10.11","TLSv1","1147","Certificate, Server Key Exchange, Server Hello Done"
"160","86.348629","10.10.10.11","52.28.38.154","TCP","66","34028  >  443 [ACK] Seq=208 Ack=1369 Win=8576 Len=0 TSval=4294948521 TSecr=437598547"
"161","86.348866","10.10.10.11","52.28.38.154","TCP","66","34028  >  443 [ACK] Seq=208 Ack=2737 Win=11312 Len=0 TSval=4294948521 TSecr=437598547"
"162","86.348951","10.10.10.11","52.28.38.154","TCP","66","34028  >  443 [ACK] Seq=208 Ack=3818 Win=14048 Len=0 TSval=4294948521 TSecr=437598547"
"163","86.422992","10.10.10.11","224.0.0.251","MDNS","373","Standard query 0x0000 ANY D-Link DCH-S160 Configuration Utility._http._tcp.local, ""QM"" question ANY D-Link HNAP Service._dhnap._tcp.local, ""QM"" question SRV 0 0 80 dch.local TXT SRV 0 0 80 dch.local TXT"
"164","86.427316","54.86.11.193","10.10.10.11","NTP","90","NTP Version 3, server"
"165","86.552068","10.10.10.11","52.28.38.154","TLSv1","200","Client Key Exchange, Change Cipher Spec, Encrypted Handshake Message"
"166","86.554883","52.28.38.154","10.10.10.11","TLSv1","300","New Session Ticket, Change Cipher Spec, Encrypted Handshake Message"
"167","86.556062","10.10.10.11","52.28.38.154","TCP","66","34028  >  443 [ACK] Seq=342 Ack=4052 Win=14048 Len=0 TSval=4294948573 TSecr=437598599"
"168","86.605476","10.10.10.11","52.28.38.154","TLSv1","460","Application Data, Application Data"
"169","86.639197","10.10.10.11","224.0.0.251","MDNS","373","Standard query 0x0000 ANY D-Link DCH-S160 Configuration Utility._http._tcp.local, ""QM"" question ANY D-Link HNAP Service._dhnap._tcp.local, ""QM"" question SRV 0 0 80 dch.local TXT SRV 0 0 80 dch.local TXT"
"170","86.647592","52.28.38.154","10.10.10.11","TCP","66","443  >  34028 [ACK] Seq=4052 Ack=736 Win=21248 Len=0 TSval=437598623 TSecr=4294948585"
"171","86.841760","10.10.10.11","224.0.0.251","MDNS","484","Standard query response 0x0000 TXT, cache flush PTR D-Link HNAP Service._dhnap._tcp.local SRV, cache flush 0 0 80 dch.local AAAA, cache flush fe80::6e72:20ff:fec5:175a A, cache flush 10.10.10.11 TXT, cache flush PTR _dhnap._tcp.local PTR D-Link DCH-S160 Configuration Utility._http._tcp.local SRV, cache flush 0 0 80 dch.local PTR _http._tcp.local"
"172","86.846552","10.10.10.11","224.0.0.251","MDNS","97","Standard query 0x0000 PTR D-Link HNAP Service._dhnap._tcp.local, ""QM"" question"
"173","87.080998","10.10.10.11","224.0.0.251","MDNS","247","Standard query response 0x0000 PTR, cache flush dch.local PTR, cache flush dch175A.local PTR, cache flush dch.local AAAA, cache flush fe80::6e72:20ff:fec5:175a PTR, cache flush dch175A.local"
"174","87.083918","10.10.10.11","224.0.0.251","MDNS","83","Standard query response 0x0000 A, cache flush 10.10.10.11"
"175","87.307196","10.10.10.11","10.10.10.1","DNS","80","Standard query 0x0002 AAAA tzinfo.dch.dlink.com"
"176","87.343982","52.28.38.154","10.10.10.11","TLSv1","471","Application Data"
"177","87.344012","52.28.38.154","10.10.10.11","TLSv1","103","Encrypted Alert"
"178","87.344886","10.10.10.11","52.28.38.154","TCP","66","34028  >  443 [ACK] Seq=736 Ack=4457 Win=14048 Len=0 TSval=4294948770 TSecr=437598797"
"179","87.345064","10.10.10.11","52.28.38.154","TCP","66","34028  >  443 [ACK] Seq=736 Ack=4494 Win=14048 Len=0 TSval=4294948770 TSecr=437598797"
"180","87.347238","10.10.10.11","10.10.10.1","DNS","79","Standard query 0x0003 A r0801.dch.dlink.com"
"181","87.347330","10.10.10.1","10.10.10.11","DNS","95","Standard query response 0x0003 A r0801.dch.dlink.com A 52.28.161.134"
"182","87.348383","10.10.10.11","52.28.161.134","TCP","74","42008  >  443 [SYN] Seq=0 Win=5840 Len=0 MSS=1460 SACK_PERM=1 TSval=4294948771 TSecr=0 WS=2"
"183","87.350135","52.28.161.134","10.10.10.11","TCP","66","443  >  42008 [SYN, ACK] Seq=0 Ack=1 Win=2048 Len=0 MSS=1380 SACK_PERM=1 WS=8"
"184","87.350813","10.10.10.11","52.28.161.134","TCP","54","42008  >  443 [ACK] Seq=1 Ack=1 Win=5840 Len=0"
"185","87.357345","10.10.10.1","10.10.10.11","DNS","213","Standard query response 0x0002 AAAA tzinfo.dch.dlink.com CNAME tzinfo-423124427.us-west-2.elb.amazonaws.com SOA ns-332.awsdns-41.com"
"186","87.359917","10.10.10.11","10.10.10.1","DNS","104","Standard query 0x0003 AAAA tzinfo-423124427.us-west-2.elb.amazonaws.com"
"187","87.360032","10.10.10.1","10.10.10.11","DNS","104","Standard query response 0x0003 AAAA tzinfo-423124427.us-west-2.elb.amazonaws.com"
"188","87.361515","10.10.10.11","10.10.10.1","DNS","80","Standard query 0x0004 A tzinfo.dch.dlink.com"
"189","87.387385","10.10.10.1","10.10.10.11","DNS","368","Standard query response 0x0004 A tzinfo.dch.dlink.com CNAME tzinfo-423124427.us-west-2.elb.amazonaws.com A 52.25.174.177 A 52.26.98.232 NS ns-332.awsdns-41.com NS ns-1769.awsdns-29.co.uk NS ns-1475.awsdns-56.org NS ns-560.awsdns-06.net A 205.251.193.76 A 205.251.194.48 A 205.251.197.195 A 205.251.198.233"
"190","87.388763","10.10.10.11","52.25.174.177","TCP","74","48025  >  80 [SYN] Seq=0 Win=5840 Len=0 MSS=1460 SACK_PERM=1 TSval=4294948781 TSecr=0 WS=2"
"191","87.403181","10.10.10.11","52.28.161.134","TLSv1","261","Client Hello"
"192","87.404725","52.28.161.134","10.10.10.11","TCP","54","443  >  42008 [ACK] Seq=1 Ack=208 Win=3120 Len=0"
"193","87.404751","52.28.161.134","10.10.10.11","TLSv1","112","Server Hello"
"194","87.405114","52.28.161.134","10.10.10.11","TCP","1434","443  >  42008 [ACK] Seq=59 Ack=208 Win=3120 Len=1380 [TCP segment of a reassembled PDU]"
"195","87.405141","52.28.161.134","10.10.10.11","TCP","1434","443  >  42008 [ACK] Seq=1439 Ack=208 Win=3120 Len=1380 [TCP segment of a reassembled PDU]"
"196","87.405147","52.28.161.134","10.10.10.11","TLSv1","700","Certificate"
"197","87.407244","10.10.10.11","52.28.161.134","TCP","54","42008  >  443 [ACK] Seq=208 Ack=59 Win=5840 Len=0"
"198","87.407510","10.10.10.11","52.28.161.134","TCP","54","42008  >  443 [ACK] Seq=208 Ack=1439 Win=8600 Len=0"
"199","87.407625","10.10.10.11","52.28.161.134","TCP","54","42008  >  443 [ACK] Seq=208 Ack=2819 Win=11360 Len=0"
"200","87.407716","10.10.10.11","52.28.161.134","TCP","54","42008  >  443 [ACK] Seq=208 Ack=3465 Win=11360 Len=0"
"201","87.413234","52.28.161.134","10.10.10.11","TLSv1","390","Server Key Exchange"
"202","87.413263","52.28.161.134","10.10.10.11","TLSv1","63","Server Hello Done"
"203","87.413925","10.10.10.11","52.28.161.134","TCP","54","42008  >  443 [ACK] Seq=208 Ack=3801 Win=11360 Len=0"
"204","87.414213","10.10.10.11","52.28.161.134","TCP","54","42008  >  443 [ACK] Seq=208 Ack=3810 Win=11360 Len=0"
"205","87.541631","10.10.10.11","52.28.161.134","TLSv1","188","Client Key Exchange, Change Cipher Spec, Encrypted Handshake Message"
"206","87.545160","52.28.161.134","10.10.10.11","TLSv1","173","New Session Ticket"
"207","87.545189","52.28.161.134","10.10.10.11","TLSv1","60","Change Cipher Spec"
"208","87.545195","52.28.161.134","10.10.10.11","TLSv1","107","Encrypted Handshake Message"
"209","87.553577","52.25.174.177","10.10.10.11","TCP","74","80  >  48025 [SYN, ACK] Seq=0 Ack=1 Win=17898 Len=0 MSS=1380 SACK_PERM=1 TSval=420261283 TSecr=4294948781 WS=256"
"210","87.554323","10.10.10.11","52.25.174.177","TCP","66","48025  >  80 [ACK] Seq=1 Ack=1 Win=5840 Len=0 TSval=4294948822 TSecr=420261283"
"211","87.554986","10.10.10.11","52.25.174.177","HTTP","227","GET /dst?timezone=Europe/Berlin&ts=1472723383&hash=f205479678aced5136edb73490461aeb HTTP/1.1 "
"212","87.556561","52.28.161.134","10.10.10.11","TCP","107","[TCP Retransmission] 443  >  42008 [PSH, ACK] Seq=3935 Ack=342 Win=3120 Len=53"
"213","87.557114","10.10.10.11","52.28.161.134","TCP","66","42008  >  443 [ACK] Seq=342 Ack=3988 Win=11360 Len=0 SLE=3935 SRE=3988"
"214","87.597787","10.10.10.11","52.28.38.154","TCP","66","34028  >  443 [RST, ACK] Seq=736 Ack=4494 Win=14048 Len=0 TSval=4294948833 TSecr=437598797"
"215","87.598654","10.10.10.11","52.28.161.134","TLSv1","256","Application Data, Application Data"
"216","87.636615","52.28.161.134","10.10.10.11","TCP","54","443  >  42008 [ACK] Seq=3988 Ack=544 Win=3120 Len=0"
"217","87.719485","52.25.174.177","10.10.10.11","TCP","66","80  >  48025 [ACK] Seq=1 Ack=162 Win=19200 Len=0 TSval=420261325 TSecr=4294948823"
"218","87.730989","52.25.174.177","10.10.10.11","HTTP","267","HTTP/1.1 200 OK  (application/json)"
"219","87.731017","52.25.174.177","10.10.10.11","TCP","66","80  >  48025 [FIN, ACK] Seq=202 Ack=162 Win=19200 Len=0 TSval=420261327 TSecr=4294948823"
"220","87.731684","10.10.10.11","52.25.174.177","TCP","66","48025  >  80 [ACK] Seq=162 Ack=202 Win=5840 Len=0 TSval=4294948867 TSecr=420261327"
"221","87.767144","10.10.10.11","52.25.174.177","TCP","66","48025  >  80 [FIN, ACK] Seq=162 Ack=203 Win=5840 Len=0 TSval=4294948876 TSecr=420261327"
"222","87.849348","10.10.10.11","224.0.0.251","MDNS","484","Standard query response 0x0000 TXT, cache flush PTR D-Link HNAP Service._dhnap._tcp.local SRV, cache flush 0 0 80 dch.local AAAA, cache flush fe80::6e72:20ff:fec5:175a A, cache flush 10.10.10.11 TXT, cache flush PTR _dhnap._tcp.local PTR D-Link DCH-S160 Configuration Utility._http._tcp.local SRV, cache flush 0 0 80 dch.local PTR _http._tcp.local"
"223","87.850648","10.10.10.11","224.0.0.251","MDNS","97","Standard query 0x0000 PTR D-Link HNAP Service._dhnap._tcp.local, ""QM"" question"
"224","87.931677","52.25.174.177","10.10.10.11","TCP","66","80  >  48025 [ACK] Seq=203 Ack=163 Win=19200 Len=0 TSval=420261378 TSecr=4294948876"
"225","88.289800","10.10.10.11","224.0.0.251","MDNS","335","Standard query response 0x0000 PTR _dhnap._tcp.local PTR D-Link HNAP Service._dhnap._tcp.local SRV, cache flush 0 0 80 dch.local TXT, cache flush"
"226","88.302657","10.10.10.11","224.0.0.251","MDNS","196","Standard query response 0x0000 PTR _http._tcp.local PTR D-Link DCH-S160 Configuration Utility._http._tcp.local SRV, cache flush 0 0 80 dch.local TXT, cache flush"
"227","88.640181","10.10.10.11","224.0.0.251","MDNS","307","Standard query response 0x0000 AAAA, cache flush fe80::6e72:20ff:fec5:175a PTR, cache flush dch.local AAAA, cache flush fe80::6e72:20ff:fec5:175a PTR, cache flush dch175A.local A, cache flush 10.10.10.11 PTR, cache flush dch.local A, cache flush 10.10.10.11 PTR, cache flush dch175A.local"
"228","88.714348","10.10.10.11","224.0.0.251","MDNS","97","Standard query 0x0000 PTR D-Link HNAP Service._dhnap._tcp.local, ""QM"" question"
"229","89.599435","DavidEle_06:08:ba","D-LinkIn_c5:17:5a","ARP","42","Who has 10.10.10.11? Tell 10.10.10.1"
"230","89.599933","D-LinkIn_c5:17:5a","DavidEle_06:08:ba","ARP","42","10.10.10.11 is at 6c:72:20:c5:17:5a"
"231","89.986879","10.10.10.11","10.10.10.1","DNS","77","Standard query 0x0002 AAAA api.dch.dlink.com"
"232","90.012677","10.10.10.1","10.10.10.11","DNS","224","Standard query response 0x0002 AAAA api.dch.dlink.com CNAME eu-api-elb-1068129369.eu-central-1.elb.amazonaws.com SOA ns-1689.awsdns-19.co.uk"
"233","90.013527","10.10.10.11","10.10.10.1","DNS","112","Standard query 0x0003 AAAA eu-api-elb-1068129369.eu-central-1.elb.amazonaws.com"
"234","90.013646","10.10.10.1","10.10.10.11","DNS","112","Standard query response 0x0003 AAAA eu-api-elb-1068129369.eu-central-1.elb.amazonaws.com"
"235","90.016356","10.10.10.11","10.10.10.1","DNS","77","Standard query 0x0004 A api.dch.dlink.com"
"236","90.016477","10.10.10.1","10.10.10.11","DNS","175","Standard query response 0x0004 A api.dch.dlink.com CNAME eu-api-elb-1068129369.eu-central-1.elb.amazonaws.com A 52.28.38.154 A 52.58.68.165"
"237","90.018492","10.10.10.11","52.28.38.154","TCP","74","40892  >  80 [SYN] Seq=0 Win=5840 Len=0 MSS=1460 SACK_PERM=1 TSval=4294949438 TSecr=0 WS=2"
"238","90.020430","52.28.38.154","10.10.10.11","TCP","74","80  >  40892 [SYN, ACK] Seq=0 Ack=1 Win=17898 Len=0 MSS=1380 SACK_PERM=1 TSval=437599466 TSecr=4294949438 WS=256"
"239","90.021154","10.10.10.11","52.28.38.154","TCP","66","40892  >  80 [ACK] Seq=1 Ack=1 Win=5840 Len=0 TSval=4294949439 TSecr=437599466"
"240","90.024232","10.10.10.11","52.28.38.154","HTTP","338","GET /agent/upgrade?p=Rol%2F%2BMO8MOodj0a8XLg9VxfoSACO%2FY5H%2FItv6c6z%2FBB%2BFakkJgRF7Nb4whfNe986TL0HfJzU1MLt7L%2Fml2JSW2U8sghW9%2F6sQyT2VWAlvUU5ebcDOVPSkn2kN6Ad05ud&iv=LQiJQTgk0iFYi3youKuyQw%3D%3D HTTP/1.1 "
"241","90.026094","52.28.38.154","10.10.10.11","TCP","66","80  >  40892 [ACK] Seq=1 Ack=273 Win=19200 Len=0 TSval=437599467 TSecr=4294949439"
"242","90.198362","52.28.38.154","10.10.10.11","HTTP","554","HTTP/1.1 200 OK  (text/html)"
"243","90.198390","52.28.38.154","10.10.10.11","TCP","66","80  >  40892 [FIN, ACK] Seq=489 Ack=273 Win=19200 Len=0 TSval=437599510 TSecr=4294949439"
"244","90.199323","10.10.10.11","52.28.38.154","TCP","66","40892  >  80 [ACK] Seq=273 Ack=489 Win=6912 Len=0 TSval=4294949484 TSecr=437599510"
"245","90.227308","10.10.10.11","52.28.38.154","TCP","66","40892  >  80 [FIN, ACK] Seq=273 Ack=490 Win=6912 Len=0 TSval=4294949491 TSecr=437599510"
"246","90.229137","52.28.38.154","10.10.10.11","TCP","66","80  >  40892 [ACK] Seq=490 Ack=274 Win=19200 Len=0 TSval=437599518 TSecr=4294949491"
"247","90.331580","10.10.10.11","224.0.0.251","MDNS","331","Standard query 0x0000 ANY a.5.7.1.5.c.e.f.f.f.0.2.2.7.e.6.0.0.0.0.0.0.0.0.0.0.0.0.0.8.e.f.ip6.arpa, ""QM"" question ANY dch175A.local, ""QM"" question ANY 11.10.10.10.in-addr.arpa, ""QM"" question ANY dch.local, ""QM"" question A 10.10.10.11 PTR dch175A.local A 10.10.10.11 PTR dch.local AAAA fe80::6e72:20ff:fec5:175a PTR dch175A.local AAAA fe80::6e72:20ff:fec5:175a PTR dch.local"
"248","90.879192","10.10.10.11","224.0.0.251","MDNS","331","Standard query 0x0000 ANY a.5.7.1.5.c.e.f.f.f.0.2.2.7.e.6.0.0.0.0.0.0.0.0.0.0.0.0.0.8.e.f.ip6.arpa, ""QM"" question ANY dch175A.local, ""QM"" question ANY 11.10.10.10.in-addr.arpa, ""QM"" question ANY dch.local, ""QM"" question A 10.10.10.11 PTR dch175A.local A 10.10.10.11 PTR dch.local AAAA fe80::6e72:20ff:fec5:175a PTR dch175A.local AAAA fe80::6e72:20ff:fec5:175a PTR dch.local"
"249","91.119588","10.10.10.11","224.0.0.251","MDNS","331","Standard query 0x0000 ANY a.5.7.1.5.c.e.f.f.f.0.2.2.7.e.6.0.0.0.0.0.0.0.0.0.0.0.0.0.8.e.f.ip6.arpa, ""QM"" question ANY dch175A.local, ""QM"" question ANY 11.10.10.10.in-addr.arpa, ""QM"" question ANY dch.local, ""QM"" question A 10.10.10.11 PTR dch175A.local A 10.10.10.11 PTR dch.local AAAA fe80::6e72:20ff:fec5:175a PTR dch175A.local AAAA fe80::6e72:20ff:fec5:175a PTR dch.local"
"250","91.307120","10.10.10.11","10.10.10.1","DNS","86","Standard query 0x0002 AAAA s3-us-west-2.amazonaws.com"
"251","91.323232","10.10.10.11","224.0.0.251","MDNS","307","Standard query response 0x0000 PTR, cache flush dch.local A, cache flush 10.10.10.11 PTR, cache flush dch175A.local A, cache flush 10.10.10.11 PTR, cache flush dch.local AAAA, cache flush fe80::6e72:20ff:fec5:175a PTR, cache flush dch175A.local AAAA, cache flush fe80::6e72:20ff:fec5:175a"
"252","91.332620","10.10.10.1","10.10.10.11","DNS","170","Standard query response 0x0002 AAAA s3-us-west-2.amazonaws.com SOA ns-1568.awsdns-04.co.uk"
"253","91.333537","10.10.10.11","10.10.10.1","DNS","86","Standard query 0x0003 A s3-us-west-2.amazonaws.com"
"254","91.359802","10.10.10.1","10.10.10.11","DNS","303","Standard query response 0x0003 A s3-us-west-2.amazonaws.com A 54.231.169.40 NS ns-1568.awsdns-04.co.uk NS ns-387.awsdns-48.com NS ns-671.awsdns-19.net NS ns-1397.awsdns-46.org A 205.251.193.131 A 205.251.194.159 A 205.251.197.117 A 205.251.198.32"
"255","91.360911","10.10.10.11","54.231.169.40","TCP","74","52410  >  80 [SYN] Seq=0 Win=5840 Len=0 MSS=1460 SACK_PERM=1 TSval=4294949774 TSecr=0 WS=2"
"256","91.408541","10.10.10.11","224.0.0.251","MDNS","375","Standard query 0x0000 ANY D-Link DCH-S160 Configuration Utility._http._tcp.local, ""QM"" question ANY D-Link HNAP Service._dhnap._tcp.local, ""QM"" question SRV 0 0 80 dch.local TXT SRV 0 0 80 dch.local TXT"
"257","91.545872","54.231.169.40","10.10.10.11","TCP","66","80  >  52410 [SYN, ACK] Seq=0 Ack=1 Win=5840 Len=0 MSS=1380 WS=256 SACK_PERM=1"
"258","91.546468","10.10.10.11","54.231.169.40","TCP","54","52410  >  80 [ACK] Seq=1 Ack=1 Win=5840 Len=0"
"259","91.546953","10.10.10.11","54.231.169.40","HTTP","220","GET /static-us-west.dch.dlink.com/firmware/agent/DCH-S160/D-Link-DCH-S160-1.7.5-AX HTTP/1.1 "
"260","91.659007","10.10.10.11","224.0.0.251","MDNS","375","Standard query 0x0000 ANY D-Link DCH-S160 Configuration Utility._http._tcp.local, ""QM"" question ANY D-Link HNAP Service._dhnap._tcp.local, ""QM"" question SRV 0 0 80 dch.local TXT SRV 0 0 80 dch.local TXT"
"261","91.731804","54.231.169.40","10.10.10.11","TCP","54","80  >  52410 [ACK] Seq=1 Ack=167 Win=15872 Len=0"
"262","91.798490","54.231.169.40","10.10.10.11","TCP","442","80  >  52410 [PSH, ACK] Seq=1 Ack=167 Win=15872 Len=388 [TCP segment of a reassembled PDU]"
"263","91.798594","54.231.169.40","10.10.10.11","TCP","1434","80  >  52410 [ACK] Seq=389 Ack=167 Win=15872 Len=1380 [TCP segment of a reassembled PDU]"
"264","91.798626","54.231.169.40","10.10.10.11","TCP","1434","80  >  52410 [ACK] Seq=1769 Ack=167 Win=15872 Len=1380 [TCP segment of a reassembled PDU]"
"265","91.798745","54.231.169.40","10.10.10.11","TCP","1434","80  >  52410 [PSH, ACK] Seq=3149 Ack=167 Win=15872 Len=1380 [TCP segment of a reassembled PDU]"
"266","91.799765","10.10.10.11","54.231.169.40","TCP","54","52410  >  80 [ACK] Seq=167 Ack=389 Win=6912 Len=0"
"267","91.800710","10.10.10.11","54.231.169.40","TCP","54","52410  >  80 [ACK] Seq=167 Ack=1769 Win=9672 Len=0"
"268","91.801145","10.10.10.11","54.231.169.40","TCP","54","52410  >  80 [ACK] Seq=167 Ack=3149 Win=12432 Len=0"
"269","91.801201","10.10.10.11","54.231.169.40","TCP","54","52410  >  80 [ACK] Seq=167 Ack=4529 Win=15192 Len=0"
"270","91.911009","10.10.10.11","224.0.0.251","MDNS","375","Standard query 0x0000 ANY D-Link DCH-S160 Configuration Utility._http._tcp.local, ""QM"" question ANY D-Link HNAP Service._dhnap._tcp.local, ""QM"" question SRV 0 0 80 dch.local TXT SRV 0 0 80 dch.local TXT"
"271","91.984875","54.231.169.40","10.10.10.11","TCP","1434","80  >  52410 [ACK] Seq=4529 Ack=167 Win=15872 Len=1380 [TCP segment of a reassembled PDU]"
"272","91.984902","54.231.169.40","10.10.10.11","TCP","1434","80  >  52410 [ACK] Seq=5909 Ack=167 Win=15872 Len=1380 [TCP segment of a reassembled PDU]"
"273","91.985696","54.231.169.40","10.10.10.11","TCP","1434","80  >  52410 [PSH, ACK] Seq=7289 Ack=167 Win=15872 Len=1380 [TCP segment of a reassembled PDU]"
"274","91.985721","54.231.169.40","10.10.10.11","TCP","1434","80  >  52410 [ACK] Seq=8669 Ack=167 Win=15872 Len=1380 [TCP segment of a reassembled PDU]"
"275","91.985750","10.10.10.11","54.231.169.40","TCP","54","52410  >  80 [ACK] Seq=167 Ack=5909 Win=17952 Len=0"
"276","91.985767","54.231.169.40","10.10.10.11","TCP","1434","80  >  52410 [ACK] Seq=10049 Ack=167 Win=15872 Len=1380 [TCP segment of a reassembled PDU]"
"277","91.985986","10.10.10.11","54.231.169.40","TCP","54","52410  >  80 [ACK] Seq=167 Ack=7289 Win=17952 Len=0"
"278","91.986153","54.231.169.40","10.10.10.11","TCP","1434","80  >  52410 [PSH, ACK] Seq=11429 Ack=167 Win=15872 Len=1380 [TCP segment of a reassembled PDU]"
"279","91.986179","54.231.169.40","10.10.10.11","TCP","1434","80  >  52410 [ACK] Seq=12809 Ack=167 Win=15872 Len=1380 [TCP segment of a reassembled PDU]"
"280","91.986286","54.231.169.40","10.10.10.11","TCP","1434","80  >  52410 [ACK] Seq=14189 Ack=167 Win=15872 Len=1380 [TCP segment of a reassembled PDU]"
"281","91.986306","54.231.169.40","10.10.10.11","TCP","1434","80  >  52410 [PSH, ACK] Seq=15569 Ack=167 Win=15872 Len=1380 [TCP segment of a reassembled PDU]"
"282","91.986415","54.231.169.40","10.10.10.11","TCP","1434","80  >  52410 [ACK] Seq=16949 Ack=167 Win=15872 Len=1380 [TCP segment of a reassembled PDU]"
"283","91.986537","54.231.169.40","10.10.10.11","TCP","1434","80  >  52410 [ACK] Seq=18329 Ack=167 Win=15872 Len=1380 [TCP segment of a reassembled PDU]"
"284","91.987026","10.10.10.11","54.231.169.40","TCP","54","52410  >  80 [ACK] Seq=167 Ack=8669 Win=17952 Len=0"
"285","91.987872","10.10.10.11","54.231.169.40","TCP","54","52410  >  80 [ACK] Seq=167 Ack=10049 Win=17952 Len=0"
"286","91.988398","10.10.10.11","54.231.169.40","TCP","54","52410  >  80 [ACK] Seq=167 Ack=11429 Win=17952 Len=0"
"287","91.989098","10.10.10.11","54.231.169.40","TCP","54","52410  >  80 [ACK] Seq=167 Ack=14189 Win=17952 Len=0"
"288","91.990030","10.10.10.11","54.231.169.40","TCP","54","52410  >  80 [ACK] Seq=167 Ack=16949 Win=17952 Len=0"
"289","91.990675","10.10.10.11","54.231.169.40","TCP","54","52410  >  80 [ACK] Seq=167 Ack=19709 Win=17952 Len=0"
"290","92.113886","10.10.10.11","224.0.0.251","MDNS","486","Standard query response 0x0000 TXT, cache flush PTR D-Link HNAP Service._dhnap._tcp.local SRV, cache flush 0 0 80 dch.local AAAA, cache flush fe80::6e72:20ff:fec5:175a A, cache flush 10.10.10.11 TXT, cache flush PTR _dhnap._tcp.local PTR D-Link DCH-S160 Configuration Utility._http._tcp.local SRV, cache flush 0 0 80 dch.local PTR _http._tcp.local"
"291","92.116913","10.10.10.11","224.0.0.251","MDNS","97","Standard query 0x0000 PTR D-Link HNAP Service._dhnap._tcp.local, ""QM"" question"
"292","92.170790","54.231.169.40","10.10.10.11","TCP","1434","80  >  52410 [PSH, ACK] Seq=19709 Ack=167 Win=15872 Len=1380 [TCP segment of a reassembled PDU]"
"293","92.170827","54.231.169.40","10.10.10.11","TCP","1434","80  >  52410 [ACK] Seq=21089 Ack=167 Win=15872 Len=1380 [TCP segment of a reassembled PDU]"
"294","92.170834","54.231.169.40","10.10.10.11","TCP","1434","80  >  52410 [ACK] Seq=22469 Ack=167 Win=15872 Len=1380 [TCP segment of a reassembled PDU]"
"295","92.171197","54.231.169.40","10.10.10.11","TCP","1434","80  >  52410 [PSH, ACK] Seq=23849 Ack=167 Win=15872 Len=1380 [TCP segment of a reassembled PDU]"
"296","92.172005","54.231.169.40","10.10.10.11","TCP","1434","80  >  52410 [ACK] Seq=25229 Ack=167 Win=15872 Len=1380 [TCP segment of a reassembled PDU]"
"297","92.172431","10.10.10.11","54.231.169.40","TCP","54","52410  >  80 [ACK] Seq=167 Ack=22469 Win=17952 Len=0"
"298","92.172886","54.231.169.40","10.10.10.11","TCP","1434","80  >  52410 [PSH, ACK] Seq=26609 Ack=167 Win=15872 Len=1380 [TCP segment of a reassembled PDU]"
"299","92.172979","10.10.10.11","54.231.169.40","TCP","54","52410  >  80 [ACK] Seq=167 Ack=25229 Win=17952 Len=0"
"300","92.173448","54.231.169.40","10.10.10.11","TCP","1434","80  >  52410 [ACK] Seq=27989 Ack=167 Win=15872 Len=1380 [TCP segment of a reassembled PDU]"
"301","92.173604","10.10.10.11","54.231.169.40","TCP","54","52410  >  80 [ACK] Seq=167 Ack=27989 Win=17952 Len=0"
"302","92.174213","54.231.169.40","10.10.10.11","TCP","1434","80  >  52410 [ACK] Seq=29369 Ack=167 Win=15872 Len=1380 [TCP segment of a reassembled PDU]"
"303","92.174237","54.231.169.40","10.10.10.11","TCP","1434","80  >  52410 [ACK] Seq=30749 Ack=167 Win=15872 Len=1380 [TCP segment of a reassembled PDU]"
"304","92.175034","54.231.169.40","10.10.10.11","TCP","1434","80  >  52410 [ACK] Seq=32129 Ack=167 Win=15872 Len=1380 [TCP segment of a reassembled PDU]"
"305","92.175057","54.231.169.40","10.10.10.11","TCP","1434","80  >  52410 [ACK] Seq=33509 Ack=167 Win=15872 Len=1380 [TCP segment of a reassembled PDU]"
"306","92.175595","10.10.10.11","54.231.169.40","TCP","54","52410  >  80 [ACK] Seq=167 Ack=30749 Win=17952 Len=0"
"307","92.175639","54.231.169.40","10.10.10.11","TCP","1434","80  >  52410 [ACK] Seq=34889 Ack=167 Win=15872 Len=1380 [TCP segment of a reassembled PDU]"
"308","92.175700","54.231.169.40","10.10.10.11","TCP","1434","80  >  52410 [ACK] Seq=36269 Ack=167 Win=15872 Len=1380 [TCP segment of a reassembled PDU]"
"309","92.176134","10.10.10.11","54.231.169.40","TCP","54","52410  >  80 [ACK] Seq=167 Ack=33509 Win=17952 Len=0"
"310","92.177100","10.10.10.11","54.231.169.40","TCP","54","52410  >  80 [ACK] Seq=167 Ack=36269 Win=17952 Len=0"
"311","92.214414","10.10.10.11","54.231.169.40","TCP","54","52410  >  80 [ACK] Seq=167 Ack=37649 Win=17952 Len=0"
"312","92.357504","10.10.10.11","224.0.0.251","MDNS","263","Standard query response 0x0000 PTR, cache flush dch.local A, cache flush 10.10.10.11 PTR, cache flush dch175A.local PTR, cache flush dch.local AAAA, cache flush fe80::6e72:20ff:fec5:175a PTR, cache flush dch175A.local"
"313","92.357519","54.231.169.40","10.10.10.11","TCP","1434","80  >  52410 [ACK] Seq=37649 Ack=167 Win=15872 Len=1380 [TCP segment of a reassembled PDU]"
"314","92.357555","54.231.169.40","10.10.10.11","TCP","1434","80  >  52410 [ACK] Seq=39029 Ack=167 Win=15872 Len=1380 [TCP segment of a reassembled PDU]"
"315","92.358140","54.231.169.40","10.10.10.11","TCP","1434","80  >  52410 [ACK] Seq=40409 Ack=167 Win=15872 Len=1380 [TCP segment of a reassembled PDU]"
"316","92.358168","54.231.169.40","10.10.10.11","TCP","1434","80  >  52410 [ACK] Seq=41789 Ack=167 Win=15872 Len=1380 [TCP segment of a reassembled PDU]"
"317","92.358605","54.231.169.40","10.10.10.11","TCP","1434","80  >  52410 [PSH, ACK] Seq=43169 Ack=167 Win=15872 Len=1380 [TCP segment of a reassembled PDU]"
"318","92.358636","54.231.169.40","10.10.10.11","TCP","1434","80  >  52410 [PSH, ACK] Seq=44549 Ack=167 Win=15872 Len=1380 [TCP segment of a reassembled PDU]"
"319","92.359215","10.10.10.11","54.231.169.40","TCP","54","52410  >  80 [ACK] Seq=167 Ack=40409 Win=17952 Len=0"
"320","92.359763","10.10.10.11","54.231.169.40","TCP","54","52410  >  80 [ACK] Seq=167 Ack=43169 Win=17952 Len=0"
"321","92.360548","54.231.169.40","10.10.10.11","TCP","1434","80  >  52410 [ACK] Seq=45929 Ack=167 Win=15872 Len=1380 [TCP segment of a reassembled PDU]"
"322","92.360550","10.10.10.11","54.231.169.40","TCP","54","52410  >  80 [ACK] Seq=167 Ack=45929 Win=17952 Len=0"
"323","92.360583","54.231.169.40","10.10.10.11","TCP","1434","80  >  52410 [ACK] Seq=47309 Ack=167 Win=15872 Len=1380 [TCP segment of a reassembled PDU]"
"324","92.361264","54.231.169.40","10.10.10.11","TCP","1434","80  >  52410 [ACK] Seq=48689 Ack=167 Win=15872 Len=1380 [TCP segment of a reassembled PDU]"
"325","92.361387","54.231.169.40","10.10.10.11","TCP","1434","80  >  52410 [ACK] Seq=50069 Ack=167 Win=15872 Len=1380 [TCP segment of a reassembled PDU]"
"326","92.362032","54.231.169.40","10.10.10.11","TCP","1434","80  >  52410 [ACK] Seq=51449 Ack=167 Win=15872 Len=1380 [TCP segment of a reassembled PDU]"
"327","92.362072","54.231.169.40","10.10.10.11","TCP","1434","80  >  52410 [ACK] Seq=52829 Ack=167 Win=15872 Len=1380 [TCP segment of a reassembled PDU]"
"328","92.363065","10.10.10.11","54.231.169.40","TCP","54","52410  >  80 [ACK] Seq=167 Ack=48689 Win=17952 Len=0"
"329","92.363255","10.10.10.11","54.231.169.40","TCP","54","52410  >  80 [ACK] Seq=167 Ack=51449 Win=17952 Len=0"
"330","92.364213","10.10.10.11","54.231.169.40","TCP","54","52410  >  80 [ACK] Seq=167 Ack=54209 Win=17952 Len=0"
"331","92.399499","54.231.169.40","10.10.10.11","TCP","1434","80  >  52410 [ACK] Seq=54209 Ack=167 Win=15872 Len=1380 [TCP segment of a reassembled PDU]"
"332","92.454426","10.10.10.11","54.231.169.40","TCP","54","52410  >  80 [ACK] Seq=167 Ack=55589 Win=17952 Len=0"
"333","92.546531","54.231.169.40","10.10.10.11","TCP","1434","80  >  52410 [ACK] Seq=55589 Ack=167 Win=15872 Len=1380 [TCP segment of a reassembled PDU]"
"334","92.546559","54.231.169.40","10.10.10.11","TCP","1434","80  >  52410 [ACK] Seq=56969 Ack=167 Win=15872 Len=1380 [TCP segment of a reassembled PDU]"
"335","92.546565","54.231.169.40","10.10.10.11","TCP","1434","80  >  52410 [ACK] Seq=58349 Ack=167 Win=15872 Len=1380 [TCP segment of a reassembled PDU]"
"336","92.546623","54.231.169.40","10.10.10.11","TCP","1434","80  >  52410 [ACK] Seq=59729 Ack=167 Win=15872 Len=1380 [TCP segment of a reassembled PDU]"
"337","92.546631","54.231.169.40","10.10.10.11","TCP","1434","80  >  52410 [PSH, ACK] Seq=61109 Ack=167 Win=15872 Len=1380 [TCP segment of a reassembled PDU]"
"338","92.546735","54.231.169.40","10.10.10.11","TCP","1434","80  >  52410 [ACK] Seq=62489 Ack=167 Win=15872 Len=1380 [TCP segment of a reassembled PDU]"
"339","92.547869","10.10.10.11","54.231.169.40","TCP","54","52410  >  80 [ACK] Seq=167 Ack=58349 Win=17952 Len=0"
"340","92.548039","54.231.169.40","10.10.10.11","TCP","1434","80  >  52410 [ACK] Seq=63869 Ack=167 Win=15872 Len=1380 [TCP segment of a reassembled PDU]"
"341","92.548066","54.231.169.40","10.10.10.11","TCP","1434","80  >  52410 [ACK] Seq=65249 Ack=167 Win=15872 Len=1380 [TCP segment of a reassembled PDU]"
"342","92.548353","54.231.169.40","10.10.10.11","TCP","1434","80  >  52410 [ACK] Seq=66629 Ack=167 Win=15872 Len=1380 [TCP segment of a reassembled PDU]"
"343","92.548487","54.231.169.40","10.10.10.11","TCP","1434","80  >  52410 [ACK] Seq=68009 Ack=167 Win=15872 Len=1380 [TCP segment of a reassembled PDU]"
"344","92.549231","54.231.169.40","10.10.10.11","TCP","1434","80  >  52410 [ACK] Seq=69389 Ack=167 Win=15872 Len=1380 [TCP segment of a reassembled PDU]"
"345","92.549252","54.231.169.40","10.10.10.11","TCP","1434","80  >  52410 [ACK] Seq=70769 Ack=167 Win=15872 Len=1380 [TCP segment of a reassembled PDU]"
"346","92.549384","10.10.10.11","54.231.169.40","TCP","54","52410  >  80 [ACK] Seq=167 Ack=61109 Win=17952 Len=0"
"347","92.552708","10.10.10.11","54.231.169.40","TCP","54","52410  >  80 [ACK] Seq=167 Ack=63869 Win=17952 Len=0"
"348","92.552845","10.10.10.11","54.231.169.40","TCP","54","52410  >  80 [ACK] Seq=167 Ack=66629 Win=17952 Len=0"
"349","92.552929","10.10.10.11","54.231.169.40","TCP","54","52410  >  80 [ACK] Seq=167 Ack=69389 Win=17952 Len=0"
"350","92.553019","10.10.10.11","54.231.169.40","TCP","54","52410  >  80 [ACK] Seq=167 Ack=72149 Win=17952 Len=0"
"351","92.596620","52.28.161.134","10.10.10.11","TCP","54","[TCP Keep-Alive] 443  >  42008 [ACK] Seq=3987 Ack=544 Win=3120 Len=0"
"352","92.597171","10.10.10.11","52.28.161.134","TCP","54","[TCP Keep-Alive ACK] 42008  >  443 [ACK] Seq=544 Ack=3988 Win=11360 Len=0"
"353","92.640909","54.231.169.40","10.10.10.11","TCP","1434","80  >  52410 [ACK] Seq=72149 Ack=167 Win=15872 Len=1380 [TCP segment of a reassembled PDU]"
"354","92.678449","10.10.10.11","54.231.169.40","TCP","54","52410  >  80 [ACK] Seq=167 Ack=73529 Win=17952 Len=0"
"355","92.732978","54.231.169.40","10.10.10.11","TCP","1434","80  >  52410 [ACK] Seq=73529 Ack=167 Win=15872 Len=1380 [TCP segment of a reassembled PDU]"
"356","92.733005","54.231.169.40","10.10.10.11","TCP","1434","80  >  52410 [ACK] Seq=74909 Ack=167 Win=15872 Len=1380 [TCP segment of a reassembled PDU]"
"357","92.734400","54.231.169.40","10.10.10.11","TCP","1434","80  >  52410 [ACK] Seq=76289 Ack=167 Win=15872 Len=1380 [TCP segment of a reassembled PDU]"
"358","92.734424","54.231.169.40","10.10.10.11","TCP","1434","80  >  52410 [PSH, ACK] Seq=77669 Ack=167 Win=15872 Len=1380 [TCP segment of a reassembled PDU]"
"359","92.736115","10.10.10.11","54.231.169.40","TCP","54","52410  >  80 [ACK] Seq=167 Ack=76289 Win=17952 Len=0"
"360","92.736732","10.10.10.11","54.231.169.40","TCP","54","52410  >  80 [ACK] Seq=167 Ack=79049 Win=17952 Len=0"
"361","92.739767","54.231.169.40","10.10.10.11","TCP","1434","80  >  52410 [ACK] Seq=79049 Ack=167 Win=15872 Len=1380 [TCP segment of a reassembled PDU]"
"362","92.739794","54.231.169.40","10.10.10.11","TCP","1434","80  >  52410 [ACK] Seq=80429 Ack=167 Win=15872 Len=1380 [TCP segment of a reassembled PDU]"
"363","92.739858","54.231.169.40","10.10.10.11","TCP","1434","80  >  52410 [ACK] Seq=81809 Ack=167 Win=15872 Len=1380 [TCP segment of a reassembled PDU]"
"364","92.739867","54.231.169.40","10.10.10.11","TCP","1434","80  >  52410 [ACK] Seq=83189 Ack=167 Win=15872 Len=1380 [TCP segment of a reassembled PDU]"
"365","92.739969","54.231.169.40","10.10.10.11","TCP","1434","80  >  52410 [ACK] Seq=84569 Ack=167 Win=15872 Len=1380 [TCP segment of a reassembled PDU]"
"366","92.739983","54.231.169.40","10.10.10.11","TCP","1434","80  >  52410 [ACK] Seq=85949 Ack=167 Win=15872 Len=1380 [TCP segment of a reassembled PDU]"
"367","92.740099","54.231.169.40","10.10.10.11","TCP","1434","80  >  52410 [ACK] Seq=87329 Ack=167 Win=15872 Len=1380 [TCP segment of a reassembled PDU]"
"368","92.740112","54.231.169.40","10.10.10.11","TCP","1434","80  >  52410 [ACK] Seq=88709 Ack=167 Win=15872 Len=1380 [TCP segment of a reassembled PDU]"
"369","92.741530","10.10.10.11","54.231.169.40","TCP","54","52410  >  80 [ACK] Seq=167 Ack=81809 Win=17952 Len=0"
"370","92.742788","10.10.10.11","54.231.169.40","TCP","54","52410  >  80 [ACK] Seq=167 Ack=84569 Win=17952 Len=0"
"371","92.743347","10.10.10.11","54.231.169.40","TCP","54","52410  >  80 [ACK] Seq=167 Ack=87329 Win=17952 Len=0"
"372","92.743944","10.10.10.11","54.231.169.40","TCP","54","52410  >  80 [ACK] Seq=167 Ack=90089 Win=17952 Len=0"
"373","92.863530","54.231.169.40","10.10.10.11","TCP","1434","80  >  52410 [ACK] Seq=90089 Ack=167 Win=15872 Len=1380 [TCP segment of a reassembled PDU]"
"374","92.902435","10.10.10.11","54.231.169.40","TCP","54","52410  >  80 [ACK] Seq=167 Ack=91469 Win=17952 Len=0"
"375","92.921164","54.231.169.40","10.10.10.11","TCP","1434","80  >  52410 [ACK] Seq=91469 Ack=167 Win=15872 Len=1380 [TCP segment of a reassembled PDU]"
"376","92.921191","54.231.169.40","10.10.10.11","TCP","1434","80  >  52410 [ACK] Seq=92849 Ack=167 Win=15872 Len=1380 [TCP segment of a reassembled PDU]"
"377","92.921716","54.231.169.40","10.10.10.11","TCP","1434","80  >  52410 [ACK] Seq=94229 Ack=167 Win=15872 Len=1380 [TCP segment of a reassembled PDU]"
"378","92.921740","54.231.169.40","10.10.10.11","TCP","1434","80  >  52410 [PSH, ACK] Seq=95609 Ack=167 Win=15872 Len=1380 [TCP segment of a reassembled PDU]"
"379","92.922900","10.10.10.11","54.231.169.40","TCP","54","52410  >  80 [ACK] Seq=167 Ack=94229 Win=17952 Len=0"
"380","92.923127","10.10.10.11","54.231.169.40","TCP","54","52410  >  80 [ACK] Seq=167 Ack=96989 Win=17952 Len=0"
"381","92.926601","54.231.169.40","10.10.10.11","TCP","1434","80  >  52410 [ACK] Seq=96989 Ack=167 Win=15872 Len=1380 [TCP segment of a reassembled PDU]"
"382","92.926635","54.231.169.40","10.10.10.11","TCP","1434","80  >  52410 [ACK] Seq=98369 Ack=167 Win=15872 Len=1380 [TCP segment of a reassembled PDU]"
"383","92.927763","10.10.10.11","54.231.169.40","TCP","54","52410  >  80 [ACK] Seq=167 Ack=99749 Win=17952 Len=0"
"384","92.927771","54.231.169.40","10.10.10.11","TCP","1434","80  >  52410 [ACK] Seq=99749 Ack=167 Win=15872 Len=1380 [TCP segment of a reassembled PDU]"
"385","92.927798","54.231.169.40","10.10.10.11","TCP","1434","80  >  52410 [ACK] Seq=101129 Ack=167 Win=15872 Len=1380 [TCP segment of a reassembled PDU]"
"386","92.928375","54.231.169.40","10.10.10.11","TCP","1434","80  >  52410 [ACK] Seq=102509 Ack=167 Win=15872 Len=1380 [TCP segment of a reassembled PDU]"
"387","92.928409","54.231.169.40","10.10.10.11","TCP","1434","80  >  52410 [ACK] Seq=103889 Ack=167 Win=15872 Len=1380 [TCP segment of a reassembled PDU]"
"388","92.928894","54.231.169.40","10.10.10.11","TCP","1434","80  >  52410 [ACK] Seq=105269 Ack=167 Win=15872 Len=1380 [TCP segment of a reassembled PDU]"
"389","92.928991","54.231.169.40","10.10.10.11","TCP","1434","80  >  52410 [ACK] Seq=106649 Ack=167 Win=15872 Len=1380 [TCP segment of a reassembled PDU]"
"390","92.929159","10.10.10.11","54.231.169.40","TCP","54","52410  >  80 [ACK] Seq=167 Ack=102509 Win=17952 Len=0"
"391","92.930446","10.10.10.11","54.231.169.40","TCP","54","52410  >  80 [ACK] Seq=167 Ack=105269 Win=17952 Len=0"
"392","92.930623","10.10.10.11","54.231.169.40","TCP","54","52410  >  80 [ACK] Seq=167 Ack=108029 Win=17952 Len=0"
"393","93.088524","54.231.169.40","10.10.10.11","TCP","1434","80  >  52410 [ACK] Seq=108029 Ack=167 Win=15872 Len=1380 [TCP segment of a reassembled PDU]"
"394","93.109053","54.231.169.40","10.10.10.11","TCP","1434","80  >  52410 [ACK] Seq=109409 Ack=167 Win=15872 Len=1380 [TCP segment of a reassembled PDU]"
"395","93.109079","54.231.169.40","10.10.10.11","TCP","1434","80  >  52410 [ACK] Seq=110789 Ack=167 Win=15872 Len=1380 [TCP segment of a reassembled PDU]"
"396","93.109127","54.231.169.40","10.10.10.11","TCP","1434","80  >  52410 [PSH, ACK] Seq=112169 Ack=167 Win=15872 Len=1380 [TCP segment of a reassembled PDU]"
"397","93.109136","54.231.169.40","10.10.10.11","TCP","1434","80  >  52410 [PSH, ACK] Seq=113549 Ack=167 Win=15872 Len=1380 [TCP segment of a reassembled PDU]"
"398","93.110655","10.10.10.11","54.231.169.40","TCP","54","52410  >  80 [ACK] Seq=167 Ack=110789 Win=17952 Len=0"
"399","93.110845","10.10.10.11","54.231.169.40","TCP","54","52410  >  80 [ACK] Seq=167 Ack=113549 Win=17952 Len=0"
"400","93.113021","54.231.169.40","10.10.10.11","TCP","1434","80  >  52410 [ACK] Seq=114929 Ack=167 Win=15872 Len=1380 [TCP segment of a reassembled PDU]"
"401","93.113049","54.231.169.40","10.10.10.11","TCP","1434","80  >  52410 [ACK] Seq=116309 Ack=167 Win=15872 Len=1380 [TCP segment of a reassembled PDU]"
"402","93.114121","54.231.169.40","10.10.10.11","TCP","1434","80  >  52410 [ACK] Seq=117689 Ack=167 Win=15872 Len=1380 [TCP segment of a reassembled PDU]"
"403","93.114149","54.231.169.40","10.10.10.11","TCP","1434","80  >  52410 [ACK] Seq=119069 Ack=167 Win=15872 Len=1380 [TCP segment of a reassembled PDU]"
"404","93.115466","54.231.169.40","10.10.10.11","TCP","1434","80  >  52410 [ACK] Seq=120449 Ack=167 Win=15872 Len=1380 [TCP segment of a reassembled PDU]"
"405","93.115490","54.231.169.40","10.10.10.11","TCP","1434","80  >  52410 [ACK] Seq=121829 Ack=167 Win=15872 Len=1380 [TCP segment of a reassembled PDU]"
"406","93.115562","54.231.169.40","10.10.10.11","TCP","1434","80  >  52410 [ACK] Seq=123209 Ack=167 Win=15872 Len=1380 [TCP segment of a reassembled PDU]"
"407","93.115571","54.231.169.40","10.10.10.11","TCP","1434","80  >  52410 [ACK] Seq=124589 Ack=167 Win=15872 Len=1380 [TCP segment of a reassembled PDU]"
"408","93.116877","10.10.10.11","54.231.169.40","TCP","54","52410  >  80 [ACK] Seq=167 Ack=116309 Win=17952 Len=0"
"409","93.117721","10.10.10.11","54.231.169.40","TCP","54","52410  >  80 [ACK] Seq=167 Ack=119069 Win=17952 Len=0"
"410","93.118352","10.10.10.11","54.231.169.40","TCP","54","52410  >  80 [ACK] Seq=167 Ack=121829 Win=17952 Len=0"
"411","93.119233","10.10.10.11","54.231.169.40","TCP","54","52410  >  80 [ACK] Seq=167 Ack=124589 Win=17952 Len=0"
"412","93.149388","10.10.10.11","224.0.0.251","MDNS","486","Standard query response 0x0000 TXT, cache flush PTR D-Link HNAP Service._dhnap._tcp.local SRV, cache flush 0 0 80 dch.local AAAA, cache flush fe80::6e72:20ff:fec5:175a A, cache flush 10.10.10.11 TXT, cache flush PTR _dhnap._tcp.local PTR D-Link DCH-S160 Configuration Utility._http._tcp.local SRV, cache flush 0 0 80 dch.local PTR _http._tcp.local"
"413","93.153420","10.10.10.11","224.0.0.251","MDNS","97","Standard query 0x0000 PTR D-Link HNAP Service._dhnap._tcp.local, ""QM"" question"
"414","93.158487","10.10.10.11","54.231.169.40","TCP","54","52410  >  80 [ACK] Seq=167 Ack=125969 Win=17952 Len=0"
"415","93.296732","54.231.169.40","10.10.10.11","TCP","1434","80  >  52410 [ACK] Seq=125969 Ack=167 Win=15872 Len=1380 [TCP segment of a reassembled PDU]"
"416","93.296759","54.231.169.40","10.10.10.11","TCP","1434","80  >  52410 [ACK] Seq=127349 Ack=167 Win=15872 Len=1380 [TCP segment of a reassembled PDU]"
"417","93.296826","54.231.169.40","10.10.10.11","TCP","1434","80  >  52410 [ACK] Seq=128729 Ack=167 Win=15872 Len=1380 [TCP segment of a reassembled PDU]"
"418","93.296834","54.231.169.40","10.10.10.11","TCP","1434","80  >  52410 [PSH, ACK] Seq=130109 Ack=167 Win=15872 Len=1380 [TCP segment of a reassembled PDU]"
"419","93.298406","10.10.10.11","54.231.169.40","TCP","54","52410  >  80 [ACK] Seq=167 Ack=128729 Win=17952 Len=0"
"420","93.298952","10.10.10.11","54.231.169.40","TCP","54","52410  >  80 [ACK] Seq=167 Ack=131489 Win=17952 Len=0"
"421","93.301892","54.231.169.40","10.10.10.11","TCP","1434","80  >  52410 [PSH, ACK] Seq=131489 Ack=167 Win=15872 Len=1380 [TCP segment of a reassembled PDU]"
"422","93.301926","54.231.169.40","10.10.10.11","TCP","1434","80  >  52410 [ACK] Seq=132869 Ack=167 Win=15872 Len=1380 [TCP segment of a reassembled PDU]"
"423","93.302734","54.231.169.40","10.10.10.11","TCP","1434","80  >  52410 [ACK] Seq=134249 Ack=167 Win=15872 Len=1380 [TCP segment of a reassembled PDU]"
"424","93.302756","54.231.169.40","10.10.10.11","TCP","1434","80  >  52410 [ACK] Seq=135629 Ack=167 Win=15872 Len=1380 [TCP segment of a reassembled PDU]"
"425","93.303228","10.10.10.11","54.231.169.40","TCP","54","52410  >  80 [ACK] Seq=167 Ack=134249 Win=17952 Len=0"
"426","93.303305","54.231.169.40","10.10.10.11","TCP","1434","80  >  52410 [ACK] Seq=137009 Ack=167 Win=15872 Len=1380 [TCP segment of a reassembled PDU]"
"427","93.303343","54.231.169.40","10.10.10.11","TCP","1434","80  >  52410 [ACK] Seq=138389 Ack=167 Win=15872 Len=1380 [TCP segment of a reassembled PDU]"
"428","93.304224","54.231.169.40","10.10.10.11","TCP","1434","80  >  52410 [ACK] Seq=139769 Ack=167 Win=15872 Len=1380 [TCP segment of a reassembled PDU]"
"429","93.304248","54.231.169.40","10.10.10.11","TCP","1434","80  >  52410 [ACK] Seq=141149 Ack=167 Win=15872 Len=1380 [TCP segment of a reassembled PDU]"
"430","93.306077","10.10.10.11","54.231.169.40","TCP","54","52410  >  80 [ACK] Seq=167 Ack=137009 Win=17952 Len=0"
"431","93.306680","10.10.10.11","54.231.169.40","TCP","54","52410  >  80 [ACK] Seq=167 Ack=139769 Win=17952 Len=0"
"432","93.307436","10.10.10.11","54.231.169.40","TCP","54","52410  >  80 [ACK] Seq=167 Ack=142529 Win=17952 Len=0"
"433","93.343611","54.231.169.40","10.10.10.11","TCP","1434","80  >  52410 [ACK] Seq=142529 Ack=167 Win=15872 Len=1380 [TCP segment of a reassembled PDU]"
"434","93.398492","10.10.10.11","54.231.169.40","TCP","54","52410  >  80 [ACK] Seq=167 Ack=143909 Win=17952 Len=0"
"435","93.483462","54.231.169.40","10.10.10.11","TCP","1434","80  >  52410 [ACK] Seq=143909 Ack=167 Win=15872 Len=1380 [TCP segment of a reassembled PDU]"
"436","93.483490","54.231.169.40","10.10.10.11","TCP","1434","80  >  52410 [ACK] Seq=145289 Ack=167 Win=15872 Len=1380 [TCP segment of a reassembled PDU]"
"437","93.483948","54.231.169.40","10.10.10.11","TCP","1434","80  >  52410 [ACK] Seq=146669 Ack=167 Win=15872 Len=1380 [TCP segment of a reassembled PDU]"
"438","93.483971","54.231.169.40","10.10.10.11","TCP","1434","80  >  52410 [PSH, ACK] Seq=148049 Ack=167 Win=15872 Len=1380 [TCP segment of a reassembled PDU]"
"439","93.484807","10.10.10.11","54.231.169.40","TCP","54","52410  >  80 [ACK] Seq=167 Ack=146669 Win=17952 Len=0"
"440","93.485552","10.10.10.11","54.231.169.40","TCP","54","52410  >  80 [ACK] Seq=167 Ack=149429 Win=17952 Len=0"
"441","93.488249","54.231.169.40","10.10.10.11","TCP","1434","80  >  52410 [PSH, ACK] Seq=149429 Ack=167 Win=15872 Len=1380 [TCP segment of a reassembled PDU]"
"442","93.488282","54.231.169.40","10.10.10.11","TCP","1434","80  >  52410 [ACK] Seq=150809 Ack=167 Win=15872 Len=1380 [TCP segment of a reassembled PDU]"
"443","93.489292","10.10.10.11","54.231.169.40","TCP","54","52410  >  80 [ACK] Seq=167 Ack=152189 Win=17952 Len=0"
"444","93.491305","54.231.169.40","10.10.10.11","TCP","1434","80  >  52410 [ACK] Seq=152189 Ack=167 Win=15872 Len=1380 [TCP segment of a reassembled PDU]"
"445","93.491333","54.231.169.40","10.10.10.11","TCP","1434","80  >  52410 [ACK] Seq=153569 Ack=167 Win=15872 Len=1380 [TCP segment of a reassembled PDU]"
"446","93.491660","54.231.169.40","10.10.10.11","TCP","1434","80  >  52410 [ACK] Seq=154949 Ack=167 Win=15872 Len=1380 [TCP segment of a reassembled PDU]"
"447","93.491683","54.231.169.40","10.10.10.11","TCP","1434","80  >  52410 [ACK] Seq=156329 Ack=167 Win=15872 Len=1380 [TCP segment of a reassembled PDU]"
"448","93.492403","54.231.169.40","10.10.10.11","TCP","1434","80  >  52410 [ACK] Seq=157709 Ack=167 Win=15872 Len=1380 [TCP segment of a reassembled PDU]"
"449","93.492424","54.231.169.40","10.10.10.11","TCP","1434","80  >  52410 [ACK] Seq=159089 Ack=167 Win=15872 Len=1380 [TCP segment of a reassembled PDU]"
"450","93.494564","10.10.10.11","54.231.169.40","TCP","54","52410  >  80 [ACK] Seq=167 Ack=154949 Win=17952 Len=0"
"451","93.494782","10.10.10.11","54.231.169.40","TCP","54","52410  >  80 [ACK] Seq=167 Ack=157709 Win=17952 Len=0"
"452","93.494891","10.10.10.11","54.231.169.40","TCP","54","52410  >  80 [ACK] Seq=167 Ack=160469 Win=17952 Len=0"
"453","93.583605","54.231.169.40","10.10.10.11","TCP","1434","80  >  52410 [ACK] Seq=160469 Ack=167 Win=15872 Len=1380 [TCP segment of a reassembled PDU]"
"454","93.622443","10.10.10.11","54.231.169.40","TCP","54","52410  >  80 [ACK] Seq=167 Ack=161849 Win=17952 Len=0"
"455","93.669892","54.231.169.40","10.10.10.11","TCP","1434","80  >  52410 [ACK] Seq=161849 Ack=167 Win=15872 Len=1380 [TCP segment of a reassembled PDU]"
"456","93.669920","54.231.169.40","10.10.10.11","TCP","1434","80  >  52410 [ACK] Seq=163229 Ack=167 Win=15872 Len=1380 [TCP segment of a reassembled PDU]"
"457","93.670580","54.231.169.40","10.10.10.11","TCP","1434","80  >  52410 [PSH, ACK] Seq=164609 Ack=167 Win=15872 Len=1380 [TCP segment of a reassembled PDU]"
"458","93.670609","54.231.169.40","10.10.10.11","TCP","1434","80  >  52410 [PSH, ACK] Seq=165989 Ack=167 Win=15872 Len=1380 [TCP segment of a reassembled PDU]"
"459","93.671311","10.10.10.11","54.231.169.40","TCP","54","52410  >  80 [ACK] Seq=167 Ack=164609 Win=17952 Len=0"
"460","93.671979","10.10.10.11","54.231.169.40","TCP","54","52410  >  80 [ACK] Seq=167 Ack=167369 Win=17952 Len=0"
"461","93.674363","54.231.169.40","10.10.10.11","TCP","1434","80  >  52410 [ACK] Seq=167369 Ack=167 Win=15872 Len=1380 [TCP segment of a reassembled PDU]"
"462","93.674391","54.231.169.40","10.10.10.11","TCP","1434","80  >  52410 [ACK] Seq=168749 Ack=167 Win=15872 Len=1380 [TCP segment of a reassembled PDU]"
"463","93.675901","10.10.10.11","54.231.169.40","TCP","54","52410  >  80 [ACK] Seq=167 Ack=170129 Win=17952 Len=0"
"464","93.679625","54.231.169.40","10.10.10.11","TCP","1434","80  >  52410 [ACK] Seq=170129 Ack=167 Win=15872 Len=1380 [TCP segment of a reassembled PDU]"
"465","93.679652","54.231.169.40","10.10.10.11","TCP","1434","80  >  52410 [ACK] Seq=171509 Ack=167 Win=15872 Len=1380 [TCP segment of a reassembled PDU]"
"466","93.679921","54.231.169.40","10.10.10.11","TCP","1434","80  >  52410 [ACK] Seq=172889 Ack=167 Win=15872 Len=1380 [TCP segment of a reassembled PDU]"
"467","93.679948","54.231.169.40","10.10.10.11","TCP","1434","80  >  52410 [ACK] Seq=174269 Ack=167 Win=15872 Len=1380 [TCP segment of a reassembled PDU]"
"468","93.679954","54.231.169.40","10.10.10.11","TCP","1434","80  >  52410 [ACK] Seq=175649 Ack=167 Win=15872 Len=1380 [TCP segment of a reassembled PDU]"
"469","93.680014","54.231.169.40","10.10.10.11","TCP","1434","80  >  52410 [ACK] Seq=177029 Ack=167 Win=15872 Len=1380 [TCP segment of a reassembled PDU]"
"470","93.682116","10.10.10.11","54.231.169.40","TCP","54","52410  >  80 [ACK] Seq=167 Ack=172889 Win=17952 Len=0"
"471","93.682316","10.10.10.11","54.231.169.40","TCP","54","52410  >  80 [ACK] Seq=167 Ack=175649 Win=17952 Len=0"
"472","93.682427","10.10.10.11","54.231.169.40","TCP","54","52410  >  80 [ACK] Seq=167 Ack=178409 Win=17952 Len=0"
"473","93.807551","54.231.169.40","10.10.10.11","TCP","1434","80  >  52410 [ACK] Seq=178409 Ack=167 Win=15872 Len=1380 [TCP segment of a reassembled PDU]"
"474","93.846443","10.10.10.11","54.231.169.40","TCP","54","52410  >  80 [ACK] Seq=167 Ack=179789 Win=17952 Len=0"
"475","93.856346","54.231.169.40","10.10.10.11","TCP","1434","80  >  52410 [ACK] Seq=179789 Ack=167 Win=15872 Len=1380 [TCP segment of a reassembled PDU]"
"476","93.856374","54.231.169.40","10.10.10.11","TCP","1434","80  >  52410 [ACK] Seq=181169 Ack=167 Win=15872 Len=1380 [TCP segment of a reassembled PDU]"
"477","93.857181","54.231.169.40","10.10.10.11","TCP","1434","80  >  52410 [PSH, ACK] Seq=182549 Ack=167 Win=15872 Len=1380 [TCP segment of a reassembled PDU]"
"478","93.857207","54.231.169.40","10.10.10.11","TCP","1434","80  >  52410 [PSH, ACK] Seq=183929 Ack=167 Win=15872 Len=1380 [TCP segment of a reassembled PDU]"
"479","93.858087","10.10.10.11","54.231.169.40","TCP","54","52410  >  80 [ACK] Seq=167 Ack=182549 Win=17952 Len=0"
"480","93.858333","10.10.10.11","54.231.169.40","TCP","54","52410  >  80 [ACK] Seq=167 Ack=185309 Win=17952 Len=0"
"481","93.861005","54.231.169.40","10.10.10.11","TCP","1434","80  >  52410 [ACK] Seq=185309 Ack=167 Win=15872 Len=1380 [TCP segment of a reassembled PDU]"
"482","93.861030","54.231.169.40","10.10.10.11","TCP","1434","80  >  52410 [ACK] Seq=186689 Ack=167 Win=15872 Len=1380 [TCP segment of a reassembled PDU]"
"483","93.862054","10.10.10.11","54.231.169.40","TCP","54","52410  >  80 [ACK] Seq=167 Ack=188069 Win=17952 Len=0"
"484","93.867174","54.231.169.40","10.10.10.11","TCP","1434","80  >  52410 [ACK] Seq=188069 Ack=167 Win=15872 Len=1380 [TCP segment of a reassembled PDU]"
"485","93.867201","54.231.169.40","10.10.10.11","TCP","1434","80  >  52410 [ACK] Seq=189449 Ack=167 Win=15872 Len=1380 [TCP segment of a reassembled PDU]"
"486","93.867266","54.231.169.40","10.10.10.11","TCP","1434","80  >  52410 [ACK] Seq=190829 Ack=167 Win=15872 Len=1380 [TCP segment of a reassembled PDU]"
"487","93.867275","54.231.169.40","10.10.10.11","TCP","1434","80  >  52410 [ACK] Seq=192209 Ack=167 Win=15872 Len=1380 [TCP segment of a reassembled PDU]"
"488","93.867424","54.231.169.40","10.10.10.11","TCP","1434","80  >  52410 [ACK] Seq=193589 Ack=167 Win=15872 Len=1380 [TCP segment of a reassembled PDU]"
"489","93.867438","54.231.169.40","10.10.10.11","TCP","1434","80  >  52410 [ACK] Seq=194969 Ack=167 Win=15872 Len=1380 [TCP segment of a reassembled PDU]"
"490","93.869887","10.10.10.11","54.231.169.40","TCP","54","52410  >  80 [ACK] Seq=167 Ack=190829 Win=17952 Len=0"
"491","93.870338","10.10.10.11","54.231.169.40","TCP","54","52410  >  80 [ACK] Seq=167 Ack=193589 Win=17952 Len=0"
"492","93.870573","10.10.10.11","54.231.169.40","TCP","54","52410  >  80 [ACK] Seq=167 Ack=196349 Win=17952 Len=0"
"493","94.031205","54.231.169.40","10.10.10.11","HTTP","154","HTTP/1.1 200 OK  (binary/octet-stream)"
"494","94.047952","10.10.10.11","54.231.169.40","TCP","54","52410  >  80 [FIN, ACK] Seq=167 Ack=196450 Win=17952 Len=0"
"495","94.232981","54.231.169.40","10.10.10.11","TCP","54","80  >  52410 [ACK] Seq=196450 Ack=168 Win=15872 Len=0"
"496","94.393031","10.10.10.11","224.0.0.251","MDNS","307","Standard query response 0x0000 PTR, cache flush dch.local A, cache flush 10.10.10.11 A, cache flush 10.10.10.11 PTR, cache flush dch175A.local PTR, cache flush dch.local AAAA, cache flush fe80::6e72:20ff:fec5:175a AAAA, cache flush fe80::6e72:20ff:fec5:175a PTR, cache flush dch175A.local"
"497","94.503068","10.10.10.11","52.28.161.134","TCP","54","42008  >  443 [FIN, ACK] Seq=544 Ack=3988 Win=11360 Len=0"
"498","94.504833","52.28.161.134","10.10.10.11","TLSv1","91","Encrypted Alert"
"499","94.504862","52.28.161.134","10.10.10.11","TCP","54","443  >  42008 [FIN, ACK] Seq=4025 Ack=545 Win=3120 Len=0"
"500","94.505481","10.10.10.11","52.28.161.134","TCP","54","42008  >  443 [RST] Seq=545 Win=0 Len=0"
"501","94.505717","10.10.10.11","52.28.161.134","TCP","54","42008  >  443 [RST] Seq=545 Win=0 Len=0"
"502","95.185328","10.10.10.11","224.0.0.251","MDNS","486","Standard query response 0x0000 TXT, cache flush PTR D-Link HNAP Service._dhnap._tcp.local SRV, cache flush 0 0 80 dch.local AAAA, cache flush fe80::6e72:20ff:fec5:175a A, cache flush 10.10.10.11 TXT, cache flush PTR _dhnap._tcp.local PTR D-Link DCH-S160 Configuration Utility._http._tcp.local SRV, cache flush 0 0 80 dch.local PTR _http._tcp.local"
"503","95.186937","10.10.10.11","224.0.0.251","MDNS","97","Standard query 0x0000 PTR D-Link HNAP Service._dhnap._tcp.local, ""QM"" question"
"504","96.350851","10.10.10.11","10.10.10.1","DNS","77","Standard query 0x0002 A api.dch.dlink.com"
"505","96.350947","10.10.10.1","10.10.10.11","DNS","175","Standard query response 0x0002 A api.dch.dlink.com CNAME eu-api-elb-1068129369.eu-central-1.elb.amazonaws.com A 52.58.68.165 A 52.28.38.154"
"506","96.352003","10.10.10.11","52.58.68.165","TCP","74","38649  >  443 [SYN] Seq=0 Win=5840 Len=0 MSS=1460 SACK_PERM=1 TSval=4294951022 TSecr=0 WS=2"
"507","96.354475","52.58.68.165","10.10.10.11","TCP","74","443  >  38649 [SYN, ACK] Seq=0 Ack=1 Win=17898 Len=0 MSS=1380 SACK_PERM=1 TSval=437600664 TSecr=4294951022 WS=256"
"508","96.355113","10.10.10.11","52.58.68.165","TCP","66","38649  >  443 [ACK] Seq=1 Ack=1 Win=5840 Len=0 TSval=4294951023 TSecr=437600664"
"509","96.800194","10.10.10.11","52.58.68.165","TLSv1.2","365","Client Hello"
"510","96.802455","52.58.68.165","10.10.10.11","TCP","66","443  >  38649 [ACK] Seq=1 Ack=300 Win=19200 Len=0 TSval=437600776 TSecr=4294951132"
"511","96.804461","52.58.68.165","10.10.10.11","TLSv1.2","1434","Server Hello"
"512","96.804489","52.58.68.165","10.10.10.11","TCP","1434","443  >  38649 [ACK] Seq=1369 Ack=300 Win=19200 Len=1368 TSval=437600776 TSecr=4294951132 [TCP segment of a reassembled PDU]"
"513","96.804495","52.58.68.165","10.10.10.11","TLSv1.2","1149","Certificate, Server Key Exchange, Server Hello Done"
"514","96.805421","10.10.10.11","52.58.68.165","TCP","66","38649  >  443 [ACK] Seq=300 Ack=1369 Win=8576 Len=0 TSval=4294951135 TSecr=437600776"
"515","96.805957","10.10.10.11","52.58.68.165","TCP","66","38649  >  443 [ACK] Seq=300 Ack=2737 Win=11312 Len=0 TSval=4294951135 TSecr=437600776"
"516","96.806152","10.10.10.11","52.58.68.165","TCP","66","38649  >  443 [ACK] Seq=300 Ack=3820 Win=14048 Len=0 TSval=4294951135 TSecr=437600776"
"517","96.933612","10.10.10.11","52.58.68.165","TLSv1.2","192","Client Key Exchange, Change Cipher Spec, Encrypted Handshake Message"
"518","96.936438","52.58.68.165","10.10.10.11","TLSv1.2","292","New Session Ticket, Change Cipher Spec, Encrypted Handshake Message"
"519","96.937000","10.10.10.11","52.58.68.165","TCP","66","38649  >  443 [ACK] Seq=426 Ack=4046 Win=14048 Len=0 TSval=4294951168 TSecr=437600809"
"520","96.939400","10.10.10.11","52.58.68.165","TLSv1.2","527","Application Data"
"521","96.978413","52.58.68.165","10.10.10.11","TCP","66","443  >  38649 [ACK] Seq=4046 Ack=887 Win=20224 Len=0 TSval=437600820 TSecr=4294951169"
"522","97.113802","52.58.68.165","10.10.10.11","TLSv1.2","335","Application Data"
"523","97.113831","52.58.68.165","10.10.10.11","TLSv1.2","97","Encrypted Alert"
"524","97.115458","10.10.10.11","52.58.68.165","TCP","66","38649  >  443 [RST, ACK] Seq=887 Ack=4346 Win=14048 Len=0 TSval=4294951213 TSecr=437600853"
"525","97.318928","10.10.10.11","52.58.68.165","TCP","74","38650  >  443 [SYN] Seq=0 Win=5840 Len=0 MSS=1460 SACK_PERM=1 TSval=4294951264 TSecr=0 WS=2"
"526","97.322858","52.58.68.165","10.10.10.11","TCP","74","443  >  38650 [SYN, ACK] Seq=0 Ack=1 Win=17898 Len=0 MSS=1380 SACK_PERM=1 TSval=437600906 TSecr=4294951264 WS=256"
"527","97.323452","10.10.10.11","52.58.68.165","TCP","66","38650  >  443 [ACK] Seq=1 Ack=1 Win=5840 Len=0 TSval=4294951265 TSecr=437600906"
"528","97.324348","10.10.10.11","52.58.68.165","TLSv1.2","557","Client Hello"
"529","97.326605","52.58.68.165","10.10.10.11","TCP","66","443  >  38650 [ACK] Seq=1 Ack=492 Win=19200 Len=0 TSval=437600907 TSecr=4294951265"
"530","97.326634","52.58.68.165","10.10.10.11","TLSv1.2","203","Server Hello, Change Cipher Spec, Encrypted Handshake Message"
"531","97.327312","10.10.10.11","52.58.68.165","TCP","66","38650  >  443 [ACK] Seq=492 Ack=138 Win=5840 Len=0 TSval=4294951266 TSecr=437600907"
"532","97.330102","10.10.10.11","52.58.68.165","TLSv1.2","117","Change Cipher Spec, Encrypted Handshake Message"
"533","97.370456","52.58.68.165","10.10.10.11","TCP","66","443  >  38650 [ACK] Seq=138 Ack=543 Win=19200 Len=0 TSval=437600918 TSecr=4294951266"
"534","97.371184","10.10.10.11","52.58.68.165","TLSv1.2","418","Application Data"
"535","97.373485","52.58.68.165","10.10.10.11","TCP","66","443  >  38650 [ACK] Seq=138 Ack=895 Win=20224 Len=0 TSval=437600918 TSecr=4294951277"
"536","97.991808","52.58.68.165","10.10.10.11","TLSv1.2","462","Application Data"
"537","97.991837","52.58.68.165","10.10.10.11","TLSv1.2","97","Encrypted Alert"
"538","97.994211","10.10.10.11","10.10.10.1","DNS","79","Standard query 0x0003 A r0802.dch.dlink.com"
"539","98.002489","52.58.68.165","10.10.10.11","TCP","97","[TCP Retransmission] 443  >  38650 [PSH, ACK] Seq=534 Ack=895 Win=20224 Len=31 TSval=437601076 TSecr=4294951277"
"540","98.003616","10.10.10.11","52.58.68.165","TCP","78","38650  >  443 [ACK] Seq=895 Ack=565 Win=6912 Len=0 TSval=4294951435 TSecr=437601073 SLE=534 SRE=565"
"541","98.020229","10.10.10.1","10.10.10.11","DNS","296","Standard query response 0x0003 A r0802.dch.dlink.com A 52.28.131.102 NS ns-265.awsdns-33.com NS ns-1758.awsdns-27.co.uk NS ns-961.awsdns-56.net NS ns-1057.awsdns-04.org A 205.251.193.9 A 205.251.195.193 A 205.251.196.33 A 205.251.198.222"
"542","98.021275","10.10.10.11","52.28.131.102","TCP","74","34984  >  443 [SYN] Seq=0 Win=5840 Len=0 MSS=1460 SACK_PERM=1 TSval=4294951439 TSecr=0 WS=2"
"543","98.022010","10.10.10.11","52.58.68.165","TCP","66","38650  >  443 [RST, ACK] Seq=895 Ack=565 Win=6912 Len=0 TSval=4294951439 TSecr=437601073"
"544","98.023465","52.28.131.102","10.10.10.11","TCP","66","443  >  34984 [SYN, ACK] Seq=0 Ack=1 Win=2048 Len=0 MSS=1380 SACK_PERM=1 WS=8"
"545","98.024041","10.10.10.11","52.28.131.102","TCP","54","34984  >  443 [ACK] Seq=1 Ack=1 Win=5840 Len=0"
"546","98.024912","10.10.10.11","52.28.131.102","TLSv1.2","353","Client Hello"
"547","98.026937","52.28.131.102","10.10.10.11","TCP","54","443  >  34984 [ACK] Seq=1 Ack=300 Win=3120 Len=0"
"548","98.026966","52.28.131.102","10.10.10.11","TLSv1.2","112","Server Hello"
"549","98.027269","52.28.131.102","10.10.10.11","TCP","1434","443  >  34984 [ACK] Seq=59 Ack=300 Win=3120 Len=1380 [TCP segment of a reassembled PDU]"
"550","98.027280","52.28.131.102","10.10.10.11","TCP","1434","443  >  34984 [ACK] Seq=1439 Ack=300 Win=3120 Len=1380 [TCP segment of a reassembled PDU]"
"551","98.027286","52.28.131.102","10.10.10.11","TLSv1.2","700","Certificate"
"552","98.028237","10.10.10.11","52.28.131.102","TCP","54","34984  >  443 [ACK] Seq=300 Ack=59 Win=5840 Len=0"
"553","98.028690","10.10.10.11","52.28.131.102","TCP","54","34984  >  443 [ACK] Seq=300 Ack=1439 Win=8600 Len=0"
"554","98.028814","10.10.10.11","52.28.131.102","TCP","54","34984  >  443 [ACK] Seq=300 Ack=2819 Win=11360 Len=0"
"555","98.028938","10.10.10.11","52.28.131.102","TCP","54","34984  >  443 [ACK] Seq=300 Ack=3465 Win=11360 Len=0"
"556","98.035236","52.28.131.102","10.10.10.11","TLSv1.2","392","Server Key Exchange"
"557","98.035254","52.28.131.102","10.10.10.11","TLSv1.2","63","Server Hello Done"
"558","98.035908","10.10.10.11","52.28.131.102","TCP","54","34984  >  443 [ACK] Seq=300 Ack=3803 Win=11360 Len=0"
"559","98.036088","10.10.10.11","52.28.131.102","TCP","54","34984  >  443 [ACK] Seq=300 Ack=3812 Win=11360 Len=0"
"560","98.086811","10.10.10.11","52.28.131.102","TLSv1.2","180","Client Key Exchange, Change Cipher Spec, Encrypted Handshake Message"
"561","98.091118","52.28.131.102","10.10.10.11","TLSv1.2","173","New Session Ticket"
"562","98.091146","52.28.131.102","10.10.10.11","TLSv1.2","60","Change Cipher Spec"
"563","98.091152","52.28.131.102","10.10.10.11","TLSv1.2","99","Encrypted Handshake Message"
"564","98.092868","10.10.10.11","52.28.131.102","TCP","54","34984  >  443 [ACK] Seq=426 Ack=3937 Win=11360 Len=0"
"565","98.093336","10.10.10.11","52.28.131.102","TCP","54","34984  >  443 [ACK] Seq=426 Ack=3982 Win=11360 Len=0"
"566","98.094526","10.10.10.11","52.28.131.102","TLSv1.2","216","Application Data"
"567","98.133747","52.28.131.102","10.10.10.11","TCP","54","443  >  34984 [ACK] Seq=3982 Ack=588 Win=3120 Len=0"
"568","103.093799","52.28.131.102","10.10.10.11","TCP","54","[TCP Keep-Alive] 443  >  34984 [ACK] Seq=3981 Ack=588 Win=3120 Len=0"
"569","103.094303","10.10.10.11","52.28.131.102","TCP","54","[TCP Keep-Alive ACK] 34984  >  443 [ACK] Seq=588 Ack=3982 Win=11360 Len=0"
"570","108.109779","52.28.131.102","10.10.10.11","TCP","54","[TCP Keep-Alive] 443  >  34984 [ACK] Seq=3981 Ack=588 Win=3120 Len=0"
"571","108.110276","10.10.10.11","52.28.131.102","TCP","54","[TCP Keep-Alive ACK] 34984  >  443 [ACK] Seq=588 Ack=3982 Win=11360 Len=0"
"572","113.117740","52.28.131.102","10.10.10.11","TCP","54","[TCP Keep-Alive] 443  >  34984 [ACK] Seq=3981 Ack=588 Win=3120 Len=0"
"573","113.119238","10.10.10.11","52.28.131.102","TCP","54","[TCP Keep-Alive ACK] 34984  >  443 [ACK] Seq=588 Ack=3982 Win=11360 Len=0"
"574","118.135007","52.28.131.102","10.10.10.11","TCP","54","[TCP Keep-Alive] 443  >  34984 [ACK] Seq=3981 Ack=588 Win=3120 Len=0"
"575","118.136761","10.10.10.11","52.28.131.102","TCP","54","[TCP Keep-Alive ACK] 34984  >  443 [ACK] Seq=588 Ack=3982 Win=11360 Len=0"
"576","123.137918","52.28.131.102","10.10.10.11","TCP","54","[TCP Keep-Alive] 443  >  34984 [ACK] Seq=3981 Ack=588 Win=3120 Len=0"
"577","123.139491","10.10.10.11","52.28.131.102","TCP","54","[TCP Keep-Alive ACK] 34984  >  443 [ACK] Seq=588 Ack=3982 Win=11360 Len=0"
"578","128.141912","52.28.131.102","10.10.10.11","TCP","54","[TCP Keep-Alive] 443  >  34984 [ACK] Seq=3981 Ack=588 Win=3120 Len=0"
"579","128.143969","10.10.10.11","52.28.131.102","TCP","54","[TCP Keep-Alive ACK] 34984  >  443 [ACK] Seq=588 Ack=3982 Win=11360 Len=0"
"580","133.149865","52.28.131.102","10.10.10.11","TCP","54","[TCP Keep-Alive] 443  >  34984 [ACK] Seq=3981 Ack=588 Win=3120 Len=0"
"581","133.151465","10.10.10.11","52.28.131.102","TCP","54","[TCP Keep-Alive ACK] 34984  >  443 [ACK] Seq=588 Ack=3982 Win=11360 Len=0"
"582","138.151080","D-LinkIn_c5:17:5a","DavidEle_06:08:ba","ARP","42","Who has 10.10.10.1? Tell 10.10.10.11"
"583","138.151099","DavidEle_06:08:ba","D-LinkIn_c5:17:5a","ARP","42","10.10.10.1 is at 00:b5:6d:06:08:ba"
"584","138.157966","52.28.131.102","10.10.10.11","TCP","54","[TCP Keep-Alive] 443  >  34984 [ACK] Seq=3981 Ack=588 Win=3120 Len=0"
"585","138.159462","10.10.10.11","52.28.131.102","TCP","54","[TCP Keep-Alive ACK] 34984  >  443 [ACK] Seq=588 Ack=3982 Win=11360 Len=0"
"586","143.165928","52.28.131.102","10.10.10.11","TCP","54","[TCP Keep-Alive] 443  >  34984 [ACK] Seq=3981 Ack=588 Win=3120 Len=0"
"587","143.167377","DavidEle_06:08:ba","D-LinkIn_c5:17:5a","ARP","42","Who has 10.10.10.11? Tell 10.10.10.1"
"588","143.167442","10.10.10.11","52.28.131.102","TCP","54","[TCP Keep-Alive ACK] 34984  >  443 [ACK] Seq=588 Ack=3982 Win=11360 Len=0"
"589","143.168857","D-LinkIn_c5:17:5a","DavidEle_06:08:ba","ARP","42","10.10.10.11 is at 6c:72:20:c5:17:5a"
"590","148.173981","52.28.131.102","10.10.10.11","TCP","54","[TCP Keep-Alive] 443  >  34984 [ACK] Seq=3981 Ack=588 Win=3120 Len=0"
"591","148.176748","10.10.10.11","52.28.131.102","TCP","54","[TCP Keep-Alive ACK] 34984  >  443 [ACK] Seq=588 Ack=3982 Win=11360 Len=0"
"592","153.182056","52.28.131.102","10.10.10.11","TCP","54","[TCP Keep-Alive] 443  >  34984 [ACK] Seq=3981 Ack=588 Win=3120 Len=0"
"593","153.183633","10.10.10.11","52.28.131.102","TCP","54","[TCP Keep-Alive ACK] 34984  >  443 [ACK] Seq=588 Ack=3982 Win=11360 Len=0"
