"No.","Time","Source","Destination","Protocol","Length","Info"
"1","0.000000","D-LinkIn_dd:0d:60","IntelCor_c3:41:78","EAPOL","135","Key (Message 2 of 4)"
"2","0.004508","D-LinkIn_dd:0d:60","IntelCor_c3:41:78","EAPOL","113","Key (Message 4 of 4)"
"3","2.676984","fe80::928d:78ff:fedd:d60","ff02::16","ICMPv6","90","Multicast Listener Report Message v2"
"4","3.952705","fe80::928d:78ff:fedd:d60","ff02::2","ICMPv6","70","Router Solicitation from 90:8d:78:dd:0d:60"
"5","5.526544","0.0.0.0","255.255.255.255","DHCP","351","DHCP Discover - Transaction ID 0x4cdbe0bf"
"6","5.564946","0.0.0.0","255.255.255.255","DHCP","363","DHCP Request  - Transaction ID 0x4cdbe0bf"
"7","7.952648","fe80::928d:78ff:fedd:d60","ff02::2","ICMPv6","70","Router Solicitation from 90:8d:78:dd:0d:60"
"8","8.569040","0.0.0.0","255.255.255.255","DHCP","363","DHCP Request  - Transaction ID 0x4cdbe0bf"
"9","8.664739","10.10.10.39","224.0.0.22","IGMPv3","54","Membership Report / Join group 224.0.0.251 for any sources"
"10","8.914131","10.10.10.39","224.0.0.251","MDNS","640","Standard query 0x0000 ANY D-Link HNAP Service._dhnap._tcp.local, ""QM"" question ANY dch0D60.local, ""QM"" question ANY 39.10.10.10.in-addr.arpa, ""QM"" question ANY dch.local, ""QM"" question ANY 0.6.d.0.d.d.e.f.f.f.8.7.d.8.2.9.0.0.0.0.0.0.0.0.0.0.0.0.0.8.e.f.ip6.arpa, ""QM"" question ANY D-Link DCH-S220 Configuration Utility._http._tcp.local, ""QM"" question A 10.10.10.39 PTR dch0D60.local A 10.10.10.39 PTR dch.local AAAA fe80::928d:78ff:fedd:d60 PTR dch.local AAAA fe80::928d:78ff:fedd:d60 PTR dch0D60.local SRV 0 0 80 dch.local TXT SRV 0 0 80 dch.local TXT"
"11","8.965463","10.10.10.39","224.0.0.251","MDNS","214","Standard query response 0x0000 PTR _dhnap._tcp.local PTR D-Link DCH-S220 Configuration Utility._http._tcp.local PTR _http._tcp.local PTR D-Link HNAP Service._dhnap._tcp.local"
"12","9.166081","10.10.10.39","224.0.0.251","MDNS","640","Standard query 0x0000 ANY D-Link HNAP Service._dhnap._tcp.local, ""QM"" question ANY dch0D60.local, ""QM"" question ANY 39.10.10.10.in-addr.arpa, ""QM"" question ANY dch.local, ""QM"" question ANY 0.6.d.0.d.d.e.f.f.f.8.7.d.8.2.9.0.0.0.0.0.0.0.0.0.0.0.0.0.8.e.f.ip6.arpa, ""QM"" question ANY D-Link DCH-S220 Configuration Utility._http._tcp.local, ""QM"" question A 10.10.10.39 PTR dch0D60.local A 10.10.10.39 PTR dch.local AAAA fe80::928d:78ff:fedd:d60 PTR dch.local AAAA fe80::928d:78ff:fedd:d60 PTR dch0D60.local SRV 0 0 80 dch.local TXT SRV 0 0 80 dch.local TXT"
"13","9.418238","10.10.10.39","224.0.0.251","MDNS","640","Standard query 0x0000 ANY D-Link HNAP Service._dhnap._tcp.local, ""QM"" question ANY dch0D60.local, ""QM"" question ANY 39.10.10.10.in-addr.arpa, ""QM"" question ANY dch.local, ""QM"" question ANY 0.6.d.0.d.d.e.f.f.f.8.7.d.8.2.9.0.0.0.0.0.0.0.0.0.0.0.0.0.8.e.f.ip6.arpa, ""QM"" question ANY D-Link DCH-S220 Configuration Utility._http._tcp.local, ""QM"" question A 10.10.10.39 PTR dch0D60.local A 10.10.10.39 PTR dch.local AAAA fe80::928d:78ff:fedd:d60 PTR dch.local AAAA fe80::928d:78ff:fedd:d60 PTR dch0D60.local SRV 0 0 80 dch.local TXT SRV 0 0 80 dch.local TXT"
"14","9.620871","10.10.10.39","224.0.0.251","MDNS","604","Standard query response 0x0000 TXT, cache flush A, cache flush 10.10.10.39 PTR, cache flush dch0D60.local A, cache flush 10.10.10.39 PTR, cache flush dch.local AAAA, cache flush fe80::928d:78ff:fedd:d60 PTR, cache flush dch.local AAAA, cache flush fe80::928d:78ff:fedd:d60 PTR, cache flush dch0D60.local SRV, cache flush 0 0 80 dch.local TXT, cache flush SRV, cache flush 0 0 80 dch.local"
"15","9.848732","D-LinkIn_dd:0d:60","Broadcast","ARP","42","Who has 10.10.10.1? Tell 10.10.10.39"
"16","9.848749","DavidEle_06:08:ba","D-LinkIn_dd:0d:60","ARP","42","10.10.10.1 is at 00:b5:6d:06:08:ba"
"17","9.850186","10.10.10.39","10.10.10.1","DNS","74","Standard query 0x0002 AAAA wrpd.dlink.com"
"18","9.876419","10.10.10.1","10.10.10.39","DNS","395","Standard query response 0x0002 AAAA wrpd.dlink.com CNAME dualstack.ipv6-1927743757.us-west-2.elb.amazonaws.com AAAA 2620:108:700f::36f4:e8b7 AAAA 2620:108:700f::3270:7d1a NS ns-1769.awsdns-29.co.uk NS ns-332.awsdns-41.com NS ns-1475.awsdns-56.org NS ns-560.awsdns-06.net A 205.251.193.76 A 205.251.194.48 A 205.251.197.195 A 205.251.198.233"
"19","9.881055","10.10.10.39","10.10.10.1","DNS","113","Standard query 0x0003 AAAA dualstack.ipv6-1927743757.us-west-2.elb.amazonaws.com"
"20","9.881155","10.10.10.1","10.10.10.39","DNS","169","Standard query response 0x0003 AAAA dualstack.ipv6-1927743757.us-west-2.elb.amazonaws.com AAAA 2620:108:700f::3270:7d1a AAAA 2620:108:700f::36f4:e8b7"
"21","9.901723","10.10.10.39","10.10.10.1","DNS","74","Standard query 0x0004 A wrpd.dlink.com"
"22","9.927834","10.10.10.1","10.10.10.39","DNS","371","Standard query response 0x0004 A wrpd.dlink.com CNAME dualstack.ipv6-1927743757.us-west-2.elb.amazonaws.com A 54.244.232.183 A 50.112.125.26 NS ns-332.awsdns-41.com NS ns-1769.awsdns-29.co.uk NS ns-1475.awsdns-56.org NS ns-560.awsdns-06.net A 205.251.193.76 A 205.251.194.48 A 205.251.197.195 A 205.251.198.233"
"23","9.952701","10.10.10.39","54.244.232.183","TCP","74","43864  >  80 [SYN] Seq=0 Win=5840 Len=0 MSS=1460 SACK_PERM=1 TSval=4294917402 TSecr=0 WS=2"
"24","10.123960","54.244.232.183","10.10.10.39","TCP","74","80  >  43864 [SYN, ACK] Seq=0 Ack=1 Win=14480 Len=0 MSS=1380 SACK_PERM=1 TSval=1459222591 TSecr=4294917402 WS=256"
"25","10.125679","10.10.10.39","54.244.232.183","TCP","66","43864  >  80 [ACK] Seq=1 Ack=1 Win=5840 Len=0 TSval=4294917446 TSecr=1459222591"
"26","10.126091","10.10.10.39","54.244.232.183","HTTP","203","GET /router/firmware/query.aspx?model=DCH-S220_Ax_Default_FW_0120_908D78DD0D60 HTTP/1.1 "
"27","10.181492","10.10.10.39","224.0.0.251","MDNS","483","Standard query response 0x0000 PTR _dhnap._tcp.local PTR D-Link DCH-S220 Configuration Utility._http._tcp.local TXT, cache flush SRV, cache flush 0 0 80 dch.local AAAA, cache flush fe80::928d:78ff:fedd:d60 A, cache flush 10.10.10.39 PTR _http._tcp.local PTR D-Link HNAP Service._dhnap._tcp.local TXT, cache flush SRV, cache flush 0 0 80 dch.local"
"28","10.297350","54.244.232.183","10.10.10.39","TCP","66","80  >  43864 [ACK] Seq=1 Ack=138 Win=15616 Len=0 TSval=1459222634 TSecr=4294917446"
"29","10.299792","54.244.232.183","10.10.10.39","HTTP","267","HTTP/1.1 404 Not Found  (text/plain)"
"30","10.303140","10.10.10.39","54.244.232.183","TCP","66","43864  >  80 [ACK] Seq=138 Ack=202 Win=5840 Len=0 TSval=4294917490 TSecr=1459222635"
"31","10.837808","10.10.10.39","224.0.0.251","MDNS","604","Standard query response 0x0000 TXT, cache flush A, cache flush 10.10.10.39 A, cache flush 10.10.10.39 PTR, cache flush dch0D60.local PTR, cache flush dch.local AAAA, cache flush fe80::928d:78ff:fedd:d60 AAAA, cache flush fe80::928d:78ff:fedd:d60 PTR, cache flush dch0D60.local PTR, cache flush dch.local SRV, cache flush 0 0 80 dch.local TXT, cache flush SRV, cache flush 0 0 80 dch.local"
"32","10.937163","10.10.10.39","10.10.10.1","DNS","74","Standard query 0x0002 A ntp1.dlink.com"
"33","10.937254","10.10.10.1","10.10.10.39","DNS","106","Standard query response 0x0002 A ntp1.dlink.com A 54.86.11.193 A 54.186.215.173"
"34","10.954774","10.10.10.39","54.86.11.193","NTP","90","NTP Version 3, client"
"35","11.054378","54.86.11.193","10.10.10.39","NTP","90","NTP Version 3, server"
"36","11.167679","10.10.10.39","54.244.232.183","TCP","66","43864  >  80 [FIN, ACK] Seq=138 Ack=202 Win=5840 Len=0 TSval=4294917706 TSecr=1459222635"
"37","11.338800","54.244.232.183","10.10.10.39","TCP","66","80  >  43864 [FIN, ACK] Seq=202 Ack=139 Win=15616 Len=0 TSval=1459222894 TSecr=4294917706"
"38","11.339916","10.10.10.39","54.244.232.183","TCP","66","43864  >  80 [ACK] Seq=139 Ack=203 Win=5840 Len=0 TSval=4294917749 TSecr=1459222894"
"39","11.428916","10.10.10.39","224.0.0.251","MDNS","683","Standard query response 0x0000 TXT, cache flush A, cache flush 10.10.10.39 A, cache flush 10.10.10.39 PTR, cache flush dch0D60.local PTR, cache flush dch.local AAAA, cache flush fe80::928d:78ff:fedd:d60 AAAA, cache flush fe80::928d:78ff:fedd:d60 PTR, cache flush dch0D60.local PTR, cache flush dch.local SRV, cache flush 0 0 80 dch.local TXT, cache flush SRV, cache flush 0 0 80 dch.local PTR D-Link DCH-S220 Configuration Utility._http._tcp.local PTR _http._tcp.local PTR D-Link HNAP Service._dhnap._tcp.local PTR _dhnap._tcp.local"
"40","12.049486","10.10.10.39","224.0.0.251","MDNS","378","Standard query response 0x0000 PTR _dhnap._tcp.local PTR D-Link HNAP Service._dhnap._tcp.local SRV, cache flush 0 0 80 dch.local AAAA, cache flush fe80::928d:78ff:fedd:d60 A, cache flush 10.10.10.39 TXT, cache flush"
"41","12.053871","10.10.10.39","224.0.0.251","MDNS","196","Standard query response 0x0000 PTR _http._tcp.local PTR D-Link DCH-S220 Configuration Utility._http._tcp.local SRV, cache flush 0 0 80 dch.local TXT, cache flush"
"42","12.250933","10.10.10.39","224.0.0.251","MDNS","307","Standard query response 0x0000 AAAA, cache flush fe80::928d:78ff:fedd:d60 PTR, cache flush dch.local AAAA, cache flush fe80::928d:78ff:fedd:d60 PTR, cache flush dch0D60.local A, cache flush 10.10.10.39 PTR, cache flush dch.local A, cache flush 10.10.10.39 PTR, cache flush dch0D60.local"
"43","12.256773","10.10.10.39","224.0.0.22","IGMPv3","54","Membership Report / Leave group 224.0.0.251"
"44","12.436766","10.10.10.39","224.0.0.22","IGMPv3","54","Membership Report / Leave group 224.0.0.251"
"45","13.844797","10.10.10.39","224.0.0.22","IGMPv3","54","Membership Report / Join group 224.0.0.251 for any sources"
"46","14.033935","10.10.10.39","224.0.0.251","MDNS","331","Standard query 0x0000 ANY 0.6.d.0.d.d.e.f.f.f.8.7.d.8.2.9.0.0.0.0.0.0.0.0.0.0.0.0.0.8.e.f.ip6.arpa, ""QM"" question ANY dch0D60.local, ""QM"" question ANY 39.10.10.10.in-addr.arpa, ""QM"" question ANY dch.local, ""QM"" question A 10.10.10.39 PTR dch0D60.local A 10.10.10.39 PTR dch.local AAAA fe80::928d:78ff:fedd:d60 PTR dch0D60.local AAAA fe80::928d:78ff:fedd:d60 PTR dch.local"
"47","14.285823","10.10.10.39","224.0.0.251","MDNS","331","Standard query 0x0000 ANY 0.6.d.0.d.d.e.f.f.f.8.7.d.8.2.9.0.0.0.0.0.0.0.0.0.0.0.0.0.8.e.f.ip6.arpa, ""QM"" question ANY dch0D60.local, ""QM"" question ANY 39.10.10.10.in-addr.arpa, ""QM"" question ANY dch.local, ""QM"" question A 10.10.10.39 PTR dch0D60.local A 10.10.10.39 PTR dch.local AAAA fe80::928d:78ff:fedd:d60 PTR dch0D60.local AAAA fe80::928d:78ff:fedd:d60 PTR dch.local"
"48","14.537844","10.10.10.39","224.0.0.251","MDNS","331","Standard query 0x0000 ANY 0.6.d.0.d.d.e.f.f.f.8.7.d.8.2.9.0.0.0.0.0.0.0.0.0.0.0.0.0.8.e.f.ip6.arpa, ""QM"" question ANY dch0D60.local, ""QM"" question ANY 39.10.10.10.in-addr.arpa, ""QM"" question ANY dch.local, ""QM"" question A 10.10.10.39 PTR dch0D60.local A 10.10.10.39 PTR dch.local AAAA fe80::928d:78ff:fedd:d60 PTR dch0D60.local AAAA fe80::928d:78ff:fedd:d60 PTR dch.local"
"49","14.738053","10.10.10.39","224.0.0.251","MDNS","177","Standard query response 0x0000 PTR, cache flush dch.local AAAA, cache flush fe80::928d:78ff:fedd:d60"
"50","14.743592","10.10.10.39","224.0.0.251","MDNS","265","Standard query response 0x0000 PTR, cache flush dch0D60.local A, cache flush 10.10.10.39 PTR, cache flush dch0D60.local A, cache flush 10.10.10.39 PTR, cache flush dch.local AAAA, cache flush fe80::928d:78ff:fedd:d60"
"51","14.890624","DavidEle_06:08:ba","D-LinkIn_dd:0d:60","ARP","42","Who has 10.10.10.39? Tell 10.10.10.1"
"52","14.891665","D-LinkIn_dd:0d:60","DavidEle_06:08:ba","ARP","42","10.10.10.39 is at 90:8d:78:dd:0d:60"
"53","14.937457","10.10.10.39","224.0.0.251","MDNS","373","Standard query 0x0000 ANY D-Link DCH-S220 Configuration Utility._http._tcp.local, ""QM"" question ANY D-Link HNAP Service._dhnap._tcp.local, ""QM"" question SRV 0 0 80 dch.local TXT SRV 0 0 80 dch.local TXT"
"54","15.189519","10.10.10.39","224.0.0.251","MDNS","373","Standard query 0x0000 ANY D-Link DCH-S220 Configuration Utility._http._tcp.local, ""QM"" question ANY D-Link HNAP Service._dhnap._tcp.local, ""QM"" question SRV 0 0 80 dch.local TXT SRV 0 0 80 dch.local TXT"
"55","15.441476","10.10.10.39","224.0.0.251","MDNS","373","Standard query 0x0000 ANY D-Link DCH-S220 Configuration Utility._http._tcp.local, ""QM"" question ANY D-Link HNAP Service._dhnap._tcp.local, ""QM"" question SRV 0 0 80 dch.local TXT SRV 0 0 80 dch.local TXT"
"56","15.644436","10.10.10.39","224.0.0.251","MDNS","484","Standard query response 0x0000 TXT, cache flush PTR D-Link HNAP Service._dhnap._tcp.local SRV, cache flush 0 0 80 dch.local AAAA, cache flush fe80::928d:78ff:fedd:d60 A, cache flush 10.10.10.39 TXT, cache flush PTR _dhnap._tcp.local PTR D-Link DCH-S220 Configuration Utility._http._tcp.local SRV, cache flush 0 0 80 dch.local PTR _http._tcp.local"
"57","15.882237","10.10.10.39","224.0.0.251","MDNS","171","Standard query response 0x0000 PTR, cache flush dch.local PTR, cache flush dch0D60.local"
"58","15.884068","10.10.10.39","224.0.0.251","MDNS","151","Standard query response 0x0000 AAAA, cache flush fe80::928d:78ff:fedd:d60 PTR, cache flush dch0D60.local PTR, cache flush dch.local"
"59","15.886310","10.10.10.39","224.0.0.251","MDNS","83","Standard query response 0x0000 A, cache flush 10.10.10.39"
"60","16.220813","10.10.10.39","224.0.0.22","IGMPv3","54","Membership Report / Join group 224.0.0.251 for any sources"
"61","16.787709","10.10.10.39","224.0.0.251","MDNS","484","Standard query response 0x0000 TXT, cache flush PTR D-Link HNAP Service._dhnap._tcp.local SRV, cache flush 0 0 80 dch.local AAAA, cache flush fe80::928d:78ff:fedd:d60 A, cache flush 10.10.10.39 TXT, cache flush PTR _dhnap._tcp.local PTR D-Link DCH-S220 Configuration Utility._http._tcp.local SRV, cache flush 0 0 80 dch.local PTR _http._tcp.local"
"62","18.031450","10.10.10.39","224.0.0.251","MDNS","307","Standard query response 0x0000 PTR, cache flush dch.local A, cache flush 10.10.10.39 A, cache flush 10.10.10.39 PTR, cache flush dch0D60.local PTR, cache flush dch.local AAAA, cache flush fe80::928d:78ff:fedd:d60 AAAA, cache flush fe80::928d:78ff:fedd:d60 PTR, cache flush dch0D60.local"
"63","18.931724","10.10.10.39","224.0.0.251","MDNS","484","Standard query response 0x0000 TXT, cache flush PTR D-Link HNAP Service._dhnap._tcp.local SRV, cache flush 0 0 80 dch.local AAAA, cache flush fe80::928d:78ff:fedd:d60 A, cache flush 10.10.10.39 TXT, cache flush PTR _dhnap._tcp.local PTR D-Link DCH-S220 Configuration Utility._http._tcp.local SRV, cache flush 0 0 80 dch.local PTR _http._tcp.local"
"64","54.238282","10.10.10.39","224.0.0.251","MDNS","342","Standard query response 0x0000 PTR D-Link HNAP Service._dhnap._tcp.local TXT, cache flush SRV, cache flush 0 0 80 dch.local AAAA, cache flush fe80::928d:78ff:fedd:d60 A, cache flush 10.10.10.39"
"65","82.624376","10.10.10.39","224.0.0.251","MDNS","379","Standard query response 0x0000 PTR _dhnap._tcp.local PTR D-Link HNAP Service._dhnap._tcp.local SRV, cache flush 0 0 80 dch.local AAAA, cache flush fe80::928d:78ff:fedd:d60 A, cache flush 10.10.10.39 TXT, cache flush"
"66","82.628132","10.10.10.39","224.0.0.251","MDNS","196","Standard query response 0x0000 PTR _http._tcp.local PTR D-Link DCH-S220 Configuration Utility._http._tcp.local SRV, cache flush 0 0 80 dch.local TXT, cache flush"
"67","82.989956","10.10.10.39","224.0.0.251","MDNS","307","Standard query response 0x0000 AAAA, cache flush fe80::928d:78ff:fedd:d60 PTR, cache flush dch.local AAAA, cache flush fe80::928d:78ff:fedd:d60 PTR, cache flush dch0D60.local A, cache flush 10.10.10.39 PTR, cache flush dch.local A, cache flush 10.10.10.39 PTR, cache flush dch0D60.local"
"68","82.997793","10.10.10.39","224.0.0.22","IGMPv3","54","Membership Report / Leave group 224.0.0.251"
"69","83.412335","10.10.10.39","10.10.10.1","DNS","77","Standard query 0x0002 A api.dch.dlink.com"
"70","83.438442","10.10.10.1","10.10.10.39","DNS","373","Standard query response 0x0002 A api.dch.dlink.com CNAME eu-api-elb-1068129369.eu-central-1.elb.amazonaws.com A 52.28.38.154 A 52.58.68.165 NS ns-1326.awsdns-37.org NS ns-1689.awsdns-19.co.uk NS ns-613.awsdns-12.net NS ns-417.awsdns-52.com A 205.251.193.161 A 205.251.194.101 A 205.251.197.46 A 205.251.198.153"
"71","83.441308","10.10.10.39","52.28.38.154","TCP","74","60982  >  443 [SYN] Seq=0 Win=5840 Len=0 MSS=1460 SACK_PERM=1 TSval=4294935774 TSecr=0 WS=2"
"72","83.443756","52.28.38.154","10.10.10.39","TCP","74","443  >  60982 [SYN, ACK] Seq=0 Ack=1 Win=17898 Len=0 MSS=1380 SACK_PERM=1 TSval=437762926 TSecr=4294935774 WS=256"
"73","83.445033","10.10.10.39","52.28.38.154","TCP","66","60982  >  443 [ACK] Seq=1 Ack=1 Win=5840 Len=0 TSval=4294935775 TSecr=437762926"
"74","83.494013","10.10.10.39","52.28.38.154","TLSv1","273","Client Hello"
"75","83.496294","52.28.38.154","10.10.10.39","TCP","66","443  >  60982 [ACK] Seq=1 Ack=208 Win=19200 Len=0 TSval=437762939 TSecr=4294935788"
"76","83.498163","52.28.38.154","10.10.10.39","TLSv1","1434","Server Hello"
"77","83.498285","52.28.38.154","10.10.10.39","TCP","1434","443  >  60982 [ACK] Seq=1369 Ack=208 Win=19200 Len=1368 TSval=437762939 TSecr=4294935788 [TCP segment of a reassembled PDU]"
"78","83.498298","52.28.38.154","10.10.10.39","TLSv1","1147","Certificate, Server Key Exchange, Server Hello Done"
"79","83.517245","10.10.10.39","52.28.38.154","TCP","66","60982  >  443 [ACK] Seq=208 Ack=1369 Win=8576 Len=0 TSval=4294935790 TSecr=437762939"
"80","83.517471","10.10.10.39","52.28.38.154","TCP","66","60982  >  443 [ACK] Seq=208 Ack=2737 Win=11312 Len=0 TSval=4294935792 TSecr=437762939"
"81","83.517573","10.10.10.39","52.28.38.154","TCP","66","60982  >  443 [ACK] Seq=208 Ack=3818 Win=14048 Len=0 TSval=4294935793 TSecr=437762939"
"82","83.663644","10.10.10.39","52.28.38.154","TLSv1","200","Client Key Exchange, Change Cipher Spec, Encrypted Handshake Message"
"83","83.667577","52.28.38.154","10.10.10.39","TLSv1","300","New Session Ticket, Change Cipher Spec, Encrypted Handshake Message"
"84","83.668876","10.10.10.39","52.28.38.154","TCP","66","60982  >  443 [ACK] Seq=342 Ack=4052 Win=14048 Len=0 TSval=4294935831 TSecr=437762982"
"85","83.721138","10.10.10.39","52.28.38.154","TLSv1","572","Application Data, Application Data"
"86","83.763101","52.28.38.154","10.10.10.39","TCP","66","443  >  60982 [ACK] Seq=4052 Ack=848 Win=21248 Len=0 TSval=437763006 TSecr=4294935844"
"87","84.026832","52.28.38.154","10.10.10.39","TLSv1","631","Application Data"
"88","84.026855","52.28.38.154","10.10.10.39","TLSv1","103","Encrypted Alert"
"89","84.030836","10.10.10.39","52.28.38.154","TCP","66","60982  >  443 [ACK] Seq=848 Ack=4617 Win=14048 Len=0 TSval=4294935921 TSecr=437763071"
"90","84.031063","10.10.10.39","52.28.38.154","TCP","66","60982  >  443 [ACK] Seq=848 Ack=4654 Win=14048 Len=0 TSval=4294935921 TSecr=437763071"
"91","84.048107","10.10.10.39","52.28.38.154","TCP","66","60982  >  443 [RST, ACK] Seq=848 Ack=4654 Win=14048 Len=0 TSval=4294935926 TSecr=437763071"
"92","84.209796","10.10.10.39","224.0.0.22","IGMPv3","54","Membership Report / Join group 224.0.0.251 for any sources"
"93","84.442623","10.10.10.39","52.28.38.154","TCP","74","60984  >  443 [SYN] Seq=0 Win=5840 Len=0 MSS=1460 SACK_PERM=1 TSval=4294936025 TSecr=0 WS=2"
"94","84.444824","52.28.38.154","10.10.10.39","TCP","74","443  >  60984 [SYN, ACK] Seq=0 Ack=1 Win=17898 Len=0 MSS=1380 SACK_PERM=1 TSval=437763176 TSecr=4294936025 WS=256"
"95","84.445800","10.10.10.39","52.28.38.154","TCP","66","60984  >  443 [ACK] Seq=1 Ack=1 Win=5840 Len=0 TSval=4294936026 TSecr=437763176"
"96","84.461581","10.10.10.39","224.0.0.251","MDNS","331","Standard query 0x0000 ANY 0.6.d.0.d.d.e.f.f.f.8.7.d.8.2.9.0.0.0.0.0.0.0.0.0.0.0.0.0.8.e.f.ip6.arpa, ""QM"" question ANY dch0D60.local, ""QM"" question ANY 39.10.10.10.in-addr.arpa, ""QM"" question ANY dch.local, ""QM"" question A 10.10.10.39 PTR dch0D60.local A 10.10.10.39 PTR dch.local AAAA fe80::928d:78ff:fedd:d60 PTR dch0D60.local AAAA fe80::928d:78ff:fedd:d60 PTR dch.local"
"97","84.494142","10.10.10.39","52.28.38.154","TLSv1","273","Client Hello"
"98","84.497636","52.28.38.154","10.10.10.39","TCP","66","443  >  60984 [ACK] Seq=1 Ack=208 Win=19200 Len=0 TSval=437763189 TSecr=4294936038"
"99","84.499333","52.28.38.154","10.10.10.39","TLSv1","1434","Server Hello"
"100","84.499361","52.28.38.154","10.10.10.39","TCP","1434","443  >  60984 [ACK] Seq=1369 Ack=208 Win=19200 Len=1368 TSval=437763190 TSecr=4294936038 [TCP segment of a reassembled PDU]"
"101","84.499378","52.28.38.154","10.10.10.39","TLSv1","1147","Certificate, Server Key Exchange, Server Hello Done"
"102","84.508746","10.10.10.39","52.28.38.154","TCP","66","60984  >  443 [ACK] Seq=208 Ack=1369 Win=8576 Len=0 TSval=4294936040 TSecr=437763190"
"103","84.508880","10.10.10.39","52.28.38.154","TCP","66","60984  >  443 [ACK] Seq=208 Ack=2737 Win=11312 Len=0 TSval=4294936040 TSecr=437763190"
"104","84.509215","10.10.10.39","52.28.38.154","TCP","66","60984  >  443 [ACK] Seq=208 Ack=3818 Win=14048 Len=0 TSval=4294936041 TSecr=437763190"
"105","84.673044","10.10.10.39","52.28.38.154","TLSv1","200","Client Key Exchange, Change Cipher Spec, Encrypted Handshake Message"
"106","84.675888","52.28.38.154","10.10.10.39","TLSv1","300","New Session Ticket, Change Cipher Spec, Encrypted Handshake Message"
"107","84.679814","10.10.10.39","52.28.38.154","TCP","66","60984  >  443 [ACK] Seq=342 Ack=4052 Win=14048 Len=0 TSval=4294936083 TSecr=437763234"
"108","84.710813","10.10.10.39","224.0.0.251","MDNS","331","Standard query 0x0000 ANY 0.6.d.0.d.d.e.f.f.f.8.7.d.8.2.9.0.0.0.0.0.0.0.0.0.0.0.0.0.8.e.f.ip6.arpa, ""QM"" question ANY dch0D60.local, ""QM"" question ANY 39.10.10.10.in-addr.arpa, ""QM"" question ANY dch.local, ""QM"" question A 10.10.10.39 PTR dch0D60.local A 10.10.10.39 PTR dch.local AAAA fe80::928d:78ff:fedd:d60 PTR dch0D60.local AAAA fe80::928d:78ff:fedd:d60 PTR dch.local"
"109","84.728552","10.10.10.39","52.28.38.154","TLSv1","588","Application Data, Application Data"
"110","84.770735","52.28.38.154","10.10.10.39","TCP","66","443  >  60984 [ACK] Seq=4052 Ack=864 Win=21248 Len=0 TSval=437763258 TSecr=4294936096"
"111","84.771699","10.10.10.39","52.28.38.154","TLSv1","780","Application Data, Application Data"
"112","84.776075","52.28.38.154","10.10.10.39","TCP","66","443  >  60984 [ACK] Seq=4052 Ack=1578 Win=22784 Len=0 TSval=437763259 TSecr=4294936107"
"113","84.964971","10.10.10.39","224.0.0.251","MDNS","331","Standard query 0x0000 ANY 0.6.d.0.d.d.e.f.f.f.8.7.d.8.2.9.0.0.0.0.0.0.0.0.0.0.0.0.0.8.e.f.ip6.arpa, ""QM"" question ANY dch0D60.local, ""QM"" question ANY 39.10.10.10.in-addr.arpa, ""QM"" question ANY dch.local, ""QM"" question A 10.10.10.39 PTR dch0D60.local A 10.10.10.39 PTR dch.local AAAA fe80::928d:78ff:fedd:d60 PTR dch0D60.local AAAA fe80::928d:78ff:fedd:d60 PTR dch.local"
"114","85.030264","10.10.10.39","52.28.38.154","TCP","74","60985  >  443 [SYN] Seq=0 Win=5840 Len=0 MSS=1460 SACK_PERM=1 TSval=4294936172 TSecr=0 WS=2"
"115","85.037459","52.28.38.154","10.10.10.39","TCP","74","443  >  60985 [SYN, ACK] Seq=0 Ack=1 Win=17898 Len=0 MSS=1380 SACK_PERM=1 TSval=437763324 TSecr=4294936172 WS=256"
"116","85.038280","10.10.10.39","52.28.38.154","TCP","66","60985  >  443 [ACK] Seq=1 Ack=1 Win=5840 Len=0 TSval=4294936174 TSecr=437763324"
"117","85.082002","10.10.10.39","52.28.38.154","TLSv1","273","Client Hello"
"118","85.083812","52.28.38.154","10.10.10.39","TCP","66","443  >  60985 [ACK] Seq=1 Ack=208 Win=19200 Len=0 TSval=437763336 TSecr=4294936185"
"119","85.085743","52.28.38.154","10.10.10.39","TLSv1","1434","Server Hello"
"120","85.085841","52.28.38.154","10.10.10.39","TCP","1434","443  >  60985 [ACK] Seq=1369 Ack=208 Win=19200 Len=1368 TSval=437763336 TSecr=4294936185 [TCP segment of a reassembled PDU]"
"121","85.085851","52.28.38.154","10.10.10.39","TLSv1","1147","Certificate, Server Key Exchange, Server Hello Done"
"122","85.090392","10.10.10.39","52.28.38.154","TCP","66","60985  >  443 [ACK] Seq=208 Ack=1369 Win=8576 Len=0 TSval=4294936186 TSecr=437763336"
"123","85.090618","10.10.10.39","52.28.38.154","TCP","66","60985  >  443 [ACK] Seq=208 Ack=2737 Win=11312 Len=0 TSval=4294936186 TSecr=437763336"
"124","85.090730","10.10.10.39","52.28.38.154","TCP","66","60985  >  443 [ACK] Seq=208 Ack=3818 Win=14048 Len=0 TSval=4294936187 TSecr=437763336"
"125","85.164051","10.10.10.39","224.0.0.251","MDNS","277","Standard query response 0x0000 PTR, cache flush dch.local A, cache flush 10.10.10.39 PTR, cache flush dch.local AAAA, cache flush fe80::928d:78ff:fedd:d60 PTR, cache flush dch0D60.local AAAA, cache flush fe80::928d:78ff:fedd:d60"
"126","85.184521","10.10.10.39","224.0.0.251","MDNS","121","Standard query response 0x0000 PTR, cache flush dch0D60.local A, cache flush 10.10.10.39"
"127","85.227273","52.28.38.154","10.10.10.39","TLSv1","663","Application Data"
"128","85.336939","10.10.10.39","52.28.38.154","TLSv1","200","Client Key Exchange, Change Cipher Spec, Encrypted Handshake Message"
"129","85.339535","52.28.38.154","10.10.10.39","TLSv1","300","New Session Ticket, Change Cipher Spec, Encrypted Handshake Message"
"130","85.340408","10.10.10.39","52.28.38.154","TCP","66","60985  >  443 [ACK] Seq=342 Ack=4052 Win=14048 Len=0 TSval=4294936249 TSecr=437763400"
"131","85.346403","10.10.10.39","10.10.10.1","DNS","74","Standard query 0x0002 A ntp1.dlink.com"
"132","85.346495","10.10.10.1","10.10.10.39","DNS","106","Standard query response 0x0002 A ntp1.dlink.com A 54.186.215.173 A 54.86.11.193"
"133","85.350976","10.10.10.39","54.186.215.173","NTP","90","NTP Version 3, client"
"134","85.395730","10.10.10.39","52.28.38.154","TLSv1","460","Application Data, Application Data"
"135","85.434676","52.28.38.154","10.10.10.39","TCP","66","443  >  60985 [ACK] Seq=4052 Ack=736 Win=21248 Len=0 TSval=437763424 TSecr=4294936262"
"136","85.438389","10.10.10.39","224.0.0.251","MDNS","373","Standard query 0x0000 ANY D-Link DCH-S220 Configuration Utility._http._tcp.local, ""QM"" question ANY D-Link HNAP Service._dhnap._tcp.local, ""QM"" question SRV 0 0 80 dch.local TXT SRV 0 0 80 dch.local TXT"
"137","85.446794","52.28.38.154","10.10.10.39","TCP","663","[TCP Retransmission] 443  >  60984 [PSH, ACK] Seq=4052 Ack=1578 Win=22784 Len=597 TSval=437763427 TSecr=4294936107"
"138","85.447875","10.10.10.39","52.28.38.154","TCP","66","60984  >  443 [ACK] Seq=1578 Ack=4649 Win=14048 Len=0 TSval=4294936276 TSecr=437763427"
"139","85.450842","10.10.10.39","52.28.38.154","TCP","66","60984  >  443 [FIN, ACK] Seq=1578 Ack=4649 Win=14048 Len=0 TSval=4294936277 TSecr=437763427"
"140","85.453010","52.28.38.154","10.10.10.39","TLSv1","103","Encrypted Alert"
"141","85.453043","52.28.38.154","10.10.10.39","TCP","66","443  >  60984 [FIN, ACK] Seq=4686 Ack=1579 Win=22784 Len=0 TSval=437763428 TSecr=4294936277"
"142","85.453899","10.10.10.39","52.28.38.154","TCP","54","60984  >  443 [RST] Seq=1579 Win=0 Len=0"
"143","85.454175","10.10.10.39","52.28.38.154","TCP","54","60984  >  443 [RST] Seq=1579 Win=0 Len=0"
"144","85.515662","54.186.215.173","10.10.10.39","NTP","90","NTP Version 3, server"
"145","85.710506","10.10.10.39","224.0.0.251","MDNS","373","Standard query 0x0000 ANY D-Link DCH-S220 Configuration Utility._http._tcp.local, ""QM"" question ANY D-Link HNAP Service._dhnap._tcp.local, ""QM"" question SRV 0 0 80 dch.local TXT SRV 0 0 80 dch.local TXT"
"146","85.962535","10.10.10.39","224.0.0.251","MDNS","373","Standard query 0x0000 ANY D-Link DCH-S220 Configuration Utility._http._tcp.local, ""QM"" question ANY D-Link HNAP Service._dhnap._tcp.local, ""QM"" question SRV 0 0 80 dch.local TXT SRV 0 0 80 dch.local TXT"
"147","86.081855","52.28.38.154","10.10.10.39","TLSv1","471","Application Data"
"148","86.081885","52.28.38.154","10.10.10.39","TLSv1","103","Encrypted Alert"
"149","86.082717","10.10.10.39","52.28.38.154","TCP","66","60985  >  443 [ACK] Seq=736 Ack=4457 Win=14048 Len=0 TSval=4294936435 TSecr=437763585"
"150","86.082900","10.10.10.39","52.28.38.154","TCP","66","60985  >  443 [ACK] Seq=736 Ack=4494 Win=14048 Len=0 TSval=4294936435 TSecr=437763585"
"151","86.085111","10.10.10.39","10.10.10.1","DNS","79","Standard query 0x0003 A r0802.dch.dlink.com"
"152","86.085202","10.10.10.1","10.10.10.39","DNS","95","Standard query response 0x0003 A r0802.dch.dlink.com A 52.28.131.102"
"153","86.086362","10.10.10.39","52.28.131.102","TCP","74","37343  >  443 [SYN] Seq=0 Win=5840 Len=0 MSS=1460 SACK_PERM=1 TSval=4294936436 TSecr=0 WS=2"
"154","86.088580","52.28.131.102","10.10.10.39","TCP","66","443  >  37343 [SYN, ACK] Seq=0 Ack=1 Win=2048 Len=0 MSS=1380 SACK_PERM=1 WS=8"
"155","86.089231","10.10.10.39","52.28.131.102","TCP","54","37343  >  443 [ACK] Seq=1 Ack=1 Win=5840 Len=0"
"156","86.150966","10.10.10.39","52.28.131.102","TLSv1","261","Client Hello"
"157","86.152967","52.28.131.102","10.10.10.39","TCP","54","443  >  37343 [ACK] Seq=1 Ack=208 Win=3120 Len=0"
"158","86.152996","52.28.131.102","10.10.10.39","TLSv1","112","Server Hello"
"159","86.153365","52.28.131.102","10.10.10.39","TCP","1434","443  >  37343 [ACK] Seq=59 Ack=208 Win=3120 Len=1380 [TCP segment of a reassembled PDU]"
"160","86.153390","52.28.131.102","10.10.10.39","TCP","1434","443  >  37343 [ACK] Seq=1439 Ack=208 Win=3120 Len=1380 [TCP segment of a reassembled PDU]"
"161","86.153397","52.28.131.102","10.10.10.39","TLSv1","700","Certificate"
"162","86.155144","10.10.10.39","52.28.131.102","TCP","54","37343  >  443 [ACK] Seq=208 Ack=59 Win=5840 Len=0"
"163","86.155772","10.10.10.39","52.28.131.102","TCP","54","37343  >  443 [ACK] Seq=208 Ack=1439 Win=8600 Len=0"
"164","86.155867","10.10.10.39","52.28.131.102","TCP","54","37343  >  443 [ACK] Seq=208 Ack=2819 Win=11360 Len=0"
"165","86.155907","10.10.10.39","52.28.131.102","TCP","54","37343  >  443 [ACK] Seq=208 Ack=3465 Win=11360 Len=0"
"166","86.161497","52.28.131.102","10.10.10.39","TLSv1","390","Server Key Exchange"
"167","86.161522","52.28.131.102","10.10.10.39","TLSv1","63","Server Hello Done"
"168","86.162210","10.10.10.39","52.28.131.102","TCP","54","37343  >  443 [ACK] Seq=208 Ack=3801 Win=11360 Len=0"
"169","86.162468","10.10.10.39","52.28.131.102","TCP","54","37343  >  443 [ACK] Seq=208 Ack=3810 Win=11360 Len=0"
"170","86.166464","10.10.10.39","224.0.0.251","MDNS","484","Standard query response 0x0000 TXT, cache flush PTR D-Link HNAP Service._dhnap._tcp.local SRV, cache flush 0 0 80 dch.local AAAA, cache flush fe80::928d:78ff:fedd:d60 A, cache flush 10.10.10.39 TXT, cache flush PTR _dhnap._tcp.local PTR D-Link DCH-S220 Configuration Utility._http._tcp.local SRV, cache flush 0 0 80 dch.local PTR _http._tcp.local"
"171","86.234344","10.10.10.39","10.10.10.1","DNS","80","Standard query 0x0002 AAAA tzinfo.dch.dlink.com"
"172","86.260122","10.10.10.1","10.10.10.39","DNS","213","Standard query response 0x0002 AAAA tzinfo.dch.dlink.com CNAME tzinfo-423124427.us-west-2.elb.amazonaws.com SOA ns-332.awsdns-41.com"
"173","86.261510","10.10.10.39","10.10.10.1","DNS","104","Standard query 0x0003 AAAA tzinfo-423124427.us-west-2.elb.amazonaws.com"
"174","86.261627","10.10.10.1","10.10.10.39","DNS","104","Standard query response 0x0003 AAAA tzinfo-423124427.us-west-2.elb.amazonaws.com"
"175","86.262536","10.10.10.39","10.10.10.1","DNS","80","Standard query 0x0004 A tzinfo.dch.dlink.com"
"176","86.288875","10.10.10.1","10.10.10.39","DNS","368","Standard query response 0x0004 A tzinfo.dch.dlink.com CNAME tzinfo-423124427.us-west-2.elb.amazonaws.com A 52.25.174.177 A 52.26.98.232 NS ns-1769.awsdns-29.co.uk NS ns-1475.awsdns-56.org NS ns-560.awsdns-06.net NS ns-332.awsdns-41.com A 205.251.193.76 A 205.251.194.48 A 205.251.197.195 A 205.251.198.233"
"177","86.321785","10.10.10.39","52.25.174.177","TCP","74","46298  >  80 [SYN] Seq=0 Win=5840 Len=0 MSS=1460 SACK_PERM=1 TSval=4294936495 TSecr=0 WS=2"
"178","86.384463","10.10.10.39","224.0.0.251","MDNS","247","Standard query response 0x0000 PTR, cache flush dch.local PTR, cache flush dch0D60.local PTR, cache flush dch.local AAAA, cache flush fe80::928d:78ff:fedd:d60 PTR, cache flush dch0D60.local"
"179","86.406617","10.10.10.39","224.0.0.251","MDNS","83","Standard query response 0x0000 A, cache flush 10.10.10.39"
"180","86.445877","10.10.10.39","52.28.131.102","TLSv1","188","Client Key Exchange, Change Cipher Spec, Encrypted Handshake Message"
"181","86.449917","52.28.131.102","10.10.10.39","TLSv1","173","New Session Ticket"
"182","86.449941","52.28.131.102","10.10.10.39","TLSv1","60","Change Cipher Spec"
"183","86.449946","52.28.131.102","10.10.10.39","TLSv1","107","Encrypted Handshake Message"
"184","86.450867","10.10.10.39","52.28.131.102","TCP","54","37343  >  443 [ACK] Seq=342 Ack=3929 Win=11360 Len=0"
"185","86.451023","10.10.10.39","52.28.131.102","TCP","54","37343  >  443 [ACK] Seq=342 Ack=3935 Win=11360 Len=0"
"186","86.451099","10.10.10.39","52.28.131.102","TCP","54","37343  >  443 [ACK] Seq=342 Ack=3988 Win=11360 Len=0"
"187","86.473137","10.10.10.39","52.28.38.154","TCP","66","60985  >  443 [RST, ACK] Seq=736 Ack=4494 Win=14048 Len=0 TSval=4294936532 TSecr=437763585"
"188","86.489144","52.25.174.177","10.10.10.39","TCP","74","80  >  46298 [SYN, ACK] Seq=0 Ack=1 Win=17898 Len=0 MSS=1380 SACK_PERM=1 TSval=420426120 TSecr=4294936495 WS=256"
"189","86.489891","10.10.10.39","52.25.174.177","TCP","66","46298  >  80 [ACK] Seq=1 Ack=1 Win=5840 Len=0 TSval=4294936537 TSecr=420426120"
"190","86.491169","10.10.10.39","52.25.174.177","HTTP","227","GET /dst?timezone=Europe/Berlin&ts=1472724043&hash=9f3cb77f2f1a9b5c2a1957dbea7fa2f3 HTTP/1.1 "
"191","86.658350","52.25.174.177","10.10.10.39","TCP","66","80  >  46298 [ACK] Seq=1 Ack=162 Win=19200 Len=0 TSval=420426162 TSecr=4294936537"
"192","86.667920","52.25.174.177","10.10.10.39","HTTP","267","HTTP/1.1 200 OK  (application/json)"
"193","86.667948","52.25.174.177","10.10.10.39","TCP","66","80  >  46298 [FIN, ACK] Seq=202 Ack=162 Win=19200 Len=0 TSval=420426165 TSecr=4294936537"
"194","86.806606","10.10.10.39","52.25.174.177","TCP","66","46298  >  80 [ACK] Seq=162 Ack=202 Win=5840 Len=0 TSval=4294936616 TSecr=420426165"
"195","86.807127","10.10.10.39","52.25.174.177","TCP","66","46298  >  80 [ACK] Seq=162 Ack=203 Win=5840 Len=0 TSval=4294936616 TSecr=420426165"
"196","86.911160","10.10.10.39","52.28.131.102","TLSv1","256","Application Data, Application Data"
"197","86.955258","52.28.131.102","10.10.10.39","TCP","54","443  >  37343 [ACK] Seq=3988 Ack=544 Win=3120 Len=0"
"198","86.961547","10.10.10.39","52.25.174.177","TCP","66","46298  >  80 [FIN, ACK] Seq=162 Ack=203 Win=5840 Len=0 TSval=4294936654 TSecr=420426165"
"199","87.139808","52.25.174.177","10.10.10.39","TCP","66","80  >  46298 [ACK] Seq=203 Ack=163 Win=19200 Len=0 TSval=420426280 TSecr=4294936654"
"200","87.372814","10.10.10.39","224.0.0.251","MDNS","484","Standard query response 0x0000 TXT, cache flush PTR D-Link HNAP Service._dhnap._tcp.local SRV, cache flush 0 0 80 dch.local AAAA, cache flush fe80::928d:78ff:fedd:d60 A, cache flush 10.10.10.39 TXT, cache flush PTR _dhnap._tcp.local PTR D-Link DCH-S220 Configuration Utility._http._tcp.local SRV, cache flush 0 0 80 dch.local PTR _http._tcp.local"
"201","87.447329","10.10.10.39","224.0.0.251","MDNS","335","Standard query response 0x0000 PTR _dhnap._tcp.local PTR D-Link HNAP Service._dhnap._tcp.local SRV, cache flush 0 0 80 dch.local TXT, cache flush"
"202","87.451822","10.10.10.39","224.0.0.251","MDNS","196","Standard query response 0x0000 PTR _http._tcp.local PTR D-Link DCH-S220 Configuration Utility._http._tcp.local SRV, cache flush 0 0 80 dch.local TXT, cache flush"
"203","87.762496","10.10.10.39","224.0.0.251","MDNS","307","Standard query response 0x0000 AAAA, cache flush fe80::928d:78ff:fedd:d60 PTR, cache flush dch.local AAAA, cache flush fe80::928d:78ff:fedd:d60 PTR, cache flush dch0D60.local A, cache flush 10.10.10.39 PTR, cache flush dch.local A, cache flush 10.10.10.39 PTR, cache flush dch0D60.local"
"204","87.769855","10.10.10.39","224.0.0.22","IGMPv3","54","Membership Report / Leave group 224.0.0.251"
"205","88.442623","DavidEle_06:08:ba","D-LinkIn_dd:0d:60","ARP","42","Who has 10.10.10.39? Tell 10.10.10.1"
"206","88.443181","D-LinkIn_dd:0d:60","DavidEle_06:08:ba","ARP","42","10.10.10.39 is at 90:8d:78:dd:0d:60"
"207","89.227465","10.10.10.39","10.10.10.1","DNS","77","Standard query 0x0002 AAAA api.dch.dlink.com"
"208","89.253502","10.10.10.1","10.10.10.39","DNS","224","Standard query response 0x0002 AAAA api.dch.dlink.com CNAME eu-api-elb-1068129369.eu-central-1.elb.amazonaws.com SOA ns-1689.awsdns-19.co.uk"
"209","89.254255","10.10.10.39","10.10.10.1","DNS","112","Standard query 0x0003 AAAA eu-api-elb-1068129369.eu-central-1.elb.amazonaws.com"
"210","89.254334","10.10.10.1","10.10.10.39","DNS","112","Standard query response 0x0003 AAAA eu-api-elb-1068129369.eu-central-1.elb.amazonaws.com"
"211","89.255114","10.10.10.39","10.10.10.1","DNS","77","Standard query 0x0004 A api.dch.dlink.com"
"212","89.255181","10.10.10.1","10.10.10.39","DNS","175","Standard query response 0x0004 A api.dch.dlink.com CNAME eu-api-elb-1068129369.eu-central-1.elb.amazonaws.com A 52.28.38.154 A 52.58.68.165"
"213","89.256755","10.10.10.39","52.28.38.154","TCP","74","33491  >  80 [SYN] Seq=0 Win=5840 Len=0 MSS=1460 SACK_PERM=1 TSval=4294937228 TSecr=0 WS=2"
"214","89.259038","52.28.38.154","10.10.10.39","TCP","74","80  >  33491 [SYN, ACK] Seq=0 Ack=1 Win=17898 Len=0 MSS=1380 SACK_PERM=1 TSval=437764380 TSecr=4294937228 WS=256"
"215","89.259885","10.10.10.39","52.28.38.154","TCP","66","33491  >  80 [ACK] Seq=1 Ack=1 Win=5840 Len=0 TSval=4294937229 TSecr=437764380"
"216","89.260350","10.10.10.39","52.28.38.154","HTTP","336","GET /agent/upgrade?p=Z6zWda%2BrEQ5WuSMs0LOenuzWwjugS%2BaLwfWzLat00FtA4ya7TP1TmOq2fN8oPI2ao1KZ9y3I%2BufGN0cZgFsCb28YfdBM1%2Bj1l1XFPjrf7%2F%2BOas0Rt1F0bXWjWWORzVQN&iv=%2FoG3wZkyAzrJU2Se82jKBg%3D%3D HTTP/1.1 "
"217","89.262505","52.28.38.154","10.10.10.39","TCP","66","80  >  33491 [ACK] Seq=1 Ack=271 Win=19200 Len=0 TSval=437764380 TSecr=4294937229"
"218","89.440357","52.28.38.154","10.10.10.39","HTTP","554","HTTP/1.1 200 OK  (text/html)"
"219","89.440379","52.28.38.154","10.10.10.39","TCP","66","80  >  33491 [FIN, ACK] Seq=489 Ack=271 Win=19200 Len=0 TSval=437764425 TSecr=4294937229"
"220","89.442976","10.10.10.39","52.28.38.154","TCP","66","33491  >  80 [ACK] Seq=271 Ack=489 Win=6912 Len=0 TSval=4294937275 TSecr=437764425"
"221","89.458896","10.10.10.39","52.28.38.154","TCP","66","33491  >  80 [FIN, ACK] Seq=271 Ack=490 Win=6912 Len=0 TSval=4294937279 TSecr=437764425"
"222","89.461130","52.28.38.154","10.10.10.39","TCP","66","80  >  33491 [ACK] Seq=490 Ack=272 Win=19200 Len=0 TSval=437764430 TSecr=4294937279"
"223","89.690069","10.10.10.39","224.0.0.22","IGMPv3","54","Membership Report / Join group 224.0.0.251 for any sources"
"224","89.807271","52.28.131.102","10.10.10.39","TLSv1","91","Application Data"
"225","89.807448","52.28.131.102","10.10.10.39","TLSv1","1115","Application Data"
"226","89.808145","10.10.10.39","52.28.131.102","TCP","54","37343  >  443 [ACK] Seq=544 Ack=4025 Win=11360 Len=0"
"227","89.808349","10.10.10.39","52.28.131.102","TCP","54","37343  >  443 [ACK] Seq=544 Ack=5086 Win=14120 Len=0"
"228","89.810098","10.10.10.39","52.28.131.102","TCP","74","37346  >  443 [SYN] Seq=0 Win=5840 Len=0 MSS=1460 SACK_PERM=1 TSval=4294937367 TSecr=0 WS=2"
"229","89.811688","52.28.131.102","10.10.10.39","TCP","66","443  >  37346 [SYN, ACK] Seq=0 Ack=1 Win=2048 Len=0 MSS=1380 SACK_PERM=1 WS=8"
"230","89.812244","10.10.10.39","52.28.131.102","TCP","54","37346  >  443 [ACK] Seq=1 Ack=1 Win=5840 Len=0"
"231","89.861954","10.10.10.39","52.28.131.102","TLSv1","261","Client Hello"
"232","89.863417","52.28.131.102","10.10.10.39","TCP","54","443  >  37346 [ACK] Seq=1 Ack=208 Win=3120 Len=0"
"233","89.863566","52.28.131.102","10.10.10.39","TLSv1","112","Server Hello"
"234","89.863862","52.28.131.102","10.10.10.39","TCP","1434","443  >  37346 [ACK] Seq=59 Ack=208 Win=3120 Len=1380 [TCP segment of a reassembled PDU]"
"235","89.863935","52.28.131.102","10.10.10.39","TCP","1434","443  >  37346 [ACK] Seq=1439 Ack=208 Win=3120 Len=1380 [TCP segment of a reassembled PDU]"
"236","89.863943","52.28.131.102","10.10.10.39","TLSv1","700","Certificate"
"237","89.863972","10.10.10.39","52.28.131.102","TCP","54","37346  >  443 [ACK] Seq=208 Ack=59 Win=5840 Len=0"
"238","89.867651","10.10.10.39","52.28.131.102","TCP","54","37346  >  443 [ACK] Seq=208 Ack=1439 Win=8600 Len=0"
"239","89.867902","10.10.10.39","52.28.131.102","TCP","54","37346  >  443 [ACK] Seq=208 Ack=2819 Win=11360 Len=0"
"240","89.868001","10.10.10.39","52.28.131.102","TCP","54","37346  >  443 [ACK] Seq=208 Ack=3465 Win=11360 Len=0"
"241","89.871881","52.28.131.102","10.10.10.39","TLSv1","390","Server Key Exchange"
"242","89.871889","52.28.131.102","10.10.10.39","TLSv1","63","Server Hello Done"
"243","89.872479","10.10.10.39","52.28.131.102","TCP","54","37346  >  443 [ACK] Seq=208 Ack=3801 Win=11360 Len=0"
"244","89.873385","10.10.10.39","52.28.131.102","TCP","54","37346  >  443 [ACK] Seq=208 Ack=3810 Win=11360 Len=0"
"245","89.971890","10.10.10.39","52.28.131.102","TLSv1","188","Client Key Exchange, Change Cipher Spec, Encrypted Handshake Message"
"246","89.975311","52.28.131.102","10.10.10.39","TLSv1","173","New Session Ticket"
"247","89.975364","52.28.131.102","10.10.10.39","TLSv1","60","Change Cipher Spec"
"248","89.975421","52.28.131.102","10.10.10.39","TLSv1","107","Encrypted Handshake Message"
"249","89.984447","52.28.131.102","10.10.10.39","TCP","107","[TCP Retransmission] 443  >  37346 [PSH, ACK] Seq=3935 Ack=342 Win=3120 Len=53"
"250","89.985419","10.10.10.39","52.28.131.102","TCP","66","37346  >  443 [ACK] Seq=342 Ack=3988 Win=11360 Len=0 SLE=3935 SRE=3988"
"251","89.990986","10.10.10.39","224.0.0.251","MDNS","331","Standard query 0x0000 ANY 0.6.d.0.d.d.e.f.f.f.8.7.d.8.2.9.0.0.0.0.0.0.0.0.0.0.0.0.0.8.e.f.ip6.arpa, ""QM"" question ANY dch0D60.local, ""QM"" question ANY 39.10.10.10.in-addr.arpa, ""QM"" question ANY dch.local, ""QM"" question A 10.10.10.39 PTR dch0D60.local A 10.10.10.39 PTR dch.local AAAA fe80::928d:78ff:fedd:d60 PTR dch0D60.local AAAA fe80::928d:78ff:fedd:d60 PTR dch.local"
"252","90.035239","10.10.10.39","52.28.131.102","TLSv1","256","Application Data, Application Data"
"253","90.076504","52.28.131.102","10.10.10.39","TCP","54","443  >  37346 [ACK] Seq=3988 Ack=544 Win=3120 Len=0"
"254","90.079197","10.10.10.39","52.28.131.102","TLSv1","1184","Application Data, Application Data"
"255","90.081277","52.28.131.102","10.10.10.39","TCP","54","443  >  37343 [ACK] Seq=5086 Ack=1674 Win=5384 Len=0"
"256","90.247211","10.10.10.39","224.0.0.251","MDNS","331","Standard query 0x0000 ANY 0.6.d.0.d.d.e.f.f.f.8.7.d.8.2.9.0.0.0.0.0.0.0.0.0.0.0.0.0.8.e.f.ip6.arpa, ""QM"" question ANY dch0D60.local, ""QM"" question ANY 39.10.10.10.in-addr.arpa, ""QM"" question ANY dch.local, ""QM"" question A 10.10.10.39 PTR dch0D60.local A 10.10.10.39 PTR dch.local AAAA fe80::928d:78ff:fedd:d60 PTR dch0D60.local AAAA fe80::928d:78ff:fedd:d60 PTR dch.local"
"257","90.494876","10.10.10.39","224.0.0.251","MDNS","331","Standard query 0x0000 ANY 0.6.d.0.d.d.e.f.f.f.8.7.d.8.2.9.0.0.0.0.0.0.0.0.0.0.0.0.0.8.e.f.ip6.arpa, ""QM"" question ANY dch0D60.local, ""QM"" question ANY 39.10.10.10.in-addr.arpa, ""QM"" question ANY dch.local, ""QM"" question A 10.10.10.39 PTR dch0D60.local A 10.10.10.39 PTR dch.local AAAA fe80::928d:78ff:fedd:d60 PTR dch0D60.local AAAA fe80::928d:78ff:fedd:d60 PTR dch.local"
"258","90.626403","10.10.10.39","10.10.10.1","DNS","86","Standard query 0x0002 AAAA s3-us-west-2.amazonaws.com"
"259","90.626493","10.10.10.1","10.10.10.39","DNS","86","Standard query response 0x0002 AAAA s3-us-west-2.amazonaws.com"
"260","90.631018","10.10.10.39","10.10.10.1","DNS","86","Standard query 0x0003 A s3-us-west-2.amazonaws.com"
"261","90.698499","10.10.10.39","224.0.0.251","MDNS","307","Standard query response 0x0000 PTR, cache flush dch.local A, cache flush 10.10.10.39 PTR, cache flush dch0D60.local A, cache flush 10.10.10.39 PTR, cache flush dch.local AAAA, cache flush fe80::928d:78ff:fedd:d60 PTR, cache flush dch0D60.local AAAA, cache flush fe80::928d:78ff:fedd:d60"
"262","90.883556","10.10.10.1","10.10.10.39","DNS","303","Standard query response 0x0003 A s3-us-west-2.amazonaws.com A 54.231.169.40 NS ns-387.awsdns-48.com NS ns-671.awsdns-19.net NS ns-1568.awsdns-04.co.uk NS ns-1397.awsdns-46.org A 205.251.193.131 A 205.251.194.159 A 205.251.197.117 A 205.251.198.32"
"263","90.884690","10.10.10.39","54.231.169.40","TCP","74","34261  >  80 [SYN] Seq=0 Win=5840 Len=0 MSS=1460 SACK_PERM=1 TSval=4294937635 TSecr=0 WS=2"
"264","91.068697","54.231.169.40","10.10.10.39","TCP","66","80  >  34261 [SYN, ACK] Seq=0 Ack=1 Win=5840 Len=0 MSS=1380 WS=256 SACK_PERM=1"
"265","91.069279","10.10.10.39","54.231.169.40","TCP","54","34261  >  80 [ACK] Seq=1 Ack=1 Win=5840 Len=0"
"266","91.408093","10.10.10.39","224.0.0.251","MDNS","375","Standard query 0x0000 ANY D-Link DCH-S220 Configuration Utility._http._tcp.local, ""QM"" question ANY D-Link HNAP Service._dhnap._tcp.local, ""QM"" question SRV 0 0 80 dch.local TXT SRV 0 0 80 dch.local TXT"
"267","91.410096","10.10.10.39","54.231.169.40","HTTP","220","GET /static-us-west.dch.dlink.com/firmware/agent/DCH-S220/D-Link-DCH-S220-1.7.5-AX HTTP/1.1 "
"268","91.594132","54.231.169.40","10.10.10.39","TCP","54","80  >  34261 [ACK] Seq=1 Ack=167 Win=15872 Len=0"
"269","91.674472","54.231.169.40","10.10.10.39","TCP","442","80  >  34261 [PSH, ACK] Seq=1 Ack=167 Win=15872 Len=388 [TCP segment of a reassembled PDU]"
"270","91.674566","54.231.169.40","10.10.10.39","TCP","1434","80  >  34261 [ACK] Seq=389 Ack=167 Win=15872 Len=1380 [TCP segment of a reassembled PDU]"
"271","91.674680","54.231.169.40","10.10.10.39","TCP","1434","80  >  34261 [ACK] Seq=1769 Ack=167 Win=15872 Len=1380 [TCP segment of a reassembled PDU]"
"272","91.674693","54.231.169.40","10.10.10.39","TCP","1434","80  >  34261 [PSH, ACK] Seq=3149 Ack=167 Win=15872 Len=1380 [TCP segment of a reassembled PDU]"
"273","91.677712","10.10.10.39","54.231.169.40","TCP","54","34261  >  80 [ACK] Seq=167 Ack=389 Win=6912 Len=0"
"274","91.678513","10.10.10.39","54.231.169.40","TCP","54","34261  >  80 [ACK] Seq=167 Ack=1769 Win=9672 Len=0"
"275","91.678606","10.10.10.39","54.231.169.40","TCP","54","34261  >  80 [ACK] Seq=167 Ack=3149 Win=12432 Len=0"
"276","91.678839","10.10.10.39","54.231.169.40","TCP","54","34261  >  80 [ACK] Seq=167 Ack=4529 Win=15192 Len=0"
"277","91.714438","10.10.10.39","224.0.0.251","MDNS","375","Standard query 0x0000 ANY D-Link DCH-S220 Configuration Utility._http._tcp.local, ""QM"" question ANY D-Link HNAP Service._dhnap._tcp.local, ""QM"" question SRV 0 0 80 dch.local TXT SRV 0 0 80 dch.local TXT"
"278","91.861825","54.231.169.40","10.10.10.39","TCP","1434","80  >  34261 [ACK] Seq=4529 Ack=167 Win=15872 Len=1380 [TCP segment of a reassembled PDU]"
"279","91.861852","54.231.169.40","10.10.10.39","TCP","1434","80  >  34261 [ACK] Seq=5909 Ack=167 Win=15872 Len=1380 [TCP segment of a reassembled PDU]"
"280","91.862541","54.231.169.40","10.10.10.39","TCP","1434","80  >  34261 [PSH, ACK] Seq=7289 Ack=167 Win=15872 Len=1380 [TCP segment of a reassembled PDU]"
"281","91.862577","54.231.169.40","10.10.10.39","TCP","1434","80  >  34261 [ACK] Seq=8669 Ack=167 Win=15872 Len=1380 [TCP segment of a reassembled PDU]"
"282","91.862583","54.231.169.40","10.10.10.39","TCP","1434","80  >  34261 [ACK] Seq=10049 Ack=167 Win=15872 Len=1380 [TCP segment of a reassembled PDU]"
"283","91.862654","54.231.169.40","10.10.10.39","TCP","1434","80  >  34261 [PSH, ACK] Seq=11429 Ack=167 Win=15872 Len=1380 [TCP segment of a reassembled PDU]"
"284","91.862731","54.231.169.40","10.10.10.39","TCP","1434","80  >  34261 [ACK] Seq=12809 Ack=167 Win=15872 Len=1380 [TCP segment of a reassembled PDU]"
"285","91.862773","54.231.169.40","10.10.10.39","TCP","1434","80  >  34261 [ACK] Seq=14189 Ack=167 Win=15872 Len=1380 [TCP segment of a reassembled PDU]"
"286","91.862892","54.231.169.40","10.10.10.39","TCP","1434","80  >  34261 [PSH, ACK] Seq=15569 Ack=167 Win=15872 Len=1380 [TCP segment of a reassembled PDU]"
"287","91.862911","54.231.169.40","10.10.10.39","TCP","1434","80  >  34261 [ACK] Seq=16949 Ack=167 Win=15872 Len=1380 [TCP segment of a reassembled PDU]"
"288","91.863025","54.231.169.40","10.10.10.39","TCP","1434","80  >  34261 [ACK] Seq=18329 Ack=167 Win=15872 Len=1380 [TCP segment of a reassembled PDU]"
"289","91.863376","10.10.10.39","54.231.169.40","TCP","54","34261  >  80 [ACK] Seq=167 Ack=5909 Win=17952 Len=0"
"290","91.864896","10.10.10.39","54.231.169.40","TCP","54","34261  >  80 [ACK] Seq=167 Ack=7289 Win=17952 Len=0"
"291","91.865712","10.10.10.39","54.231.169.40","TCP","54","34261  >  80 [ACK] Seq=167 Ack=8669 Win=17952 Len=0"
"292","91.865805","10.10.10.39","54.231.169.40","TCP","54","34261  >  80 [ACK] Seq=167 Ack=10049 Win=17952 Len=0"
"293","91.866042","10.10.10.39","54.231.169.40","TCP","54","34261  >  80 [ACK] Seq=167 Ack=11429 Win=17952 Len=0"
"294","91.869358","10.10.10.39","54.231.169.40","TCP","54","34261  >  80 [ACK] Seq=167 Ack=14189 Win=17952 Len=0"
"295","91.870203","10.10.10.39","54.231.169.40","TCP","54","34261  >  80 [ACK] Seq=167 Ack=16949 Win=17952 Len=0"
"296","91.871892","10.10.10.39","54.231.169.40","TCP","54","34261  >  80 [ACK] Seq=167 Ack=19709 Win=17952 Len=0"
"297","91.917270","10.10.10.39","224.0.0.251","MDNS","486","Standard query response 0x0000 TXT, cache flush PTR D-Link HNAP Service._dhnap._tcp.local SRV, cache flush 0 0 80 dch.local AAAA, cache flush fe80::928d:78ff:fedd:d60 A, cache flush 10.10.10.39 TXT, cache flush PTR _dhnap._tcp.local PTR D-Link DCH-S220 Configuration Utility._http._tcp.local SRV, cache flush 0 0 80 dch.local PTR _http._tcp.local"
"298","91.922731","10.10.10.39","224.0.0.251","MDNS","247","Standard query response 0x0000 PTR, cache flush dch.local PTR, cache flush dch0D60.local PTR, cache flush dch.local AAAA, cache flush fe80::928d:78ff:fedd:d60 PTR, cache flush dch0D60.local"
"299","91.923902","10.10.10.39","224.0.0.251","MDNS","83","Standard query response 0x0000 A, cache flush 10.10.10.39"
"300","92.047685","54.231.169.40","10.10.10.39","TCP","1434","80  >  34261 [PSH, ACK] Seq=19709 Ack=167 Win=15872 Len=1380 [TCP segment of a reassembled PDU]"
"301","92.047723","54.231.169.40","10.10.10.39","TCP","1434","80  >  34261 [ACK] Seq=21089 Ack=167 Win=15872 Len=1380 [TCP segment of a reassembled PDU]"
"302","92.047730","54.231.169.40","10.10.10.39","TCP","1434","80  >  34261 [ACK] Seq=22469 Ack=167 Win=15872 Len=1380 [TCP segment of a reassembled PDU]"
"303","92.049811","10.10.10.39","54.231.169.40","TCP","54","34261  >  80 [ACK] Seq=167 Ack=22469 Win=17952 Len=0"
"304","92.049827","54.231.169.40","10.10.10.39","TCP","1434","80  >  34261 [PSH, ACK] Seq=23849 Ack=167 Win=15872 Len=1380 [TCP segment of a reassembled PDU]"
"305","92.049850","54.231.169.40","10.10.10.39","TCP","1434","80  >  34261 [ACK] Seq=25229 Ack=167 Win=15872 Len=1380 [TCP segment of a reassembled PDU]"
"306","92.050044","54.231.169.40","10.10.10.39","TCP","1434","80  >  34261 [PSH, ACK] Seq=26609 Ack=167 Win=15872 Len=1380 [TCP segment of a reassembled PDU]"
"307","92.050356","54.231.169.40","10.10.10.39","TCP","1434","80  >  34261 [ACK] Seq=27989 Ack=167 Win=15872 Len=1380 [TCP segment of a reassembled PDU]"
"308","92.051396","10.10.10.39","54.231.169.40","TCP","54","34261  >  80 [ACK] Seq=167 Ack=25229 Win=17952 Len=0"
"309","92.052906","10.10.10.39","54.231.169.40","TCP","54","34261  >  80 [ACK] Seq=167 Ack=27989 Win=17952 Len=0"
"310","92.053471","54.231.169.40","10.10.10.39","TCP","1434","80  >  34261 [ACK] Seq=29369 Ack=167 Win=15872 Len=1380 [TCP segment of a reassembled PDU]"
"311","92.053492","54.231.169.40","10.10.10.39","TCP","1434","80  >  34261 [ACK] Seq=30749 Ack=167 Win=15872 Len=1380 [TCP segment of a reassembled PDU]"
"312","92.054237","54.231.169.40","10.10.10.39","TCP","1434","80  >  34261 [ACK] Seq=32129 Ack=167 Win=15872 Len=1380 [TCP segment of a reassembled PDU]"
"313","92.054255","54.231.169.40","10.10.10.39","TCP","1434","80  >  34261 [ACK] Seq=33509 Ack=167 Win=15872 Len=1380 [TCP segment of a reassembled PDU]"
"314","92.055474","10.10.10.39","54.231.169.40","TCP","54","34261  >  80 [ACK] Seq=167 Ack=30749 Win=17952 Len=0"
"315","92.055919","54.231.169.40","10.10.10.39","TCP","1434","80  >  34261 [ACK] Seq=34889 Ack=167 Win=15872 Len=1380 [TCP segment of a reassembled PDU]"
"316","92.055936","54.231.169.40","10.10.10.39","TCP","1434","80  >  34261 [ACK] Seq=36269 Ack=167 Win=15872 Len=1380 [TCP segment of a reassembled PDU]"
"317","92.058855","10.10.10.39","54.231.169.40","TCP","54","34261  >  80 [ACK] Seq=167 Ack=33509 Win=17952 Len=0"
"318","92.059082","10.10.10.39","54.231.169.40","TCP","54","34261  >  80 [ACK] Seq=167 Ack=36269 Win=17952 Len=0"
"319","92.097834","10.10.10.39","54.231.169.40","TCP","54","34261  >  80 [ACK] Seq=167 Ack=37649 Win=17952 Len=0"
"320","92.233885","54.231.169.40","10.10.10.39","TCP","1434","80  >  34261 [ACK] Seq=37649 Ack=167 Win=15872 Len=1380 [TCP segment of a reassembled PDU]"
"321","92.233906","54.231.169.40","10.10.10.39","TCP","1434","80  >  34261 [ACK] Seq=39029 Ack=167 Win=15872 Len=1380 [TCP segment of a reassembled PDU]"
"322","92.235436","54.231.169.40","10.10.10.39","TCP","1434","80  >  34261 [ACK] Seq=40409 Ack=167 Win=15872 Len=1380 [TCP segment of a reassembled PDU]"
"323","92.235450","54.231.169.40","10.10.10.39","TCP","1434","80  >  34261 [ACK] Seq=41789 Ack=167 Win=15872 Len=1380 [TCP segment of a reassembled PDU]"
"324","92.235463","10.10.10.39","54.231.169.40","TCP","54","34261  >  80 [ACK] Seq=167 Ack=40409 Win=17952 Len=0"
"325","92.236916","54.231.169.40","10.10.10.39","TCP","1434","80  >  34261 [PSH, ACK] Seq=43169 Ack=167 Win=15872 Len=1380 [TCP segment of a reassembled PDU]"
"326","92.236933","54.231.169.40","10.10.10.39","TCP","1434","80  >  34261 [PSH, ACK] Seq=44549 Ack=167 Win=15872 Len=1380 [TCP segment of a reassembled PDU]"
"327","92.238561","10.10.10.39","54.231.169.40","TCP","54","34261  >  80 [ACK] Seq=167 Ack=43169 Win=17952 Len=0"
"328","92.239474","54.231.169.40","10.10.10.39","TCP","1434","80  >  34261 [ACK] Seq=45929 Ack=167 Win=15872 Len=1380 [TCP segment of a reassembled PDU]"
"329","92.239536","54.231.169.40","10.10.10.39","TCP","1434","80  >  34261 [ACK] Seq=47309 Ack=167 Win=15872 Len=1380 [TCP segment of a reassembled PDU]"
"330","92.241982","10.10.10.39","54.231.169.40","TCP","54","34261  >  80 [ACK] Seq=167 Ack=45929 Win=17952 Len=0"
"331","92.242251","10.10.10.39","54.231.169.40","TCP","54","34261  >  80 [ACK] Seq=167 Ack=48689 Win=17952 Len=0"
"332","92.242839","54.231.169.40","10.10.10.39","TCP","1434","80  >  34261 [ACK] Seq=48689 Ack=167 Win=15872 Len=1380 [TCP segment of a reassembled PDU]"
"333","92.242880","54.231.169.40","10.10.10.39","TCP","1434","80  >  34261 [ACK] Seq=50069 Ack=167 Win=15872 Len=1380 [TCP segment of a reassembled PDU]"
"334","92.243079","54.231.169.40","10.10.10.39","TCP","1434","80  >  34261 [ACK] Seq=51449 Ack=167 Win=15872 Len=1380 [TCP segment of a reassembled PDU]"
"335","92.243179","54.231.169.40","10.10.10.39","TCP","1434","80  >  34261 [ACK] Seq=52829 Ack=167 Win=15872 Len=1380 [TCP segment of a reassembled PDU]"
"336","92.245724","10.10.10.39","54.231.169.40","TCP","54","34261  >  80 [ACK] Seq=167 Ack=51449 Win=17952 Len=0"
"337","92.246746","10.10.10.39","54.231.169.40","TCP","54","34261  >  80 [ACK] Seq=167 Ack=54209 Win=17952 Len=0"
"338","92.281881","54.231.169.40","10.10.10.39","TCP","1434","80  >  34261 [ACK] Seq=54209 Ack=167 Win=15872 Len=1380 [TCP segment of a reassembled PDU]"
"339","92.338148","10.10.10.39","54.231.169.40","TCP","54","34261  >  80 [ACK] Seq=167 Ack=55589 Win=17952 Len=0"
"340","92.419500","54.231.169.40","10.10.10.39","TCP","1434","80  >  34261 [ACK] Seq=55589 Ack=167 Win=15872 Len=1380 [TCP segment of a reassembled PDU]"
"341","92.419527","54.231.169.40","10.10.10.39","TCP","1434","80  >  34261 [ACK] Seq=56969 Ack=167 Win=15872 Len=1380 [TCP segment of a reassembled PDU]"
"342","92.421127","10.10.10.39","54.231.169.40","TCP","54","34261  >  80 [ACK] Seq=167 Ack=58349 Win=17952 Len=0"
"343","92.422597","54.231.169.40","10.10.10.39","TCP","1434","80  >  34261 [ACK] Seq=58349 Ack=167 Win=15872 Len=1380 [TCP segment of a reassembled PDU]"
"344","92.422624","54.231.169.40","10.10.10.39","TCP","1434","80  >  34261 [ACK] Seq=59729 Ack=167 Win=15872 Len=1380 [TCP segment of a reassembled PDU]"
"345","92.424190","10.10.10.39","54.231.169.40","TCP","54","34261  >  80 [ACK] Seq=167 Ack=61109 Win=17952 Len=0"
"346","92.426061","54.231.169.40","10.10.10.39","TCP","1434","80  >  34261 [PSH, ACK] Seq=61109 Ack=167 Win=15872 Len=1380 [TCP segment of a reassembled PDU]"
"347","92.426094","54.231.169.40","10.10.10.39","TCP","1434","80  >  34261 [ACK] Seq=62489 Ack=167 Win=15872 Len=1380 [TCP segment of a reassembled PDU]"
"348","92.426157","54.231.169.40","10.10.10.39","TCP","1434","80  >  34261 [ACK] Seq=63869 Ack=167 Win=15872 Len=1380 [TCP segment of a reassembled PDU]"
"349","92.426286","54.231.169.40","10.10.10.39","TCP","1434","80  >  34261 [ACK] Seq=65249 Ack=167 Win=15872 Len=1380 [TCP segment of a reassembled PDU]"
"350","92.428312","10.10.10.39","54.231.169.40","TCP","54","34261  >  80 [ACK] Seq=167 Ack=63869 Win=17952 Len=0"
"351","92.429784","54.231.169.40","10.10.10.39","TCP","1434","80  >  34261 [ACK] Seq=66629 Ack=167 Win=15872 Len=1380 [TCP segment of a reassembled PDU]"
"352","92.429809","54.231.169.40","10.10.10.39","TCP","1434","80  >  34261 [ACK] Seq=68009 Ack=167 Win=15872 Len=1380 [TCP segment of a reassembled PDU]"
"353","92.430746","54.231.169.40","10.10.10.39","TCP","1434","80  >  34261 [ACK] Seq=69389 Ack=167 Win=15872 Len=1380 [TCP segment of a reassembled PDU]"
"354","92.430819","54.231.169.40","10.10.10.39","TCP","1434","80  >  34261 [ACK] Seq=70769 Ack=167 Win=15872 Len=1380 [TCP segment of a reassembled PDU]"
"355","92.433312","10.10.10.39","54.231.169.40","TCP","54","34261  >  80 [ACK] Seq=167 Ack=66629 Win=17952 Len=0"
"356","92.433439","10.10.10.39","54.231.169.40","TCP","54","34261  >  80 [ACK] Seq=167 Ack=69389 Win=17952 Len=0"
"357","92.435147","10.10.10.39","54.231.169.40","TCP","54","34261  >  80 [ACK] Seq=167 Ack=72149 Win=17952 Len=0"
"358","92.522187","54.231.169.40","10.10.10.39","TCP","1434","80  >  34261 [ACK] Seq=72149 Ack=167 Win=15872 Len=1380 [TCP segment of a reassembled PDU]"
"359","92.561793","10.10.10.39","54.231.169.40","TCP","54","34261  >  80 [ACK] Seq=167 Ack=73529 Win=17952 Len=0"
"360","92.605200","54.231.169.40","10.10.10.39","TCP","1434","80  >  34261 [ACK] Seq=73529 Ack=167 Win=15872 Len=1380 [TCP segment of a reassembled PDU]"
"361","92.605223","54.231.169.40","10.10.10.39","TCP","1434","80  >  34261 [ACK] Seq=74909 Ack=167 Win=15872 Len=1380 [TCP segment of a reassembled PDU]"
"362","92.606889","10.10.10.39","54.231.169.40","TCP","54","34261  >  80 [ACK] Seq=167 Ack=76289 Win=17952 Len=0"
"363","92.608238","54.231.169.40","10.10.10.39","TCP","1434","80  >  34261 [ACK] Seq=76289 Ack=167 Win=15872 Len=1380 [TCP segment of a reassembled PDU]"
"364","92.608265","54.231.169.40","10.10.10.39","TCP","1434","80  >  34261 [PSH, ACK] Seq=77669 Ack=167 Win=15872 Len=1380 [TCP segment of a reassembled PDU]"
"365","92.609903","10.10.10.39","54.231.169.40","TCP","54","34261  >  80 [ACK] Seq=167 Ack=79049 Win=17952 Len=0"
"366","92.612389","54.231.169.40","10.10.10.39","TCP","1434","80  >  34261 [ACK] Seq=79049 Ack=167 Win=15872 Len=1380 [TCP segment of a reassembled PDU]"
"367","92.612412","54.231.169.40","10.10.10.39","TCP","1434","80  >  34261 [ACK] Seq=80429 Ack=167 Win=15872 Len=1380 [TCP segment of a reassembled PDU]"
"368","92.615428","10.10.10.39","54.231.169.40","TCP","54","34261  >  80 [ACK] Seq=167 Ack=81809 Win=17952 Len=0"
"369","92.617396","54.231.169.40","10.10.10.39","TCP","1434","80  >  34261 [ACK] Seq=81809 Ack=167 Win=15872 Len=1380 [TCP segment of a reassembled PDU]"
"370","92.617423","54.231.169.40","10.10.10.39","TCP","1434","80  >  34261 [ACK] Seq=83189 Ack=167 Win=15872 Len=1380 [TCP segment of a reassembled PDU]"
"371","92.617528","54.231.169.40","10.10.10.39","TCP","1434","80  >  34261 [ACK] Seq=84569 Ack=167 Win=15872 Len=1380 [TCP segment of a reassembled PDU]"
"372","92.617543","54.231.169.40","10.10.10.39","TCP","1434","80  >  34261 [ACK] Seq=85949 Ack=167 Win=15872 Len=1380 [TCP segment of a reassembled PDU]"
"373","92.619268","54.231.169.40","10.10.10.39","TCP","1434","80  >  34261 [ACK] Seq=87329 Ack=167 Win=15872 Len=1380 [TCP segment of a reassembled PDU]"
"374","92.619295","54.231.169.40","10.10.10.39","TCP","1434","80  >  34261 [ACK] Seq=88709 Ack=167 Win=15872 Len=1380 [TCP segment of a reassembled PDU]"
"375","92.620480","10.10.10.39","54.231.169.40","TCP","54","34261  >  80 [ACK] Seq=167 Ack=84569 Win=17952 Len=0"
"376","92.621910","10.10.10.39","54.231.169.40","TCP","54","34261  >  80 [ACK] Seq=167 Ack=87329 Win=17952 Len=0"
"377","92.622159","10.10.10.39","54.231.169.40","TCP","54","34261  >  80 [ACK] Seq=167 Ack=90089 Win=17952 Len=0"
"378","92.745890","54.231.169.40","10.10.10.39","TCP","1434","80  >  34261 [ACK] Seq=90089 Ack=167 Win=15872 Len=1380 [TCP segment of a reassembled PDU]"
"379","92.785840","10.10.10.39","54.231.169.40","TCP","54","34261  >  80 [ACK] Seq=167 Ack=91469 Win=17952 Len=0"
"380","92.791088","54.231.169.40","10.10.10.39","TCP","1434","80  >  34261 [ACK] Seq=91469 Ack=167 Win=15872 Len=1380 [TCP segment of a reassembled PDU]"
"381","92.791117","54.231.169.40","10.10.10.39","TCP","1434","80  >  34261 [ACK] Seq=92849 Ack=167 Win=15872 Len=1380 [TCP segment of a reassembled PDU]"
"382","92.792858","10.10.10.39","54.231.169.40","TCP","54","34261  >  80 [ACK] Seq=167 Ack=94229 Win=17952 Len=0"
"383","92.793976","54.231.169.40","10.10.10.39","TCP","1434","80  >  34261 [ACK] Seq=94229 Ack=167 Win=15872 Len=1380 [TCP segment of a reassembled PDU]"
"384","92.794005","54.231.169.40","10.10.10.39","TCP","1434","80  >  34261 [PSH, ACK] Seq=95609 Ack=167 Win=15872 Len=1380 [TCP segment of a reassembled PDU]"
"385","92.795729","10.10.10.39","54.231.169.40","TCP","54","34261  >  80 [ACK] Seq=167 Ack=96989 Win=17952 Len=0"
"386","92.799520","54.231.169.40","10.10.10.39","TCP","1434","80  >  34261 [ACK] Seq=96989 Ack=167 Win=15872 Len=1380 [TCP segment of a reassembled PDU]"
"387","92.799547","54.231.169.40","10.10.10.39","TCP","1434","80  >  34261 [ACK] Seq=98369 Ack=167 Win=15872 Len=1380 [TCP segment of a reassembled PDU]"
"388","92.803027","10.10.10.39","54.231.169.40","TCP","54","34261  >  80 [ACK] Seq=167 Ack=99749 Win=17952 Len=0"
"389","92.804607","54.231.169.40","10.10.10.39","TCP","1434","80  >  34261 [ACK] Seq=99749 Ack=167 Win=15872 Len=1380 [TCP segment of a reassembled PDU]"
"390","92.804635","54.231.169.40","10.10.10.39","TCP","1434","80  >  34261 [ACK] Seq=101129 Ack=167 Win=15872 Len=1380 [TCP segment of a reassembled PDU]"
"391","92.806007","54.231.169.40","10.10.10.39","TCP","1434","80  >  34261 [ACK] Seq=102509 Ack=167 Win=15872 Len=1380 [TCP segment of a reassembled PDU]"
"392","92.806035","54.231.169.40","10.10.10.39","TCP","1434","80  >  34261 [ACK] Seq=103889 Ack=167 Win=15872 Len=1380 [TCP segment of a reassembled PDU]"
"393","92.806076","54.231.169.40","10.10.10.39","TCP","1434","80  >  34261 [ACK] Seq=105269 Ack=167 Win=15872 Len=1380 [TCP segment of a reassembled PDU]"
"394","92.806218","54.231.169.40","10.10.10.39","TCP","1434","80  >  34261 [ACK] Seq=106649 Ack=167 Win=15872 Len=1380 [TCP segment of a reassembled PDU]"
"395","92.808256","10.10.10.39","54.231.169.40","TCP","54","34261  >  80 [ACK] Seq=167 Ack=102509 Win=17952 Len=0"
"396","92.811245","10.10.10.39","54.231.169.40","TCP","54","34261  >  80 [ACK] Seq=167 Ack=105269 Win=17952 Len=0"
"397","92.812486","10.10.10.39","54.231.169.40","TCP","54","34261  >  80 [ACK] Seq=167 Ack=108029 Win=17952 Len=0"
"398","92.970082","54.231.169.40","10.10.10.39","TCP","1434","80  >  34261 [ACK] Seq=108029 Ack=167 Win=15872 Len=1380 [TCP segment of a reassembled PDU]"
"399","92.977000","54.231.169.40","10.10.10.39","TCP","1434","80  >  34261 [ACK] Seq=109409 Ack=167 Win=15872 Len=1380 [TCP segment of a reassembled PDU]"
"400","92.977027","54.231.169.40","10.10.10.39","TCP","1434","80  >  34261 [ACK] Seq=110789 Ack=167 Win=15872 Len=1380 [TCP segment of a reassembled PDU]"
"401","92.978907","10.10.10.39","54.231.169.40","TCP","54","34261  >  80 [ACK] Seq=167 Ack=110789 Win=17952 Len=0"
"402","92.979807","54.231.169.40","10.10.10.39","TCP","1434","80  >  34261 [PSH, ACK] Seq=112169 Ack=167 Win=15872 Len=1380 [TCP segment of a reassembled PDU]"
"403","92.979839","54.231.169.40","10.10.10.39","TCP","1434","80  >  34261 [PSH, ACK] Seq=113549 Ack=167 Win=15872 Len=1380 [TCP segment of a reassembled PDU]"
"404","92.981787","10.10.10.39","54.231.169.40","TCP","54","34261  >  80 [ACK] Seq=167 Ack=113549 Win=17952 Len=0"
"405","92.987141","54.231.169.40","10.10.10.39","TCP","1434","80  >  34261 [ACK] Seq=114929 Ack=167 Win=15872 Len=1380 [TCP segment of a reassembled PDU]"
"406","92.987168","54.231.169.40","10.10.10.39","TCP","1434","80  >  34261 [ACK] Seq=116309 Ack=167 Win=15872 Len=1380 [TCP segment of a reassembled PDU]"
"407","92.988221","10.10.10.39","54.231.169.40","TCP","54","34261  >  80 [ACK] Seq=167 Ack=116309 Win=17952 Len=0"
"408","92.992508","54.231.169.40","10.10.10.39","TCP","1434","80  >  34261 [ACK] Seq=117689 Ack=167 Win=15872 Len=1380 [TCP segment of a reassembled PDU]"
"409","92.992536","54.231.169.40","10.10.10.39","TCP","1434","80  >  34261 [ACK] Seq=119069 Ack=167 Win=15872 Len=1380 [TCP segment of a reassembled PDU]"
"410","92.993816","10.10.10.39","54.231.169.40","TCP","54","34261  >  80 [ACK] Seq=167 Ack=119069 Win=17952 Len=0"
"411","92.995316","54.231.169.40","10.10.10.39","TCP","1434","80  >  34261 [ACK] Seq=120449 Ack=167 Win=15872 Len=1380 [TCP segment of a reassembled PDU]"
"412","92.995343","54.231.169.40","10.10.10.39","TCP","1434","80  >  34261 [ACK] Seq=121829 Ack=167 Win=15872 Len=1380 [TCP segment of a reassembled PDU]"
"413","92.996547","54.231.169.40","10.10.10.39","TCP","1434","80  >  34261 [ACK] Seq=123209 Ack=167 Win=15872 Len=1380 [TCP segment of a reassembled PDU]"
"414","92.996575","54.231.169.40","10.10.10.39","TCP","1434","80  >  34261 [ACK] Seq=124589 Ack=167 Win=15872 Len=1380 [TCP segment of a reassembled PDU]"
"415","92.996946","10.10.10.39","54.231.169.40","TCP","54","34261  >  80 [ACK] Seq=167 Ack=121829 Win=17952 Len=0"
"416","92.998242","10.10.10.39","54.231.169.40","TCP","54","34261  >  80 [ACK] Seq=167 Ack=124589 Win=17952 Len=0"
"417","93.037757","10.10.10.39","54.231.169.40","TCP","54","34261  >  80 [ACK] Seq=167 Ack=125969 Win=17952 Len=0"
"418","93.144811","10.10.10.39","224.0.0.251","MDNS","486","Standard query response 0x0000 TXT, cache flush PTR D-Link HNAP Service._dhnap._tcp.local SRV, cache flush 0 0 80 dch.local AAAA, cache flush fe80::928d:78ff:fedd:d60 A, cache flush 10.10.10.39 TXT, cache flush PTR _dhnap._tcp.local PTR D-Link DCH-S220 Configuration Utility._http._tcp.local SRV, cache flush 0 0 80 dch.local PTR _http._tcp.local"
"419","93.163035","54.231.169.40","10.10.10.39","TCP","1434","80  >  34261 [ACK] Seq=125969 Ack=167 Win=15872 Len=1380 [TCP segment of a reassembled PDU]"
"420","93.163058","54.231.169.40","10.10.10.39","TCP","1434","80  >  34261 [ACK] Seq=127349 Ack=167 Win=15872 Len=1380 [TCP segment of a reassembled PDU]"
"421","93.164898","10.10.10.39","54.231.169.40","TCP","54","34261  >  80 [ACK] Seq=167 Ack=128729 Win=17952 Len=0"
"422","93.165898","54.231.169.40","10.10.10.39","TCP","1434","80  >  34261 [ACK] Seq=128729 Ack=167 Win=15872 Len=1380 [TCP segment of a reassembled PDU]"
"423","93.165926","54.231.169.40","10.10.10.39","TCP","1434","80  >  34261 [PSH, ACK] Seq=130109 Ack=167 Win=15872 Len=1380 [TCP segment of a reassembled PDU]"
"424","93.167611","10.10.10.39","54.231.169.40","TCP","54","34261  >  80 [ACK] Seq=167 Ack=131489 Win=17952 Len=0"
"425","93.172304","54.231.169.40","10.10.10.39","TCP","1434","80  >  34261 [PSH, ACK] Seq=131489 Ack=167 Win=15872 Len=1380 [TCP segment of a reassembled PDU]"
"426","93.172331","54.231.169.40","10.10.10.39","TCP","1434","80  >  34261 [ACK] Seq=132869 Ack=167 Win=15872 Len=1380 [TCP segment of a reassembled PDU]"
"427","93.174418","10.10.10.39","54.231.169.40","TCP","54","34261  >  80 [ACK] Seq=167 Ack=134249 Win=17952 Len=0"
"428","93.177872","54.231.169.40","10.10.10.39","TCP","1434","80  >  34261 [ACK] Seq=134249 Ack=167 Win=15872 Len=1380 [TCP segment of a reassembled PDU]"
"429","93.177895","54.231.169.40","10.10.10.39","TCP","1434","80  >  34261 [ACK] Seq=135629 Ack=167 Win=15872 Len=1380 [TCP segment of a reassembled PDU]"
"430","93.179764","10.10.10.39","54.231.169.40","TCP","54","34261  >  80 [ACK] Seq=167 Ack=137009 Win=17952 Len=0"
"431","93.180983","54.231.169.40","10.10.10.39","TCP","1434","80  >  34261 [ACK] Seq=137009 Ack=167 Win=15872 Len=1380 [TCP segment of a reassembled PDU]"
"432","93.181001","54.231.169.40","10.10.10.39","TCP","1434","80  >  34261 [ACK] Seq=138389 Ack=167 Win=15872 Len=1380 [TCP segment of a reassembled PDU]"
"433","93.182309","54.231.169.40","10.10.10.39","TCP","1434","80  >  34261 [ACK] Seq=139769 Ack=167 Win=15872 Len=1380 [TCP segment of a reassembled PDU]"
"434","93.182346","54.231.169.40","10.10.10.39","TCP","1434","80  >  34261 [ACK] Seq=141149 Ack=167 Win=15872 Len=1380 [TCP segment of a reassembled PDU]"
"435","93.183544","10.10.10.39","54.231.169.40","TCP","54","34261  >  80 [ACK] Seq=167 Ack=139769 Win=17952 Len=0"
"436","93.185500","10.10.10.39","54.231.169.40","TCP","54","34261  >  80 [ACK] Seq=167 Ack=142529 Win=17952 Len=0"
"437","93.221869","54.231.169.40","10.10.10.39","TCP","1434","80  >  34261 [ACK] Seq=142529 Ack=167 Win=15872 Len=1380 [TCP segment of a reassembled PDU]"
"438","93.261880","10.10.10.39","54.231.169.40","TCP","54","34261  >  80 [ACK] Seq=167 Ack=143909 Win=17952 Len=0"
"439","93.349057","54.231.169.40","10.10.10.39","TCP","1434","80  >  34261 [ACK] Seq=143909 Ack=167 Win=15872 Len=1380 [TCP segment of a reassembled PDU]"
"440","93.349085","54.231.169.40","10.10.10.39","TCP","1434","80  >  34261 [ACK] Seq=145289 Ack=167 Win=15872 Len=1380 [TCP segment of a reassembled PDU]"
"441","93.350379","10.10.10.39","54.231.169.40","TCP","54","34261  >  80 [ACK] Seq=167 Ack=146669 Win=17952 Len=0"
"442","93.351691","54.231.169.40","10.10.10.39","TCP","1434","80  >  34261 [ACK] Seq=146669 Ack=167 Win=15872 Len=1380 [TCP segment of a reassembled PDU]"
"443","93.351720","54.231.169.40","10.10.10.39","TCP","1434","80  >  34261 [PSH, ACK] Seq=148049 Ack=167 Win=15872 Len=1380 [TCP segment of a reassembled PDU]"
"444","93.353612","10.10.10.39","54.231.169.40","TCP","54","34261  >  80 [ACK] Seq=167 Ack=149429 Win=17952 Len=0"
"445","93.358651","54.231.169.40","10.10.10.39","TCP","1434","80  >  34261 [PSH, ACK] Seq=149429 Ack=167 Win=15872 Len=1380 [TCP segment of a reassembled PDU]"
"446","93.358710","54.231.169.40","10.10.10.39","TCP","1434","80  >  34261 [ACK] Seq=150809 Ack=167 Win=15872 Len=1380 [TCP segment of a reassembled PDU]"
"447","93.360265","10.10.10.39","54.231.169.40","TCP","54","34261  >  80 [ACK] Seq=167 Ack=152189 Win=17952 Len=0"
"448","93.363967","54.231.169.40","10.10.10.39","TCP","1434","80  >  34261 [ACK] Seq=152189 Ack=167 Win=15872 Len=1380 [TCP segment of a reassembled PDU]"
"449","93.364014","54.231.169.40","10.10.10.39","TCP","1434","80  >  34261 [ACK] Seq=153569 Ack=167 Win=15872 Len=1380 [TCP segment of a reassembled PDU]"
"450","93.366008","10.10.10.39","54.231.169.40","TCP","54","34261  >  80 [ACK] Seq=167 Ack=154949 Win=17952 Len=0"
"451","93.367709","54.231.169.40","10.10.10.39","TCP","1434","80  >  34261 [ACK] Seq=154949 Ack=167 Win=15872 Len=1380 [TCP segment of a reassembled PDU]"
"452","93.367756","54.231.169.40","10.10.10.39","TCP","1434","80  >  34261 [ACK] Seq=156329 Ack=167 Win=15872 Len=1380 [TCP segment of a reassembled PDU]"
"453","93.369523","10.10.10.39","54.231.169.40","TCP","54","34261  >  80 [ACK] Seq=167 Ack=157709 Win=17952 Len=0"
"454","93.369567","54.231.169.40","10.10.10.39","TCP","1434","80  >  34261 [ACK] Seq=157709 Ack=167 Win=15872 Len=1380 [TCP segment of a reassembled PDU]"
"455","93.369602","54.231.169.40","10.10.10.39","TCP","1434","80  >  34261 [ACK] Seq=159089 Ack=167 Win=15872 Len=1380 [TCP segment of a reassembled PDU]"
"456","93.370881","10.10.10.39","54.231.169.40","TCP","54","34261  >  80 [ACK] Seq=167 Ack=160469 Win=17952 Len=0"
"457","93.446025","54.231.169.40","10.10.10.39","TCP","1434","80  >  34261 [ACK] Seq=160469 Ack=167 Win=15872 Len=1380 [TCP segment of a reassembled PDU]"
"458","93.485874","10.10.10.39","54.231.169.40","TCP","54","34261  >  80 [ACK] Seq=167 Ack=161849 Win=17952 Len=0"
"459","93.534536","54.231.169.40","10.10.10.39","TCP","1434","80  >  34261 [ACK] Seq=161849 Ack=167 Win=15872 Len=1380 [TCP segment of a reassembled PDU]"
"460","93.534591","54.231.169.40","10.10.10.39","TCP","1434","80  >  34261 [ACK] Seq=163229 Ack=167 Win=15872 Len=1380 [TCP segment of a reassembled PDU]"
"461","93.536565","10.10.10.39","54.231.169.40","TCP","54","34261  >  80 [ACK] Seq=167 Ack=164609 Win=17952 Len=0"
"462","93.537739","54.231.169.40","10.10.10.39","TCP","1434","80  >  34261 [PSH, ACK] Seq=164609 Ack=167 Win=15872 Len=1380 [TCP segment of a reassembled PDU]"
"463","93.537802","54.231.169.40","10.10.10.39","TCP","1434","80  >  34261 [PSH, ACK] Seq=165989 Ack=167 Win=15872 Len=1380 [TCP segment of a reassembled PDU]"
"464","93.539110","10.10.10.39","54.231.169.40","TCP","54","34261  >  80 [ACK] Seq=167 Ack=167369 Win=17952 Len=0"
"465","93.544490","54.231.169.40","10.10.10.39","TCP","1434","80  >  34261 [ACK] Seq=167369 Ack=167 Win=15872 Len=1380 [TCP segment of a reassembled PDU]"
"466","93.544546","54.231.169.40","10.10.10.39","TCP","1434","80  >  34261 [ACK] Seq=168749 Ack=167 Win=15872 Len=1380 [TCP segment of a reassembled PDU]"
"467","93.545838","10.10.10.39","54.231.169.40","TCP","54","34261  >  80 [ACK] Seq=167 Ack=170129 Win=17952 Len=0"
"468","93.550103","54.231.169.40","10.10.10.39","TCP","1434","80  >  34261 [ACK] Seq=170129 Ack=167 Win=15872 Len=1380 [TCP segment of a reassembled PDU]"
"469","93.550177","54.231.169.40","10.10.10.39","TCP","1434","80  >  34261 [ACK] Seq=171509 Ack=167 Win=15872 Len=1380 [TCP segment of a reassembled PDU]"
"470","93.551984","10.10.10.39","54.231.169.40","TCP","54","34261  >  80 [ACK] Seq=167 Ack=172889 Win=17952 Len=0"
"471","93.553638","54.231.169.40","10.10.10.39","TCP","1434","80  >  34261 [ACK] Seq=172889 Ack=167 Win=15872 Len=1380 [TCP segment of a reassembled PDU]"
"472","93.553686","54.231.169.40","10.10.10.39","TCP","1434","80  >  34261 [ACK] Seq=174269 Ack=167 Win=15872 Len=1380 [TCP segment of a reassembled PDU]"
"473","93.554997","10.10.10.39","54.231.169.40","TCP","54","34261  >  80 [ACK] Seq=167 Ack=175649 Win=17952 Len=0"
"474","93.555103","54.231.169.40","10.10.10.39","TCP","1434","80  >  34261 [ACK] Seq=175649 Ack=167 Win=15872 Len=1380 [TCP segment of a reassembled PDU]"
"475","93.555182","54.231.169.40","10.10.10.39","TCP","1434","80  >  34261 [ACK] Seq=177029 Ack=167 Win=15872 Len=1380 [TCP segment of a reassembled PDU]"
"476","93.556521","10.10.10.39","54.231.169.40","TCP","54","34261  >  80 [ACK] Seq=167 Ack=178409 Win=17952 Len=0"
"477","93.670080","54.231.169.40","10.10.10.39","TCP","1434","80  >  34261 [ACK] Seq=178409 Ack=167 Win=15872 Len=1380 [TCP segment of a reassembled PDU]"
"478","93.709892","10.10.10.39","54.231.169.40","TCP","54","34261  >  80 [ACK] Seq=167 Ack=179789 Win=17952 Len=0"
"479","93.720761","54.231.169.40","10.10.10.39","TCP","1434","80  >  34261 [ACK] Seq=179789 Ack=167 Win=15872 Len=1380 [TCP segment of a reassembled PDU]"
"480","93.720812","54.231.169.40","10.10.10.39","TCP","1434","80  >  34261 [ACK] Seq=181169 Ack=167 Win=15872 Len=1380 [TCP segment of a reassembled PDU]"
"481","93.722622","10.10.10.39","54.231.169.40","TCP","54","34261  >  80 [ACK] Seq=167 Ack=182549 Win=17952 Len=0"
"482","93.723231","54.231.169.40","10.10.10.39","TCP","1434","80  >  34261 [PSH, ACK] Seq=182549 Ack=167 Win=15872 Len=1380 [TCP segment of a reassembled PDU]"
"483","93.723293","54.231.169.40","10.10.10.39","TCP","1434","80  >  34261 [PSH, ACK] Seq=183929 Ack=167 Win=15872 Len=1380 [TCP segment of a reassembled PDU]"
"484","93.725837","10.10.10.39","54.231.169.40","TCP","54","34261  >  80 [ACK] Seq=167 Ack=185309 Win=17952 Len=0"
"485","93.730042","54.231.169.40","10.10.10.39","TCP","1434","80  >  34261 [ACK] Seq=185309 Ack=167 Win=15872 Len=1380 [TCP segment of a reassembled PDU]"
"486","93.730097","54.231.169.40","10.10.10.39","TCP","1434","80  >  34261 [ACK] Seq=186689 Ack=167 Win=15872 Len=1380 [TCP segment of a reassembled PDU]"
"487","93.731426","10.10.10.39","54.231.169.40","TCP","54","34261  >  80 [ACK] Seq=167 Ack=188069 Win=17952 Len=0"
"488","93.736145","54.231.169.40","10.10.10.39","TCP","1434","80  >  34261 [ACK] Seq=188069 Ack=167 Win=15872 Len=1380 [TCP segment of a reassembled PDU]"
"489","93.736200","54.231.169.40","10.10.10.39","TCP","1434","80  >  34261 [ACK] Seq=189449 Ack=167 Win=15872 Len=1380 [TCP segment of a reassembled PDU]"
"490","93.738511","10.10.10.39","54.231.169.40","TCP","54","34261  >  80 [ACK] Seq=167 Ack=190829 Win=17952 Len=0"
"491","93.739073","54.231.169.40","10.10.10.39","TCP","1434","80  >  34261 [ACK] Seq=190829 Ack=167 Win=15872 Len=1380 [TCP segment of a reassembled PDU]"
"492","93.739119","54.231.169.40","10.10.10.39","TCP","1434","80  >  34261 [ACK] Seq=192209 Ack=167 Win=15872 Len=1380 [TCP segment of a reassembled PDU]"
"493","93.740632","54.231.169.40","10.10.10.39","TCP","1434","80  >  34261 [ACK] Seq=193589 Ack=167 Win=15872 Len=1380 [TCP segment of a reassembled PDU]"
"494","93.740669","54.231.169.40","10.10.10.39","TCP","1434","80  >  34261 [ACK] Seq=194969 Ack=167 Win=15872 Len=1380 [TCP segment of a reassembled PDU]"
"495","93.744518","10.10.10.39","54.231.169.40","TCP","54","34261  >  80 [ACK] Seq=167 Ack=193589 Win=17952 Len=0"
"496","93.745904","10.10.10.39","54.231.169.40","TCP","54","34261  >  80 [ACK] Seq=167 Ack=196349 Win=17952 Len=0"
"497","93.893780","54.231.169.40","10.10.10.39","HTTP","154","HTTP/1.1 200 OK  (binary/octet-stream)"
"498","93.909867","10.10.10.39","54.231.169.40","TCP","54","34261  >  80 [FIN, ACK] Seq=167 Ack=196450 Win=17952 Len=0"
"499","94.093788","54.231.169.40","10.10.10.39","TCP","54","80  >  34261 [ACK] Seq=196450 Ack=168 Win=15872 Len=0"
"500","94.152508","10.10.10.39","224.0.0.251","MDNS","307","Standard query response 0x0000 PTR, cache flush dch.local A, cache flush 10.10.10.39 A, cache flush 10.10.10.39 PTR, cache flush dch0D60.local PTR, cache flush dch.local AAAA, cache flush fe80::928d:78ff:fedd:d60 AAAA, cache flush fe80::928d:78ff:fedd:d60 PTR, cache flush dch0D60.local"
"501","94.819716","10.10.10.39","52.28.131.102","TCP","54","37343  >  443 [FIN, ACK] Seq=1674 Ack=5086 Win=14120 Len=0"
"502","94.820051","10.10.10.39","52.28.131.102","TCP","54","37346  >  443 [FIN, ACK] Seq=544 Ack=3988 Win=11360 Len=0"
"503","94.821684","52.28.131.102","10.10.10.39","TLSv1","91","Encrypted Alert"
"504","94.821713","52.28.131.102","10.10.10.39","TCP","54","443  >  37346 [FIN, ACK] Seq=4025 Ack=545 Win=3120 Len=0"
"505","94.821719","52.28.131.102","10.10.10.39","TLSv1","91","Encrypted Alert"
"506","94.821744","52.28.131.102","10.10.10.39","TCP","54","443  >  37343 [FIN, ACK] Seq=5123 Ack=1675 Win=5384 Len=0"
"507","94.822391","10.10.10.39","52.28.131.102","TCP","54","37346  >  443 [RST] Seq=545 Win=0 Len=0"
"508","94.822820","10.10.10.39","52.28.131.102","TCP","54","37346  >  443 [RST] Seq=545 Win=0 Len=0"
"509","94.822914","10.10.10.39","52.28.131.102","TCP","54","37343  >  443 [RST] Seq=1675 Win=0 Len=0"
"510","94.823121","10.10.10.39","52.28.131.102","TCP","54","37343  >  443 [RST] Seq=1675 Win=0 Len=0"
"511","95.372689","10.10.10.39","224.0.0.251","MDNS","486","Standard query response 0x0000 TXT, cache flush PTR D-Link HNAP Service._dhnap._tcp.local SRV, cache flush 0 0 80 dch.local AAAA, cache flush fe80::928d:78ff:fedd:d60 A, cache flush 10.10.10.39 TXT, cache flush PTR _dhnap._tcp.local PTR D-Link DCH-S220 Configuration Utility._http._tcp.local SRV, cache flush 0 0 80 dch.local PTR _http._tcp.local"
"512","96.642089","10.10.10.39","10.10.10.1","DNS","77","Standard query 0x0002 A api.dch.dlink.com"
"513","96.642183","10.10.10.1","10.10.10.39","DNS","175","Standard query response 0x0002 A api.dch.dlink.com CNAME eu-api-elb-1068129369.eu-central-1.elb.amazonaws.com A 52.58.68.165 A 52.28.38.154"
"514","96.643262","10.10.10.39","52.58.68.165","TCP","74","52514  >  443 [SYN] Seq=0 Win=5840 Len=0 MSS=1460 SACK_PERM=1 TSval=4294939075 TSecr=0 WS=2"
"515","96.645693","52.58.68.165","10.10.10.39","TCP","74","443  >  52514 [SYN, ACK] Seq=0 Ack=1 Win=17898 Len=0 MSS=1380 SACK_PERM=1 TSval=437765840 TSecr=4294939075 WS=256"
"516","96.646339","10.10.10.39","52.58.68.165","TCP","66","52514  >  443 [ACK] Seq=1 Ack=1 Win=5840 Len=0 TSval=4294939076 TSecr=437765840"
"517","97.053423","10.10.10.39","52.58.68.165","TLSv1.2","365","Client Hello"
"518","97.055707","52.58.68.165","10.10.10.39","TCP","66","443  >  52514 [ACK] Seq=1 Ack=300 Win=19200 Len=0 TSval=437765943 TSecr=4294939177"
"519","97.057666","52.58.68.165","10.10.10.39","TLSv1.2","1434","Server Hello"
"520","97.057694","52.58.68.165","10.10.10.39","TCP","1434","443  >  52514 [ACK] Seq=1369 Ack=300 Win=19200 Len=1368 TSval=437765943 TSecr=4294939177 [TCP segment of a reassembled PDU]"
"521","97.057712","52.58.68.165","10.10.10.39","TLSv1.2","1149","Certificate, Server Key Exchange, Server Hello Done"
"522","97.059617","10.10.10.39","52.58.68.165","TCP","66","52514  >  443 [ACK] Seq=300 Ack=1369 Win=8576 Len=0 TSval=4294939179 TSecr=437765943"
"523","97.060286","10.10.10.39","52.58.68.165","TCP","66","52514  >  443 [ACK] Seq=300 Ack=2737 Win=11312 Len=0 TSval=4294939179 TSecr=437765943"
"524","97.060762","10.10.10.39","52.58.68.165","TCP","66","52514  >  443 [ACK] Seq=300 Ack=3820 Win=14048 Len=0 TSval=4294939179 TSecr=437765943"
"525","97.118406","10.10.10.39","52.58.68.165","TLSv1.2","192","Client Key Exchange, Change Cipher Spec, Encrypted Handshake Message"
"526","97.121507","52.58.68.165","10.10.10.39","TLSv1.2","292","New Session Ticket, Change Cipher Spec, Encrypted Handshake Message"
"527","97.122086","10.10.10.39","52.58.68.165","TCP","66","52514  >  443 [ACK] Seq=426 Ack=4046 Win=14048 Len=0 TSval=4294939195 TSecr=437765959"
"528","97.124299","10.10.10.39","52.58.68.165","TLSv1.2","523","Application Data"
"529","97.165957","52.58.68.165","10.10.10.39","TCP","66","443  >  52514 [ACK] Seq=4046 Ack=883 Win=20224 Len=0 TSval=437765971 TSecr=4294939195"
"530","97.297786","52.58.68.165","10.10.10.39","TLSv1.2","335","Application Data"
"531","97.297814","52.58.68.165","10.10.10.39","TLSv1.2","97","Encrypted Alert"
"532","97.299475","10.10.10.39","52.58.68.165","TCP","66","52514  >  443 [RST, ACK] Seq=883 Ack=4346 Win=14048 Len=0 TSval=4294939239 TSecr=437766003"
"533","97.585907","10.10.10.39","224.0.0.22","IGMPv3","54","Membership Report / Join group 224.0.0.251 for any sources"
"534","97.614387","10.10.10.39","52.58.68.165","TCP","74","52515  >  443 [SYN] Seq=0 Win=5840 Len=0 MSS=1460 SACK_PERM=1 TSval=4294939318 TSecr=0 WS=2"
"535","97.616854","52.58.68.165","10.10.10.39","TCP","74","443  >  52515 [SYN, ACK] Seq=0 Ack=1 Win=17898 Len=0 MSS=1380 SACK_PERM=1 TSval=437766083 TSecr=4294939318 WS=256"
"536","97.617486","10.10.10.39","52.58.68.165","TCP","66","52515  >  443 [ACK] Seq=1 Ack=1 Win=5840 Len=0 TSval=4294939318 TSecr=437766083"
"537","97.618550","10.10.10.39","52.58.68.165","TLSv1.2","557","Client Hello"
"538","97.620893","52.58.68.165","10.10.10.39","TCP","66","443  >  52515 [ACK] Seq=1 Ack=492 Win=19200 Len=0 TSval=437766084 TSecr=4294939319"
"539","97.620921","52.58.68.165","10.10.10.39","TLSv1.2","203","Server Hello, Change Cipher Spec, Encrypted Handshake Message"
"540","97.622627","10.10.10.39","52.58.68.165","TCP","66","52515  >  443 [ACK] Seq=492 Ack=138 Win=5840 Len=0 TSval=4294939320 TSecr=437766084"
"541","97.625526","10.10.10.39","52.58.68.165","TLSv1.2","117","Change Cipher Spec, Encrypted Handshake Message"
"542","97.665984","52.58.68.165","10.10.10.39","TCP","66","443  >  52515 [ACK] Seq=138 Ack=543 Win=19200 Len=0 TSval=437766096 TSecr=4294939320"
"543","97.666805","10.10.10.39","52.58.68.165","TLSv1.2","416","Application Data"
"544","97.669207","52.58.68.165","10.10.10.39","TCP","66","443  >  52515 [ACK] Seq=138 Ack=893 Win=20224 Len=0 TSval=437766096 TSecr=4294939331"
"545","98.311071","52.58.68.165","10.10.10.39","TLSv1.2","462","Application Data"
"546","98.311100","52.58.68.165","10.10.10.39","TLSv1.2","97","Encrypted Alert"
"547","98.313550","10.10.10.39","10.10.10.1","DNS","79","Standard query 0x0003 A r0801.dch.dlink.com"
"548","98.313642","10.10.10.1","10.10.10.39","DNS","95","Standard query response 0x0003 A r0801.dch.dlink.com A 52.28.161.134"
"549","98.314664","10.10.10.39","52.28.161.134","TCP","74","41699  >  443 [SYN] Seq=0 Win=5840 Len=0 MSS=1460 SACK_PERM=1 TSval=4294939493 TSecr=0 WS=2"
"550","98.315369","10.10.10.39","52.58.68.165","TCP","66","52515  >  443 [RST, ACK] Seq=893 Ack=565 Win=6912 Len=0 TSval=4294939493 TSecr=437766257"
"551","98.316969","52.28.161.134","10.10.10.39","TCP","66","443  >  41699 [SYN, ACK] Seq=0 Ack=1 Win=2048 Len=0 MSS=1380 SACK_PERM=1 WS=8"
"552","98.317844","10.10.10.39","52.28.161.134","TCP","54","41699  >  443 [ACK] Seq=1 Ack=1 Win=5840 Len=0"
"553","98.318691","10.10.10.39","52.28.161.134","TLSv1.2","353","Client Hello"
"554","98.320787","52.28.161.134","10.10.10.39","TCP","54","443  >  41699 [ACK] Seq=1 Ack=300 Win=3120 Len=0"
"555","98.320816","52.28.161.134","10.10.10.39","TLSv1.2","112","Server Hello"
"556","98.321075","52.28.161.134","10.10.10.39","TCP","1434","443  >  41699 [ACK] Seq=59 Ack=300 Win=3120 Len=1380 [TCP segment of a reassembled PDU]"
"557","98.321151","52.28.161.134","10.10.10.39","TCP","1434","443  >  41699 [ACK] Seq=1439 Ack=300 Win=3120 Len=1380 [TCP segment of a reassembled PDU]"
"558","98.321159","52.28.161.134","10.10.10.39","TLSv1.2","700","Certificate"
"559","98.324627","10.10.10.39","52.28.161.134","TCP","54","41699  >  443 [ACK] Seq=300 Ack=59 Win=5840 Len=0"
"560","98.324822","10.10.10.39","52.28.161.134","TCP","54","41699  >  443 [ACK] Seq=300 Ack=1439 Win=8600 Len=0"
"561","98.324931","10.10.10.39","52.28.161.134","TCP","54","41699  >  443 [ACK] Seq=300 Ack=2819 Win=11360 Len=0"
"562","98.326743","10.10.10.39","52.28.161.134","TCP","54","41699  >  443 [ACK] Seq=300 Ack=3465 Win=11360 Len=0"
"563","98.329241","52.28.161.134","10.10.10.39","TLSv1.2","392","Server Key Exchange"
"564","98.329271","52.28.161.134","10.10.10.39","TLSv1.2","63","Server Hello Done"
"565","98.330172","10.10.10.39","52.28.161.134","TCP","54","41699  >  443 [ACK] Seq=300 Ack=3803 Win=11360 Len=0"
"566","98.330377","10.10.10.39","52.28.161.134","TCP","54","41699  >  443 [ACK] Seq=300 Ack=3812 Win=11360 Len=0"
"567","98.385912","10.10.10.39","52.28.161.134","TLSv1.2","180","Client Key Exchange, Change Cipher Spec, Encrypted Handshake Message"
"568","98.389841","52.28.161.134","10.10.10.39","TLSv1.2","173","New Session Ticket"
"569","98.389863","52.28.161.134","10.10.10.39","TLSv1.2","60","Change Cipher Spec"
"570","98.389868","52.28.161.134","10.10.10.39","TLSv1.2","99","Encrypted Handshake Message"
"571","98.391599","10.10.10.39","52.28.161.134","TCP","54","41699  >  443 [ACK] Seq=426 Ack=3982 Win=11360 Len=0"
"572","98.392752","10.10.10.39","52.28.161.134","TLSv1.2","216","Application Data"
"573","98.432794","52.28.161.134","10.10.10.39","TCP","54","443  >  41699 [ACK] Seq=3982 Ack=588 Win=3120 Len=0"
"574","103.392523","52.28.161.134","10.10.10.39","TCP","54","[TCP Keep-Alive] 443  >  41699 [ACK] Seq=3981 Ack=588 Win=3120 Len=0"
"575","103.393046","10.10.10.39","52.28.161.134","TCP","54","[TCP Keep-Alive ACK] 41699  >  443 [ACK] Seq=588 Ack=3982 Win=11360 Len=0"
"576","108.400558","52.28.161.134","10.10.10.39","TCP","54","[TCP Keep-Alive] 443  >  41699 [ACK] Seq=3981 Ack=588 Win=3120 Len=0"
"577","108.401177","10.10.10.39","52.28.161.134","TCP","54","[TCP Keep-Alive ACK] 41699  >  443 [ACK] Seq=588 Ack=3982 Win=11360 Len=0"
"578","113.408577","52.28.161.134","10.10.10.39","TCP","54","[TCP Keep-Alive] 443  >  41699 [ACK] Seq=3981 Ack=588 Win=3120 Len=0"
"579","113.410155","10.10.10.39","52.28.161.134","TCP","54","[TCP Keep-Alive ACK] 41699  >  443 [ACK] Seq=588 Ack=3982 Win=11360 Len=0"
"580","118.416640","52.28.161.134","10.10.10.39","TCP","54","[TCP Keep-Alive] 443  >  41699 [ACK] Seq=3981 Ack=588 Win=3120 Len=0"
"581","118.418230","10.10.10.39","52.28.161.134","TCP","54","[TCP Keep-Alive ACK] 41699  >  443 [ACK] Seq=588 Ack=3982 Win=11360 Len=0"
"582","123.418687","DavidEle_06:08:ba","D-LinkIn_dd:0d:60","ARP","42","Who has 10.10.10.39? Tell 10.10.10.1"
"583","123.421917","D-LinkIn_dd:0d:60","DavidEle_06:08:ba","ARP","42","10.10.10.39 is at 90:8d:78:dd:0d:60"
"584","123.424710","52.28.161.134","10.10.10.39","TCP","54","[TCP Keep-Alive] 443  >  41699 [ACK] Seq=3981 Ack=588 Win=3120 Len=0"
"585","123.426278","10.10.10.39","52.28.161.134","TCP","54","[TCP Keep-Alive ACK] 41699  >  443 [ACK] Seq=588 Ack=3982 Win=11360 Len=0"
"586","128.432688","52.28.161.134","10.10.10.39","TCP","54","[TCP Keep-Alive] 443  >  41699 [ACK] Seq=3981 Ack=588 Win=3120 Len=0"
"587","128.434234","10.10.10.39","52.28.161.134","TCP","54","[TCP Keep-Alive ACK] 41699  >  443 [ACK] Seq=588 Ack=3982 Win=11360 Len=0"
"588","133.430390","D-LinkIn_dd:0d:60","DavidEle_06:08:ba","ARP","42","Who has 10.10.10.1? Tell 10.10.10.39"
"589","133.430403","DavidEle_06:08:ba","D-LinkIn_dd:0d:60","ARP","42","10.10.10.1 is at 00:b5:6d:06:08:ba"
"590","133.440747","52.28.161.134","10.10.10.39","TCP","54","[TCP Keep-Alive] 443  >  41699 [ACK] Seq=3981 Ack=588 Win=3120 Len=0"
"591","133.442388","10.10.10.39","52.28.161.134","TCP","54","[TCP Keep-Alive ACK] 41699  >  443 [ACK] Seq=588 Ack=3982 Win=11360 Len=0"
