"No.","Time","Source","Destination","Protocol","Length","Info"
"1","0.000000","52.28.131.102","10.10.10.87","TCP","54","443  >  42418 [ACK] Seq=1 Ack=1 Win=1513 Len=0"
"2","4.058868","DavidEle_06:08:ba","D-LinkIn_aa:fd:4e","ARP","42","Who has 10.10.10.87? Tell 10.10.10.1"
"3","4.059124","D-LinkIn_aa:fd:4e","DavidEle_06:08:ba","ARP","60","10.10.10.87 is at 1c:5f:2b:aa:fd:4e"
"4","4.063518","52.28.131.102","10.10.10.87","TCP","54","443  >  47616 [ACK] Seq=1 Ack=1 Win=390 Len=0"
"5","4.063848","10.10.10.87","52.28.131.102","TCP","60","[TCP ACKed unseen segment] 47616  >  443 [ACK] Seq=1 Ack=2 Win=2920 Len=0"
"6","5.013901","52.28.131.102","10.10.10.87","TCP","54","[TCP Dup ACK 1#1] 443  >  42418 [ACK] Seq=1 Ack=1 Win=1513 Len=0"
"7","5.014242","10.10.10.87","52.28.131.102","TCP","60","[TCP ACKed unseen segment] 42418  >  443 [ACK] Seq=1 Ack=2 Win=13309 Len=0"
"8","9.071516","52.28.131.102","10.10.10.87","TCP","54","[TCP Dup ACK 4#1] 443  >  47616 [ACK] Seq=1 Ack=1 Win=390 Len=0"
"9","9.071879","10.10.10.87","52.28.131.102","TCP","60","[TCP Dup ACK 5#1] [TCP ACKed unseen segment] 47616  >  443 [ACK] Seq=1 Ack=2 Win=2920 Len=0"
"10","10.016027","52.28.131.102","10.10.10.87","TCP","54","[TCP Dup ACK 1#2] 443  >  42418 [ACK] Seq=1 Ack=1 Win=1513 Len=0"
"11","10.016396","10.10.10.87","52.28.131.102","TCP","60","[TCP Dup ACK 7#1] [TCP ACKed unseen segment] 42418  >  443 [ACK] Seq=1 Ack=2 Win=13309 Len=0"
"12","10.060386","52.28.131.102","10.10.10.87","TLSv1.2","1026","[TCP Previous segment not captured] , Application Data"
"13","10.060847","10.10.10.87","52.28.131.102","TCP","60","[TCP ACKed unseen segment] 42418  >  443 [ACK] Seq=1 Ack=974 Win=14402 Len=0"
"14","10.234326","10.10.10.87","52.28.131.102","TLSv1.2","632","Application Data"
"15","10.236457","52.28.131.102","10.10.10.87","TCP","54","443  >  42418 [ACK] Seq=974 Ack=579 Win=1513 Len=0"
"16","10.311946","52.28.131.102","10.10.10.87","TLSv1.2","1087","Application Data"
"17","10.312448","10.10.10.87","52.28.131.102","TCP","60","42418  >  443 [ACK] Seq=579 Ack=2007 Win=15495 Len=0"
"18","10.397921","10.10.10.87","52.28.131.102","TLSv1.2","687","Application Data"
"19","10.400081","52.28.131.102","10.10.10.87","TCP","54","443  >  42418 [ACK] Seq=2007 Ack=1212 Win=1513 Len=0"
"20","14.079525","52.28.131.102","10.10.10.87","TCP","54","[TCP Dup ACK 4#2] 443  >  47616 [ACK] Seq=1 Ack=1 Win=390 Len=0"
"21","14.079887","10.10.10.87","52.28.131.102","TCP","60","[TCP Dup ACK 5#2] [TCP ACKed unseen segment] 47616  >  443 [ACK] Seq=1 Ack=2 Win=2920 Len=0"
"22","15.178017","52.28.131.102","10.10.10.87","TLSv1.2","1087","Application Data"
"23","15.178542","10.10.10.87","52.28.131.102","TCP","60","42418  >  443 [ACK] Seq=1212 Ack=3040 Win=16528 Len=0"
"24","15.276570","10.10.10.87","52.28.131.102","TLSv1.2","687","Application Data"
"25","15.278698","52.28.131.102","10.10.10.87","TCP","54","443  >  42418 [ACK] Seq=3040 Ack=1845 Win=1513 Len=0"
"26","19.087569","52.28.131.102","10.10.10.87","TCP","54","[TCP Dup ACK 4#3] 443  >  47616 [ACK] Seq=1 Ack=1 Win=390 Len=0"
"27","19.087978","10.10.10.87","52.28.131.102","TCP","60","[TCP Dup ACK 5#3] [TCP ACKed unseen segment] 47616  >  443 [ACK] Seq=1 Ack=2 Win=2920 Len=0"
"28","20.201874","52.28.131.102","10.10.10.87","TLSv1.2","1087","Application Data"
"29","20.202422","10.10.10.87","52.28.131.102","TCP","60","42418  >  443 [ACK] Seq=1845 Ack=4073 Win=16528 Len=0"
"30","20.288197","10.10.10.87","52.28.131.102","TLSv1.2","687","Application Data"
"31","20.290371","52.28.131.102","10.10.10.87","TCP","54","443  >  42418 [ACK] Seq=4073 Ack=2478 Win=1513 Len=0"
"32","23.454137","10.10.10.87","52.28.38.154","TCP","74","37733  >  443 [SYN] Seq=0 Win=5840 Len=0 MSS=1460 SACK_PERM=1 TSval=313780 TSecr=0 WS=2"
"33","23.456338","52.28.38.154","10.10.10.87","TCP","74","443  >  37733 [SYN, ACK] Seq=0 Ack=1 Win=17898 Len=0 MSS=1380 SACK_PERM=1 TSval=244974416 TSecr=313780 WS=256"
"34","23.456745","10.10.10.87","52.28.38.154","TCP","66","37733  >  443 [ACK] Seq=1 Ack=1 Win=5840 Len=0 TSval=313781 TSecr=244974416"
"35","23.457535","10.10.10.87","52.28.38.154","TLSv1.2","557","Client Hello"
"36","23.459602","52.28.38.154","10.10.10.87","TCP","66","443  >  37733 [ACK] Seq=1 Ack=492 Win=19200 Len=0 TSval=244974417 TSecr=313781"
"37","23.459625","52.28.38.154","10.10.10.87","TLSv1.2","203","Server Hello, Change Cipher Spec, Encrypted Handshake Message"
"38","23.460011","10.10.10.87","52.28.38.154","TCP","66","37733  >  443 [ACK] Seq=492 Ack=138 Win=5840 Len=0 TSval=313782 TSecr=244974417"
"39","23.463319","10.10.10.87","52.28.38.154","TLSv1.2","117","Change Cipher Spec, Encrypted Handshake Message"
"40","23.505025","52.28.38.154","10.10.10.87","TCP","66","443  >  37733 [ACK] Seq=138 Ack=543 Win=19200 Len=0 TSval=244974429 TSecr=313783"
"41","23.505554","10.10.10.87","52.28.38.154","TLSv1.2","1027","Application Data, Application Data"
"42","23.507767","52.28.38.154","10.10.10.87","TCP","66","443  >  37733 [ACK] Seq=138 Ack=1504 Win=20992 Len=0 TSval=244974429 TSecr=313793"
"43","23.684975","52.28.38.154","10.10.10.87","TLSv1.2","649","Application Data"
"44","23.687014","10.10.10.87","52.28.38.154","TCP","66","37733  >  443 [FIN, ACK] Seq=1504 Ack=721 Win=7006 Len=0 TSval=313839 TSecr=244974473"
"45","23.689074","52.28.38.154","10.10.10.87","TLSv1.2","97","Encrypted Alert"
"46","23.689098","52.28.38.154","10.10.10.87","TCP","66","443  >  37733 [FIN, ACK] Seq=752 Ack=1505 Win=20992 Len=0 TSval=244974475 TSecr=313839"
"47","23.689532","10.10.10.87","52.28.38.154","TCP","60","37733  >  443 [RST] Seq=1505 Win=0 Len=0"
"48","23.689533","10.10.10.87","52.28.38.154","TCP","60","37733  >  443 [RST] Seq=1505 Win=0 Len=0"
"49","24.095594","52.28.131.102","10.10.10.87","TCP","54","[TCP Dup ACK 4#4] 443  >  47616 [ACK] Seq=1 Ack=1 Win=390 Len=0"
"50","24.095965","10.10.10.87","52.28.131.102","TCP","60","[TCP Dup ACK 5#4] [TCP ACKed unseen segment] 47616  >  443 [ACK] Seq=1 Ack=2 Win=2920 Len=0"
"51","25.200152","52.28.131.102","10.10.10.87","TLSv1.2","1087","Application Data"
"52","25.200694","10.10.10.87","52.28.131.102","TCP","60","42418  >  443 [ACK] Seq=2478 Ack=5106 Win=16528 Len=0"
"53","25.330175","10.10.10.87","52.28.131.102","TLSv1.2","687","Application Data"
"54","25.332274","52.28.131.102","10.10.10.87","TCP","54","443  >  42418 [ACK] Seq=5106 Ack=3111 Win=1513 Len=0"
"55","29.103627","52.28.131.102","10.10.10.87","TCP","54","[TCP Dup ACK 4#5] 443  >  47616 [ACK] Seq=1 Ack=1 Win=390 Len=0"
"56","29.103983","10.10.10.87","52.28.131.102","TCP","60","[TCP Dup ACK 5#5] [TCP ACKed unseen segment] 47616  >  443 [ACK] Seq=1 Ack=2 Win=2920 Len=0"
"57","30.200168","52.28.131.102","10.10.10.87","TLSv1.2","1087","Application Data"
"58","30.200686","10.10.10.87","52.28.131.102","TCP","60","42418  >  443 [ACK] Seq=3111 Ack=6139 Win=16528 Len=0"
"59","30.281329","10.10.10.87","52.28.131.102","TLSv1.2","687","Application Data"
"60","30.283530","52.28.131.102","10.10.10.87","TCP","54","443  >  42418 [ACK] Seq=6139 Ack=3744 Win=1513 Len=0"
"61","34.111630","52.28.131.102","10.10.10.87","TCP","54","[TCP Dup ACK 4#6] 443  >  47616 [ACK] Seq=1 Ack=1 Win=390 Len=0"
"62","34.112014","10.10.10.87","52.28.131.102","TCP","60","[TCP Dup ACK 5#6] [TCP ACKed unseen segment] 47616  >  443 [ACK] Seq=1 Ack=2 Win=2920 Len=0"
"63","35.232025","52.28.131.102","10.10.10.87","TLSv1.2","1087","Application Data"
"64","35.232506","10.10.10.87","52.28.131.102","TCP","60","42418  >  443 [ACK] Seq=3744 Ack=7172 Win=16528 Len=0"
"65","35.428704","10.10.10.87","52.28.131.102","TLSv1.2","1079","Application Data"
"66","35.430953","52.28.131.102","10.10.10.87","TCP","54","443  >  42418 [ACK] Seq=7172 Ack=4769 Win=1513 Len=0"
"67","39.114856","DavidEle_06:08:ba","D-LinkIn_aa:fd:4e","ARP","42","Who has 10.10.10.87? Tell 10.10.10.1"
"68","39.115162","D-LinkIn_aa:fd:4e","DavidEle_06:08:ba","ARP","60","10.10.10.87 is at 1c:5f:2b:aa:fd:4e"
"69","39.119590","52.28.131.102","10.10.10.87","TCP","54","[TCP Dup ACK 4#7] 443  >  47616 [ACK] Seq=1 Ack=1 Win=390 Len=0"
"70","39.119952","10.10.10.87","52.28.131.102","TCP","60","[TCP Dup ACK 5#7] [TCP ACKed unseen segment] 47616  >  443 [ACK] Seq=1 Ack=2 Win=2920 Len=0"
"71","40.428094","52.28.131.102","10.10.10.87","TCP","54","[TCP Keep-Alive] 443  >  42418 [ACK] Seq=7171 Ack=4769 Win=1513 Len=0"
"72","40.428445","10.10.10.87","52.28.131.102","TCP","60","[TCP Keep-Alive ACK] 42418  >  443 [ACK] Seq=4769 Ack=7172 Win=16528 Len=0"
"73","41.250291","10.10.10.87","52.28.38.154","TCP","74","37738  >  443 [SYN] Seq=0 Win=5840 Len=0 MSS=1460 SACK_PERM=1 TSval=318229 TSecr=0 WS=2"
"74","41.253219","52.28.38.154","10.10.10.87","TCP","74","443  >  37738 [SYN, ACK] Seq=0 Ack=1 Win=17898 Len=0 MSS=1380 SACK_PERM=1 TSval=244978866 TSecr=318229 WS=256"
"75","41.253577","10.10.10.87","52.28.38.154","TCP","66","37738  >  443 [ACK] Seq=1 Ack=1 Win=5840 Len=0 TSval=318230 TSecr=244978866"
"76","41.254385","10.10.10.87","52.28.38.154","TLSv1.2","557","Client Hello"
"77","41.256363","52.28.38.154","10.10.10.87","TCP","66","443  >  37738 [ACK] Seq=1 Ack=492 Win=19200 Len=0 TSval=244978866 TSecr=318230"
"78","41.256422","52.28.38.154","10.10.10.87","TLSv1.2","203","Server Hello, Change Cipher Spec, Encrypted Handshake Message"
"79","41.256776","10.10.10.87","52.28.38.154","TCP","66","37738  >  443 [ACK] Seq=492 Ack=138 Win=5840 Len=0 TSval=318231 TSecr=244978866"
"80","41.260050","10.10.10.87","52.28.38.154","TLSv1.2","117","Change Cipher Spec, Encrypted Handshake Message"
"81","41.261343","10.10.10.87","52.28.38.154","TLSv1.2","1434","Application Data"
"82","41.263519","52.28.38.154","10.10.10.87","TCP","66","443  >  37738 [ACK] Seq=138 Ack=1911 Win=21760 Len=0 TSval=244978868 TSecr=318232"
"83","41.264062","10.10.10.87","52.28.38.154","TLSv1.2","1273","Application Data"
"84","41.305076","52.28.38.154","10.10.10.87","TCP","66","443  >  37738 [ACK] Seq=138 Ack=3118 Win=24576 Len=0 TSval=244978879 TSecr=318233"
"85","41.818380","52.28.38.154","10.10.10.87","TLSv1.2","665","Application Data"
"86","41.820293","10.10.10.87","52.28.38.154","TCP","66","37738  >  443 [FIN, ACK] Seq=3118 Ack=737 Win=7038 Len=0 TSval=318372 TSecr=244979006"
"87","41.826657","52.28.38.154","10.10.10.87","TLSv1.2","97","Encrypted Alert"
"88","41.827103","10.10.10.87","52.28.38.154","TCP","60","37738  >  443 [RST] Seq=3119 Win=0 Len=0"
"89","41.828608","52.28.38.154","10.10.10.87","TCP","66","443  >  37738 [FIN, ACK] Seq=768 Ack=3119 Win=24576 Len=0 TSval=244979008 TSecr=318372"
"90","41.828937","10.10.10.87","52.28.38.154","TCP","60","37738  >  443 [RST] Seq=3119 Win=0 Len=0"
"91","44.127696","52.28.131.102","10.10.10.87","TCP","54","[TCP Dup ACK 4#8] 443  >  47616 [ACK] Seq=1 Ack=1 Win=390 Len=0"
"92","44.128074","10.10.10.87","52.28.131.102","TCP","60","[TCP Dup ACK 5#8] [TCP ACKed unseen segment] 47616  >  443 [ACK] Seq=1 Ack=2 Win=2920 Len=0"
"93","45.440145","52.28.131.102","10.10.10.87","TCP","54","[TCP Keep-Alive] 443  >  42418 [ACK] Seq=7171 Ack=4769 Win=1513 Len=0"
"94","45.440478","10.10.10.87","52.28.131.102","TCP","60","[TCP Keep-Alive ACK] 42418  >  443 [ACK] Seq=4769 Ack=7172 Win=16528 Len=0"
"95","49.135786","52.28.131.102","10.10.10.87","TCP","54","[TCP Dup ACK 4#9] 443  >  47616 [ACK] Seq=1 Ack=1 Win=390 Len=0"
"96","49.136191","10.10.10.87","52.28.131.102","TCP","60","[TCP Dup ACK 5#9] [TCP ACKed unseen segment] 47616  >  443 [ACK] Seq=1 Ack=2 Win=2920 Len=0"
"97","49.646246","10.10.10.87","52.28.38.154","TCP","74","37740  >  443 [SYN] Seq=0 Win=5840 Len=0 MSS=1460 SACK_PERM=1 TSval=320328 TSecr=0 WS=2"
"98","49.648925","52.28.38.154","10.10.10.87","TCP","74","443  >  37740 [SYN, ACK] Seq=0 Ack=1 Win=17898 Len=0 MSS=1380 SACK_PERM=1 TSval=244980964 TSecr=320328 WS=256"
"99","49.649375","10.10.10.87","52.28.38.154","TCP","66","37740  >  443 [ACK] Seq=1 Ack=1 Win=5840 Len=0 TSval=320329 TSecr=244980964"
"100","49.650168","10.10.10.87","52.28.38.154","TLSv1.2","557","Client Hello"
"101","49.652524","52.28.38.154","10.10.10.87","TCP","66","443  >  37740 [ACK] Seq=1 Ack=492 Win=19200 Len=0 TSval=244980965 TSecr=320329"
"102","49.652567","52.28.38.154","10.10.10.87","TLSv1.2","203","Server Hello, Change Cipher Spec, Encrypted Handshake Message"
"103","49.652966","10.10.10.87","52.28.38.154","TCP","66","37740  >  443 [ACK] Seq=492 Ack=138 Win=5840 Len=0 TSval=320330 TSecr=244980965"
"104","49.656244","10.10.10.87","52.28.38.154","TLSv1.2","117","Change Cipher Spec, Encrypted Handshake Message"
"105","49.697391","52.28.38.154","10.10.10.87","TCP","66","443  >  37740 [ACK] Seq=138 Ack=543 Win=19200 Len=0 TSval=244980977 TSecr=320331"
"106","49.697983","10.10.10.87","52.28.38.154","TLSv1.2","1061","Application Data, Application Data"
"107","49.700503","52.28.38.154","10.10.10.87","TCP","66","443  >  37740 [ACK] Seq=138 Ack=1538 Win=20992 Len=0 TSval=244980977 TSecr=320341"
"108","50.448234","52.28.131.102","10.10.10.87","TCP","54","[TCP Keep-Alive] 443  >  42418 [ACK] Seq=7171 Ack=4769 Win=1513 Len=0"
"109","50.448616","10.10.10.87","52.28.131.102","TCP","60","[TCP Keep-Alive ACK] 42418  >  443 [ACK] Seq=4769 Ack=7172 Win=16528 Len=0"
"110","50.538282","52.28.38.154","10.10.10.87","TLSv1.2","649","Application Data"
"111","50.540251","10.10.10.87","52.28.38.154","TCP","66","37740  >  443 [FIN, ACK] Seq=1538 Ack=721 Win=7006 Len=0 TSval=320552 TSecr=244981186"
"112","50.547065","52.28.38.154","10.10.10.87","TLSv1.2","97","Encrypted Alert"
"113","50.547094","52.28.38.154","10.10.10.87","TCP","66","443  >  37740 [FIN, ACK] Seq=752 Ack=1539 Win=20992 Len=0 TSval=244981188 TSecr=320552"
"114","50.547546","10.10.10.87","52.28.38.154","TCP","60","37740  >  443 [RST] Seq=1539 Win=0 Len=0"
"115","50.547547","10.10.10.87","52.28.38.154","TCP","60","37740  >  443 [RST] Seq=1539 Win=0 Len=0"
"116","51.323768","52.28.131.102","10.10.10.87","TLSv1.2","1087","Application Data"
"117","51.324306","10.10.10.87","52.28.131.102","TCP","60","42418  >  443 [ACK] Seq=4769 Ack=8205 Win=16528 Len=0"
"118","51.403716","10.10.10.87","52.28.131.102","TLSv1.2","1079","Application Data"
"119","51.406026","52.28.131.102","10.10.10.87","TCP","54","443  >  42418 [ACK] Seq=8205 Ack=5794 Win=1513 Len=0"
"120","51.513237","52.28.131.102","10.10.10.87","TLSv1.2","1147","Application Data"
"121","51.513775","10.10.10.87","52.28.131.102","TCP","60","42418  >  443 [ACK] Seq=5794 Ack=9298 Win=16528 Len=0"
"122","51.630492","10.10.10.87","52.28.131.102","TLSv1.2","648","Application Data"
"123","51.632696","52.28.131.102","10.10.10.87","TCP","54","443  >  42418 [ACK] Seq=9298 Ack=6388 Win=1513 Len=0"
"124","51.720699","52.28.131.102","10.10.10.87","TLSv1.2","1112","Application Data"
"125","51.721192","10.10.10.87","52.28.131.102","TCP","60","42418  >  443 [ACK] Seq=6388 Ack=10356 Win=16528 Len=0"
"126","51.792051","10.10.10.87","52.28.131.102","TCP","1434","42418  >  443 [ACK] Seq=6388 Ack=10356 Win=16528 Len=1380 [TCP segment of a reassembled PDU]"
"127","51.792052","10.10.10.87","52.28.131.102","TLSv1.2","953","Application Data"
"128","51.794346","52.28.131.102","10.10.10.87","TCP","54","443  >  42418 [ACK] Seq=10356 Ack=7768 Win=1858 Len=0"
"129","51.794368","52.28.131.102","10.10.10.87","TCP","54","443  >  42418 [ACK] Seq=10356 Ack=8667 Win=1858 Len=0"
"130","53.858695","10.10.10.87","52.28.131.102","TCP","60","[TCP Keep-Alive] [TCP ACKed unseen segment] 47616  >  443 [ACK] Seq=0 Ack=2 Win=2920 Len=0"
"131","53.863442","52.28.131.102","10.10.10.87","TCP","54","[TCP Previous segment not captured] 443  >  47616 [ACK] Seq=2 Ack=1 Win=390 Len=0"
"132","54.143764","52.28.131.102","10.10.10.87","TCP","54","[TCP Keep-Alive] 443  >  47616 [ACK] Seq=1 Ack=1 Win=390 Len=0"
"133","54.144148","10.10.10.87","52.28.131.102","TCP","60","[TCP Keep-Alive ACK] 47616  >  443 [ACK] Seq=1 Ack=2 Win=2920 Len=0"
"134","56.796261","52.28.131.102","10.10.10.87","TCP","54","[TCP Keep-Alive] 443  >  42418 [ACK] Seq=10355 Ack=8667 Win=1858 Len=0"
"135","56.796647","10.10.10.87","52.28.131.102","TCP","60","[TCP Keep-Alive ACK] 42418  >  443 [ACK] Seq=8667 Ack=10356 Win=16528 Len=0"
"136","59.151776","52.28.131.102","10.10.10.87","TCP","54","[TCP Keep-Alive] 443  >  47616 [ACK] Seq=1 Ack=1 Win=390 Len=0"
"137","59.152143","10.10.10.87","52.28.131.102","TCP","60","[TCP Keep-Alive ACK] 47616  >  443 [ACK] Seq=1 Ack=2 Win=2920 Len=0"
"138","61.808259","52.28.131.102","10.10.10.87","TCP","54","[TCP Keep-Alive] 443  >  42418 [ACK] Seq=10355 Ack=8667 Win=1858 Len=0"
"139","61.808625","10.10.10.87","52.28.131.102","TCP","60","[TCP Keep-Alive ACK] 42418  >  443 [ACK] Seq=8667 Ack=10356 Win=16528 Len=0"
"140","64.159795","52.28.131.102","10.10.10.87","TCP","54","[TCP Keep-Alive] 443  >  47616 [ACK] Seq=1 Ack=1 Win=390 Len=0"
"141","64.160119","10.10.10.87","52.28.131.102","TCP","60","[TCP Keep-Alive ACK] 47616  >  443 [ACK] Seq=1 Ack=2 Win=2920 Len=0"
"142","66.816408","52.28.131.102","10.10.10.87","TCP","54","[TCP Keep-Alive] 443  >  42418 [ACK] Seq=10355 Ack=8667 Win=1858 Len=0"
"143","66.816800","10.10.10.87","52.28.131.102","TCP","60","[TCP Keep-Alive ACK] 42418  >  443 [ACK] Seq=8667 Ack=10356 Win=16528 Len=0"
"144","69.167872","52.28.131.102","10.10.10.87","TCP","54","[TCP Keep-Alive] 443  >  47616 [ACK] Seq=1 Ack=1 Win=390 Len=0"
"145","69.168269","10.10.10.87","52.28.131.102","TCP","60","[TCP Keep-Alive ACK] 47616  >  443 [ACK] Seq=1 Ack=2 Win=2920 Len=0"
"146","71.824329","52.28.131.102","10.10.10.87","TCP","54","[TCP Keep-Alive] 443  >  42418 [ACK] Seq=10355 Ack=8667 Win=1858 Len=0"
"147","71.824676","10.10.10.87","52.28.131.102","TCP","60","[TCP Keep-Alive ACK] 42418  >  443 [ACK] Seq=8667 Ack=10356 Win=16528 Len=0"
"148","74.170864","DavidEle_06:08:ba","D-LinkIn_aa:fd:4e","ARP","42","Who has 10.10.10.87? Tell 10.10.10.1"
"149","74.171146","D-LinkIn_aa:fd:4e","DavidEle_06:08:ba","ARP","60","10.10.10.87 is at 1c:5f:2b:aa:fd:4e"
"150","74.175828","52.28.131.102","10.10.10.87","TCP","54","[TCP Keep-Alive] 443  >  47616 [ACK] Seq=1 Ack=1 Win=390 Len=0"
"151","74.176166","10.10.10.87","52.28.131.102","TCP","60","[TCP Keep-Alive ACK] 47616  >  443 [ACK] Seq=1 Ack=2 Win=2920 Len=0"
"152","76.832371","52.28.131.102","10.10.10.87","TCP","54","[TCP Keep-Alive] 443  >  42418 [ACK] Seq=10355 Ack=8667 Win=1858 Len=0"
"153","76.832779","10.10.10.87","52.28.131.102","TCP","60","[TCP Keep-Alive ACK] 42418  >  443 [ACK] Seq=8667 Ack=10356 Win=16528 Len=0"
"154","79.174905","D-LinkIn_aa:fd:4e","DavidEle_06:08:ba","ARP","60","Who has 10.10.10.1? Tell 10.10.10.87"
"155","79.174933","DavidEle_06:08:ba","D-LinkIn_aa:fd:4e","ARP","42","10.10.10.1 is at 00:b5:6d:06:08:ba"
"156","79.183868","52.28.131.102","10.10.10.87","TCP","54","[TCP Keep-Alive] 443  >  47616 [ACK] Seq=1 Ack=1 Win=390 Len=0"
"157","79.184221","10.10.10.87","52.28.131.102","TCP","60","[TCP Keep-Alive ACK] 47616  >  443 [ACK] Seq=1 Ack=2 Win=2920 Len=0"
"158","81.840375","52.28.131.102","10.10.10.87","TCP","54","[TCP Keep-Alive] 443  >  42418 [ACK] Seq=10355 Ack=8667 Win=1858 Len=0"
"159","81.840731","10.10.10.87","52.28.131.102","TCP","60","[TCP Keep-Alive ACK] 42418  >  443 [ACK] Seq=8667 Ack=10356 Win=16528 Len=0"
"160","84.191907","52.28.131.102","10.10.10.87","TCP","54","[TCP Keep-Alive] 443  >  47616 [ACK] Seq=1 Ack=1 Win=390 Len=0"
"161","84.192284","10.10.10.87","52.28.131.102","TCP","60","[TCP Keep-Alive ACK] 47616  >  443 [ACK] Seq=1 Ack=2 Win=2920 Len=0"
