"No.","Time","Source","Destination","Protocol","Length","Info"
"1","0.000000","D-LinkIn_a9:3d:6f","IntelCor_c3:41:78","EAPOL","135","Key (Message 2 of 4)"
"2","0.004511","D-LinkIn_a9:3d:6f","IntelCor_c3:41:78","EAPOL","113","Key (Message 4 of 4)"
"3","2.713450","fe80::928d:78ff:fea9:3d6f","ff02::2","ICMPv6","70","Router Solicitation from 90:8d:78:a9:3d:6f"
"4","7.056326","0.0.0.0","255.255.255.255","DHCP","351","DHCP Discover - Transaction ID 0x2706f2ce"
"5","7.229425","0.0.0.0","255.255.255.255","DHCP","363","DHCP Request  - Transaction ID 0x2706f2ce"
"6","7.465230","10.10.10.176","224.0.0.22","IGMPv3","54","Membership Report / Join group 224.0.0.251 for any sources"
"7","7.606904","10.10.10.176","224.0.0.251","MDNS","557","Standard query 0x0000 ANY D-Link HNAP Service._dhnap._tcp.local, ""QM"" question ANY dsp3D6F.local, ""QM"" question ANY 176.10.10.10.in-addr.arpa, ""QM"" question ANY dsp.local, ""QM"" question ANY f.6.d.3.9.a.e.f.f.f.8.7.d.8.2.9.0.0.0.0.0.0.0.0.0.0.0.0.0.8.e.f.ip6.arpa, ""QM"" question A 10.10.10.176 PTR dsp3D6F.local A 10.10.10.176 PTR dsp.local AAAA fe80::928d:78ff:fea9:3d6f PTR dsp.local AAAA fe80::928d:78ff:fea9:3d6f PTR dsp3D6F.local SRV 0 0 80 dsp.local TXT"
"8","7.613560","10.10.10.176","224.0.0.251","MDNS","142","Standard query response 0x0000 PTR _dhnap._tcp.local PTR D-Link HNAP Service._dhnap._tcp.local"
"9","7.858357","10.10.10.176","224.0.0.251","MDNS","557","Standard query 0x0000 ANY D-Link HNAP Service._dhnap._tcp.local, ""QM"" question ANY dsp3D6F.local, ""QM"" question ANY 176.10.10.10.in-addr.arpa, ""QM"" question ANY dsp.local, ""QM"" question ANY f.6.d.3.9.a.e.f.f.f.8.7.d.8.2.9.0.0.0.0.0.0.0.0.0.0.0.0.0.8.e.f.ip6.arpa, ""QM"" question A 10.10.10.176 PTR dsp3D6F.local A 10.10.10.176 PTR dsp.local AAAA fe80::928d:78ff:fea9:3d6f PTR dsp.local AAAA fe80::928d:78ff:fea9:3d6f PTR dsp3D6F.local SRV 0 0 80 dsp.local TXT"
"10","8.110308","10.10.10.176","224.0.0.251","MDNS","557","Standard query 0x0000 ANY D-Link HNAP Service._dhnap._tcp.local, ""QM"" question ANY dsp3D6F.local, ""QM"" question ANY 176.10.10.10.in-addr.arpa, ""QM"" question ANY dsp.local, ""QM"" question ANY f.6.d.3.9.a.e.f.f.f.8.7.d.8.2.9.0.0.0.0.0.0.0.0.0.0.0.0.0.8.e.f.ip6.arpa, ""QM"" question A 10.10.10.176 PTR dsp3D6F.local A 10.10.10.176 PTR dsp.local AAAA fe80::928d:78ff:fea9:3d6f PTR dsp.local AAAA fe80::928d:78ff:fea9:3d6f PTR dsp3D6F.local SRV 0 0 80 dsp.local TXT"
"11","8.312475","10.10.10.176","224.0.0.251","MDNS","527","Standard query response 0x0000 TXT, cache flush A, cache flush 10.10.10.176 PTR, cache flush dsp3D6F.local A, cache flush 10.10.10.176 PTR, cache flush dsp.local AAAA, cache flush fe80::928d:78ff:fea9:3d6f PTR, cache flush dsp.local AAAA, cache flush fe80::928d:78ff:fea9:3d6f PTR, cache flush dsp3D6F.local SRV, cache flush 0 0 80 dsp.local"
"12","8.689586","10.10.10.176","224.0.0.251","MDNS","333","Standard query response 0x0000 PTR _dhnap._tcp.local SRV, cache flush 0 0 80 dsp.local TXT, cache flush PTR D-Link HNAP Service._dhnap._tcp.local"
"13","8.714762","10.10.10.176","224.0.0.251","MDNS","308","Standard query response 0x0000 AAAA, cache flush fe80::928d:78ff:fea9:3d6f PTR, cache flush dsp.local AAAA, cache flush fe80::928d:78ff:fea9:3d6f PTR, cache flush dsp3D6F.local A, cache flush 10.10.10.176 PTR, cache flush dsp.local A, cache flush 10.10.10.176 PTR, cache flush dsp3D6F.local"
"14","8.721181","10.10.10.176","224.0.0.22","IGMPv3","54","Membership Report / Leave group 224.0.0.251"
"15","8.725131","D-LinkIn_a9:3d:6f","Broadcast","ARP","42","Who has 10.10.10.1? Tell 10.10.10.176"
"16","8.725155","DavidEle_06:08:ba","D-LinkIn_a9:3d:6f","ARP","42","10.10.10.1 is at 00:b5:6d:06:08:ba"
"17","8.726511","10.10.10.176","10.10.10.1","DNS","74","Standard query 0x0002 AAAA wrpd.dlink.com"
"18","8.757845","10.10.10.176","10.10.10.1","DNS","74","Standard query 0x0002 A ntp1.dlink.com"
"19","8.757934","10.10.10.1","10.10.10.176","DNS","106","Standard query response 0x0002 A ntp1.dlink.com A 54.186.215.173 A 54.86.11.193"
"20","8.760387","10.10.10.176","54.186.215.173","NTP","90","NTP Version 3, client"
"21","8.849919","10.10.10.1","10.10.10.176","DNS","395","Standard query response 0x0002 AAAA wrpd.dlink.com CNAME dualstack.ipv6-1927743757.us-west-2.elb.amazonaws.com AAAA 2620:108:700f::3270:7f24 AAAA 2620:108:700f::36f4:e8b7 NS ns-560.awsdns-06.net NS ns-1475.awsdns-56.org NS ns-1769.awsdns-29.co.uk NS ns-332.awsdns-41.com A 205.251.193.76 A 205.251.194.48 A 205.251.197.195 A 205.251.198.233"
"22","8.854986","10.10.10.176","10.10.10.1","DNS","113","Standard query 0x0003 AAAA dualstack.ipv6-1927743757.us-west-2.elb.amazonaws.com"
"23","8.855106","10.10.10.1","10.10.10.176","DNS","169","Standard query response 0x0003 AAAA dualstack.ipv6-1927743757.us-west-2.elb.amazonaws.com AAAA 2620:108:700f::36f4:e8b7 AAAA 2620:108:700f::3270:7f24"
"24","8.867343","10.10.10.176","10.10.10.1","DNS","74","Standard query 0x0004 A wrpd.dlink.com"
"25","8.925177","54.186.215.173","10.10.10.176","NTP","90","NTP Version 3, server"
"26","8.987887","10.10.10.1","10.10.10.176","DNS","371","Standard query response 0x0004 A wrpd.dlink.com CNAME dualstack.ipv6-1927743757.us-west-2.elb.amazonaws.com A 54.244.232.183 A 50.112.127.36 NS ns-560.awsdns-06.net NS ns-332.awsdns-41.com NS ns-1769.awsdns-29.co.uk NS ns-1475.awsdns-56.org A 205.251.193.76 A 205.251.194.48 A 205.251.197.195 A 205.251.198.233"
"27","8.992490","10.10.10.176","54.244.232.183","TCP","74","59351  >  80 [SYN] Seq=0 Win=5840 Len=0 MSS=1460 SACK_PERM=1 TSval=4294923268 TSecr=0 WS=2"
"28","9.155750","54.244.232.183","10.10.10.176","TCP","74","80  >  59351 [SYN, ACK] Seq=0 Ack=1 Win=14480 Len=0 MSS=1380 SACK_PERM=1 TSval=2883823373 TSecr=4294923268 WS=256"
"29","9.157456","10.10.10.176","54.244.232.183","TCP","66","59351  >  80 [ACK] Seq=1 Ack=1 Win=5840 Len=0 TSval=4294923310 TSecr=2883823373"
"30","9.158003","10.10.10.176","54.244.232.183","HTTP","203","GET /router/firmware/query.aspx?model=DSP-W215_Bx_Default_FW_0222_908D78A93D6F HTTP/1.1 "
"31","9.340205","54.244.232.183","10.10.10.176","TCP","66","80  >  59351 [ACK] Seq=1 Ack=138 Win=15616 Len=0 TSval=2883823419 TSecr=4294923310"
"32","9.343545","54.244.232.183","10.10.10.176","HTTP/XML","726","HTTP/1.1 200 OK "
"33","9.350591","10.10.10.176","54.244.232.183","TCP","66","59351  >  80 [ACK] Seq=138 Ack=661 Win=7160 Len=0 TSval=4294923358 TSecr=2883823420"
"34","10.137212","10.10.10.176","224.0.0.22","IGMPv3","54","Membership Report / Join group 224.0.0.251 for any sources"
"35","10.161379","10.10.10.176","54.244.232.183","TCP","66","59351  >  80 [FIN, ACK] Seq=138 Ack=661 Win=7160 Len=0 TSval=4294923561 TSecr=2883823420"
"36","10.324804","54.244.232.183","10.10.10.176","TCP","66","80  >  59351 [FIN, ACK] Seq=661 Ack=139 Win=15616 Len=0 TSval=2883823665 TSecr=4294923561"
"37","10.326210","10.10.10.176","54.244.232.183","TCP","66","59351  >  80 [ACK] Seq=139 Ack=662 Win=7160 Len=0 TSval=4294923602 TSecr=2883823665"
"38","10.402409","10.10.10.176","224.0.0.251","MDNS","332","Standard query 0x0000 ANY f.6.d.3.9.a.e.f.f.f.8.7.d.8.2.9.0.0.0.0.0.0.0.0.0.0.0.0.0.8.e.f.ip6.arpa, ""QM"" question ANY dsp3D6F.local, ""QM"" question ANY 176.10.10.10.in-addr.arpa, ""QM"" question ANY dsp.local, ""QM"" question A 10.10.10.176 PTR dsp3D6F.local A 10.10.10.176 PTR dsp.local AAAA fe80::928d:78ff:fea9:3d6f PTR dsp3D6F.local AAAA fe80::928d:78ff:fea9:3d6f PTR dsp.local"
"39","10.715285","10.10.10.176","224.0.0.251","MDNS","332","Standard query 0x0000 ANY f.6.d.3.9.a.e.f.f.f.8.7.d.8.2.9.0.0.0.0.0.0.0.0.0.0.0.0.0.8.e.f.ip6.arpa, ""QM"" question ANY dsp3D6F.local, ""QM"" question ANY 176.10.10.10.in-addr.arpa, ""QM"" question ANY dsp.local, ""QM"" question A 10.10.10.176 PTR dsp3D6F.local A 10.10.10.176 PTR dsp.local AAAA fe80::928d:78ff:fea9:3d6f PTR dsp3D6F.local AAAA fe80::928d:78ff:fea9:3d6f PTR dsp.local"
"40","11.119122","10.10.10.176","224.0.0.251","MDNS","308","Standard query response 0x0000 PTR, cache flush dsp.local A, cache flush 10.10.10.176 PTR, cache flush dsp3D6F.local A, cache flush 10.10.10.176 PTR, cache flush dsp.local AAAA, cache flush fe80::928d:78ff:fea9:3d6f PTR, cache flush dsp3D6F.local AAAA, cache flush fe80::928d:78ff:fea9:3d6f"
"41","11.405751","10.10.10.176","224.0.0.251","MDNS","289","Standard query 0x0000 ANY D-Link HNAP Service._dhnap._tcp.local, ""QM"" question SRV 0 0 80 dsp.local TXT"
"42","11.692457","10.10.10.176","224.0.0.251","MDNS","289","Standard query 0x0000 ANY D-Link HNAP Service._dhnap._tcp.local, ""QM"" question SRV 0 0 80 dsp.local TXT"
"43","11.911883","10.10.10.176","224.0.0.251","MDNS","289","Standard query 0x0000 ANY D-Link HNAP Service._dhnap._tcp.local, ""QM"" question SRV 0 0 80 dsp.local TXT"
"44","12.125509","10.10.10.176","224.0.0.251","MDNS","378","Standard query response 0x0000 TXT, cache flush PTR D-Link HNAP Service._dhnap._tcp.local SRV, cache flush 0 0 80 dsp.local AAAA, cache flush fe80::928d:78ff:fea9:3d6f A, cache flush 10.10.10.176 PTR _dhnap._tcp.local"
"45","12.353779","10.10.10.176","224.0.0.251","MDNS","264","Standard query response 0x0000 PTR, cache flush dsp.local A, cache flush 10.10.10.176 PTR, cache flush dsp3D6F.local PTR, cache flush dsp.local AAAA, cache flush fe80::928d:78ff:fea9:3d6f PTR, cache flush dsp3D6F.local"
"46","13.338866","10.10.10.176","224.0.0.251","MDNS","378","Standard query response 0x0000 TXT, cache flush PTR D-Link HNAP Service._dhnap._tcp.local SRV, cache flush 0 0 80 dsp.local AAAA, cache flush fe80::928d:78ff:fea9:3d6f A, cache flush 10.10.10.176 PTR _dhnap._tcp.local"
"47","13.769291","DavidEle_06:08:ba","D-LinkIn_a9:3d:6f","ARP","42","Who has 10.10.10.176? Tell 10.10.10.1"
"48","13.770450","D-LinkIn_a9:3d:6f","DavidEle_06:08:ba","ARP","42","10.10.10.176 is at 90:8d:78:a9:3d:6f"
"49","14.567702","10.10.10.176","224.0.0.251","MDNS","308","Standard query response 0x0000 PTR, cache flush dsp.local A, cache flush 10.10.10.176 A, cache flush 10.10.10.176 PTR, cache flush dsp3D6F.local PTR, cache flush dsp.local AAAA, cache flush fe80::928d:78ff:fea9:3d6f AAAA, cache flush fe80::928d:78ff:fea9:3d6f PTR, cache flush dsp3D6F.local"
"50","15.554894","10.10.10.176","224.0.0.251","MDNS","378","Standard query response 0x0000 TXT, cache flush PTR D-Link HNAP Service._dhnap._tcp.local SRV, cache flush 0 0 80 dsp.local AAAA, cache flush fe80::928d:78ff:fea9:3d6f A, cache flush 10.10.10.176 PTR _dhnap._tcp.local"
"51","17.685261","10.10.10.176","224.0.0.22","IGMPv3","54","Membership Report / Join group 224.0.0.251 for any sources"
"52","31.191187","10.10.10.176","10.10.10.1","DNS","74","Standard query 0x0002 A ntp1.dlink.com"
"53","31.191261","10.10.10.1","10.10.10.176","DNS","106","Standard query response 0x0002 A ntp1.dlink.com A 54.86.11.193 A 54.186.215.173"
"54","31.194070","10.10.10.176","54.86.11.193","NTP","90","NTP Version 3, client"
"55","31.293507","54.86.11.193","10.10.10.176","NTP","90","NTP Version 3, server"
"56","39.654528","10.10.10.176","224.0.0.251","MDNS","341","Standard query response 0x0000 PTR D-Link HNAP Service._dhnap._tcp.local TXT, cache flush SRV, cache flush 0 0 80 dsp.local AAAA, cache flush fe80::928d:78ff:fea9:3d6f A, cache flush 10.10.10.176"
"57","42.494514","10.10.10.176","224.0.0.251","MDNS","341","Standard query response 0x0000 PTR D-Link HNAP Service._dhnap._tcp.local TXT, cache flush SRV, cache flush 0 0 80 dsp.local AAAA, cache flush fe80::928d:78ff:fea9:3d6f A, cache flush 10.10.10.176"
"58","61.124630","10.10.10.176","224.0.0.251","MDNS","378","Standard query response 0x0000 PTR _dhnap._tcp.local PTR D-Link HNAP Service._dhnap._tcp.local SRV, cache flush 0 0 80 dsp.local AAAA, cache flush fe80::928d:78ff:fea9:3d6f A, cache flush 10.10.10.176 TXT, cache flush"
"59","61.198382","10.10.10.176","224.0.0.251","MDNS","308","Standard query response 0x0000 AAAA, cache flush fe80::928d:78ff:fea9:3d6f PTR, cache flush dsp.local AAAA, cache flush fe80::928d:78ff:fea9:3d6f PTR, cache flush dsp3D6F.local A, cache flush 10.10.10.176 PTR, cache flush dsp.local A, cache flush 10.10.10.176 PTR, cache flush dsp3D6F.local"
"60","61.205779","10.10.10.176","224.0.0.22","IGMPv3","54","Membership Report / Leave group 224.0.0.251"
"61","62.070468","10.10.10.176","10.10.10.1","DNS","77","Standard query 0x0002 A api.dch.dlink.com"
"62","62.302474","10.10.10.1","10.10.10.176","DNS","383","Standard query response 0x0002 A api.dch.dlink.com CNAME dualstack.eu-api-elb-1068129369.eu-central-1.elb.amazonaws.com A 52.29.29.242 A 52.28.38.154 NS ns-417.awsdns-52.com NS ns-1326.awsdns-37.org NS ns-1689.awsdns-19.co.uk NS ns-613.awsdns-12.net A 205.251.193.161 A 205.251.194.101 A 205.251.197.46 A 205.251.198.153"
"63","62.307777","10.10.10.176","52.29.29.242","TCP","74","40234  >  443 [SYN] Seq=0 Win=5840 Len=0 MSS=1460 SACK_PERM=1 TSval=4294936597 TSecr=0 WS=2"
"64","62.310134","52.29.29.242","10.10.10.176","TCP","74","443  >  40234 [SYN, ACK] Seq=0 Ack=1 Win=17898 Len=0 MSS=1380 SACK_PERM=1 TSval=208499874 TSecr=4294936597 WS=256"
"65","62.313806","10.10.10.176","52.29.29.242","TCP","66","40234  >  443 [ACK] Seq=1 Ack=1 Win=5840 Len=0 TSval=4294936598 TSecr=208499874"
"66","62.362079","10.10.10.176","52.29.29.242","TLSv1","273","Client Hello"
"67","62.364406","52.29.29.242","10.10.10.176","TCP","66","443  >  40234 [ACK] Seq=1 Ack=208 Win=19200 Len=0 TSval=208499887 TSecr=4294936611"
"68","62.366196","52.29.29.242","10.10.10.176","TLSv1","1434","Server Hello"
"69","62.366214","52.29.29.242","10.10.10.176","TCP","1434","443  >  40234 [ACK] Seq=1369 Ack=208 Win=19200 Len=1368 TSval=208499888 TSecr=4294936611 [TCP segment of a reassembled PDU]"
"70","62.366310","52.29.29.242","10.10.10.176","TLSv1","1147","Certificate, Server Key Exchange, Server Hello Done"
"71","62.382697","10.10.10.176","52.29.29.242","TCP","66","40234  >  443 [ACK] Seq=208 Ack=1369 Win=8576 Len=0 TSval=4294936613 TSecr=208499888"
"72","62.382914","10.10.10.176","52.29.29.242","TCP","66","40234  >  443 [ACK] Seq=208 Ack=2737 Win=11312 Len=0 TSval=4294936615 TSecr=208499888"
"73","62.383026","10.10.10.176","52.29.29.242","TCP","66","40234  >  443 [ACK] Seq=208 Ack=3818 Win=14048 Len=0 TSval=4294936616 TSecr=208499888"
"74","62.516405","10.10.10.176","52.29.29.242","TLSv1","200","Client Key Exchange, Change Cipher Spec, Encrypted Handshake Message"
"75","62.520377","52.29.29.242","10.10.10.176","TLSv1","300","New Session Ticket, Change Cipher Spec, Encrypted Handshake Message"
"76","62.521801","10.10.10.176","52.29.29.242","TCP","66","40234  >  443 [ACK] Seq=342 Ack=4052 Win=14048 Len=0 TSval=4294936651 TSecr=208499926"
"77","62.573289","10.10.10.176","52.29.29.242","TLSv1","572","Application Data, Application Data"
"78","62.613345","52.29.29.242","10.10.10.176","TCP","66","443  >  40234 [ACK] Seq=4052 Ack=848 Win=21248 Len=0 TSval=208499950 TSecr=4294936663"
"79","62.762559","52.29.29.242","10.10.10.176","TLSv1","631","Application Data"
"80","62.762585","52.29.29.242","10.10.10.176","TLSv1","103","Encrypted Alert"
"81","62.764981","10.10.10.176","52.29.29.242","TCP","66","40234  >  443 [ACK] Seq=848 Ack=4617 Win=14048 Len=0 TSval=4294936711 TSecr=208499987"
"82","62.765212","10.10.10.176","52.29.29.242","TCP","66","40234  >  443 [ACK] Seq=848 Ack=4654 Win=14048 Len=0 TSval=4294936711 TSecr=208499987"
"83","62.777385","10.10.10.176","52.29.29.242","TCP","66","40234  >  443 [RST, ACK] Seq=848 Ack=4654 Win=14048 Len=0 TSval=4294936714 TSecr=208499987"
"84","62.964040","10.10.10.176","52.29.29.242","TCP","74","40236  >  443 [SYN] Seq=0 Win=5840 Len=0 MSS=1460 SACK_PERM=1 TSval=4294936761 TSecr=0 WS=2"
"85","62.966567","52.29.29.242","10.10.10.176","TCP","74","443  >  40236 [SYN, ACK] Seq=0 Ack=1 Win=17898 Len=0 MSS=1380 SACK_PERM=1 TSval=208500038 TSecr=4294936761 WS=256"
"86","62.967573","10.10.10.176","52.29.29.242","TCP","66","40236  >  443 [ACK] Seq=1 Ack=1 Win=5840 Len=0 TSval=4294936762 TSecr=208500038"
"87","62.977771","10.10.10.176","224.0.0.22","IGMPv3","54","Membership Report / Join group 224.0.0.251 for any sources"
"88","63.018071","10.10.10.176","52.29.29.242","TLSv1","273","Client Hello"
"89","63.020469","52.29.29.242","10.10.10.176","TCP","66","443  >  40236 [ACK] Seq=1 Ack=208 Win=19200 Len=0 TSval=208500051 TSecr=4294936775"
"90","63.022826","52.29.29.242","10.10.10.176","TLSv1","1434","Server Hello"
"91","63.022848","52.29.29.242","10.10.10.176","TCP","1434","443  >  40236 [ACK] Seq=1369 Ack=208 Win=19200 Len=1368 TSval=208500052 TSecr=4294936775 [TCP segment of a reassembled PDU]"
"92","63.022850","52.29.29.242","10.10.10.176","TLSv1","1147","Certificate, Server Key Exchange, Server Hello Done"
"93","63.028226","10.10.10.176","52.29.29.242","TCP","66","40236  >  443 [ACK] Seq=208 Ack=1369 Win=8576 Len=0 TSval=4294936777 TSecr=208500052"
"94","63.031381","10.10.10.176","52.29.29.242","TCP","66","40236  >  443 [ACK] Seq=208 Ack=2737 Win=11312 Len=0 TSval=4294936777 TSecr=208500052"
"95","63.031569","10.10.10.176","52.29.29.242","TCP","66","40236  >  443 [ACK] Seq=208 Ack=3818 Win=14048 Len=0 TSval=4294936778 TSecr=208500052"
"96","63.111061","10.10.10.176","224.0.0.251","MDNS","332","Standard query 0x0000 ANY f.6.d.3.9.a.e.f.f.f.8.7.d.8.2.9.0.0.0.0.0.0.0.0.0.0.0.0.0.8.e.f.ip6.arpa, ""QM"" question ANY dsp3D6F.local, ""QM"" question ANY 176.10.10.10.in-addr.arpa, ""QM"" question ANY dsp.local, ""QM"" question A 10.10.10.176 PTR dsp3D6F.local A 10.10.10.176 PTR dsp.local AAAA fe80::928d:78ff:fea9:3d6f PTR dsp3D6F.local AAAA fe80::928d:78ff:fea9:3d6f PTR dsp.local"
"97","63.173066","10.10.10.176","52.29.29.242","TLSv1","200","Client Key Exchange, Change Cipher Spec, Encrypted Handshake Message"
"98","63.176057","52.29.29.242","10.10.10.176","TLSv1","300","New Session Ticket, Change Cipher Spec, Encrypted Handshake Message"
"99","63.177148","10.10.10.176","52.29.29.242","TCP","66","40236  >  443 [ACK] Seq=342 Ack=4052 Win=14048 Len=0 TSval=4294936814 TSecr=208500090"
"100","63.229104","10.10.10.176","52.29.29.242","TLSv1","588","Application Data, Application Data"
"101","63.273438","52.29.29.242","10.10.10.176","TCP","66","443  >  40236 [ACK] Seq=4052 Ack=864 Win=21248 Len=0 TSval=208500115 TSecr=4294936827"
"102","63.274614","10.10.10.176","52.29.29.242","TLSv1","1228","Application Data, Application Data"
"103","63.277053","52.29.29.242","10.10.10.176","TCP","66","443  >  40236 [ACK] Seq=4052 Ack=2026 Win=23552 Len=0 TSval=208500115 TSecr=4294936839"
"104","63.362976","10.10.10.176","224.0.0.251","MDNS","332","Standard query 0x0000 ANY f.6.d.3.9.a.e.f.f.f.8.7.d.8.2.9.0.0.0.0.0.0.0.0.0.0.0.0.0.8.e.f.ip6.arpa, ""QM"" question ANY dsp3D6F.local, ""QM"" question ANY 176.10.10.10.in-addr.arpa, ""QM"" question ANY dsp.local, ""QM"" question A 10.10.10.176 PTR dsp3D6F.local A 10.10.10.176 PTR dsp.local AAAA fe80::928d:78ff:fea9:3d6f PTR dsp3D6F.local AAAA fe80::928d:78ff:fea9:3d6f PTR dsp.local"
"105","63.462109","52.29.29.242","10.10.10.176","TLSv1","663","Application Data"
"106","63.463439","10.10.10.176","52.29.29.242","TCP","66","40236  >  443 [ACK] Seq=2026 Ack=4649 Win=14048 Len=0 TSval=4294936886 TSecr=208500162"
"107","63.466594","10.10.10.176","52.29.29.242","TCP","66","40236  >  443 [FIN, ACK] Seq=2026 Ack=4649 Win=14048 Len=0 TSval=4294936887 TSecr=208500162"
"108","63.468855","52.29.29.242","10.10.10.176","TLSv1","103","Encrypted Alert"
"109","63.468880","52.29.29.242","10.10.10.176","TCP","66","443  >  40236 [FIN, ACK] Seq=4686 Ack=2027 Win=23552 Len=0 TSval=208500163 TSecr=4294936887"
"110","63.470213","10.10.10.176","52.29.29.242","TCP","54","40236  >  443 [RST] Seq=2027 Win=0 Len=0"
"111","63.470433","10.10.10.176","52.29.29.242","TCP","54","40236  >  443 [RST] Seq=2027 Win=0 Len=0"
"112","63.614902","10.10.10.176","224.0.0.251","MDNS","332","Standard query 0x0000 ANY f.6.d.3.9.a.e.f.f.f.8.7.d.8.2.9.0.0.0.0.0.0.0.0.0.0.0.0.0.8.e.f.ip6.arpa, ""QM"" question ANY dsp3D6F.local, ""QM"" question ANY 176.10.10.10.in-addr.arpa, ""QM"" question ANY dsp.local, ""QM"" question A 10.10.10.176 PTR dsp3D6F.local A 10.10.10.176 PTR dsp.local AAAA fe80::928d:78ff:fea9:3d6f PTR dsp3D6F.local AAAA fe80::928d:78ff:fea9:3d6f PTR dsp.local"
"113","63.766587","10.10.10.176","52.29.29.242","TCP","74","40237  >  443 [SYN] Seq=0 Win=5840 Len=0 MSS=1460 SACK_PERM=1 TSval=4294936962 TSecr=0 WS=2"
"114","63.769225","52.29.29.242","10.10.10.176","TCP","74","443  >  40237 [SYN, ACK] Seq=0 Ack=1 Win=17898 Len=0 MSS=1380 SACK_PERM=1 TSval=208500238 TSecr=4294936962 WS=256"
"115","63.770021","10.10.10.176","52.29.29.242","TCP","66","40237  >  443 [ACK] Seq=1 Ack=1 Win=5840 Len=0 TSval=4294936963 TSecr=208500238"
"116","63.818034","10.10.10.176","224.0.0.251","MDNS","308","Standard query response 0x0000 PTR, cache flush dsp.local A, cache flush 10.10.10.176 PTR, cache flush dsp3D6F.local A, cache flush 10.10.10.176 PTR, cache flush dsp.local AAAA, cache flush fe80::928d:78ff:fea9:3d6f PTR, cache flush dsp3D6F.local AAAA, cache flush fe80::928d:78ff:fea9:3d6f"
"117","63.821286","10.10.10.176","52.29.29.242","TLSv1","273","Client Hello"
"118","63.823827","52.29.29.242","10.10.10.176","TCP","66","443  >  40237 [ACK] Seq=1 Ack=208 Win=19200 Len=0 TSval=208500252 TSecr=4294936975"
"119","63.825551","52.29.29.242","10.10.10.176","TLSv1","1434","Server Hello"
"120","63.825572","52.29.29.242","10.10.10.176","TCP","1434","443  >  40237 [ACK] Seq=1369 Ack=208 Win=19200 Len=1368 TSval=208500252 TSecr=4294936975 [TCP segment of a reassembled PDU]"
"121","63.825642","52.29.29.242","10.10.10.176","TLSv1","1147","Certificate, Server Key Exchange, Server Hello Done"
"122","63.828909","10.10.10.176","52.29.29.242","TCP","66","40237  >  443 [ACK] Seq=208 Ack=1369 Win=8576 Len=0 TSval=4294936977 TSecr=208500252"
"123","63.829330","10.10.10.176","52.29.29.242","TCP","66","40237  >  443 [ACK] Seq=208 Ack=2737 Win=11312 Len=0 TSval=4294936977 TSecr=208500252"
"124","63.829424","10.10.10.176","52.29.29.242","TCP","66","40237  >  443 [ACK] Seq=208 Ack=3818 Win=14048 Len=0 TSval=4294936977 TSecr=208500252"
"125","63.951715","10.10.10.176","224.0.0.251","MDNS","289","Standard query 0x0000 ANY D-Link HNAP Service._dhnap._tcp.local, ""QM"" question SRV 0 0 80 dsp.local TXT"
"126","64.036762","10.10.10.176","52.29.29.242","TLSv1","200","Client Key Exchange, Change Cipher Spec, Encrypted Handshake Message"
"127","64.040123","52.29.29.242","10.10.10.176","TLSv1","300","New Session Ticket, Change Cipher Spec, Encrypted Handshake Message"
"128","64.041065","10.10.10.176","52.29.29.242","TCP","66","40237  >  443 [ACK] Seq=342 Ack=4052 Win=14048 Len=0 TSval=4294937030 TSecr=208500306"
"129","64.058809","10.10.10.176","10.10.10.1","DNS","74","Standard query 0x0002 A ntp1.dlink.com"
"130","64.058900","10.10.10.1","10.10.10.176","DNS","106","Standard query response 0x0002 A ntp1.dlink.com A 54.186.215.173 A 54.86.11.193"
"131","64.060564","10.10.10.176","54.186.215.173","NTP","90","NTP Version 3, client"
"132","64.092809","10.10.10.176","52.29.29.242","TLSv1","476","Application Data, Application Data"
"133","64.133593","52.29.29.242","10.10.10.176","TCP","66","443  >  40237 [ACK] Seq=4052 Ack=752 Win=21248 Len=0 TSval=208500330 TSecr=4294937043"
"134","64.202440","10.10.10.176","224.0.0.251","MDNS","289","Standard query 0x0000 ANY D-Link HNAP Service._dhnap._tcp.local, ""QM"" question SRV 0 0 80 dsp.local TXT"
"135","64.228585","54.186.215.173","10.10.10.176","NTP","90","NTP Version 3, server"
"136","64.490397","10.10.10.176","224.0.0.251","MDNS","289","Standard query 0x0000 ANY D-Link HNAP Service._dhnap._tcp.local, ""QM"" question SRV 0 0 80 dsp.local TXT"
"137","64.612365","52.29.29.242","10.10.10.176","TLSv1","471","Application Data"
"138","64.612398","52.29.29.242","10.10.10.176","TLSv1","103","Encrypted Alert"
"139","64.613317","10.10.10.176","52.29.29.242","TCP","66","40237  >  443 [ACK] Seq=752 Ack=4457 Win=14048 Len=0 TSval=4294937173 TSecr=208500449"
"140","64.613723","10.10.10.176","52.29.29.242","TCP","66","40237  >  443 [ACK] Seq=752 Ack=4494 Win=14048 Len=0 TSval=4294937173 TSecr=208500449"
"141","64.615983","10.10.10.176","10.10.10.1","DNS","79","Standard query 0x0003 A r0801.dch.dlink.com"
"142","64.616097","10.10.10.1","10.10.10.176","DNS","95","Standard query response 0x0003 A r0801.dch.dlink.com A 52.28.161.134"
"143","64.617307","10.10.10.176","52.28.161.134","TCP","74","33374  >  443 [SYN] Seq=0 Win=5840 Len=0 MSS=1460 SACK_PERM=1 TSval=4294937174 TSecr=0 WS=2"
"144","64.619551","52.28.161.134","10.10.10.176","TCP","66","443  >  33374 [SYN, ACK] Seq=0 Ack=1 Win=8192 Len=0 MSS=1380 SACK_PERM=1 WS=128"
"145","64.620356","10.10.10.176","52.28.161.134","TCP","54","33374  >  443 [ACK] Seq=1 Ack=1 Win=5840 Len=0"
"146","64.670055","10.10.10.176","52.28.161.134","TLSv1","261","Client Hello"
"147","64.672146","52.28.161.134","10.10.10.176","TCP","54","443  >  33374 [ACK] Seq=1 Ack=208 Win=8064 Len=0"
"148","64.672167","52.28.161.134","10.10.10.176","TLSv1","112","Server Hello"
"149","64.672476","52.28.161.134","10.10.10.176","TCP","1434","443  >  33374 [ACK] Seq=59 Ack=208 Win=8192 Len=1380 [TCP segment of a reassembled PDU]"
"150","64.672489","52.28.161.134","10.10.10.176","TCP","1434","443  >  33374 [ACK] Seq=1439 Ack=208 Win=8192 Len=1380 [TCP segment of a reassembled PDU]"
"151","64.672492","52.28.161.134","10.10.10.176","TLSv1","700","Certificate"
"152","64.674090","10.10.10.176","52.28.161.134","TCP","54","33374  >  443 [ACK] Seq=208 Ack=59 Win=5840 Len=0"
"153","64.674620","10.10.10.176","52.28.161.134","TCP","54","33374  >  443 [ACK] Seq=208 Ack=1439 Win=8600 Len=0"
"154","64.674716","10.10.10.176","52.28.161.134","TCP","54","33374  >  443 [ACK] Seq=208 Ack=2819 Win=11360 Len=0"
"155","64.674928","10.10.10.176","52.28.161.134","TCP","54","33374  >  443 [ACK] Seq=208 Ack=3465 Win=11360 Len=0"
"156","64.680341","52.28.161.134","10.10.10.176","TLSv1","390","Server Key Exchange"
"157","64.680360","52.28.161.134","10.10.10.176","TLSv1","63","Server Hello Done"
"158","64.681601","10.10.10.176","52.28.161.134","TCP","54","33374  >  443 [ACK] Seq=208 Ack=3801 Win=11360 Len=0"
"159","64.682115","10.10.10.176","52.28.161.134","TCP","54","33374  >  443 [ACK] Seq=208 Ack=3810 Win=11360 Len=0"
"160","64.691673","10.10.10.176","224.0.0.251","MDNS","378","Standard query response 0x0000 TXT, cache flush PTR D-Link HNAP Service._dhnap._tcp.local SRV, cache flush 0 0 80 dsp.local AAAA, cache flush fe80::928d:78ff:fea9:3d6f A, cache flush 10.10.10.176 PTR _dhnap._tcp.local"
"161","64.819384","10.10.10.176","52.28.161.134","TLSv1","188","Client Key Exchange, Change Cipher Spec, Encrypted Handshake Message"
"162","64.823847","52.28.161.134","10.10.10.176","TLSv1","173","New Session Ticket"
"163","64.823872","52.28.161.134","10.10.10.176","TLSv1","60","Change Cipher Spec"
"164","64.823877","52.28.161.134","10.10.10.176","TLSv1","107","Encrypted Handshake Message"
"165","64.835269","52.28.161.134","10.10.10.176","TCP","107","[TCP Retransmission] 443  >  33374 [PSH, ACK] Seq=3935 Ack=342 Win=8192 Len=53"
"166","64.835965","10.10.10.176","52.28.161.134","TCP","66","33374  >  443 [ACK] Seq=342 Ack=3988 Win=11360 Len=0 SLE=3935 SRE=3988"
"167","64.873599","10.10.10.176","52.29.29.242","TCP","66","40237  >  443 [RST, ACK] Seq=752 Ack=4494 Win=14048 Len=0 TSval=4294937238 TSecr=208500449"
"168","64.874517","10.10.10.176","52.28.161.134","TLSv1","256","Application Data, Application Data"
"169","64.915448","52.28.161.134","10.10.10.176","TCP","54","443  >  33374 [ACK] Seq=3988 Ack=544 Win=8192 Len=0"
"170","64.936918","10.10.10.176","224.0.0.251","MDNS","264","Standard query response 0x0000 PTR, cache flush dsp.local A, cache flush 10.10.10.176 PTR, cache flush dsp3D6F.local PTR, cache flush dsp.local AAAA, cache flush fe80::928d:78ff:fea9:3d6f PTR, cache flush dsp3D6F.local"
"171","65.072257","10.10.10.176","10.10.10.1","DNS","80","Standard query 0x0002 A tzinfo.dch.dlink.com"
"172","65.312114","10.10.10.1","10.10.10.176","DNS","378","Standard query response 0x0002 A tzinfo.dch.dlink.com CNAME dualstack.tzinfo-423124427.us-west-2.elb.amazonaws.com A 52.26.98.232 A 52.25.174.177 NS ns-1475.awsdns-56.org NS ns-560.awsdns-06.net NS ns-332.awsdns-41.com NS ns-1769.awsdns-29.co.uk A 205.251.193.76 A 205.251.194.48 A 205.251.197.195 A 205.251.198.233"
"173","65.313424","10.10.10.176","52.26.98.232","TCP","74","52123  >  80 [SYN] Seq=0 Win=5840 Len=0 MSS=1460 SACK_PERM=1 TSval=4294937348 TSecr=0 WS=2"
"174","65.480966","52.26.98.232","10.10.10.176","TCP","74","80  >  52123 [SYN, ACK] Seq=0 Ack=1 Win=17898 Len=0 MSS=1380 SACK_PERM=1 TSval=1845020626 TSecr=4294937348 WS=256"
"175","65.481803","10.10.10.176","52.26.98.232","TCP","66","52123  >  80 [ACK] Seq=1 Ack=1 Win=5840 Len=0 TSval=4294937391 TSecr=1845020626"
"176","65.482814","10.10.10.176","52.26.98.232","HTTP","265","GET /dst?timezone=Europe/Berlin&ts=1461242556&hash=a1240851885250851c7fcf328edf1f5a HTTP/1.1 "
"177","65.650256","52.26.98.232","10.10.10.176","TCP","66","80  >  52123 [ACK] Seq=1 Ack=200 Win=19200 Len=0 TSval=1845020668 TSecr=4294937391"
"178","65.659385","52.26.98.232","10.10.10.176","HTTP","271","HTTP/1.1 200 OK  (application/json)"
"179","65.660149","10.10.10.176","52.26.98.232","TCP","66","52123  >  80 [ACK] Seq=200 Ack=206 Win=5840 Len=0 TSval=4294937435 TSecr=1845020671"
"180","65.662049","10.10.10.176","52.26.98.232","TCP","66","52123  >  80 [FIN, ACK] Seq=200 Ack=206 Win=5840 Len=0 TSval=4294937436 TSecr=1845020671"
"181","65.775478","10.10.10.176","224.0.0.251","MDNS","378","Standard query response 0x0000 TXT, cache flush PTR D-Link HNAP Service._dhnap._tcp.local SRV, cache flush 0 0 80 dsp.local AAAA, cache flush fe80::928d:78ff:fea9:3d6f A, cache flush 10.10.10.176 PTR _dhnap._tcp.local"
"182","65.829425","52.26.98.232","10.10.10.176","TCP","66","80  >  52123 [FIN, ACK] Seq=206 Ack=201 Win=19200 Len=0 TSval=1845020713 TSecr=4294937436"
"183","65.830109","10.10.10.176","52.26.98.232","TCP","66","52123  >  80 [ACK] Seq=201 Ack=207 Win=5840 Len=0 TSval=4294937478 TSecr=1845020713"
"184","65.882809","10.10.10.176","224.0.0.251","MDNS","334","Standard query response 0x0000 PTR _dhnap._tcp.local PTR D-Link HNAP Service._dhnap._tcp.local SRV, cache flush 0 0 80 dsp.local TXT, cache flush"
"185","65.912932","10.10.10.176","224.0.0.251","MDNS","308","Standard query response 0x0000 AAAA, cache flush fe80::928d:78ff:fea9:3d6f PTR, cache flush dsp.local AAAA, cache flush fe80::928d:78ff:fea9:3d6f PTR, cache flush dsp3D6F.local A, cache flush 10.10.10.176 PTR, cache flush dsp.local A, cache flush 10.10.10.176 PTR, cache flush dsp3D6F.local"
"186","65.921790","10.10.10.176","224.0.0.22","IGMPv3","54","Membership Report / Leave group 224.0.0.251"
"187","67.305255","DavidEle_06:08:ba","D-LinkIn_a9:3d:6f","ARP","42","Who has 10.10.10.176? Tell 10.10.10.1"
"188","67.305936","D-LinkIn_a9:3d:6f","DavidEle_06:08:ba","ARP","42","10.10.10.176 is at 90:8d:78:a9:3d:6f"
"189","67.893906","10.10.10.176","224.0.0.22","IGMPv3","54","Membership Report / Join group 224.0.0.251 for any sources"
"190","67.947016","10.10.10.176","10.10.10.1","DNS","77","Standard query 0x0002 A api.dch.dlink.com"
"191","67.947214","10.10.10.1","10.10.10.176","DNS","185","Standard query response 0x0002 A api.dch.dlink.com CNAME dualstack.eu-api-elb-1068129369.eu-central-1.elb.amazonaws.com A 52.29.29.242 A 52.28.38.154"
"192","67.952037","10.10.10.176","52.29.29.242","TCP","74","48441  >  80 [SYN] Seq=0 Win=5840 Len=0 MSS=1460 SACK_PERM=1 TSval=4294938008 TSecr=0 WS=2"
"193","67.954782","52.29.29.242","10.10.10.176","TCP","74","80  >  48441 [SYN, ACK] Seq=0 Ack=1 Win=17898 Len=0 MSS=1380 SACK_PERM=1 TSval=208501285 TSecr=4294938008 WS=256"
"194","67.955455","10.10.10.176","52.29.29.242","TCP","66","48441  >  80 [ACK] Seq=1 Ack=1 Win=5840 Len=0 TSval=4294938009 TSecr=208501285"
"195","68.094881","10.10.10.176","52.29.29.242","HTTP","376","GET /agent/upgrade?p=3U%2FLIJG4%2Br%2BAjIx90R2ZruggK8AYAfcRfvaxnfi6WGTHjsCX31rhX67V07uKbGwqsW3zD25%2B5vNeYgWIdxixCaXH3qOKuWy2F4i8XBz6OvkIG2mzhq%2B1%2FqYUBpdzyI1T&iv=6jPtQglrMXl15o%2Bnc%2FHggQ%3D%3D HTTP/1.1 "
"196","68.097651","52.29.29.242","10.10.10.176","TCP","66","80  >  48441 [ACK] Seq=1 Ack=311 Win=19200 Len=0 TSval=208501320 TSecr=4294938044"
"197","68.178997","10.10.10.176","224.0.0.251","MDNS","332","Standard query 0x0000 ANY f.6.d.3.9.a.e.f.f.f.8.7.d.8.2.9.0.0.0.0.0.0.0.0.0.0.0.0.0.8.e.f.ip6.arpa, ""QM"" question ANY dsp3D6F.local, ""QM"" question ANY 176.10.10.10.in-addr.arpa, ""QM"" question ANY dsp.local, ""QM"" question A 10.10.10.176 PTR dsp3D6F.local A 10.10.10.176 PTR dsp.local AAAA fe80::928d:78ff:fea9:3d6f PTR dsp3D6F.local AAAA fe80::928d:78ff:fea9:3d6f PTR dsp.local"
"198","68.265685","52.29.29.242","10.10.10.176","HTTP","559","HTTP/1.1 200 OK  (text/html)"
"199","68.266354","10.10.10.176","52.29.29.242","TCP","66","48441  >  80 [ACK] Seq=311 Ack=494 Win=6912 Len=0 TSval=4294938087 TSecr=208501363"
"200","68.268250","10.10.10.176","52.29.29.242","TCP","66","48441  >  80 [FIN, ACK] Seq=311 Ack=494 Win=6912 Len=0 TSval=4294938087 TSecr=208501363"
"201","68.270682","52.29.29.242","10.10.10.176","TCP","66","80  >  48441 [FIN, ACK] Seq=494 Ack=312 Win=19200 Len=0 TSval=208501364 TSecr=4294938087"
"202","68.271314","10.10.10.176","52.29.29.242","TCP","66","48441  >  80 [ACK] Seq=312 Ack=495 Win=6912 Len=0 TSval=4294938088 TSecr=208501364"
"203","68.430825","10.10.10.176","224.0.0.251","MDNS","332","Standard query 0x0000 ANY f.6.d.3.9.a.e.f.f.f.8.7.d.8.2.9.0.0.0.0.0.0.0.0.0.0.0.0.0.8.e.f.ip6.arpa, ""QM"" question ANY dsp3D6F.local, ""QM"" question ANY 176.10.10.10.in-addr.arpa, ""QM"" question ANY dsp.local, ""QM"" question A 10.10.10.176 PTR dsp3D6F.local A 10.10.10.176 PTR dsp.local AAAA fe80::928d:78ff:fea9:3d6f PTR dsp3D6F.local AAAA fe80::928d:78ff:fea9:3d6f PTR dsp.local"
"204","68.682785","10.10.10.176","224.0.0.251","MDNS","332","Standard query 0x0000 ANY f.6.d.3.9.a.e.f.f.f.8.7.d.8.2.9.0.0.0.0.0.0.0.0.0.0.0.0.0.8.e.f.ip6.arpa, ""QM"" question ANY dsp3D6F.local, ""QM"" question ANY 176.10.10.10.in-addr.arpa, ""QM"" question ANY dsp.local, ""QM"" question A 10.10.10.176 PTR dsp3D6F.local A 10.10.10.176 PTR dsp.local AAAA fe80::928d:78ff:fea9:3d6f PTR dsp3D6F.local AAAA fe80::928d:78ff:fea9:3d6f PTR dsp.local"
"205","68.885785","10.10.10.176","224.0.0.251","MDNS","308","Standard query response 0x0000 PTR, cache flush dsp.local A, cache flush 10.10.10.176 PTR, cache flush dsp3D6F.local A, cache flush 10.10.10.176 PTR, cache flush dsp.local AAAA, cache flush fe80::928d:78ff:fea9:3d6f PTR, cache flush dsp3D6F.local AAAA, cache flush fe80::928d:78ff:fea9:3d6f"
"206","69.170336","10.10.10.176","224.0.0.251","MDNS","291","Standard query 0x0000 ANY D-Link HNAP Service._dhnap._tcp.local, ""QM"" question SRV 0 0 80 dsp.local TXT"
"207","69.279296","10.10.10.176","10.10.10.1","DNS","86","Standard query 0x0002 A s3-us-west-2.amazonaws.com"
"208","69.395181","10.10.10.1","10.10.10.176","DNS","303","Standard query response 0x0002 A s3-us-west-2.amazonaws.com A 54.231.184.164 NS ns-1397.awsdns-46.org NS ns-387.awsdns-48.com NS ns-1568.awsdns-04.co.uk NS ns-671.awsdns-19.net A 205.251.193.131 A 205.251.194.159 A 205.251.197.117 A 205.251.198.32"
"209","69.396433","10.10.10.176","54.231.184.164","TCP","74","34960  >  80 [SYN] Seq=0 Win=5840 Len=0 MSS=1460 SACK_PERM=1 TSval=4294938369 TSecr=0 WS=2"
"210","69.422244","10.10.10.176","224.0.0.251","MDNS","291","Standard query 0x0000 ANY D-Link HNAP Service._dhnap._tcp.local, ""QM"" question SRV 0 0 80 dsp.local TXT"
"211","69.564028","54.231.184.164","10.10.10.176","TCP","66","80  >  34960 [SYN, ACK] Seq=0 Ack=1 Win=5840 Len=0 MSS=1380 WS=256 SACK_PERM=1"
"212","69.564733","10.10.10.176","54.231.184.164","TCP","54","34960  >  80 [ACK] Seq=1 Ack=1 Win=5840 Len=0"
"213","69.565460","10.10.10.176","54.231.184.164","HTTP","258","GET /static-us-west.dch.dlink.com/firmware/agent/DSP-W215/D-Link-DSP-W215-1.1.0-BX HTTP/1.1 "
"214","69.674228","10.10.10.176","224.0.0.251","MDNS","291","Standard query 0x0000 ANY D-Link HNAP Service._dhnap._tcp.local, ""QM"" question SRV 0 0 80 dsp.local TXT"
"215","69.734162","54.231.184.164","10.10.10.176","TCP","54","80  >  34960 [ACK] Seq=1 Ack=205 Win=15872 Len=0"
"216","69.782637","54.231.184.164","10.10.10.176","TCP","423","80  >  34960 [PSH, ACK] Seq=1 Ack=205 Win=15872 Len=369 [TCP segment of a reassembled PDU]"
"217","69.782890","54.231.184.164","10.10.10.176","TCP","1434","80  >  34960 [ACK] Seq=370 Ack=205 Win=15872 Len=1380 [TCP segment of a reassembled PDU]"
"218","69.782910","54.231.184.164","10.10.10.176","TCP","1434","80  >  34960 [ACK] Seq=1750 Ack=205 Win=15872 Len=1380 [TCP segment of a reassembled PDU]"
"219","69.782933","54.231.184.164","10.10.10.176","TCP","1434","80  >  34960 [PSH, ACK] Seq=3130 Ack=205 Win=15872 Len=1380 [TCP segment of a reassembled PDU]"
"220","69.783564","10.10.10.176","54.231.184.164","TCP","54","34960  >  80 [ACK] Seq=205 Ack=370 Win=5840 Len=0"
"221","69.784111","10.10.10.176","54.231.184.164","TCP","54","34960  >  80 [ACK] Seq=205 Ack=1750 Win=8600 Len=0"
"222","69.784701","10.10.10.176","54.231.184.164","TCP","54","34960  >  80 [ACK] Seq=205 Ack=3130 Win=11360 Len=0"
"223","69.784994","10.10.10.176","54.231.184.164","TCP","54","34960  >  80 [ACK] Seq=205 Ack=4510 Win=14120 Len=0"
"224","69.875168","52.28.161.134","10.10.10.176","TCP","54","[TCP Keep-Alive] 443  >  33374 [ACK] Seq=3987 Ack=544 Win=8192 Len=0"
"225","69.875637","10.10.10.176","224.0.0.251","MDNS","380","Standard query response 0x0000 TXT, cache flush PTR D-Link HNAP Service._dhnap._tcp.local SRV, cache flush 0 0 80 dsp.local AAAA, cache flush fe80::928d:78ff:fea9:3d6f A, cache flush 10.10.10.176 PTR _dhnap._tcp.local"
"226","69.876062","10.10.10.176","52.28.161.134","TCP","54","[TCP Keep-Alive ACK] 33374  >  443 [ACK] Seq=544 Ack=3988 Win=11360 Len=0"
"227","69.951291","54.231.184.164","10.10.10.176","TCP","1434","80  >  34960 [ACK] Seq=4510 Ack=205 Win=15872 Len=1380 [TCP segment of a reassembled PDU]"
"228","69.952106","10.10.10.176","54.231.184.164","TCP","54","34960  >  80 [ACK] Seq=205 Ack=5890 Win=16880 Len=0"
"229","69.952163","54.231.184.164","10.10.10.176","TCP","1434","80  >  34960 [ACK] Seq=5890 Ack=205 Win=15872 Len=1380 [TCP segment of a reassembled PDU]"
"230","69.952258","54.231.184.164","10.10.10.176","TCP","1434","80  >  34960 [PSH, ACK] Seq=7270 Ack=205 Win=15872 Len=1380 [TCP segment of a reassembled PDU]"
"231","69.952272","54.231.184.164","10.10.10.176","TCP","1434","80  >  34960 [ACK] Seq=8650 Ack=205 Win=15872 Len=1380 [TCP segment of a reassembled PDU]"
"232","69.952328","54.231.184.164","10.10.10.176","TCP","1434","80  >  34960 [ACK] Seq=10030 Ack=205 Win=15872 Len=1380 [TCP segment of a reassembled PDU]"
"233","69.952452","54.231.184.164","10.10.10.176","TCP","1434","80  >  34960 [PSH, ACK] Seq=11410 Ack=205 Win=15872 Len=1380 [TCP segment of a reassembled PDU]"
"234","69.953015","10.10.10.176","54.231.184.164","TCP","54","34960  >  80 [ACK] Seq=205 Ack=7270 Win=16880 Len=0"
"235","69.953448","54.231.184.164","10.10.10.176","TCP","1434","80  >  34960 [ACK] Seq=12790 Ack=205 Win=15872 Len=1380 [TCP segment of a reassembled PDU]"
"236","69.953459","54.231.184.164","10.10.10.176","TCP","1434","80  >  34960 [ACK] Seq=14170 Ack=205 Win=15872 Len=1380 [TCP segment of a reassembled PDU]"
"237","69.953557","54.231.184.164","10.10.10.176","TCP","1434","80  >  34960 [ACK] Seq=15550 Ack=205 Win=15872 Len=1380 [TCP segment of a reassembled PDU]"
"238","69.953561","54.231.184.164","10.10.10.176","TCP","533","80  >  34960 [PSH, ACK] Seq=16930 Ack=205 Win=15872 Len=479 [TCP segment of a reassembled PDU]"
"239","69.955671","10.10.10.176","54.231.184.164","TCP","54","34960  >  80 [ACK] Seq=205 Ack=8650 Win=16880 Len=0"
"240","69.957625","10.10.10.176","54.231.184.164","TCP","54","34960  >  80 [ACK] Seq=205 Ack=10030 Win=16880 Len=0"
"241","69.958469","10.10.10.176","54.231.184.164","TCP","54","34960  >  80 [ACK] Seq=205 Ack=11410 Win=16880 Len=0"
"242","69.958542","10.10.10.176","54.231.184.164","TCP","54","34960  >  80 [ACK] Seq=205 Ack=14170 Win=16880 Len=0"
"243","69.958713","10.10.10.176","54.231.184.164","TCP","54","34960  >  80 [ACK] Seq=205 Ack=16930 Win=16880 Len=0"
"244","69.959033","10.10.10.176","54.231.184.164","TCP","54","34960  >  80 [ACK] Seq=205 Ack=17409 Win=16880 Len=0"
"245","70.116323","10.10.10.176","224.0.0.251","MDNS","248","Standard query response 0x0000 PTR, cache flush dsp.local PTR, cache flush dsp3D6F.local PTR, cache flush dsp.local AAAA, cache flush fe80::928d:78ff:fea9:3d6f PTR, cache flush dsp3D6F.local"
"246","70.117546","10.10.10.176","224.0.0.251","MDNS","83","Standard query response 0x0000 A, cache flush 10.10.10.176"
"247","70.119860","54.231.184.164","10.10.10.176","TCP","1434","80  >  34960 [ACK] Seq=17409 Ack=205 Win=15872 Len=1380 [TCP segment of a reassembled PDU]"
"248","70.119879","54.231.184.164","10.10.10.176","TCP","1434","80  >  34960 [ACK] Seq=18789 Ack=205 Win=15872 Len=1380 [TCP segment of a reassembled PDU]"
"249","70.119902","54.231.184.164","10.10.10.176","TCP","1434","80  >  34960 [ACK] Seq=20169 Ack=205 Win=15872 Len=1380 [TCP segment of a reassembled PDU]"
"250","70.120559","54.231.184.164","10.10.10.176","TCP","1434","80  >  34960 [ACK] Seq=21549 Ack=205 Win=15872 Len=1380 [TCP segment of a reassembled PDU]"
"251","70.121190","10.10.10.176","54.231.184.164","TCP","54","34960  >  80 [ACK] Seq=205 Ack=20169 Win=16880 Len=0"
"252","70.122097","10.10.10.176","54.231.184.164","TCP","54","34960  >  80 [ACK] Seq=205 Ack=22929 Win=16880 Len=0"
"253","70.123503","54.231.184.164","10.10.10.176","TCP","1434","80  >  34960 [ACK] Seq=22929 Ack=205 Win=15872 Len=1380 [TCP segment of a reassembled PDU]"
"254","70.125207","54.231.184.164","10.10.10.176","TCP","1434","80  >  34960 [PSH, ACK] Seq=24309 Ack=205 Win=15872 Len=1380 [TCP segment of a reassembled PDU]"
"255","70.126037","10.10.10.176","54.231.184.164","TCP","54","34960  >  80 [ACK] Seq=205 Ack=25689 Win=16880 Len=0"
"256","70.126057","54.231.184.164","10.10.10.176","TCP","1434","80  >  34960 [ACK] Seq=25689 Ack=205 Win=15872 Len=1380 [TCP segment of a reassembled PDU]"
"257","70.126069","54.231.184.164","10.10.10.176","TCP","1434","80  >  34960 [ACK] Seq=27069 Ack=205 Win=15872 Len=1380 [TCP segment of a reassembled PDU]"
"258","70.126133","54.231.184.164","10.10.10.176","TCP","1434","80  >  34960 [ACK] Seq=28449 Ack=205 Win=15872 Len=1380 [TCP segment of a reassembled PDU]"
"259","70.126214","54.231.184.164","10.10.10.176","TCP","1434","80  >  34960 [PSH, ACK] Seq=29829 Ack=205 Win=15872 Len=1380 [TCP segment of a reassembled PDU]"
"260","70.126328","54.231.184.164","10.10.10.176","TCP","1434","80  >  34960 [ACK] Seq=31209 Ack=205 Win=15872 Len=1380 [TCP segment of a reassembled PDU]"
"261","70.126634","54.231.184.164","10.10.10.176","TCP","1434","80  >  34960 [ACK] Seq=32589 Ack=205 Win=15872 Len=1380 [TCP segment of a reassembled PDU]"
"262","70.128254","10.10.10.176","54.231.184.164","TCP","54","34960  >  80 [ACK] Seq=205 Ack=28449 Win=16880 Len=0"
"263","70.128786","10.10.10.176","54.231.184.164","TCP","54","34960  >  80 [ACK] Seq=205 Ack=31209 Win=16880 Len=0"
"264","70.129620","10.10.10.176","54.231.184.164","TCP","54","34960  >  80 [ACK] Seq=205 Ack=33969 Win=16880 Len=0"
"265","70.289017","54.231.184.164","10.10.10.176","TCP","1434","80  >  34960 [ACK] Seq=33969 Ack=205 Win=15872 Len=1380 [TCP segment of a reassembled PDU]"
"266","70.289038","54.231.184.164","10.10.10.176","TCP","1434","80  >  34960 [ACK] Seq=35349 Ack=205 Win=15872 Len=1380 [TCP segment of a reassembled PDU]"
"267","70.290154","10.10.10.176","54.231.184.164","TCP","54","34960  >  80 [ACK] Seq=205 Ack=36729 Win=16880 Len=0"
"268","70.290178","54.231.184.164","10.10.10.176","TCP","1434","80  >  34960 [ACK] Seq=36729 Ack=205 Win=15872 Len=1380 [TCP segment of a reassembled PDU]"
"269","70.290191","54.231.184.164","10.10.10.176","TCP","1434","80  >  34960 [ACK] Seq=38109 Ack=205 Win=15872 Len=1380 [TCP segment of a reassembled PDU]"
"270","70.291327","10.10.10.176","54.231.184.164","TCP","54","34960  >  80 [ACK] Seq=205 Ack=39489 Win=16880 Len=0"
"271","70.293879","54.231.184.164","10.10.10.176","TCP","1434","80  >  34960 [ACK] Seq=39489 Ack=205 Win=15872 Len=1380 [TCP segment of a reassembled PDU]"
"272","70.293900","54.231.184.164","10.10.10.176","TCP","1434","80  >  34960 [ACK] Seq=40869 Ack=205 Win=15872 Len=1380 [TCP segment of a reassembled PDU]"
"273","70.295063","10.10.10.176","54.231.184.164","TCP","54","34960  >  80 [ACK] Seq=205 Ack=42249 Win=16880 Len=0"
"274","70.295906","54.231.184.164","10.10.10.176","TCP","1434","80  >  34960 [PSH, ACK] Seq=42249 Ack=205 Win=15872 Len=1380 [TCP segment of a reassembled PDU]"
"275","70.295933","54.231.184.164","10.10.10.176","TCP","1434","80  >  34960 [ACK] Seq=43629 Ack=205 Win=15872 Len=1380 [TCP segment of a reassembled PDU]"
"276","70.296372","54.231.184.164","10.10.10.176","TCP","1434","80  >  34960 [PSH, ACK] Seq=45009 Ack=205 Win=15872 Len=1380 [TCP segment of a reassembled PDU]"
"277","70.296395","54.231.184.164","10.10.10.176","TCP","1434","80  >  34960 [ACK] Seq=46389 Ack=205 Win=15872 Len=1380 [TCP segment of a reassembled PDU]"
"278","70.297289","10.10.10.176","54.231.184.164","TCP","54","34960  >  80 [ACK] Seq=205 Ack=45009 Win=16880 Len=0"
"279","70.297391","54.231.184.164","10.10.10.176","TCP","1434","80  >  34960 [ACK] Seq=47769 Ack=205 Win=15872 Len=1380 [TCP segment of a reassembled PDU]"
"280","70.297464","54.231.184.164","10.10.10.176","TCP","1434","80  >  34960 [ACK] Seq=49149 Ack=205 Win=15872 Len=1380 [TCP segment of a reassembled PDU]"
"281","70.298407","10.10.10.176","54.231.184.164","TCP","54","34960  >  80 [ACK] Seq=205 Ack=47769 Win=16880 Len=0"
"282","70.298742","10.10.10.176","54.231.184.164","TCP","54","34960  >  80 [ACK] Seq=205 Ack=50529 Win=16880 Len=0"
"283","70.457761","54.231.184.164","10.10.10.176","TCP","1434","80  >  34960 [ACK] Seq=50529 Ack=205 Win=15872 Len=1380 [TCP segment of a reassembled PDU]"
"284","70.457781","54.231.184.164","10.10.10.176","TCP","1434","80  >  34960 [ACK] Seq=51909 Ack=205 Win=15872 Len=1380 [TCP segment of a reassembled PDU]"
"285","70.459065","54.231.184.164","10.10.10.176","TCP","1434","80  >  34960 [ACK] Seq=53289 Ack=205 Win=15872 Len=1380 [TCP segment of a reassembled PDU]"
"286","70.459082","54.231.184.164","10.10.10.176","TCP","1434","80  >  34960 [ACK] Seq=54669 Ack=205 Win=15872 Len=1380 [TCP segment of a reassembled PDU]"
"287","70.459607","10.10.10.176","54.231.184.164","TCP","54","34960  >  80 [ACK] Seq=205 Ack=53289 Win=16880 Len=0"
"288","70.460443","10.10.10.176","54.231.184.164","TCP","54","34960  >  80 [ACK] Seq=205 Ack=56049 Win=16880 Len=0"
"289","70.462772","54.231.184.164","10.10.10.176","TCP","1434","80  >  34960 [ACK] Seq=56049 Ack=205 Win=15872 Len=1380 [TCP segment of a reassembled PDU]"
"290","70.462784","54.231.184.164","10.10.10.176","TCP","1434","80  >  34960 [ACK] Seq=57429 Ack=205 Win=15872 Len=1380 [TCP segment of a reassembled PDU]"
"291","70.464004","10.10.10.176","54.231.184.164","TCP","54","34960  >  80 [ACK] Seq=205 Ack=58809 Win=16880 Len=0"
"292","70.464869","54.231.184.164","10.10.10.176","TCP","1434","80  >  34960 [ACK] Seq=58809 Ack=205 Win=15872 Len=1380 [TCP segment of a reassembled PDU]"
"293","70.464887","54.231.184.164","10.10.10.176","TCP","1434","80  >  34960 [PSH, ACK] Seq=60189 Ack=205 Win=15872 Len=1380 [TCP segment of a reassembled PDU]"
"294","70.465994","54.231.184.164","10.10.10.176","TCP","1434","80  >  34960 [PSH, ACK] Seq=61569 Ack=205 Win=15872 Len=1380 [TCP segment of a reassembled PDU]"
"295","70.466020","54.231.184.164","10.10.10.176","TCP","1434","80  >  34960 [ACK] Seq=62949 Ack=205 Win=15872 Len=1380 [TCP segment of a reassembled PDU]"
"296","70.466339","54.231.184.164","10.10.10.176","TCP","1434","80  >  34960 [ACK] Seq=64329 Ack=205 Win=15872 Len=1380 [TCP segment of a reassembled PDU]"
"297","70.466360","54.231.184.164","10.10.10.176","TCP","1434","80  >  34960 [ACK] Seq=65709 Ack=205 Win=15872 Len=1380 [TCP segment of a reassembled PDU]"
"298","70.468158","10.10.10.176","54.231.184.164","TCP","54","34960  >  80 [ACK] Seq=205 Ack=61569 Win=16880 Len=0"
"299","70.469013","10.10.10.176","54.231.184.164","TCP","54","34960  >  80 [ACK] Seq=205 Ack=64329 Win=16880 Len=0"
"300","70.469794","10.10.10.176","54.231.184.164","TCP","54","34960  >  80 [ACK] Seq=205 Ack=67089 Win=16880 Len=0"
"301","70.627209","54.231.184.164","10.10.10.176","TCP","1434","80  >  34960 [ACK] Seq=67089 Ack=205 Win=15872 Len=1380 [TCP segment of a reassembled PDU]"
"302","70.627226","54.231.184.164","10.10.10.176","TCP","1434","80  >  34960 [ACK] Seq=68469 Ack=205 Win=15872 Len=1380 [TCP segment of a reassembled PDU]"
"303","70.627993","54.231.184.164","10.10.10.176","TCP","1434","80  >  34960 [ACK] Seq=69849 Ack=205 Win=15872 Len=1380 [TCP segment of a reassembled PDU]"
"304","70.628007","54.231.184.164","10.10.10.176","TCP","1434","80  >  34960 [ACK] Seq=71229 Ack=205 Win=15872 Len=1380 [TCP segment of a reassembled PDU]"
"305","70.628555","10.10.10.176","54.231.184.164","TCP","54","34960  >  80 [ACK] Seq=205 Ack=69849 Win=16880 Len=0"
"306","70.629333","10.10.10.176","54.231.184.164","TCP","54","34960  >  80 [ACK] Seq=205 Ack=72609 Win=16880 Len=0"
"307","70.631599","54.231.184.164","10.10.10.176","TCP","1434","80  >  34960 [ACK] Seq=72609 Ack=205 Win=15872 Len=1380 [TCP segment of a reassembled PDU]"
"308","70.631620","54.231.184.164","10.10.10.176","TCP","1434","80  >  34960 [ACK] Seq=73989 Ack=205 Win=15872 Len=1380 [TCP segment of a reassembled PDU]"
"309","70.632727","10.10.10.176","54.231.184.164","TCP","54","34960  >  80 [ACK] Seq=205 Ack=75369 Win=16880 Len=0"
"310","70.635972","54.231.184.164","10.10.10.176","TCP","1434","80  >  34960 [ACK] Seq=75369 Ack=205 Win=15872 Len=1380 [TCP segment of a reassembled PDU]"
"311","70.635993","54.231.184.164","10.10.10.176","TCP","1434","80  >  34960 [PSH, ACK] Seq=76749 Ack=205 Win=15872 Len=1380 [TCP segment of a reassembled PDU]"
"312","70.637103","10.10.10.176","54.231.184.164","TCP","54","34960  >  80 [ACK] Seq=205 Ack=78129 Win=16880 Len=0"
"313","70.637149","54.231.184.164","10.10.10.176","TCP","1434","80  >  34960 [PSH, ACK] Seq=78129 Ack=205 Win=15872 Len=1380 [TCP segment of a reassembled PDU]"
"314","70.637166","54.231.184.164","10.10.10.176","TCP","1434","80  >  34960 [ACK] Seq=79509 Ack=205 Win=15872 Len=1380 [TCP segment of a reassembled PDU]"
"315","70.637400","54.231.184.164","10.10.10.176","TCP","1434","80  >  34960 [ACK] Seq=80889 Ack=205 Win=15872 Len=1380 [TCP segment of a reassembled PDU]"
"316","70.637426","54.231.184.164","10.10.10.176","TCP","1434","80  >  34960 [ACK] Seq=82269 Ack=205 Win=15872 Len=1380 [TCP segment of a reassembled PDU]"
"317","70.638478","10.10.10.176","54.231.184.164","TCP","54","34960  >  80 [ACK] Seq=205 Ack=80889 Win=16880 Len=0"
"318","70.639279","10.10.10.176","54.231.184.164","TCP","54","34960  >  80 [ACK] Seq=205 Ack=83649 Win=16880 Len=0"
"319","70.796143","54.231.184.164","10.10.10.176","TCP","1434","80  >  34960 [ACK] Seq=83649 Ack=205 Win=15872 Len=1380 [TCP segment of a reassembled PDU]"
"320","70.796163","54.231.184.164","10.10.10.176","TCP","1434","80  >  34960 [ACK] Seq=85029 Ack=205 Win=15872 Len=1380 [TCP segment of a reassembled PDU]"
"321","70.797069","54.231.184.164","10.10.10.176","TCP","1434","80  >  34960 [ACK] Seq=86409 Ack=205 Win=15872 Len=1380 [TCP segment of a reassembled PDU]"
"322","70.797089","54.231.184.164","10.10.10.176","TCP","1434","80  >  34960 [ACK] Seq=87789 Ack=205 Win=15872 Len=1380 [TCP segment of a reassembled PDU]"
"323","70.798046","10.10.10.176","54.231.184.164","TCP","54","34960  >  80 [ACK] Seq=205 Ack=86409 Win=16880 Len=0"
"324","70.798407","10.10.10.176","54.231.184.164","TCP","54","34960  >  80 [ACK] Seq=205 Ack=89169 Win=16880 Len=0"
"325","70.800300","54.231.184.164","10.10.10.176","TCP","1434","80  >  34960 [ACK] Seq=89169 Ack=205 Win=15872 Len=1380 [TCP segment of a reassembled PDU]"
"326","70.800320","54.231.184.164","10.10.10.176","TCP","1434","80  >  34960 [ACK] Seq=90549 Ack=205 Win=15872 Len=1380 [TCP segment of a reassembled PDU]"
"327","70.801523","10.10.10.176","54.231.184.164","TCP","54","34960  >  80 [ACK] Seq=205 Ack=91929 Win=16880 Len=0"
"328","70.804767","54.231.184.164","10.10.10.176","TCP","1434","80  >  34960 [ACK] Seq=91929 Ack=205 Win=15872 Len=1380 [TCP segment of a reassembled PDU]"
"329","70.804783","54.231.184.164","10.10.10.176","TCP","1434","80  >  34960 [ACK] Seq=93309 Ack=205 Win=15872 Len=1380 [TCP segment of a reassembled PDU]"
"330","70.805878","10.10.10.176","54.231.184.164","TCP","54","34960  >  80 [ACK] Seq=205 Ack=94689 Win=16880 Len=0"
"331","70.806016","54.231.184.164","10.10.10.176","TCP","1434","80  >  34960 [PSH, ACK] Seq=94689 Ack=205 Win=15872 Len=1380 [TCP segment of a reassembled PDU]"
"332","70.806033","54.231.184.164","10.10.10.176","TCP","1434","80  >  34960 [ACK] Seq=96069 Ack=205 Win=15872 Len=1380 [TCP segment of a reassembled PDU]"
"333","70.806841","54.231.184.164","10.10.10.176","TCP","1434","80  >  34960 [ACK] Seq=97449 Ack=205 Win=15872 Len=1380 [TCP segment of a reassembled PDU]"
"334","70.806849","54.231.184.164","10.10.10.176","TCP","1434","80  >  34960 [ACK] Seq=98829 Ack=205 Win=15872 Len=1380 [TCP segment of a reassembled PDU]"
"335","70.807788","10.10.10.176","54.231.184.164","TCP","54","34960  >  80 [ACK] Seq=205 Ack=97449 Win=16880 Len=0"
"336","70.808007","10.10.10.176","54.231.184.164","TCP","54","34960  >  80 [ACK] Seq=205 Ack=100209 Win=16880 Len=0"
"337","70.965622","54.231.184.164","10.10.10.176","TCP","1434","80  >  34960 [ACK] Seq=100209 Ack=205 Win=15872 Len=1380 [TCP segment of a reassembled PDU]"
"338","70.965672","54.231.184.164","10.10.10.176","TCP","1434","80  >  34960 [ACK] Seq=101589 Ack=205 Win=15872 Len=1380 [TCP segment of a reassembled PDU]"
"339","70.965899","54.231.184.164","10.10.10.176","TCP","1434","80  >  34960 [ACK] Seq=102969 Ack=205 Win=15872 Len=1380 [TCP segment of a reassembled PDU]"
"340","70.965951","54.231.184.164","10.10.10.176","TCP","1434","80  >  34960 [ACK] Seq=104349 Ack=205 Win=15872 Len=1380 [TCP segment of a reassembled PDU]"
"341","70.967645","10.10.10.176","54.231.184.164","TCP","54","34960  >  80 [ACK] Seq=205 Ack=102969 Win=16880 Len=0"
"342","70.968107","10.10.10.176","54.231.184.164","TCP","54","34960  >  80 [ACK] Seq=205 Ack=105729 Win=16880 Len=0"
"343","70.969410","54.231.184.164","10.10.10.176","TCP","1434","80  >  34960 [ACK] Seq=105729 Ack=205 Win=15872 Len=1380 [TCP segment of a reassembled PDU]"
"344","70.969430","54.231.184.164","10.10.10.176","TCP","1434","80  >  34960 [ACK] Seq=107109 Ack=205 Win=15872 Len=1380 [TCP segment of a reassembled PDU]"
"345","70.970674","10.10.10.176","54.231.184.164","TCP","54","34960  >  80 [ACK] Seq=205 Ack=108489 Win=16880 Len=0"
"346","70.973614","54.231.184.164","10.10.10.176","TCP","1434","80  >  34960 [ACK] Seq=108489 Ack=205 Win=15872 Len=1380 [TCP segment of a reassembled PDU]"
"347","70.973635","54.231.184.164","10.10.10.176","TCP","1434","80  >  34960 [ACK] Seq=109869 Ack=205 Win=15872 Len=1380 [TCP segment of a reassembled PDU]"
"348","70.975214","10.10.10.176","54.231.184.164","TCP","54","34960  >  80 [ACK] Seq=205 Ack=111249 Win=16880 Len=0"
"349","70.975324","54.231.184.164","10.10.10.176","TCP","1434","80  >  34960 [PSH, ACK] Seq=111249 Ack=205 Win=15872 Len=1380 [TCP segment of a reassembled PDU]"
"350","70.975341","54.231.184.164","10.10.10.176","TCP","1434","80  >  34960 [ACK] Seq=112629 Ack=205 Win=15872 Len=1380 [TCP segment of a reassembled PDU]"
"351","70.975531","54.231.184.164","10.10.10.176","TCP","1434","80  >  34960 [ACK] Seq=114009 Ack=205 Win=15872 Len=1380 [TCP segment of a reassembled PDU]"
"352","70.975557","54.231.184.164","10.10.10.176","TCP","1434","80  >  34960 [ACK] Seq=115389 Ack=205 Win=15872 Len=1380 [TCP segment of a reassembled PDU]"
"353","70.976496","10.10.10.176","54.231.184.164","TCP","54","34960  >  80 [ACK] Seq=205 Ack=114009 Win=16880 Len=0"
"354","70.979363","10.10.10.176","54.231.184.164","TCP","54","34960  >  80 [ACK] Seq=205 Ack=116769 Win=16880 Len=0"
"355","71.107414","10.10.10.176","224.0.0.251","MDNS","380","Standard query response 0x0000 TXT, cache flush PTR D-Link HNAP Service._dhnap._tcp.local SRV, cache flush 0 0 80 dsp.local AAAA, cache flush fe80::928d:78ff:fea9:3d6f A, cache flush 10.10.10.176 PTR _dhnap._tcp.local"
"356","71.135288","54.231.184.164","10.10.10.176","TCP","1434","80  >  34960 [ACK] Seq=116769 Ack=205 Win=15872 Len=1380 [TCP segment of a reassembled PDU]"
"357","71.135305","54.231.184.164","10.10.10.176","TCP","1434","80  >  34960 [ACK] Seq=118149 Ack=205 Win=15872 Len=1380 [TCP segment of a reassembled PDU]"
"358","71.135831","54.231.184.164","10.10.10.176","TCP","1434","80  >  34960 [ACK] Seq=119529 Ack=205 Win=15872 Len=1380 [TCP segment of a reassembled PDU]"
"359","71.135851","54.231.184.164","10.10.10.176","TCP","1434","80  >  34960 [ACK] Seq=120909 Ack=205 Win=15872 Len=1380 [TCP segment of a reassembled PDU]"
"360","71.136501","10.10.10.176","54.231.184.164","TCP","54","34960  >  80 [ACK] Seq=205 Ack=119529 Win=16880 Len=0"
"361","71.137274","10.10.10.176","54.231.184.164","TCP","54","34960  >  80 [ACK] Seq=205 Ack=122289 Win=16880 Len=0"
"362","71.138298","54.231.184.164","10.10.10.176","TCP","1434","80  >  34960 [ACK] Seq=122289 Ack=205 Win=15872 Len=1380 [TCP segment of a reassembled PDU]"
"363","71.138319","54.231.184.164","10.10.10.176","TCP","1434","80  >  34960 [ACK] Seq=123669 Ack=205 Win=15872 Len=1380 [TCP segment of a reassembled PDU]"
"364","71.139604","10.10.10.176","54.231.184.164","TCP","54","34960  >  80 [ACK] Seq=205 Ack=125049 Win=16880 Len=0"
"365","71.143107","54.231.184.164","10.10.10.176","TCP","1434","80  >  34960 [ACK] Seq=125049 Ack=205 Win=15872 Len=1380 [TCP segment of a reassembled PDU]"
"366","71.143120","54.231.184.164","10.10.10.176","TCP","1434","80  >  34960 [ACK] Seq=126429 Ack=205 Win=15872 Len=1380 [TCP segment of a reassembled PDU]"
"367","71.144058","54.231.184.164","10.10.10.176","TCP","1434","80  >  34960 [PSH, ACK] Seq=127809 Ack=205 Win=15872 Len=1380 [TCP segment of a reassembled PDU]"
"368","71.144071","54.231.184.164","10.10.10.176","TCP","1434","80  >  34960 [ACK] Seq=129189 Ack=205 Win=15872 Len=1380 [TCP segment of a reassembled PDU]"
"369","71.144984","10.10.10.176","54.231.184.164","TCP","54","34960  >  80 [ACK] Seq=205 Ack=127809 Win=16880 Len=0"
"370","71.145293","10.10.10.176","54.231.184.164","TCP","54","34960  >  80 [ACK] Seq=205 Ack=130569 Win=16880 Len=0"
"371","71.146922","54.231.184.164","10.10.10.176","TCP","1434","80  >  34960 [ACK] Seq=130569 Ack=205 Win=15872 Len=1380 [TCP segment of a reassembled PDU]"
"372","71.147044","54.231.184.164","10.10.10.176","TCP","1434","80  >  34960 [ACK] Seq=131949 Ack=205 Win=15872 Len=1380 [TCP segment of a reassembled PDU]"
"373","71.148140","10.10.10.176","54.231.184.164","TCP","54","34960  >  80 [ACK] Seq=205 Ack=133329 Win=16880 Len=0"
"374","71.304930","54.231.184.164","10.10.10.176","TCP","1434","80  >  34960 [ACK] Seq=133329 Ack=205 Win=15872 Len=1380 [TCP segment of a reassembled PDU]"
"375","71.304945","54.231.184.164","10.10.10.176","TCP","1434","80  >  34960 [ACK] Seq=134709 Ack=205 Win=15872 Len=1380 [TCP segment of a reassembled PDU]"
"376","71.305373","54.231.184.164","10.10.10.176","TCP","1434","80  >  34960 [ACK] Seq=136089 Ack=205 Win=15872 Len=1380 [TCP segment of a reassembled PDU]"
"377","71.305390","54.231.184.164","10.10.10.176","TCP","1434","80  >  34960 [PSH, ACK] Seq=137469 Ack=205 Win=15872 Len=1380 [TCP segment of a reassembled PDU]"
"378","71.306245","10.10.10.176","54.231.184.164","TCP","54","34960  >  80 [ACK] Seq=205 Ack=136089 Win=16880 Len=0"
"379","71.307065","10.10.10.176","54.231.184.164","TCP","54","34960  >  80 [ACK] Seq=205 Ack=138849 Win=16880 Len=0"
"380","71.307111","54.231.184.164","10.10.10.176","TCP","1434","80  >  34960 [ACK] Seq=138849 Ack=205 Win=15872 Len=1380 [TCP segment of a reassembled PDU]"
"381","71.307219","54.231.184.164","10.10.10.176","TCP","1434","80  >  34960 [ACK] Seq=140229 Ack=205 Win=15872 Len=1380 [TCP segment of a reassembled PDU]"
"382","71.308304","10.10.10.176","54.231.184.164","TCP","54","34960  >  80 [ACK] Seq=205 Ack=141609 Win=16880 Len=0"
"383","71.312504","54.231.184.164","10.10.10.176","TCP","1434","80  >  34960 [ACK] Seq=141609 Ack=205 Win=15872 Len=1380 [TCP segment of a reassembled PDU]"
"384","71.312579","54.231.184.164","10.10.10.176","TCP","1434","80  >  34960 [ACK] Seq=142989 Ack=205 Win=15872 Len=1380 [TCP segment of a reassembled PDU]"
"385","71.312797","54.231.184.164","10.10.10.176","TCP","1434","80  >  34960 [PSH, ACK] Seq=144369 Ack=205 Win=15872 Len=1380 [TCP segment of a reassembled PDU]"
"386","71.312804","54.231.184.164","10.10.10.176","TCP","1434","80  >  34960 [ACK] Seq=145749 Ack=205 Win=15872 Len=1380 [TCP segment of a reassembled PDU]"
"387","71.314164","10.10.10.176","54.231.184.164","TCP","54","34960  >  80 [ACK] Seq=205 Ack=144369 Win=16880 Len=0"
"388","71.314411","10.10.10.176","54.231.184.164","TCP","54","34960  >  80 [ACK] Seq=205 Ack=147129 Win=16880 Len=0"
"389","71.315657","54.231.184.164","10.10.10.176","TCP","1434","80  >  34960 [ACK] Seq=147129 Ack=205 Win=15872 Len=1380 [TCP segment of a reassembled PDU]"
"390","71.315718","54.231.184.164","10.10.10.176","TCP","1434","80  >  34960 [ACK] Seq=148509 Ack=205 Win=15872 Len=1380 [TCP segment of a reassembled PDU]"
"391","71.317170","10.10.10.176","54.231.184.164","TCP","54","34960  >  80 [ACK] Seq=205 Ack=149889 Win=16880 Len=0"
"392","71.473864","54.231.184.164","10.10.10.176","TCP","1434","80  >  34960 [ACK] Seq=149889 Ack=205 Win=15872 Len=1380 [TCP segment of a reassembled PDU]"
"393","71.473884","54.231.184.164","10.10.10.176","TCP","1434","80  >  34960 [ACK] Seq=151269 Ack=205 Win=15872 Len=1380 [TCP segment of a reassembled PDU]"
"394","71.474586","54.231.184.164","10.10.10.176","TCP","1434","80  >  34960 [ACK] Seq=152649 Ack=205 Win=15872 Len=1380 [TCP segment of a reassembled PDU]"
"395","71.474604","54.231.184.164","10.10.10.176","TCP","1434","80  >  34960 [PSH, ACK] Seq=154029 Ack=205 Win=15872 Len=1380 [TCP segment of a reassembled PDU]"
"396","71.475251","10.10.10.176","54.231.184.164","TCP","54","34960  >  80 [ACK] Seq=205 Ack=152649 Win=16880 Len=0"
"397","71.475850","54.231.184.164","10.10.10.176","TCP","1434","80  >  34960 [ACK] Seq=155409 Ack=205 Win=15872 Len=1380 [TCP segment of a reassembled PDU]"
"398","71.475865","54.231.184.164","10.10.10.176","TCP","1434","80  >  34960 [ACK] Seq=156789 Ack=205 Win=15872 Len=1380 [TCP segment of a reassembled PDU]"
"399","71.476032","10.10.10.176","54.231.184.164","TCP","54","34960  >  80 [ACK] Seq=205 Ack=155409 Win=16880 Len=0"
"400","71.477088","10.10.10.176","54.231.184.164","TCP","54","34960  >  80 [ACK] Seq=205 Ack=158169 Win=16880 Len=0"
"401","71.482083","54.231.184.164","10.10.10.176","TCP","1434","80  >  34960 [ACK] Seq=158169 Ack=205 Win=15872 Len=1380 [TCP segment of a reassembled PDU]"
"402","71.482101","54.231.184.164","10.10.10.176","TCP","1434","80  >  34960 [ACK] Seq=159549 Ack=205 Win=15872 Len=1380 [TCP segment of a reassembled PDU]"
"403","71.482144","54.231.184.164","10.10.10.176","TCP","1434","80  >  34960 [PSH, ACK] Seq=160929 Ack=205 Win=15872 Len=1380 [TCP segment of a reassembled PDU]"
"404","71.482253","54.231.184.164","10.10.10.176","TCP","1434","80  >  34960 [ACK] Seq=162309 Ack=205 Win=15872 Len=1380 [TCP segment of a reassembled PDU]"
"405","71.483696","10.10.10.176","54.231.184.164","TCP","54","34960  >  80 [ACK] Seq=205 Ack=160929 Win=16880 Len=0"
"406","71.484258","10.10.10.176","54.231.184.164","TCP","54","34960  >  80 [ACK] Seq=205 Ack=163689 Win=16880 Len=0"
"407","71.484759","54.231.184.164","10.10.10.176","TCP","1434","80  >  34960 [ACK] Seq=163689 Ack=205 Win=15872 Len=1380 [TCP segment of a reassembled PDU]"
"408","71.484780","54.231.184.164","10.10.10.176","TCP","1434","80  >  34960 [ACK] Seq=165069 Ack=205 Win=15872 Len=1380 [TCP segment of a reassembled PDU]"
"409","71.485990","10.10.10.176","54.231.184.164","TCP","54","34960  >  80 [ACK] Seq=205 Ack=166449 Win=16880 Len=0"
"410","71.642869","54.231.184.164","10.10.10.176","TCP","1434","80  >  34960 [ACK] Seq=166449 Ack=205 Win=15872 Len=1380 [TCP segment of a reassembled PDU]"
"411","71.642889","54.231.184.164","10.10.10.176","TCP","1434","80  >  34960 [ACK] Seq=167829 Ack=205 Win=15872 Len=1380 [TCP segment of a reassembled PDU]"
"412","71.643720","54.231.184.164","10.10.10.176","TCP","1434","80  >  34960 [ACK] Seq=169209 Ack=205 Win=15872 Len=1380 [TCP segment of a reassembled PDU]"
"413","71.643739","54.231.184.164","10.10.10.176","TCP","1434","80  >  34960 [PSH, ACK] Seq=170589 Ack=205 Win=15872 Len=1380 [TCP segment of a reassembled PDU]"
"414","71.644304","10.10.10.176","54.231.184.164","TCP","54","34960  >  80 [ACK] Seq=205 Ack=169209 Win=16880 Len=0"
"415","71.644656","54.231.184.164","10.10.10.176","TCP","1434","80  >  34960 [ACK] Seq=171969 Ack=205 Win=15872 Len=1380 [TCP segment of a reassembled PDU]"
"416","71.644748","54.231.184.164","10.10.10.176","TCP","1434","80  >  34960 [ACK] Seq=173349 Ack=205 Win=15872 Len=1380 [TCP segment of a reassembled PDU]"
"417","71.645176","10.10.10.176","54.231.184.164","TCP","54","34960  >  80 [ACK] Seq=205 Ack=171969 Win=16880 Len=0"
"418","71.646337","10.10.10.176","54.231.184.164","TCP","54","34960  >  80 [ACK] Seq=205 Ack=174729 Win=16880 Len=0"
"419","71.651312","54.231.184.164","10.10.10.176","TCP","1434","80  >  34960 [ACK] Seq=174729 Ack=205 Win=15872 Len=1380 [TCP segment of a reassembled PDU]"
"420","71.651327","54.231.184.164","10.10.10.176","TCP","1434","80  >  34960 [ACK] Seq=176109 Ack=205 Win=15872 Len=1380 [TCP segment of a reassembled PDU]"
"421","71.651834","54.231.184.164","10.10.10.176","TCP","1434","80  >  34960 [PSH, ACK] Seq=177489 Ack=205 Win=15872 Len=1380 [TCP segment of a reassembled PDU]"
"422","71.651851","54.231.184.164","10.10.10.176","TCP","1434","80  >  34960 [ACK] Seq=178869 Ack=205 Win=15872 Len=1380 [TCP segment of a reassembled PDU]"
"423","71.652606","10.10.10.176","54.231.184.164","TCP","54","34960  >  80 [ACK] Seq=205 Ack=177489 Win=16880 Len=0"
"424","71.653403","10.10.10.176","54.231.184.164","TCP","54","34960  >  80 [ACK] Seq=205 Ack=180249 Win=16880 Len=0"
"425","71.653537","54.231.184.164","10.10.10.176","TCP","1434","80  >  34960 [ACK] Seq=180249 Ack=205 Win=15872 Len=1380 [TCP segment of a reassembled PDU]"
"426","71.653547","54.231.184.164","10.10.10.176","TCP","1434","80  >  34960 [ACK] Seq=181629 Ack=205 Win=15872 Len=1380 [TCP segment of a reassembled PDU]"
"427","71.654716","10.10.10.176","54.231.184.164","TCP","54","34960  >  80 [ACK] Seq=205 Ack=183009 Win=16880 Len=0"
"428","71.812194","54.231.184.164","10.10.10.176","TCP","1434","80  >  34960 [ACK] Seq=183009 Ack=205 Win=15872 Len=1380 [TCP segment of a reassembled PDU]"
"429","71.812214","54.231.184.164","10.10.10.176","TCP","1434","80  >  34960 [ACK] Seq=184389 Ack=205 Win=15872 Len=1380 [TCP segment of a reassembled PDU]"
"430","71.812781","54.231.184.164","10.10.10.176","TCP","1434","80  >  34960 [ACK] Seq=185769 Ack=205 Win=15872 Len=1380 [TCP segment of a reassembled PDU]"
"431","71.812802","54.231.184.164","10.10.10.176","TCP","1434","80  >  34960 [PSH, ACK] Seq=187149 Ack=205 Win=15872 Len=1380 [TCP segment of a reassembled PDU]"
"432","71.813894","10.10.10.176","54.231.184.164","TCP","54","34960  >  80 [ACK] Seq=205 Ack=185769 Win=16880 Len=0"
"433","71.813949","54.231.184.164","10.10.10.176","TCP","1434","80  >  34960 [ACK] Seq=188529 Ack=205 Win=15872 Len=1380 [TCP segment of a reassembled PDU]"
"434","71.813985","54.231.184.164","10.10.10.176","TCP","1434","80  >  34960 [ACK] Seq=189909 Ack=205 Win=15872 Len=1380 [TCP segment of a reassembled PDU]"
"435","71.814893","10.10.10.176","54.231.184.164","TCP","54","34960  >  80 [ACK] Seq=205 Ack=188529 Win=16880 Len=0"
"436","71.815239","10.10.10.176","54.231.184.164","TCP","54","34960  >  80 [ACK] Seq=205 Ack=191289 Win=16880 Len=0"
"437","71.820426","54.231.184.164","10.10.10.176","TCP","1434","80  >  34960 [ACK] Seq=191289 Ack=205 Win=15872 Len=1380 [TCP segment of a reassembled PDU]"
"438","71.820438","54.231.184.164","10.10.10.176","TCP","1434","80  >  34960 [ACK] Seq=192669 Ack=205 Win=15872 Len=1380 [TCP segment of a reassembled PDU]"
"439","71.821084","54.231.184.164","10.10.10.176","TCP","1434","80  >  34960 [PSH, ACK] Seq=194049 Ack=205 Win=15872 Len=1380 [TCP segment of a reassembled PDU]"
"440","71.821112","54.231.184.164","10.10.10.176","TCP","1434","80  >  34960 [ACK] Seq=195429 Ack=205 Win=15872 Len=1380 [TCP segment of a reassembled PDU]"
"441","71.822161","10.10.10.176","54.231.184.164","TCP","54","34960  >  80 [ACK] Seq=205 Ack=194049 Win=16880 Len=0"
"442","71.822276","54.231.184.164","10.10.10.176","TCP","1434","80  >  34960 [ACK] Seq=196809 Ack=205 Win=15872 Len=1380 [TCP segment of a reassembled PDU]"
"443","71.822290","54.231.184.164","10.10.10.176","TCP","1434","80  >  34960 [ACK] Seq=198189 Ack=205 Win=15872 Len=1380 [TCP segment of a reassembled PDU]"
"444","71.823629","10.10.10.176","54.231.184.164","TCP","54","34960  >  80 [ACK] Seq=205 Ack=196809 Win=16880 Len=0"
"445","71.824274","10.10.10.176","54.231.184.164","TCP","54","34960  >  80 [ACK] Seq=205 Ack=199569 Win=16880 Len=0"
"446","71.981491","54.231.184.164","10.10.10.176","TCP","1434","80  >  34960 [ACK] Seq=199569 Ack=205 Win=15872 Len=1380 [TCP segment of a reassembled PDU]"
"447","71.981512","54.231.184.164","10.10.10.176","TCP","1434","80  >  34960 [ACK] Seq=200949 Ack=205 Win=15872 Len=1380 [TCP segment of a reassembled PDU]"
"448","71.982630","10.10.10.176","54.231.184.164","TCP","54","34960  >  80 [ACK] Seq=205 Ack=202329 Win=16880 Len=0"
"449","71.982651","54.231.184.164","10.10.10.176","TCP","1434","80  >  34960 [ACK] Seq=202329 Ack=205 Win=15872 Len=1380 [TCP segment of a reassembled PDU]"
"450","71.982662","54.231.184.164","10.10.10.176","TCP","1434","80  >  34960 [PSH, ACK] Seq=203709 Ack=205 Win=15872 Len=1380 [TCP segment of a reassembled PDU]"
"451","71.982839","54.231.184.164","10.10.10.176","TCP","1434","80  >  34960 [ACK] Seq=205089 Ack=205 Win=15872 Len=1380 [TCP segment of a reassembled PDU]"
"452","71.982860","54.231.184.164","10.10.10.176","TCP","1434","80  >  34960 [ACK] Seq=206469 Ack=205 Win=15872 Len=1380 [TCP segment of a reassembled PDU]"
"453","71.984294","10.10.10.176","54.231.184.164","TCP","54","34960  >  80 [ACK] Seq=205 Ack=205089 Win=16880 Len=0"
"454","71.985119","10.10.10.176","54.231.184.164","TCP","54","34960  >  80 [ACK] Seq=205 Ack=207849 Win=16880 Len=0"
"455","71.989752","54.231.184.164","10.10.10.176","TCP","1434","80  >  34960 [ACK] Seq=207849 Ack=205 Win=15872 Len=1380 [TCP segment of a reassembled PDU]"
"456","71.989831","54.231.184.164","10.10.10.176","TCP","1434","80  >  34960 [ACK] Seq=209229 Ack=205 Win=15872 Len=1380 [TCP segment of a reassembled PDU]"
"457","71.990944","10.10.10.176","54.231.184.164","TCP","54","34960  >  80 [ACK] Seq=205 Ack=210609 Win=16880 Len=0"
"458","71.991115","54.231.184.164","10.10.10.176","TCP","1434","80  >  34960 [PSH, ACK] Seq=210609 Ack=205 Win=15872 Len=1380 [TCP segment of a reassembled PDU]"
"459","71.991150","54.231.184.164","10.10.10.176","TCP","1434","80  >  34960 [ACK] Seq=211989 Ack=205 Win=15872 Len=1380 [TCP segment of a reassembled PDU]"
"460","71.991862","54.231.184.164","10.10.10.176","TCP","1434","80  >  34960 [ACK] Seq=213369 Ack=205 Win=15872 Len=1380 [TCP segment of a reassembled PDU]"
"461","71.991974","54.231.184.164","10.10.10.176","TCP","1434","80  >  34960 [ACK] Seq=214749 Ack=205 Win=15872 Len=1380 [TCP segment of a reassembled PDU]"
"462","71.993446","10.10.10.176","54.231.184.164","TCP","54","34960  >  80 [ACK] Seq=205 Ack=213369 Win=16880 Len=0"
"463","71.994338","10.10.10.176","54.231.184.164","TCP","54","34960  >  80 [ACK] Seq=205 Ack=216129 Win=16880 Len=0"
"464","72.150361","54.231.184.164","10.10.10.176","TCP","1434","80  >  34960 [ACK] Seq=216129 Ack=205 Win=15872 Len=1380 [TCP segment of a reassembled PDU]"
"465","72.150382","54.231.184.164","10.10.10.176","TCP","1434","80  >  34960 [ACK] Seq=217509 Ack=205 Win=15872 Len=1380 [TCP segment of a reassembled PDU]"
"466","72.151627","10.10.10.176","54.231.184.164","TCP","54","34960  >  80 [ACK] Seq=205 Ack=218889 Win=16880 Len=0"
"467","72.151856","54.231.184.164","10.10.10.176","TCP","1434","80  >  34960 [ACK] Seq=218889 Ack=205 Win=15872 Len=1380 [TCP segment of a reassembled PDU]"
"468","72.151874","54.231.184.164","10.10.10.176","TCP","1434","80  >  34960 [PSH, ACK] Seq=220269 Ack=205 Win=15872 Len=1380 [TCP segment of a reassembled PDU]"
"469","72.152655","54.231.184.164","10.10.10.176","TCP","1434","80  >  34960 [ACK] Seq=221649 Ack=205 Win=15872 Len=1380 [TCP segment of a reassembled PDU]"
"470","72.152672","54.231.184.164","10.10.10.176","TCP","1434","80  >  34960 [ACK] Seq=223029 Ack=205 Win=15872 Len=1380 [TCP segment of a reassembled PDU]"
"471","72.153943","10.10.10.176","54.231.184.164","TCP","54","34960  >  80 [ACK] Seq=205 Ack=221649 Win=16880 Len=0"
"472","72.154412","10.10.10.176","54.231.184.164","TCP","54","34960  >  80 [ACK] Seq=205 Ack=224409 Win=16880 Len=0"
"473","72.158561","54.231.184.164","10.10.10.176","TCP","1434","80  >  34960 [ACK] Seq=224409 Ack=205 Win=15872 Len=1380 [TCP segment of a reassembled PDU]"
"474","72.158582","54.231.184.164","10.10.10.176","TCP","1434","80  >  34960 [ACK] Seq=225789 Ack=205 Win=15872 Len=1380 [TCP segment of a reassembled PDU]"
"475","72.159764","10.10.10.176","54.231.184.164","TCP","54","34960  >  80 [ACK] Seq=205 Ack=227169 Win=16880 Len=0"
"476","72.161038","54.231.184.164","10.10.10.176","TCP","1434","80  >  34960 [PSH, ACK] Seq=227169 Ack=205 Win=15872 Len=1380 [TCP segment of a reassembled PDU]"
"477","72.161064","54.231.184.164","10.10.10.176","TCP","1434","80  >  34960 [ACK] Seq=228549 Ack=205 Win=15872 Len=1380 [TCP segment of a reassembled PDU]"
"478","72.161913","54.231.184.164","10.10.10.176","TCP","1434","80  >  34960 [ACK] Seq=229929 Ack=205 Win=15872 Len=1380 [TCP segment of a reassembled PDU]"
"479","72.161928","54.231.184.164","10.10.10.176","TCP","1434","80  >  34960 [ACK] Seq=231309 Ack=205 Win=15872 Len=1380 [TCP segment of a reassembled PDU]"
"480","72.162889","10.10.10.176","54.231.184.164","TCP","54","34960  >  80 [ACK] Seq=205 Ack=229929 Win=16880 Len=0"
"481","72.163118","10.10.10.176","54.231.184.164","TCP","54","34960  >  80 [ACK] Seq=205 Ack=232689 Win=16880 Len=0"
"482","72.319216","54.231.184.164","10.10.10.176","TCP","1434","80  >  34960 [ACK] Seq=232689 Ack=205 Win=15872 Len=1380 [TCP segment of a reassembled PDU]"
"483","72.319237","54.231.184.164","10.10.10.176","TCP","1434","80  >  34960 [ACK] Seq=234069 Ack=205 Win=15872 Len=1380 [TCP segment of a reassembled PDU]"
"484","72.320550","10.10.10.176","54.231.184.164","TCP","54","34960  >  80 [ACK] Seq=205 Ack=235449 Win=16880 Len=0"
"485","72.321770","54.231.184.164","10.10.10.176","TCP","1434","80  >  34960 [ACK] Seq=235449 Ack=205 Win=15872 Len=1380 [TCP segment of a reassembled PDU]"
"486","72.321792","54.231.184.164","10.10.10.176","TCP","1434","80  >  34960 [PSH, ACK] Seq=236829 Ack=205 Win=15872 Len=1380 [TCP segment of a reassembled PDU]"
"487","72.322076","54.231.184.164","10.10.10.176","TCP","1434","80  >  34960 [ACK] Seq=238209 Ack=205 Win=15872 Len=1380 [TCP segment of a reassembled PDU]"
"488","72.322095","54.231.184.164","10.10.10.176","TCP","1434","80  >  34960 [ACK] Seq=239589 Ack=205 Win=15872 Len=1380 [TCP segment of a reassembled PDU]"
"489","72.323472","10.10.10.176","54.231.184.164","TCP","54","34960  >  80 [ACK] Seq=205 Ack=238209 Win=16880 Len=0"
"490","72.323876","10.10.10.176","54.231.184.164","TCP","54","34960  >  80 [ACK] Seq=205 Ack=240969 Win=16880 Len=0"
"491","72.327403","54.231.184.164","10.10.10.176","TCP","1434","80  >  34960 [ACK] Seq=240969 Ack=205 Win=15872 Len=1380 [TCP segment of a reassembled PDU]"
"492","72.327420","54.231.184.164","10.10.10.176","TCP","1434","80  >  34960 [ACK] Seq=242349 Ack=205 Win=15872 Len=1380 [TCP segment of a reassembled PDU]"
"493","72.328563","10.10.10.176","54.231.184.164","TCP","54","34960  >  80 [ACK] Seq=205 Ack=243729 Win=16880 Len=0"
"494","72.330535","54.231.184.164","10.10.10.176","TCP","1434","80  >  34960 [PSH, ACK] Seq=243729 Ack=205 Win=15872 Len=1380 [TCP segment of a reassembled PDU]"
"495","72.330551","54.231.184.164","10.10.10.176","TCP","1434","80  >  34960 [ACK] Seq=245109 Ack=205 Win=15872 Len=1380 [TCP segment of a reassembled PDU]"
"496","72.330759","54.231.184.164","10.10.10.176","TCP","1434","80  >  34960 [ACK] Seq=246489 Ack=205 Win=15872 Len=1380 [TCP segment of a reassembled PDU]"
"497","72.330770","54.231.184.164","10.10.10.176","TCP","1434","80  >  34960 [ACK] Seq=247869 Ack=205 Win=15872 Len=1380 [TCP segment of a reassembled PDU]"
"498","72.331747","10.10.10.176","54.231.184.164","TCP","54","34960  >  80 [ACK] Seq=205 Ack=246489 Win=16880 Len=0"
"499","72.332593","10.10.10.176","54.231.184.164","TCP","54","34960  >  80 [ACK] Seq=205 Ack=249249 Win=16880 Len=0"
"500","72.352332","10.10.10.176","224.0.0.251","MDNS","308","Standard query response 0x0000 PTR, cache flush dsp.local A, cache flush 10.10.10.176 A, cache flush 10.10.10.176 PTR, cache flush dsp3D6F.local PTR, cache flush dsp.local AAAA, cache flush fe80::928d:78ff:fea9:3d6f AAAA, cache flush fe80::928d:78ff:fea9:3d6f PTR, cache flush dsp3D6F.local"
"501","72.488138","54.231.184.164","10.10.10.176","TCP","1434","80  >  34960 [ACK] Seq=249249 Ack=205 Win=15872 Len=1380 [TCP segment of a reassembled PDU]"
"502","72.488159","54.231.184.164","10.10.10.176","TCP","1434","80  >  34960 [ACK] Seq=250629 Ack=205 Win=15872 Len=1380 [TCP segment of a reassembled PDU]"
"503","72.489318","10.10.10.176","54.231.184.164","TCP","54","34960  >  80 [ACK] Seq=205 Ack=252009 Win=16880 Len=0"
"504","72.491327","54.231.184.164","10.10.10.176","TCP","1434","80  >  34960 [ACK] Seq=252009 Ack=205 Win=15872 Len=1380 [TCP segment of a reassembled PDU]"
"505","72.491348","54.231.184.164","10.10.10.176","HTTP","539","HTTP/1.1 200 OK  (binary/octet-stream)"
"506","72.492315","10.10.10.176","54.231.184.164","TCP","54","34960  >  80 [ACK] Seq=205 Ack=253874 Win=16880 Len=0"
"507","72.493964","10.10.10.176","54.231.184.164","TCP","54","34960  >  80 [FIN, ACK] Seq=205 Ack=253874 Win=16880 Len=0"
"508","72.661474","54.231.184.164","10.10.10.176","TCP","54","80  >  34960 [FIN, ACK] Seq=253874 Ack=206 Win=15872 Len=0"
"509","72.662093","10.10.10.176","54.231.184.164","TCP","54","34960  >  80 [ACK] Seq=206 Ack=253875 Win=16880 Len=0"
"510","73.339422","10.10.10.176","224.0.0.251","MDNS","380","Standard query response 0x0000 TXT, cache flush PTR D-Link HNAP Service._dhnap._tcp.local SRV, cache flush 0 0 80 dsp.local AAAA, cache flush fe80::928d:78ff:fea9:3d6f A, cache flush 10.10.10.176 PTR _dhnap._tcp.local"
"511","73.521487","10.10.10.176","52.28.161.134","TCP","54","33374  >  443 [FIN, ACK] Seq=544 Ack=3988 Win=11360 Len=0"
"512","73.523617","52.28.161.134","10.10.10.176","TLSv1","91","Encrypted Alert"
"513","73.523645","52.28.161.134","10.10.10.176","TCP","54","443  >  33374 [FIN, ACK] Seq=4025 Ack=545 Win=8192 Len=0"
"514","73.524297","10.10.10.176","52.28.161.134","TCP","54","33374  >  443 [RST] Seq=545 Win=0 Len=0"
"515","73.524665","10.10.10.176","52.28.161.134","TCP","54","33374  >  443 [RST] Seq=545 Win=0 Len=0"
"516","75.850320","10.10.10.176","10.10.10.1","DNS","77","Standard query 0x0002 A api.dch.dlink.com"
"517","75.850413","10.10.10.1","10.10.10.176","DNS","185","Standard query response 0x0002 A api.dch.dlink.com CNAME dualstack.eu-api-elb-1068129369.eu-central-1.elb.amazonaws.com A 52.28.38.154 A 52.29.29.242"
"518","75.859208","10.10.10.176","52.28.38.154","TCP","74","36296  >  443 [SYN] Seq=0 Win=5840 Len=0 MSS=1460 SACK_PERM=1 TSval=4294939985 TSecr=0 WS=2"
"519","75.861752","52.28.38.154","10.10.10.176","TCP","74","443  >  36296 [SYN, ACK] Seq=0 Ack=1 Win=17898 Len=0 MSS=1380 SACK_PERM=1 TSval=208506664 TSecr=4294939985 WS=256"
"520","75.862531","10.10.10.176","52.28.38.154","TCP","66","36296  >  443 [ACK] Seq=1 Ack=1 Win=5840 Len=0 TSval=4294939986 TSecr=208506664"
"521","75.914146","10.10.10.176","52.28.38.154","TLSv1.2","365","Client Hello"
"522","75.916601","52.28.38.154","10.10.10.176","TCP","66","443  >  36296 [ACK] Seq=1 Ack=300 Win=19200 Len=0 TSval=208506678 TSecr=4294939999"
"523","75.918658","52.28.38.154","10.10.10.176","TLSv1.2","1434","Server Hello"
"524","75.918679","52.28.38.154","10.10.10.176","TCP","1434","443  >  36296 [ACK] Seq=1369 Ack=300 Win=19200 Len=1368 TSval=208506678 TSecr=4294939999 [TCP segment of a reassembled PDU]"
"525","75.918681","52.28.38.154","10.10.10.176","TLSv1.2","1149","Certificate, Server Key Exchange, Server Hello Done"
"526","75.919962","10.10.10.176","52.28.38.154","TCP","66","36296  >  443 [ACK] Seq=300 Ack=1369 Win=8576 Len=0 TSval=4294940000 TSecr=208506678"
"527","75.920180","10.10.10.176","52.28.38.154","TCP","66","36296  >  443 [ACK] Seq=300 Ack=2737 Win=11312 Len=0 TSval=4294940000 TSecr=208506678"
"528","75.920271","10.10.10.176","52.28.38.154","TCP","66","36296  >  443 [ACK] Seq=300 Ack=3820 Win=14048 Len=0 TSval=4294940000 TSecr=208506678"
"529","76.025512","10.10.10.176","52.28.38.154","TLSv1.2","192","Client Key Exchange, Change Cipher Spec, Encrypted Handshake Message"
"530","76.028709","52.28.38.154","10.10.10.176","TLSv1.2","292","New Session Ticket, Change Cipher Spec, Encrypted Handshake Message"
"531","76.029348","10.10.10.176","52.28.38.154","TCP","66","36296  >  443 [ACK] Seq=426 Ack=4046 Win=14048 Len=0 TSval=4294940027 TSecr=208506706"
"532","76.084700","10.10.10.176","52.28.38.154","TLSv1.2","505","Application Data"
"533","76.123790","52.28.38.154","10.10.10.176","TCP","66","443  >  36296 [ACK] Seq=4046 Ack=865 Win=20224 Len=0 TSval=208506730 TSecr=4294940041"
"534","76.257599","52.28.38.154","10.10.10.176","TLSv1.2","335","Application Data"
"535","76.257625","52.28.38.154","10.10.10.176","TLSv1.2","97","Encrypted Alert"
"536","76.258250","10.10.10.176","52.28.38.154","TCP","66","36296  >  443 [ACK] Seq=865 Ack=4315 Win=14048 Len=0 TSval=4294940085 TSecr=208506763"
"537","76.258682","10.10.10.176","52.28.38.154","TCP","66","36296  >  443 [ACK] Seq=865 Ack=4346 Win=14048 Len=0 TSval=4294940085 TSecr=208506763"
"538","76.259988","10.10.10.176","52.28.38.154","TCP","66","36296  >  443 [RST, ACK] Seq=865 Ack=4346 Win=14048 Len=0 TSval=4294940085 TSecr=208506763"
"539","76.770374","10.10.10.176","52.28.38.154","TCP","74","36297  >  443 [SYN] Seq=0 Win=5840 Len=0 MSS=1460 SACK_PERM=1 TSval=4294940213 TSecr=0 WS=2"
"540","76.773136","52.28.38.154","10.10.10.176","TCP","74","443  >  36297 [SYN, ACK] Seq=0 Ack=1 Win=17898 Len=0 MSS=1380 SACK_PERM=1 TSval=208506892 TSecr=4294940213 WS=256"
"541","76.773933","10.10.10.176","52.28.38.154","TCP","66","36297  >  443 [ACK] Seq=1 Ack=1 Win=5840 Len=0 TSval=4294940214 TSecr=208506892"
"542","76.822164","10.10.10.176","52.28.38.154","TLSv1.2","557","Client Hello"
"543","76.824907","52.28.38.154","10.10.10.176","TCP","66","443  >  36297 [ACK] Seq=1 Ack=492 Win=19200 Len=0 TSval=208506905 TSecr=4294940226"
"544","76.825058","52.28.38.154","10.10.10.176","TLSv1.2","203","Server Hello, Change Cipher Spec, Encrypted Handshake Message"
"545","76.827548","10.10.10.176","52.28.38.154","TCP","66","36297  >  443 [ACK] Seq=492 Ack=138 Win=5840 Len=0 TSval=4294940227 TSecr=208506905"
"546","76.876449","10.10.10.176","52.28.38.154","TLSv1.2","117","Change Cipher Spec, Encrypted Handshake Message"
"547","76.916085","52.28.38.154","10.10.10.176","TCP","66","443  >  36297 [ACK] Seq=138 Ack=543 Win=19200 Len=0 TSval=208506928 TSecr=4294940239"
"548","76.917457","10.10.10.176","52.28.38.154","TLSv1.2","426","Application Data"
"549","76.920291","52.28.38.154","10.10.10.176","TCP","66","443  >  36297 [ACK] Seq=138 Ack=903 Win=20224 Len=0 TSval=208506929 TSecr=4294940249"
"550","77.269885","10.10.10.176","224.0.0.22","IGMPv3","54","Membership Report / Join group 224.0.0.251 for any sources"
"551","77.428410","52.28.38.154","10.10.10.176","TLSv1.2","462","Application Data"
"552","77.428436","52.28.38.154","10.10.10.176","TLSv1.2","97","Encrypted Alert"
"553","77.429227","10.10.10.176","52.28.38.154","TCP","66","36297  >  443 [ACK] Seq=903 Ack=534 Win=6912 Len=0 TSval=4294940377 TSecr=208507056"
"554","77.429555","10.10.10.176","52.28.38.154","TCP","66","36297  >  443 [ACK] Seq=903 Ack=565 Win=6912 Len=0 TSval=4294940377 TSecr=208507056"
"555","77.431762","10.10.10.176","10.10.10.1","DNS","79","Standard query 0x0003 A r0802.dch.dlink.com"
"556","77.741919","10.10.10.1","10.10.10.176","DNS","296","Standard query response 0x0003 A r0802.dch.dlink.com A 52.28.131.102 NS ns-961.awsdns-56.net NS ns-265.awsdns-33.com NS ns-1057.awsdns-04.org NS ns-1758.awsdns-27.co.uk A 205.251.193.9 A 205.251.195.193 A 205.251.196.33 A 205.251.198.222"
"557","77.743105","10.10.10.176","52.28.131.102","TCP","74","40851  >  443 [SYN] Seq=0 Win=5840 Len=0 MSS=1460 SACK_PERM=1 TSval=4294940456 TSecr=0 WS=2"
"558","77.745381","52.28.131.102","10.10.10.176","TCP","66","443  >  40851 [SYN, ACK] Seq=0 Ack=1 Win=8192 Len=0 MSS=1380 SACK_PERM=1 WS=128"
"559","77.746169","10.10.10.176","52.28.131.102","TCP","54","40851  >  443 [ACK] Seq=1 Ack=1 Win=5840 Len=0"
"560","77.798245","10.10.10.176","52.28.131.102","TLSv1.2","353","Client Hello"
"561","77.800376","52.28.131.102","10.10.10.176","TCP","54","443  >  40851 [ACK] Seq=1 Ack=300 Win=8064 Len=0"
"562","77.800403","52.28.131.102","10.10.10.176","TLSv1.2","112","Server Hello"
"563","77.800668","52.28.131.102","10.10.10.176","TCP","1434","443  >  40851 [ACK] Seq=59 Ack=300 Win=8192 Len=1380 [TCP segment of a reassembled PDU]"
"564","77.800688","52.28.131.102","10.10.10.176","TCP","1434","443  >  40851 [ACK] Seq=1439 Ack=300 Win=8192 Len=1380 [TCP segment of a reassembled PDU]"
"565","77.800690","52.28.131.102","10.10.10.176","TLSv1.2","700","Certificate"
"566","77.801678","10.10.10.176","52.28.131.102","TCP","54","40851  >  443 [ACK] Seq=300 Ack=59 Win=5840 Len=0"
"567","77.802116","10.10.10.176","52.28.131.102","TCP","54","40851  >  443 [ACK] Seq=300 Ack=1439 Win=8600 Len=0"
"568","77.802176","10.10.10.176","52.28.131.102","TCP","54","40851  >  443 [ACK] Seq=300 Ack=2819 Win=11360 Len=0"
"569","77.802422","10.10.10.176","52.28.131.102","TCP","54","40851  >  443 [ACK] Seq=300 Ack=3465 Win=11360 Len=0"
"570","77.808623","52.28.131.102","10.10.10.176","TLSv1.2","392","Server Key Exchange"
"571","77.808646","52.28.131.102","10.10.10.176","TLSv1.2","63","Server Hello Done"
"572","77.809392","10.10.10.176","52.28.131.102","TCP","54","40851  >  443 [ACK] Seq=300 Ack=3803 Win=11360 Len=0"
"573","77.809768","10.10.10.176","52.28.131.102","TCP","54","40851  >  443 [ACK] Seq=300 Ack=3812 Win=11360 Len=0"
"574","77.916028","10.10.10.176","52.28.131.102","TLSv1.2","204","Client Key Exchange, Change Cipher Spec, Encrypted Handshake Message"
"575","77.920118","52.28.131.102","10.10.10.176","TLSv1.2","173","New Session Ticket"
"576","77.920143","52.28.131.102","10.10.10.176","TLSv1.2","60","Change Cipher Spec"
"577","77.920148","52.28.131.102","10.10.10.176","TLSv1.2","123","Encrypted Handshake Message"
"578","77.929072","52.28.131.102","10.10.10.176","TCP","123","[TCP Retransmission] 443  >  40851 [PSH, ACK] Seq=3937 Ack=450 Win=8192 Len=69"
"579","77.930896","10.10.10.176","52.28.131.102","TCP","66","40851  >  443 [ACK] Seq=450 Ack=4006 Win=11360 Len=0 SLE=3937 SRE=4006"
"580","77.972107","10.10.10.176","52.28.38.154","TCP","66","36297  >  443 [RST, ACK] Seq=903 Ack=565 Win=6912 Len=0 TSval=4294940513 TSecr=208507056"
"581","77.973106","10.10.10.176","52.28.131.102","TLSv1.2","235","Application Data"
"582","78.013041","52.28.131.102","10.10.10.176","TCP","54","443  >  40851 [ACK] Seq=4006 Ack=631 Win=8192 Len=0"
"583","82.973116","52.28.131.102","10.10.10.176","TCP","54","[TCP Keep-Alive] 443  >  40851 [ACK] Seq=4005 Ack=631 Win=8192 Len=0"
"584","82.973769","10.10.10.176","52.28.131.102","TCP","54","[TCP Keep-Alive ACK] 40851  >  443 [ACK] Seq=631 Ack=4006 Win=11360 Len=0"
"585","87.977102","52.28.131.102","10.10.10.176","TCP","54","[TCP Keep-Alive] 443  >  40851 [ACK] Seq=4005 Ack=631 Win=8192 Len=0"
"586","87.977668","10.10.10.176","52.28.131.102","TCP","54","[TCP Keep-Alive ACK] 40851  >  443 [ACK] Seq=631 Ack=4006 Win=11360 Len=0"
"587","88.009913","10.10.10.176","52.28.131.102","TCP","54","[TCP Keep-Alive] 40851  >  443 [ACK] Seq=630 Ack=4006 Win=11360 Len=0"
"588","88.011986","52.28.131.102","10.10.10.176","TCP","54","[TCP Keep-Alive ACK] 443  >  40851 [ACK] Seq=4006 Ack=631 Win=8192 Len=0"
"589","92.985149","52.28.131.102","10.10.10.176","TCP","54","[TCP Keep-Alive] 443  >  40851 [ACK] Seq=4005 Ack=631 Win=8192 Len=0"
"590","92.986632","10.10.10.176","52.28.131.102","TCP","54","[TCP Keep-Alive ACK] 40851  >  443 [ACK] Seq=631 Ack=4006 Win=11360 Len=0"
"591","97.993226","52.28.131.102","10.10.10.176","TCP","54","[TCP Keep-Alive] 443  >  40851 [ACK] Seq=4005 Ack=631 Win=8192 Len=0"
"592","97.994720","10.10.10.176","52.28.131.102","TCP","54","[TCP Keep-Alive ACK] 40851  >  443 [ACK] Seq=631 Ack=4006 Win=11360 Len=0"
"593","98.010072","10.10.10.176","52.28.131.102","TCP","54","[TCP Keep-Alive] 40851  >  443 [ACK] Seq=630 Ack=4006 Win=11360 Len=0"
"594","98.012107","52.28.131.102","10.10.10.176","TCP","54","[TCP Keep-Alive ACK] 443  >  40851 [ACK] Seq=4006 Ack=631 Win=8192 Len=0"
"595","103.001245","52.28.131.102","10.10.10.176","TCP","54","[TCP Keep-Alive] 443  >  40851 [ACK] Seq=4005 Ack=631 Win=8192 Len=0"
"596","103.002733","10.10.10.176","52.28.131.102","TCP","54","[TCP Keep-Alive ACK] 40851  >  443 [ACK] Seq=631 Ack=4006 Win=11360 Len=0"
"597","108.009288","DavidEle_06:08:ba","D-LinkIn_a9:3d:6f","ARP","42","Who has 10.10.10.176? Tell 10.10.10.1"
"598","108.009342","52.28.131.102","10.10.10.176","TCP","54","[TCP Keep-Alive] 443  >  40851 [ACK] Seq=4005 Ack=631 Win=8192 Len=0"
"599","108.010748","10.10.10.176","52.28.131.102","TCP","54","[TCP Keep-Alive] 40851  >  443 [ACK] Seq=630 Ack=4006 Win=11360 Len=0"
"600","108.012201","D-LinkIn_a9:3d:6f","DavidEle_06:08:ba","ARP","42","10.10.10.176 is at 90:8d:78:a9:3d:6f"
"601","108.012397","10.10.10.176","52.28.131.102","TCP","54","[TCP Keep-Alive ACK] 40851  >  443 [ACK] Seq=631 Ack=4006 Win=11360 Len=0"
"602","108.012796","52.28.131.102","10.10.10.176","TCP","54","[TCP Dup ACK 582#1] 443  >  40851 [ACK] Seq=4006 Ack=631 Win=8192 Len=0"
"603","113.017824","52.28.131.102","10.10.10.176","TCP","54","[TCP Keep-Alive] 443  >  40851 [ACK] Seq=4005 Ack=631 Win=8192 Len=0"
"604","113.019322","10.10.10.176","52.28.131.102","TCP","54","[TCP Keep-Alive ACK] 40851  >  443 [ACK] Seq=631 Ack=4006 Win=11360 Len=0"
"605","118.014382","10.10.10.176","52.28.131.102","TCP","54","[TCP Keep-Alive] 40851  >  443 [ACK] Seq=630 Ack=4006 Win=11360 Len=0"
"606","118.016477","52.28.131.102","10.10.10.176","TCP","54","[TCP Keep-Alive ACK] 443  >  40851 [ACK] Seq=4006 Ack=631 Win=8192 Len=0"
"607","118.025314","52.28.131.102","10.10.10.176","TCP","54","[TCP Keep-Alive] 443  >  40851 [ACK] Seq=4005 Ack=631 Win=8192 Len=0"
"608","118.026950","10.10.10.176","52.28.131.102","TCP","54","[TCP Keep-Alive ACK] 40851  >  443 [ACK] Seq=631 Ack=4006 Win=11360 Len=0"
"609","120.522133","10.10.10.176","10.10.10.1","DNS","77","Standard query 0x0004 A api.dch.dlink.com"
"610","120.522230","10.10.10.1","10.10.10.176","DNS","185","Standard query response 0x0004 A api.dch.dlink.com CNAME dualstack.eu-api-elb-1068129369.eu-central-1.elb.amazonaws.com A 52.29.29.242 A 52.28.38.154"
"611","120.525545","10.10.10.176","52.29.29.242","TCP","74","40246  >  443 [SYN] Seq=0 Win=5840 Len=0 MSS=1460 SACK_PERM=1 TSval=4294951151 TSecr=0 WS=2"
"612","120.527970","52.29.29.242","10.10.10.176","TCP","74","443  >  40246 [SYN, ACK] Seq=0 Ack=1 Win=17898 Len=0 MSS=1380 SACK_PERM=1 TSval=208514428 TSecr=4294951151 WS=256"
"613","120.529712","10.10.10.176","52.29.29.242","TCP","66","40246  >  443 [ACK] Seq=1 Ack=1 Win=5840 Len=0 TSval=4294951152 TSecr=208514428"
"614","120.579606","10.10.10.176","52.29.29.242","TLSv1.2","557","Client Hello"
"615","120.581988","52.29.29.242","10.10.10.176","TCP","66","443  >  40246 [ACK] Seq=1 Ack=492 Win=19200 Len=0 TSval=208514442 TSecr=4294951165"
"616","120.583930","52.29.29.242","10.10.10.176","TLSv1.2","1434","Server Hello"
"617","120.583947","52.29.29.242","10.10.10.176","TCP","1434","443  >  40246 [ACK] Seq=1369 Ack=492 Win=19200 Len=1368 TSval=208514442 TSecr=4294951165 [TCP segment of a reassembled PDU]"
"618","120.584028","52.29.29.242","10.10.10.176","TLSv1.2","1149","Certificate, Server Key Exchange, Server Hello Done"
"619","120.596840","10.10.10.176","52.29.29.242","TCP","66","40246  >  443 [ACK] Seq=492 Ack=1369 Win=8576 Len=0 TSval=4294951169 TSecr=208514442"
"620","120.609378","10.10.10.176","52.29.29.242","TCP","66","40246  >  443 [ACK] Seq=492 Ack=2737 Win=11312 Len=0 TSval=4294951172 TSecr=208514442"
"621","120.619653","10.10.10.176","52.29.29.242","TCP","66","40246  >  443 [ACK] Seq=492 Ack=3820 Win=14048 Len=0 TSval=4294951175 TSecr=208514442"
"622","120.689349","10.10.10.176","52.29.29.242","TLSv1.2","192","Client Key Exchange, Change Cipher Spec, Encrypted Handshake Message"
"623","120.692251","52.29.29.242","10.10.10.176","TLSv1.2","292","New Session Ticket, Change Cipher Spec, Encrypted Handshake Message"
"624","120.694344","10.10.10.176","52.29.29.242","TCP","66","40246  >  443 [ACK] Seq=618 Ack=4046 Win=14048 Len=0 TSval=4294951194 TSecr=208514469"
"625","120.745926","10.10.10.176","52.29.29.242","TLSv1.2","549","Application Data"
"626","120.785644","52.29.29.242","10.10.10.176","TCP","66","443  >  40246 [ACK] Seq=4046 Ack=1101 Win=20224 Len=0 TSval=208514493 TSecr=4294951206"
"627","120.786920","10.10.10.176","52.29.29.242","TLSv1.2","602","Application Data"
"628","120.789357","52.29.29.242","10.10.10.176","TCP","66","443  >  40246 [ACK] Seq=4046 Ack=1637 Win=21248 Len=0 TSval=208514493 TSecr=4294951217"
"629","121.714227","52.29.29.242","10.10.10.176","TLSv1.2","649","Application Data"
"630","121.718200","10.10.10.176","52.29.29.242","TCP","66","40246  >  443 [ACK] Seq=1637 Ack=4629 Win=14048 Len=0 TSval=4294951449 TSecr=208514725"
"631","121.719720","10.10.10.176","52.29.29.242","TCP","66","40246  >  443 [FIN, ACK] Seq=1637 Ack=4629 Win=14048 Len=0 TSval=4294951450 TSecr=208514725"
"632","121.722006","52.29.29.242","10.10.10.176","TLSv1.2","97","Encrypted Alert"
"633","121.722037","52.29.29.242","10.10.10.176","TCP","66","443  >  40246 [FIN, ACK] Seq=4660 Ack=1638 Win=21248 Len=0 TSval=208514727 TSecr=4294951450"
"634","121.724242","10.10.10.176","52.29.29.242","TCP","54","40246  >  443 [RST] Seq=1638 Win=0 Len=0"
"635","121.724467","10.10.10.176","52.29.29.242","TCP","54","40246  >  443 [RST] Seq=1638 Win=0 Len=0"
"636","123.033460","52.28.131.102","10.10.10.176","TCP","54","[TCP Keep-Alive] 443  >  40851 [ACK] Seq=4005 Ack=631 Win=8192 Len=0"
"637","123.035077","10.10.10.176","52.28.131.102","TCP","54","[TCP Keep-Alive ACK] 40851  >  443 [ACK] Seq=631 Ack=4006 Win=11360 Len=0"
