"No.","Time","Source","Destination","Protocol","Length","Info"
"1","0.000000","EdimaxTe_4a:76:49","IntelCor_c3:41:78","EAPOL","135","Key (Message 2 of 4)"
"2","0.007349","EdimaxTe_4a:76:49","IntelCor_c3:41:78","EAPOL","113","Key (Message 4 of 4)"
"3","0.365177","0.0.0.0","255.255.255.255","DHCP","590","DHCP Discover - Transaction ID 0xd8c2c86f"
"4","0.389199","0.0.0.0","255.255.255.255","DHCP","590","DHCP Request  - Transaction ID 0xd8c2c86f"
"5","0.680792","EdimaxTe_4a:76:49","Broadcast","ARP","42","Who has 10.10.10.1? Tell 10.10.10.186"
"6","0.680814","DavidEle_06:08:ba","EdimaxTe_4a:76:49","ARP","42","10.10.10.1 is at 00:b5:6d:06:08:ba"
"7","0.683561","10.10.10.186","10.10.10.1","DNS","74","Standard query 0x0002 A www.google.com"
"8","0.683646","10.10.10.1","10.10.10.186","DNS","170","Standard query response 0x0002 A www.google.com A 74.125.136.104 A 74.125.136.103 A 74.125.136.99 A 74.125.136.147 A 74.125.136.106 A 74.125.136.105"
"9","0.686862","10.10.10.186","74.125.136.104","TCP","74","3754  >  80 [SYN] Seq=0 Win=5840 Len=0 MSS=1460 SACK_PERM=1 TSval=4294919592 TSecr=0 WS=2"
"10","0.698212","74.125.136.104","10.10.10.186","TCP","74","80  >  3754 [SYN, ACK] Seq=0 Ack=1 Win=42780 Len=0 MSS=1380 SACK_PERM=1 TSval=140945378 TSecr=4294919592 WS=128"
"11","0.702944","10.10.10.186","74.125.136.104","TCP","66","3754  >  80 [ACK] Seq=1 Ack=1 Win=5840 Len=0 TSval=4294919596 TSecr=140945378"
"12","0.702996","10.10.10.186","74.125.136.104","TCP","66","3754  >  80 [FIN, ACK] Seq=1 Ack=1 Win=5840 Len=0 TSval=4294919596 TSecr=140945378"
"13","0.714138","74.125.136.104","10.10.10.186","TCP","66","80  >  3754 [FIN, ACK] Seq=1 Ack=2 Win=42880 Len=0 TSval=140945394 TSecr=4294919596"
"14","0.716169","10.10.10.186","74.125.136.104","TCP","66","3754  >  80 [ACK] Seq=2 Ack=2 Win=5840 Len=0 TSval=4294919600 TSecr=140945394"
"15","5.687291","DavidEle_06:08:ba","EdimaxTe_4a:76:49","ARP","42","Who has 10.10.10.186? Tell 10.10.10.1"
"16","5.689883","EdimaxTe_4a:76:49","DavidEle_06:08:ba","ARP","42","10.10.10.186 is at 74:da:38:4a:76:49"
"17","19.068714","EdimaxTe_4a:76:49","Broadcast","XID","20","Basic Format; Type 1 LLC (Class I LLC); Window Size 0"
"18","19.076906","EdimaxTe_4a:76:49","IntelCor_c3:41:78","EAPOL","135","Key (Message 2 of 4)"
"19","19.081188","EdimaxTe_4a:76:49","IntelCor_c3:41:78","EAPOL","113","Key (Message 4 of 4)"
"20","19.284426","192.168.20.3","192.168.20.100","TCP","66","10000  >  51904 [FIN, ACK] Seq=1 Ack=1 Win=2896 Len=0 TSval=4294924223 TSecr=3844853"
"21","20.916475","192.168.20.3","192.168.20.100","TCP","66","[TCP Retransmission] 10000  >  51904 [FIN, ACK] Seq=1 Ack=1 Win=2896 Len=0 TSval=4294924631 TSecr=3844853"
"22","24.180506","192.168.20.3","192.168.20.100","TCP","66","[TCP Retransmission] 10000  >  51904 [FIN, ACK] Seq=1 Ack=1 Win=2896 Len=0 TSval=4294925447 TSecr=3844853"
"23","28.332765","10.10.10.186","10.10.10.1","DNS","74","Standard query 0x0003 A www.google.com"
"24","28.332841","10.10.10.1","10.10.10.186","DNS","170","Standard query response 0x0003 A www.google.com A 74.125.136.105 A 74.125.136.104 A 74.125.136.103 A 74.125.136.99 A 74.125.136.147 A 74.125.136.106"
"25","28.336690","10.10.10.186","74.125.136.105","TCP","74","4065  >  80 [SYN] Seq=0 Win=5840 Len=0 MSS=1460 SACK_PERM=1 TSval=4294926485 TSecr=0 WS=2"
"26","28.347857","74.125.136.105","10.10.10.186","TCP","74","80  >  4065 [SYN, ACK] Seq=0 Ack=1 Win=42780 Len=0 MSS=1380 SACK_PERM=1 TSval=3495374162 TSecr=4294926485 WS=128"
"27","28.351444","10.10.10.186","74.125.136.105","TCP","66","4065  >  80 [ACK] Seq=1 Ack=1 Win=5840 Len=0 TSval=4294926489 TSecr=3495374162"
"28","28.351767","10.10.10.186","74.125.136.105","TCP","66","4065  >  80 [FIN, ACK] Seq=1 Ack=1 Win=5840 Len=0 TSval=4294926489 TSecr=3495374162"
"29","28.362884","74.125.136.105","10.10.10.186","TCP","66","80  >  4065 [FIN, ACK] Seq=1 Ack=2 Win=42880 Len=0 TSval=3495374177 TSecr=4294926489"
"30","28.364658","10.10.10.186","74.125.136.105","TCP","66","4065  >  80 [ACK] Seq=2 Ack=2 Win=5840 Len=0 TSval=4294926493 TSecr=3495374177"
"31","28.742145","10.10.10.186","10.10.10.1","DNS","72","Standard query 0x0002 A pool.ntp.org"
"32","28.743535","10.10.10.1","10.10.10.186","DNS","542","Standard query response 0x0002 A pool.ntp.org A 5.100.133.221 A 87.118.124.35 A 109.239.48.152 A 217.79.181.50 NS i.ntpns.org NS d.ntpns.org NS f.ntpns.org NS h.ntpns.org NS c.ntpns.org NS e.ntpns.org NS a.ntpns.org NS b.ntpns.org NS g.ntpns.org A 207.171.17.42 AAAA 2620:101:d007::42 A 174.127.124.192 A 193.243.171.138 A 89.36.18.22 AAAA 2a00:14b0:4200:32e0::1e5 A 199.188.48.59 A 178.63.120.205 AAAA 2a01:4f8:121:43cd::3:1 A 46.234.32.107 A 173.255.139.202 AAAA 2001:4b20:0:ca01:5054:ff:fe6f:c4fb A 50.31.240.214"
"33","28.773592","10.10.10.186","5.100.133.221","NTP","90","NTP Version 3, client"
"34","28.798804","5.100.133.221","10.10.10.186","NTP","90","NTP Version 3, server"
"35","28.933622","10.10.10.186","10.10.10.1","DNS","76","Standard query 0x0002 A www.myedimax.com"
"36","29.113456","10.10.10.1","10.10.10.186","DNS","310","Standard query response 0x0002 A www.myedimax.com CNAME ns.myedimax.com A 122.248.252.67 NS ns-1845.awsdns-38.co.uk NS ns-1511.awsdns-60.org NS ns-589.awsdns-09.net NS ns-149.awsdns-18.com A 205.251.192.149 A 205.251.194.77 A 205.251.197.231 A 205.251.199.53"
"37","29.118129","10.10.10.186","255.255.255.255","UDP","100","58294  >  58294 Len=58"
"38","29.224613","10.10.10.186","255.255.255.255","UDP","100","58294  >  58294 Len=58"
"39","29.328581","10.10.10.186","255.255.255.255","UDP","100","58294  >  58294 Len=58"
"40","30.708552","192.168.20.3","192.168.20.100","TCP","66","[TCP Retransmission] 10000  >  51904 [FIN, ACK] Seq=1 Ack=1 Win=2896 Len=0 TSval=4294927079 TSecr=3844853"
"41","31.329253","10.10.10.186","122.248.252.67","UDP","78","58294  >  8765 Len=36"
"42","31.330290","10.10.10.186","122.248.252.67","UDP","399","58294  >  8765 Len=357"
"43","31.587450","122.248.252.67","10.10.10.186","UDP","127","8765  >  58294 Len=85"
"44","32.885554","EdimaxTe_4a:76:49","Broadcast","ARP","42","Who has 10.10.10.30? Tell 10.10.10.186"
"45","33.414987","122.248.252.67","10.10.10.186","UDP","664","8765  >  58294 Len=622"
"46","33.509330","10.10.10.186","122.248.252.67","UDP","421","58294  >  8765 Len=379"
"47","33.545088","10.10.10.186","122.248.252.67","UDP","421","58294  >  8765 Len=379"
"48","33.589498","10.10.10.186","122.248.252.67","UDP","421","58294  >  8765 Len=379"
"49","33.624691","10.10.10.186","122.248.252.67","UDP","421","58294  >  8765 Len=379"
"50","33.660657","10.10.10.186","122.248.252.67","UDP","421","58294  >  8765 Len=379"
"51","33.699314","10.10.10.186","54.217.230.12","TCP","74","3299  >  8767 [SYN] Seq=0 Win=5840 Len=0 MSS=1460 SACK_PERM=1 TSval=4294927826 TSecr=0 WS=2"
"52","33.702118","10.10.10.186","255.255.255.255","UDP","100","52608  >  52608 Len=58"
"53","33.723342","54.217.230.12","10.10.10.186","TCP","74","8767  >  3299 [SYN, ACK] Seq=0 Ack=1 Win=28960 Len=0 MSS=1380 SACK_PERM=1 TSval=1978709044 TSecr=4294927826 WS=128"
"54","33.724386","10.10.10.186","54.217.230.12","TCP","66","3299  >  8767 [ACK] Seq=1 Ack=1 Win=5840 Len=0 TSval=4294927832 TSecr=1978709044"
"55","33.725504","10.10.10.186","54.217.230.12","TCP","113","3299  >  8767 [PSH, ACK] Seq=1 Ack=1 Win=5840 Len=47 TSval=4294927833 TSecr=1978709044"
"56","33.749128","54.217.230.12","10.10.10.186","TCP","66","8767  >  3299 [ACK] Seq=1 Ack=48 Win=29056 Len=0 TSval=1978709051 TSecr=4294927833"
"57","33.808647","10.10.10.186","255.255.255.255","UDP","100","52608  >  52608 Len=58"
"58","33.912629","10.10.10.186","255.255.255.255","UDP","100","52608  >  52608 Len=58"
"59","35.162548","54.217.230.12","10.10.10.186","TCP","297","8767  >  3299 [PSH, ACK] Seq=1 Ack=48 Win=29056 Len=231 TSval=1978709404 TSecr=4294927833"
"60","35.165044","10.10.10.186","54.217.230.12","TCP","66","3299  >  8767 [ACK] Seq=48 Ack=232 Win=5840 Len=0 TSval=4294928193 TSecr=1978709404"
"61","35.205404","10.10.10.186","54.217.230.12","TCP","494","3299  >  8767 [PSH, ACK] Seq=48 Ack=232 Win=5840 Len=428 TSval=4294928203 TSecr=1978709404"
"62","35.231465","54.217.230.12","10.10.10.186","TCP","66","8767  >  3299 [ACK] Seq=232 Ack=476 Win=30080 Len=0 TSval=1978709421 TSecr=4294928203"
"63","35.315417","54.217.230.12","10.10.10.186","TCP","66","8767  >  3299 [FIN, ACK] Seq=232 Ack=476 Win=30080 Len=0 TSval=1978709442 TSecr=4294928203"
"64","35.316715","10.10.10.186","54.217.230.12","TCP","66","3299  >  8767 [FIN, ACK] Seq=476 Ack=233 Win=5840 Len=0 TSval=4294928231 TSecr=1978709442"
"65","35.342386","54.217.230.12","10.10.10.186","TCP","66","8767  >  3299 [ACK] Seq=233 Ack=477 Win=30080 Len=0 TSval=1978709449 TSecr=4294928231"
"66","35.913510","10.10.10.186","122.248.252.67","UDP","399","52608  >  8765 Len=357"
"67","36.191025","122.248.252.67","10.10.10.186","UDP","127","8765  >  52608 Len=85"
"68","43.767402","192.168.20.3","192.168.20.100","TCP","66","[TCP Retransmission] 10000  >  51904 [FIN, ACK] Seq=1 Ack=1 Win=2896 Len=0 TSval=4294930343 TSecr=3844853"
"69","56.192822","10.10.10.186","122.248.252.67","UDP","46","52608  >  8765 Len=4"
"70","65.568942","122.248.252.67","10.10.10.186","UDP","664","8765  >  52608 Len=622"
"71","65.651597","10.10.10.186","122.248.252.67","UDP","421","52608  >  8765 Len=379"
"72","65.684974","10.10.10.186","122.248.252.67","UDP","421","52608  >  8765 Len=379"
"73","65.721212","10.10.10.186","122.248.252.67","UDP","421","52608  >  8765 Len=379"
"74","65.756934","10.10.10.186","122.248.252.67","UDP","421","52608  >  8765 Len=379"
"75","65.792947","10.10.10.186","122.248.252.67","UDP","421","52608  >  8765 Len=379"
"76","65.831433","10.10.10.186","54.217.230.12","TCP","74","3301  >  8767 [SYN] Seq=0 Win=5840 Len=0 MSS=1460 SACK_PERM=1 TSval=4294935859 TSecr=0 WS=2"
"77","65.834023","10.10.10.186","255.255.255.255","UDP","100","28893  >  28893 Len=58"
"78","65.855564","54.217.230.12","10.10.10.186","TCP","74","8767  >  3301 [SYN, ACK] Seq=0 Ack=1 Win=28960 Len=0 MSS=1380 SACK_PERM=1 TSval=1978717077 TSecr=4294935859 WS=128"
"79","65.857356","10.10.10.186","54.217.230.12","TCP","66","3301  >  8767 [ACK] Seq=1 Ack=1 Win=5840 Len=0 TSval=4294935866 TSecr=1978717077"
"80","65.858398","10.10.10.186","54.217.230.12","TCP","113","3301  >  8767 [PSH, ACK] Seq=1 Ack=1 Win=5840 Len=47 TSval=4294935866 TSecr=1978717077"
"81","65.882407","54.217.230.12","10.10.10.186","TCP","66","8767  >  3301 [ACK] Seq=1 Ack=48 Win=29056 Len=0 TSval=1978717084 TSecr=4294935866"
"82","65.940939","10.10.10.186","255.255.255.255","UDP","100","28893  >  28893 Len=58"
"83","66.044928","10.10.10.186","255.255.255.255","UDP","100","28893  >  28893 Len=58"
"84","66.105893","54.217.230.12","10.10.10.186","TCP","297","8767  >  3301 [PSH, ACK] Seq=1 Ack=48 Win=29056 Len=231 TSval=1978717140 TSecr=4294935866"
"85","66.110948","10.10.10.186","54.217.230.12","TCP","66","3301  >  8767 [ACK] Seq=48 Ack=232 Win=5840 Len=0 TSval=4294935929 TSecr=1978717140"
"86","66.150633","10.10.10.186","54.217.230.12","TCP","494","3301  >  8767 [PSH, ACK] Seq=48 Ack=232 Win=5840 Len=428 TSval=4294935939 TSecr=1978717140"
"87","66.174709","54.217.230.12","10.10.10.186","TCP","66","8767  >  3301 [ACK] Seq=232 Ack=476 Win=30080 Len=0 TSval=1978717157 TSecr=4294935939"
"88","66.267596","54.217.230.12","10.10.10.186","TCP","66","8767  >  3301 [FIN, ACK] Seq=232 Ack=476 Win=30080 Len=0 TSval=1978717180 TSecr=4294935939"
"89","66.269680","10.10.10.186","54.217.230.12","TCP","66","3301  >  8767 [FIN, ACK] Seq=476 Ack=233 Win=5840 Len=0 TSval=4294935969 TSecr=1978717180"
"90","66.293739","54.217.230.12","10.10.10.186","TCP","66","8767  >  3301 [ACK] Seq=233 Ack=477 Win=30080 Len=0 TSval=1978717187 TSecr=4294935969"
"91","68.045815","10.10.10.186","122.248.252.67","UDP","399","28893  >  8765 Len=357"
"92","68.320407","122.248.252.67","10.10.10.186","UDP","127","8765  >  28893 Len=85"
