"No.","Time","Source","Destination","Protocol","Length","Info"
"1","0.000000","EdimaxTe_23:22:7b","IntelCor_c3:41:78","EAPOL","135","Key (Message 2 of 4)"
"2","0.004213","EdimaxTe_23:22:7b","IntelCor_c3:41:78","EAPOL","113","Key (Message 4 of 4)"
"3","0.522009","0.0.0.0","255.255.255.255","DHCP","590","DHCP Discover - Transaction ID 0x27459d5a"
"4","3.541658","0.0.0.0","255.255.255.255","DHCP","590","DHCP Request  - Transaction ID 0x27459d5a"
"5","3.817258","EdimaxTe_23:22:7b","Broadcast","ARP","42","Who has 10.10.10.1? Tell 10.10.10.232"
"6","3.817276","DavidEle_06:08:ba","EdimaxTe_23:22:7b","ARP","42","10.10.10.1 is at 00:b5:6d:06:08:ba"
"7","3.820592","10.10.10.232","10.10.10.1","DNS","74","Standard query 0x0002 A www.google.com"
"8","3.820686","10.10.10.1","10.10.10.232","DNS","170","Standard query response 0x0002 A www.google.com A 74.125.136.106 A 74.125.136.105 A 74.125.136.104 A 74.125.136.103 A 74.125.136.99 A 74.125.136.147"
"9","3.823984","10.10.10.232","74.125.136.106","TCP","74","4662  >  80 [SYN] Seq=0 Win=5840 Len=0 MSS=1460 SACK_PERM=1 TSval=4294962774 TSecr=0 WS=2"
"10","3.835637","74.125.136.106","10.10.10.232","TCP","74","80  >  4662 [SYN, ACK] Seq=0 Ack=1 Win=42780 Len=0 MSS=1380 SACK_PERM=1 TSval=3512540167 TSecr=4294962774 WS=128"
"11","3.837503","10.10.10.232","74.125.136.106","TCP","66","4662  >  80 [ACK] Seq=1 Ack=1 Win=5840 Len=0 TSval=4294962778 TSecr=3512540167"
"12","3.837882","10.10.10.232","74.125.136.106","TCP","66","4662  >  80 [FIN, ACK] Seq=1 Ack=1 Win=5840 Len=0 TSval=4294962778 TSecr=3512540167"
"13","3.848875","74.125.136.106","10.10.10.232","TCP","66","80  >  4662 [FIN, ACK] Seq=1 Ack=2 Win=42880 Len=0 TSval=3512540181 TSecr=4294962778"
"14","3.852037","10.10.10.232","74.125.136.106","TCP","66","4662  >  80 [ACK] Seq=2 Ack=2 Win=5840 Len=0 TSval=4294962781 TSecr=3512540181"
"15","8.825857","DavidEle_06:08:ba","EdimaxTe_23:22:7b","ARP","42","Who has 10.10.10.232? Tell 10.10.10.1"
"16","8.828544","EdimaxTe_23:22:7b","DavidEle_06:08:ba","ARP","42","10.10.10.232 is at 74:da:38:23:22:7b"
"17","19.967419","EdimaxTe_23:22:7b","Broadcast","XID","20","Basic Format; Type 1 LLC (Class I LLC); Window Size 0"
"18","19.974488","EdimaxTe_23:22:7b","IntelCor_c3:41:78","EAPOL","135","Key (Message 2 of 4)"
"19","19.978714","EdimaxTe_23:22:7b","IntelCor_c3:41:78","EAPOL","113","Key (Message 4 of 4)"
"20","20.253912","192.168.20.3","192.168.20.100","TCP","66","10000  >  48769 [FIN, ACK] Seq=1 Ack=1 Win=2896 Len=0 TSval=4294966863 TSecr=5111247"
"21","21.917940","192.168.20.3","192.168.20.100","TCP","66","[TCP Retransmission] 10000  >  48769 [FIN, ACK] Seq=1 Ack=1 Win=2896 Len=0 TSval=4294967279 TSecr=5111247"
"22","24.726967","EdimaxTe_23:22:7b","DavidEle_06:08:ba","ARP","42","Who has 10.10.10.1? Tell 10.10.10.232"
"23","24.726982","DavidEle_06:08:ba","EdimaxTe_23:22:7b","ARP","42","10.10.10.1 is at 00:b5:6d:06:08:ba"
"24","25.246188","192.168.20.3","192.168.20.100","TCP","66","[TCP Retransmission] 10000  >  48769 [FIN, ACK] Seq=1 Ack=1 Win=2896 Len=0 TSval=815 TSecr=5111247"
"25","29.298520","10.10.10.232","10.10.10.1","DNS","74","Standard query 0x0003 A www.google.com"
"26","29.298605","10.10.10.1","10.10.10.232","DNS","170","Standard query response 0x0003 A www.google.com A 74.125.136.147 A 74.125.136.106 A 74.125.136.105 A 74.125.136.104 A 74.125.136.103 A 74.125.136.99"
"27","29.302903","10.10.10.232","74.125.136.147","TCP","74","3156  >  80 [SYN] Seq=0 Win=5840 Len=0 MSS=1460 SACK_PERM=1 TSval=1829 TSecr=0 WS=2"
"28","29.314501","74.125.136.147","10.10.10.232","TCP","74","80  >  3156 [SYN, ACK] Seq=0 Ack=1 Win=42780 Len=0 MSS=1380 SACK_PERM=1 TSval=3614983401 TSecr=1829 WS=128"
"29","29.316575","10.10.10.232","74.125.136.147","TCP","66","3156  >  80 [ACK] Seq=1 Ack=1 Win=5840 Len=0 TSval=1832 TSecr=3614983401"
"30","29.316957","10.10.10.232","74.125.136.147","TCP","66","3156  >  80 [FIN, ACK] Seq=1 Ack=1 Win=5840 Len=0 TSval=1832 TSecr=3614983401"
"31","29.328486","74.125.136.147","10.10.10.232","TCP","66","80  >  3156 [FIN, ACK] Seq=1 Ack=2 Win=42880 Len=0 TSval=3614983415 TSecr=1832"
"32","29.330505","10.10.10.232","74.125.136.147","TCP","66","3156  >  80 [ACK] Seq=2 Ack=2 Win=5840 Len=0 TSval=1836 TSecr=3614983415"
"33","29.719916","10.10.10.232","10.10.10.1","DNS","72","Standard query 0x0002 A pool.ntp.org"
"34","29.721553","10.10.10.1","10.10.10.232","DNS","542","Standard query response 0x0002 A pool.ntp.org A 88.80.200.36 A 88.198.35.53 A 46.101.154.113 A 78.46.204.247 NS f.ntpns.org NS g.ntpns.org NS b.ntpns.org NS a.ntpns.org NS e.ntpns.org NS c.ntpns.org NS d.ntpns.org NS i.ntpns.org NS h.ntpns.org A 207.171.17.42 AAAA 2620:101:d007::42 A 174.127.124.192 A 193.243.171.138 A 89.36.18.22 AAAA 2a00:14b0:4200:32e0::1e5 A 178.63.120.205 A 199.188.48.59 AAAA 2a01:4f8:121:43cd::3:1 A 46.234.32.107 A 173.255.139.202 AAAA 2001:4b20:0:ca01:5054:ff:fe6f:c4fb A 50.31.240.214"
"35","29.751828","10.10.10.232","88.80.200.36","NTP","90","NTP Version 3, client"
"36","29.757018","88.80.200.36","10.10.10.232","NTP","90","NTP Version 3, server"
"37","29.969290","10.10.10.232","10.10.10.1","DNS","76","Standard query 0x0002 A www.myedimax.com"
"38","29.970938","10.10.10.1","10.10.10.232","DNS","310","Standard query response 0x0002 A www.myedimax.com CNAME ns.myedimax.com A 122.248.252.67 NS ns-149.awsdns-18.com NS ns-589.awsdns-09.net NS ns-1511.awsdns-60.org NS ns-1845.awsdns-38.co.uk A 205.251.192.149 A 205.251.194.77 A 205.251.197.231 A 205.251.199.53"
"39","30.063355","10.10.10.232","255.255.255.255","UDP","100","60919  >  60919 Len=58"
"40","30.185133","10.10.10.232","255.255.255.255","UDP","100","60919  >  60919 Len=58"
"41","30.290355","10.10.10.232","255.255.255.255","UDP","100","60919  >  60919 Len=58"
"42","31.902313","192.168.20.3","192.168.20.100","TCP","66","[TCP Retransmission] 10000  >  48769 [FIN, ACK] Seq=1 Ack=1 Win=2896 Len=0 TSval=2479 TSecr=5111247"
"43","32.291009","10.10.10.232","122.248.252.67","UDP","78","60919  >  8765 Len=36"
"44","32.292506","10.10.10.232","122.248.252.67","UDP","399","60919  >  8765 Len=357"
"45","32.563144","122.248.252.67","10.10.10.232","UDP","127","8765  >  60919 Len=85"
"46","45.214442","192.168.20.3","192.168.20.100","TCP","66","[TCP Retransmission] 10000  >  48769 [FIN, ACK] Seq=1 Ack=1 Win=2896 Len=0 TSval=5807 TSecr=5111247"
"47","50.215184","EdimaxTe_23:22:7b","DavidEle_06:08:ba","ARP","42","Who has 10.10.10.1? Tell 10.10.10.232"
"48","50.215201","DavidEle_06:08:ba","EdimaxTe_23:22:7b","ARP","42","10.10.10.1 is at 00:b5:6d:06:08:ba"
"49","52.562552","10.10.10.232","122.248.252.67","UDP","46","60919  >  8765 Len=4"
"50","71.838683","192.168.20.3","192.168.20.100","TCP","66","[TCP Retransmission] 10000  >  48769 [FIN, ACK] Seq=1 Ack=1 Win=2896 Len=0 TSval=12463 TSecr=5111247"
"51","72.562744","10.10.10.232","122.248.252.67","UDP","46","60919  >  8765 Len=4"
"52","76.839456","EdimaxTe_23:22:7b","DavidEle_06:08:ba","ARP","42","Who has 10.10.10.1? Tell 10.10.10.232"
"53","76.839489","DavidEle_06:08:ba","EdimaxTe_23:22:7b","ARP","42","10.10.10.1 is at 00:b5:6d:06:08:ba"
"54","89.855595","EdimaxTe_23:22:7b","Broadcast","ARP","42","Who has 10.10.10.30? Tell 10.10.10.232"
"55","90.186578","10.10.10.232","10.10.10.1","DNS","74","Standard query 0x0002 A www.google.com"
"56","90.186661","10.10.10.1","10.10.10.232","DNS","170","Standard query response 0x0002 A www.google.com A 74.125.136.99 A 74.125.136.147 A 74.125.136.106 A 74.125.136.105 A 74.125.136.104 A 74.125.136.103"
"57","90.190152","10.10.10.232","74.125.136.99","TCP","74","4717  >  80 [SYN] Seq=0 Win=5840 Len=0 MSS=1460 SACK_PERM=1 TSval=17050 TSecr=0 WS=2"
"58","90.201157","74.125.136.99","10.10.10.232","TCP","74","80  >  4717 [SYN, ACK] Seq=0 Ack=1 Win=42780 Len=0 MSS=1380 SACK_PERM=1 TSval=3557303586 TSecr=17050 WS=128"
"59","90.202724","10.10.10.232","74.125.136.99","TCP","66","4717  >  80 [ACK] Seq=1 Ack=1 Win=5840 Len=0 TSval=17054 TSecr=3557303586"
"60","90.203245","10.10.10.232","74.125.136.99","TCP","66","4717  >  80 [FIN, ACK] Seq=1 Ack=1 Win=5840 Len=0 TSval=17054 TSecr=3557303586"
"61","90.214018","74.125.136.99","10.10.10.232","TCP","66","80  >  4717 [FIN, ACK] Seq=1 Ack=2 Win=42880 Len=0 TSval=3557303599 TSecr=17054"
"62","90.215572","10.10.10.232","74.125.136.99","TCP","66","4717  >  80 [ACK] Seq=2 Ack=2 Win=5840 Len=0 TSval=17057 TSecr=3557303599"
"63","92.563667","10.10.10.232","122.248.252.67","UDP","46","60919  >  8765 Len=4"
"64","95.193832","DavidEle_06:08:ba","EdimaxTe_23:22:7b","ARP","42","Who has 10.10.10.232? Tell 10.10.10.1"
"65","95.196052","EdimaxTe_23:22:7b","DavidEle_06:08:ba","ARP","42","10.10.10.232 is at 74:da:38:23:22:7b"
