"No.","Time","Source","Destination","Protocol","Length","Info"
"1","0.000000","Hi-Flyin_62:3c:6e","IntelCor_c3:41:78","EAPOL","135","Key (Message 2 of 4)"
"2","0.145557","Hi-Flyin_62:3c:6e","IntelCor_c3:41:78","EAPOL","113","Key (Message 4 of 4)"
"3","0.335933","0.0.0.0","255.255.255.255","DHCP","350","DHCP Discover - Transaction ID 0xabcd0001"
"4","0.336080","10.10.10.1","10.10.10.149","DHCP","342","DHCP Offer    - Transaction ID 0xabcd0001"
"5","0.343403","Hi-Flyin_62:3c:6e","IntelCor_c3:41:78","EAPOL","113","Key (Message 4 of 4)"
"6","0.363840","0.0.0.0","255.255.255.255","DHCP","350","DHCP Request  - Transaction ID 0xabcd0002"
"7","0.439695","10.10.10.1","10.10.10.149","DHCP","342","DHCP ACK      - Transaction ID 0xabcd0002"
"8","0.514975","Hi-Flyin_62:3c:6e","Broadcast","ARP","42","Who has 10.10.10.149? Tell 0.0.0.0"
"9","0.734453","Hi-Flyin_62:3c:6e","Broadcast","ARP","42","Who has 10.10.10.149? Tell 0.0.0.0"
"10","1.138814","10.10.10.149","255.255.255.255","UDP","67","48899  >  49999 Len=25"
"11","1.153169","10.10.10.149","255.255.255.255","UDP","67","48899  >  49999 Len=25"
"12","1.516878","Hi-Flyin_62:3c:6e","Broadcast","ARP","42","Who has 10.10.10.30? Tell 10.10.10.149"
"13","1.588569","10.10.10.149","255.255.255.255","UDP","67","48899  >  49999 Len=25"
"14","1.595662","10.10.10.149","255.255.255.255","UDP","67","48899  >  49999 Len=25"
"15","2.031154","10.10.10.149","255.255.255.255","UDP","67","48899  >  49999 Len=25"
"16","2.045788","10.10.10.149","255.255.255.255","UDP","67","48899  >  49999 Len=25"
"17","2.480919","10.10.10.149","255.255.255.255","UDP","67","48899  >  49999 Len=25"
"18","2.495734","10.10.10.149","255.255.255.255","UDP","67","48899  >  49999 Len=25"
"19","2.502872","Hi-Flyin_62:3c:6e","Broadcast","ARP","42","Who has 10.10.10.1? Tell 10.10.10.149"
"20","2.502891","DavidEle_06:08:ba","Hi-Flyin_62:3c:6e","ARP","42","10.10.10.1 is at 00:b5:6d:06:08:ba"
"21","2.517771","10.10.10.149","10.10.100.254","NTP","90","NTP Version 3, client"
"22","2.598381","10.10.10.149","10.10.10.1","DNS","77","Standard query 0x0000 A icomen.yunext.com"
"23","2.598464","10.10.10.1","10.10.10.149","DNS","93","Standard query response 0x0000 A icomen.yunext.com A 52.10.39.38"
"24","2.604402","10.10.10.149","10.10.10.1","DNS","74","Standard query 0x0001 A 0.pool.ntp.org"
"25","2.604481","10.10.10.1","10.10.10.149","DNS","138","Standard query response 0x0001 A 0.pool.ntp.org A 211.233.84.186 A 200.192.232.8 A 178.17.160.12 A 217.114.59.66"
"26","2.607324","10.10.10.149","52.10.39.38","TCP","58","12679  >  7531 [SYN] Seq=0 Win=1500 Len=0 MSS=1400"
"27","2.612826","10.10.10.149","10.10.10.1","DNS","75","Standard query 0x0002 A ntp.sjtu.edu.cn"
"28","2.612906","10.10.10.1","10.10.10.149","DNS","91","Standard query response 0x0002 A ntp.sjtu.edu.cn A 202.120.2.100"
"29","2.772438","52.10.39.38","10.10.10.149","TCP","58","7531  >  12679 [SYN, ACK] Seq=0 Ack=1 Win=2048 Len=0 MSS=1380"
"30","2.779614","10.10.10.149","52.10.39.38","TCP","54","12679  >  7531 [ACK] Seq=1 Ack=1 Win=1500 Len=0"
"31","2.786598","10.10.10.149","52.10.39.38","TCP","79","12679  >  7531 [PSH, ACK] Seq=1 Ack=1 Win=1500 Len=25"
"32","2.951406","52.10.39.38","10.10.10.149","TCP","54","7531  >  12679 [ACK] Seq=1 Ack=26 Win=2048 Len=0"
"33","2.951892","52.10.39.38","10.10.10.149","TCP","79","7531  >  12679 [PSH, ACK] Seq=1 Ack=26 Win=2048 Len=25"
"34","3.066155","10.10.10.149","52.10.39.38","TCP","54","12679  >  7531 [ACK] Seq=26 Ack=26 Win=1475 Len=0"
"35","3.510013","10.10.10.149","52.10.39.38","TCP","54","12679  >  7531 [FIN, ACK] Seq=26 Ack=26 Win=1475 Len=0"
"36","3.513743","10.10.10.149","211.233.84.186","NTP","90","NTP Version 4, client"
"37","3.546188","10.10.10.149","52.24.113.48","TCP","58","11178  >  7533 [SYN] Seq=0 Win=1500 Len=0 MSS=1400"
"38","3.674867","52.10.39.38","10.10.10.149","TCP","54","7531  >  12679 [FIN, ACK] Seq=26 Ack=27 Win=2048 Len=0"
"39","3.679660","10.10.10.149","52.10.39.38","TCP","54","12679  >  7531 [ACK] Seq=27 Ack=27 Win=1474 Len=0"
"40","3.720042","52.24.113.48","10.10.10.149","TCP","58","7533  >  11178 [SYN, ACK] Seq=0 Ack=1 Win=2048 Len=0 MSS=1380"
"41","3.723001","10.10.10.149","52.24.113.48","TCP","54","11178  >  7533 [ACK] Seq=1 Ack=1 Win=1500 Len=0"
"42","3.730174","10.10.10.149","52.24.113.48","TCP","79","11178  >  7533 [PSH, ACK] Seq=1 Ack=1 Win=1500 Len=25"
"43","3.806275","211.233.84.186","10.10.10.149","NTP","90","NTP Version 4, server"
"44","3.903767","52.24.113.48","10.10.10.149","TCP","54","7533  >  11178 [ACK] Seq=1 Ack=26 Win=2048 Len=0"
"45","3.906673","52.24.113.48","10.10.10.149","TCP","95","7533  >  11178 [PSH, ACK] Seq=1 Ack=26 Win=2048 Len=41"
"46","3.906718","52.24.113.48","10.10.10.149","TCP","79","7533  >  11178 [PSH, ACK] Seq=42 Ack=26 Win=2048 Len=25"
"47","3.929115","10.10.10.149","52.24.113.48","TCP","79","11178  >  7533 [PSH, ACK] Seq=26 Ack=42 Win=1459 Len=25"
"48","4.081896","52.24.113.48","10.10.10.149","TCP","79","7533  >  11178 [PSH, ACK] Seq=67 Ack=26 Win=2048 Len=25"
"49","4.082461","52.24.113.48","10.10.10.149","TCP","79","7533  >  11178 [PSH, ACK] Seq=92 Ack=26 Win=2048 Len=25"
"50","4.102806","52.24.113.48","10.10.10.149","TCP","79","7533  >  11178 [PSH, ACK] Seq=117 Ack=51 Win=2048 Len=25"
"51","4.108268","10.10.10.149","52.24.113.48","TCP","161","11178  >  7533 [PSH, ACK] Seq=51 Ack=142 Win=1359 Len=107"
"52","4.319985","52.24.113.48","10.10.10.149","TCP","54","7533  >  11178 [ACK] Seq=142 Ack=158 Win=2048 Len=0"
"53","5.515153","10.10.10.1","10.10.10.149","ICMP","118","Destination unreachable (Host unreachable)"
"54","7.599082","DavidEle_06:08:ba","Hi-Flyin_62:3c:6e","ARP","42","Who has 10.10.10.149? Tell 10.10.10.1"
"55","7.625578","Hi-Flyin_62:3c:6e","DavidEle_06:08:ba","ARP","42","10.10.10.149 is at ac:cf:23:62:3c:6e"
"56","9.073033","52.24.113.48","10.10.10.149","TCP","54","7533  >  9013 [FIN, ACK] Seq=1 Ack=1 Win=2048 Len=0"
"57","9.099404","10.10.10.149","52.24.113.48","TCP","54","9013  >  7533 [RST, ACK] Seq=1 Ack=2 Win=1500 Len=0"
"58","28.237178","10.10.10.149","10.10.100.254","NTP","90","NTP Version 3, client"
"59","28.237213","10.10.10.1","10.10.10.149","ICMP","118","Redirect             (Redirect for host)"
"60","29.747862","10.10.10.149","52.24.113.48","TCP","79","11178  >  7533 [PSH, ACK] Seq=158 Ack=142 Win=1359 Len=25"
"61","29.921528","52.24.113.48","10.10.10.149","TCP","54","7533  >  11178 [ACK] Seq=142 Ack=183 Win=2048 Len=0"
"62","29.921552","52.24.113.48","10.10.10.149","TCP","79","7533  >  11178 [PSH, ACK] Seq=142 Ack=183 Win=2048 Len=25"
"63","30.088048","10.10.10.149","52.24.113.48","TCP","54","11178  >  7533 [ACK] Seq=183 Ack=167 Win=1334 Len=0"
"64","31.235119","10.10.10.1","10.10.10.149","ICMP","118","Destination unreachable (Host unreachable)"
"65","53.828337","10.10.10.149","10.10.100.254","NTP","90","NTP Version 3, client"
"66","53.828372","10.10.10.1","10.10.10.149","ICMP","118","Redirect             (Redirect for host)"
"67","56.827086","10.10.10.1","10.10.10.149","ICMP","118","Destination unreachable (Host unreachable)"
"68","58.831083","DavidEle_06:08:ba","Hi-Flyin_62:3c:6e","ARP","42","Who has 10.10.10.149? Tell 10.10.10.1"
"69","58.882681","Hi-Flyin_62:3c:6e","DavidEle_06:08:ba","ARP","42","10.10.10.149 is at ac:cf:23:62:3c:6e"
"70","59.671121","10.10.10.149","52.24.113.48","TCP","79","11178  >  7533 [PSH, ACK] Seq=183 Ack=167 Win=1334 Len=25"
