"No.","Time","Source","Destination","Protocol","Length","Info"
"1","0.000000","81.14.202.72","10.10.10.89","TCP","54","9292  >  50756 [ACK] Seq=1 Ack=1 Win=15544 Len=0"
"2","3.578420","DavidEle_06:08:ba","Eq-3Entw_05:c4:2e","ARP","42","Who has 10.10.10.89? Tell 10.10.10.1"
"3","3.578672","Eq-3Entw_05:c4:2e","DavidEle_06:08:ba","ARP","60","10.10.10.89 is at 00:1a:22:05:c4:2e"
"4","10.123755","10.10.10.89","81.14.202.72","TCP","134","50756  >  9292 [PSH, ACK] Seq=1 Ack=1 Win=4380 Len=80"
"5","10.142377","81.14.202.72","10.10.10.89","TCP","54","9292  >  50756 [ACK] Seq=1 Ack=81 Win=15544 Len=0"
"6","13.658000","81.14.202.72","10.10.10.89","TCP","80","9292  >  50756 [PSH, ACK] Seq=1 Ack=81 Win=15544 Len=26"
"7","13.669291","10.10.10.89","81.14.202.72","TCP","60","50756  >  9292 [ACK] Seq=81 Ack=27 Win=4354 Len=0"
"8","13.730174","10.10.10.89","81.14.202.72","TCP","60","[TCP Window Update] 50756  >  9292 [ACK] Seq=81 Ack=27 Win=4380 Len=0"
"9","13.856833","10.10.10.89","81.14.202.72","TCP","86","50756  >  9292 [PSH, ACK] Seq=81 Ack=27 Win=4380 Len=32"
"10","13.875380","81.14.202.72","10.10.10.89","TCP","54","9292  >  50756 [ACK] Seq=27 Ack=113 Win=15544 Len=0"
"11","20.201104","10.10.10.89","81.14.202.72","TCP","134","50756  >  9292 [PSH, ACK] Seq=113 Ack=27 Win=4380 Len=80"
"12","20.219724","81.14.202.72","10.10.10.89","TCP","54","9292  >  50756 [ACK] Seq=27 Ack=193 Win=15544 Len=0"
"13","25.226402","DavidEle_06:08:ba","Eq-3Entw_05:c4:2e","ARP","42","Who has 10.10.10.89? Tell 10.10.10.1"
"14","25.226630","Eq-3Entw_05:c4:2e","DavidEle_06:08:ba","ARP","60","10.10.10.89 is at 00:1a:22:05:c4:2e"
"15","30.089507","10.10.10.89","81.14.202.72","TCP","134","50756  >  9292 [PSH, ACK] Seq=193 Ack=27 Win=4380 Len=80"
"16","30.108371","81.14.202.72","10.10.10.89","TCP","54","9292  >  50756 [ACK] Seq=27 Ack=273 Win=15544 Len=0"
"17","30.108936","81.14.202.72","10.10.10.89","TCP","104","9292  >  50756 [PSH, ACK] Seq=27 Ack=273 Win=15544 Len=50"
"18","30.123976","10.10.10.89","81.14.202.72","TCP","60","50756  >  9292 [ACK] Seq=273 Ack=77 Win=4330 Len=0"
"19","30.176271","10.10.10.89","81.14.202.72","TCP","60","[TCP Window Update] 50756  >  9292 [ACK] Seq=273 Ack=77 Win=4380 Len=0"
"20","30.213054","10.10.10.89","81.14.202.72","TCP","121","50756  >  9292 [PSH, ACK] Seq=273 Ack=77 Win=4380 Len=67"
"21","30.254192","81.14.202.72","10.10.10.89","TCP","87","9292  >  50756 [PSH, ACK] Seq=77 Ack=340 Win=15544 Len=33"
"22","30.265512","10.10.10.89","81.14.202.72","TCP","60","50756  >  9292 [ACK] Seq=340 Ack=110 Win=4347 Len=0"
"23","30.310127","10.10.10.89","81.14.202.72","TCP","60","[TCP Window Update] 50756  >  9292 [ACK] Seq=340 Ack=110 Win=4380 Len=0"
"24","30.384377","10.10.10.89","81.14.202.72","TCP","85","50756  >  9292 [PSH, ACK] Seq=340 Ack=110 Win=4380 Len=31"
"25","30.403358","81.14.202.72","10.10.10.89","TCP","135","9292  >  50756 [PSH, ACK] Seq=110 Ack=371 Win=15544 Len=81"
"26","30.418862","10.10.10.89","81.14.202.72","TCP","60","50756  >  9292 [ACK] Seq=371 Ack=191 Win=4299 Len=0"
"27","30.463375","10.10.10.89","81.14.202.72","TCP","60","[TCP Window Update] 50756  >  9292 [ACK] Seq=371 Ack=191 Win=4380 Len=0"
"28","30.588021","10.10.10.89","81.14.202.72","TCP","85","50756  >  9292 [PSH, ACK] Seq=371 Ack=191 Win=4380 Len=31"
"29","30.647269","81.14.202.72","10.10.10.89","TCP","54","9292  >  50756 [ACK] Seq=191 Ack=402 Win=15544 Len=0"
"30","30.829265","10.10.10.89","81.14.202.72","TCP","103","50756  >  9292 [PSH, ACK] Seq=402 Ack=191 Win=4380 Len=49"
"31","30.847835","81.14.202.72","10.10.10.89","TCP","54","9292  >  50756 [ACK] Seq=191 Ack=451 Win=15544 Len=0"
"32","31.409348","10.10.10.89","81.14.202.72","TCP","112","50756  >  9292 [PSH, ACK] Seq=451 Ack=191 Win=4380 Len=58"
"33","31.428010","81.14.202.72","10.10.10.89","TCP","54","9292  >  50756 [ACK] Seq=191 Ack=509 Win=15544 Len=0"
"34","31.428616","81.14.202.72","10.10.10.89","TCP","93","9292  >  50756 [PSH, ACK] Seq=191 Ack=509 Win=15544 Len=39"
"35","31.443856","10.10.10.89","81.14.202.72","TCP","60","50756  >  9292 [ACK] Seq=509 Ack=230 Win=4341 Len=0"
"36","31.500210","10.10.10.89","81.14.202.72","TCP","60","[TCP Window Update] 50756  >  9292 [ACK] Seq=509 Ack=230 Win=4380 Len=0"
"37","31.596600","10.10.10.89","81.14.202.72","TCP","85","50756  >  9292 [PSH, ACK] Seq=509 Ack=230 Win=4380 Len=31"
"38","31.654321","81.14.202.72","10.10.10.89","TCP","54","9292  >  50756 [ACK] Seq=230 Ack=540 Win=15544 Len=0"
