"No.","Time","Source","Destination","Protocol","Length","Info"
"1","0.000000","::","ff02::16","ICMPv6","110","Multicast Listener Report Message v2"
"2","0.360087","::","ff02::16","ICMPv6","110","Multicast Listener Report Message v2"
"3","0.360074","0.0.0.0","224.0.0.22","IGMPv3","60","Membership Report / Join group 224.0.0.251 for any sources"
"4","0.524299","::","ff02::1:ff24:76ff","ICMPv6","78","Neighbor Solicitation for fe80::217:88ff:fe24:76ff"
"5","0.729966","0.0.0.0","224.0.0.22","IGMPv3","60","Membership Report / Join group 224.0.0.251 for any sources"
"6","1.199976","::","ff02::16","ICMPv6","90","Multicast Listener Report Message v2"
"7","1.574784","fe80::217:88ff:fe24:76ff","ff02::16","ICMPv6","150","Multicast Listener Report Message v2"
"8","1.590002","fe80::217:88ff:fe24:76ff","ff02::16","ICMPv6","90","Multicast Listener Report Message v2"
"9","1.869977","fe80::217:88ff:fe24:76ff","ff02::16","ICMPv6","90","Multicast Listener Report Message v2"
"10","1.970031","fe80::217:88ff:fe24:76ff","ff02::16","ICMPv6","150","Multicast Listener Report Message v2"
"11","1.981881","0.0.0.0","255.255.255.255","DHCP","412","DHCP Discover - Transaction ID 0x52e05922"
"12","1.982186","10.10.10.1","10.10.10.6","DHCP","342","DHCP Offer    - Transaction ID 0x52e05922"
"13","1.982606","PhilipsL_24:76:ff","Broadcast","ARP","60","Who has 10.10.10.6? Tell 0.0.0.0"
"14","1.983117","0.0.0.0","255.255.255.255","DHCP","418","DHCP Request  - Transaction ID 0x52e05922"
"15","1.989991","fe80::217:88ff:fe24:76ff","ff02::16","ICMPv6","170","Multicast Listener Report Message v2"
"16","2.057300","10.10.10.1","10.10.10.6","DHCP","351","DHCP ACK      - Transaction ID 0x52e05922"
"17","2.057731","PhilipsL_24:76:ff","Broadcast","ARP","60","Who has 10.10.10.1? Tell 0.0.0.0"
"18","2.057764","DavidEle_06:08:ba","PhilipsL_24:76:ff","ARP","42","10.10.10.1 is at 00:b5:6d:06:08:ba"
"19","2.058036","0.0.0.0","10.10.10.1","ICMP","379","Redirect             (Redirect for host)"
"20","2.240001","fe80::217:88ff:fe24:76ff","ff02::16","ICMPv6","90","Multicast Listener Report Message v2"
"21","2.410031","10.10.10.6","224.0.0.22","IGMPv3","60","Membership Report / Leave group 224.0.0.251"
"22","2.410032","fe80::217:88ff:fe24:76ff","ff02::16","ICMPv6","90","Multicast Listener Report Message v2"
"23","2.479977","fe80::217:88ff:fe24:76ff","ff02::16","ICMPv6","90","Multicast Listener Report Message v2"
"24","2.519956","fe80::217:88ff:fe24:76ff","ff02::16","ICMPv6","150","Multicast Listener Report Message v2"
"25","2.560025","::","ff02::1:ff00:1","ICMPv6","78","Neighbor Solicitation for fdd9:fbb:a067::1"
"26","2.979958","PhilipsL_24:76:ff","Broadcast","ARP","60","Gratuitous ARP for 10.10.10.6 (Request)"
"27","3.050006","10.10.10.6","224.0.0.22","IGMPv3","60","Membership Report / Leave group 224.0.0.251"
"28","3.410038","10.10.10.6","224.0.0.22","IGMPv3","60","Membership Report / Join group 224.0.0.251 for any sources"
"29","3.410040","fe80::217:88ff:fe24:76ff","ff02::16","ICMPv6","90","Multicast Listener Report Message v2"
"30","3.659974","10.10.10.6","224.0.0.22","IGMPv3","60","Membership Report / Join group 224.0.0.251 for any sources"
"31","3.939959","fe80::217:88ff:fe24:76ff","ff02::16","ICMPv6","90","Multicast Listener Report Message v2"
"32","3.979961","PhilipsL_24:76:ff","Broadcast","ARP","60","Gratuitous ARP for 10.10.10.6 (Request)"
"33","4.980091","10.10.10.6","10.10.10.1","ICMP","370","Destination unreachable (Host unreachable)"
"34","4.980092","10.10.10.6","10.10.10.1","ICMP","379","Destination unreachable (Host unreachable)"
"35","7.467169","10.10.10.6","10.10.10.1","DNS","82","Standard query 0x001a AAAA 3.openwrt.pool.ntp.org"
"36","7.467282","10.10.10.1","10.10.10.6","DNS","82","Standard query response 0x001a AAAA 3.openwrt.pool.ntp.org"
"37","7.467925","10.10.10.6","10.10.10.1","DNS","82","Standard query 0x001b A 3.openwrt.pool.ntp.org"
"38","7.481028","10.10.10.1","10.10.10.6","DNS","552","Standard query response 0x001b A 3.openwrt.pool.ntp.org A 74.120.8.2 A 163.172.28.46 A 217.147.223.78 A 52.59.88.68 NS f.ntpns.org NS h.ntpns.org NS c.ntpns.org NS i.ntpns.org NS a.ntpns.org NS b.ntpns.org NS g.ntpns.org NS d.ntpns.org NS e.ntpns.org A 207.171.17.42 AAAA 2620:101:d007::42 A 174.127.124.192 A 193.243.171.138 A 89.36.18.22 AAAA 2a00:14b0:4200:32e0::1e5 A 178.63.120.205 A 199.188.48.59 AAAA 2a01:4f8:121:43cd::3:1 A 46.234.32.107 A 173.255.139.202 AAAA 2001:4b20:0:ca01:5054:ff:fe6f:c4fb A 50.31.240.214"
"39","7.481871","10.10.10.6","74.120.8.2","NTP","90","NTP Version 4, client"
"40","7.482207","10.10.10.6","10.10.10.1","DNS","82","Standard query 0x001c AAAA 2.openwrt.pool.ntp.org"
"41","7.491175","10.10.10.1","10.10.10.6","DNS","524","Standard query response 0x001c AAAA 2.openwrt.pool.ntp.org AAAA 2a01:4f8:151:2053::123 AAAA 2a01:4f8:210:5323::2 AAAA 2001:638:a000:1123:123::2 AAAA 2001:67c:299c:3998:91:237:88:67 NS g.ntpns.org NS e.ntpns.org NS h.ntpns.org NS c.ntpns.org NS a.ntpns.org NS f.ntpns.org NS d.ntpns.org NS b.ntpns.org NS i.ntpns.org A 207.171.17.42 AAAA 2620:101:d007::42 A 193.243.171.138 A 174.127.124.192 A 89.36.18.22 AAAA 2a00:14b0:4200:32e0::1e5 A 199.188.48.59 A 178.63.120.205 AAAA 2a01:4f8:121:43cd::3:1"
"42","7.491950","10.10.10.6","10.10.10.1","DNS","82","Standard query 0x001d A 2.openwrt.pool.ntp.org"
"43","7.538211","10.10.10.6","10.10.10.1","DNS","88","Standard query 0x0002 A www.ecdinterface.philips.com"
"44","7.538332","10.10.10.1","10.10.10.6","DNS","104","Standard query response 0x0002 A www.ecdinterface.philips.com A 162.13.31.14"
"45","7.539880","10.10.10.6","162.13.31.14","TCP","74","53410  >  80 [SYN] Seq=0 Win=29200 Len=0 MSS=1460 SACK_PERM=1 TSval=4294940756 TSecr=0 WS=8"
"46","7.550096","10.10.10.6","224.0.0.22","IGMPv3","60","Membership Report / Join group 239.255.255.250 for any sources"
"47","7.555988","162.13.31.14","10.10.10.6","TCP","74","80  >  53410 [SYN, ACK] Seq=0 Ack=1 Win=4140 Len=0 MSS=1380 TSval=85733901 TSecr=4294940756 SACK_PERM=1"
"48","7.556355","10.10.10.6","162.13.31.14","TCP","66","53410  >  80 [ACK] Seq=1 Ack=1 Win=29200 Len=0 TSval=4294940758 TSecr=85733901"
"49","7.556521","10.10.10.6","162.13.31.14","HTTP","326","POST /DevicePortalICPRequestHandler/RequestHandler.ashx HTTP/1.1 "
"50","7.572315","162.13.31.14","10.10.10.6","TCP","66","80  >  53410 [ACK] Seq=1 Ack=261 Win=4400 Len=0 TSval=85733917 TSecr=4294940758"
"51","7.577690","162.13.31.14","10.10.10.6","TCP","1434","80  >  53410 [ACK] Seq=1 Ack=261 Win=4400 Len=1368 TSval=85733922 TSecr=4294940758 [TCP segment of a reassembled PDU]"
"52","7.577710","162.13.31.14","10.10.10.6","TCP","146","80  >  53410 [PSH, ACK] Seq=1369 Ack=261 Win=4400 Len=80 TSval=85733922 TSecr=4294940758 [TCP segment of a reassembled PDU]"
"53","7.577716","162.13.31.14","10.10.10.6","HTTP","475","HTTP/1.1 401 Unauthorized  (text/html)"
"54","7.578146","10.10.10.6","162.13.31.14","TCP","66","53410  >  80 [ACK] Seq=261 Ack=1369 Win=31464 Len=0 TSval=4294940760 TSecr=85733922"
"55","7.578156","10.10.10.6","162.13.31.14","TCP","66","53410  >  80 [ACK] Seq=261 Ack=1449 Win=31464 Len=0 TSval=4294940760 TSecr=85733922"
"56","7.578199","10.10.10.6","162.13.31.14","TCP","66","53410  >  80 [ACK] Seq=261 Ack=1858 Win=34200 Len=0 TSval=4294940760 TSecr=85733922"
"57","7.613312","10.10.10.1","10.10.10.6","DNS","552","Standard query response 0x001d A 2.openwrt.pool.ntp.org A 85.220.190.246 A 195.50.171.101 A 78.47.201.162 A 84.200.28.17 NS i.ntpns.org NS c.ntpns.org NS g.ntpns.org NS e.ntpns.org NS h.ntpns.org NS d.ntpns.org NS b.ntpns.org NS f.ntpns.org NS a.ntpns.org A 207.171.17.42 AAAA 2620:101:d007::42 A 174.127.124.192 A 193.243.171.138 A 89.36.18.22 AAAA 2a00:14b0:4200:32e0::1e5 A 178.63.120.205 A 199.188.48.59 AAAA 2a01:4f8:121:43cd::3:1 A 46.234.32.107 A 173.255.139.202 AAAA 2001:4b20:0:ca01:5054:ff:fe6f:c4fb A 50.31.240.214"
"58","7.615276","10.10.10.6","85.220.190.246","NTP","90","NTP Version 4, client"
"59","7.615681","10.10.10.6","10.10.10.1","DNS","82","Standard query 0x001e AAAA 1.openwrt.pool.ntp.org"
"60","7.615782","10.10.10.1","10.10.10.6","DNS","82","Standard query response 0x001e AAAA 1.openwrt.pool.ntp.org"
"61","7.616486","10.10.10.6","10.10.10.1","DNS","82","Standard query 0x001f A 1.openwrt.pool.ntp.org"
"62","7.617574","85.220.190.246","10.10.10.6","NTP","90","NTP Version 4, server"
"63","7.622833","74.120.8.2","10.10.10.6","NTP","90","NTP Version 4, server"
"64","7.645620","10.10.10.6","224.0.0.251","MDNS","485","Standard query 0x0000 ANY _hap._tcp.local, ""QU"" question ANY Philips-hue.local, ""QU"" question ANY Philips hue - 2476FF._hap._tcp.local, ""QU"" question PTR Philips hue - 2476FF._hap._tcp.local TXT SRV 0 0 8080 Philips-hue.local AAAA fdd9:fbb:a067::1 A 10.10.10.6"
"65","7.645928","fe80::217:88ff:fe24:76ff","ff02::fb","MDNS","505","Standard query 0x0000 ANY _hap._tcp.local, ""QU"" question ANY Philips-hue.local, ""QU"" question ANY Philips hue - 2476FF._hap._tcp.local, ""QU"" question PTR Philips hue - 2476FF._hap._tcp.local TXT SRV 0 0 8080 Philips-hue.local AAAA fdd9:fbb:a067::1 A 10.10.10.6"
"66","7.774648","10.10.10.6","162.13.31.14","HTTP","1243","POST /DevicePortalICPRequestHandler/RequestHandler.ashx HTTP/1.1  (application/cb-encrypted)"
"67","7.790692","162.13.31.14","10.10.10.6","TCP","66","80  >  53410 [ACK] Seq=1858 Ack=1438 Win=5577 Len=0 TSval=85734136 TSecr=4294940780"
"68","7.801020","162.13.31.14","10.10.10.6","TCP","1434","80  >  53410 [ACK] Seq=1858 Ack=1438 Win=5577 Len=1368 TSval=85734146 TSecr=4294940780 [TCP segment of a reassembled PDU]"
"69","7.801040","162.13.31.14","10.10.10.6","HTTP","91","HTTP/1.1 200 OK  (application/cb-encrypted)"
"70","7.801487","10.10.10.6","162.13.31.14","TCP","66","53410  >  80 [ACK] Seq=1438 Ack=3226 Win=36936 Len=0 TSval=4294940783 TSecr=85734146"
"71","7.801488","10.10.10.6","162.13.31.14","TCP","66","53410  >  80 [ACK] Seq=1438 Ack=3251 Win=36936 Len=0 TSval=4294940783 TSecr=85734146"
"72","7.802895","10.10.10.6","162.13.31.14","HTTP","1323","POST /DevicePortalICPRequestHandler/RequestHandler.ashx HTTP/1.1  (application/cb-encrypted)"
"73","7.819122","162.13.31.14","10.10.10.6","TCP","66","80  >  53410 [ACK] Seq=3251 Ack=2695 Win=6834 Len=0 TSval=85734164 TSecr=4294940783"
"74","7.834452","162.13.31.14","10.10.10.6","TCP","1434","80  >  53410 [ACK] Seq=3251 Ack=2695 Win=6834 Len=1368 TSval=85734179 TSecr=4294940783 [TCP segment of a reassembled PDU]"
"75","7.834472","162.13.31.14","10.10.10.6","TCP","146","80  >  53410 [PSH, ACK] Seq=4619 Ack=2695 Win=6834 Len=80 TSval=85734179 TSecr=4294940783 [TCP segment of a reassembled PDU]"
"76","7.834478","162.13.31.14","10.10.10.6","HTTP","927","HTTP/1.1 200 OK  (application/cb-encrypted)"
"77","7.834955","10.10.10.6","162.13.31.14","TCP","66","53410  >  80 [ACK] Seq=2695 Ack=4699 Win=39672 Len=0 TSval=4294940786 TSecr=85734179"
"78","7.835981","10.10.10.6","162.13.31.14","TCP","66","53410  >  80 [FIN, ACK] Seq=2695 Ack=5560 Win=42408 Len=0 TSval=4294940786 TSecr=85734179"
"79","7.851700","162.13.31.14","10.10.10.6","TCP","66","80  >  53410 [ACK] Seq=5560 Ack=2696 Win=6834 Len=0 TSval=85734197 TSecr=4294940786"
"80","7.851868","162.13.31.14","10.10.10.6","TCP","66","80  >  53410 [FIN, ACK] Seq=5560 Ack=2696 Win=6834 Len=0 TSval=85734197 TSecr=4294940786"
"81","7.852203","10.10.10.6","162.13.31.14","TCP","66","53410  >  80 [ACK] Seq=2696 Ack=5561 Win=42408 Len=0 TSval=4294940788 TSecr=85734197"
"82","7.852444","10.10.10.6","10.10.10.1","DNS","88","Standard query 0x0003 A www.ecdinterface.philips.com"
"83","7.852537","10.10.10.1","10.10.10.6","DNS","104","Standard query response 0x0003 A www.ecdinterface.philips.com A 162.13.31.14"
"84","7.853133","10.10.10.6","162.13.31.14","TCP","74","53411  >  80 [SYN] Seq=0 Win=29200 Len=0 MSS=1460 SACK_PERM=1 TSval=4294940788 TSecr=0 WS=8"
"85","7.871298","162.13.31.14","10.10.10.6","TCP","74","80  >  53411 [SYN, ACK] Seq=0 Ack=1 Win=4140 Len=0 MSS=1380 TSval=85734214 TSecr=4294940788 SACK_PERM=1"
"86","7.871673","10.10.10.6","162.13.31.14","TCP","66","53411  >  80 [ACK] Seq=1 Ack=1 Win=29200 Len=0 TSval=4294940790 TSecr=85734214"
"87","7.871877","10.10.10.6","162.13.31.14","HTTP","1260","POST /NotificationService/RequestHandler.ashx HTTP/1.1  (application/cb-encrypted)"
"88","7.890067","162.13.31.14","10.10.10.6","TCP","66","80  >  53411 [ACK] Seq=1 Ack=1195 Win=5334 Len=0 TSval=85734233 TSecr=4294940790"
"89","7.896172","10.10.10.6","224.0.0.251","MDNS","485","Standard query 0x0000 ANY _hap._tcp.local, ""QU"" question ANY Philips-hue.local, ""QU"" question ANY Philips hue - 2476FF._hap._tcp.local, ""QU"" question PTR Philips hue - 2476FF._hap._tcp.local TXT SRV 0 0 8080 Philips-hue.local AAAA fdd9:fbb:a067::1 A 10.10.10.6"
"90","7.896291","fe80::217:88ff:fe24:76ff","ff02::fb","MDNS","505","Standard query 0x0000 ANY _hap._tcp.local, ""QU"" question ANY Philips-hue.local, ""QU"" question ANY Philips hue - 2476FF._hap._tcp.local, ""QU"" question PTR Philips hue - 2476FF._hap._tcp.local TXT SRV 0 0 8080 Philips-hue.local AAAA fdd9:fbb:a067::1 A 10.10.10.6"
"91","7.913042","162.13.31.14","10.10.10.6","HTTP","921","HTTP/1.1 200 OK  (application/cb-encrypted)"
"92","7.913065","162.13.31.14","10.10.10.6","TCP","66","80  >  53411 [FIN, ACK] Seq=856 Ack=1195 Win=5334 Len=0 TSval=85734255 TSecr=4294940790"
"93","7.913465","10.10.10.6","162.13.31.14","TCP","66","53411  >  80 [ACK] Seq=1195 Ack=856 Win=30780 Len=0 TSval=4294940794 TSecr=85734255"
"94","7.914079","10.10.10.6","162.13.31.14","TCP","66","53411  >  80 [FIN, ACK] Seq=1195 Ack=857 Win=30780 Len=0 TSval=4294940794 TSecr=85734255"
"95","7.915247","10.10.10.6","10.10.10.1","DNS","88","Standard query 0x0004 A www.ecdinterface.philips.com"
"96","7.915343","10.10.10.1","10.10.10.6","DNS","104","Standard query response 0x0004 A www.ecdinterface.philips.com A 162.13.31.14"
"97","7.915956","10.10.10.6","162.13.31.14","TCP","74","53412  >  80 [SYN] Seq=0 Win=29200 Len=0 MSS=1460 SACK_PERM=1 TSval=4294940794 TSecr=0 WS=8"
"98","7.932085","162.13.31.14","10.10.10.6","TCP","66","80  >  53411 [ACK] Seq=857 Ack=1196 Win=5334 Len=0 TSval=85734275 TSecr=4294940794"
"99","7.933454","162.13.31.14","10.10.10.6","TCP","74","80  >  53412 [SYN, ACK] Seq=0 Ack=1 Win=4140 Len=0 MSS=1380 TSval=85734275 TSecr=4294940794 SACK_PERM=1"
"100","7.933788","10.10.10.6","162.13.31.14","TCP","66","53412  >  80 [ACK] Seq=1 Ack=1 Win=29200 Len=0 TSval=4294940796 TSecr=85734275"
"101","7.934037","10.10.10.6","162.13.31.14","HTTP","1276","POST /NotificationService/RequestHandler.ashx HTTP/1.1  (application/cb-encrypted)"
"102","7.951467","162.13.31.14","10.10.10.6","TCP","66","80  >  53412 [ACK] Seq=1 Ack=1211 Win=5350 Len=0 TSval=85734293 TSecr=4294940796"
"103","7.966579","162.13.31.14","10.10.10.6","HTTP","1049","HTTP/1.1 200 OK  (application/cb-encrypted)"
"104","7.966605","162.13.31.14","10.10.10.6","TCP","66","80  >  53412 [FIN, ACK] Seq=984 Ack=1211 Win=5350 Len=0 TSval=85734308 TSecr=4294940796"
"105","7.967007","10.10.10.6","162.13.31.14","TCP","66","53412  >  80 [ACK] Seq=1211 Ack=984 Win=30473 Len=0 TSval=4294940799 TSecr=85734308"
"106","7.967579","10.10.10.6","162.13.31.14","TCP","66","53412  >  80 [FIN, ACK] Seq=1211 Ack=985 Win=30473 Len=0 TSval=4294940799 TSecr=85734308"
"107","7.971639","10.10.10.1","10.10.10.6","DNS","552","Standard query response 0x001f A 1.openwrt.pool.ntp.org A 185.11.138.90 A 192.53.103.108 A 212.18.3.19 A 78.46.37.9 NS h.ntpns.org NS e.ntpns.org NS c.ntpns.org NS b.ntpns.org NS f.ntpns.org NS g.ntpns.org NS i.ntpns.org NS a.ntpns.org NS d.ntpns.org A 207.171.17.42 AAAA 2620:101:d007::42 A 193.243.171.138 A 174.127.124.192 A 89.36.18.22 AAAA 2a00:14b0:4200:32e0::1e5 A 199.188.48.59 A 178.63.120.205 AAAA 2a01:4f8:121:43cd::3:1 A 173.255.139.202 A 46.234.32.107 AAAA 2001:4b20:0:ca01:5054:ff:fe6f:c4fb A 50.31.240.214"
"108","7.972357","10.10.10.6","185.11.138.90","NTP","90","NTP Version 4, client"
"109","7.972762","10.10.10.6","10.10.10.1","DNS","82","Standard query 0x0020 AAAA 0.openwrt.pool.ntp.org"
"110","7.972856","10.10.10.1","10.10.10.6","DNS","82","Standard query response 0x0020 AAAA 0.openwrt.pool.ntp.org"
"111","7.973673","10.10.10.6","10.10.10.1","DNS","82","Standard query 0x0021 A 0.openwrt.pool.ntp.org"
"112","7.979265","185.11.138.90","10.10.10.6","NTP","90","NTP Version 4, server"
"113","7.984968","162.13.31.14","10.10.10.6","TCP","66","80  >  53412 [ACK] Seq=985 Ack=1212 Win=5350 Len=0 TSval=85734327 TSecr=4294940799"
"114","7.990441","10.10.10.1","10.10.10.6","DNS","552","Standard query response 0x0021 A 0.openwrt.pool.ntp.org A 94.23.210.194 A 4.53.160.75 A 81.7.16.52 A 91.212.242.20 NS c.ntpns.org NS a.ntpns.org NS d.ntpns.org NS g.ntpns.org NS b.ntpns.org NS h.ntpns.org NS f.ntpns.org NS i.ntpns.org NS e.ntpns.org A 207.171.17.42 AAAA 2620:101:d007::42 A 174.127.124.192 A 193.243.171.138 A 89.36.18.22 AAAA 2a00:14b0:4200:32e0::1e5 A 178.63.120.205 A 199.188.48.59 AAAA 2a01:4f8:121:43cd::3:1 A 46.234.32.107 A 173.255.139.202 AAAA 2001:4b20:0:ca01:5054:ff:fe6f:c4fb A 50.31.240.214"
"115","7.991202","10.10.10.6","94.23.210.194","NTP","90","NTP Version 4, client"
"116","8.004985","94.23.210.194","10.10.10.6","NTP","90","NTP Version 4, server"
"117","8.146493","10.10.10.6","224.0.0.251","MDNS","485","Standard query 0x0000 ANY _hap._tcp.local, ""QU"" question ANY Philips-hue.local, ""QU"" question ANY Philips hue - 2476FF._hap._tcp.local, ""QU"" question PTR Philips hue - 2476FF._hap._tcp.local TXT SRV 0 0 8080 Philips-hue.local AAAA fdd9:fbb:a067::1 A 10.10.10.6"
"118","8.146557","fe80::217:88ff:fe24:76ff","ff02::fb","MDNS","505","Standard query 0x0000 ANY _hap._tcp.local, ""QU"" question ANY Philips-hue.local, ""QU"" question ANY Philips hue - 2476FF._hap._tcp.local, ""QU"" question PTR Philips hue - 2476FF._hap._tcp.local TXT SRV 0 0 8080 Philips-hue.local AAAA fdd9:fbb:a067::1 A 10.10.10.6"
"119","8.210034","10.10.10.6","224.0.0.22","IGMPv3","60","Membership Report / Join group 239.255.255.250 for any sources"
"120","8.406991","10.10.10.6","224.0.0.251","MDNS","459","Standard query response 0x0000 PTR Philips hue - 2476FF._hap._tcp.local TXT, cache flush SRV, cache flush 0 0 8080 Philips-hue.local AAAA, cache flush fdd9:fbb:a067::1 A, cache flush 10.10.10.6 AAAA, cache flush fdd9:fbb:a067::1 A, cache flush 10.10.10.6"
"121","8.407049","fe80::217:88ff:fe24:76ff","ff02::fb","MDNS","479","Standard query response 0x0000 PTR Philips hue - 2476FF._hap._tcp.local TXT, cache flush SRV, cache flush 0 0 8080 Philips-hue.local AAAA, cache flush fdd9:fbb:a067::1 A, cache flush 10.10.10.6 AAAA, cache flush fdd9:fbb:a067::1 A, cache flush 10.10.10.6"
"122","8.444060","10.10.10.6","10.10.10.1","DNS","79","Standard query 0x0005 A dcp.cpp.philips.com"
"123","8.444155","10.10.10.1","10.10.10.6","DNS","95","Standard query response 0x0005 A dcp.cpp.philips.com A 5.79.62.93"
"124","8.444763","10.10.10.6","5.79.62.93","TCP","74","37692  >  80 [SYN] Seq=0 Win=29200 Len=0 MSS=1460 SACK_PERM=1 TSval=4294940847 TSecr=0 WS=8"
"125","8.460521","5.79.62.93","10.10.10.6","TCP","74","80  >  37692 [SYN, ACK] Seq=0 Ack=1 Win=4140 Len=0 MSS=1380 TSval=85734804 TSecr=4294940847 SACK_PERM=1"
"126","8.460875","10.10.10.6","5.79.62.93","TCP","66","37692  >  80 [ACK] Seq=1 Ack=1 Win=29200 Len=0 TSval=4294940849 TSecr=85734804"
"127","8.461064","10.10.10.6","5.79.62.93","TCP","664","37692  >  80 [PSH, ACK] Seq=1 Ack=1 Win=29200 Len=598 TSval=4294940849 TSecr=85734804 [TCP segment of a reassembled PDU]"
"128","8.473161","10.10.10.30","10.10.10.6","TCP","74","38447  >  80 [SYN] Seq=0 Win=65535 Len=0 MSS=1460 SACK_PERM=1 TSval=14115972 TSecr=0 WS=128"
"129","8.473610","PhilipsL_24:76:ff","Broadcast","ARP","60","Who has 10.10.10.30? Tell 10.10.10.6"
"130","8.476592","5.79.62.93","10.10.10.6","TCP","66","80  >  37692 [ACK] Seq=1 Ack=599 Win=4738 Len=0 TSval=85734820 TSecr=4294940849"
"131","8.477005","10.10.10.6","5.79.62.93","HTTP","1186","POST /DcpRequestHandler/index.ashx HTTP/1.1  (application/cb-encrypted)"
"132","8.492562","5.79.62.93","10.10.10.6","TCP","66","80  >  37692 [ACK] Seq=1 Ack=1719 Win=5858 Len=0 TSval=85734837 TSecr=4294940850"
"133","8.513986","5.79.62.93","10.10.10.6","HTTP","937","HTTP/1.1 200 OK  (application/cb-encrypted)"
"134","8.514010","5.79.62.93","10.10.10.6","TCP","66","80  >  37692 [FIN, ACK] Seq=872 Ack=1719 Win=5858 Len=0 TSval=85734858 TSecr=4294940850"
"135","8.514414","10.10.10.6","5.79.62.93","TCP","66","37692  >  80 [ACK] Seq=1719 Ack=872 Win=30485 Len=0 TSval=4294940854 TSecr=85734858"
"136","8.515059","10.10.10.6","5.79.62.93","TCP","66","37692  >  80 [FIN, ACK] Seq=1719 Ack=873 Win=30485 Len=0 TSval=4294940854 TSecr=85734858"
"137","8.530605","5.79.62.93","10.10.10.6","TCP","66","80  >  37692 [ACK] Seq=873 Ack=1720 Win=5858 Len=0 TSval=85734874 TSecr=4294940854"
"138","8.730491","SamsungE_ef:85:41","PhilipsL_24:76:ff","ARP","42","10.10.10.30 is at 38:0b:40:ef:85:41"
"139","8.730692","10.10.10.6","10.10.10.30","TCP","74","80  >  38447 [SYN, ACK] Seq=0 Ack=1 Win=28960 Len=0 MSS=1460 SACK_PERM=1 TSval=4294940850 TSecr=14115972 WS=8"
"140","8.730808","SamsungE_ef:85:41","PhilipsL_24:76:ff","ARP","42","10.10.10.30 is at 38:0b:40:ef:85:41"
"141","8.733276","10.10.10.30","10.10.10.6","TCP","66","38447  >  80 [ACK] Seq=1 Ack=1 Win=87680 Len=0 TSval=14116024 TSecr=4294940850"
"142","8.733691","10.10.10.30","10.10.10.6","HTTP","232","GET /api/null HTTP/1.1 "
"143","8.733993","10.10.10.6","10.10.10.30","TCP","66","80  >  38447 [ACK] Seq=1 Ack=167 Win=30032 Len=0 TSval=4294940876 TSecr=14116024"
"144","8.734686","10.10.10.6","10.10.10.30","TCP","83","80  >  38447 [PSH, ACK] Seq=1 Ack=167 Win=30032 Len=17 TSval=4294940876 TSecr=14116024 [TCP segment of a reassembled PDU]"
"145","8.735150","10.10.10.6","10.10.10.30","HTTP","540","HTTP/1.1 200 OK  (application/json)"
"146","8.742560","10.10.10.30","10.10.10.6","TCP","66","38447  >  80 [ACK] Seq=167 Ack=18 Win=87680 Len=0 TSval=14116025 TSecr=4294940876"
"147","8.746704","10.10.10.30","10.10.10.6","TCP","66","38447  >  80 [FIN, ACK] Seq=167 Ack=493 Win=88704 Len=0 TSval=14116027 TSecr=4294940876"
"148","8.746978","10.10.10.6","10.10.10.30","TCP","66","80  >  38447 [ACK] Seq=493 Ack=168 Win=30032 Len=0 TSval=4294940877 TSecr=14116027"
"149","8.757954","10.10.10.30","10.10.10.6","TCP","74","33934  >  80 [SYN] Seq=0 Win=65535 Len=0 MSS=1460 SACK_PERM=1 TSval=14116029 TSecr=0 WS=128"
"150","8.758393","10.10.10.6","10.10.10.30","TCP","74","80  >  33934 [SYN, ACK] Seq=0 Ack=1 Win=28960 Len=0 MSS=1460 SACK_PERM=1 TSval=4294940878 TSecr=14116029 WS=8"
"151","8.760975","10.10.10.30","10.10.10.6","TCP","66","33934  >  80 [ACK] Seq=1 Ack=1 Win=87680 Len=0 TSval=14116029 TSecr=4294940878"
"152","8.762625","10.10.10.30","10.10.10.6","HTTP","335","POST /api/ HTTP/1.1  (application/x-www-form-urlencoded)"
"153","8.762930","10.10.10.6","10.10.10.30","TCP","66","80  >  33934 [ACK] Seq=1 Ack=270 Win=30032 Len=0 TSval=4294940879 TSecr=14116030"
"154","8.763788","10.10.10.6","10.10.10.30","TCP","83","80  >  33934 [PSH, ACK] Seq=1 Ack=270 Win=30032 Len=17 TSval=4294940879 TSecr=14116030 [TCP segment of a reassembled PDU]"
"155","8.764330","10.10.10.6","10.10.10.30","HTTP","548","HTTP/1.1 200 OK  (application/json)"
"156","8.772032","10.10.10.30","10.10.10.6","TCP","66","33934  >  80 [ACK] Seq=270 Ack=18 Win=87680 Len=0 TSval=14116031 TSecr=4294940879"
"157","8.774024","10.10.10.30","10.10.10.6","TCP","66","33934  >  80 [FIN, ACK] Seq=270 Ack=501 Win=88704 Len=0 TSval=14116032 TSecr=4294940879"
"158","8.774286","10.10.10.6","10.10.10.30","TCP","66","80  >  33934 [ACK] Seq=501 Ack=271 Win=30032 Len=0 TSval=4294940880 TSecr=14116032"
"159","9.407311","10.10.10.6","224.0.0.251","MDNS","459","Standard query response 0x0000 PTR Philips hue - 2476FF._hap._tcp.local TXT, cache flush SRV, cache flush 0 0 8080 Philips-hue.local AAAA, cache flush fdd9:fbb:a067::1 A, cache flush 10.10.10.6 AAAA, cache flush fdd9:fbb:a067::1 A, cache flush 10.10.10.6"
"160","9.407490","fe80::217:88ff:fe24:76ff","ff02::fb","MDNS","479","Standard query response 0x0000 PTR Philips hue - 2476FF._hap._tcp.local TXT, cache flush SRV, cache flush 0 0 8080 Philips-hue.local AAAA, cache flush fdd9:fbb:a067::1 A, cache flush 10.10.10.6 AAAA, cache flush fdd9:fbb:a067::1 A, cache flush 10.10.10.6"
"161","9.727091","10.10.10.6","239.255.255.250","SSDP","348","NOTIFY * HTTP/1.1 "
"162","9.778520","10.10.10.6","239.255.255.250","SSDP","348","NOTIFY * HTTP/1.1 "
"163","9.801487","10.10.10.30","10.10.10.6","TCP","74","53057  >  80 [SYN] Seq=0 Win=65535 Len=0 MSS=1460 SACK_PERM=1 TSval=14116233 TSecr=0 WS=128"
"164","9.801871","10.10.10.6","10.10.10.30","TCP","74","80  >  53057 [SYN, ACK] Seq=0 Ack=1 Win=28960 Len=0 MSS=1460 SACK_PERM=1 TSval=4294940983 TSecr=14116233 WS=8"
"165","9.805238","10.10.10.30","10.10.10.6","TCP","66","53057  >  80 [ACK] Seq=1 Ack=1 Win=87680 Len=0 TSval=14116238 TSecr=4294940983"
"166","9.807566","10.10.10.30","10.10.10.6","HTTP","335","POST /api/ HTTP/1.1  (application/x-www-form-urlencoded)"
"167","9.807978","10.10.10.6","10.10.10.30","TCP","66","80  >  53057 [ACK] Seq=1 Ack=270 Win=30032 Len=0 TSval=4294940983 TSecr=14116239"
"168","9.808899","10.10.10.6","10.10.10.30","TCP","83","80  >  53057 [PSH, ACK] Seq=1 Ack=270 Win=30032 Len=17 TSval=4294940983 TSecr=14116239 [TCP segment of a reassembled PDU]"
"169","9.809488","10.10.10.6","10.10.10.30","HTTP","548","HTTP/1.1 200 OK  (application/json)"
"170","9.810149","10.10.10.6","10.10.10.30","TCP","548","[TCP Out-Of-Order] 80  >  53057 [FIN, PSH, ACK] Seq=18 Ack=270 Win=30032 Len=482 TSval=4294940984 TSecr=14116239[Reassembly error, protocol TCP: New fragment overlaps old data (retransmission?)]"
"171","9.816535","10.10.10.30","10.10.10.6","TCP","66","53057  >  80 [ACK] Seq=270 Ack=18 Win=87680 Len=0 TSval=14116239 TSecr=4294940983"
"172","9.816611","10.10.10.30","10.10.10.6","TCP","66","53057  >  80 [FIN, ACK] Seq=270 Ack=501 Win=88704 Len=0 TSval=14116240 TSecr=4294940983"
"173","9.816949","10.10.10.6","10.10.10.30","TCP","66","80  >  53057 [ACK] Seq=501 Ack=271 Win=30032 Len=0 TSval=4294940984 TSecr=14116240"
"174","9.818100","10.10.10.30","10.10.10.6","TCP","78","[TCP Dup ACK 172#1] 53057  >  80 [ACK] Seq=271 Ack=501 Win=88704 Len=0 TSval=14116241 TSecr=4294940984 SLE=18 SRE=501"
"175","9.830519","10.10.10.6","239.255.255.250","SSDP","357","NOTIFY * HTTP/1.1 "
"176","9.881796","10.10.10.6","239.255.255.250","SSDP","357","NOTIFY * HTTP/1.1 "
"177","9.933070","10.10.10.6","239.255.255.250","SSDP","351","NOTIFY * HTTP/1.1 "
"178","9.984364","10.10.10.6","239.255.255.250","SSDP","351","NOTIFY * HTTP/1.1 "
"179","10.006708","10.10.10.6","74.120.8.2","NTP","90","NTP Version 4, client"
"180","10.006838","10.10.10.6","85.220.190.246","NTP","90","NTP Version 4, client"
"181","10.007040","10.10.10.6","185.11.138.90","NTP","90","NTP Version 4, client"
"182","10.007216","10.10.10.6","94.23.210.194","NTP","90","NTP Version 4, client"
"183","10.009033","85.220.190.246","10.10.10.6","NTP","90","NTP Version 4, server"
"184","10.013897","185.11.138.90","10.10.10.6","NTP","90","NTP Version 4, server"
"185","10.020887","94.23.210.194","10.10.10.6","NTP","90","NTP Version 4, server"
"186","10.156471","74.120.8.2","10.10.10.6","NTP","90","NTP Version 4, server"
"187","10.407683","10.10.10.6","224.0.0.251","MDNS","459","Standard query response 0x0000 PTR Philips hue - 2476FF._hap._tcp.local TXT, cache flush SRV, cache flush 0 0 8080 Philips-hue.local AAAA, cache flush fdd9:fbb:a067::1 A, cache flush 10.10.10.6 AAAA, cache flush fdd9:fbb:a067::1 A, cache flush 10.10.10.6"
"188","10.407815","fe80::217:88ff:fe24:76ff","ff02::fb","MDNS","479","Standard query response 0x0000 PTR Philips hue - 2476FF._hap._tcp.local TXT, cache flush SRV, cache flush 0 0 8080 Philips-hue.local AAAA, cache flush fdd9:fbb:a067::1 A, cache flush 10.10.10.6 AAAA, cache flush fdd9:fbb:a067::1 A, cache flush 10.10.10.6"
"189","10.843885","10.10.10.30","10.10.10.6","TCP","74","54513  >  80 [SYN] Seq=0 Win=65535 Len=0 MSS=1460 SACK_PERM=1 TSval=14116441 TSecr=0 WS=128"
"190","10.844277","10.10.10.6","10.10.10.30","TCP","74","80  >  54513 [SYN, ACK] Seq=0 Ack=1 Win=28960 Len=0 MSS=1460 SACK_PERM=1 TSval=4294941087 TSecr=14116441 WS=8"
"191","10.847044","10.10.10.30","10.10.10.6","TCP","66","54513  >  80 [ACK] Seq=1 Ack=1 Win=87680 Len=0 TSval=14116447 TSecr=4294941087"
"192","10.847667","10.10.10.30","10.10.10.6","HTTP","335","POST /api/ HTTP/1.1  (application/x-www-form-urlencoded)"
"193","10.847995","10.10.10.6","10.10.10.30","TCP","66","80  >  54513 [ACK] Seq=1 Ack=270 Win=30032 Len=0 TSval=4294941087 TSecr=14116447"
"194","10.848815","10.10.10.6","10.10.10.30","TCP","83","80  >  54513 [PSH, ACK] Seq=1 Ack=270 Win=30032 Len=17 TSval=4294941087 TSecr=14116447 [TCP segment of a reassembled PDU]"
"195","10.849428","10.10.10.6","10.10.10.30","HTTP","548","HTTP/1.1 200 OK  (application/json)"
"196","10.850139","10.10.10.6","10.10.10.30","TCP","548","[TCP Out-Of-Order] 80  >  54513 [FIN, PSH, ACK] Seq=18 Ack=270 Win=30032 Len=482 TSval=4294941088 TSecr=14116447[Reassembly error, protocol TCP: New fragment overlaps old data (retransmission?)]"
"197","10.852585","10.10.10.30","10.10.10.6","TCP","66","54513  >  80 [ACK] Seq=270 Ack=18 Win=87680 Len=0 TSval=14116447 TSecr=4294941087"
"198","10.852664","10.10.10.30","10.10.10.6","TCP","66","54513  >  80 [FIN, ACK] Seq=270 Ack=501 Win=88704 Len=0 TSval=14116448 TSecr=4294941087"
"199","10.852989","10.10.10.6","10.10.10.30","TCP","66","80  >  54513 [ACK] Seq=501 Ack=271 Win=30032 Len=0 TSval=4294941088 TSecr=14116448"
"200","10.853195","10.10.10.30","10.10.10.6","TCP","78","[TCP Dup ACK 198#1] 54513  >  80 [ACK] Seq=271 Ack=501 Win=88704 Len=0 TSval=14116448 TSecr=4294941088 SLE=18 SRE=501"
"201","11.157965","10.10.10.6","94.23.210.194","NTP","90","NTP Version 4, client"
"202","11.171787","94.23.210.194","10.10.10.6","NTP","90","NTP Version 4, server"
"203","11.922079","10.10.10.30","10.10.10.6","TCP","74","38928  >  80 [SYN] Seq=0 Win=65535 Len=0 MSS=1460 SACK_PERM=1 TSval=14116649 TSecr=0 WS=128"
"204","11.922445","10.10.10.6","10.10.10.30","TCP","74","80  >  38928 [SYN, ACK] Seq=0 Ack=1 Win=28960 Len=0 MSS=1460 SACK_PERM=1 TSval=4294941195 TSecr=14116649 WS=8"
"205","11.925102","10.10.10.30","10.10.10.6","TCP","66","38928  >  80 [ACK] Seq=1 Ack=1 Win=87680 Len=0 TSval=14116662 TSecr=4294941195"
"206","11.928317","10.10.10.30","10.10.10.6","HTTP","335","POST /api/ HTTP/1.1  (application/x-www-form-urlencoded)"
"207","11.928616","10.10.10.6","10.10.10.30","TCP","66","80  >  38928 [ACK] Seq=1 Ack=270 Win=30032 Len=0 TSval=4294941195 TSecr=14116663"
"208","11.929485","10.10.10.6","10.10.10.30","TCP","83","80  >  38928 [PSH, ACK] Seq=1 Ack=270 Win=30032 Len=17 TSval=4294941195 TSecr=14116663 [TCP segment of a reassembled PDU]"
"209","11.930163","10.10.10.6","10.10.10.30","HTTP","548","HTTP/1.1 200 OK  (application/json)"
"210","11.931942","10.10.10.30","10.10.10.6","TCP","66","38928  >  80 [ACK] Seq=270 Ack=18 Win=87680 Len=0 TSval=14116664 TSecr=4294941195"
"211","11.936113","10.10.10.30","10.10.10.6","TCP","66","38928  >  80 [FIN, ACK] Seq=270 Ack=501 Win=88704 Len=0 TSval=14116664 TSecr=4294941195"
"212","11.936424","10.10.10.6","10.10.10.30","TCP","66","80  >  38928 [ACK] Seq=501 Ack=271 Win=30032 Len=0 TSval=4294941196 TSecr=14116664"
"213","12.173610","10.10.10.6","74.120.8.2","NTP","90","NTP Version 4, client"
"214","12.173689","10.10.10.6","85.220.190.246","NTP","90","NTP Version 4, client"
"215","12.174022","10.10.10.6","185.11.138.90","NTP","90","NTP Version 4, client"
"216","12.175922","85.220.190.246","10.10.10.6","NTP","90","NTP Version 4, server"
"217","12.180847","185.11.138.90","10.10.10.6","NTP","90","NTP Version 4, server"
"218","12.311576","74.120.8.2","10.10.10.6","NTP","90","NTP Version 4, server"
"219","12.460932","10.10.10.6","10.10.10.1","DNS","79","Standard query 0x0006 A dcp.cpp.philips.com"
"220","12.461028","10.10.10.1","10.10.10.6","DNS","95","Standard query response 0x0006 A dcp.cpp.philips.com A 5.79.62.93"
"221","12.461629","10.10.10.6","5.79.62.93","TCP","74","37693  >  80 [SYN] Seq=0 Win=29200 Len=0 MSS=1460 SACK_PERM=1 TSval=4294941249 TSecr=0 WS=8"
"222","12.480875","5.79.62.93","10.10.10.6","TCP","74","80  >  37693 [SYN, ACK] Seq=0 Ack=1 Win=4140 Len=0 MSS=1380 TSval=85738822 TSecr=4294941249 SACK_PERM=1"
"223","12.481259","10.10.10.6","5.79.62.93","TCP","66","37693  >  80 [ACK] Seq=1 Ack=1 Win=29200 Len=0 TSval=4294941251 TSecr=85738822"
"224","12.481448","10.10.10.6","5.79.62.93","TCP","664","37693  >  80 [PSH, ACK] Seq=1 Ack=1 Win=29200 Len=598 TSval=4294941251 TSecr=85738822 [TCP segment of a reassembled PDU]"
"225","12.500262","5.79.62.93","10.10.10.6","TCP","66","80  >  37693 [ACK] Seq=1 Ack=599 Win=4738 Len=0 TSval=85738842 TSecr=4294941251"
"226","12.500748","10.10.10.6","5.79.62.93","HTTP","1090","POST /DcpRequestHandler/index.ashx HTTP/1.1  (application/cb-encrypted)"
"227","12.520023","5.79.62.93","10.10.10.6","TCP","66","80  >  37693 [ACK] Seq=1 Ack=1623 Win=5762 Len=0 TSval=85738862 TSecr=4294941253"
"228","12.546444","5.79.62.93","10.10.10.6","HTTP","937","HTTP/1.1 200 OK  (application/cb-encrypted)"
"229","12.546454","5.79.62.93","10.10.10.6","TCP","66","80  >  37693 [FIN, ACK] Seq=872 Ack=1623 Win=5762 Len=0 TSval=85738888 TSecr=4294941253"
"230","12.546820","10.10.10.6","5.79.62.93","TCP","66","37693  >  80 [ACK] Seq=1623 Ack=872 Win=30485 Len=0 TSval=4294941257 TSecr=85738888"
"231","12.547767","10.10.10.6","5.79.62.93","TCP","66","37693  >  80 [FIN, ACK] Seq=1623 Ack=873 Win=30485 Len=0 TSval=4294941257 TSecr=85738888"
"232","12.566236","5.79.62.93","10.10.10.6","TCP","66","80  >  37693 [ACK] Seq=873 Ack=1624 Win=5762 Len=0 TSval=85738908 TSecr=4294941257"
"233","12.687608","10.10.10.30","10.10.10.6","TCP","74","48565  >  80 [SYN] Seq=0 Win=65535 Len=0 MSS=1460 SACK_PERM=1 TSval=14116815 TSecr=0 WS=128"
"234","12.687971","10.10.10.6","10.10.10.30","TCP","74","80  >  48565 [SYN, ACK] Seq=0 Ack=1 Win=28960 Len=0 MSS=1460 SACK_PERM=1 TSval=4294941271 TSecr=14116815 WS=8"
"235","12.689408","10.10.10.30","10.10.10.6","TCP","66","48565  >  80 [ACK] Seq=1 Ack=1 Win=87680 Len=0 TSval=14116815 TSecr=4294941271"
"236","12.691157","10.10.10.30","10.10.10.6","HTTP","234","GET /api/config HTTP/1.1 "
"237","12.691493","10.10.10.6","10.10.10.30","TCP","66","80  >  48565 [ACK] Seq=1 Ack=169 Win=30032 Len=0 TSval=4294941272 TSecr=14116816"
"238","12.692173","10.10.10.6","10.10.10.30","TCP","83","80  >  48565 [PSH, ACK] Seq=1 Ack=169 Win=30032 Len=17 TSval=4294941272 TSecr=14116816 [TCP segment of a reassembled PDU]"
"239","12.692881","10.10.10.6","10.10.10.30","HTTP","617","HTTP/1.1 200 OK  (application/json)"
"240","12.694085","10.10.10.30","10.10.10.6","TCP","66","48565  >  80 [ACK] Seq=169 Ack=18 Win=87680 Len=0 TSval=14116816 TSecr=4294941272"
"241","12.694944","10.10.10.30","10.10.10.6","TCP","66","48565  >  80 [ACK] Seq=169 Ack=570 Win=88704 Len=0 TSval=14116816 TSecr=4294941272"
"242","12.696539","10.10.10.30","10.10.10.6","TCP","66","48565  >  80 [FIN, ACK] Seq=169 Ack=570 Win=88704 Len=0 TSval=14116817 TSecr=4294941272"
"243","12.696783","10.10.10.6","10.10.10.30","TCP","66","80  >  48565 [ACK] Seq=570 Ack=170 Win=30032 Len=0 TSval=4294941272 TSecr=14116817"
"244","12.940115","10.10.10.30","10.10.10.6","TCP","74","52698  >  80 [SYN] Seq=0 Win=65535 Len=0 MSS=1460 SACK_PERM=1 TSval=14116865 TSecr=0 WS=128"
"245","12.940565","10.10.10.6","10.10.10.30","TCP","74","80  >  52698 [SYN, ACK] Seq=0 Ack=1 Win=28960 Len=0 MSS=1460 SACK_PERM=1 TSval=4294941297 TSecr=14116865 WS=8"
"246","12.942103","10.10.10.30","10.10.10.6","TCP","66","52698  >  80 [ACK] Seq=1 Ack=1 Win=87680 Len=0 TSval=14116866 TSecr=4294941297"
"247","12.944494","10.10.10.30","10.10.10.6","HTTP","335","POST /api/ HTTP/1.1  (application/x-www-form-urlencoded)"
"248","12.944816","10.10.10.6","10.10.10.30","TCP","66","80  >  52698 [ACK] Seq=1 Ack=270 Win=30032 Len=0 TSval=4294941297 TSecr=14116866"
"249","12.945666","10.10.10.6","10.10.10.30","TCP","83","80  >  52698 [PSH, ACK] Seq=1 Ack=270 Win=30032 Len=17 TSval=4294941297 TSecr=14116866 [TCP segment of a reassembled PDU]"
"250","12.946173","10.10.10.6","10.10.10.30","HTTP","548","HTTP/1.1 200 OK  (application/json)"
"251","12.947052","10.10.10.30","10.10.10.6","TCP","66","52698  >  80 [ACK] Seq=270 Ack=18 Win=87680 Len=0 TSval=14116867 TSecr=4294941297"
"252","12.950277","10.10.10.30","10.10.10.6","TCP","66","52698  >  80 [FIN, ACK] Seq=270 Ack=501 Win=88704 Len=0 TSval=14116867 TSecr=4294941297"
"253","12.950523","10.10.10.6","10.10.10.30","TCP","66","80  >  52698 [ACK] Seq=501 Ack=271 Win=30032 Len=0 TSval=4294941298 TSecr=14116867"
"254","13.312978","10.10.10.6","74.120.8.2","NTP","90","NTP Version 4, client"
"255","13.313144","10.10.10.6","85.220.190.246","NTP","90","NTP Version 4, client"
"256","13.313331","10.10.10.6","94.23.210.194","NTP","90","NTP Version 4, client"
"257","13.315265","85.220.190.246","10.10.10.6","NTP","90","NTP Version 4, server"
"258","13.327047","94.23.210.194","10.10.10.6","NTP","90","NTP Version 4, server"
"259","13.450650","74.120.8.2","10.10.10.6","NTP","90","NTP Version 4, server"
"260","13.482067","DavidEle_06:08:ba","PhilipsL_24:76:ff","ARP","42","Who has 10.10.10.6? Tell 10.10.10.1"
"261","13.482330","PhilipsL_24:76:ff","DavidEle_06:08:ba","ARP","60","10.10.10.6 is at 00:17:88:24:76:ff"
"262","13.956847","10.10.10.30","10.10.10.6","TCP","74","56500  >  80 [SYN] Seq=0 Win=65535 Len=0 MSS=1460 SACK_PERM=1 TSval=14117068 TSecr=0 WS=128"
"263","13.957262","10.10.10.6","10.10.10.30","TCP","74","80  >  56500 [SYN, ACK] Seq=0 Ack=1 Win=28960 Len=0 MSS=1460 SACK_PERM=1 TSval=4294941398 TSecr=14117068 WS=8"
"264","13.959768","10.10.10.30","10.10.10.6","TCP","66","56500  >  80 [ACK] Seq=1 Ack=1 Win=87680 Len=0 TSval=14117069 TSecr=4294941398"
"265","13.962837","10.10.10.30","10.10.10.6","HTTP","335","POST /api/ HTTP/1.1  (application/x-www-form-urlencoded)"
"266","13.963167","10.10.10.6","10.10.10.30","TCP","66","80  >  56500 [ACK] Seq=1 Ack=270 Win=30032 Len=0 TSval=4294941399 TSecr=14117070"
"267","13.964015","10.10.10.6","10.10.10.30","TCP","83","80  >  56500 [PSH, ACK] Seq=1 Ack=270 Win=30032 Len=17 TSval=4294941399 TSecr=14117070 [TCP segment of a reassembled PDU]"
"268","13.964532","10.10.10.6","10.10.10.30","HTTP","548","HTTP/1.1 200 OK  (application/json)"
"269","13.966084","10.10.10.30","10.10.10.6","TCP","66","56500  >  80 [ACK] Seq=270 Ack=18 Win=87680 Len=0 TSval=14117070 TSecr=4294941399"
"270","13.969062","10.10.10.30","10.10.10.6","TCP","66","56500  >  80 [FIN, ACK] Seq=270 Ack=501 Win=88704 Len=0 TSval=14117071 TSecr=4294941399"
"271","13.969295","10.10.10.6","10.10.10.30","TCP","66","80  >  56500 [ACK] Seq=501 Ack=271 Win=30032 Len=0 TSval=4294941399 TSecr=14117071"
"272","14.452858","10.10.10.6","74.120.8.2","NTP","90","NTP Version 4, client"
"273","14.452967","10.10.10.6","185.11.138.90","NTP","90","NTP Version 4, client"
"274","14.459996","185.11.138.90","10.10.10.6","NTP","90","NTP Version 4, server"
"275","14.593781","74.120.8.2","10.10.10.6","NTP","90","NTP Version 4, server"
"276","14.976827","10.10.10.30","10.10.10.6","TCP","74","49911  >  80 [SYN] Seq=0 Win=65535 Len=0 MSS=1460 SACK_PERM=1 TSval=14117272 TSecr=0 WS=128"
"277","14.977205","10.10.10.6","10.10.10.30","TCP","74","80  >  49911 [SYN, ACK] Seq=0 Ack=1 Win=28960 Len=0 MSS=1460 SACK_PERM=1 TSval=4294941500 TSecr=14117272 WS=8"
"278","14.980019","10.10.10.30","10.10.10.6","TCP","66","49911  >  80 [ACK] Seq=1 Ack=1 Win=87680 Len=0 TSval=14117273 TSecr=4294941500"
"279","14.984112","10.10.10.30","10.10.10.6","HTTP","335","POST /api/ HTTP/1.1  (application/x-www-form-urlencoded)"
