"No.","Time","Source","Destination","Protocol","Length","Info"
"1","0.000000","10.10.10.30","10.10.10.6","TCP","74","60364  >  80 [SYN] Seq=0 Win=65535 Len=0 MSS=1460 SACK_PERM=1 TSval=14249025 TSecr=0 WS=128"
"2","0.005550","10.10.10.30","10.10.10.6","TCP","66","60364  >  80 [ACK] Seq=1 Ack=1 Win=87680 Len=0 TSval=14249028 TSecr=40081"
"3","0.007338","10.10.10.30","10.10.10.6","HTTP","258","GET /api/59df4532a5f9c15ff500b552b69bbc HTTP/1.1 "
"4","0.007628","10.10.10.6","10.10.10.30","TCP","66","80  >  60364 [ACK] Seq=1 Ack=193 Win=3754 Len=0 TSval=40082 TSecr=14249029"
"5","0.008434","10.10.10.6","10.10.10.30","TCP","83","80  >  60364 [PSH, ACK] Seq=1 Ack=193 Win=3754 Len=17 TSval=40082 TSecr=14249029 [TCP segment of a reassembled PDU]"
"6","0.012951","10.10.10.30","10.10.10.6","TCP","66","60364  >  80 [ACK] Seq=193 Ack=18 Win=87680 Len=0 TSval=14249030 TSecr=40082"
"7","0.013426","10.10.10.6","10.10.10.30","TCP","1115","HTTP/1.1 200 OK  [TCP segment of a reassembled PDU]"
"8","0.017003","10.10.10.6","10.10.10.30","TCP","1514","80  >  60364 [ACK] Seq=1067 Ack=193 Win=3754 Len=1448 TSval=40083 TSecr=14249030 [TCP segment of a reassembled PDU]"
"9","0.017003","10.10.10.6","10.10.10.30","HTTP","81","Continuation"
"10","0.026434","10.10.10.6","10.10.10.30","TCP","81","[TCP Retransmission] 80  >  60364 [FIN, PSH, ACK] Seq=2515 Ack=193 Win=3754 Len=15 TSval=40084 TSecr=14249030"
"11","0.040559","10.10.10.30","10.10.10.6","TCP","66","60364  >  80 [ACK] Seq=193 Ack=1067 Win=89728 Len=0 TSval=14249032 TSecr=40082"
"12","0.040631","10.10.10.30","10.10.10.6","TCP","66","60364  >  80 [ACK] Seq=193 Ack=2515 Win=92672 Len=0 TSval=14249035 TSecr=40083"
"13","0.041708","10.10.10.30","10.10.10.6","TCP","66","60364  >  80 [FIN, ACK] Seq=193 Ack=2531 Win=92672 Len=0 TSval=14249035 TSecr=40083"
"14","0.041902","10.10.10.6","10.10.10.30","TCP","66","80  >  60364 [ACK] Seq=2531 Ack=194 Win=3754 Len=0 TSval=40085 TSecr=14249035"
"15","0.042048","10.10.10.30","10.10.10.6","TCP","78","[TCP Dup ACK 13#1] 60364  >  80 [ACK] Seq=194 Ack=2531 Win=92672 Len=0 TSval=14249035 TSecr=40084 SLE=2515 SRE=2531"
"16","0.332952","10.10.10.30","10.10.10.6","TCP","74","57740  >  80 [SYN] Seq=0 Win=65535 Len=0 MSS=1460 SACK_PERM=1 TSval=14249092 TSecr=0 WS=128"
"17","0.333367","10.10.10.6","10.10.10.30","TCP","74","80  >  57740 [SYN, ACK] Seq=0 Ack=1 Win=28960 Len=0 MSS=1460 SACK_PERM=1 TSval=40114 TSecr=14249092 WS=8"
"18","0.337362","10.10.10.30","10.10.10.6","TCP","66","57740  >  80 [ACK] Seq=1 Ack=1 Win=87680 Len=0 TSval=14249095 TSecr=40114"
"19","0.338601","10.10.10.30","10.10.10.6","HTTP","266","GET /api/59df4532a5f9c15ff500b552b69bbc/sensors HTTP/1.1 "
"20","0.338909","10.10.10.6","10.10.10.30","TCP","66","80  >  57740 [ACK] Seq=1 Ack=201 Win=30032 Len=0 TSval=40115 TSecr=14249095"
"21","0.339736","10.10.10.6","10.10.10.30","TCP","83","80  >  57740 [PSH, ACK] Seq=1 Ack=201 Win=30032 Len=17 TSval=40115 TSecr=14249095 [TCP segment of a reassembled PDU]"
"22","0.340769","10.10.10.6","10.10.10.30","HTTP","713","HTTP/1.1 200 OK  (application/json)"
"23","0.344711","10.10.10.30","10.10.10.6","TCP","66","57740  >  80 [ACK] Seq=201 Ack=18 Win=87680 Len=0 TSval=14249096 TSecr=40115"
"24","0.345721","10.10.10.30","10.10.10.6","TCP","66","57740  >  80 [ACK] Seq=201 Ack=666 Win=88960 Len=0 TSval=14249096 TSecr=40115"
"25","0.348733","10.10.10.30","10.10.10.6","TCP","66","57740  >  80 [FIN, ACK] Seq=201 Ack=666 Win=88960 Len=0 TSval=14249097 TSecr=40115"
"26","0.349046","10.10.10.6","10.10.10.30","TCP","66","80  >  57740 [ACK] Seq=666 Ack=202 Win=30032 Len=0 TSval=40116 TSecr=14249097"
"27","0.840730","10.10.10.30","10.10.10.6","TCP","74","48283  >  80 [SYN] Seq=0 Win=65535 Len=0 MSS=1460 SACK_PERM=1 TSval=14249193 TSecr=0 WS=128"
"28","0.841133","10.10.10.6","10.10.10.30","TCP","74","80  >  48283 [SYN, ACK] Seq=0 Ack=1 Win=28960 Len=0 MSS=1460 SACK_PERM=1 TSval=40165 TSecr=14249193 WS=8"
"29","0.845130","10.10.10.30","10.10.10.6","TCP","66","48283  >  80 [ACK] Seq=1 Ack=1 Win=87680 Len=0 TSval=14249196 TSecr=40165"
"30","0.848250","10.10.10.30","10.10.10.6","HTTP","266","GET /api/59df4532a5f9c15ff500b552b69bbc/sensors HTTP/1.1 "
"31","0.848559","10.10.10.6","10.10.10.30","TCP","66","80  >  48283 [ACK] Seq=1 Ack=201 Win=30032 Len=0 TSval=40166 TSecr=14249197"
"32","0.849356","10.10.10.6","10.10.10.30","TCP","83","80  >  48283 [PSH, ACK] Seq=1 Ack=201 Win=30032 Len=17 TSval=40166 TSecr=14249197 [TCP segment of a reassembled PDU]"
"33","0.850364","10.10.10.6","10.10.10.30","HTTP","713","HTTP/1.1 200 OK  (application/json)"
"34","0.854345","10.10.10.30","10.10.10.6","TCP","66","48283  >  80 [ACK] Seq=201 Ack=18 Win=87680 Len=0 TSval=14249198 TSecr=40166"
"35","0.856050","10.10.10.30","10.10.10.6","TCP","66","48283  >  80 [ACK] Seq=201 Ack=666 Win=88960 Len=0 TSval=14249198 TSecr=40166"
"36","0.862469","10.10.10.30","10.10.10.6","TCP","66","48283  >  80 [FIN, ACK] Seq=201 Ack=666 Win=88960 Len=0 TSval=14249199 TSecr=40166"
"37","0.862721","10.10.10.6","10.10.10.30","TCP","66","80  >  48283 [ACK] Seq=666 Ack=202 Win=30032 Len=0 TSval=40167 TSecr=14249199"
"38","1.340472","10.10.10.30","10.10.10.6","TCP","74","54678  >  80 [SYN] Seq=0 Win=65535 Len=0 MSS=1460 SACK_PERM=1 TSval=14249293 TSecr=0 WS=128"
"39","1.340915","10.10.10.6","10.10.10.30","TCP","74","80  >  54678 [SYN, ACK] Seq=0 Ack=1 Win=28960 Len=0 MSS=1460 SACK_PERM=1 TSval=40215 TSecr=14249293 WS=8"
"40","1.344254","10.10.10.30","10.10.10.6","TCP","66","54678  >  80 [ACK] Seq=1 Ack=1 Win=87680 Len=0 TSval=14249296 TSecr=40215"
"41","1.347169","10.10.10.30","10.10.10.6","HTTP","266","GET /api/59df4532a5f9c15ff500b552b69bbc/sensors HTTP/1.1 "
"42","1.347489","10.10.10.6","10.10.10.30","TCP","66","80  >  54678 [ACK] Seq=1 Ack=201 Win=30032 Len=0 TSval=40216 TSecr=14249296"
"43","1.348284","10.10.10.6","10.10.10.30","TCP","83","80  >  54678 [PSH, ACK] Seq=1 Ack=201 Win=30032 Len=17 TSval=40216 TSecr=14249296 [TCP segment of a reassembled PDU]"
"44","1.349291","10.10.10.6","10.10.10.30","HTTP","713","HTTP/1.1 200 OK  (application/json)"
"45","1.351113","10.10.10.30","10.10.10.6","TCP","66","54678  >  80 [ACK] Seq=201 Ack=18 Win=87680 Len=0 TSval=14249297 TSecr=40216"
"46","1.352332","10.10.10.30","10.10.10.6","TCP","66","54678  >  80 [ACK] Seq=201 Ack=666 Win=88960 Len=0 TSval=14249298 TSecr=40216"
"47","1.358219","10.10.10.30","10.10.10.6","TCP","66","54678  >  80 [FIN, ACK] Seq=201 Ack=666 Win=88960 Len=0 TSval=14249299 TSecr=40216"
"48","1.358515","10.10.10.6","10.10.10.30","TCP","66","80  >  54678 [ACK] Seq=666 Ack=202 Win=30032 Len=0 TSval=40217 TSecr=14249299"
"49","1.841390","10.10.10.30","10.10.10.6","TCP","74","46083  >  80 [SYN] Seq=0 Win=65535 Len=0 MSS=1460 SACK_PERM=1 TSval=14249394 TSecr=0 WS=128"
"50","1.841715","10.10.10.6","10.10.10.30","TCP","74","80  >  46083 [SYN, ACK] Seq=0 Ack=1 Win=28960 Len=0 MSS=1460 SACK_PERM=1 TSval=40265 TSecr=14249394 WS=8"
"51","1.846000","10.10.10.30","10.10.10.6","TCP","66","46083  >  80 [ACK] Seq=1 Ack=1 Win=87680 Len=0 TSval=14249396 TSecr=40265"
"52","1.848689","10.10.10.30","10.10.10.6","HTTP","266","GET /api/59df4532a5f9c15ff500b552b69bbc/sensors HTTP/1.1 "
"53","1.848941","10.10.10.6","10.10.10.30","TCP","66","80  >  46083 [ACK] Seq=1 Ack=201 Win=30032 Len=0 TSval=40266 TSecr=14249397"
"54","1.849745","10.10.10.6","10.10.10.30","TCP","83","80  >  46083 [PSH, ACK] Seq=1 Ack=201 Win=30032 Len=17 TSval=40266 TSecr=14249397 [TCP segment of a reassembled PDU]"
"55","1.850863","10.10.10.6","10.10.10.30","HTTP","713","HTTP/1.1 200 OK  (application/json)"
"56","1.852906","10.10.10.30","10.10.10.6","TCP","66","46083  >  80 [ACK] Seq=201 Ack=18 Win=87680 Len=0 TSval=14249398 TSecr=40266"
"57","1.854012","10.10.10.30","10.10.10.6","TCP","66","46083  >  80 [ACK] Seq=201 Ack=666 Win=88960 Len=0 TSval=14249398 TSecr=40266"
"58","1.860032","10.10.10.30","10.10.10.6","TCP","66","46083  >  80 [FIN, ACK] Seq=201 Ack=666 Win=88960 Len=0 TSval=14249399 TSecr=40266"
"59","1.860297","10.10.10.6","10.10.10.30","TCP","66","80  >  46083 [ACK] Seq=666 Ack=202 Win=30032 Len=0 TSval=40267 TSecr=14249399"
"60","2.341331","10.10.10.30","10.10.10.6","TCP","74","39689  >  80 [SYN] Seq=0 Win=65535 Len=0 MSS=1460 SACK_PERM=1 TSval=14249494 TSecr=0 WS=128"
"61","2.341771","10.10.10.6","10.10.10.30","TCP","74","80  >  39689 [SYN, ACK] Seq=0 Ack=1 Win=28960 Len=0 MSS=1460 SACK_PERM=1 TSval=40315 TSecr=14249494 WS=8"
"62","2.345496","10.10.10.30","10.10.10.6","TCP","66","39689  >  80 [ACK] Seq=1 Ack=1 Win=87680 Len=0 TSval=14249496 TSecr=40315"
"63","2.348770","10.10.10.30","10.10.10.6","HTTP","266","GET /api/59df4532a5f9c15ff500b552b69bbc/sensors HTTP/1.1 "
"64","2.349069","10.10.10.6","10.10.10.30","TCP","66","80  >  39689 [ACK] Seq=1 Ack=201 Win=30032 Len=0 TSval=40316 TSecr=14249497"
"65","2.349811","10.10.10.6","10.10.10.30","TCP","83","80  >  39689 [PSH, ACK] Seq=1 Ack=201 Win=30032 Len=17 TSval=40316 TSecr=14249497 [TCP segment of a reassembled PDU]"
"66","2.350973","10.10.10.6","10.10.10.30","HTTP","713","HTTP/1.1 200 OK  (application/json)"
"67","2.352217","10.10.10.30","10.10.10.6","TCP","66","39689  >  80 [ACK] Seq=201 Ack=18 Win=87680 Len=0 TSval=14249498 TSecr=40316"
"68","2.354060","10.10.10.30","10.10.10.6","TCP","66","39689  >  80 [ACK] Seq=201 Ack=666 Win=88960 Len=0 TSval=14249498 TSecr=40316"
"69","2.360143","10.10.10.30","10.10.10.6","TCP","66","39689  >  80 [FIN, ACK] Seq=201 Ack=666 Win=88960 Len=0 TSval=14249499 TSecr=40316"
"70","2.360448","10.10.10.6","10.10.10.30","TCP","66","80  >  39689 [ACK] Seq=666 Ack=202 Win=30032 Len=0 TSval=40317 TSecr=14249499"
"71","2.837023","10.10.10.30","10.10.10.6","TCP","74","58493  >  80 [SYN] Seq=0 Win=65535 Len=0 MSS=1460 SACK_PERM=1 TSval=14249593 TSecr=0 WS=128"
"72","2.837436","10.10.10.6","10.10.10.30","TCP","74","80  >  58493 [SYN, ACK] Seq=0 Ack=1 Win=28960 Len=0 MSS=1460 SACK_PERM=1 TSval=40365 TSecr=14249593 WS=8"
"73","2.839915","10.10.10.30","10.10.10.6","TCP","66","58493  >  80 [ACK] Seq=1 Ack=1 Win=87680 Len=0 TSval=14249595 TSecr=40365"
"74","2.841817","10.10.10.30","10.10.10.6","HTTP","266","GET /api/59df4532a5f9c15ff500b552b69bbc/sensors HTTP/1.1 "
"75","2.842131","10.10.10.6","10.10.10.30","TCP","66","80  >  58493 [ACK] Seq=1 Ack=201 Win=30032 Len=0 TSval=40365 TSecr=14249595"
"76","2.842901","10.10.10.6","10.10.10.30","TCP","83","80  >  58493 [PSH, ACK] Seq=1 Ack=201 Win=30032 Len=17 TSval=40365 TSecr=14249595 [TCP segment of a reassembled PDU]"
"77","2.843995","10.10.10.6","10.10.10.30","HTTP","713","HTTP/1.1 200 OK  (application/json)"
"78","2.845444","10.10.10.30","10.10.10.6","TCP","66","58493  >  80 [ACK] Seq=201 Ack=18 Win=87680 Len=0 TSval=14249596 TSecr=40365"
"79","2.846743","10.10.10.30","10.10.10.6","TCP","66","58493  >  80 [ACK] Seq=201 Ack=666 Win=88960 Len=0 TSval=14249596 TSecr=40365"
"80","2.850434","10.10.10.30","10.10.10.6","TCP","66","58493  >  80 [FIN, ACK] Seq=201 Ack=666 Win=88960 Len=0 TSval=14249597 TSecr=40365"
"81","2.850745","10.10.10.6","10.10.10.30","TCP","66","80  >  58493 [ACK] Seq=666 Ack=202 Win=30032 Len=0 TSval=40366 TSecr=14249597"
"82","3.257683","10.10.10.6","85.220.190.246","NTP","90","NTP Version 4, client"
"83","3.257770","10.10.10.6","185.11.138.90","NTP","90","NTP Version 4, client"
"84","3.259806","85.220.190.246","10.10.10.6","NTP","90","NTP Version 4, server"
"85","3.264718","185.11.138.90","10.10.10.6","NTP","90","NTP Version 4, server"
"86","3.341866","10.10.10.30","10.10.10.6","TCP","74","48422  >  80 [SYN] Seq=0 Win=65535 Len=0 MSS=1460 SACK_PERM=1 TSval=14249694 TSecr=0 WS=128"
"87","3.342238","10.10.10.6","10.10.10.30","TCP","74","80  >  48422 [SYN, ACK] Seq=0 Ack=1 Win=28960 Len=0 MSS=1460 SACK_PERM=1 TSval=40415 TSecr=14249694 WS=8"
"88","3.345442","10.10.10.30","10.10.10.6","TCP","66","48422  >  80 [ACK] Seq=1 Ack=1 Win=87680 Len=0 TSval=14249696 TSecr=40415"
"89","3.348407","10.10.10.30","10.10.10.6","HTTP","266","GET /api/59df4532a5f9c15ff500b552b69bbc/sensors HTTP/1.1 "
"90","3.348716","10.10.10.6","10.10.10.30","TCP","66","80  >  48422 [ACK] Seq=1 Ack=201 Win=30032 Len=0 TSval=40416 TSecr=14249697"
"91","3.349457","10.10.10.6","10.10.10.30","TCP","83","80  >  48422 [PSH, ACK] Seq=1 Ack=201 Win=30032 Len=17 TSval=40416 TSecr=14249697 [TCP segment of a reassembled PDU]"
"92","3.350595","10.10.10.6","10.10.10.30","HTTP","713","HTTP/1.1 200 OK  (application/json)"
"93","3.351689","10.10.10.30","10.10.10.6","TCP","66","48422  >  80 [ACK] Seq=201 Ack=18 Win=87680 Len=0 TSval=14249697 TSecr=40416"
"94","3.353838","10.10.10.30","10.10.10.6","TCP","66","48422  >  80 [ACK] Seq=201 Ack=666 Win=88960 Len=0 TSval=14249698 TSecr=40416"
"95","3.359683","10.10.10.30","10.10.10.6","TCP","66","48422  >  80 [FIN, ACK] Seq=201 Ack=666 Win=88960 Len=0 TSval=14249699 TSecr=40416"
"96","3.359997","10.10.10.6","10.10.10.30","TCP","66","80  >  48422 [ACK] Seq=666 Ack=202 Win=30032 Len=0 TSval=40417 TSecr=14249699"
"97","3.841188","10.10.10.30","10.10.10.6","TCP","74","34336  >  80 [SYN] Seq=0 Win=65535 Len=0 MSS=1460 SACK_PERM=1 TSval=14249793 TSecr=0 WS=128"
"98","3.841557","10.10.10.6","10.10.10.30","TCP","74","80  >  34336 [SYN, ACK] Seq=0 Ack=1 Win=28960 Len=0 MSS=1460 SACK_PERM=1 TSval=40465 TSecr=14249793 WS=8"
"99","3.844755","10.10.10.30","10.10.10.6","TCP","66","34336  >  80 [ACK] Seq=1 Ack=1 Win=87680 Len=0 TSval=14249796 TSecr=40465"
"100","3.847828","10.10.10.30","10.10.10.6","HTTP","266","GET /api/59df4532a5f9c15ff500b552b69bbc/sensors HTTP/1.1 "
"101","3.848137","10.10.10.6","10.10.10.30","TCP","66","80  >  34336 [ACK] Seq=1 Ack=201 Win=30032 Len=0 TSval=40466 TSecr=14249797"
"102","3.848872","10.10.10.6","10.10.10.30","TCP","83","80  >  34336 [PSH, ACK] Seq=1 Ack=201 Win=30032 Len=17 TSval=40466 TSecr=14249797 [TCP segment of a reassembled PDU]"
"103","3.850002","10.10.10.6","10.10.10.30","HTTP","713","HTTP/1.1 200 OK  (application/json)"
"104","3.851109","10.10.10.30","10.10.10.6","TCP","66","34336  >  80 [ACK] Seq=201 Ack=18 Win=87680 Len=0 TSval=14249797 TSecr=40466"
"105","3.852924","10.10.10.30","10.10.10.6","TCP","66","34336  >  80 [ACK] Seq=201 Ack=666 Win=88960 Len=0 TSval=14249798 TSecr=40466"
"106","3.858942","10.10.10.30","10.10.10.6","TCP","66","34336  >  80 [FIN, ACK] Seq=201 Ack=666 Win=88960 Len=0 TSval=14249799 TSecr=40466"
"107","3.859242","10.10.10.6","10.10.10.30","TCP","66","80  >  34336 [ACK] Seq=666 Ack=202 Win=30032 Len=0 TSval=40467 TSecr=14249799"
"108","4.341545","10.10.10.30","10.10.10.6","TCP","74","59618  >  80 [SYN] Seq=0 Win=65535 Len=0 MSS=1460 SACK_PERM=1 TSval=14249894 TSecr=0 WS=128"
"109","4.341965","10.10.10.6","10.10.10.30","TCP","74","80  >  59618 [SYN, ACK] Seq=0 Ack=1 Win=28960 Len=0 MSS=1460 SACK_PERM=1 TSval=40515 TSecr=14249894 WS=8"
"110","4.345137","10.10.10.30","10.10.10.6","TCP","66","59618  >  80 [ACK] Seq=1 Ack=1 Win=87680 Len=0 TSval=14249896 TSecr=40515"
"111","4.348058","10.10.10.30","10.10.10.6","HTTP","266","GET /api/59df4532a5f9c15ff500b552b69bbc/sensors HTTP/1.1 "
"112","4.348387","10.10.10.6","10.10.10.30","TCP","66","80  >  59618 [ACK] Seq=1 Ack=201 Win=30032 Len=0 TSval=40516 TSecr=14249897"
"113","4.349131","10.10.10.6","10.10.10.30","TCP","83","80  >  59618 [PSH, ACK] Seq=1 Ack=201 Win=30032 Len=17 TSval=40516 TSecr=14249897 [TCP segment of a reassembled PDU]"
"114","4.350172","10.10.10.6","10.10.10.30","HTTP","713","HTTP/1.1 200 OK  (application/json)"
"115","4.351242","10.10.10.30","10.10.10.6","TCP","66","59618  >  80 [ACK] Seq=201 Ack=18 Win=87680 Len=0 TSval=14249897 TSecr=40516"
"116","4.353625","10.10.10.30","10.10.10.6","TCP","66","59618  >  80 [ACK] Seq=201 Ack=666 Win=88960 Len=0 TSval=14249898 TSecr=40516"
"117","4.359646","10.10.10.30","10.10.10.6","TCP","66","59618  >  80 [FIN, ACK] Seq=201 Ack=666 Win=88960 Len=0 TSval=14249899 TSecr=40516"
"118","4.359944","10.10.10.6","10.10.10.30","TCP","66","80  >  59618 [ACK] Seq=666 Ack=202 Win=30032 Len=0 TSval=40517 TSecr=14249899"
"119","4.842846","10.10.10.30","10.10.10.6","TCP","74","54412  >  80 [SYN] Seq=0 Win=65535 Len=0 MSS=1460 SACK_PERM=1 TSval=14249994 TSecr=0 WS=128"
"120","4.843240","10.10.10.6","10.10.10.30","TCP","74","80  >  54412 [SYN, ACK] Seq=0 Ack=1 Win=28960 Len=0 MSS=1460 SACK_PERM=1 TSval=40565 TSecr=14249994 WS=8"
"121","4.846351","10.10.10.30","10.10.10.6","TCP","66","54412  >  80 [ACK] Seq=1 Ack=1 Win=87680 Len=0 TSval=14249996 TSecr=40565"
"122","4.849859","10.10.10.30","10.10.10.6","HTTP","266","GET /api/59df4532a5f9c15ff500b552b69bbc/sensors HTTP/1.1 "
"123","4.850164","10.10.10.6","10.10.10.30","TCP","66","80  >  54412 [ACK] Seq=1 Ack=201 Win=30032 Len=0 TSval=40566 TSecr=14249997"
"124","4.850944","10.10.10.6","10.10.10.30","TCP","83","80  >  54412 [PSH, ACK] Seq=1 Ack=201 Win=30032 Len=17 TSval=40566 TSecr=14249997 [TCP segment of a reassembled PDU]"
"125","4.852059","10.10.10.6","10.10.10.30","HTTP","713","HTTP/1.1 200 OK  (application/json)"
"126","4.856334","10.10.10.30","10.10.10.6","TCP","66","54412  >  80 [ACK] Seq=201 Ack=18 Win=87680 Len=0 TSval=14249998 TSecr=40566"
"127","4.857576","10.10.10.30","10.10.10.6","TCP","66","54412  >  80 [ACK] Seq=201 Ack=666 Win=88960 Len=0 TSval=14249999 TSecr=40566"
"128","4.864995","10.10.10.30","10.10.10.6","TCP","66","54412  >  80 [FIN, ACK] Seq=201 Ack=666 Win=88960 Len=0 TSval=14250000 TSecr=40566"
"129","4.865291","10.10.10.6","10.10.10.30","TCP","66","80  >  54412 [ACK] Seq=666 Ack=202 Win=30032 Len=0 TSval=40567 TSecr=14250000"
"130","5.092136","10.10.10.6","239.255.255.250","SSDP","348","NOTIFY * HTTP/1.1 "
"131","5.143297","10.10.10.6","239.255.255.250","SSDP","348","NOTIFY * HTTP/1.1 "
"132","5.194574","10.10.10.6","239.255.255.250","SSDP","357","NOTIFY * HTTP/1.1 "
"133","5.245847","10.10.10.6","239.255.255.250","SSDP","357","NOTIFY * HTTP/1.1 "
"134","5.297170","10.10.10.6","239.255.255.250","SSDP","351","NOTIFY * HTTP/1.1 "
"135","5.348419","10.10.10.6","239.255.255.250","SSDP","351","NOTIFY * HTTP/1.1 "
"136","6.267732","10.10.10.6","94.23.210.194","NTP","90","NTP Version 4, client"
"137","6.281742","94.23.210.194","10.10.10.6","NTP","90","NTP Version 4, server"
"138","7.283872","10.10.10.6","74.120.8.2","NTP","90","NTP Version 4, client"
"139","7.425186","74.120.8.2","10.10.10.6","NTP","90","NTP Version 4, server"
"140","7.700028","10.10.10.30","10.10.10.6","TCP","74","41850  >  80 [SYN] Seq=0 Win=65535 Len=0 MSS=1460 SACK_PERM=1 TSval=14250566 TSecr=0 WS=128"
"141","7.700462","10.10.10.6","10.10.10.30","TCP","74","80  >  41850 [SYN, ACK] Seq=0 Ack=1 Win=28960 Len=0 MSS=1460 SACK_PERM=1 TSval=40851 TSecr=14250566 WS=8"
"142","7.702361","10.10.10.30","10.10.10.6","TCP","66","41850  >  80 [ACK] Seq=1 Ack=1 Win=87680 Len=0 TSval=14250568 TSecr=40851"
"143","7.703593","10.10.10.30","10.10.10.6","HTTP","336","POST /api/59df4532a5f9c15ff500b552b69bbc/sensors/ HTTP/1.1 "
"144","7.703899","10.10.10.6","10.10.10.30","TCP","66","80  >  41850 [ACK] Seq=1 Ack=271 Win=30032 Len=0 TSval=40851 TSecr=14250568"
"145","7.704922","10.10.10.6","10.10.10.30","TCP","83","80  >  41850 [PSH, ACK] Seq=1 Ack=271 Win=30032 Len=17 TSval=40851 TSecr=14250568 [TCP segment of a reassembled PDU]"
"146","7.705855","10.10.10.6","10.10.10.30","HTTP","524","HTTP/1.1 200 OK  (application/json)"
"147","7.706301","10.10.10.30","10.10.10.6","TCP","66","41850  >  80 [ACK] Seq=271 Ack=18 Win=87680 Len=0 TSval=14250568 TSecr=40851"
"148","7.706562","10.10.10.6","10.10.10.30","TCP","524","[TCP Out-Of-Order] 80  >  41850 [FIN, PSH, ACK] Seq=18 Ack=271 Win=30032 Len=458 TSval=40852 TSecr=14250568[Reassembly error, protocol TCP: New fragment overlaps old data (retransmission?)]"
"149","7.707696","10.10.10.30","10.10.10.6","TCP","78","41850  >  80 [ACK] Seq=271 Ack=477 Win=88704 Len=0 TSval=14250569 TSecr=40852 SLE=18 SRE=477"
"150","7.708721","10.10.10.30","10.10.10.6","TCP","66","41850  >  80 [FIN, ACK] Seq=271 Ack=477 Win=88704 Len=0 TSval=14250569 TSecr=40852"
"151","7.708987","10.10.10.6","10.10.10.30","TCP","66","80  >  41850 [ACK] Seq=477 Ack=272 Win=30032 Len=0 TSval=40852 TSecr=14250569"
"152","7.715644","10.10.10.30","10.10.10.6","TCP","74","46474  >  80 [SYN] Seq=0 Win=65535 Len=0 MSS=1460 SACK_PERM=1 TSval=14250570 TSecr=0 WS=128"
"153","7.716087","10.10.10.6","10.10.10.30","TCP","74","80  >  46474 [SYN, ACK] Seq=0 Ack=1 Win=28960 Len=0 MSS=1460 SACK_PERM=1 TSval=40852 TSecr=14250570 WS=8"
"154","7.717507","10.10.10.30","10.10.10.6","TCP","66","46474  >  80 [ACK] Seq=1 Ack=1 Win=87680 Len=0 TSval=14250571 TSecr=40852"
"155","7.718336","10.10.10.30","10.10.10.6","HTTP","270","GET /api/59df4532a5f9c15ff500b552b69bbc/sensors/new HTTP/1.1 "
"156","7.718822","10.10.10.6","10.10.10.30","TCP","66","80  >  46474 [ACK] Seq=1 Ack=205 Win=30032 Len=0 TSval=40853 TSecr=14250571"
"157","7.719546","10.10.10.6","10.10.10.30","TCP","83","80  >  46474 [PSH, ACK] Seq=1 Ack=205 Win=30032 Len=17 TSval=40853 TSecr=14250571 [TCP segment of a reassembled PDU]"
"158","7.720448","10.10.10.6","10.10.10.30","HTTP","492","HTTP/1.1 200 OK  (application/json)"
"159","7.721010","10.10.10.30","10.10.10.6","TCP","66","46474  >  80 [ACK] Seq=205 Ack=18 Win=87680 Len=0 TSval=14250571 TSecr=40853"
"160","7.723031","10.10.10.30","10.10.10.6","TCP","66","46474  >  80 [FIN, ACK] Seq=205 Ack=445 Win=88704 Len=0 TSval=14250572 TSecr=40853"
"161","7.723284","10.10.10.6","10.10.10.30","TCP","66","80  >  46474 [ACK] Seq=445 Ack=206 Win=30032 Len=0 TSval=40853 TSecr=14250572"
"162","8.261981","DavidEle_06:08:ba","PhilipsL_24:76:ff","ARP","42","Who has 10.10.10.6? Tell 10.10.10.1"
"163","8.262271","PhilipsL_24:76:ff","DavidEle_06:08:ba","ARP","60","10.10.10.6 is at 00:17:88:24:76:ff"
"164","9.740521","10.10.10.30","10.10.10.6","TCP","74","36302  >  80 [SYN] Seq=0 Win=65535 Len=0 MSS=1460 SACK_PERM=1 TSval=14250973 TSecr=0 WS=128"
"165","9.740946","10.10.10.6","10.10.10.30","TCP","74","80  >  36302 [SYN, ACK] Seq=0 Ack=1 Win=28960 Len=0 MSS=1460 SACK_PERM=1 TSval=41055 TSecr=14250973 WS=8"
"166","9.743952","10.10.10.30","10.10.10.6","TCP","66","36302  >  80 [ACK] Seq=1 Ack=1 Win=87680 Len=0 TSval=14250976 TSecr=41055"
"167","9.747315","10.10.10.30","10.10.10.6","HTTP","270","GET /api/59df4532a5f9c15ff500b552b69bbc/sensors/new HTTP/1.1 "
"168","9.747628","10.10.10.6","10.10.10.30","TCP","66","80  >  36302 [ACK] Seq=1 Ack=205 Win=30032 Len=0 TSval=41056 TSecr=14250976"
"169","9.748417","10.10.10.6","10.10.10.30","TCP","83","80  >  36302 [PSH, ACK] Seq=1 Ack=205 Win=30032 Len=17 TSval=41056 TSecr=14250976 [TCP segment of a reassembled PDU]"
"170","9.749305","10.10.10.6","10.10.10.30","HTTP","492","HTTP/1.1 200 OK  (application/json)"
"171","9.751044","10.10.10.30","10.10.10.6","TCP","66","36302  >  80 [ACK] Seq=205 Ack=18 Win=87680 Len=0 TSval=14250977 TSecr=41056"
"172","9.757905","10.10.10.30","10.10.10.6","TCP","66","36302  >  80 [FIN, ACK] Seq=205 Ack=445 Win=88704 Len=0 TSval=14250979 TSecr=41056"
"173","9.758206","10.10.10.6","10.10.10.30","TCP","66","80  >  36302 [ACK] Seq=445 Ack=206 Win=30032 Len=0 TSval=41057 TSecr=14250979"
"174","10.005971","10.10.10.30","10.10.10.6","TCP","74","38315  >  80 [SYN] Seq=0 Win=65535 Len=0 MSS=1460 SACK_PERM=1 TSval=14251026 TSecr=0 WS=128"
"175","10.006410","10.10.10.6","10.10.10.30","TCP","74","80  >  38315 [SYN, ACK] Seq=0 Ack=1 Win=28960 Len=0 MSS=1460 SACK_PERM=1 TSval=41081 TSecr=14251026 WS=8"
"176","10.011326","10.10.10.30","10.10.10.6","TCP","66","38315  >  80 [ACK] Seq=1 Ack=1 Win=87680 Len=0 TSval=14251029 TSecr=41081"
"177","10.014057","10.10.10.30","10.10.10.6","HTTP","258","GET /api/59df4532a5f9c15ff500b552b69bbc HTTP/1.1 "
"178","10.014381","10.10.10.6","10.10.10.30","TCP","66","80  >  38315 [ACK] Seq=1 Ack=193 Win=30032 Len=0 TSval=41082 TSecr=14251030"
"179","10.015077","10.10.10.6","10.10.10.30","TCP","83","80  >  38315 [PSH, ACK] Seq=1 Ack=193 Win=30032 Len=17 TSval=41082 TSecr=14251030 [TCP segment of a reassembled PDU]"
"180","10.017902","10.10.10.30","10.10.10.6","TCP","66","38315  >  80 [ACK] Seq=193 Ack=18 Win=87680 Len=0 TSval=14251031 TSecr=41082"
"181","10.018380","10.10.10.6","10.10.10.30","TCP","931","HTTP/1.1 200 OK  [TCP segment of a reassembled PDU]"
"182","10.020408","10.10.10.30","10.10.10.6","TCP","66","38315  >  80 [ACK] Seq=193 Ack=883 Win=89344 Len=0 TSval=14251031 TSecr=41083"
"183","10.020795","10.10.10.6","10.10.10.30","TCP","250","80  >  38315 [PSH, ACK] Seq=883 Ack=193 Win=30032 Len=184 TSval=41083 TSecr=14251031 [TCP segment of a reassembled PDU]"
"184","10.024079","10.10.10.6","10.10.10.30","TCP","1514","80  >  38315 [ACK] Seq=1067 Ack=193 Win=30032 Len=1448 TSval=41083 TSecr=14251031 [TCP segment of a reassembled PDU]"
"185","10.024079","10.10.10.6","10.10.10.30","HTTP","81","Continuation"
"186","10.024987","10.10.10.30","10.10.10.6","TCP","66","38315  >  80 [ACK] Seq=193 Ack=1067 Win=91136 Len=0 TSval=14251032 TSecr=41083"
"187","10.026455","10.10.10.6","10.10.10.30","TCP","81","[TCP Out-Of-Order] 80  >  38315 [FIN, PSH, ACK] Seq=2515 Ack=193 Win=30032 Len=15 TSval=41084 TSecr=14251032[Reassembly error, protocol TCP: New fragment overlaps old data (retransmission?)]"
"188","10.028659","10.10.10.30","10.10.10.6","TCP","66","38315  >  80 [ACK] Seq=193 Ack=2515 Win=94080 Len=0 TSval=14251033 TSecr=41083"
"189","10.030396","10.10.10.30","10.10.10.6","TCP","66","38315  >  80 [FIN, ACK] Seq=193 Ack=2531 Win=94080 Len=0 TSval=14251033 TSecr=41083"
"190","10.030691","10.10.10.6","10.10.10.30","TCP","66","80  >  38315 [ACK] Seq=2531 Ack=194 Win=30032 Len=0 TSval=41084 TSecr=14251033"
"191","10.031133","10.10.10.30","10.10.10.6","TCP","78","[TCP Dup ACK 189#1] 38315  >  80 [ACK] Seq=194 Ack=2531 Win=94080 Len=0 TSval=14251033 TSecr=41084 SLE=2515 SRE=2531"
"192","11.778362","10.10.10.30","10.10.10.6","TCP","74","45252  >  80 [SYN] Seq=0 Win=65535 Len=0 MSS=1460 SACK_PERM=1 TSval=14251381 TSecr=0 WS=128"
"193","11.778795","10.10.10.6","10.10.10.30","TCP","74","80  >  45252 [SYN, ACK] Seq=0 Ack=1 Win=28960 Len=0 MSS=1460 SACK_PERM=1 TSval=41259 TSecr=14251381 WS=8"
"194","11.782448","10.10.10.30","10.10.10.6","TCP","66","45252  >  80 [ACK] Seq=1 Ack=1 Win=87680 Len=0 TSval=14251384 TSecr=41259"
"195","11.785468","10.10.10.30","10.10.10.6","HTTP","270","GET /api/59df4532a5f9c15ff500b552b69bbc/sensors/new HTTP/1.1 "
"196","11.785858","10.10.10.6","10.10.10.30","TCP","66","80  >  45252 [ACK] Seq=1 Ack=205 Win=30032 Len=0 TSval=41259 TSecr=14251384"
"197","11.786662","10.10.10.6","10.10.10.30","TCP","83","80  >  45252 [PSH, ACK] Seq=1 Ack=205 Win=30032 Len=17 TSval=41260 TSecr=14251384 [TCP segment of a reassembled PDU]"
"198","11.787517","10.10.10.6","10.10.10.30","HTTP","492","HTTP/1.1 200 OK  (application/json)"
"199","11.790028","10.10.10.30","10.10.10.6","TCP","66","45252  >  80 [ACK] Seq=205 Ack=18 Win=87680 Len=0 TSval=14251385 TSecr=41260"
"200","11.797281","10.10.10.30","10.10.10.6","TCP","66","45252  >  80 [FIN, ACK] Seq=205 Ack=445 Win=88704 Len=0 TSval=14251386 TSecr=41260"
"201","11.797658","10.10.10.6","10.10.10.30","TCP","66","80  >  45252 [ACK] Seq=445 Ack=206 Win=30032 Len=0 TSval=41261 TSecr=14251386"
"202","13.813174","10.10.10.30","10.10.10.6","TCP","74","40554  >  80 [SYN] Seq=0 Win=65535 Len=0 MSS=1460 SACK_PERM=1 TSval=14251788 TSecr=0 WS=128"
"203","13.813594","10.10.10.6","10.10.10.30","TCP","74","80  >  40554 [SYN, ACK] Seq=0 Ack=1 Win=28960 Len=0 MSS=1460 SACK_PERM=1 TSval=41462 TSecr=14251788 WS=8"
"204","13.815982","10.10.10.30","10.10.10.6","TCP","66","40554  >  80 [ACK] Seq=1 Ack=1 Win=87680 Len=0 TSval=14251790 TSecr=41462"
"205","13.817731","10.10.10.30","10.10.10.6","HTTP","270","GET /api/59df4532a5f9c15ff500b552b69bbc/sensors/new HTTP/1.1 "
"206","13.818066","10.10.10.6","10.10.10.30","TCP","66","80  >  40554 [ACK] Seq=1 Ack=205 Win=30032 Len=0 TSval=41463 TSecr=14251791"
"207","13.818835","10.10.10.6","10.10.10.30","TCP","83","80  >  40554 [PSH, ACK] Seq=1 Ack=205 Win=30032 Len=17 TSval=41463 TSecr=14251791 [TCP segment of a reassembled PDU]"
"208","13.819677","10.10.10.6","10.10.10.30","HTTP","492","HTTP/1.1 200 OK  (application/json)"
"209","13.820547","10.10.10.30","10.10.10.6","TCP","66","40554  >  80 [ACK] Seq=205 Ack=18 Win=87680 Len=0 TSval=14251791 TSecr=41463"
"210","13.824514","10.10.10.30","10.10.10.6","TCP","66","40554  >  80 [FIN, ACK] Seq=205 Ack=445 Win=88704 Len=0 TSval=14251792 TSecr=41463"
"211","13.824761","10.10.10.6","10.10.10.30","TCP","66","80  >  40554 [ACK] Seq=445 Ack=206 Win=30032 Len=0 TSval=41463 TSecr=14251792"
"212","15.841706","10.10.10.30","10.10.10.6","TCP","74","35477  >  80 [SYN] Seq=0 Win=65535 Len=0 MSS=1460 SACK_PERM=1 TSval=14252194 TSecr=0 WS=128"
"213","15.842126","10.10.10.6","10.10.10.30","TCP","74","80  >  35477 [SYN, ACK] Seq=0 Ack=1 Win=28960 Len=0 MSS=1460 SACK_PERM=1 TSval=41665 TSecr=14252194 WS=8"
"214","15.847451","10.10.10.30","10.10.10.6","TCP","66","35477  >  80 [ACK] Seq=1 Ack=1 Win=87680 Len=0 TSval=14252196 TSecr=41665"
"215","15.848673","10.10.10.30","10.10.10.6","HTTP","270","GET /api/59df4532a5f9c15ff500b552b69bbc/sensors/new HTTP/1.1 "
"216","15.848965","10.10.10.6","10.10.10.30","TCP","66","80  >  35477 [ACK] Seq=1 Ack=205 Win=30032 Len=0 TSval=41666 TSecr=14252197"
"217","15.849751","10.10.10.6","10.10.10.30","TCP","83","80  >  35477 [PSH, ACK] Seq=1 Ack=205 Win=30032 Len=17 TSval=41666 TSecr=14252197 [TCP segment of a reassembled PDU]"
"218","15.850690","10.10.10.6","10.10.10.30","HTTP","492","HTTP/1.1 200 OK  (application/json)"
"219","15.852947","10.10.10.30","10.10.10.6","TCP","66","35477  >  80 [ACK] Seq=205 Ack=18 Win=87680 Len=0 TSval=14252198 TSecr=41666"
"220","15.859850","10.10.10.30","10.10.10.6","TCP","66","35477  >  80 [FIN, ACK] Seq=205 Ack=445 Win=88704 Len=0 TSval=14252199 TSecr=41666"
"221","15.860143","10.10.10.6","10.10.10.30","TCP","66","80  >  35477 [ACK] Seq=445 Ack=206 Win=30032 Len=0 TSval=41667 TSecr=14252199"
"222","17.879512","10.10.10.30","10.10.10.6","TCP","74","33462  >  80 [SYN] Seq=0 Win=65535 Len=0 MSS=1460 SACK_PERM=1 TSval=14252601 TSecr=0 WS=128"
"223","17.879953","10.10.10.6","10.10.10.30","TCP","74","80  >  33462 [SYN, ACK] Seq=0 Ack=1 Win=28960 Len=0 MSS=1460 SACK_PERM=1 TSval=41869 TSecr=14252601 WS=8"
"224","17.883355","10.10.10.30","10.10.10.6","TCP","66","33462  >  80 [ACK] Seq=1 Ack=1 Win=87680 Len=0 TSval=14252604 TSecr=41869"
"225","17.886972","10.10.10.30","10.10.10.6","HTTP","270","GET /api/59df4532a5f9c15ff500b552b69bbc/sensors/new HTTP/1.1 "
"226","17.887304","10.10.10.6","10.10.10.30","TCP","66","80  >  33462 [ACK] Seq=1 Ack=205 Win=30032 Len=0 TSval=41870 TSecr=14252604"
"227","17.888011","10.10.10.6","10.10.10.30","TCP","83","80  >  33462 [PSH, ACK] Seq=1 Ack=205 Win=30032 Len=17 TSval=41870 TSecr=14252604 [TCP segment of a reassembled PDU]"
"228","17.889004","10.10.10.6","10.10.10.30","HTTP","492","HTTP/1.1 200 OK  (application/json)"
"229","17.890779","10.10.10.30","10.10.10.6","TCP","66","33462  >  80 [ACK] Seq=205 Ack=18 Win=87680 Len=0 TSval=14252605 TSecr=41870"
"230","17.897853","10.10.10.30","10.10.10.6","TCP","66","33462  >  80 [FIN, ACK] Seq=205 Ack=445 Win=88704 Len=0 TSval=14252607 TSecr=41870"
"231","17.898147","10.10.10.6","10.10.10.30","TCP","66","80  >  33462 [ACK] Seq=445 Ack=206 Win=30032 Len=0 TSval=41871 TSecr=14252607"
"232","19.916830","10.10.10.30","10.10.10.6","TCP","74","50141  >  80 [SYN] Seq=0 Win=65535 Len=0 MSS=1460 SACK_PERM=1 TSval=14253009 TSecr=0 WS=128"
"233","19.917261","10.10.10.6","10.10.10.30","TCP","74","80  >  50141 [SYN, ACK] Seq=0 Ack=1 Win=28960 Len=0 MSS=1460 SACK_PERM=1 TSval=42073 TSecr=14253009 WS=8"
"234","19.920666","10.10.10.30","10.10.10.6","TCP","66","50141  >  80 [ACK] Seq=1 Ack=1 Win=87680 Len=0 TSval=14253011 TSecr=42073"
"235","19.924570","10.10.10.30","10.10.10.6","HTTP","270","GET /api/59df4532a5f9c15ff500b552b69bbc/sensors/new HTTP/1.1 "
"236","19.924876","10.10.10.6","10.10.10.30","TCP","66","80  >  50141 [ACK] Seq=1 Ack=205 Win=30032 Len=0 TSval=42073 TSecr=14253012"
"237","19.925708","10.10.10.6","10.10.10.30","TCP","83","80  >  50141 [PSH, ACK] Seq=1 Ack=205 Win=30032 Len=17 TSval=42073 TSecr=14253012 [TCP segment of a reassembled PDU]"
"238","19.926644","10.10.10.6","10.10.10.30","HTTP","492","HTTP/1.1 200 OK  (application/json)"
"239","19.929257","10.10.10.30","10.10.10.6","TCP","66","50141  >  80 [ACK] Seq=205 Ack=18 Win=87680 Len=0 TSval=14253013 TSecr=42073"
"240","19.936014","10.10.10.30","10.10.10.6","TCP","66","50141  >  80 [FIN, ACK] Seq=205 Ack=445 Win=88704 Len=0 TSval=14253014 TSecr=42073"
"241","19.936298","10.10.10.6","10.10.10.30","TCP","66","80  >  50141 [ACK] Seq=445 Ack=206 Win=30032 Len=0 TSval=42074 TSecr=14253014"
"242","19.996969","10.10.10.30","10.10.10.6","TCP","74","58443  >  80 [SYN] Seq=0 Win=65535 Len=0 MSS=1460 SACK_PERM=1 TSval=14253026 TSecr=0 WS=128"
"243","19.997329","10.10.10.6","10.10.10.30","TCP","74","80  >  58443 [SYN, ACK] Seq=0 Ack=1 Win=28960 Len=0 MSS=1460 SACK_PERM=1 TSval=42081 TSecr=14253026 WS=8"
"244","20.000361","10.10.10.30","10.10.10.6","TCP","66","58443  >  80 [ACK] Seq=1 Ack=1 Win=87680 Len=0 TSval=14253027 TSecr=42081"
"245","20.003809","10.10.10.30","10.10.10.6","HTTP","258","GET /api/59df4532a5f9c15ff500b552b69bbc HTTP/1.1 "
"246","20.004085","10.10.10.6","10.10.10.30","TCP","66","80  >  58443 [ACK] Seq=1 Ack=193 Win=30032 Len=0 TSval=42081 TSecr=14253028"
"247","20.004912","10.10.10.6","10.10.10.30","TCP","83","80  >  58443 [PSH, ACK] Seq=1 Ack=193 Win=30032 Len=17 TSval=42081 TSecr=14253028 [TCP segment of a reassembled PDU]"
"248","20.007960","10.10.10.30","10.10.10.6","TCP","66","58443  >  80 [ACK] Seq=193 Ack=18 Win=87680 Len=0 TSval=14253029 TSecr=42081"
"249","20.008438","10.10.10.6","10.10.10.30","TCP","931","HTTP/1.1 200 OK  [TCP segment of a reassembled PDU]"
"250","20.010411","10.10.10.30","10.10.10.6","TCP","66","58443  >  80 [ACK] Seq=193 Ack=883 Win=89344 Len=0 TSval=14253029 TSecr=42082"
"251","20.010743","10.10.10.6","10.10.10.30","TCP","285","80  >  58443 [PSH, ACK] Seq=883 Ack=193 Win=30032 Len=219 TSval=42082 TSecr=14253029 [TCP segment of a reassembled PDU]"
"252","20.013445","10.10.10.30","10.10.10.6","TCP","66","58443  >  80 [ACK] Seq=193 Ack=1102 Win=91136 Len=0 TSval=14253030 TSecr=42082"
"253","20.013884","10.10.10.6","10.10.10.30","HTTP","1494","Continuation"
"254","20.015616","10.10.10.30","10.10.10.6","TCP","66","58443  >  80 [ACK] Seq=193 Ack=2531 Win=94080 Len=0 TSval=14253030 TSecr=42082"
"255","20.016225","10.10.10.30","10.10.10.6","TCP","66","58443  >  80 [FIN, ACK] Seq=193 Ack=2531 Win=94080 Len=0 TSval=14253030 TSecr=42082"
"256","20.016509","10.10.10.6","10.10.10.30","TCP","66","80  >  58443 [ACK] Seq=2531 Ack=194 Win=30032 Len=0 TSval=42082 TSecr=14253030"
"257","21.965981","10.10.10.30","10.10.10.6","TCP","74","33335  >  80 [SYN] Seq=0 Win=65535 Len=0 MSS=1460 SACK_PERM=1 TSval=14253416 TSecr=0 WS=128"
"258","21.966450","10.10.10.6","10.10.10.30","TCP","74","80  >  33335 [SYN, ACK] Seq=0 Ack=1 Win=28960 Len=0 MSS=1460 SACK_PERM=1 TSval=42277 TSecr=14253416 WS=8"
"259","21.969977","10.10.10.30","10.10.10.6","TCP","66","33335  >  80 [ACK] Seq=1 Ack=1 Win=87680 Len=0 TSval=14253421 TSecr=42277"
"260","21.982736","10.10.10.30","10.10.10.6","HTTP","270","GET /api/59df4532a5f9c15ff500b552b69bbc/sensors/new HTTP/1.1 "
"261","21.983067","10.10.10.6","10.10.10.30","TCP","66","80  >  33335 [ACK] Seq=1 Ack=205 Win=30032 Len=0 TSval=42279 TSecr=14253422"
"262","21.983914","10.10.10.6","10.10.10.30","TCP","83","80  >  33335 [PSH, ACK] Seq=1 Ack=205 Win=30032 Len=17 TSval=42279 TSecr=14253422 [TCP segment of a reassembled PDU]"
"263","21.984787","10.10.10.6","10.10.10.30","HTTP","492","HTTP/1.1 200 OK  (application/json)"
"264","21.988797","10.10.10.30","10.10.10.6","TCP","66","33335  >  80 [ACK] Seq=205 Ack=18 Win=87680 Len=0 TSval=14253425 TSecr=42279"
"265","21.994785","10.10.10.30","10.10.10.6","TCP","66","33335  >  80 [FIN, ACK] Seq=205 Ack=445 Win=88704 Len=0 TSval=14253426 TSecr=42279"
"266","21.995117","10.10.10.6","10.10.10.30","TCP","66","80  >  33335 [ACK] Seq=445 Ack=206 Win=30032 Len=0 TSval=42280 TSecr=14253426"
"267","24.009687","10.10.10.30","10.10.10.6","TCP","74","45264  >  80 [SYN] Seq=0 Win=65535 Len=0 MSS=1460 SACK_PERM=1 TSval=14253827 TSecr=0 WS=128"
"268","24.010114","10.10.10.6","10.10.10.30","TCP","74","80  >  45264 [SYN, ACK] Seq=0 Ack=1 Win=28960 Len=0 MSS=1460 SACK_PERM=1 TSval=42482 TSecr=14253827 WS=8"
"269","24.012666","10.10.10.30","10.10.10.6","TCP","66","45264  >  80 [ACK] Seq=1 Ack=1 Win=87680 Len=0 TSval=14253830 TSecr=42482"
"270","24.014185","10.10.10.30","10.10.10.6","HTTP","270","GET /api/59df4532a5f9c15ff500b552b69bbc/sensors/new HTTP/1.1 "
"271","24.014483","10.10.10.6","10.10.10.30","TCP","66","80  >  45264 [ACK] Seq=1 Ack=205 Win=30032 Len=0 TSval=42482 TSecr=14253830"
"272","24.015264","10.10.10.6","10.10.10.30","TCP","83","80  >  45264 [PSH, ACK] Seq=1 Ack=205 Win=30032 Len=17 TSval=42482 TSecr=14253830 [TCP segment of a reassembled PDU]"
"273","24.016436","10.10.10.6","10.10.10.30","HTTP","518","HTTP/1.1 200 OK  (application/json)"
"274","24.016688","10.10.10.6","10.10.10.30","TCP","518","[TCP Out-Of-Order] 80  >  45264 [FIN, PSH, ACK] Seq=18 Ack=205 Win=30032 Len=452 TSval=42483 TSecr=14253830[Reassembly error, protocol TCP: New fragment overlaps old data (retransmission?)]"
"275","24.017261","10.10.10.30","10.10.10.6","TCP","66","45264  >  80 [ACK] Seq=205 Ack=18 Win=87680 Len=0 TSval=14253831 TSecr=42482"
"276","24.020535","10.10.10.30","10.10.10.6","TCP","78","45264  >  80 [ACK] Seq=205 Ack=471 Win=88704 Len=0 TSval=14253831 TSecr=42483 SLE=18 SRE=471"
"277","24.020964","10.10.10.30","10.10.10.6","TCP","66","45264  >  80 [FIN, ACK] Seq=205 Ack=471 Win=88704 Len=0 TSval=14253831 TSecr=42483"
"278","24.021192","10.10.10.6","10.10.10.30","TCP","66","80  >  45264 [ACK] Seq=471 Ack=206 Win=30032 Len=0 TSval=42483 TSecr=14253831"
"279","24.028205","10.10.10.30","10.10.10.6","TCP","74","35974  >  80 [SYN] Seq=0 Win=65535 Len=0 MSS=1460 SACK_PERM=1 TSval=14253833 TSecr=0 WS=128"
"280","24.028639","10.10.10.6","10.10.10.30","TCP","74","80  >  35974 [SYN, ACK] Seq=0 Ack=1 Win=28960 Len=0 MSS=1460 SACK_PERM=1 TSval=42484 TSecr=14253833 WS=8"
"281","24.030048","10.10.10.30","10.10.10.6","TCP","66","35974  >  80 [ACK] Seq=1 Ack=1 Win=87680 Len=0 TSval=14253833 TSecr=42484"
"282","24.031362","10.10.10.30","10.10.10.6","HTTP","258","GET /api/59df4532a5f9c15ff500b552b69bbc HTTP/1.1 "
"283","24.031678","10.10.10.6","10.10.10.30","TCP","66","80  >  35974 [ACK] Seq=1 Ack=193 Win=30032 Len=0 TSval=42484 TSecr=14253833"
"284","24.032358","10.10.10.6","10.10.10.30","TCP","83","80  >  35974 [PSH, ACK] Seq=1 Ack=193 Win=30032 Len=17 TSval=42484 TSecr=14253833 [TCP segment of a reassembled PDU]"
"285","24.033631","10.10.10.30","10.10.10.6","TCP","66","35974  >  80 [ACK] Seq=193 Ack=18 Win=87680 Len=0 TSval=14253834 TSecr=42484"
"286","24.034016","10.10.10.6","10.10.10.30","TCP","931","HTTP/1.1 200 OK  [TCP segment of a reassembled PDU]"
"287","24.035424","10.10.10.30","10.10.10.6","TCP","66","35974  >  80 [ACK] Seq=193 Ack=883 Win=89344 Len=0 TSval=14253834 TSecr=42484"
"288","24.036935","10.10.10.6","10.10.10.30","TCP","67","80  >  35974 [PSH, ACK] Seq=883 Ack=193 Win=30032 Len=1 TSval=42485 TSecr=14253834 [TCP segment of a reassembled PDU]"
"289","24.039062","10.10.10.30","10.10.10.6","TCP","66","35974  >  80 [ACK] Seq=193 Ack=884 Win=89344 Len=0 TSval=14253835 TSecr=42485"
"290","24.039380","10.10.10.6","10.10.10.30","TCP","492","80  >  35974 [PSH, ACK] Seq=884 Ack=193 Win=30032 Len=426 TSval=42485 TSecr=14253835 [TCP segment of a reassembled PDU]"
"291","24.040710","10.10.10.30","10.10.10.6","TCP","66","35974  >  80 [ACK] Seq=193 Ack=1310 Win=91136 Len=0 TSval=14253835 TSecr=42485"
