"No.","Time","Source","Destination","Protocol","Length","Info"
"1","0.000000","0.0.0.0","255.255.255.255","DHCP","342","DHCP Request  - Transaction ID 0x74a6a165"
"2","0.082459","Eq-3Entw_03:cb:be","Broadcast","ARP","60","Who has 10.10.10.1? Tell 10.10.10.129"
"3","0.082499","DavidEle_06:08:ba","Eq-3Entw_03:cb:be","ARP","42","10.10.10.1 is at 00:b5:6d:06:08:ba"
"4","0.082495","10.10.10.129","224.0.0.1","IGMPv2","60","Membership Report group 224.0.0.1"
"5","0.098647","10.10.10.129","10.10.10.1","DNS","77","Standard query 0xcdab A ntp.homematic.com"
"6","0.098744","10.10.10.1","10.10.10.129","DNS","120","Standard query response 0xcdab A ntp.homematic.com CNAME homematic.com A 81.14.202.21"
"7","0.099296","10.10.10.129","81.14.202.21","NTP","90","NTP Version 4, client"
"8","0.118042","81.14.202.21","10.10.10.129","NTP","90","NTP Version 4, server"
"9","5.102357","DavidEle_06:08:ba","Eq-3Entw_03:cb:be","ARP","42","Who has 10.10.10.129? Tell 10.10.10.1"
"10","5.102763","Eq-3Entw_03:cb:be","DavidEle_06:08:ba","ARP","60","10.10.10.129 is at 00:1a:22:03:cb:be"
"11","5.898816","10.10.10.129","224.0.0.1","IGMPv2","60","Membership Report group 224.0.0.1"
"12","17.526519","Eq-3Entw_03:cb:be","IntelCor_7c:ea:dc","ARP","60","10.10.10.129 is at 00:1a:22:03:cb:be"
"13","17.527101","10.10.10.127","10.10.10.129","TCP","66","50077  >  62910 [SYN] Seq=0 Win=8192 Len=0 MSS=1460 WS=256 SACK_PERM=1"
"14","17.532317","10.10.10.129","10.10.10.127","TCP","60","62910  >  50077 [SYN, ACK] Seq=0 Ack=1 Win=4380 Len=0 MSS=1350"
"15","17.532842","10.10.10.127","10.10.10.129","TCP","54","50077  >  62910 [ACK] Seq=1 Ack=1 Win=16616 Len=0"
"16","17.737858","10.10.10.129","10.10.10.127","TCP","124","62910  >  50077 [PSH, ACK] Seq=1 Ack=1 Win=4380 Len=70"
"17","17.795031","10.10.10.127","10.10.10.129","TCP","54","50077  >  62910 [ACK] Seq=1 Ack=71 Win=16546 Len=0"
"18","17.806719","10.10.10.129","10.10.10.127","TCP","60","62910  >  50077 [PSH, ACK] Seq=71 Ack=1 Win=4380 Len=4"
"19","17.858889","10.10.10.127","10.10.10.129","TCP","54","50077  >  62910 [ACK] Seq=1 Ack=75 Win=16542 Len=0"
"20","17.907674","10.10.10.129","10.10.10.127","TCP","385","62910  >  50077 [PSH, ACK] Seq=75 Ack=1 Win=4380 Len=331"
"21","17.968193","10.10.10.127","10.10.10.129","TCP","54","50077  >  62910 [ACK] Seq=1 Ack=406 Win=16211 Len=0"
"22","18.006777","10.10.10.129","10.10.10.127","TCP","60","62910  >  50077 [PSH, ACK] Seq=406 Ack=1 Win=4380 Len=4"
"23","18.021492","10.10.10.127","10.10.10.129","TCP","58","50077  >  62910 [PSH, ACK] Seq=1 Ack=410 Win=16207 Len=4"
"24","18.025153","10.10.10.129","10.10.10.127","TCP","60","62910  >  50077 [ACK] Seq=410 Ack=5 Win=4380 Len=0"
"25","18.106768","10.10.10.129","10.10.10.127","TCP","60","62910  >  50077 [PSH, ACK] Seq=410 Ack=5 Win=4380 Len=4"
"26","18.154444","10.10.10.127","10.10.10.129","TCP","54","50077  >  62910 [ACK] Seq=5 Ack=414 Win=16203 Len=0"
"27","18.277701","10.10.10.127","10.10.10.129","TCP","90","50077  >  62910 [PSH, ACK] Seq=5 Ack=414 Win=16203 Len=36"
"28","18.283910","10.10.10.129","10.10.10.127","TCP","60","62910  >  50077 [ACK] Seq=414 Ack=41 Win=4380 Len=0"
"29","18.328752","10.10.10.129","10.10.10.127","TCP","60","62910  >  50077 [PSH, ACK] Seq=414 Ack=41 Win=4380 Len=4"
"30","18.388833","10.10.10.127","10.10.10.129","TCP","54","50077  >  62910 [ACK] Seq=41 Ack=418 Win=16199 Len=0"
"31","27.222007","10.10.10.127","10.10.10.129","TCP","90","50077  >  62910 [PSH, ACK] Seq=41 Ack=418 Win=16199 Len=36"
"32","27.228263","10.10.10.129","10.10.10.127","TCP","60","62910  >  50077 [ACK] Seq=418 Ack=77 Win=4380 Len=0"
"33","27.329158","10.10.10.129","10.10.10.127","TCP","60","62910  >  50077 [PSH, ACK] Seq=418 Ack=77 Win=4380 Len=4"
"34","27.374476","10.10.10.127","10.10.10.129","TCP","54","50077  >  62910 [ACK] Seq=77 Ack=422 Win=16195 Len=0"
"35","27.472865","10.10.10.127","10.10.10.129","TCP","62","50077  >  62910 [PSH, ACK] Seq=77 Ack=422 Win=16195 Len=8"
"36","27.479485","10.10.10.129","10.10.10.127","TCP","60","62910  >  50077 [ACK] Seq=422 Ack=85 Win=4380 Len=0"
"37","34.041573","10.10.10.127","10.10.10.129","TCP","58","50077  >  62910 [PSH, ACK] Seq=85 Ack=422 Win=16195 Len=4"
"38","34.046523","10.10.10.129","10.10.10.127","TCP","60","62910  >  50077 [ACK] Seq=422 Ack=89 Win=4380 Len=0"
"39","34.207547","10.10.10.129","10.10.10.127","TCP","60","62910  >  50077 [PSH, ACK] Seq=422 Ack=89 Win=4380 Len=4"
"40","34.265328","10.10.10.127","10.10.10.129","TCP","54","50077  >  62910 [ACK] Seq=89 Ack=426 Win=16191 Len=0"
"41","37.772668","10.10.10.127","10.10.10.129","TCP","58","50077  >  62910 [PSH, ACK] Seq=89 Ack=426 Win=16191 Len=4"
"42","37.776276","10.10.10.129","10.10.10.127","TCP","60","62910  >  50077 [ACK] Seq=426 Ack=93 Win=4380 Len=0"
"43","37.807796","10.10.10.129","10.10.10.127","TCP","60","62910  >  50077 [PSH, ACK] Seq=426 Ack=93 Win=4380 Len=4"
"44","37.859409","10.10.10.127","10.10.10.129","TCP","54","50077  >  62910 [ACK] Seq=93 Ack=430 Win=16187 Len=0"
"45","47.838082","10.10.10.127","10.10.10.129","TCP","58","50077  >  62910 [PSH, ACK] Seq=93 Ack=430 Win=16187 Len=4"
"46","47.841714","10.10.10.129","10.10.10.127","TCP","60","62910  >  50077 [ACK] Seq=430 Ack=97 Win=4380 Len=0"
"47","47.908252","10.10.10.129","10.10.10.127","TCP","60","62910  >  50077 [PSH, ACK] Seq=430 Ack=97 Win=4380 Len=4"
"48","47.969746","10.10.10.127","10.10.10.129","TCP","54","50077  >  62910 [ACK] Seq=97 Ack=434 Win=16183 Len=0"
"49","57.931294","10.10.10.127","10.10.10.129","TCP","58","50077  >  62910 [PSH, ACK] Seq=97 Ack=434 Win=16183 Len=4"
"50","57.934919","10.10.10.129","10.10.10.127","TCP","60","62910  >  50077 [ACK] Seq=434 Ack=101 Win=4380 Len=0"
"51","58.008816","10.10.10.129","10.10.10.127","TCP","60","62910  >  50077 [PSH, ACK] Seq=434 Ack=101 Win=4380 Len=4"
"52","58.065634","10.10.10.127","10.10.10.129","TCP","54","50077  >  62910 [ACK] Seq=101 Ack=438 Win=16179 Len=0"
"53","68.029552","10.10.10.127","10.10.10.129","TCP","58","50077  >  62910 [PSH, ACK] Seq=101 Ack=438 Win=16179 Len=4"
"54","68.033223","10.10.10.129","10.10.10.127","TCP","60","62910  >  50077 [ACK] Seq=438 Ack=105 Win=4380 Len=0"
"55","68.109292","10.10.10.129","10.10.10.127","TCP","60","62910  >  50077 [PSH, ACK] Seq=438 Ack=105 Win=4380 Len=4"
"56","68.161066","10.10.10.127","10.10.10.129","TCP","54","50077  >  62910 [ACK] Seq=105 Ack=442 Win=16175 Len=0"
