"No.","Time","Source","Destination","Protocol","Length","Info"
"1","0.000000","Tp-LinkT_00:fc:a3","IntelCor_c3:41:78","EAPOL","135","Key (Message 2 of 4)"
"2","0.009710","Tp-LinkT_00:fc:a3","IntelCor_c3:41:78","EAPOL","113","Key (Message 4 of 4)"
"3","1.986561","0.0.0.0","255.255.255.255","DHCP","590","DHCP Discover - Transaction ID 0x33e312c"
"4","3.911419","0.0.0.0","255.255.255.255","DHCP","590","DHCP Discover - Transaction ID 0x33e312c"
"5","4.239717","10.10.10.1","10.10.10.228","ICMP","62","Echo (ping) request  id=0x2439, seq=0/0, ttl=64 (no response found!)"
"6","4.239770","10.10.10.1","10.10.10.228","DHCP","342","DHCP Offer    - Transaction ID 0x33e312c"
"7","4.239832","10.10.10.1","10.10.10.228","DHCP","342","DHCP Offer    - Transaction ID 0x33e312c"
"8","4.395982","0.0.0.0","255.255.255.255","DHCP","590","DHCP Request  - Transaction ID 0x33e312c"
"9","4.467905","10.10.10.1","10.10.10.228","DHCP","342","DHCP ACK      - Transaction ID 0x33e312c"
"10","4.789112","Tp-LinkT_00:fc:a3","Broadcast","ARP","42","Who has 10.10.10.1? Tell 10.10.10.228"
"11","4.789136","DavidEle_06:08:ba","Tp-LinkT_00:fc:a3","ARP","42","10.10.10.1 is at 00:b5:6d:06:08:ba"
"12","4.790187","10.10.10.228","10.10.10.1","DNS","75","Standard query 0x0002 A de.pool.ntp.org"
"13","4.791787","10.10.10.1","10.10.10.228","DNS","545","Standard query response 0x0002 A de.pool.ntp.org A 144.76.172.53 A 178.63.135.195 A 131.188.3.220 A 138.201.16.225 NS b.ntpns.org NS e.ntpns.org NS a.ntpns.org NS c.ntpns.org NS i.ntpns.org NS g.ntpns.org NS h.ntpns.org NS f.ntpns.org NS d.ntpns.org A 207.171.17.42 AAAA 2620:101:d007::42 A 193.243.171.138 A 174.127.124.192 A 89.36.18.22 AAAA 2a00:14b0:4200:32e0::1e5 A 199.188.48.59 A 178.63.120.205 AAAA 2a01:4f8:121:43cd::3:1 A 46.234.32.107 A 173.255.139.202 AAAA 2001:4b20:0:ca01:5054:ff:fe6f:c4fb A 50.31.240.214"
"14","4.888231","10.10.10.228","144.76.172.53","NTP","90","NTP Version 3, client"
"15","4.894671","144.76.172.53","10.10.10.228","NTP","90","NTP Version 3, server"
"16","4.937246","Tp-LinkT_00:fc:a3","Broadcast","ARP","42","Who has 10.10.10.30? Tell 10.10.10.228"
"17","5.009707","10.10.10.228","10.10.10.1","DNS","80","Standard query 0x0003 A devs.tplinkcloud.com"
"18","5.300855","10.10.10.1","10.10.10.228","DNS","414","Standard query response 0x0003 A devs.tplinkcloud.com CNAME prd-elb-connector-0-1621750456.eu-west-1.elb.amazonaws.com A 52.18.200.165 A 52.49.65.150 A 52.49.107.41 A 52.209.224.132 NS ns-1053.awsdns-03.org NS ns-739.awsdns-28.net NS ns-341.awsdns-42.com NS ns-2023.awsdns-60.co.uk A 205.251.193.85 A 205.251.194.227 A 205.251.196.29 A 205.251.199.231"
"19","5.303727","10.10.10.228","52.18.200.165","TCP","74","48456  >  50443 [SYN] Seq=0 Win=5840 Len=0 MSS=1460 SACK_PERM=1 TSval=4294916205 TSecr=0 WS=2"
"20","5.326668","52.18.200.165","10.10.10.228","TCP","74","50443  >  48456 [SYN, ACK] Seq=0 Ack=1 Win=17898 Len=0 MSS=1380 SACK_PERM=1 TSval=460236059 TSecr=4294916205 WS=256"
"21","5.327855","10.10.10.228","52.18.200.165","TCP","66","48456  >  50443 [ACK] Seq=1 Ack=1 Win=5840 Len=0 TSval=4294916211 TSecr=460236059"
"22","5.739618","10.10.10.228","52.18.200.165","TCP","281","48456  >  50443 [PSH, ACK] Seq=1 Ack=1 Win=5840 Len=215 TSval=4294916314 TSecr=460236059"
"23","5.762511","52.18.200.165","10.10.10.228","TCP","66","50443  >  48456 [ACK] Seq=1 Ack=216 Win=19200 Len=0 TSval=460236168 TSecr=4294916314"
"24","5.764358","52.18.200.165","10.10.10.228","TCP","1434","50443  >  48456 [ACK] Seq=1 Ack=216 Win=19200 Len=1368 TSval=460236168 TSecr=4294916314"
"25","5.764385","52.18.200.165","10.10.10.228","TCP","1434","50443  >  48456 [ACK] Seq=1369 Ack=216 Win=19200 Len=1368 TSval=460236168 TSecr=4294916314"
"26","5.764392","52.18.200.165","10.10.10.228","TCP","903","50443  >  48456 [PSH, ACK] Seq=2737 Ack=216 Win=19200 Len=837 TSval=460236168 TSecr=4294916314"
"27","5.767524","10.10.10.228","52.18.200.165","TCP","66","48456  >  50443 [ACK] Seq=216 Ack=1369 Win=8576 Len=0 TSval=4294916321 TSecr=460236168"
"28","5.772407","10.10.10.228","52.18.200.165","TCP","66","48456  >  50443 [ACK] Seq=216 Ack=2737 Win=11312 Len=0 TSval=4294916322 TSecr=460236168"
"29","5.772632","10.10.10.228","52.18.200.165","TCP","66","48456  >  50443 [ACK] Seq=216 Ack=3574 Win=14048 Len=0 TSval=4294916322 TSecr=460236168"
"30","7.074924","10.10.10.228","52.18.200.165","TCP","200","48456  >  50443 [PSH, ACK] Seq=216 Ack=3574 Win=14048 Len=134 TSval=4294916648 TSecr=460236168"
"31","7.098410","52.18.200.165","10.10.10.228","TCP","300","50443  >  48456 [PSH, ACK] Seq=3574 Ack=350 Win=20224 Len=234 TSval=460236502 TSecr=4294916648"
"32","7.099706","10.10.10.228","52.18.200.165","TCP","66","48456  >  50443 [ACK] Seq=350 Ack=3808 Win=14048 Len=0 TSval=4294916654 TSecr=460236502"
"33","7.111222","10.10.10.228","52.18.200.165","TCP","588","48456  >  50443 [PSH, ACK] Seq=350 Ack=3808 Win=14048 Len=522 TSval=4294916657 TSecr=460236502"
"34","7.146094","52.18.200.165","10.10.10.228","TCP","167","50443  >  48456 [PSH, ACK] Seq=3808 Ack=872 Win=21248 Len=101 TSval=460236514 TSecr=4294916657"
"35","7.185063","10.10.10.228","52.18.200.165","TCP","66","48456  >  50443 [ACK] Seq=872 Ack=3909 Win=14048 Len=0 TSval=4294916676 TSecr=460236514"
"36","7.318303","10.10.10.228","52.18.200.165","TCP","268","48456  >  50443 [PSH, ACK] Seq=872 Ack=3909 Win=14048 Len=202 TSval=4294916709 TSecr=460236514"
"37","7.377345","52.18.200.165","10.10.10.228","TCP","66","50443  >  48456 [ACK] Seq=3909 Ack=1074 Win=22272 Len=0 TSval=460236572 TSecr=4294916709"
"38","7.417497","52.18.200.165","10.10.10.228","TCP","119","50443  >  48456 [PSH, ACK] Seq=3909 Ack=1074 Win=22272 Len=53 TSval=460236582 TSecr=4294916709"
"39","7.418407","10.10.10.228","52.18.200.165","TCP","66","48456  >  50443 [ACK] Seq=1074 Ack=3962 Win=14048 Len=0 TSval=4294916734 TSecr=460236582"
"40","10.314492","DavidEle_06:08:ba","Tp-LinkT_00:fc:a3","ARP","42","Who has 10.10.10.228? Tell 10.10.10.1"
"41","10.315316","Tp-LinkT_00:fc:a3","DavidEle_06:08:ba","ARP","42","10.10.10.228 is at 50:c7:bf:00:fc:a3"
"42","12.078224","10.10.10.228","52.18.200.165","TCP","236","48456  >  50443 [PSH, ACK] Seq=1074 Ack=3962 Win=14048 Len=170 TSval=4294917899 TSecr=460236582"
"43","12.101013","52.18.200.165","10.10.10.228","TCP","66","50443  >  48456 [ACK] Seq=3962 Ack=1244 Win=23296 Len=0 TSval=460237752 TSecr=4294917899"
"44","12.103305","52.18.200.165","10.10.10.228","TCP","151","50443  >  48456 [PSH, ACK] Seq=3962 Ack=1244 Win=23296 Len=85 TSval=460237753 TSecr=4294917899"
"45","12.104075","10.10.10.228","52.18.200.165","TCP","66","48456  >  50443 [ACK] Seq=1244 Ack=4047 Win=14048 Len=0 TSval=4294917905 TSecr=460237753"
"46","14.330089","10.10.10.228","52.18.200.165","TCP","300","48456  >  50443 [PSH, ACK] Seq=1244 Ack=4047 Win=14048 Len=234 TSval=4294918462 TSecr=460237753"
"47","14.389333","52.18.200.165","10.10.10.228","TCP","66","50443  >  48456 [ACK] Seq=4047 Ack=1478 Win=24576 Len=0 TSval=460238325 TSecr=4294918462"
"48","14.424766","52.18.200.165","10.10.10.228","TCP","119","50443  >  48456 [PSH, ACK] Seq=4047 Ack=1478 Win=24576 Len=53 TSval=460238333 TSecr=4294918462"
"49","14.425578","10.10.10.228","52.18.200.165","TCP","66","48456  >  50443 [ACK] Seq=1478 Ack=4100 Win=14048 Len=0 TSval=4294918486 TSecr=460238333"
"50","19.802821","52.18.200.165","10.10.10.228","TCP","263","50443  >  48456 [PSH, ACK] Seq=4100 Ack=1478 Win=24576 Len=197 TSval=460239678 TSecr=4294918486"
"51","19.803780","10.10.10.228","52.18.200.165","TCP","66","48456  >  50443 [ACK] Seq=1478 Ack=4297 Win=14048 Len=0 TSval=4294919830 TSecr=460239678"
"52","19.886201","10.10.10.228","52.18.200.165","TCP","876","48456  >  50443 [PSH, ACK] Seq=1478 Ack=4297 Win=14048 Len=810 TSval=4294919851 TSecr=460239678"
"53","19.913307","52.18.200.165","10.10.10.228","TCP","66","50443  >  48456 [ACK] Seq=4297 Ack=2288 Win=26112 Len=0 TSval=460239704 TSecr=4294919851"
"54","27.067048","52.18.200.165","10.10.10.228","TCP","263","50443  >  48456 [PSH, ACK] Seq=4297 Ack=2288 Win=26112 Len=197 TSval=460241494 TSecr=4294919851"
"55","27.070246","10.10.10.228","52.18.200.165","TCP","66","48456  >  50443 [ACK] Seq=2288 Ack=4494 Win=14048 Len=0 TSval=4294921647 TSecr=460241494"
"56","27.166004","10.10.10.228","52.18.200.165","TCP","876","48456  >  50443 [PSH, ACK] Seq=2288 Ack=4494 Win=14048 Len=810 TSval=4294921671 TSecr=460241494"
"57","27.188912","52.18.200.165","10.10.10.228","TCP","66","50443  >  48456 [ACK] Seq=4494 Ack=3098 Win=27648 Len=0 TSval=460241524 TSecr=4294921671"
"58","31.168378","52.18.200.165","10.10.10.228","TCP","263","50443  >  48456 [PSH, ACK] Seq=4494 Ack=3098 Win=27648 Len=197 TSval=460242519 TSecr=4294921671"
"59","31.171984","10.10.10.228","52.18.200.165","TCP","66","48456  >  50443 [ACK] Seq=3098 Ack=4691 Win=14048 Len=0 TSval=4294922672 TSecr=460242519"
"60","31.222695","10.10.10.228","52.18.200.165","TCP","876","48456  >  50443 [PSH, ACK] Seq=3098 Ack=4691 Win=14048 Len=810 TSval=4294922685 TSecr=460242519"
"61","31.245670","52.18.200.165","10.10.10.228","TCP","66","50443  >  48456 [ACK] Seq=4691 Ack=3908 Win=29440 Len=0 TSval=460242539 TSecr=4294922685"
"62","38.396005","52.18.200.165","10.10.10.228","TCP","263","50443  >  48456 [PSH, ACK] Seq=4691 Ack=3908 Win=29440 Len=197 TSval=460244326 TSecr=4294922685"
"63","38.397958","10.10.10.228","52.18.200.165","TCP","66","48456  >  50443 [ACK] Seq=3908 Ack=4888 Win=14048 Len=0 TSval=4294924479 TSecr=460244326"
"64","38.502186","10.10.10.228","52.18.200.165","TCP","876","48456  >  50443 [PSH, ACK] Seq=3908 Ack=4888 Win=14048 Len=810 TSval=4294924505 TSecr=460244326"
"65","38.525162","52.18.200.165","10.10.10.228","TCP","66","50443  >  48456 [ACK] Seq=4888 Ack=4718 Win=30976 Len=0 TSval=460244358 TSecr=4294924505"
"66","43.402499","DavidEle_06:08:ba","Tp-LinkT_00:fc:a3","ARP","42","Who has 10.10.10.228? Tell 10.10.10.1"
"67","43.404031","Tp-LinkT_00:fc:a3","DavidEle_06:08:ba","ARP","42","10.10.10.228 is at 50:c7:bf:00:fc:a3"
"68","45.647408","52.18.200.165","10.10.10.228","TCP","263","50443  >  48456 [PSH, ACK] Seq=4888 Ack=4718 Win=30976 Len=197 TSval=460246139 TSecr=4294924505"
"69","45.652302","10.10.10.228","52.18.200.165","TCP","66","48456  >  50443 [ACK] Seq=4718 Ack=5085 Win=14048 Len=0 TSval=4294926292 TSecr=460246139"
"70","45.678273","10.10.10.228","52.18.200.165","TCP","876","48456  >  50443 [PSH, ACK] Seq=4718 Ack=5085 Win=14048 Len=810 TSval=4294926299 TSecr=460246139"
"71","45.701197","52.18.200.165","10.10.10.228","TCP","66","50443  >  48456 [ACK] Seq=5085 Ack=5528 Win=32512 Len=0 TSval=460246152 TSecr=4294926299"
"72","52.849440","52.18.200.165","10.10.10.228","TCP","263","50443  >  48456 [PSH, ACK] Seq=5085 Ack=5528 Win=32512 Len=197 TSval=460247939 TSecr=4294926299"
"73","52.889572","10.10.10.228","52.18.200.165","TCP","66","48456  >  50443 [ACK] Seq=5528 Ack=5282 Win=14048 Len=0 TSval=4294928102 TSecr=460247939"
"74","52.958333","10.10.10.228","52.18.200.165","TCP","876","48456  >  50443 [PSH, ACK] Seq=5528 Ack=5282 Win=14048 Len=810 TSval=4294928119 TSecr=460247939"
"75","52.981309","52.18.200.165","10.10.10.228","TCP","66","50443  >  48456 [ACK] Seq=5282 Ack=6338 Win=34304 Len=0 TSval=460247972 TSecr=4294928119"
"76","60.113224","52.18.200.165","10.10.10.228","TCP","263","50443  >  48456 [PSH, ACK] Seq=5282 Ack=6338 Win=34304 Len=197 TSval=460249755 TSecr=4294928119"
"77","60.116558","10.10.10.228","52.18.200.165","TCP","66","48456  >  50443 [ACK] Seq=6338 Ack=5479 Win=14048 Len=0 TSval=4294929908 TSecr=460249755"
"78","60.134417","10.10.10.228","52.18.200.165","TCP","876","48456  >  50443 [PSH, ACK] Seq=6338 Ack=5479 Win=14048 Len=810 TSval=4294929913 TSecr=460249755"
"79","60.157355","52.18.200.165","10.10.10.228","TCP","66","50443  >  48456 [ACK] Seq=5479 Ack=7148 Win=34816 Len=0 TSval=460249766 TSecr=4294929913"
"80","67.288730","52.18.200.165","10.10.10.228","TCP","263","50443  >  48456 [PSH, ACK] Seq=5479 Ack=7148 Win=34816 Len=197 TSval=460251549 TSecr=4294929913"
"81","67.310535","10.10.10.228","52.18.200.165","TCP","876","48456  >  50443 [PSH, ACK] Seq=7148 Ack=5676 Win=14048 Len=810 TSval=4294931707 TSecr=460251549"
"82","67.333551","52.18.200.165","10.10.10.228","TCP","66","50443  >  48456 [ACK] Seq=5676 Ack=7958 Win=34816 Len=0 TSval=460251560 TSecr=4294931707"
