"No.","Time","Source","Destination","Protocol","Length","Info"
"1","0.000000","Tp-LinkT_00:c7:03","IntelCor_c3:41:78","EAPOL","135","Key (Message 2 of 4)"
"2","0.009769","Tp-LinkT_00:c7:03","IntelCor_c3:41:78","EAPOL","113","Key (Message 4 of 4)"
"3","1.785121","0.0.0.0","255.255.255.255","DHCP","590","DHCP Discover - Transaction ID 0x6c73eccc"
"4","3.595629","0.0.0.0","255.255.255.255","DHCP","590","DHCP Discover - Transaction ID 0x6c73eccc"
"5","4.038333","10.10.10.1","10.10.10.20","ICMP","62","Echo (ping) request  id=0x642a, seq=0/0, ttl=64 (no response found!)"
"6","4.038386","10.10.10.1","10.10.10.20","DHCP","342","DHCP Offer    - Transaction ID 0x6c73eccc"
"7","4.038450","10.10.10.1","10.10.10.20","DHCP","342","DHCP Offer    - Transaction ID 0x6c73eccc"
"8","4.047505","0.0.0.0","255.255.255.255","DHCP","590","DHCP Request  - Transaction ID 0x6c73eccc"
"9","4.141071","10.10.10.1","10.10.10.20","DHCP","342","DHCP ACK      - Transaction ID 0x6c73eccc"
"10","4.177840","Tp-LinkT_00:c7:03","Broadcast","ARP","42","Who has 10.10.10.1? Tell 10.10.10.20"
"11","4.177864","DavidEle_06:08:ba","Tp-LinkT_00:c7:03","ARP","42","10.10.10.1 is at 00:b5:6d:06:08:ba"
"12","4.178898","10.10.10.20","10.10.10.1","DNS","75","Standard query 0x0002 A time-b.nist.gov"
"13","4.180341","10.10.10.1","10.10.10.20","DNS","215","Standard query response 0x0002 A time-b.nist.gov A 129.6.15.29 NS gea.nist.gov NS bea.nist.gov A 132.163.4.10 AAAA 2610:20:6b01:4::10 A 129.6.13.3 AAAA 2610:20:6005:13::3"
"14","4.301278","10.10.10.20","129.6.15.29","NTP","90","NTP Version 3, client"
"15","4.374404","10.10.10.20","10.10.10.1","DNS","80","Standard query 0x0003 A devs.tplinkcloud.com"
"16","4.400851","10.10.10.1","10.10.10.20","DNS","414","Standard query response 0x0003 A devs.tplinkcloud.com CNAME prd-elb-connector-0-1621750456.eu-west-1.elb.amazonaws.com A 52.49.65.150 A 52.49.107.41 A 52.209.224.132 A 52.18.200.165 NS ns-2023.awsdns-60.co.uk NS ns-739.awsdns-28.net NS ns-1053.awsdns-03.org NS ns-341.awsdns-42.com A 205.251.193.85 A 205.251.194.227 A 205.251.196.29 A 205.251.199.231"
"17","4.403821","10.10.10.20","52.49.65.150","TCP","74","34988  >  50443 [SYN] Seq=0 Win=5840 Len=0 MSS=1460 SACK_PERM=1 TSval=4294914874 TSecr=0 WS=2"
"18","4.426605","52.49.65.150","10.10.10.20","TCP","74","50443  >  34988 [SYN, ACK] Seq=0 Ack=1 Win=17898 Len=0 MSS=1380 SACK_PERM=1 TSval=460302639 TSecr=4294914874 WS=256"
"19","4.427781","10.10.10.20","52.49.65.150","TCP","66","34988  >  50443 [ACK] Seq=1 Ack=1 Win=5840 Len=0 TSval=4294914880 TSecr=460302639"
"20","4.467729","129.6.15.29","10.10.10.20","NTP","90","NTP Version 3, server"
"21","5.256024","10.10.10.20","52.49.65.150","TCP","281","34988  >  50443 [PSH, ACK] Seq=1 Ack=1 Win=5840 Len=215 TSval=4294915087 TSecr=460302639"
"22","5.278615","52.49.65.150","10.10.10.20","TCP","66","50443  >  34988 [ACK] Seq=1 Ack=216 Win=19200 Len=0 TSval=460302852 TSecr=4294915087"
"23","5.280522","52.49.65.150","10.10.10.20","TCP","1434","50443  >  34988 [ACK] Seq=1 Ack=216 Win=19200 Len=1368 TSval=460302853 TSecr=4294915087"
"24","5.280551","52.49.65.150","10.10.10.20","TCP","1434","50443  >  34988 [ACK] Seq=1369 Ack=216 Win=19200 Len=1368 TSval=460302853 TSecr=4294915087"
"25","5.280557","52.49.65.150","10.10.10.20","TCP","903","50443  >  34988 [PSH, ACK] Seq=2737 Ack=216 Win=19200 Len=837 TSval=460302853 TSecr=4294915087"
"26","5.293980","10.10.10.20","52.49.65.150","TCP","66","34988  >  50443 [ACK] Seq=216 Ack=1369 Win=8576 Len=0 TSval=4294915095 TSecr=460302853"
"27","5.296627","10.10.10.20","52.49.65.150","TCP","66","34988  >  50443 [ACK] Seq=216 Ack=2737 Win=11312 Len=0 TSval=4294915097 TSecr=460302853"
"28","5.296684","10.10.10.20","52.49.65.150","TCP","66","34988  >  50443 [ACK] Seq=216 Ack=3574 Win=14048 Len=0 TSval=4294915097 TSecr=460302853"
"29","6.520724","10.10.10.20","52.49.65.150","TCP","200","34988  >  50443 [PSH, ACK] Seq=216 Ack=3574 Win=14048 Len=134 TSval=4294915403 TSecr=460302853"
"30","6.543924","52.49.65.150","10.10.10.20","TCP","300","50443  >  34988 [PSH, ACK] Seq=3574 Ack=350 Win=20224 Len=234 TSval=460303169 TSecr=4294915403"
"31","6.545159","10.10.10.20","52.49.65.150","TCP","66","34988  >  50443 [ACK] Seq=350 Ack=3808 Win=14048 Len=0 TSval=4294915409 TSecr=460303169"
"32","6.560047","10.10.10.20","52.49.65.150","TCP","588","34988  >  50443 [PSH, ACK] Seq=350 Ack=3808 Win=14048 Len=522 TSval=4294915413 TSecr=460303169"
"33","6.593065","52.49.65.150","10.10.10.20","TCP","167","50443  >  34988 [PSH, ACK] Seq=3808 Ack=872 Win=21248 Len=101 TSval=460303181 TSecr=4294915413"
"34","6.609802","Tp-LinkT_00:c7:03","Broadcast","ARP","42","Who has 10.10.10.30? Tell 10.10.10.20"
"35","6.633753","10.10.10.20","52.49.65.150","TCP","66","34988  >  50443 [ACK] Seq=872 Ack=3909 Win=14048 Len=0 TSval=4294915432 TSecr=460303181"
"36","13.319201","10.10.10.20","52.49.65.150","TCP","236","34988  >  50443 [PSH, ACK] Seq=872 Ack=3909 Win=14048 Len=170 TSval=4294917103 TSecr=460303181"
"37","13.344492","52.49.65.150","10.10.10.20","TCP","151","50443  >  34988 [PSH, ACK] Seq=3909 Ack=1042 Win=22272 Len=85 TSval=460304869 TSecr=4294917103"
"38","13.346166","10.10.10.20","52.49.65.150","TCP","66","34988  >  50443 [ACK] Seq=1042 Ack=3994 Win=14048 Len=0 TSval=4294917109 TSecr=460304869"
"39","15.675107","10.10.10.20","52.49.65.150","TCP","300","34988  >  50443 [PSH, ACK] Seq=1042 Ack=3994 Win=14048 Len=234 TSval=4294917692 TSecr=460304869"
"40","15.734914","52.49.65.150","10.10.10.20","TCP","66","50443  >  34988 [ACK] Seq=3994 Ack=1276 Win=23296 Len=0 TSval=460305467 TSecr=4294917692"
"41","15.803118","52.49.65.150","10.10.10.20","TCP","119","50443  >  34988 [PSH, ACK] Seq=3994 Ack=1276 Win=23296 Len=53 TSval=460305484 TSecr=4294917692"
"42","15.803925","10.10.10.20","52.49.65.150","TCP","66","34988  >  50443 [ACK] Seq=1276 Ack=4047 Win=14048 Len=0 TSval=4294917724 TSecr=460305484"
"43","18.355444","DavidEle_06:08:ba","Tp-LinkT_00:c7:03","ARP","42","Who has 10.10.10.20? Tell 10.10.10.1"
"44","18.356187","Tp-LinkT_00:c7:03","DavidEle_06:08:ba","ARP","42","10.10.10.20 is at 50:c7:bf:00:c7:03"
"45","26.001203","52.49.65.150","10.10.10.20","TCP","263","50443  >  34988 [PSH, ACK] Seq=4047 Ack=1276 Win=23296 Len=197 TSval=460308033 TSecr=4294917724"
"46","26.002135","10.10.10.20","52.49.65.150","TCP","66","34988  >  50443 [ACK] Seq=1276 Ack=4244 Win=14048 Len=0 TSval=4294920274 TSecr=460308033"
"47","26.044669","10.10.10.20","52.49.65.150","TCP","956","34988  >  50443 [PSH, ACK] Seq=1276 Ack=4244 Win=14048 Len=890 TSval=4294920284 TSecr=460308033"
"48","26.067386","52.49.65.150","10.10.10.20","TCP","66","50443  >  34988 [ACK] Seq=4244 Ack=2166 Win=25088 Len=0 TSval=460308050 TSecr=4294920284"
"49","37.897572","52.49.65.150","10.10.10.20","TCP","263","50443  >  34988 [PSH, ACK] Seq=4244 Ack=2166 Win=25088 Len=197 TSval=460311007 TSecr=4294920284"
"50","37.906054","10.10.10.20","52.49.65.150","TCP","66","34988  >  50443 [ACK] Seq=2166 Ack=4441 Win=14048 Len=0 TSval=4294923249 TSecr=460311007"
"51","38.003670","10.10.10.20","52.49.65.150","TCP","956","34988  >  50443 [PSH, ACK] Seq=2166 Ack=4441 Win=14048 Len=890 TSval=4294923274 TSecr=460311007"
"52","38.026374","52.49.65.150","10.10.10.20","TCP","66","50443  >  34988 [ACK] Seq=4441 Ack=3056 Win=26880 Len=0 TSval=460311039 TSecr=4294923274"
