"No.","Time","Source","Destination","Protocol","Length","Info"
"1","0.000000","BelkinIn_cd:37:65","IntelCor_c3:41:78","EAPOL","135","Key (Message 2 of 4)"
"2","0.005907","BelkinIn_cd:37:65","IntelCor_c3:41:78","EAPOL","113","Key (Message 4 of 4)"
"3","1.521158","0.0.0.0","255.255.255.255","DHCP","402","DHCP Discover - Transaction ID 0x13a1892d"
"4","1.521313","10.10.10.1","10.10.10.144","DHCP","342","DHCP Offer    - Transaction ID 0x13a1892d"
"5","1.549304","0.0.0.0","255.255.255.255","DHCP","410","DHCP Request  - Transaction ID 0x13a1892d"
"6","1.606967","10.10.10.1","10.10.10.144","DHCP","342","DHCP ACK      - Transaction ID 0x13a1892d"
"7","2.414436","BelkinIn_cd:37:65","Broadcast","ARP","60","Who has 10.10.10.1? Tell 10.10.10.144"
"8","2.414475","DavidEle_06:08:ba","BelkinIn_cd:37:65","ARP","42","10.10.10.1 is at 00:b5:6d:06:08:ba"
"9","3.496630","BelkinIn_cd:37:65","Broadcast","ARP","42","Who has 10.10.10.1? Tell 10.10.10.144"
"10","3.496648","DavidEle_06:08:ba","BelkinIn_cd:37:65","ARP","42","10.10.10.1 is at 00:b5:6d:06:08:ba"
"11","3.499595","10.22.22.138","64.210.203.208","TCP","74","57286  >  7275 [SYN] Seq=0 Win=14600 Len=0 MSS=1460 SACK_PERM=1 TSval=18758598 TSecr=0 WS=128"
"12","3.573402","10.10.10.144","10.10.10.1","DNS","78","Standard query 0xc494 A api.samsungosp.com"
"13","3.575142","10.10.10.1","10.10.10.144","DNS","480","Standard query response 0xc494 A api.samsungosp.com CNAME scalr-26dc4e1ecfa7bc-415-587723368.us-east-1.elb.amazonaws.com A 174.129.248.41 A 174.129.254.197 A 184.73.179.203 A 204.236.217.159 A 54.243.161.167 A 54.243.187.195 A 174.129.209.146 A 174.129.209.149 NS ns-235.awsdns-29.com NS ns-1119.awsdns-11.org NS ns-934.awsdns-52.net NS ns-1793.awsdns-32.co.uk A 205.251.192.235 A 205.251.195.166 A 205.251.196.95 A 205.251.199.1"
"14","3.598443","10.22.22.138","174.129.248.41","TCP","74","57759  >  443 [SYN] Seq=0 Win=14600 Len=0 MSS=1460 SACK_PERM=1 TSval=18758621 TSecr=0 WS=128"
"15","4.080299","10.10.10.144","10.10.10.1","DNS","77","Standard query 0x0881 A mtalk4.google.com"
"16","4.082220","10.10.10.1","10.10.10.144","DNS","259","Standard query response 0x0881 A mtalk4.google.com CNAME mobile-gtalk4.l.google.com A 64.233.184.188 NS ns2.google.com NS ns1.google.com NS ns4.google.com NS ns3.google.com A 216.239.32.10 A 216.239.34.10 A 216.239.36.10 A 216.239.38.10"
"17","4.098552","10.22.22.138","64.233.184.188","TCP","74","55914  >  5228 [SYN] Seq=0 Win=14600 Len=0 MSS=1460 SACK_PERM=1 TSval=18758721 TSecr=0 WS=128"
"18","4.496007","10.22.22.138","64.210.203.208","TCP","74","[TCP Retransmission] 57286  >  7275 [SYN] Seq=0 Win=14600 Len=0 MSS=1460 SACK_PERM=1 TSval=18758798 TSecr=0 WS=128"
"19","4.603355","10.22.22.138","174.129.248.41","TCP","74","[TCP Retransmission] 57759  >  443 [SYN] Seq=0 Win=14600 Len=0 MSS=1460 SACK_PERM=1 TSval=18758821 TSecr=0 WS=128"
"20","5.110098","10.22.22.138","64.233.184.188","TCP","74","[TCP Retransmission] 55914  >  5228 [SYN] Seq=0 Win=14600 Len=0 MSS=1460 SACK_PERM=1 TSval=18758921 TSecr=0 WS=128"
"21","5.298258","10.10.10.144","4.2.2.2","ICMP","98","Echo (ping) request  id=0x1808, seq=0/0, ttl=64 (reply in 22)"
"22","5.300077","4.2.2.2","10.10.10.144","ICMP","98","Echo (ping) reply    id=0x1808, seq=0/0, ttl=52 (request in 21)"
"23","5.361922","10.10.10.144","129.132.2.21","NTP","90","NTP Version 3, client"
"24","5.838793","10.10.10.144","10.10.10.1","DNS","79","Standard query 0x4ae4 A clients3.google.com"
"25","5.838868","10.10.10.144","10.10.10.1","DNS","79","Standard query 0x3046 A clients3.google.com"
"26","5.842894","10.10.10.1","10.10.10.144","DNS","255","Standard query response 0x4ae4 A clients3.google.com CNAME clients.l.google.com A 216.58.214.110 NS ns1.google.com NS ns4.google.com NS ns2.google.com NS ns3.google.com A 216.239.32.10 A 216.239.34.10 A 216.239.36.10 A 216.239.38.10"
"27","5.843003","10.10.10.1","10.10.10.144","DNS","255","Standard query response 0x3046 A clients3.google.com CNAME clients.l.google.com A 216.58.214.110 NS ns2.google.com NS ns3.google.com NS ns4.google.com NS ns1.google.com A 216.239.32.10 A 216.239.34.10 A 216.239.36.10 A 216.239.38.10"
"28","6.049691","10.22.22.138","216.58.214.110","TCP","74","33069  >  80 [SYN] Seq=0 Win=14600 Len=0 MSS=1460 SACK_PERM=1 TSval=18759110 TSecr=0 WS=128"
"29","6.304283","10.10.10.144","4.2.2.2","ICMP","98","Echo (ping) request  id=0x1808, seq=1/256, ttl=64 (reply in 30)"
"30","6.306060","4.2.2.2","10.10.10.144","ICMP","98","Echo (ping) reply    id=0x1808, seq=1/256, ttl=52 (request in 29)"
"31","6.377471","10.10.10.144","130.149.17.8","NTP","90","NTP Version 3, client"
"32","6.395458","130.149.17.8","10.10.10.144","NTP","90","NTP Version 3, server"
"33","6.497583","10.22.22.138","64.210.203.208","TCP","74","[TCP Retransmission] 57286  >  7275 [SYN] Seq=0 Win=14600 Len=0 MSS=1460 SACK_PERM=1 TSval=18759199 TSecr=0 WS=128"
"34","6.602882","10.22.22.138","174.129.248.41","TCP","74","[TCP Retransmission] 57759  >  443 [SYN] Seq=0 Win=14600 Len=0 MSS=1460 SACK_PERM=1 TSval=18759222 TSecr=0 WS=128"
"35","7.053462","10.22.22.138","216.58.214.110","TCP","74","[TCP Retransmission] 33069  >  80 [SYN] Seq=0 Win=14600 Len=0 MSS=1460 SACK_PERM=1 TSval=18759310 TSecr=0 WS=128"
"36","7.102773","10.22.22.138","64.233.184.188","TCP","74","[TCP Retransmission] 55914  >  5228 [SYN] Seq=0 Win=14600 Len=0 MSS=1460 SACK_PERM=1 TSval=18759322 TSecr=0 WS=128"
"37","7.307775","10.10.10.144","4.2.2.2","ICMP","98","Echo (ping) request  id=0x1808, seq=2/512, ttl=64 (reply in 38)"
"38","7.309450","4.2.2.2","10.10.10.144","ICMP","98","Echo (ping) reply    id=0x1808, seq=2/512, ttl=52 (request in 37)"
"39","8.311738","10.10.10.144","4.2.2.2","ICMP","98","Echo (ping) request  id=0x1808, seq=3/768, ttl=64 (reply in 40)"
"40","8.313419","4.2.2.2","10.10.10.144","ICMP","98","Echo (ping) reply    id=0x1808, seq=3/768, ttl=52 (request in 39)"
"41","8.496735","BelkinIn_cd:37:65","DavidEle_06:08:ba","ARP","42","Who has 10.10.10.1? Tell 10.10.10.144"
"42","8.496765","DavidEle_06:08:ba","BelkinIn_cd:37:65","ARP","42","10.10.10.1 is at 00:b5:6d:06:08:ba"
"43","8.548509","10.10.10.144","129.132.2.21","NTP","90","NTP Version 3, client"
"44","8.555883","129.143.47.6","10.10.10.144","ICMP","70","Destination unreachable (Communication administratively filtered)"
"45","8.575350","10.10.10.144","130.149.17.8","NTP","90","NTP Version 3, client"
"46","8.593320","130.149.17.8","10.10.10.144","NTP","90","NTP Version 3, server"
"47","8.722298","10.10.10.144","10.10.10.1","DNS","72","Standard query 0x0002 A nat.xbcs.net"
"48","8.865771","10.10.10.1","10.10.10.144","DNS","373","Standard query response 0x0002 A nat.xbcs.net CNAME prod1-nat-xbcs-net-1543133972.us-east-1.elb.amazonaws.com A 54.235.195.29 A 23.23.244.163 NS ns-235.awsdns-29.com NS ns-1119.awsdns-11.org NS ns-934.awsdns-52.net NS ns-1793.awsdns-32.co.uk A 205.251.192.235 A 205.251.195.166 A 205.251.196.95 A 205.251.199.1"
"49","9.058976","10.22.22.138","216.58.214.110","TCP","74","[TCP Retransmission] 33069  >  80 [SYN] Seq=0 Win=14600 Len=0 MSS=1460 SACK_PERM=1 TSval=18759711 TSecr=0 WS=128"
"50","9.876734","10.10.10.144","54.235.195.29","TCP","66","3541  >  3475 [SYN] Seq=0 Win=5840 Len=0 MSS=1460 SACK_PERM=1 WS=2"
"51","9.974126","54.235.195.29","10.10.10.144","TCP","66","3475  >  3541 [SYN, ACK] Seq=0 Ack=1 Win=14600 Len=0 MSS=1380 SACK_PERM=1 WS=256"
"52","9.975090","10.10.10.144","54.235.195.29","TCP","54","3541  >  3475 [ACK] Seq=1 Ack=1 Win=5840 Len=0"
"53","9.975865","10.10.10.144","54.235.195.29","TCP","403","3541  >  3475 [PSH, ACK] Seq=1 Ack=1 Win=5840 Len=349"
"54","10.004923","10.10.10.144","10.10.10.1","DNS","84","Standard query 0x609d A analytics.localytics.com"
"55","10.006545","10.10.10.1","10.10.10.144","DNS","470","Standard query response 0x609d A analytics.localytics.com CNAME queuerlb-599065538.us-east-1.elb.amazonaws.com A 23.23.160.249 A 50.17.195.105 A 50.19.119.163 A 54.225.147.8 A 54.243.101.215 A 107.20.243.255 A 23.21.229.203 A 23.23.102.29 NS ns-1793.awsdns-32.co.uk NS ns-235.awsdns-29.com NS ns-934.awsdns-52.net NS ns-1119.awsdns-11.org A 205.251.192.235 A 205.251.195.166 A 205.251.196.95 A 205.251.199.1"
"56","10.013657","10.22.22.138","23.23.160.249","TCP","74","34700  >  443 [SYN] Seq=0 Win=14600 Len=0 MSS=1460 SACK_PERM=1 TSval=18759904 TSecr=0 WS=128"
"57","10.073105","54.235.195.29","10.10.10.144","TCP","54","3475  >  3541 [ACK] Seq=1 Ack=350 Win=15872 Len=0"
"58","10.073753","54.235.195.29","10.10.10.144","TCP","68","3475  >  3541 [PSH, ACK] Seq=1 Ack=350 Win=15872 Len=14"
"59","10.075482","10.10.10.144","54.235.195.29","TCP","54","3541  >  3475 [ACK] Seq=350 Ack=15 Win=5840 Len=0"
"60","10.075927","10.10.10.144","54.235.195.29","TCP","54","3541  >  3475 [FIN, ACK] Seq=350 Ack=15 Win=5840 Len=0"
"61","10.174181","54.235.195.29","10.10.10.144","TCP","54","3475  >  3541 [FIN, ACK] Seq=15 Ack=351 Win=15872 Len=0"
"62","10.182715","10.10.10.144","54.235.195.29","TCP","54","3541  >  3475 [ACK] Seq=351 Ack=16 Win=5840 Len=0"
"63","10.503860","10.22.22.138","64.210.203.208","TCP","74","[TCP Retransmission] 57286  >  7275 [SYN] Seq=0 Win=14600 Len=0 MSS=1460 SACK_PERM=1 TSval=18760000 TSecr=0 WS=128"
"64","10.613977","10.22.22.138","174.129.248.41","TCP","74","[TCP Retransmission] 57759  >  443 [SYN] Seq=0 Win=14600 Len=0 MSS=1460 SACK_PERM=1 TSval=18760024 TSecr=0 WS=128"
"65","11.022806","10.22.22.138","23.23.160.249","TCP","74","[TCP Retransmission] 34700  >  443 [SYN] Seq=0 Win=14600 Len=0 MSS=1460 SACK_PERM=1 TSval=18760104 TSecr=0 WS=128"
"66","11.119240","10.22.22.138","64.233.184.188","TCP","74","[TCP Retransmission] 55914  >  5228 [SYN] Seq=0 Win=14600 Len=0 MSS=1460 SACK_PERM=1 TSval=18760124 TSecr=0 WS=128"
"67","11.160409","10.10.10.144","54.224.226.163","TCP","66","3849  >  3478 [SYN] Seq=0 Win=5840 Len=0 MSS=1460 SACK_PERM=1 WS=2"
"68","11.260376","54.224.226.163","10.10.10.144","TCP","66","3478  >  3849 [SYN, ACK] Seq=0 Ack=1 Win=29200 Len=0 MSS=1380 SACK_PERM=1 WS=128"
"69","11.261299","10.10.10.144","54.224.226.163","TCP","54","3849  >  3478 [ACK] Seq=1 Ack=1 Win=5840 Len=0"
"70","11.264631","10.10.10.144","54.224.226.163","STUN","102","Allocate Request TCP"
"71","11.364238","54.224.226.163","10.10.10.144","TCP","54","3478  >  3849 [ACK] Seq=1 Ack=49 Win=29312 Len=0"
"72","12.910990","10.10.10.144","10.10.10.1","DNS","72","Standard query 0x37b5 A api.xbcs.net"
"73","13.029290","10.22.22.138","23.23.160.249","TCP","74","[TCP Retransmission] 34700  >  443 [SYN] Seq=0 Win=14600 Len=0 MSS=1460 SACK_PERM=1 TSval=18760505 TSecr=0 WS=128"
"74","13.032854","10.10.10.1","10.10.10.144","DNS","468","Standard query response 0x37b5 A api.xbcs.net CNAME prod1-api-xbcs-net-889336557.us-east-1.elb.amazonaws.com A 23.21.117.32 A 23.21.138.13 A 23.21.226.117 A 23.23.111.129 A 50.17.221.66 A 174.129.249.52 A 184.73.254.250 A 204.236.228.222 NS ns-1793.awsdns-32.co.uk NS ns-934.awsdns-52.net NS ns-1119.awsdns-11.org NS ns-235.awsdns-29.com A 205.251.192.235 A 205.251.195.166 A 205.251.196.95 A 205.251.199.1"
"75","13.035304","10.10.10.144","23.21.117.32","TCP","66","3955  >  8443 [SYN] Seq=0 Win=5840 Len=0 MSS=1460 SACK_PERM=1 WS=2"
"76","13.133522","23.21.117.32","10.10.10.144","TCP","66","8443  >  3955 [SYN, ACK] Seq=0 Ack=1 Win=14600 Len=0 MSS=1380 SACK_PERM=1 WS=256"
"77","13.135010","10.10.10.144","23.21.117.32","TCP","54","3955  >  8443 [ACK] Seq=1 Ack=1 Win=5840 Len=0"
"78","13.331067","10.10.10.144","23.21.117.32","TCP","281","3955  >  8443 [PSH, ACK] Seq=1 Ack=1 Win=5840 Len=227"
"79","13.429042","23.21.117.32","10.10.10.144","TCP","54","8443  >  3955 [ACK] Seq=1 Ack=228 Win=15872 Len=0"
"80","13.429441","23.21.117.32","10.10.10.144","TCP","1434","8443  >  3955 [ACK] Seq=1 Ack=228 Win=15872 Len=1380"
"81","13.429546","23.21.117.32","10.10.10.144","TCP","1434","8443  >  3955 [ACK] Seq=1381 Ack=228 Win=15872 Len=1380"
"82","13.429555","23.21.117.32","10.10.10.144","TCP","1390","8443  >  3955 [PSH, ACK] Seq=2761 Ack=228 Win=15872 Len=1336"
"83","13.429567","23.21.117.32","10.10.10.144","TCP","857","8443  >  3955 [PSH, ACK] Seq=4097 Ack=228 Win=15872 Len=803"
"84","13.432909","10.10.10.144","23.21.117.32","TCP","54","3955  >  8443 [ACK] Seq=228 Ack=1381 Win=8600 Len=0"
"85","13.443307","10.10.10.144","23.21.117.32","TCP","54","3955  >  8443 [ACK] Seq=228 Ack=2761 Win=11360 Len=0"
"86","13.445133","10.10.10.144","10.10.10.1","DNS","79","Standard query 0x20f0 A clients3.google.com"
"87","13.445319","10.10.10.1","10.10.10.144","DNS","129","Standard query response 0x20f0 A clients3.google.com CNAME clients.l.google.com A 216.58.214.110"
"88","13.445449","10.10.10.144","23.21.117.32","TCP","54","3955  >  8443 [ACK] Seq=228 Ack=4097 Win=14120 Len=0"
"89","13.446194","10.10.10.144","23.21.117.32","TCP","54","3955  >  8443 [ACK] Seq=228 Ack=4900 Win=16880 Len=0"
"90","13.498629","10.10.10.144","23.21.117.32","TCP","380","3955  >  8443 [PSH, ACK] Seq=228 Ack=4900 Win=16880 Len=326"
"91","13.514818","10.22.22.138","216.58.214.110","TCP","74","55742  >  80 [SYN] Seq=0 Win=14600 Len=0 MSS=1460 SACK_PERM=1 TSval=18760604 TSecr=0 WS=128"
"92","13.559019","DavidEle_06:08:ba","BelkinIn_cd:37:65","ARP","42","Who has 10.10.10.144? Tell 10.10.10.1"
"93","13.561476","BelkinIn_cd:37:65","DavidEle_06:08:ba","ARP","42","10.10.10.144 is at 94:10:3e:cd:37:65"
"94","13.599071","23.21.117.32","10.10.10.144","TCP","113","8443  >  3955 [PSH, ACK] Seq=4900 Ack=554 Win=16896 Len=59"
"95","13.601325","10.10.10.144","23.21.117.32","TCP","54","3955  >  8443 [ACK] Seq=554 Ack=4959 Win=16880 Len=0"
"96","13.605478","10.10.10.144","23.21.117.32","TCP","315","3955  >  8443 [PSH, ACK] Seq=554 Ack=4959 Win=16880 Len=261"
"97","13.622110","10.10.10.144","23.21.117.32","TCP","1434","3955  >  8443 [ACK] Seq=815 Ack=4959 Win=16880 Len=1380"
"98","13.720553","23.21.117.32","10.10.10.144","TCP","54","8443  >  3955 [ACK] Seq=4959 Ack=2195 Win=20736 Len=0"
"99","13.721869","10.10.10.144","23.21.117.32","TCP","1434","3955  >  8443 [ACK] Seq=2195 Ack=4959 Win=16880 Len=1380"
"100","13.722088","10.10.10.144","23.21.117.32","TCP","1434","3955  >  8443 [ACK] Seq=3575 Ack=4959 Win=16880 Len=1380"
"101","13.722416","10.10.10.144","23.21.117.32","TCP","1434","3955  >  8443 [ACK] Seq=4955 Ack=4959 Win=16880 Len=1380"
"102","13.820319","23.21.117.32","10.10.10.144","TCP","54","8443  >  3955 [ACK] Seq=4959 Ack=4955 Win=26624 Len=0"
"103","13.823277","10.10.10.144","23.21.117.32","TCP","1434","3955  >  8443 [ACK] Seq=6335 Ack=4959 Win=16880 Len=1380"
"104","13.823481","10.10.10.144","23.21.117.32","TCP","1434","3955  >  8443 [ACK] Seq=7715 Ack=4959 Win=16880 Len=1380"
"105","13.825458","10.10.10.144","23.21.117.32","TCP","1434","3955  >  8443 [ACK] Seq=9095 Ack=4959 Win=16880 Len=1380"
"106","13.860510","23.21.117.32","10.10.10.144","TCP","54","8443  >  3955 [ACK] Seq=4959 Ack=6335 Win=29696 Len=0"
"107","13.862907","10.10.10.144","23.21.117.32","TCP","1434","3955  >  8443 [ACK] Seq=10475 Ack=4959 Win=16880 Len=1380"
"108","13.863152","10.10.10.144","23.21.117.32","TCP","1434","3955  >  8443 [ACK] Seq=11855 Ack=4959 Win=16880 Len=1380"
"109","13.921817","23.21.117.32","10.10.10.144","TCP","54","8443  >  3955 [ACK] Seq=4959 Ack=7715 Win=32512 Len=0"
"110","13.921878","23.21.117.32","10.10.10.144","TCP","54","8443  >  3955 [ACK] Seq=4959 Ack=9095 Win=35584 Len=0"
"111","13.922641","10.10.10.144","23.21.117.32","TCP","1434","3955  >  8443 [ACK] Seq=13235 Ack=4959 Win=16880 Len=1380"
"112","13.922755","10.10.10.144","23.21.117.32","TCP","55","3955  >  8443 [PSH, ACK] Seq=14615 Ack=4959 Win=16880 Len=1"
"113","13.923626","23.21.117.32","10.10.10.144","TCP","54","8443  >  3955 [ACK] Seq=4959 Ack=10475 Win=38400 Len=0"
"114","13.938935","10.10.10.144","23.21.117.32","TCP","1434","3955  >  8443 [ACK] Seq=14616 Ack=4959 Win=16880 Len=1380"
"115","13.954739","10.10.10.144","23.21.117.32","TCP","1434","3955  >  8443 [ACK] Seq=15996 Ack=4959 Win=16880 Len=1380"
"116","13.961353","23.21.117.32","10.10.10.144","TCP","54","8443  >  3955 [ACK] Seq=4959 Ack=11855 Win=41216 Len=0"
"117","13.961379","23.21.117.32","10.10.10.144","TCP","54","8443  >  3955 [ACK] Seq=4959 Ack=13235 Win=42240 Len=0"
"118","13.978814","10.10.10.144","23.21.117.32","TCP","1434","3955  >  8443 [ACK] Seq=17376 Ack=4959 Win=16880 Len=1380"
"119","13.994299","10.10.10.144","23.21.117.32","TCP","1434","3955  >  8443 [ACK] Seq=18756 Ack=4959 Win=16880 Len=1380"
"120","14.011556","10.10.10.144","23.21.117.32","TCP","1434","3955  >  8443 [ACK] Seq=20136 Ack=4959 Win=16880 Len=1380"
"121","14.020934","23.21.117.32","10.10.10.144","TCP","54","8443  >  3955 [ACK] Seq=4959 Ack=14615 Win=42240 Len=0"
"122","14.020961","23.21.117.32","10.10.10.144","TCP","54","8443  >  3955 [ACK] Seq=4959 Ack=14616 Win=42240 Len=0"
"123","14.022171","10.10.10.144","23.21.117.32","TCP","1146","3955  >  8443 [PSH, ACK] Seq=21516 Ack=4959 Win=16880 Len=1092"
"124","14.037142","23.21.117.32","10.10.10.144","TCP","54","8443  >  3955 [ACK] Seq=4959 Ack=15996 Win=42240 Len=0"
"125","14.038697","10.10.10.144","23.21.117.32","TCP","1434","3955  >  8443 [ACK] Seq=22608 Ack=4959 Win=16880 Len=1380"
"126","14.052910","23.21.117.32","10.10.10.144","TCP","54","8443  >  3955 [ACK] Seq=4959 Ack=17376 Win=42240 Len=0"
"127","14.076992","23.21.117.32","10.10.10.144","TCP","54","8443  >  3955 [ACK] Seq=4959 Ack=18756 Win=42240 Len=0"
"128","14.091341","54.167.245.198","10.10.10.144","TCP","54","3478  >  4508 [FIN, ACK] Seq=1 Ack=1 Win=245 Len=0"
"129","14.092485","23.21.117.32","10.10.10.144","TCP","54","8443  >  3955 [ACK] Seq=4959 Ack=20136 Win=42240 Len=0"
"130","14.093325","10.10.10.144","54.167.245.198","TCP","54","4508  >  3478 [RST] Seq=1 Win=0 Len=0"
"131","14.109683","23.21.117.32","10.10.10.144","TCP","54","8443  >  3955 [ACK] Seq=4959 Ack=21516 Win=42240 Len=0"
"132","14.120352","23.21.117.32","10.10.10.144","TCP","54","8443  >  3955 [ACK] Seq=4959 Ack=22608 Win=42240 Len=0"
"133","14.120923","10.10.10.144","23.21.117.32","TCP","117","3955  >  8443 [PSH, ACK] Seq=23988 Ack=4959 Win=16880 Len=63"
"134","14.176521","23.21.117.32","10.10.10.144","TCP","54","8443  >  3955 [ACK] Seq=4959 Ack=23988 Win=42240 Len=0"
"135","14.218849","23.21.117.32","10.10.10.144","TCP","54","8443  >  3955 [ACK] Seq=4959 Ack=24051 Win=42240 Len=0"
"136","14.266440","23.21.117.32","10.10.10.144","TCP","1434","8443  >  3955 [ACK] Seq=4959 Ack=24051 Win=42240 Len=1380"
"137","14.266485","23.21.117.32","10.10.10.144","TCP","823","8443  >  3955 [PSH, ACK] Seq=6339 Ack=24051 Win=42240 Len=769"
"138","14.268087","10.10.10.144","23.21.117.32","TCP","54","3955  >  8443 [ACK] Seq=24051 Ack=7108 Win=16880 Len=0"
"139","14.522055","10.22.22.138","216.58.214.110","TCP","74","[TCP Retransmission] 55742  >  80 [SYN] Seq=0 Win=14600 Len=0 MSS=1460 SACK_PERM=1 TSval=18760804 TSecr=0 WS=128"
"140","14.844834","10.10.10.144","23.21.117.32","TCP","91","3955  >  8443 [PSH, ACK] Seq=24051 Ack=7108 Win=16880 Len=37"
"141","14.850027","10.10.10.144","23.21.117.32","TCP","54","3955  >  8443 [FIN, ACK] Seq=24088 Ack=7108 Win=16880 Len=0"
"142","14.943191","23.21.117.32","10.10.10.144","TCP","91","8443  >  3955 [PSH, ACK] Seq=7108 Ack=24088 Win=42240 Len=37"
"143","14.943217","23.21.117.32","10.10.10.144","TCP","54","8443  >  3955 [FIN, ACK] Seq=7145 Ack=24088 Win=42240 Len=0"
"144","14.943924","10.10.10.144","23.21.117.32","TCP","54","3955  >  8443 [RST] Seq=24088 Win=0 Len=0"
"145","14.944324","10.10.10.144","23.21.117.32","TCP","54","3955  >  8443 [RST] Seq=24088 Win=0 Len=0"
"146","16.528169","10.22.22.138","216.58.214.110","TCP","74","[TCP Retransmission] 55742  >  80 [SYN] Seq=0 Win=14600 Len=0 MSS=1460 SACK_PERM=1 TSval=18761205 TSecr=0 WS=128"
"147","17.043084","10.22.22.138","23.23.160.249","TCP","74","[TCP Retransmission] 34700  >  443 [SYN] Seq=0 Win=14600 Len=0 MSS=1460 SACK_PERM=1 TSval=18761308 TSecr=0 WS=128"
"148","18.525601","10.22.22.138","64.210.203.208","TCP","74","[TCP Retransmission] 57286  >  7275 [SYN] Seq=0 Win=14600 Len=0 MSS=1460 SACK_PERM=1 TSval=18761604 TSecr=0 WS=128"
"149","18.640575","10.22.22.138","174.129.248.41","TCP","74","[TCP Retransmission] 57759  >  443 [SYN] Seq=0 Win=14600 Len=0 MSS=1460 SACK_PERM=1 TSval=18761628 TSecr=0 WS=128"
"150","18.796188","54.224.226.163","10.10.10.144","STUN","194","Allocate Error Response error-code: 401 (Unauthorized) Unauthorized realm: belkin.org with nonce"
"151","18.796805","10.10.10.144","54.224.226.163","TCP","54","3849  >  3478 [ACK] Seq=49 Ack=141 Win=5840 Len=0"
"152","18.800435","10.10.10.144","54.224.226.163","STUN","210","Allocate Request TCP user: 94103ECD3764 realm: belkin.org with nonce"
"153","18.900680","54.224.226.163","10.10.10.144","TCP","54","3478  >  3849 [ACK] Seq=141 Ack=205 Win=30336 Len=0"
"154","19.134572","10.22.22.138","216.58.214.110","TCP","74","60970  >  80 [SYN] Seq=0 Win=14600 Len=0 MSS=1460 SACK_PERM=1 TSval=18761726 TSecr=0 WS=128"
"155","19.134888","10.22.22.138","64.233.184.188","TCP","74","[TCP Retransmission] 55914  >  5228 [SYN] Seq=0 Win=14600 Len=0 MSS=1460 SACK_PERM=1 TSval=18761728 TSecr=0 WS=128"
"156","19.773067","10.10.10.144","10.10.10.1","DNS","86","Standard query 0x56e6 A android.clients.google.com"
"157","19.774889","10.10.10.1","10.10.10.144","DNS","262","Standard query response 0x56e6 A android.clients.google.com CNAME android.l.google.com A 216.58.214.110 NS ns4.google.com NS ns2.google.com NS ns3.google.com NS ns1.google.com A 216.239.32.10 A 216.239.34.10 A 216.239.36.10 A 216.239.38.10"
"158","19.784555","10.22.22.138","216.58.214.110","TCP","74","46560  >  443 [SYN] Seq=0 Win=14600 Len=0 MSS=1460 SACK_PERM=1 TSval=18761858 TSecr=0 WS=128"
"159","20.129962","10.22.22.138","216.58.214.110","TCP","74","[TCP Retransmission] 60970  >  80 [SYN] Seq=0 Win=14600 Len=0 MSS=1460 SACK_PERM=1 TSval=18761926 TSecr=0 WS=128"
"160","20.542932","10.22.22.138","216.58.214.110","TCP","74","[TCP Retransmission] 55742  >  80 [SYN] Seq=0 Win=14600 Len=0 MSS=1460 SACK_PERM=1 TSval=18762008 TSecr=0 WS=128"
"161","20.792010","10.22.22.138","216.58.214.110","TCP","74","[TCP Retransmission] 46560  >  443 [SYN] Seq=0 Win=14600 Len=0 MSS=1460 SACK_PERM=1 TSval=18762058 TSecr=0 WS=128"
"162","20.839632","54.224.226.163","10.10.10.144","STUN","158","Allocate Success Response XOR-RELAYED-ADDRESS: 10.237.253.105:19595 lifetime: 330 XOR-MAPPED-ADDRESS: 130.83.40.252:3849"
"163","20.879850","10.10.10.144","54.224.226.163","TCP","54","3849  >  3478 [ACK] Seq=205 Ack=245 Win=5840 Len=0"
"164","21.306319","10.10.10.144","10.10.10.1","DNS","72","Standard query 0xd886 A api.xbcs.net"
"165","21.306457","10.10.10.1","10.10.10.144","DNS","270","Standard query response 0xd886 A api.xbcs.net CNAME prod1-api-xbcs-net-889336557.us-east-1.elb.amazonaws.com A 204.236.228.222 A 184.73.254.250 A 174.129.249.52 A 50.17.221.66 A 23.23.111.129 A 23.21.226.117 A 23.21.138.13 A 23.21.117.32"
"166","21.310405","10.10.10.144","204.236.228.222","TCP","66","4548  >  8443 [SYN] Seq=0 Win=5840 Len=0 MSS=1460 SACK_PERM=1 WS=2"
"167","21.408970","204.236.228.222","10.10.10.144","TCP","66","8443  >  4548 [SYN, ACK] Seq=0 Ack=1 Win=14600 Len=0 MSS=1380 SACK_PERM=1 WS=256"
"168","21.409556","10.10.10.144","204.236.228.222","TCP","54","4548  >  8443 [ACK] Seq=1 Ack=1 Win=5840 Len=0"
"169","21.440366","10.10.10.144","204.236.228.222","TCP","281","4548  >  8443 [PSH, ACK] Seq=1 Ack=1 Win=5840 Len=227"
"170","21.538622","204.236.228.222","10.10.10.144","TCP","54","8443  >  4548 [ACK] Seq=1 Ack=228 Win=15872 Len=0"
"171","21.538979","204.236.228.222","10.10.10.144","TCP","1434","8443  >  4548 [ACK] Seq=1 Ack=228 Win=15872 Len=1380"
"172","21.539015","204.236.228.222","10.10.10.144","TCP","1434","8443  >  4548 [ACK] Seq=1381 Ack=228 Win=15872 Len=1380"
"173","21.539060","204.236.228.222","10.10.10.144","TCP","1390","8443  >  4548 [PSH, ACK] Seq=2761 Ack=228 Win=15872 Len=1336"
"174","21.539073","204.236.228.222","10.10.10.144","TCP","857","8443  >  4548 [PSH, ACK] Seq=4097 Ack=228 Win=15872 Len=803"
"175","21.540593","10.10.10.144","204.236.228.222","TCP","54","4548  >  8443 [ACK] Seq=228 Ack=1381 Win=8600 Len=0"
"176","21.540696","10.10.10.144","204.236.228.222","TCP","54","4548  >  8443 [ACK] Seq=228 Ack=2761 Win=11360 Len=0"
"177","21.540763","10.10.10.144","204.236.228.222","TCP","54","4548  >  8443 [ACK] Seq=228 Ack=4097 Win=14120 Len=0"
"178","21.541569","10.10.10.144","204.236.228.222","TCP","54","4548  >  8443 [ACK] Seq=228 Ack=4900 Win=16880 Len=0"
"179","21.594120","10.10.10.144","204.236.228.222","TCP","380","4548  >  8443 [PSH, ACK] Seq=228 Ack=4900 Win=16880 Len=326"
"180","21.694487","204.236.228.222","10.10.10.144","TCP","113","8443  >  4548 [PSH, ACK] Seq=4900 Ack=554 Win=16896 Len=59"
"181","21.695345","10.10.10.144","204.236.228.222","TCP","54","4548  >  8443 [ACK] Seq=554 Ack=4959 Win=16880 Len=0"
"182","21.698731","10.10.10.144","204.236.228.222","TCP","299","4548  >  8443 [PSH, ACK] Seq=554 Ack=4959 Win=16880 Len=245"
"183","21.716347","10.10.10.144","204.236.228.222","TCP","1434","4548  >  8443 [ACK] Seq=799 Ack=4959 Win=16880 Len=1380"
"184","21.814803","204.236.228.222","10.10.10.144","TCP","54","8443  >  4548 [ACK] Seq=4959 Ack=2179 Win=20736 Len=0"
"185","21.815685","10.10.10.144","204.236.228.222","TCP","1434","4548  >  8443 [ACK] Seq=2179 Ack=4959 Win=16880 Len=1380"
"186","21.815977","10.10.10.144","204.236.228.222","TCP","1434","4548  >  8443 [ACK] Seq=3559 Ack=4959 Win=16880 Len=1380"
"187","21.816282","10.10.10.144","204.236.228.222","TCP","1434","4548  >  8443 [ACK] Seq=4939 Ack=4959 Win=16880 Len=1380"
"188","21.914315","204.236.228.222","10.10.10.144","TCP","54","8443  >  4548 [ACK] Seq=4959 Ack=4939 Win=26624 Len=0"
"189","21.915729","10.10.10.144","204.236.228.222","TCP","1434","4548  >  8443 [ACK] Seq=6319 Ack=4959 Win=16880 Len=1380"
"190","21.915995","10.10.10.144","204.236.228.222","TCP","1434","4548  >  8443 [ACK] Seq=7699 Ack=4959 Win=16880 Len=1380"
"191","21.916238","10.10.10.144","204.236.228.222","TCP","839","4548  >  8443 [PSH, ACK] Seq=9079 Ack=4959 Win=16880 Len=785"
"192","21.952658","204.236.228.222","10.10.10.144","TCP","54","8443  >  4548 [ACK] Seq=4959 Ack=6319 Win=29696 Len=0"
"193","22.014814","204.236.228.222","10.10.10.144","TCP","54","8443  >  4548 [ACK] Seq=4959 Ack=7699 Win=32512 Len=0"
"194","22.015041","204.236.228.222","10.10.10.144","TCP","54","8443  >  4548 [ACK] Seq=4959 Ack=9079 Win=35584 Len=0"
"195","22.015069","204.236.228.222","10.10.10.144","TCP","54","8443  >  4548 [ACK] Seq=4959 Ack=9864 Win=38144 Len=0"
"196","22.042106","204.236.228.222","10.10.10.144","TCP","1434","8443  >  4548 [ACK] Seq=4959 Ack=9864 Win=38144 Len=1380"
"197","22.042142","204.236.228.222","10.10.10.144","TCP","151","8443  >  4548 [PSH, ACK] Seq=6339 Ack=9864 Win=38144 Len=97"
"198","22.043126","10.10.10.144","204.236.228.222","TCP","54","4548  >  8443 [ACK] Seq=9864 Ack=6436 Win=16880 Len=0"
"199","22.046012","10.10.10.144","204.236.228.222","TCP","91","4548  >  8443 [PSH, ACK] Seq=9864 Ack=6436 Win=16880 Len=37"
"200","22.050302","10.10.10.144","204.236.228.222","TCP","54","4548  >  8443 [FIN, ACK] Seq=9901 Ack=6436 Win=16880 Len=0"
"201","22.145404","204.236.228.222","10.10.10.144","TCP","91","8443  >  4548 [PSH, ACK] Seq=6436 Ack=9901 Win=38144 Len=37"
"202","22.145446","204.236.228.222","10.10.10.144","TCP","54","8443  >  4548 [FIN, ACK] Seq=6473 Ack=9901 Win=38144 Len=0"
"203","22.146302","10.10.10.144","204.236.228.222","TCP","54","4548  >  8443 [RST] Seq=9901 Win=0 Len=0"
"204","22.147367","10.10.10.144","204.236.228.222","TCP","54","4548  >  8443 [RST] Seq=9901 Win=0 Len=0"
"205","22.651599","10.10.10.144","129.132.2.21","NTP","90","NTP Version 3, client"
"206","22.658976","129.143.47.6","10.10.10.144","ICMP","70","Destination unreachable (Communication administratively filtered)"
"207","22.796763","10.22.22.138","216.58.214.110","TCP","74","[TCP Retransmission] 46560  >  443 [SYN] Seq=0 Win=14600 Len=0 MSS=1460 SACK_PERM=1 TSval=18762459 TSecr=0 WS=128"
"208","22.809982","10.10.10.144","129.132.2.21","NTP","90","NTP Version 3, client"
"209","22.829300","10.10.10.144","130.149.17.8","NTP","90","NTP Version 3, client"
"210","22.849147","130.149.17.8","10.10.10.144","NTP","90","NTP Version 3, server"
"211","23.038429","10.10.10.144","129.132.2.21","NTP","90","NTP Version 3, client"
"212","23.827028","10.10.10.144","130.149.17.8","NTP","90","NTP Version 3, client"
"213","23.847511","130.149.17.8","10.10.10.144","NTP","90","NTP Version 3, server"
"214","24.054497","10.10.10.144","130.149.17.8","NTP","90","NTP Version 3, client"
"215","24.074159","130.149.17.8","10.10.10.144","NTP","90","NTP Version 3, server"
"216","24.174920","10.10.10.144","10.10.10.1","DNS","81","Standard query 0x6c0b A alt6-mtalk.google.com"
"217","24.187048","10.10.10.1","10.10.10.144","DNS","268","Standard query response 0x6c0b A alt6-mtalk.google.com CNAME alt6.mobile-gtalk4.l.google.com A 74.125.194.188 NS ns4.google.com NS ns2.google.com NS ns1.google.com NS ns3.google.com A 216.239.32.10 A 216.239.34.10 A 216.239.36.10 A 216.239.38.10"
"218","24.259766","10.22.22.138","74.125.194.188","TCP","74","56593  >  5228 [SYN] Seq=0 Win=14600 Len=0 MSS=1460 SACK_PERM=1 TSval=18762753 TSecr=0 WS=128"
"219","24.472888","10.10.10.144","10.10.10.1","DNS","72","Standard query 0xeded A api.xbcs.net"
"220","24.473015","10.10.10.1","10.10.10.144","DNS","270","Standard query response 0xeded A api.xbcs.net CNAME prod1-api-xbcs-net-889336557.us-east-1.elb.amazonaws.com A 23.21.117.32 A 204.236.228.222 A 184.73.254.250 A 174.129.249.52 A 50.17.221.66 A 23.23.111.129 A 23.21.226.117 A 23.21.138.13"
"221","24.474299","10.10.10.144","23.21.117.32","TCP","66","3957  >  8443 [SYN] Seq=0 Win=5840 Len=0 MSS=1460 SACK_PERM=1 WS=2"
"222","24.573584","23.21.117.32","10.10.10.144","TCP","66","8443  >  3957 [SYN, ACK] Seq=0 Ack=1 Win=14600 Len=0 MSS=1380 SACK_PERM=1 WS=256"
"223","24.575289","10.10.10.144","23.21.117.32","TCP","54","3957  >  8443 [ACK] Seq=1 Ack=1 Win=5840 Len=0"
"224","24.607101","10.10.10.144","23.21.117.32","TCP","281","3957  >  8443 [PSH, ACK] Seq=1 Ack=1 Win=5840 Len=227"
"225","24.706495","23.21.117.32","10.10.10.144","TCP","54","8443  >  3957 [ACK] Seq=1 Ack=228 Win=15872 Len=0"
"226","24.706793","23.21.117.32","10.10.10.144","TCP","1434","8443  >  3957 [ACK] Seq=1 Ack=228 Win=15872 Len=1380"
"227","24.706810","23.21.117.32","10.10.10.144","TCP","1434","8443  >  3957 [ACK] Seq=1381 Ack=228 Win=15872 Len=1380"
"228","24.706834","23.21.117.32","10.10.10.144","TCP","1390","8443  >  3957 [PSH, ACK] Seq=2761 Ack=228 Win=15872 Len=1336"
"229","24.706838","23.21.117.32","10.10.10.144","TCP","857","8443  >  3957 [PSH, ACK] Seq=4097 Ack=228 Win=15872 Len=803"
"230","24.708350","10.10.10.144","23.21.117.32","TCP","54","3957  >  8443 [ACK] Seq=228 Ack=1381 Win=8600 Len=0"
"231","24.708440","10.10.10.144","23.21.117.32","TCP","54","3957  >  8443 [ACK] Seq=228 Ack=2761 Win=11360 Len=0"
"232","24.708541","10.10.10.144","23.21.117.32","TCP","54","3957  >  8443 [ACK] Seq=228 Ack=4097 Win=14120 Len=0"
"233","24.708668","10.10.10.144","23.21.117.32","TCP","54","3957  >  8443 [ACK] Seq=228 Ack=4900 Win=16880 Len=0"
"234","24.762539","10.10.10.144","23.21.117.32","TCP","380","3957  >  8443 [PSH, ACK] Seq=228 Ack=4900 Win=16880 Len=326"
"235","24.863904","23.21.117.32","10.10.10.144","TCP","113","8443  >  3957 [PSH, ACK] Seq=4900 Ack=554 Win=16896 Len=59"
"236","24.865705","10.10.10.144","23.21.117.32","TCP","54","3957  >  8443 [ACK] Seq=554 Ack=4959 Win=16880 Len=0"
"237","24.869347","10.10.10.144","23.21.117.32","TCP","763","3957  >  8443 [PSH, ACK] Seq=554 Ack=4959 Win=16880 Len=709"
"238","25.007141","23.21.117.32","10.10.10.144","TCP","54","8443  >  3957 [ACK] Seq=4959 Ack=1263 Win=18176 Len=0"
"239","25.010637","23.21.117.32","10.10.10.144","TCP","747","8443  >  3957 [PSH, ACK] Seq=4959 Ack=1263 Win=18176 Len=693"
"240","25.019389","10.10.10.144","23.21.117.32","TCP","91","3957  >  8443 [PSH, ACK] Seq=1263 Ack=5652 Win=16880 Len=37"
"241","25.024703","10.10.10.144","23.21.117.32","TCP","54","3957  >  8443 [FIN, ACK] Seq=1300 Ack=5652 Win=16880 Len=0"
"242","25.062118","10.22.22.138","23.23.160.249","TCP","74","[TCP Retransmission] 34700  >  443 [SYN] Seq=0 Win=14600 Len=0 MSS=1460 SACK_PERM=1 TSval=18762912 TSecr=0 WS=128"
"243","25.118527","23.21.117.32","10.10.10.144","TCP","54","8443  >  3957 [ACK] Seq=5652 Ack=1300 Win=18176 Len=0"
"244","25.118554","23.21.117.32","10.10.10.144","TCP","91","8443  >  3957 [PSH, ACK] Seq=5652 Ack=1300 Win=18176 Len=37"
"245","25.118559","23.21.117.32","10.10.10.144","TCP","54","8443  >  3957 [FIN, ACK] Seq=5689 Ack=1300 Win=18176 Len=0"
"246","25.119498","10.10.10.144","23.21.117.32","TCP","54","3957  >  8443 [RST] Seq=1300 Win=0 Len=0"
"247","25.119544","10.10.10.144","23.21.117.32","TCP","54","3957  >  8443 [RST] Seq=1300 Win=0 Len=0"
"248","25.262090","10.22.22.138","74.125.194.188","TCP","74","[TCP Retransmission] 56593  >  5228 [SYN] Seq=0 Win=14600 Len=0 MSS=1460 SACK_PERM=1 TSval=18762953 TSecr=0 WS=128"
"249","26.804212","10.22.22.138","216.58.214.110","TCP","74","[TCP Retransmission] 46560  >  443 [SYN] Seq=0 Win=14600 Len=0 MSS=1460 SACK_PERM=1 TSval=18763260 TSecr=0 WS=128"
"250","27.273196","10.22.22.138","74.125.194.188","TCP","74","[TCP Retransmission] 56593  >  5228 [SYN] Seq=0 Win=14600 Len=0 MSS=1460 SACK_PERM=1 TSval=18763354 TSecr=0 WS=128"
"251","31.285255","10.22.22.138","74.125.194.188","TCP","74","[TCP Retransmission] 56593  >  5228 [SYN] Seq=0 Win=14600 Len=0 MSS=1460 SACK_PERM=1 TSval=18764156 TSecr=0 WS=128"
"252","32.208072","10.22.22.138","216.58.214.110","TCP","74","45669  >  80 [SYN] Seq=0 Win=14600 Len=0 MSS=1460 SACK_PERM=1 TSval=18764340 TSecr=0 WS=128"
"253","33.204141","10.22.22.138","216.58.214.110","TCP","74","[TCP Retransmission] 45669  >  80 [SYN] Seq=0 Win=14600 Len=0 MSS=1460 SACK_PERM=1 TSval=18764540 TSecr=0 WS=128"
"254","34.665028","10.22.22.138","174.129.248.41","TCP","74","[TCP Retransmission] 57759  >  443 [SYN] Seq=0 Win=14600 Len=0 MSS=1460 SACK_PERM=1 TSval=18764832 TSecr=0 WS=128"
"255","34.818707","10.22.22.138","216.58.214.110","TCP","74","[TCP Retransmission] 46560  >  443 [SYN] Seq=0 Win=14600 Len=0 MSS=1460 SACK_PERM=1 TSval=18764864 TSecr=0 WS=128"
"256","35.202440","10.22.22.138","216.58.214.110","TCP","74","[TCP Retransmission] 45669  >  80 [SYN] Seq=0 Win=14600 Len=0 MSS=1460 SACK_PERM=1 TSval=18764941 TSecr=0 WS=128"
"257","36.535964","10.10.10.144","10.10.10.1","DNS","72","Standard query 0x8090 A api.xbcs.net"
"258","36.536111","10.10.10.1","10.10.10.144","DNS","270","Standard query response 0x8090 A api.xbcs.net CNAME prod1-api-xbcs-net-889336557.us-east-1.elb.amazonaws.com A 23.21.138.13 A 23.21.117.32 A 204.236.228.222 A 184.73.254.250 A 174.129.249.52 A 50.17.221.66 A 23.23.111.129 A 23.21.226.117"
"259","36.538946","10.10.10.144","23.21.138.13","TCP","66","4902  >  8443 [SYN] Seq=0 Win=5840 Len=0 MSS=1460 SACK_PERM=1 WS=2"
"260","36.640130","23.21.138.13","10.10.10.144","TCP","66","8443  >  4902 [SYN, ACK] Seq=0 Ack=1 Win=14600 Len=0 MSS=1380 SACK_PERM=1 WS=256"
"261","36.642661","10.10.10.144","23.21.138.13","TCP","54","4902  >  8443 [ACK] Seq=1 Ack=1 Win=5840 Len=0"
"262","36.674296","10.10.10.144","23.21.138.13","TCP","281","4902  >  8443 [PSH, ACK] Seq=1 Ack=1 Win=5840 Len=227"
"263","36.775221","23.21.138.13","10.10.10.144","TCP","54","8443  >  4902 [ACK] Seq=1 Ack=228 Win=15872 Len=0"
"264","36.775618","23.21.138.13","10.10.10.144","TCP","1434","8443  >  4902 [ACK] Seq=1 Ack=228 Win=15872 Len=1380"
"265","36.775640","23.21.138.13","10.10.10.144","TCP","1434","8443  >  4902 [ACK] Seq=1381 Ack=228 Win=15872 Len=1380"
"266","36.775656","23.21.138.13","10.10.10.144","TCP","1390","8443  >  4902 [PSH, ACK] Seq=2761 Ack=228 Win=15872 Len=1336"
"267","36.775662","23.21.138.13","10.10.10.144","TCP","857","8443  >  4902 [PSH, ACK] Seq=4097 Ack=228 Win=15872 Len=803"
"268","36.789596","10.10.10.144","23.21.138.13","TCP","54","4902  >  8443 [ACK] Seq=228 Ack=1381 Win=8600 Len=0"
"269","36.815356","10.10.10.144","23.21.138.13","TCP","54","4902  >  8443 [ACK] Seq=228 Ack=2761 Win=11360 Len=0"
"270","36.837936","10.10.10.144","23.21.138.13","TCP","54","4902  >  8443 [ACK] Seq=228 Ack=4097 Win=14120 Len=0"
"271","36.837991","10.10.10.144","23.21.138.13","TCP","54","4902  >  8443 [ACK] Seq=228 Ack=4900 Win=16880 Len=0"
"272","36.982363","10.10.10.144","23.21.138.13","TCP","380","4902  >  8443 [PSH, ACK] Seq=228 Ack=4900 Win=16880 Len=326"
"273","37.085492","23.21.138.13","10.10.10.144","TCP","113","8443  >  4902 [PSH, ACK] Seq=4900 Ack=554 Win=16896 Len=59"
"274","37.090706","10.10.10.144","23.21.138.13","TCP","54","4902  >  8443 [ACK] Seq=554 Ack=4959 Win=16880 Len=0"
"275","37.092663","10.10.10.144","23.21.138.13","TCP","315","4902  >  8443 [PSH, ACK] Seq=554 Ack=4959 Win=16880 Len=261"
"276","37.109081","10.10.10.144","23.21.138.13","TCP","1434","4902  >  8443 [ACK] Seq=815 Ack=4959 Win=16880 Len=1380"
"277","37.210232","23.21.138.13","10.10.10.144","TCP","54","8443  >  4902 [ACK] Seq=4959 Ack=2195 Win=20736 Len=0"
"278","37.212349","10.10.10.144","23.21.138.13","TCP","1434","4902  >  8443 [ACK] Seq=2195 Ack=4959 Win=16880 Len=1380"
"279","37.212601","10.10.10.144","23.21.138.13","TCP","1434","4902  >  8443 [ACK] Seq=3575 Ack=4959 Win=16880 Len=1380"
"280","37.213629","10.10.10.144","23.21.138.13","TCP","1434","4902  >  8443 [ACK] Seq=4955 Ack=4959 Win=16880 Len=1380"
"281","37.313911","23.21.138.13","10.10.10.144","TCP","54","8443  >  4902 [ACK] Seq=4959 Ack=4955 Win=26624 Len=0"
"282","37.315844","10.10.10.144","23.21.138.13","TCP","1434","4902  >  8443 [ACK] Seq=6335 Ack=4959 Win=16880 Len=1380"
"283","37.316098","10.10.10.144","23.21.138.13","TCP","1434","4902  >  8443 [ACK] Seq=7715 Ack=4959 Win=16880 Len=1380"
"284","37.316399","10.10.10.144","23.21.138.13","TCP","1434","4902  >  8443 [ACK] Seq=9095 Ack=4959 Win=16880 Len=1380"
"285","37.353336","23.21.138.13","10.10.10.144","TCP","54","8443  >  4902 [ACK] Seq=4959 Ack=6335 Win=29696 Len=0"
"286","37.355525","10.10.10.144","23.21.138.13","TCP","1434","4902  >  8443 [ACK] Seq=10475 Ack=4959 Win=16880 Len=1380"
"287","37.355603","10.10.10.144","23.21.138.13","TCP","77","4902  >  8443 [PSH, ACK] Seq=11855 Ack=4959 Win=16880 Len=23"
"288","37.416927","23.21.138.13","10.10.10.144","TCP","54","8443  >  4902 [ACK] Seq=4959 Ack=7715 Win=32512 Len=0"
"289","37.417112","23.21.138.13","10.10.10.144","TCP","54","8443  >  4902 [ACK] Seq=4959 Ack=9095 Win=35584 Len=0"
"290","37.417508","23.21.138.13","10.10.10.144","TCP","54","8443  >  4902 [ACK] Seq=4959 Ack=10475 Win=38400 Len=0"
"291","37.419038","10.10.10.144","23.21.138.13","TCP","1434","4902  >  8443 [ACK] Seq=11878 Ack=4959 Win=16880 Len=1380"
"292","37.456635","23.21.138.13","10.10.10.144","TCP","54","8443  >  4902 [ACK] Seq=4959 Ack=11878 Win=41216 Len=0"
"293","37.458027","10.10.10.144","23.21.138.13","TCP","1412","4902  >  8443 [PSH, ACK] Seq=13258 Ack=4959 Win=16880 Len=1358"
"294","37.502510","10.10.10.144","23.21.138.13","TCP","1434","4902  >  8443 [ACK] Seq=14616 Ack=4959 Win=16880 Len=1380"
"295","37.520208","23.21.138.13","10.10.10.144","TCP","54","8443  >  4902 [ACK] Seq=4959 Ack=13258 Win=42240 Len=0"
"296","37.559164","23.21.138.13","10.10.10.144","TCP","54","8443  >  4902 [ACK] Seq=4959 Ack=14616 Win=42240 Len=0"
"297","37.560488","10.10.10.144","23.21.138.13","TCP","1301","4902  >  8443 [PSH, ACK] Seq=15996 Ack=4959 Win=16880 Len=1247"
"298","37.576991","10.10.10.144","23.21.138.13","TCP","1434","4902  >  8443 [ACK] Seq=17243 Ack=4959 Win=16880 Len=1380"
"299","37.593257","10.10.10.144","23.21.138.13","TCP","1434","4902  >  8443 [ACK] Seq=18623 Ack=4959 Win=16880 Len=1380"
"300","37.603633","23.21.138.13","10.10.10.144","TCP","54","8443  >  4902 [ACK] Seq=4959 Ack=15996 Win=42240 Len=0"
"301","37.633791","10.10.10.144","23.21.138.13","TCP","1434","4902  >  8443 [ACK] Seq=20003 Ack=4959 Win=16880 Len=1380"
"302","37.649845","10.10.10.144","23.21.138.13","TCP","1434","4902  >  8443 [ACK] Seq=21383 Ack=4959 Win=16880 Len=1380"
"303","37.661607","23.21.138.13","10.10.10.144","TCP","54","8443  >  4902 [ACK] Seq=4959 Ack=17243 Win=42240 Len=0"
"304","37.662946","10.10.10.144","23.21.138.13","TCP","1120","4902  >  8443 [PSH, ACK] Seq=22763 Ack=4959 Win=16880 Len=1066"
"305","37.678129","23.21.138.13","10.10.10.144","TCP","54","8443  >  4902 [ACK] Seq=4959 Ack=18623 Win=42240 Len=0"
"306","37.694419","23.21.138.13","10.10.10.144","TCP","54","8443  >  4902 [ACK] Seq=4959 Ack=20003 Win=42240 Len=0"
"307","37.718509","10.10.10.144","23.21.138.13","TCP","1434","4902  >  8443 [ACK] Seq=23829 Ack=4959 Win=16880 Len=1380"
"308","37.735220","23.21.138.13","10.10.10.144","TCP","54","8443  >  4902 [ACK] Seq=4959 Ack=21383 Win=42240 Len=0"
"309","37.737165","10.10.10.144","23.21.138.13","TCP","1434","4902  >  8443 [ACK] Seq=25209 Ack=4959 Win=16880 Len=1380"
"310","37.750656","10.10.10.144","23.21.138.13","TCP","1434","4902  >  8443 [ACK] Seq=26589 Ack=4959 Win=16880 Len=1380"
"311","37.750975","23.21.138.13","10.10.10.144","TCP","54","8443  >  4902 [ACK] Seq=4959 Ack=22763 Win=42240 Len=0"
"312","37.764264","23.21.138.13","10.10.10.144","TCP","54","8443  >  4902 [ACK] Seq=4959 Ack=23829 Win=42240 Len=0"
"313","37.765349","10.10.10.144","23.21.138.13","TCP","1279","4902  >  8443 [PSH, ACK] Seq=27969 Ack=4959 Win=16880 Len=1225"
"314","37.781431","10.10.10.144","23.21.138.13","TCP","1434","4902  >  8443 [ACK] Seq=29194 Ack=4959 Win=16880 Len=1380"
"315","37.798243","10.10.10.144","23.21.138.13","TCP","1434","4902  >  8443 [ACK] Seq=30574 Ack=4959 Win=16880 Len=1380"
"316","37.838423","23.21.138.13","10.10.10.144","TCP","54","8443  >  4902 [ACK] Seq=4959 Ack=26589 Win=42240 Len=0"
"317","37.866493","23.21.138.13","10.10.10.144","TCP","54","8443  >  4902 [ACK] Seq=4959 Ack=29194 Win=42240 Len=0"
"318","37.867415","10.10.10.144","23.21.138.13","TCP","217","4902  >  8443 [PSH, ACK] Seq=31954 Ack=4959 Win=16880 Len=163"
"319","37.899345","23.21.138.13","10.10.10.144","TCP","54","8443  >  4902 [ACK] Seq=4959 Ack=31954 Win=42240 Len=0"
"320","37.968871","23.21.138.13","10.10.10.144","TCP","54","8443  >  4902 [ACK] Seq=4959 Ack=32117 Win=42240 Len=0"
"321","37.985577","23.21.138.13","10.10.10.144","TCP","1434","8443  >  4902 [ACK] Seq=4959 Ack=32117 Win=42240 Len=1380"
"322","37.985595","23.21.138.13","10.10.10.144","TCP","151","8443  >  4902 [PSH, ACK] Seq=6339 Ack=32117 Win=42240 Len=97"
"323","37.988102","10.10.10.144","23.21.138.13","TCP","54","4902  >  8443 [ACK] Seq=32117 Ack=6436 Win=16880 Len=0"
"324","38.000627","10.10.10.144","23.21.138.13","TCP","91","4902  >  8443 [PSH, ACK] Seq=32117 Ack=6436 Win=16880 Len=37"
"325","38.005876","10.10.10.144","23.21.138.13","TCP","54","4902  >  8443 [FIN, ACK] Seq=32154 Ack=6436 Win=16880 Len=0"
"326","38.102305","23.21.138.13","10.10.10.144","TCP","91","8443  >  4902 [PSH, ACK] Seq=6436 Ack=32154 Win=42240 Len=37"
"327","38.102328","23.21.138.13","10.10.10.144","TCP","54","8443  >  4902 [FIN, ACK] Seq=6473 Ack=32154 Win=42240 Len=0"
"328","38.103429","10.10.10.144","23.21.138.13","TCP","54","4902  >  8443 [RST] Seq=32154 Win=0 Len=0"
"329","38.105037","10.10.10.144","23.21.138.13","TCP","54","4902  >  8443 [RST] Seq=32154 Win=0 Len=0"
"330","39.105779","10.10.10.144","54.224.226.163","STUN","202","Refresh Request user: 94103ECD3764 realm: belkin.org with nonce"
"331","39.205474","54.224.226.163","10.10.10.144","TCP","54","3478  >  3849 [ACK] Seq=245 Ack=353 Win=31360 Len=0"
"332","39.205495","54.224.226.163","10.10.10.144","STUN","134","Refresh Success Response lifetime: 330"
"333","39.207011","10.10.10.144","54.224.226.163","TCP","54","3849  >  3478 [ACK] Seq=353 Ack=325 Win=5840 Len=0"
"334","39.302255","10.22.22.138","74.125.194.188","TCP","74","[TCP Retransmission] 56593  >  5228 [SYN] Seq=0 Win=14600 Len=0 MSS=1460 SACK_PERM=1 TSval=18765760 TSecr=0 WS=128"
"335","39.622749","10.10.10.144","10.10.10.1","DNS","72","Standard query 0x161a A api.xbcs.net"
"336","39.622985","10.10.10.1","10.10.10.144","DNS","270","Standard query response 0x161a A api.xbcs.net CNAME prod1-api-xbcs-net-889336557.us-east-1.elb.amazonaws.com A 23.21.226.117 A 23.21.138.13 A 23.21.117.32 A 204.236.228.222 A 184.73.254.250 A 174.129.249.52 A 50.17.221.66 A 23.23.111.129"
"337","39.631229","10.22.22.138","23.21.226.117","TCP","74","55101  >  8443 [SYN] Seq=0 Win=14600 Len=0 MSS=1460 SACK_PERM=1 TSval=18765827 TSecr=0 WS=128"
"338","39.920524","10.10.10.144","10.10.10.1","DNS","72","Standard query 0x21cf A api.xbcs.net"
"339","39.920654","10.10.10.1","10.10.10.144","DNS","270","Standard query response 0x21cf A api.xbcs.net CNAME prod1-api-xbcs-net-889336557.us-east-1.elb.amazonaws.com A 23.23.111.129 A 23.21.226.117 A 23.21.138.13 A 23.21.117.32 A 204.236.228.222 A 184.73.254.250 A 174.129.249.52 A 50.17.221.66"
"340","39.922464","10.10.10.144","23.23.111.129","TCP","66","3364  >  8443 [SYN] Seq=0 Win=5840 Len=0 MSS=1460 SACK_PERM=1 WS=2"
"341","40.042685","23.23.111.129","10.10.10.144","TCP","66","8443  >  3364 [SYN, ACK] Seq=0 Ack=1 Win=14600 Len=0 MSS=1380 SACK_PERM=1 WS=256"
"342","40.043495","10.10.10.144","23.23.111.129","TCP","54","3364  >  8443 [ACK] Seq=1 Ack=1 Win=5840 Len=0"
"343","40.135350","10.10.10.144","23.23.111.129","TCP","281","3364  >  8443 [PSH, ACK] Seq=1 Ack=1 Win=5840 Len=227"
"344","40.256742","23.23.111.129","10.10.10.144","TCP","54","8443  >  3364 [ACK] Seq=1 Ack=228 Win=15872 Len=0"
"345","40.257170","23.23.111.129","10.10.10.144","TCP","1434","8443  >  3364 [ACK] Seq=1 Ack=228 Win=15872 Len=1380"
"346","40.257194","23.23.111.129","10.10.10.144","TCP","1434","8443  >  3364 [ACK] Seq=1381 Ack=228 Win=15872 Len=1380"
"347","40.257241","23.23.111.129","10.10.10.144","TCP","1390","8443  >  3364 [PSH, ACK] Seq=2761 Ack=228 Win=15872 Len=1336"
"348","40.257255","23.23.111.129","10.10.10.144","TCP","857","8443  >  3364 [PSH, ACK] Seq=4097 Ack=228 Win=15872 Len=803"
"349","40.261825","10.10.10.144","23.23.111.129","TCP","54","3364  >  8443 [ACK] Seq=228 Ack=1381 Win=8600 Len=0"
"350","40.261885","10.10.10.144","23.23.111.129","TCP","54","3364  >  8443 [ACK] Seq=228 Ack=2761 Win=11360 Len=0"
"351","40.261959","10.10.10.144","23.23.111.129","TCP","54","3364  >  8443 [ACK] Seq=228 Ack=4097 Win=14120 Len=0"
"352","40.264900","10.10.10.144","23.23.111.129","TCP","54","3364  >  8443 [ACK] Seq=228 Ack=4900 Win=16880 Len=0"
"353","40.314958","10.10.10.144","23.23.111.129","TCP","380","3364  >  8443 [PSH, ACK] Seq=228 Ack=4900 Win=16880 Len=326"
"354","40.443846","23.23.111.129","10.10.10.144","TCP","113","8443  >  3364 [PSH, ACK] Seq=4900 Ack=554 Win=16896 Len=59"
"355","40.445127","10.10.10.144","23.23.111.129","TCP","54","3364  >  8443 [ACK] Seq=554 Ack=4959 Win=16880 Len=0"
"356","40.448351","10.10.10.144","23.23.111.129","TCP","331","3364  >  8443 [PSH, ACK] Seq=554 Ack=4959 Win=16880 Len=277"
"357","40.574424","23.23.111.129","10.10.10.144","TCP","107","8443  >  3364 [PSH, ACK] Seq=4959 Ack=831 Win=17920 Len=53"
"358","40.612084","10.10.10.144","23.23.111.129","TCP","54","3364  >  8443 [ACK] Seq=831 Ack=5012 Win=16880 Len=0"
"359","40.918441","10.10.10.144","23.23.111.129","TCP","91","3364  >  8443 [PSH, ACK] Seq=831 Ack=5012 Win=16880 Len=37"
"360","40.934280","10.10.10.144","23.23.111.129","TCP","1434","3364  >  8443 [ACK] Seq=868 Ack=5012 Win=16880 Len=1380"
"361","41.004191","10.10.10.144","224.0.0.22","IGMPv3","54","Membership Report / Join group 239.255.255.250 for any sources"
"362","41.058897","23.23.111.129","10.10.10.144","TCP","54","8443  >  3364 [ACK] Seq=5012 Ack=2248 Win=20736 Len=0"
"363","41.059866","10.10.10.144","23.23.111.129","TCP","1434","3364  >  8443 [ACK] Seq=2248 Ack=5012 Win=16880 Len=1380"
"364","41.060093","10.10.10.144","23.23.111.129","TCP","1434","3364  >  8443 [ACK] Seq=3628 Ack=5012 Win=16880 Len=1380"
"365","41.060426","10.10.10.144","23.23.111.129","TCP","1434","3364  >  8443 [ACK] Seq=5008 Ack=5012 Win=16880 Len=1380"
"366","41.165246","10.10.10.144","239.255.255.250","SSDP","423","NOTIFY * HTTP/1.1 "
"367","41.165364","10.10.10.144","239.255.255.250","SSDP","421","NOTIFY * HTTP/1.1 "
"368","41.165490","10.10.10.144","239.255.255.250","SSDP","445","NOTIFY * HTTP/1.1 "
"369","41.165639","10.10.10.144","239.255.255.250","SSDP","453","NOTIFY * HTTP/1.1 "
"370","41.166149","10.10.10.144","239.255.255.250","SSDP","451","NOTIFY * HTTP/1.1 "
"371","41.166915","10.10.10.144","239.255.255.250","SSDP","455","NOTIFY * HTTP/1.1 "
"372","41.167967","10.10.10.144","239.255.255.250","SSDP","463","NOTIFY * HTTP/1.1 "
"373","41.169854","10.10.10.144","239.255.255.250","SSDP","445","NOTIFY * HTTP/1.1 "
"374","41.170648","10.10.10.144","239.255.255.250","SSDP","451","NOTIFY * HTTP/1.1 "
"375","41.173715","10.10.10.144","239.255.255.250","SSDP","459","NOTIFY * HTTP/1.1 "
"376","41.173875","10.10.10.144","239.255.255.250","SSDP","455","NOTIFY * HTTP/1.1 "
"377","41.174031","10.10.10.144","239.255.255.250","SSDP","447","NOTIFY * HTTP/1.1 "
"378","41.174199","10.10.10.144","239.255.255.250","SSDP","457","NOTIFY * HTTP/1.1 "
"379","41.187820","23.23.111.129","10.10.10.144","TCP","54","8443  >  3364 [ACK] Seq=5012 Ack=5008 Win=26624 Len=0"
"380","41.195641","10.10.10.144","23.23.111.129","TCP","1434","3364  >  8443 [ACK] Seq=6388 Ack=5012 Win=16880 Len=1380"
"381","41.195865","10.10.10.144","23.23.111.129","TCP","1434","3364  >  8443 [ACK] Seq=7768 Ack=5012 Win=16880 Len=1380"
"382","41.196195","10.10.10.144","23.23.111.129","TCP","1434","3364  >  8443 [ACK] Seq=9148 Ack=5012 Win=16880 Len=1380"
"383","41.227727","23.23.111.129","10.10.10.144","TCP","54","8443  >  3364 [ACK] Seq=5012 Ack=6388 Win=29696 Len=0"
"384","41.250353","10.10.10.144","23.23.111.129","TCP","1434","3364  >  8443 [ACK] Seq=10528 Ack=5012 Win=16880 Len=1380"
"385","41.251174","10.10.10.144","23.23.111.129","TCP","1434","3364  >  8443 [ACK] Seq=11908 Ack=5012 Win=16880 Len=1380"
"386","41.320248","23.23.111.129","10.10.10.144","TCP","54","8443  >  3364 [ACK] Seq=5012 Ack=7768 Win=32512 Len=0"
"387","41.320418","23.23.111.129","10.10.10.144","TCP","54","8443  >  3364 [ACK] Seq=5012 Ack=9148 Win=35584 Len=0"
"388","41.320798","23.23.111.129","10.10.10.144","TCP","54","8443  >  3364 [ACK] Seq=5012 Ack=10528 Win=38400 Len=0"
"389","41.321086","10.10.10.144","23.23.111.129","TCP","1434","3364  >  8443 [ACK] Seq=13288 Ack=5012 Win=16880 Len=1380"
"390","41.321164","10.10.10.144","23.23.111.129","TCP","55","3364  >  8443 [PSH, ACK] Seq=14668 Ack=5012 Win=16880 Len=1"
"391","41.337959","10.10.10.144","23.23.111.129","TCP","1434","3364  >  8443 [ACK] Seq=14669 Ack=5012 Win=16880 Len=1380"
"392","41.353836","10.10.10.144","23.23.111.129","TCP","1434","3364  >  8443 [ACK] Seq=16049 Ack=5012 Win=16880 Len=1380"
"393","41.376795","23.23.111.129","10.10.10.144","TCP","54","8443  >  3364 [ACK] Seq=5012 Ack=11908 Win=41216 Len=0"
"394","41.377480","23.23.111.129","10.10.10.144","TCP","54","8443  >  3364 [ACK] Seq=5012 Ack=13288 Win=42240 Len=0"
"395","41.394185","10.10.10.144","23.23.111.129","TCP","1434","3364  >  8443 [ACK] Seq=17429 Ack=5012 Win=16880 Len=1380"
"396","41.410327","10.10.10.144","23.23.111.129","TCP","1434","3364  >  8443 [ACK] Seq=18809 Ack=5012 Win=16880 Len=1380"
"397","41.426371","10.10.10.144","23.23.111.129","TCP","1434","3364  >  8443 [ACK] Seq=20189 Ack=5012 Win=16880 Len=1380"
"398","41.443675","23.23.111.129","10.10.10.144","TCP","54","8443  >  3364 [ACK] Seq=5012 Ack=14668 Win=42240 Len=0"
"399","41.443700","23.23.111.129","10.10.10.144","TCP","54","8443  >  3364 [ACK] Seq=5012 Ack=14669 Win=42240 Len=0"
"400","41.444689","10.10.10.144","23.23.111.129","TCP","1434","3364  >  8443 [ACK] Seq=21569 Ack=5012 Win=16880 Len=1380"
"401","41.444729","10.10.10.144","23.23.111.129","TCP","247","3364  >  8443 [PSH, ACK] Seq=22949 Ack=5012 Win=16880 Len=193"
"402","41.460397","23.23.111.129","10.10.10.144","TCP","54","8443  >  3364 [ACK] Seq=5012 Ack=16049 Win=42240 Len=0"
"403","41.460634","10.10.10.144","23.23.111.129","TCP","1434","3364  >  8443 [ACK] Seq=23142 Ack=5012 Win=16880 Len=1380"
"404","41.476358","10.10.10.144","23.23.111.129","TCP","1434","3364  >  8443 [ACK] Seq=24522 Ack=5012 Win=16880 Len=1380"
"405","41.477833","23.23.111.129","10.10.10.144","TCP","54","8443  >  3364 [ACK] Seq=5012 Ack=17429 Win=42240 Len=0"
"406","41.493775","10.10.10.144","23.23.111.129","TCP","1434","3364  >  8443 [ACK] Seq=25902 Ack=5012 Win=16880 Len=1380"
"407","41.509521","10.10.10.144","23.23.111.129","TCP","1434","3364  >  8443 [ACK] Seq=27282 Ack=5012 Win=16880 Len=1380"
"408","41.520249","23.23.111.129","10.10.10.144","TCP","54","8443  >  3364 [ACK] Seq=5012 Ack=18809 Win=42240 Len=0"
"409","41.536884","10.10.10.144","23.23.111.129","TCP","1434","3364  >  8443 [ACK] Seq=28662 Ack=5012 Win=16880 Len=1380"
"410","41.537550","23.23.111.129","10.10.10.144","TCP","54","8443  >  3364 [ACK] Seq=5012 Ack=20189 Win=42240 Len=0"
"411","41.543000","DavidEle_06:08:ba","BelkinIn_cd:37:65","ARP","42","Who has 10.10.10.144? Tell 10.10.10.1"
"412","41.545616","BelkinIn_cd:37:65","DavidEle_06:08:ba","ARP","42","10.10.10.144 is at 94:10:3e:cd:37:65"
"413","41.553582","10.10.10.144","23.23.111.129","TCP","1434","3364  >  8443 [ACK] Seq=30042 Ack=5012 Win=16880 Len=1380"
"414","41.554609","23.23.111.129","10.10.10.144","TCP","54","8443  >  3364 [ACK] Seq=5012 Ack=21569 Win=42240 Len=0"
"415","41.570528","23.23.111.129","10.10.10.144","TCP","54","8443  >  3364 [ACK] Seq=5012 Ack=22949 Win=42240 Len=0"
"416","41.570552","23.23.111.129","10.10.10.144","TCP","54","8443  >  3364 [ACK] Seq=5012 Ack=23142 Win=42240 Len=0"
"417","41.571811","10.10.10.144","23.23.111.129","TCP","1434","3364  >  8443 [ACK] Seq=31422 Ack=5012 Win=16880 Len=1380"
"418","41.572557","10.10.10.144","23.23.111.129","TCP","236","3364  >  8443 [PSH, ACK] Seq=32802 Ack=5012 Win=16880 Len=182"
"419","41.602722","23.23.111.129","10.10.10.144","TCP","54","8443  >  3364 [ACK] Seq=5012 Ack=25902 Win=42240 Len=0"
"420","41.611868","10.10.10.144","23.23.111.129","TCP","1434","3364  >  8443 [ACK] Seq=32984 Ack=5012 Win=16880 Len=1380"
"421","41.635088","23.23.111.129","10.10.10.144","TCP","54","8443  >  3364 [ACK] Seq=5012 Ack=28662 Win=42240 Len=0"
"422","41.680363","23.23.111.129","10.10.10.144","TCP","54","8443  >  3364 [ACK] Seq=5012 Ack=31422 Win=42240 Len=0"
"423","41.699517","23.23.111.129","10.10.10.144","TCP","54","8443  >  3364 [ACK] Seq=5012 Ack=32984 Win=42240 Len=0"
"424","41.700212","10.10.10.144","23.23.111.129","TCP","931","3364  >  8443 [PSH, ACK] Seq=34364 Ack=5012 Win=16880 Len=877"
"425","41.775701","23.23.111.129","10.10.10.144","TCP","54","8443  >  3364 [ACK] Seq=5012 Ack=34364 Win=42240 Len=0"
"426","41.827231","23.23.111.129","10.10.10.144","TCP","54","8443  >  3364 [ACK] Seq=5012 Ack=35241 Win=42240 Len=0"
"427","41.827989","10.10.10.144","23.23.111.129","TCP","942","3364  >  8443 [PSH, ACK] Seq=35241 Ack=5012 Win=16880 Len=888"
"428","41.868782","10.10.10.144","23.23.111.129","TCP","1434","3364  >  8443 [ACK] Seq=36129 Ack=5012 Win=16880 Len=1380"
"429","41.890297","10.10.10.144","23.23.111.129","TCP","1434","3364  >  8443 [ACK] Seq=37509 Ack=5012 Win=16880 Len=1380"
"430","41.900216","10.10.10.144","23.23.111.129","TCP","1434","3364  >  8443 [ACK] Seq=38889 Ack=5012 Win=16880 Len=1380"
"431","41.916787","10.10.10.144","23.23.111.129","TCP","1434","3364  >  8443 [ACK] Seq=40269 Ack=5012 Win=16880 Len=1380"
"432","41.933135","10.10.10.144","23.23.111.129","TCP","1434","3364  >  8443 [ACK] Seq=41649 Ack=5012 Win=16880 Len=1380"
"433","41.952625","23.23.111.129","10.10.10.144","TCP","54","8443  >  3364 [ACK] Seq=5012 Ack=36129 Win=42240 Len=0"
"434","41.953347","10.10.10.144","23.23.111.129","TCP","406","3364  >  8443 [PSH, ACK] Seq=43029 Ack=5012 Win=16880 Len=352"
"435","42.014066","23.23.111.129","10.10.10.144","TCP","54","8443  >  3364 [ACK] Seq=5012 Ack=38889 Win=42240 Len=0"
"436","42.039650","23.23.111.129","10.10.10.144","TCP","54","8443  >  3364 [ACK] Seq=5012 Ack=41649 Win=42240 Len=0"
"437","42.075314","23.23.111.129","10.10.10.144","TCP","54","8443  >  3364 [ACK] Seq=5012 Ack=43381 Win=42240 Len=0"
"438","42.162000","23.23.111.129","10.10.10.144","TCP","1434","8443  >  3364 [ACK] Seq=5012 Ack=43381 Win=42240 Len=1380"
"439","42.162022","23.23.111.129","10.10.10.144","TCP","519","8443  >  3364 [PSH, ACK] Seq=6392 Ack=43381 Win=42240 Len=465"
"440","42.162861","10.10.10.144","23.23.111.129","TCP","54","3364  >  8443 [ACK] Seq=43381 Ack=6392 Win=16880 Len=0"
"441","42.163091","10.10.10.144","23.23.111.129","TCP","54","3364  >  8443 [ACK] Seq=43381 Ack=6857 Win=16880 Len=0"
"442","42.196932","10.10.10.144","23.23.111.129","TCP","91","3364  >  8443 [PSH, ACK] Seq=43381 Ack=6857 Win=16880 Len=37"
"443","42.210846","10.10.10.144","23.23.111.129","TCP","54","3364  >  8443 [FIN, ACK] Seq=43418 Ack=6857 Win=16880 Len=0"
"444","42.324196","23.23.111.129","10.10.10.144","TCP","54","8443  >  3364 [ACK] Seq=6857 Ack=43418 Win=42240 Len=0"
"445","42.324222","23.23.111.129","10.10.10.144","TCP","91","8443  >  3364 [PSH, ACK] Seq=6857 Ack=43418 Win=42240 Len=37"
"446","42.324299","23.23.111.129","10.10.10.144","TCP","54","8443  >  3364 [FIN, ACK] Seq=6894 Ack=43418 Win=42240 Len=0"
"447","42.324992","10.10.10.144","23.23.111.129","TCP","54","3364  >  8443 [RST] Seq=43418 Win=0 Len=0"
"448","42.325217","10.10.10.144","23.23.111.129","TCP","54","3364  >  8443 [RST] Seq=43418 Win=0 Len=0"
"449","42.900465","10.10.10.144","10.10.10.1","DNS","72","Standard query 0x2da4 A api.xbcs.net"
"450","42.900563","10.10.10.1","10.10.10.144","DNS","270","Standard query response 0x2da4 A api.xbcs.net CNAME prod1-api-xbcs-net-889336557.us-east-1.elb.amazonaws.com A 50.17.221.66 A 23.23.111.129 A 23.21.226.117 A 23.21.138.13 A 23.21.117.32 A 204.236.228.222 A 184.73.254.250 A 174.129.249.52"
"451","42.901940","10.10.10.144","50.17.221.66","TCP","66","3208  >  8443 [SYN] Seq=0 Win=5840 Len=0 MSS=1460 SACK_PERM=1 WS=2"
"452","43.000157","50.17.221.66","10.10.10.144","TCP","66","8443  >  3208 [SYN, ACK] Seq=0 Ack=1 Win=14600 Len=0 MSS=1380 SACK_PERM=1 WS=256"
"453","43.001005","10.10.10.144","50.17.221.66","TCP","54","3208  >  8443 [ACK] Seq=1 Ack=1 Win=5840 Len=0"
"454","43.032225","10.10.10.144","50.17.221.66","TCP","281","3208  >  8443 [PSH, ACK] Seq=1 Ack=1 Win=5840 Len=227"
"455","43.130334","50.17.221.66","10.10.10.144","TCP","54","8443  >  3208 [ACK] Seq=1 Ack=228 Win=15872 Len=0"
"456","43.130689","50.17.221.66","10.10.10.144","TCP","1434","8443  >  3208 [ACK] Seq=1 Ack=228 Win=15872 Len=1380"
"457","43.130710","50.17.221.66","10.10.10.144","TCP","1434","8443  >  3208 [ACK] Seq=1381 Ack=228 Win=15872 Len=1380"
"458","43.130712","50.17.221.66","10.10.10.144","TCP","1390","8443  >  3208 [PSH, ACK] Seq=2761 Ack=228 Win=15872 Len=1336"
"459","43.130717","50.17.221.66","10.10.10.144","TCP","857","8443  >  3208 [PSH, ACK] Seq=4097 Ack=228 Win=15872 Len=803"
"460","43.132833","10.10.10.144","50.17.221.66","TCP","54","3208  >  8443 [ACK] Seq=228 Ack=1381 Win=8600 Len=0"
"461","43.133643","10.10.10.144","50.17.221.66","TCP","54","3208  >  8443 [ACK] Seq=228 Ack=2761 Win=11360 Len=0"
"462","43.133743","10.10.10.144","50.17.221.66","TCP","54","3208  >  8443 [ACK] Seq=228 Ack=4097 Win=14120 Len=0"
"463","43.133840","10.10.10.144","50.17.221.66","TCP","54","3208  >  8443 [ACK] Seq=228 Ack=4900 Win=16880 Len=0"
"464","43.185951","10.10.10.144","50.17.221.66","TCP","380","3208  >  8443 [PSH, ACK] Seq=228 Ack=4900 Win=16880 Len=326"
"465","43.286207","50.17.221.66","10.10.10.144","TCP","113","8443  >  3208 [PSH, ACK] Seq=4900 Ack=554 Win=16896 Len=59"
"466","43.286757","10.10.10.144","50.17.221.66","TCP","54","3208  >  8443 [ACK] Seq=554 Ack=4959 Win=16880 Len=0"
"467","43.290644","10.10.10.144","50.17.221.66","TCP","875","3208  >  8443 [PSH, ACK] Seq=554 Ack=4959 Win=16880 Len=821"
"468","43.426694","50.17.221.66","10.10.10.144","TCP","54","8443  >  3208 [ACK] Seq=4959 Ack=1375 Win=18432 Len=0"
"469","43.515694","50.17.221.66","10.10.10.144","TCP","795","8443  >  3208 [PSH, ACK] Seq=4959 Ack=1375 Win=18432 Len=741"
"470","43.527718","10.10.10.144","50.17.221.66","TCP","91","3208  >  8443 [PSH, ACK] Seq=1375 Ack=5700 Win=16880 Len=37"
"471","43.530336","10.10.10.144","50.17.221.66","TCP","54","3208  >  8443 [FIN, ACK] Seq=1412 Ack=5700 Win=16880 Len=0"
"472","43.625703","50.17.221.66","10.10.10.144","TCP","54","8443  >  3208 [ACK] Seq=5700 Ack=1412 Win=18432 Len=0"
"473","43.625726","50.17.221.66","10.10.10.144","TCP","91","8443  >  3208 [PSH, ACK] Seq=5700 Ack=1412 Win=18432 Len=37"
"474","43.625732","50.17.221.66","10.10.10.144","TCP","54","8443  >  3208 [FIN, ACK] Seq=5737 Ack=1412 Win=18432 Len=0"
"475","43.626605","10.10.10.144","50.17.221.66","TCP","54","3208  >  8443 [RST] Seq=1412 Win=0 Len=0"
"476","43.626684","10.10.10.144","50.17.221.66","TCP","54","3208  >  8443 [RST] Seq=1412 Win=0 Len=0"
"477","44.059347","10.10.10.144","10.10.10.1","DNS","72","Standard query 0x8d6c A api.xbcs.net"
"478","44.059442","10.10.10.1","10.10.10.144","DNS","270","Standard query response 0x8d6c A api.xbcs.net CNAME prod1-api-xbcs-net-889336557.us-east-1.elb.amazonaws.com A 174.129.249.52 A 50.17.221.66 A 23.23.111.129 A 23.21.226.117 A 23.21.138.13 A 23.21.117.32 A 204.236.228.222 A 184.73.254.250"
"479","44.061076","10.10.10.144","174.129.249.52","TCP","66","4345  >  8443 [SYN] Seq=0 Win=5840 Len=0 MSS=1460 SACK_PERM=1 WS=2"
"480","44.160537","174.129.249.52","10.10.10.144","TCP","66","8443  >  4345 [SYN, ACK] Seq=0 Ack=1 Win=14600 Len=0 MSS=1380 SACK_PERM=1 WS=256"
"481","44.161232","10.10.10.144","174.129.249.52","TCP","54","4345  >  8443 [ACK] Seq=1 Ack=1 Win=5840 Len=0"
"482","44.192334","10.10.10.144","174.129.249.52","TCP","281","4345  >  8443 [PSH, ACK] Seq=1 Ack=1 Win=5840 Len=227"
"483","44.291514","174.129.249.52","10.10.10.144","TCP","54","8443  >  4345 [ACK] Seq=1 Ack=228 Win=15872 Len=0"
"484","44.291923","174.129.249.52","10.10.10.144","TCP","1434","8443  >  4345 [ACK] Seq=1 Ack=228 Win=15872 Len=1380"
"485","44.291949","174.129.249.52","10.10.10.144","TCP","1434","8443  >  4345 [ACK] Seq=1381 Ack=228 Win=15872 Len=1380"
"486","44.292060","174.129.249.52","10.10.10.144","TCP","1390","8443  >  4345 [PSH, ACK] Seq=2761 Ack=228 Win=15872 Len=1336"
"487","44.292072","174.129.249.52","10.10.10.144","TCP","857","8443  >  4345 [PSH, ACK] Seq=4097 Ack=228 Win=15872 Len=803"
"488","44.294069","10.10.10.144","174.129.249.52","TCP","54","4345  >  8443 [ACK] Seq=228 Ack=1381 Win=8600 Len=0"
"489","44.294515","10.10.10.144","174.129.249.52","TCP","54","4345  >  8443 [ACK] Seq=228 Ack=2761 Win=11360 Len=0"
"490","44.295760","10.10.10.144","174.129.249.52","TCP","54","4345  >  8443 [ACK] Seq=228 Ack=4097 Win=14120 Len=0"
"491","44.298254","10.10.10.144","174.129.249.52","TCP","54","4345  >  8443 [ACK] Seq=228 Ack=4900 Win=16880 Len=0"
"492","44.347864","10.10.10.144","174.129.249.52","TCP","380","4345  >  8443 [PSH, ACK] Seq=228 Ack=4900 Win=16880 Len=326"
"493","44.449273","174.129.249.52","10.10.10.144","TCP","113","8443  >  4345 [PSH, ACK] Seq=4900 Ack=554 Win=16896 Len=59"
"494","44.449802","10.10.10.144","174.129.249.52","TCP","54","4345  >  8443 [ACK] Seq=554 Ack=4959 Win=16880 Len=0"
"495","44.453629","10.10.10.144","174.129.249.52","TCP","875","4345  >  8443 [PSH, ACK] Seq=554 Ack=4959 Win=16880 Len=821"
"496","44.590099","174.129.249.52","10.10.10.144","TCP","54","8443  >  4345 [ACK] Seq=4959 Ack=1375 Win=18432 Len=0"
"497","44.714728","174.129.249.52","10.10.10.144","TCP","795","8443  >  4345 [PSH, ACK] Seq=4959 Ack=1375 Win=18432 Len=741"
"498","44.723407","10.10.10.144","174.129.249.52","TCP","91","4345  >  8443 [PSH, ACK] Seq=1375 Ack=5700 Win=16880 Len=37"
"499","44.730866","10.10.10.144","174.129.249.52","TCP","54","4345  >  8443 [FIN, ACK] Seq=1412 Ack=5700 Win=16880 Len=0"
"500","44.822679","174.129.249.52","10.10.10.144","TCP","54","8443  >  4345 [ACK] Seq=5700 Ack=1412 Win=18432 Len=0"
"501","44.822704","174.129.249.52","10.10.10.144","TCP","91","8443  >  4345 [PSH, ACK] Seq=5700 Ack=1412 Win=18432 Len=37"
"502","44.822709","174.129.249.52","10.10.10.144","TCP","54","8443  >  4345 [FIN, ACK] Seq=5737 Ack=1412 Win=18432 Len=0"
"503","44.823714","10.10.10.144","174.129.249.52","TCP","54","4345  >  8443 [RST] Seq=1412 Win=0 Len=0"
"504","44.823958","10.10.10.144","174.129.249.52","TCP","54","4345  >  8443 [RST] Seq=1412 Win=0 Len=0"
"505","45.432089","10.10.10.144","224.0.0.22","IGMPv3","54","Membership Report / Join group 239.255.255.250 for any sources"
"506","51.061245","BelkinIn_cd:37:65","Broadcast","ARP","42","Who has 10.10.10.30? Tell 10.10.10.144"
"507","69.107511","10.10.10.144","10.10.10.1","ICMP","98","Echo (ping) request  id=0x7408, seq=0/0, ttl=64 (reply in 508)"
"508","69.107554","10.10.10.1","10.10.10.144","ICMP","98","Echo (ping) reply    id=0x7408, seq=0/0, ttl=64 (request in 507)"
"509","70.112549","10.10.10.144","10.10.10.1","ICMP","98","Echo (ping) request  id=0x7408, seq=1/256, ttl=64 (reply in 510)"
"510","70.112588","10.10.10.1","10.10.10.144","ICMP","98","Echo (ping) reply    id=0x7408, seq=1/256, ttl=64 (request in 509)"
"511","71.117122","10.10.10.144","10.10.10.1","ICMP","98","Echo (ping) request  id=0x7408, seq=2/512, ttl=64 (reply in 512)"
"512","71.117150","10.10.10.1","10.10.10.144","ICMP","98","Echo (ping) reply    id=0x7408, seq=2/512, ttl=64 (request in 511)"
"513","74.118951","DavidEle_06:08:ba","BelkinIn_cd:37:65","ARP","42","Who has 10.10.10.144? Tell 10.10.10.1"
"514","74.122859","BelkinIn_cd:37:65","DavidEle_06:08:ba","ARP","42","10.10.10.144 is at 94:10:3e:cd:37:65"
