"No.","Time","Source","Destination","Protocol","Length","Info"
"1","0.000000","BelkinIn_41:c2:05","IntelCor_c3:41:78","EAPOL","135","Key (Message 2 of 4)"
"2","0.006913","BelkinIn_41:c2:05","IntelCor_c3:41:78","EAPOL","113","Key (Message 4 of 4)"
"3","2.002285","BelkinIn_41:c2:05","Broadcast","XID","20","Basic Format; Type 1 LLC (Class I LLC); Window Size 0"
"4","2.011306","BelkinIn_41:c2:05","IntelCor_c3:41:78","EAPOL","135","Key (Message 2 of 4)"
"5","2.016366","BelkinIn_41:c2:05","IntelCor_c3:41:78","EAPOL","113","Key (Message 4 of 4)"
"6","2.628071","0.0.0.0","255.255.255.255","DHCP","590","DHCP Discover - Transaction ID 0x39032001"
"7","2.663649","0.0.0.0","255.255.255.255","DHCP","590","DHCP Discover - Transaction ID 0x39032001"
"8","2.699606","0.0.0.0","255.255.255.255","DHCP","590","DHCP Discover - Transaction ID 0x39032001"
"9","2.735684","0.0.0.0","255.255.255.255","DHCP","590","DHCP Discover - Transaction ID 0x39032001"
"10","2.791806","0.0.0.0","255.255.255.255","DHCP","590","DHCP Request  - Transaction ID 0x39032001"
"11","3.819608","0.0.0.0","255.255.255.255","DHCP","590","DHCP Request  - Transaction ID 0x39032001"
"12","4.851613","0.0.0.0","255.255.255.255","DHCP","590","DHCP Request  - Transaction ID 0x39032001"
"13","5.846430","fe80::9610:3eff:fe41:c205","ff02::2","ICMPv6","70","Router Solicitation from 94:10:3e:41:c2:05"
"14","6.485310","BelkinIn_41:c2:05","Broadcast","ARP","60","Who has 10.10.10.1? Tell 10.10.10.158"
"15","6.485328","DavidEle_06:08:ba","BelkinIn_41:c2:05","ARP","42","10.10.10.1 is at 00:b5:6d:06:08:ba"
"16","8.542444","fe80::9610:3eff:fe41:c205","ff02::16","ICMPv6","90","Multicast Listener Report Message v2"
"17","9.846321","fe80::9610:3eff:fe41:c205","ff02::2","ICMPv6","70","Router Solicitation from 94:10:3e:41:c2:05"
"18","11.551315","BelkinIn_41:c2:05","Broadcast","ARP","42","Who has 10.10.10.1? Tell 10.10.10.158"
"19","11.551334","DavidEle_06:08:ba","BelkinIn_41:c2:05","ARP","42","10.10.10.1 is at 00:b5:6d:06:08:ba"
"20","11.554153","10.10.10.158","10.10.10.1","DNS","74","Standard query 0x0002 A www.belkin.com"
"21","11.555586","10.10.10.1","10.10.10.158","DNS","443","Standard query response 0x0002 A www.belkin.com CNAME d3gjecg2uu2eaq.cloudfront.net A 54.230.11.236 A 54.230.11.7 A 54.230.11.21 A 54.230.11.41 A 54.230.11.126 A 54.230.11.210 A 54.230.11.216 A 54.230.11.230 NS ns-105.awsdns-13.com NS ns-1510.awsdns-60.org NS ns-747.awsdns-29.net NS ns-1906.awsdns-46.co.uk A 205.251.192.105 A 205.251.194.235 A 205.251.197.230 A 205.251.199.114"
"22","11.562222","10.10.10.158","10.10.10.1","DNS","89","Standard query 0x0003 A d3gjecg2uu2eaq.cloudfront.net"
"23","11.562334","10.10.10.1","10.10.10.158","DNS","217","Standard query response 0x0003 A d3gjecg2uu2eaq.cloudfront.net A 54.230.11.230 A 54.230.11.216 A 54.230.11.210 A 54.230.11.126 A 54.230.11.41 A 54.230.11.21 A 54.230.11.7 A 54.230.11.236"
"24","13.625192","10.10.10.158","10.10.10.1","DNS","79","Standard query 0x892f A clients3.google.com"
"25","13.626591","10.10.10.1","10.10.10.158","DNS","255","Standard query response 0x892f A clients3.google.com CNAME clients.l.google.com A 216.58.214.110 NS ns3.google.com NS ns1.google.com NS ns4.google.com NS ns2.google.com A 216.239.32.10 A 216.239.34.10 A 216.239.36.10 A 216.239.38.10"
"26","13.766631","10.10.10.158","10.10.10.1","DNS","62","Standard query 0x77cc A gw"
"27","14.576199","10.10.10.1","10.10.10.158","DNS","118","Standard query response 0x77cc A gw SOA gw01.dns.pt"
"28","14.597155","10.10.10.158","10.10.10.1","DNS","62","Standard query 0x5489 A gw"
"29","14.597293","10.10.10.1","10.10.10.158","DNS","62","Standard query response 0x5489 A gw"
"30","14.617158","10.10.10.158","10.10.10.1","DNS","62","Standard query 0x5a7a A gw"
"31","14.617295","10.10.10.1","10.10.10.158","DNS","62","Standard query response 0x5a7a A gw"
"32","14.636963","10.10.10.158","10.10.10.1","DNS","62","Standard query 0xc73f A gw"
"33","14.637099","10.10.10.1","10.10.10.158","DNS","62","Standard query response 0xc73f A gw"
"34","14.656740","10.10.10.158","10.10.10.1","DNS","62","Standard query 0xde22 A gw"
"35","14.656880","10.10.10.1","10.10.10.158","DNS","62","Standard query response 0xde22 A gw"
"36","14.810339","10.10.10.158","129.132.2.21","NTP","90","NTP Version 3, client"
"37","14.823319","10.10.10.158","130.149.17.8","NTP","90","NTP Version 3, client"
"38","14.838706","10.10.10.158","192.53.103.104","NTP","90","NTP Version 3, client"
"39","14.841670","130.149.17.8","10.10.10.158","NTP","90","NTP Version 3, server"
"40","14.850492","192.53.103.104","10.10.10.158","NTP","90","NTP Version 3, server"
"41","14.976045","fe80::9610:3eff:fe41:c205","ff02::16","ICMPv6","110","Multicast Listener Report Message v2"
"42","16.039992","10.10.10.158","10.10.10.1","DNS","72","Standard query 0x923c A api.xbcs.net"
"43","16.156315","10.10.10.1","10.10.10.158","DNS","468","Standard query response 0x923c A api.xbcs.net CNAME prod1-api-xbcs-net-889336557.us-east-1.elb.amazonaws.com A 50.17.221.66 A 54.83.204.109 A 54.225.140.113 A 54.243.87.97 A 23.21.117.32 A 23.21.138.13 A 23.21.226.117 A 23.23.111.129 NS ns-235.awsdns-29.com NS ns-1793.awsdns-32.co.uk NS ns-1119.awsdns-11.org NS ns-934.awsdns-52.net A 205.251.192.235 A 205.251.195.166 A 205.251.196.95 A 205.251.199.1"
"44","16.178306","10.10.10.158","50.17.221.66","TCP","74","4382  >  8443 [SYN] Seq=0 Win=5840 Len=0 MSS=1460 SACK_PERM=1 TSval=4294914132 TSecr=0 WS=2"
"45","16.277889","50.17.221.66","10.10.10.158","TCP","74","8443  >  4382 [SYN, ACK] Seq=0 Ack=1 Win=14480 Len=0 MSS=1380 SACK_PERM=1 TSval=1299973152 TSecr=4294914132 WS=256"
"46","16.280136","10.10.10.158","50.17.221.66","TCP","66","4382  >  8443 [ACK] Seq=1 Ack=1 Win=5840 Len=0 TSval=4294914158 TSecr=1299973152"
"47","16.403330","10.10.10.158","50.17.221.66","TCP","293","4382  >  8443 [PSH, ACK] Seq=1 Ack=1 Win=5840 Len=227 TSval=4294914188 TSecr=1299973152"
"48","16.503500","50.17.221.66","10.10.10.158","TCP","66","8443  >  4382 [ACK] Seq=1 Ack=228 Win=15616 Len=0 TSval=1299973208 TSecr=4294914188"
"49","16.503977","50.17.221.66","10.10.10.158","TCP","1434","8443  >  4382 [ACK] Seq=1 Ack=228 Win=15616 Len=1368 TSval=1299973208 TSecr=4294914188"
"50","16.504002","50.17.221.66","10.10.10.158","TCP","1434","8443  >  4382 [ACK] Seq=1369 Ack=228 Win=15616 Len=1368 TSval=1299973208 TSecr=4294914188"
"51","16.504090","50.17.221.66","10.10.10.158","TCP","1426","8443  >  4382 [PSH, ACK] Seq=2737 Ack=228 Win=15616 Len=1360 TSval=1299973208 TSecr=4294914188"
"52","16.504210","50.17.221.66","10.10.10.158","TCP","869","8443  >  4382 [PSH, ACK] Seq=4097 Ack=228 Win=15616 Len=803 TSval=1299973208 TSecr=4294914188"
"53","16.530185","10.10.10.158","50.17.221.66","TCP","66","4382  >  8443 [ACK] Seq=228 Ack=1369 Win=8576 Len=0 TSval=4294914216 TSecr=1299973208"
"54","16.530863","10.10.10.158","50.17.221.66","TCP","66","4382  >  8443 [ACK] Seq=228 Ack=2737 Win=11312 Len=0 TSval=4294914218 TSecr=1299973208"
"55","16.531152","10.10.10.158","50.17.221.66","TCP","66","4382  >  8443 [ACK] Seq=228 Ack=4097 Win=14048 Len=0 TSval=4294914219 TSecr=1299973208"
"56","16.531275","10.10.10.158","50.17.221.66","TCP","66","4382  >  8443 [ACK] Seq=228 Ack=4900 Win=16784 Len=0 TSval=4294914220 TSecr=1299973208"
"57","16.556001","DavidEle_06:08:ba","BelkinIn_41:c2:05","ARP","42","Who has 10.10.10.158? Tell 10.10.10.1"
"58","16.567105","BelkinIn_41:c2:05","DavidEle_06:08:ba","ARP","42","10.10.10.158 is at 94:10:3e:41:c2:05"
"59","16.648168","10.10.10.158","50.17.221.66","TCP","392","4382  >  8443 [PSH, ACK] Seq=228 Ack=4900 Win=16784 Len=326 TSval=4294914250 TSecr=1299973208"
"60","16.749926","50.17.221.66","10.10.10.158","TCP","125","8443  >  4382 [PSH, ACK] Seq=4900 Ack=554 Win=16640 Len=59 TSval=1299973270 TSecr=4294914250"
"61","16.751860","10.10.10.158","50.17.221.66","TCP","66","4382  >  8443 [ACK] Seq=554 Ack=4959 Win=16784 Len=0 TSval=4294914276 TSecr=1299973270"
"62","16.760378","10.10.10.158","50.17.221.66","TCP","327","4382  >  8443 [PSH, ACK] Seq=554 Ack=4959 Win=16784 Len=261 TSval=4294914277 TSecr=1299973270"
"63","16.792631","10.10.10.158","50.17.221.66","TCP","1434","4382  >  8443 [ACK] Seq=815 Ack=4959 Win=16784 Len=1368 TSval=4294914285 TSecr=1299973270"
"64","16.846784","fe80::9610:3eff:fe41:c205","ff02::16","ICMPv6","110","Multicast Listener Report Message v2"
"65","16.892220","50.17.221.66","10.10.10.158","TCP","66","8443  >  4382 [ACK] Seq=4959 Ack=2183 Win=20736 Len=0 TSval=1299973306 TSecr=4294914277"
"66","16.894769","10.10.10.158","50.17.221.66","TCP","1434","4382  >  8443 [ACK] Seq=2183 Ack=4959 Win=16784 Len=1368 TSval=4294914311 TSecr=1299973306"
"67","16.897105","10.10.10.158","50.17.221.66","TCP","1434","4382  >  8443 [ACK] Seq=3551 Ack=4959 Win=16784 Len=1368 TSval=4294914311 TSecr=1299973306"
"68","16.907158","10.10.10.158","50.17.221.66","TCP","1434","4382  >  8443 [ACK] Seq=4919 Ack=4959 Win=16784 Len=1368 TSval=4294914311 TSecr=1299973306"
"69","16.996665","50.17.221.66","10.10.10.158","TCP","66","8443  >  4382 [ACK] Seq=4959 Ack=4919 Win=26624 Len=0 TSval=1299973332 TSecr=4294914311"
"70","17.001964","10.10.10.158","50.17.221.66","TCP","1434","4382  >  8443 [ACK] Seq=6287 Ack=4959 Win=16784 Len=1368 TSval=4294914338 TSecr=1299973332"
"71","17.004151","10.10.10.158","50.17.221.66","TCP","1434","4382  >  8443 [ACK] Seq=7655 Ack=4959 Win=16784 Len=1368 TSval=4294914338 TSecr=1299973332"
"72","17.006319","10.10.10.158","50.17.221.66","TCP","1434","4382  >  8443 [ACK] Seq=9023 Ack=4959 Win=16784 Len=1368 TSval=4294914338 TSecr=1299973332"
"73","17.047832","50.17.221.66","10.10.10.158","TCP","66","8443  >  4382 [ACK] Seq=4959 Ack=6287 Win=29440 Len=0 TSval=1299973345 TSecr=4294914311"
"74","17.057186","10.10.10.158","50.17.221.66","TCP","1434","4382  >  8443 [ACK] Seq=10391 Ack=4959 Win=16784 Len=1368 TSval=4294914351 TSecr=1299973345"
"75","17.059612","10.10.10.158","50.17.221.66","TCP","1184","4382  >  8443 [PSH, ACK] Seq=11759 Ack=4959 Win=16784 Len=1118 TSval=4294914351 TSecr=1299973345"
"76","17.101574","50.17.221.66","10.10.10.158","TCP","66","8443  >  4382 [ACK] Seq=4959 Ack=7655 Win=32256 Len=0 TSval=1299973358 TSecr=4294914338"
"77","17.103628","50.17.221.66","10.10.10.158","TCP","66","8443  >  4382 [ACK] Seq=4959 Ack=9023 Win=35072 Len=0 TSval=1299973358 TSecr=4294914338"
"78","17.105780","50.17.221.66","10.10.10.158","TCP","66","8443  >  4382 [ACK] Seq=4959 Ack=10391 Win=38144 Len=0 TSval=1299973359 TSecr=4294914338"
"79","17.107625","10.10.10.158","50.17.221.66","TCP","1434","4382  >  8443 [ACK] Seq=12877 Ack=4959 Win=16784 Len=1368 TSval=4294914364 TSecr=1299973358"
"80","17.151070","10.10.10.158","50.17.221.66","TCP","1434","4382  >  8443 [ACK] Seq=14245 Ack=4959 Win=16784 Len=1368 TSval=4294914372 TSecr=1299973359"
"81","17.156779","50.17.221.66","10.10.10.158","TCP","66","8443  >  4382 [ACK] Seq=4959 Ack=11759 Win=40960 Len=0 TSval=1299973372 TSecr=4294914351"
"82","17.159095","50.17.221.66","10.10.10.158","TCP","66","8443  >  4382 [ACK] Seq=4959 Ack=12877 Win=42496 Len=0 TSval=1299973372 TSecr=4294914351"
"83","17.162235","10.10.10.158","50.17.221.66","TCP","1141","4382  >  8443 [PSH, ACK] Seq=15613 Ack=4959 Win=16784 Len=1075 TSval=4294914378 TSecr=1299973372"
"84","17.191672","10.10.10.158","50.17.221.66","TCP","1434","4382  >  8443 [ACK] Seq=16688 Ack=4959 Win=16784 Len=1368 TSval=4294914385 TSecr=1299973372"
"85","17.207991","50.17.221.66","10.10.10.158","TCP","66","8443  >  4382 [ACK] Seq=4959 Ack=14245 Win=42496 Len=0 TSval=1299973384 TSecr=4294914364"
"86","17.222414","10.10.10.158","50.17.221.66","TCP","1434","4382  >  8443 [ACK] Seq=18056 Ack=4959 Win=16784 Len=1368 TSval=4294914393 TSecr=1299973384"
"87","17.250628","50.17.221.66","10.10.10.158","TCP","66","8443  >  4382 [ACK] Seq=4959 Ack=15613 Win=42496 Len=0 TSval=1299973395 TSecr=4294914372"
"88","17.253220","10.10.10.158","50.17.221.66","TCP","1434","4382  >  8443 [ACK] Seq=19424 Ack=4959 Win=16784 Len=1368 TSval=4294914401 TSecr=1299973384"
"89","17.261791","50.17.221.66","10.10.10.158","TCP","66","8443  >  4382 [ACK] Seq=4959 Ack=16688 Win=42496 Len=0 TSval=1299973398 TSecr=4294914378"
"90","17.263150","10.10.10.158","50.17.221.66","TCP","550","4382  >  8443 [PSH, ACK] Seq=20792 Ack=4959 Win=16784 Len=484 TSval=4294914404 TSecr=1299973398"
"91","17.291874","50.17.221.66","10.10.10.158","TCP","66","8443  >  4382 [ACK] Seq=4959 Ack=18056 Win=42496 Len=0 TSval=1299973406 TSecr=4294914385"
"92","17.298921","10.10.10.158","50.17.221.66","TCP","1434","4382  >  8443 [ACK] Seq=21276 Ack=4959 Win=16784 Len=1368 TSval=4294914411 TSecr=1299973406"
"93","17.324521","50.17.221.66","10.10.10.158","TCP","66","8443  >  4382 [ACK] Seq=4959 Ack=19424 Win=42496 Len=0 TSval=1299973414 TSecr=4294914393"
"94","17.326483","10.10.10.158","50.17.221.66","TCP","1434","4382  >  8443 [ACK] Seq=22644 Ack=4959 Win=16784 Len=1368 TSval=4294914419 TSecr=1299973406"
"95","17.352827","50.17.221.66","10.10.10.158","TCP","66","8443  >  4382 [ACK] Seq=4959 Ack=20792 Win=42496 Len=0 TSval=1299973421 TSecr=4294914401"
"96","17.362589","50.17.221.66","10.10.10.158","TCP","66","8443  >  4382 [ACK] Seq=4959 Ack=21276 Win=42496 Len=0 TSval=1299973423 TSecr=4294914404"
"97","17.363999","10.10.10.158","50.17.221.66","TCP","956","4382  >  8443 [PSH, ACK] Seq=24012 Ack=4959 Win=16784 Len=890 TSval=4294914429 TSecr=1299973423"
"98","17.398556","50.17.221.66","10.10.10.158","TCP","66","8443  >  4382 [ACK] Seq=4959 Ack=22644 Win=42496 Len=0 TSval=1299973432 TSecr=4294914411"
"99","17.463771","50.17.221.66","10.10.10.158","TCP","66","8443  >  4382 [ACK] Seq=4959 Ack=24902 Win=42496 Len=0 TSval=1299973448 TSecr=4294914419"
"100","17.526968","50.17.221.66","10.10.10.158","TCP","1434","8443  >  4382 [ACK] Seq=4959 Ack=24902 Win=42496 Len=1368 TSval=1299973464 TSecr=4294914419"
"101","17.527008","50.17.221.66","10.10.10.158","TCP","783","8443  >  4382 [PSH, ACK] Seq=6327 Ack=24902 Win=42496 Len=717 TSval=1299973464 TSecr=4294914419"
"102","17.529529","10.10.10.158","50.17.221.66","TCP","66","4382  >  8443 [ACK] Seq=24902 Ack=7044 Win=16784 Len=0 TSval=4294914470 TSecr=1299973464"
"103","17.545178","10.10.10.158","50.17.221.66","TCP","103","4382  >  8443 [PSH, ACK] Seq=24902 Ack=7044 Win=16784 Len=37 TSval=4294914474 TSecr=1299973464"
"104","17.546513","10.10.10.158","50.17.221.66","TCP","66","4382  >  8443 [FIN, ACK] Seq=24939 Ack=7044 Win=16784 Len=0 TSval=4294914474 TSecr=1299973464"
"105","17.644842","50.17.221.66","10.10.10.158","TCP","66","8443  >  4382 [ACK] Seq=7044 Ack=24939 Win=42496 Len=0 TSval=1299973494 TSecr=4294914474"
"106","17.644870","50.17.221.66","10.10.10.158","TCP","103","8443  >  4382 [PSH, ACK] Seq=7044 Ack=24939 Win=42496 Len=37 TSval=1299973494 TSecr=4294914474"
"107","17.644876","50.17.221.66","10.10.10.158","TCP","66","8443  >  4382 [FIN, ACK] Seq=7081 Ack=24939 Win=42496 Len=0 TSval=1299973494 TSecr=4294914474"
"108","17.645896","50.17.221.66","10.10.10.158","TCP","66","8443  >  4382 [ACK] Seq=7082 Ack=24940 Win=42496 Len=0 TSval=1299973494 TSecr=4294914474"
"109","17.645938","10.10.10.158","50.17.221.66","TCP","54","4382  >  8443 [RST] Seq=24939 Win=0 Len=0"
"110","17.646415","10.10.10.158","50.17.221.66","TCP","54","4382  >  8443 [RST] Seq=24939 Win=0 Len=0"
"111","17.646737","10.10.10.158","50.17.221.66","TCP","54","4382  >  8443 [RST] Seq=24940 Win=0 Len=0"
"112","18.677785","10.22.22.2","64.210.203.208","TCP","74","41730  >  7275 [SYN] Seq=0 Win=14600 Len=0 MSS=1460 SACK_PERM=1 TSval=18335984 TSecr=0 WS=128"
"113","23.577095","10.10.10.158","10.10.10.1","DNS","72","Standard query 0x0004 A nat.xbcs.net"
"114","23.732904","10.10.10.1","10.10.10.158","DNS","373","Standard query response 0x0004 A nat.xbcs.net CNAME prod1-nat-xbcs-net-1543133972.us-east-1.elb.amazonaws.com A 23.23.244.163 A 54.235.195.29 NS ns-934.awsdns-52.net NS ns-235.awsdns-29.com NS ns-1119.awsdns-11.org NS ns-1793.awsdns-32.co.uk A 205.251.192.235 A 205.251.195.166 A 205.251.196.95 A 205.251.199.1"
"115","23.749599","10.10.10.158","10.10.10.1","DNS","117","Standard query 0x0005 A prod1-nat-xbcs-net-1543133972.us-east-1.elb.amazonaws.com"
"116","23.749706","10.10.10.1","10.10.10.158","DNS","149","Standard query response 0x0005 A prod1-nat-xbcs-net-1543133972.us-east-1.elb.amazonaws.com A 54.235.195.29 A 23.23.244.163"
"117","31.526387","10.10.10.158","10.10.10.1","DNS","86","Standard query 0x246a A android.clients.google.com"
"118","31.527817","10.10.10.1","10.10.10.158","DNS","262","Standard query response 0x246a A android.clients.google.com CNAME android.l.google.com A 216.58.214.110 NS ns4.google.com NS ns2.google.com NS ns3.google.com NS ns1.google.com A 216.239.32.10 A 216.239.34.10 A 216.239.36.10 A 216.239.38.10"
"119","31.531082","10.10.10.158","10.10.10.1","DNS","84","Standard query 0x81cf A analytics.localytics.com"
"120","31.531400","10.10.10.158","10.10.10.1","DNS","77","Standard query 0x1195 A mtalk4.google.com"
"121","31.531702","10.10.10.158","10.10.10.1","DNS","86","Standard query 0x246a A android.clients.google.com"
"122","31.531739","10.10.10.1","10.10.10.158","DNS","136","Standard query response 0x246a A android.clients.google.com CNAME android.l.google.com A 216.58.214.110"
"123","31.532798","10.10.10.1","10.10.10.158","DNS","259","Standard query response 0x1195 A mtalk4.google.com CNAME mobile-gtalk4.l.google.com A 64.233.184.188 NS ns4.google.com NS ns3.google.com NS ns2.google.com NS ns1.google.com A 216.239.32.10 A 216.239.34.10 A 216.239.36.10 A 216.239.38.10"
"124","31.541287","10.10.10.158","10.10.10.1","DNS","84","Standard query 0x81cf A analytics.localytics.com"
"125","31.543521","10.10.10.158","10.10.10.1","DNS","77","Standard query 0x1195 A mtalk4.google.com"
"126","31.543634","10.10.10.1","10.10.10.158","DNS","133","Standard query response 0x1195 A mtalk4.google.com CNAME mobile-gtalk4.l.google.com A 64.233.184.188"
"127","31.553425","10.10.10.158","10.10.10.1","DNS","93","Standard query 0xcf1d A android.clients.google.com.Belkin"
"128","31.554388","10.10.10.158","10.10.10.1","DNS","91","Standard query 0x0dcb A analytics.localytics.com.Belkin"
"129","31.555979","10.10.10.158","10.10.10.1","DNS","84","Standard query 0x320b A mtalk4.google.com.Belkin"
"130","31.557596","10.10.10.1","10.10.10.158","DNS","168","Standard query response 0xcf1d No such name A android.clients.google.com.Belkin SOA a.root-servers.net"
"131","31.558407","10.10.10.1","10.10.10.158","DNS","166","Standard query response 0x0dcb No such name A analytics.localytics.com.Belkin SOA a.root-servers.net"
"132","31.560148","10.10.10.1","10.10.10.158","DNS","159","Standard query response 0x320b No such name A mtalk4.google.com.Belkin SOA a.root-servers.net"
"133","31.570642","10.10.10.158","10.10.10.1","DNS","79","Standard query 0x8fc8 A ticks2.bugsense.com"
"134","31.572403","10.10.10.1","10.10.10.158","DNS","296","Standard query response 0x8fc8 A ticks2.bugsense.com A 54.193.117.148 NS ns-1818.awsdns-35.co.uk NS ns-746.awsdns-29.net NS ns-1059.awsdns-04.org NS ns-471.awsdns-58.com A 205.251.193.215 A 205.251.194.234 A 205.251.196.35 A 205.251.199.26"
"135","31.572405","10.10.10.158","10.10.10.1","DNS","72","Standard query 0x41a1 A api.xbcs.net"
"136","31.572444","10.10.10.1","10.10.10.158","DNS","270","Standard query response 0x41a1 A api.xbcs.net CNAME prod1-api-xbcs-net-889336557.us-east-1.elb.amazonaws.com A 23.23.111.129 A 23.21.226.117 A 23.21.138.13 A 23.21.117.32 A 54.243.87.97 A 54.225.140.113 A 54.83.204.109 A 50.17.221.66"
"137","31.593240","10.10.10.158","54.193.117.148","TCP","74","4594  >  443 [SYN] Seq=0 Win=5840 Len=0 MSS=1460 SACK_PERM=1 TSval=4294917986 TSecr=0 WS=2"
"138","31.594461","10.10.10.158","23.23.111.129","TCP","74","4817  >  8443 [SYN] Seq=0 Win=5840 Len=0 MSS=1460 SACK_PERM=1 TSval=4294917986 TSecr=0 WS=2"
"139","31.648742","10.10.10.1","10.10.10.158","DNS","470","Standard query response 0x81cf A analytics.localytics.com CNAME queuerlb-599065538.us-east-1.elb.amazonaws.com A 54.225.147.8 A 107.20.243.255 A 23.21.194.29 A 23.21.229.203 A 23.23.102.29 A 23.23.160.249 A 50.17.195.105 A 50.19.119.163 NS ns-1793.awsdns-32.co.uk NS ns-1119.awsdns-11.org NS ns-934.awsdns-52.net NS ns-235.awsdns-29.com A 205.251.192.235 A 205.251.195.166 A 205.251.196.95 A 205.251.199.1"
"140","31.687566","10.10.10.158","10.10.10.1","DNS","81","Standard query 0x2a00 A alt7-mtalk.google.com"
"141","31.694172","23.23.111.129","10.10.10.158","TCP","74","8443  >  4817 [SYN, ACK] Seq=0 Ack=1 Win=14480 Len=0 MSS=1380 SACK_PERM=1 TSval=397503476 TSecr=4294917986 WS=256"
"142","31.695828","10.10.10.158","23.23.111.129","TCP","66","4817  >  8443 [ACK] Seq=1 Ack=1 Win=5840 Len=0 TSval=4294918012 TSecr=397503476"
"143","31.699781","10.10.10.158","23.23.111.129","TCP","293","4817  >  8443 [PSH, ACK] Seq=1 Ack=1 Win=5840 Len=227 TSval=4294918013 TSecr=397503476"
"144","31.699826","10.10.10.1","10.10.10.158","DNS","267","Standard query response 0x2a00 A alt7-mtalk.google.com CNAME alt7.mobile-gtalk.l.google.com A 74.125.142.188 NS ns3.google.com NS ns4.google.com NS ns1.google.com NS ns2.google.com A 216.239.32.10 A 216.239.34.10 A 216.239.36.10 A 216.239.38.10"
"145","31.716759","10.22.22.2","74.125.142.188","TCP","74","52672  >  5228 [SYN] Seq=0 Win=14600 Len=0 MSS=1460 SACK_PERM=1 TSval=18338591 TSecr=0 WS=128"
"146","31.758420","54.193.117.148","10.10.10.158","TCP","74","443  >  4594 [SYN, ACK] Seq=0 Ack=1 Win=17898 Len=0 MSS=1380 SACK_PERM=1 TSval=2314076113 TSecr=4294917986 WS=256"
"147","31.759943","10.10.10.158","54.193.117.148","TCP","66","4594  >  443 [ACK] Seq=1 Ack=1 Win=5840 Len=0 TSval=4294918028 TSecr=2314076113"
"148","31.764283","10.10.10.158","54.193.117.148","TLSv1","300","Client Hello"
"149","31.801975","23.23.111.129","10.10.10.158","TCP","66","8443  >  4817 [ACK] Seq=1 Ack=228 Win=15616 Len=0 TSval=397503502 TSecr=4294918013"
"150","31.802003","23.23.111.129","10.10.10.158","TCP","1434","8443  >  4817 [ACK] Seq=1 Ack=228 Win=15616 Len=1368 TSval=397503503 TSecr=4294918013"
"151","31.802102","23.23.111.129","10.10.10.158","TCP","1434","8443  >  4817 [ACK] Seq=1369 Ack=228 Win=15616 Len=1368 TSval=397503503 TSecr=4294918013"
"152","31.802125","23.23.111.129","10.10.10.158","TCP","1426","8443  >  4817 [PSH, ACK] Seq=2737 Ack=228 Win=15616 Len=1360 TSval=397503503 TSecr=4294918013"
"153","31.802129","23.23.111.129","10.10.10.158","TCP","869","8443  >  4817 [PSH, ACK] Seq=4097 Ack=228 Win=15616 Len=803 TSval=397503503 TSecr=4294918013"
"154","31.839323","10.10.10.158","23.23.111.129","TCP","66","4817  >  8443 [ACK] Seq=228 Ack=1369 Win=8576 Len=0 TSval=4294918041 TSecr=397503503"
"155","31.839482","10.10.10.158","23.23.111.129","TCP","66","4817  >  8443 [ACK] Seq=228 Ack=2737 Win=11312 Len=0 TSval=4294918043 TSecr=397503503"
"156","31.839703","10.10.10.158","23.23.111.129","TCP","66","4817  >  8443 [ACK] Seq=228 Ack=4097 Win=14048 Len=0 TSval=4294918046 TSecr=397503503"
"157","31.840069","10.10.10.158","23.23.111.129","TCP","66","4817  >  8443 [ACK] Seq=228 Ack=4900 Win=16784 Len=0 TSval=4294918048 TSecr=397503503"
"158","31.903803","10.10.10.158","23.23.111.129","TCP","392","4817  >  8443 [PSH, ACK] Seq=228 Ack=4900 Win=16784 Len=326 TSval=4294918064 TSecr=397503503"
"159","31.929257","54.193.117.148","10.10.10.158","TCP","66","443  >  4594 [ACK] Seq=1 Ack=235 Win=11520 Len=0 TSval=2314076211 TSecr=4294918029"
"160","31.929703","54.193.117.148","10.10.10.158","TLSv1","1078","Server Hello, Certificate"
"161","31.929724","54.193.117.148","10.10.10.158","TLSv1","96","Server Key Exchange, Server Hello Done"
"162","31.951947","10.10.10.158","54.193.117.148","TCP","66","4594  >  443 [ACK] Seq=235 Ack=1013 Win=7864 Len=0 TSval=4294918076 TSecr=2314076211"
"163","31.952334","10.10.10.158","54.193.117.148","TCP","66","4594  >  443 [ACK] Seq=235 Ack=1043 Win=7864 Len=0 TSval=4294918076 TSecr=2314076211"
"164","32.005540","23.23.111.129","10.10.10.158","TCP","125","8443  >  4817 [PSH, ACK] Seq=4900 Ack=554 Win=16640 Len=59 TSval=397503554 TSecr=4294918064"
"165","32.006724","10.10.10.158","23.23.111.129","TCP","66","4817  >  8443 [ACK] Seq=554 Ack=4959 Win=16784 Len=0 TSval=4294918090 TSecr=397503554"
"166","32.020897","10.10.10.158","23.23.111.129","TCP","327","4817  >  8443 [PSH, ACK] Seq=554 Ack=4959 Win=16784 Len=261 TSval=4294918093 TSecr=397503554"
"167","32.086780","10.10.10.158","23.23.111.129","TCP","1434","4817  >  8443 [ACK] Seq=815 Ack=4959 Win=16784 Len=1368 TSval=4294918109 TSecr=397503554"
"168","32.159404","23.23.111.129","10.10.10.158","TCP","66","8443  >  4817 [ACK] Seq=4959 Ack=815 Win=17920 Len=0 TSval=397503593 TSecr=4294918093"
"169","32.161517","10.10.10.158","23.23.111.129","TCP","1434","4817  >  8443 [ACK] Seq=2183 Ack=4959 Win=16784 Len=1368 TSval=4294918128 TSecr=397503593"
"170","32.161887","10.10.10.158","23.23.111.129","TCP","216","4817  >  8443 [PSH, ACK] Seq=3551 Ack=4959 Win=16784 Len=150 TSval=4294918128 TSecr=397503593"
"171","32.186526","23.23.111.129","10.10.10.158","TCP","66","8443  >  4817 [ACK] Seq=4959 Ack=2183 Win=20736 Len=0 TSval=397503599 TSecr=4294918109"
"172","32.224989","10.10.10.158","23.23.111.129","TCP","1434","4817  >  8443 [ACK] Seq=3701 Ack=4959 Win=16784 Len=1368 TSval=4294918144 TSecr=397503599"
"173","32.261310","23.23.111.129","10.10.10.158","TCP","66","8443  >  4817 [ACK] Seq=4959 Ack=3551 Win=23552 Len=0 TSval=397503618 TSecr=4294918128"
"174","32.261335","23.23.111.129","10.10.10.158","TCP","66","8443  >  4817 [ACK] Seq=4959 Ack=3701 Win=26368 Len=0 TSval=397503618 TSecr=4294918128"
"175","32.263519","10.10.10.158","23.23.111.129","TCP","918","4817  >  8443 [PSH, ACK] Seq=5069 Ack=4959 Win=16784 Len=852 TSval=4294918154 TSecr=397503618"
"176","32.318034","10.10.10.158","23.23.111.129","TCP","1434","4817  >  8443 [ACK] Seq=5921 Ack=4959 Win=16784 Len=1368 TSval=4294918167 TSecr=397503618"
"177","32.324826","23.23.111.129","10.10.10.158","TCP","66","8443  >  4817 [ACK] Seq=4959 Ack=5069 Win=29184 Len=0 TSval=397503634 TSecr=4294918144"
"178","32.363185","23.23.111.129","10.10.10.158","TCP","66","8443  >  4817 [ACK] Seq=4959 Ack=5921 Win=32000 Len=0 TSval=397503643 TSecr=4294918154"
"179","32.364967","10.10.10.158","23.23.111.129","TCP","1029","4817  >  8443 [PSH, ACK] Seq=7289 Ack=4959 Win=16784 Len=963 TSval=4294918179 TSecr=397503643"
"180","32.418195","23.23.111.129","10.10.10.158","TCP","66","8443  >  4817 [ACK] Seq=4959 Ack=7289 Win=34816 Len=0 TSval=397503657 TSecr=4294918167"
"181","32.464826","23.23.111.129","10.10.10.158","TCP","66","8443  >  4817 [ACK] Seq=4959 Ack=8252 Win=37632 Len=0 TSval=397503669 TSecr=4294918179"
"182","32.466217","10.10.10.158","23.23.111.129","TCP","621","4817  >  8443 [PSH, ACK] Seq=8252 Ack=4959 Win=16784 Len=555 TSval=4294918204 TSecr=397503669"
"183","32.566074","23.23.111.129","10.10.10.158","TCP","66","8443  >  4817 [ACK] Seq=4959 Ack=8807 Win=40448 Len=0 TSval=397503694 TSecr=4294918204"
"184","32.576859","23.23.111.129","10.10.10.158","TCP","567","8443  >  4817 [PSH, ACK] Seq=4959 Ack=8807 Win=40448 Len=501 TSval=397503697 TSecr=4294918204"
"185","32.581749","10.10.10.158","23.23.111.129","TCP","103","4817  >  8443 [PSH, ACK] Seq=8807 Ack=5460 Win=16784 Len=37 TSval=4294918233 TSecr=397503697"
"186","32.582419","10.10.10.158","23.23.111.129","TCP","66","4817  >  8443 [FIN, ACK] Seq=8844 Ack=5460 Win=16784 Len=0 TSval=4294918233 TSecr=397503697"
"187","32.683547","23.23.111.129","10.10.10.158","TCP","103","8443  >  4817 [PSH, ACK] Seq=5460 Ack=8844 Win=40448 Len=37 TSval=397503723 TSecr=4294918233"
"188","32.683571","23.23.111.129","10.10.10.158","TCP","66","8443  >  4817 [FIN, ACK] Seq=5497 Ack=8844 Win=40448 Len=0 TSval=397503723 TSecr=4294918233"
"189","32.683772","23.23.111.129","10.10.10.158","TCP","66","8443  >  4817 [ACK] Seq=5498 Ack=8845 Win=40448 Len=0 TSval=397503723 TSecr=4294918233"
"190","32.685918","10.10.10.158","23.23.111.129","TCP","54","4817  >  8443 [RST] Seq=8844 Win=0 Len=0"
"191","32.686471","10.10.10.158","23.23.111.129","TCP","54","4817  >  8443 [RST] Seq=8844 Win=0 Len=0"
"192","32.686850","10.10.10.158","23.23.111.129","TCP","54","4817  >  8443 [RST] Seq=8845 Win=0 Len=0"
"193","32.725693","10.22.22.2","74.125.142.188","TCP","74","[TCP Retransmission] 52672  >  5228 [SYN] Seq=0 Win=14600 Len=0 MSS=1460 SACK_PERM=1 TSval=18338791 TSecr=0 WS=128"
"194","32.915174","10.10.10.158","54.193.117.148","TLSv1","200","Client Key Exchange, Change Cipher Spec, Encrypted Handshake Message"
"195","33.081111","54.193.117.148","10.10.10.158","TLSv1","125","Change Cipher Spec, Encrypted Handshake Message"
"196","33.082164","10.10.10.158","54.193.117.148","TCP","66","4594  >  443 [ACK] Seq=369 Ack=1102 Win=7864 Len=0 TSval=4294918358 TSecr=2314076499"
"197","33.089081","10.10.10.158","54.193.117.148","TLSv1","295","Application Data"
"198","33.120740","10.10.10.158","54.193.117.148","TLSv1","1434","Application Data, Application Data, Application Data, Application Data, Application Data, Application Data, Application Data, Application Data, Application Data, Application Data, Application Data, Application Data, Application Data, Application Data, Application Data, Application Data, Application Data, Application Data, Application Data, Application Data, Application Data, Application Data, Application Data, Application Data, Application Data, Application Data, Application Data, Application Data, Application Data, Application Data, Application Data, Application Data, Application Data, Application Data, Application Data, Application Data"
"199","33.255550","54.193.117.148","10.10.10.158","TLSv1","247","Application Data"
"200","33.257207","10.10.10.158","54.193.117.148","TLSv1","1325","Application Data, Application Data, Application Data, Application Data, Application Data, Application Data, Application Data, Application Data, Application Data, Application Data, Application Data, Application Data, Application Data, Application Data, Application Data, Application Data, Application Data, Application Data, Application Data, Application Data, Application Data, Application Data, Application Data, Application Data, Application Data, Application Data, Application Data, Application Data, Application Data, Application Data, Application Data, Application Data, Application Data, Application Data, Application Data"
"201","33.260372","10.10.10.158","54.193.117.148","TLSv1","103","Encrypted Alert"
"202","33.331528","54.193.117.148","10.10.10.158","TCP","66","443  >  4594 [ACK] Seq=1283 Ack=1966 Win=16384 Len=0 TSval=2314076562 TSecr=4294918368"
"203","33.422428","54.193.117.148","10.10.10.158","TCP","66","443  >  4594 [ACK] Seq=1283 Ack=3225 Win=18944 Len=0 TSval=2314076584 TSecr=4294918402"
"204","33.425372","54.193.117.148","10.10.10.158","TLSv1","103","Encrypted Alert"
"205","33.425410","54.193.117.148","10.10.10.158","TCP","66","443  >  4594 [FIN, ACK] Seq=1320 Ack=3263 Win=18944 Len=0 TSval=2314076585 TSecr=4294918403"
"206","33.426426","10.10.10.158","54.193.117.148","TCP","54","4594  >  443 [RST] Seq=3263 Win=0 Len=0"
"207","33.427071","10.10.10.158","54.193.117.148","TCP","54","4594  >  443 [RST] Seq=3263 Win=0 Len=0"
"208","34.728603","10.22.22.2","74.125.142.188","TCP","74","[TCP Retransmission] 52672  >  5228 [SYN] Seq=0 Win=14600 Len=0 MSS=1460 SACK_PERM=1 TSval=18339192 TSecr=0 WS=128"
"209","36.941248","10.10.10.158","10.10.10.1","DNS","84","Standard query 0x60ec AAAA analytics.localytics.com"
"210","36.942760","10.10.10.1","10.10.10.158","DNS","223","Standard query response 0x60ec AAAA analytics.localytics.com CNAME queuerlb-599065538.us-east-1.elb.amazonaws.com SOA ns-1119.awsdns-11.org"
"211","36.950202","10.10.10.158","10.10.10.1","DNS","84","Standard query 0x0cd4 A analytics.localytics.com"
"212","36.950366","10.10.10.1","10.10.10.158","DNS","272","Standard query response 0x0cd4 A analytics.localytics.com CNAME queuerlb-599065538.us-east-1.elb.amazonaws.com A 50.19.119.163 A 50.17.195.105 A 23.23.160.249 A 23.23.102.29 A 23.21.229.203 A 23.21.194.29 A 107.20.243.255 A 54.225.147.8"
"213","36.964407","10.22.22.2","50.19.119.163","TCP","74","53815  >  443 [SYN] Seq=0 Win=14600 Len=0 MSS=1460 SACK_PERM=1 TSval=18339641 TSecr=0 WS=128"
"214","37.962627","10.22.22.2","50.19.119.163","TCP","74","[TCP Retransmission] 53815  >  443 [SYN] Seq=0 Win=14600 Len=0 MSS=1460 SACK_PERM=1 TSval=18339841 TSecr=0 WS=128"
"215","38.744185","10.22.22.2","74.125.142.188","TCP","74","[TCP Retransmission] 52672  >  5228 [SYN] Seq=0 Win=14600 Len=0 MSS=1460 SACK_PERM=1 TSval=18339994 TSecr=0 WS=128"
"216","39.968379","10.22.22.2","50.19.119.163","TCP","74","[TCP Retransmission] 53815  >  443 [SYN] Seq=0 Win=14600 Len=0 MSS=1460 SACK_PERM=1 TSval=18340242 TSecr=0 WS=128"
"217","43.760240","10.10.10.158","54.235.195.29","TCP","74","4699  >  3475 [SYN] Seq=0 Win=5840 Len=0 MSS=1460 SACK_PERM=1 TSval=4294921028 TSecr=0 WS=2"
"218","43.862057","54.235.195.29","10.10.10.158","TCP","74","3475  >  4699 [SYN, ACK] Seq=0 Ack=1 Win=14480 Len=0 MSS=1380 SACK_PERM=1 TSval=191461892 TSecr=4294921028 WS=256"
"219","43.863067","10.10.10.158","54.235.195.29","TCP","66","4699  >  3475 [ACK] Seq=1 Ack=1 Win=5840 Len=0 TSval=4294921054 TSecr=191461892"
"220","43.864286","10.10.10.158","54.235.195.29","TCP","415","4699  >  3475 [PSH, ACK] Seq=1 Ack=1 Win=5840 Len=349 TSval=4294921054 TSecr=191461892"
"221","43.965852","54.235.195.29","10.10.10.158","TCP","66","3475  >  4699 [ACK] Seq=1 Ack=350 Win=15616 Len=0 TSval=191461918 TSecr=4294921054"
"222","43.966465","54.235.195.29","10.10.10.158","TCP","80","3475  >  4699 [PSH, ACK] Seq=1 Ack=350 Win=15616 Len=14 TSval=191461918 TSecr=4294921054"
"223","43.969184","10.10.10.158","54.235.195.29","TCP","66","4699  >  3475 [ACK] Seq=350 Ack=15 Win=5840 Len=0 TSval=4294921080 TSecr=191461918"
"224","43.969898","10.10.10.158","54.235.195.29","TCP","66","4699  >  3475 [FIN, ACK] Seq=350 Ack=15 Win=5840 Len=0 TSval=4294921080 TSecr=191461918"
"225","43.988336","10.22.22.2","50.19.119.163","TCP","74","[TCP Retransmission] 53815  >  443 [SYN] Seq=0 Win=14600 Len=0 MSS=1460 SACK_PERM=1 TSval=18341044 TSecr=0 WS=128"
"226","44.072227","54.235.195.29","10.10.10.158","TCP","66","3475  >  4699 [FIN, ACK] Seq=15 Ack=351 Win=15616 Len=0 TSval=191461945 TSecr=4294921080"
"227","44.074231","10.10.10.158","54.235.195.29","TCP","66","4699  >  3475 [ACK] Seq=351 Ack=16 Win=5840 Len=0 TSval=4294921106 TSecr=191461945"
"228","46.769109","10.22.22.2","74.125.142.188","TCP","74","[TCP Retransmission] 52672  >  5228 [SYN] Seq=0 Win=14600 Len=0 MSS=1460 SACK_PERM=1 TSval=18341600 TSecr=0 WS=128"
"229","50.635478","10.10.10.158","10.10.10.1","DNS","72","Standard query 0xc301 A api.xbcs.net"
"230","50.635556","10.10.10.1","10.10.10.158","DNS","270","Standard query response 0xc301 A api.xbcs.net CNAME prod1-api-xbcs-net-889336557.us-east-1.elb.amazonaws.com A 50.17.221.66 A 23.23.111.129 A 23.21.226.117 A 23.21.138.13 A 23.21.117.32 A 54.243.87.97 A 54.225.140.113 A 54.83.204.109"
"231","50.648187","10.10.10.158","50.17.221.66","TCP","74","4386  >  8443 [SYN] Seq=0 Win=5840 Len=0 MSS=1460 SACK_PERM=1 TSval=4294922750 TSecr=0 WS=2"
"232","50.748147","50.17.221.66","10.10.10.158","TCP","74","8443  >  4386 [SYN, ACK] Seq=0 Ack=1 Win=14480 Len=0 MSS=1380 SACK_PERM=1 TSval=1299981769 TSecr=4294922750 WS=256"
"233","50.750215","10.10.10.158","50.17.221.66","TCP","66","4386  >  8443 [ACK] Seq=1 Ack=1 Win=5840 Len=0 TSval=4294922775 TSecr=1299981769"
"234","50.754619","10.10.10.158","50.17.221.66","TCP","293","4386  >  8443 [PSH, ACK] Seq=1 Ack=1 Win=5840 Len=227 TSval=4294922776 TSecr=1299981769"
"235","50.854415","50.17.221.66","10.10.10.158","TCP","66","8443  >  4386 [ACK] Seq=1 Ack=228 Win=15616 Len=0 TSval=1299981796 TSecr=4294922776"
"236","50.854794","50.17.221.66","10.10.10.158","TCP","1434","8443  >  4386 [ACK] Seq=1 Ack=228 Win=15616 Len=1368 TSval=1299981796 TSecr=4294922776"
"237","50.854815","50.17.221.66","10.10.10.158","TCP","1434","8443  >  4386 [ACK] Seq=1369 Ack=228 Win=15616 Len=1368 TSval=1299981796 TSecr=4294922776"
"238","50.854817","50.17.221.66","10.10.10.158","TCP","1426","8443  >  4386 [PSH, ACK] Seq=2737 Ack=228 Win=15616 Len=1360 TSval=1299981796 TSecr=4294922776"
"239","50.854823","50.17.221.66","10.10.10.158","TCP","869","8443  >  4386 [PSH, ACK] Seq=4097 Ack=228 Win=15616 Len=803 TSval=1299981796 TSecr=4294922776"
"240","50.916913","10.10.10.158","50.17.221.66","TCP","66","4386  >  8443 [ACK] Seq=228 Ack=1369 Win=8576 Len=0 TSval=4294922805 TSecr=1299981796"
"241","50.950069","10.10.10.158","50.17.221.66","TCP","66","4386  >  8443 [ACK] Seq=228 Ack=2737 Win=11312 Len=0 TSval=4294922808 TSecr=1299981796"
"242","50.959977","10.10.10.158","50.17.221.66","TCP","66","4386  >  8443 [ACK] Seq=228 Ack=4097 Win=14048 Len=0 TSval=4294922815 TSecr=1299981796"
"243","50.960100","10.10.10.158","50.17.221.66","TCP","66","4386  >  8443 [ACK] Seq=228 Ack=4900 Win=16784 Len=0 TSval=4294922822 TSecr=1299981796"
"244","51.002153","10.10.10.158","50.17.221.66","TCP","392","4386  >  8443 [PSH, ACK] Seq=228 Ack=4900 Win=16784 Len=326 TSval=4294922838 TSecr=1299981796"
"245","51.105124","50.17.221.66","10.10.10.158","TCP","125","8443  >  4386 [PSH, ACK] Seq=4900 Ack=554 Win=16640 Len=59 TSval=1299981859 TSecr=4294922838"
"246","51.107729","10.10.10.158","50.17.221.66","TCP","66","4386  >  8443 [ACK] Seq=554 Ack=4959 Win=16784 Len=0 TSval=4294922865 TSecr=1299981859"
"247","51.114600","10.10.10.158","50.17.221.66","TCP","327","4386  >  8443 [PSH, ACK] Seq=554 Ack=4959 Win=16784 Len=261 TSval=4294922866 TSecr=1299981859"
"248","51.170306","10.10.10.158","50.17.221.66","TCP","1434","4386  >  8443 [ACK] Seq=815 Ack=4959 Win=16784 Len=1368 TSval=4294922880 TSecr=1299981859"
"249","51.252733","50.17.221.66","10.10.10.158","TCP","66","8443  >  4386 [ACK] Seq=4959 Ack=815 Win=17920 Len=0 TSval=1299981896 TSecr=4294922866"
"250","51.255230","10.10.10.158","50.17.221.66","TCP","1434","4386  >  8443 [ACK] Seq=2183 Ack=4959 Win=16784 Len=1368 TSval=4294922901 TSecr=1299981896"
"251","51.257110","10.10.10.158","50.17.221.66","TCP","1434","4386  >  8443 [ACK] Seq=3551 Ack=4959 Win=16784 Len=1368 TSval=4294922901 TSecr=1299981896"
"252","51.270344","50.17.221.66","10.10.10.158","TCP","66","8443  >  4386 [ACK] Seq=4959 Ack=2183 Win=20736 Len=0 TSval=1299981900 TSecr=4294922880"
"253","51.273671","10.10.10.158","50.17.221.66","TCP","1434","4386  >  8443 [ACK] Seq=4919 Ack=4959 Win=16784 Len=1368 TSval=4294922906 TSecr=1299981900"
"254","51.275084","10.10.10.158","50.17.221.66","TCP","70","4386  >  8443 [PSH, ACK] Seq=6287 Ack=4959 Win=16784 Len=4 TSval=4294922906 TSecr=1299981900"
"255","51.355046","10.10.10.158","130.149.17.8","NTP","90","NTP Version 3, client"
"256","51.355196","50.17.221.66","10.10.10.158","TCP","66","8443  >  4386 [ACK] Seq=4959 Ack=3551 Win=23552 Len=0 TSval=1299981921 TSecr=4294922901"
"257","51.357260","10.10.10.158","50.17.221.66","TCP","1434","4386  >  8443 [ACK] Seq=6291 Ack=4959 Win=16784 Len=1368 TSval=4294922927 TSecr=1299981921"
"258","51.357728","50.17.221.66","10.10.10.158","TCP","66","8443  >  4386 [ACK] Seq=4959 Ack=4919 Win=26624 Len=0 TSval=1299981922 TSecr=4294922901"
"259","51.358092","10.10.10.158","50.17.221.66","TCP","1434","4386  >  8443 [ACK] Seq=7659 Ack=4959 Win=16784 Len=1368 TSval=4294922927 TSecr=1299981921"
"260","51.375302","50.17.221.66","10.10.10.158","TCP","66","8443  >  4386 [ACK] Seq=4959 Ack=6287 Win=29440 Len=0 TSval=1299981926 TSecr=4294922906"
"261","51.375324","50.17.221.66","10.10.10.158","TCP","66","8443  >  4386 [ACK] Seq=4959 Ack=6291 Win=29440 Len=0 TSval=1299981926 TSecr=4294922906"
"262","51.375631","130.149.17.8","10.10.10.158","NTP","90","NTP Version 3, server"
"263","51.381746","10.10.10.158","50.17.221.66","TCP","845","4386  >  8443 [PSH, ACK] Seq=9027 Ack=4959 Win=16784 Len=779 TSval=4294922932 TSecr=1299981926"
"264","51.410755","10.10.10.158","50.17.221.66","TCP","1434","4386  >  8443 [ACK] Seq=9806 Ack=4959 Win=16784 Len=1368 TSval=4294922940 TSecr=1299981926"
"265","51.440857","10.10.10.158","50.17.221.66","TCP","1434","4386  >  8443 [ACK] Seq=11174 Ack=4959 Win=16784 Len=1368 TSval=4294922948 TSecr=1299981926"
"266","51.457989","50.17.221.66","10.10.10.158","TCP","66","8443  >  4386 [ACK] Seq=4959 Ack=7659 Win=32256 Len=0 TSval=1299981947 TSecr=4294922927"
"267","51.458648","50.17.221.66","10.10.10.158","TCP","66","8443  >  4386 [ACK] Seq=4959 Ack=9027 Win=35072 Len=0 TSval=1299981947 TSecr=4294922927"
"268","51.474600","10.10.10.158","50.17.221.66","TCP","1434","4386  >  8443 [ACK] Seq=12542 Ack=4959 Win=16784 Len=1368 TSval=4294922956 TSecr=1299981947"
"269","51.481650","50.17.221.66","10.10.10.158","TCP","66","8443  >  4386 [ACK] Seq=4959 Ack=9806 Win=37888 Len=0 TSval=1299981953 TSecr=4294922932"
"270","51.483365","10.10.10.158","50.17.221.66","TCP","550","4386  >  8443 [PSH, ACK] Seq=13910 Ack=4959 Win=16784 Len=484 TSval=4294922959 TSecr=1299981953"
"271","51.510869","50.17.221.66","10.10.10.158","TCP","66","8443  >  4386 [ACK] Seq=4959 Ack=11174 Win=40704 Len=0 TSval=1299981960 TSecr=4294922940"
"272","51.516198","10.10.10.158","50.17.221.66","TCP","1434","4386  >  8443 [ACK] Seq=14394 Ack=4959 Win=16784 Len=1368 TSval=4294922966 TSecr=1299981953"
"273","51.541555","50.17.221.66","10.10.10.158","TCP","66","8443  >  4386 [ACK] Seq=4959 Ack=12542 Win=42496 Len=0 TSval=1299981968 TSecr=4294922948"
"274","51.546897","10.10.10.158","50.17.221.66","TCP","1434","4386  >  8443 [ACK] Seq=15762 Ack=4959 Win=16784 Len=1368 TSval=4294922974 TSecr=1299981968"
"275","51.573964","10.10.10.158","129.132.2.21","NTP","90","NTP Version 3, client"
"276","51.574539","50.17.221.66","10.10.10.158","TCP","66","8443  >  4386 [ACK] Seq=4959 Ack=13910 Win=42496 Len=0 TSval=1299981976 TSecr=4294922956"
"277","51.581406","129.143.47.6","10.10.10.158","ICMP","70","Destination unreachable (Communication administratively filtered)"
"278","51.583152","50.17.221.66","10.10.10.158","TCP","66","8443  >  4386 [ACK] Seq=4959 Ack=14394 Win=42496 Len=0 TSval=1299981978 TSecr=4294922959"
"279","51.607465","10.10.10.158","50.17.221.66","TCP","993","4386  >  8443 [PSH, ACK] Seq=17130 Ack=4959 Win=16784 Len=927 TSval=4294922984 TSecr=1299981978"
"280","51.607579","10.10.10.158","192.53.103.104","NTP","90","NTP Version 3, client"
"281","51.616637","50.17.221.66","10.10.10.158","TCP","66","8443  >  4386 [ACK] Seq=4959 Ack=15762 Win=42496 Len=0 TSval=1299981986 TSecr=4294922966"
"282","51.621817","192.53.103.104","10.10.10.158","NTP","90","NTP Version 3, server"
"283","51.646951","50.17.221.66","10.10.10.158","TCP","66","8443  >  4386 [ACK] Seq=4959 Ack=17130 Win=42496 Len=0 TSval=1299981994 TSecr=4294922974"
"284","51.709708","50.17.221.66","10.10.10.158","TCP","66","8443  >  4386 [ACK] Seq=4959 Ack=18057 Win=42496 Len=0 TSval=1299982010 TSecr=4294922984"
"285","51.736475","50.17.221.66","10.10.10.158","TCP","471","8443  >  4386 [PSH, ACK] Seq=4959 Ack=18057 Win=42496 Len=405 TSval=1299982016 TSecr=4294922984"
"286","51.742652","10.10.10.158","50.17.221.66","TCP","103","4386  >  8443 [PSH, ACK] Seq=18057 Ack=5364 Win=16784 Len=37 TSval=4294923023 TSecr=1299982016"
"287","51.843069","50.17.221.66","10.10.10.158","TCP","103","8443  >  4386 [PSH, ACK] Seq=5364 Ack=18094 Win=42496 Len=37 TSval=1299982043 TSecr=4294923023"
"288","51.843117","50.17.221.66","10.10.10.158","TCP","66","8443  >  4386 [FIN, ACK] Seq=5401 Ack=18094 Win=42496 Len=0 TSval=1299982043 TSecr=4294923023"
"289","51.883279","10.10.10.158","50.17.221.66","TCP","66","4386  >  8443 [ACK] Seq=18094 Ack=5402 Win=16784 Len=0 TSval=4294923059 TSecr=1299982043"
"290","52.010186","10.22.22.2","50.19.119.163","TCP","74","[TCP Retransmission] 53815  >  443 [SYN] Seq=0 Win=14600 Len=0 MSS=1460 SACK_PERM=1 TSval=18342648 TSecr=0 WS=128"
"291","56.870116","10.10.10.158","50.17.221.66","TCP","66","4386  >  8443 [RST, ACK] Seq=18094 Ack=5402 Win=16784 Len=0 TSval=4294924305 TSecr=1299982043"
"292","56.875192","10.10.10.158","224.0.0.22","IGMPv3","54","Membership Report / Join group 239.255.255.250 for any sources"
"293","56.930888","10.10.10.158","239.255.255.250","SSDP","424","NOTIFY * HTTP/1.1 "
"294","56.936111","10.10.10.158","239.255.255.250","SSDP","423","NOTIFY * HTTP/1.1 "
"295","56.940581","10.10.10.158","239.255.255.250","SSDP","448","NOTIFY * HTTP/1.1 "
"296","56.940709","10.10.10.158","239.255.255.250","SSDP","454","NOTIFY * HTTP/1.1 "
"297","56.949494","10.10.10.158","239.255.255.250","SSDP","452","NOTIFY * HTTP/1.1 "
"298","56.949684","10.10.10.158","239.255.255.250","SSDP","456","NOTIFY * HTTP/1.1 "
"299","56.959070","10.10.10.158","239.255.255.250","SSDP","464","NOTIFY * HTTP/1.1 "
"300","56.964574","10.10.10.158","239.255.255.250","SSDP","446","NOTIFY * HTTP/1.1 "
"301","56.964686","10.10.10.158","239.255.255.250","SSDP","452","NOTIFY * HTTP/1.1 "
"302","56.964859","10.10.10.158","239.255.255.250","SSDP","460","NOTIFY * HTTP/1.1 "
"303","56.965041","10.10.10.158","239.255.255.250","SSDP","456","NOTIFY * HTTP/1.1 "
"304","56.965193","10.10.10.158","239.255.255.250","SSDP","450","NOTIFY * HTTP/1.1 "
"305","56.965353","10.10.10.158","239.255.255.250","SSDP","143","M-SEARCH * HTTP/1.1 "
"306","66.242267","10.10.10.158","224.0.0.22","IGMPv3","54","Membership Report / Join group 239.255.255.250 for any sources"
"307","67.976835","10.10.10.158","239.255.255.250","SSDP","424","NOTIFY * HTTP/1.1 "
"308","67.983555","10.10.10.158","239.255.255.250","SSDP","423","NOTIFY * HTTP/1.1 "
"309","67.983853","10.10.10.158","239.255.255.250","SSDP","448","NOTIFY * HTTP/1.1 "
"310","67.994436","10.10.10.158","239.255.255.250","SSDP","454","NOTIFY * HTTP/1.1 "
"311","67.999893","10.10.10.158","239.255.255.250","SSDP","452","NOTIFY * HTTP/1.1 "
"312","68.004509","10.10.10.158","239.255.255.250","SSDP","456","NOTIFY * HTTP/1.1 "
"313","68.009137","10.10.10.158","239.255.255.250","SSDP","464","NOTIFY * HTTP/1.1 "
"314","68.014070","10.10.10.158","239.255.255.250","SSDP","446","NOTIFY * HTTP/1.1 "
"315","68.019722","10.10.10.158","239.255.255.250","SSDP","452","NOTIFY * HTTP/1.1 "
"316","68.024744","10.10.10.158","239.255.255.250","SSDP","460","NOTIFY * HTTP/1.1 "
"317","68.024879","10.10.10.158","239.255.255.250","SSDP","456","NOTIFY * HTTP/1.1 "
"318","68.051015","10.10.10.158","239.255.255.250","SSDP","450","NOTIFY * HTTP/1.1 "
"319","74.862466","10.10.10.158","10.10.10.1","ICMP","118","Echo (ping) request  id=0x7b05, seq=0/0, ttl=64 (reply in 320)"
"320","74.862530","10.10.10.1","10.10.10.158","ICMP","118","Echo (ping) reply    id=0x7b05, seq=0/0, ttl=64 (request in 319)"
"321","75.868191","10.10.10.158","10.10.10.1","ICMP","118","Echo (ping) request  id=0x7b05, seq=1/256, ttl=64 (reply in 322)"
"322","75.868238","10.10.10.1","10.10.10.158","ICMP","118","Echo (ping) reply    id=0x7b05, seq=1/256, ttl=64 (request in 321)"
"323","76.873029","10.10.10.158","10.10.10.1","ICMP","118","Echo (ping) request  id=0x7b05, seq=2/512, ttl=64 (reply in 324)"
"324","76.873057","10.10.10.1","10.10.10.158","ICMP","118","Echo (ping) reply    id=0x7b05, seq=2/512, ttl=64 (request in 323)"
"325","79.867989","DavidEle_06:08:ba","BelkinIn_41:c2:05","ARP","42","Who has 10.10.10.158? Tell 10.10.10.1"
"326","79.870541","BelkinIn_41:c2:05","DavidEle_06:08:ba","ARP","42","10.10.10.158 is at 94:10:3e:41:c2:05"
