"No.","Time","Source","Destination","Protocol","Length","Info"
"1","0.000000","BelkinIn_34:0c:b5","IntelCor_c3:41:78","EAPOL","135","Key (Message 2 of 4)"
"2","0.004095","BelkinIn_34:0c:b5","IntelCor_c3:41:78","EAPOL","113","Key (Message 4 of 4)"
"3","1.993165","BelkinIn_34:0c:b5","Broadcast","XID","20","Basic Format; Type 1 LLC (Class I LLC); Window Size 0"
"4","2.000167","BelkinIn_34:0c:b5","IntelCor_c3:41:78","EAPOL","135","Key (Message 2 of 4)"
"5","2.004492","BelkinIn_34:0c:b5","IntelCor_c3:41:78","EAPOL","113","Key (Message 4 of 4)"
"6","2.821308","0.0.0.0","255.255.255.255","DHCP","590","DHCP Discover - Transaction ID 0x7c412f22"
"7","2.861414","0.0.0.0","255.255.255.255","DHCP","590","DHCP Discover - Transaction ID 0x7c412f22"
"8","2.901691","0.0.0.0","255.255.255.255","DHCP","590","DHCP Discover - Transaction ID 0x7c412f22"
"9","2.942606","0.0.0.0","255.255.255.255","DHCP","590","DHCP Discover - Transaction ID 0x7c412f22"
"10","2.997354","0.0.0.0","255.255.255.255","DHCP","590","DHCP Request  - Transaction ID 0x7c412f22"
"11","3.623019","BelkinIn_34:0c:b5","Broadcast","ARP","60","Who has 10.10.10.1? Tell 10.10.10.190"
"12","3.623035","DavidEle_06:08:ba","BelkinIn_34:0c:b5","ARP","42","10.10.10.1 is at 00:b5:6d:06:08:ba"
"13","3.710439","BelkinIn_34:0c:b5","Broadcast","ARP","42","Who has 10.10.10.1? Tell 10.10.10.190"
"14","3.710454","DavidEle_06:08:ba","BelkinIn_34:0c:b5","ARP","42","10.10.10.1 is at 00:b5:6d:06:08:ba"
"15","3.714935","10.10.10.190","10.10.10.1","DNS","74","Standard query 0x0002 A www.belkin.com"
"16","3.716369","10.10.10.1","10.10.10.190","DNS","443","Standard query response 0x0002 A www.belkin.com CNAME d3gjecg2uu2eaq.cloudfront.net A 52.85.184.61 A 52.85.184.109 A 52.85.184.119 A 52.85.184.159 A 52.85.184.182 A 52.85.184.193 A 52.85.184.42 A 52.85.184.55 NS ns-1906.awsdns-46.co.uk NS ns-747.awsdns-29.net NS ns-105.awsdns-13.com NS ns-1510.awsdns-60.org A 205.251.192.105 A 205.251.194.235 A 205.251.197.230 A 205.251.199.114"
"17","3.723476","10.10.10.190","10.10.10.1","DNS","89","Standard query 0x0003 A d3gjecg2uu2eaq.cloudfront.net"
"18","3.723559","10.10.10.1","10.10.10.190","DNS","217","Standard query response 0x0003 A d3gjecg2uu2eaq.cloudfront.net A 52.85.184.55 A 52.85.184.42 A 52.85.184.193 A 52.85.184.182 A 52.85.184.159 A 52.85.184.119 A 52.85.184.109 A 52.85.184.61"
"19","5.781787","fe80::9610:3eff:fe34:cb5","ff02::16","ICMPv6","90","Multicast Listener Report Message v2"
"20","5.809635","fe80::9610:3eff:fe34:cb5","ff02::2","ICMPv6","70","Router Solicitation from 94:10:3e:34:0c:b5"
"21","8.722200","DavidEle_06:08:ba","BelkinIn_34:0c:b5","ARP","42","Who has 10.10.10.190? Tell 10.10.10.1"
"22","8.724839","BelkinIn_34:0c:b5","DavidEle_06:08:ba","ARP","42","10.10.10.190 is at 94:10:3e:34:0c:b5"
"23","9.809647","fe80::9610:3eff:fe34:cb5","ff02::2","ICMPv6","70","Router Solicitation from 94:10:3e:34:0c:b5"
"24","10.261398","10.10.10.190","10.10.10.1","DNS","62","Standard query 0x1743 A gw"
"25","10.704428","10.10.10.190","10.10.10.1","DNS","88","Standard query 0x0d5a A alt7-mtalk.google.com.Belkin"
"26","10.708595","10.10.10.1","10.10.10.190","DNS","163","Standard query response 0x0d5a No such name A alt7-mtalk.google.com.Belkin SOA a.root-servers.net"
"27","11.070794","10.10.10.1","10.10.10.190","DNS","118","Standard query response 0x1743 A gw SOA gw01.dns.pt"
"28","11.090939","10.10.10.190","10.10.10.1","DNS","62","Standard query 0xcfa2 A gw"
"29","11.091050","10.10.10.1","10.10.10.190","DNS","62","Standard query response 0xcfa2 A gw"
"30","11.110513","10.10.10.190","10.10.10.1","DNS","62","Standard query 0xb922 A gw"
"31","11.110624","10.10.10.1","10.10.10.190","DNS","62","Standard query response 0xb922 A gw"
"32","11.130778","10.10.10.190","10.10.10.1","DNS","62","Standard query 0x9cd0 A gw"
"33","11.130890","10.10.10.1","10.10.10.190","DNS","62","Standard query response 0x9cd0 A gw"
"34","11.151141","10.10.10.190","10.10.10.1","DNS","62","Standard query 0x0d54 A gw"
"35","11.151228","10.10.10.1","10.10.10.190","DNS","62","Standard query response 0x0d54 A gw"
"36","11.283565","10.10.10.190","129.132.2.21","NTP","90","NTP Version 3, client"
"37","11.300043","10.10.10.190","130.149.17.8","NTP","90","NTP Version 3, client"
"38","11.313498","10.10.10.190","192.53.103.104","NTP","90","NTP Version 3, client"
"39","11.314210","130.149.17.8","10.10.10.190","NTP","90","NTP Version 3, server"
"40","11.324707","192.53.103.104","10.10.10.190","NTP","90","NTP Version 3, server"
"41","11.423435","fe80::9610:3eff:fe34:cb5","ff02::16","ICMPv6","110","Multicast Listener Report Message v2"
"42","11.725641","10.10.10.190","10.10.10.1","DNS","84","Standard query 0xe259 A analytics.localytics.com"
"43","11.729742","10.10.10.1","10.10.10.190","DNS","446","Standard query response 0xe259 A analytics.localytics.com CNAME queuer-prod-elb.53.localytics.com A 52.86.30.227 A 52.86.133.32 A 52.87.11.228 A 54.164.239.22 A 54.165.155.168 A 54.165.224.7 A 52.1.131.19 A 52.6.114.238 NS ns-509.awsdns-63.com NS ns-642.awsdns-16.net NS ns-1150.awsdns-15.org NS ns-1881.awsdns-43.co.uk A 205.251.193.253 A 205.251.194.130 A 205.251.196.126 A 205.251.199.89"
"44","11.754157","10.22.22.2","52.86.30.227","TCP","74","40091  >  443 [SYN] Seq=0 Win=65535 Len=0 MSS=1460 SACK_PERM=1 TSval=538252 TSecr=0 WS=128"
"45","12.761597","10.22.22.2","52.86.30.227","TCP","74","[TCP Retransmission] 40091  >  443 [SYN] Seq=0 Win=65535 Len=0 MSS=1460 SACK_PERM=1 TSval=538452 TSecr=0 WS=128"
"46","12.842040","10.10.10.190","10.10.10.1","DNS","68","Standard query 0x0004 A xbcs.net"
"47","12.855975","10.10.10.1","10.10.10.190","DNS","227","Standard query response 0x0004 A xbcs.net A 184.73.174.14 NS ns36.domaincontrol.com NS ns35.domaincontrol.com A 216.69.185.18 AAAA 2607:f208:206::12 A 208.109.255.18 AAAA 2607:f208:302::12"
"48","12.862304","10.10.10.190","10.10.10.1","DNS","68","Standard query 0x0005 A xbcs.net"
"49","12.862405","10.10.10.1","10.10.10.190","DNS","84","Standard query response 0x0005 A xbcs.net A 184.73.174.14"
"50","13.083630","10.10.10.190","184.73.174.14","TCP","74","4469  >  8443 [SYN] Seq=0 Win=5840 Len=0 MSS=1460 SACK_PERM=1 TSval=4294910561 TSecr=0 WS=2"
"51","13.183594","184.73.174.14","10.10.10.190","TCP","74","8443  >  4469 [SYN, ACK] Seq=0 Ack=1 Win=28960 Len=0 MSS=1380 SACK_PERM=1 TSval=1287388436 TSecr=4294910561 WS=128"
"52","13.185736","10.10.10.190","184.73.174.14","TCP","66","4469  >  8443 [ACK] Seq=1 Ack=1 Win=5840 Len=0 TSval=4294910586 TSecr=1287388436"
"53","13.526060","10.10.10.190","184.73.174.14","TCP","66","4469  >  8443 [FIN, ACK] Seq=1 Ack=1 Win=5840 Len=0 TSval=4294910671 TSecr=1287388436"
"54","13.587047","10.10.10.190","184.73.174.14","TCP","74","4470  >  8443 [SYN] Seq=0 Win=5840 Len=0 MSS=1460 SACK_PERM=1 TSval=4294910687 TSecr=0 WS=2"
"55","13.625823","184.73.174.14","10.10.10.190","TCP","66","8443  >  4469 [FIN, ACK] Seq=1 Ack=2 Win=29056 Len=0 TSval=1287388547 TSecr=4294910671"
"56","13.629196","10.10.10.190","184.73.174.14","TCP","66","4469  >  8443 [ACK] Seq=2 Ack=2 Win=5840 Len=0 TSval=4294910697 TSecr=1287388547"
"57","13.688545","184.73.174.14","10.10.10.190","TCP","74","8443  >  4470 [SYN, ACK] Seq=0 Ack=1 Win=28960 Len=0 MSS=1380 SACK_PERM=1 TSval=1287388563 TSecr=4294910687 WS=128"
"58","13.691085","10.10.10.190","184.73.174.14","TCP","66","4470  >  8443 [ACK] Seq=1 Ack=1 Win=5840 Len=0 TSval=4294910713 TSecr=1287388563"
"59","13.704073","10.10.10.190","184.73.174.14","TCP","272","4470  >  8443 [PSH, ACK] Seq=1 Ack=1 Win=5840 Len=206 TSval=4294910716 TSecr=1287388563"
"60","13.805532","184.73.174.14","10.10.10.190","TCP","66","8443  >  4470 [ACK] Seq=1 Ack=207 Win=30080 Len=0 TSval=1287388592 TSecr=4294910716"
"61","13.808748","184.73.174.14","10.10.10.190","TCP","1434","8443  >  4470 [ACK] Seq=1 Ack=207 Win=30080 Len=1368 TSval=1287388592 TSecr=4294910716"
"62","13.808775","184.73.174.14","10.10.10.190","TCP","515","8443  >  4470 [PSH, ACK] Seq=1369 Ack=207 Win=30080 Len=449 TSval=1287388592 TSecr=4294910716"
"63","13.815607","10.10.10.190","184.73.174.14","TCP","66","4470  >  8443 [ACK] Seq=207 Ack=1369 Win=8576 Len=0 TSval=4294910743 TSecr=1287388592"
"64","13.816654","10.10.10.190","184.73.174.14","TCP","66","4470  >  8443 [ACK] Seq=207 Ack=1818 Win=8576 Len=0 TSval=4294910744 TSecr=1287388592"
"65","14.669779","10.10.10.190","10.10.10.1","DNS","78","Standard query 0x7a23 A api.samsungosp.com"
"66","14.671315","10.10.10.1","10.10.10.190","DNS","480","Standard query response 0x7a23 A api.samsungosp.com CNAME scalr-26dc4e1ecfa7bc-415-587723368.us-east-1.elb.amazonaws.com A 107.21.229.36 A 184.73.179.203 A 204.236.217.159 A 54.243.161.167 A 54.243.187.195 A 75.101.153.17 A 107.21.99.201 A 107.21.218.177 NS ns-235.awsdns-29.com NS ns-934.awsdns-52.net NS ns-1793.awsdns-32.co.uk NS ns-1119.awsdns-11.org A 205.251.192.235 A 205.251.195.166 A 205.251.196.95 A 205.251.199.1"
"67","14.692976","10.22.22.2","107.21.229.36","TCP","74","55988  >  443 [SYN] Seq=0 Win=65535 Len=0 MSS=1460 SACK_PERM=1 TSval=538840 TSecr=0 WS=128"
"68","14.695501","10.10.10.190","184.73.174.14","TCP","200","4470  >  8443 [PSH, ACK] Seq=207 Ack=1818 Win=8576 Len=134 TSval=4294910964 TSecr=1287388592"
"69","14.756599","10.22.22.2","52.86.30.227","TCP","74","[TCP Retransmission] 40091  >  443 [SYN] Seq=0 Win=65535 Len=0 MSS=1460 SACK_PERM=1 TSval=538853 TSecr=0 WS=128"
"70","14.798058","184.73.174.14","10.10.10.190","TCP","125","8443  >  4470 [PSH, ACK] Seq=1818 Ack=341 Win=31104 Len=59 TSval=1287388840 TSecr=4294910964"
"71","14.800469","10.10.10.190","184.73.174.14","TCP","66","4470  >  8443 [ACK] Seq=341 Ack=1877 Win=8576 Len=0 TSval=4294910990 TSecr=1287388840"
"72","14.809159","10.10.10.190","184.73.174.14","TCP","279","4470  >  8443 [PSH, ACK] Seq=341 Ack=1877 Win=8576 Len=213 TSval=4294910992 TSecr=1287388840"
"73","14.839105","10.10.10.190","184.73.174.14","TCP","1434","4470  >  8443 [ACK] Seq=554 Ack=1877 Win=8576 Len=1368 TSval=4294910999 TSecr=1287388840"
"74","14.872778","10.10.10.190","184.73.174.14","TCP","1434","4470  >  8443 [ACK] Seq=1922 Ack=1877 Win=8576 Len=1368 TSval=4294911007 TSecr=1287388840"
"75","14.940701","184.73.174.14","10.10.10.190","TCP","66","8443  >  4470 [ACK] Seq=1877 Ack=1922 Win=34944 Len=0 TSval=1287388876 TSecr=4294910992"
"76","14.943550","10.10.10.190","184.73.174.14","TCP","1434","4470  >  8443 [ACK] Seq=3290 Ack=1877 Win=8576 Len=1368 TSval=4294911026 TSecr=1287388876"
"77","14.946476","10.10.10.190","184.73.174.14","TCP","1434","4470  >  8443 [ACK] Seq=4658 Ack=1877 Win=8576 Len=1368 TSval=4294911026 TSecr=1287388876"
"78","14.949164","10.10.10.190","184.73.174.14","TCP","736","4470  >  8443 [PSH, ACK] Seq=6026 Ack=1877 Win=8576 Len=670 TSval=4294911026 TSecr=1287388876"
"79","15.028561","184.73.174.14","10.10.10.190","TCP","66","8443  >  4470 [ACK] Seq=1877 Ack=3290 Win=37760 Len=0 TSval=1287388898 TSecr=4294911007"
"80","15.031959","10.10.10.190","184.73.174.14","TCP","1434","4470  >  8443 [ACK] Seq=6696 Ack=1877 Win=8576 Len=1368 TSval=4294911048 TSecr=1287388898"
"81","15.037199","10.10.10.190","184.73.174.14","TCP","1434","4470  >  8443 [ACK] Seq=8064 Ack=1877 Win=8576 Len=1368 TSval=4294911048 TSecr=1287388898"
"82","15.045074","184.73.174.14","10.10.10.190","TCP","66","8443  >  4470 [ACK] Seq=1877 Ack=4658 Win=40448 Len=0 TSval=1287388902 TSecr=4294911026"
"83","15.048047","184.73.174.14","10.10.10.190","TCP","66","8443  >  4470 [ACK] Seq=1877 Ack=6026 Win=43136 Len=0 TSval=1287388902 TSecr=4294911026"
"84","15.050535","184.73.174.14","10.10.10.190","TCP","66","8443  >  4470 [ACK] Seq=1877 Ack=6696 Win=45952 Len=0 TSval=1287388903 TSecr=4294911026"
"85","15.056641","10.10.10.190","184.73.174.14","TCP","1030","4470  >  8443 [PSH, ACK] Seq=9432 Ack=1877 Win=8576 Len=964 TSval=4294911053 TSecr=1287388903"
"86","15.083412","10.10.10.190","184.73.174.14","TCP","1434","4470  >  8443 [ACK] Seq=10396 Ack=1877 Win=8576 Len=1368 TSval=4294911060 TSecr=1287388903"
"87","15.113856","10.10.10.190","184.73.174.14","TCP","1434","4470  >  8443 [ACK] Seq=11764 Ack=1877 Win=8576 Len=1368 TSval=4294911068 TSecr=1287388903"
"88","15.133504","184.73.174.14","10.10.10.190","TCP","66","8443  >  4470 [ACK] Seq=1877 Ack=8064 Win=48640 Len=0 TSval=1287388924 TSecr=4294911048"
"89","15.138677","184.73.174.14","10.10.10.190","TCP","66","8443  >  4470 [ACK] Seq=1877 Ack=9432 Win=51328 Len=0 TSval=1287388925 TSecr=4294911048"
"90","15.144622","10.10.10.190","184.73.174.14","TCP","1434","4470  >  8443 [ACK] Seq=13132 Ack=1877 Win=8576 Len=1368 TSval=4294911076 TSecr=1287388925"
"91","15.158929","184.73.174.14","10.10.10.190","TCP","66","8443  >  4470 [ACK] Seq=1877 Ack=10396 Win=54144 Len=0 TSval=1287388930 TSecr=4294911053"
"92","15.162167","10.10.10.190","184.73.174.14","TCP","846","4470  >  8443 [PSH, ACK] Seq=14500 Ack=1877 Win=8576 Len=780 TSval=4294911080 TSecr=1287388930"
"93","15.184936","184.73.174.14","10.10.10.190","TCP","66","8443  >  4470 [ACK] Seq=1877 Ack=11764 Win=56832 Len=0 TSval=1287388937 TSecr=4294911060"
"94","15.194142","10.10.10.190","184.73.174.14","TCP","1434","4470  >  8443 [ACK] Seq=15280 Ack=1877 Win=8576 Len=1368 TSval=4294911088 TSecr=1287388937"
"95","15.216220","184.73.174.14","10.10.10.190","TCP","66","8443  >  4470 [ACK] Seq=1877 Ack=13132 Win=59648 Len=0 TSval=1287388944 TSecr=4294911068"
"96","15.226656","10.10.10.190","184.73.174.14","TCP","1434","4470  >  8443 [ACK] Seq=16648 Ack=1877 Win=8576 Len=1368 TSval=4294911095 TSecr=1287388944"
"97","15.246195","184.73.174.14","10.10.10.190","TCP","66","8443  >  4470 [ACK] Seq=1877 Ack=14500 Win=62336 Len=0 TSval=1287388952 TSecr=4294911076"
"98","15.253899","10.10.10.190","184.73.174.14","TCP","1434","4470  >  8443 [ACK] Seq=18016 Ack=1877 Win=8576 Len=1368 TSval=4294911103 TSecr=1287388952"
"99","15.263612","184.73.174.14","10.10.10.190","TCP","66","8443  >  4470 [ACK] Seq=1877 Ack=15280 Win=65024 Len=0 TSval=1287388956 TSecr=4294911080"
"100","15.268385","10.10.10.190","184.73.174.14","TCP","624","4470  >  8443 [PSH, ACK] Seq=19384 Ack=1877 Win=8576 Len=558 TSval=4294911106 TSecr=1287388956"
"101","15.295754","184.73.174.14","10.10.10.190","TCP","66","8443  >  4470 [ACK] Seq=1877 Ack=16648 Win=67840 Len=0 TSval=1287388964 TSecr=4294911088"
"102","15.298492","10.10.10.190","184.73.174.14","TCP","1434","4470  >  8443 [ACK] Seq=19942 Ack=1877 Win=8576 Len=1368 TSval=4294911114 TSecr=1287388956"
"103","15.327043","10.10.10.190","184.73.174.14","TCP","1434","4470  >  8443 [ACK] Seq=21310 Ack=1877 Win=8576 Len=1368 TSval=4294911121 TSecr=1287388964"
"104","15.328207","184.73.174.14","10.10.10.190","TCP","66","8443  >  4470 [ACK] Seq=1877 Ack=18016 Win=70528 Len=0 TSval=1287388972 TSecr=4294911095"
"105","15.355480","184.73.174.14","10.10.10.190","TCP","66","8443  >  4470 [ACK] Seq=1877 Ack=19384 Win=73216 Len=0 TSval=1287388979 TSecr=4294911103"
"106","15.369808","184.73.174.14","10.10.10.190","TCP","66","8443  >  4470 [ACK] Seq=1877 Ack=19942 Win=76032 Len=0 TSval=1287388983 TSecr=4294911106"
"107","15.370815","10.10.10.190","184.73.174.14","TCP","1363","4470  >  8443 [PSH, ACK] Seq=22678 Ack=1877 Win=8576 Len=1297 TSval=4294911133 TSecr=1287388983"
"108","15.400035","184.73.174.14","10.10.10.190","TCP","66","8443  >  4470 [ACK] Seq=1877 Ack=21310 Win=78720 Len=0 TSval=1287388990 TSecr=4294911114"
"109","15.428589","184.73.174.14","10.10.10.190","TCP","66","8443  >  4470 [ACK] Seq=1877 Ack=22678 Win=81536 Len=0 TSval=1287388998 TSecr=4294911121"
"110","15.472410","184.73.174.14","10.10.10.190","TCP","66","8443  >  4470 [ACK] Seq=1877 Ack=23975 Win=84224 Len=0 TSval=1287389008 TSecr=4294911133"
"111","15.705210","10.22.22.2","107.21.229.36","TCP","74","[TCP Retransmission] 55988  >  443 [SYN] Seq=0 Win=65535 Len=0 MSS=1460 SACK_PERM=1 TSval=539040 TSecr=0 WS=128"
"112","17.231766","184.73.174.14","10.10.10.190","TCP","908","8443  >  4470 [PSH, ACK] Seq=1877 Ack=23975 Win=84224 Len=842 TSval=1287389448 TSecr=4294911133"
"113","17.231796","184.73.174.14","10.10.10.190","TCP","103","8443  >  4470 [PSH, ACK] Seq=2719 Ack=23975 Win=84224 Len=37 TSval=1287389448 TSecr=4294911133"
"114","17.231803","184.73.174.14","10.10.10.190","TCP","66","8443  >  4470 [FIN, ACK] Seq=2756 Ack=23975 Win=84224 Len=0 TSval=1287389448 TSecr=4294911133"
"115","17.239031","10.10.10.190","184.73.174.14","TCP","103","4470  >  8443 [PSH, ACK] Seq=23975 Ack=2757 Win=11312 Len=37 TSval=4294911599 TSecr=1287389448"
"116","17.239228","10.10.10.190","184.73.174.14","TCP","66","4470  >  8443 [RST, ACK] Seq=24012 Ack=2757 Win=11312 Len=0 TSval=4294911600 TSecr=1287389448"
"117","17.357971","fe80::9610:3eff:fe34:cb5","ff02::16","ICMPv6","110","Multicast Listener Report Message v2"
"118","17.708836","10.22.22.2","107.21.229.36","TCP","74","[TCP Retransmission] 55988  >  443 [SYN] Seq=0 Win=65535 Len=0 MSS=1460 SACK_PERM=1 TSval=539441 TSecr=0 WS=128"
"119","17.900262","10.10.10.190","10.10.10.1","DNS","78","Standard query 0xa9b7 AAAA api.samsungosp.com"
"120","17.903450","10.10.10.1","10.10.10.190","DNS","233","Standard query response 0xa9b7 AAAA api.samsungosp.com CNAME scalr-26dc4e1ecfa7bc-415-587723368.us-east-1.elb.amazonaws.com SOA ns-1119.awsdns-11.org"
"121","17.911563","10.10.10.190","10.10.10.1","DNS","78","Standard query 0xbbf5 A api.samsungosp.com"
"122","17.911681","10.10.10.1","10.10.10.190","DNS","282","Standard query response 0xbbf5 A api.samsungosp.com CNAME scalr-26dc4e1ecfa7bc-415-587723368.us-east-1.elb.amazonaws.com A 107.21.218.177 A 107.21.99.201 A 75.101.153.17 A 54.243.187.195 A 54.243.161.167 A 204.236.217.159 A 184.73.179.203 A 107.21.229.36"
"123","17.926510","10.22.22.2","107.21.218.177","TCP","74","60193  >  443 [SYN] Seq=0 Win=65535 Len=0 MSS=1460 SACK_PERM=1 TSval=539487 TSecr=0 WS=128"
"124","18.783107","10.22.22.2","52.86.30.227","TCP","74","[TCP Retransmission] 40091  >  443 [SYN] Seq=0 Win=65535 Len=0 MSS=1460 SACK_PERM=1 TSval=539656 TSecr=0 WS=128"
"125","18.931270","10.22.22.2","107.21.218.177","TCP","74","[TCP Retransmission] 60193  >  443 [SYN] Seq=0 Win=65535 Len=0 MSS=1460 SACK_PERM=1 TSval=539687 TSecr=0 WS=128"
"126","20.942772","10.22.22.2","107.21.218.177","TCP","74","[TCP Retransmission] 60193  >  443 [SYN] Seq=0 Win=65535 Len=0 MSS=1460 SACK_PERM=1 TSval=540088 TSecr=0 WS=128"
"127","21.628499","10.10.10.190","10.10.10.1","DNS","77","Standard query 0x034d AAAA mtalk4.google.com"
"128","21.629917","10.10.10.1","10.10.10.190","DNS","157","Standard query response 0x034d AAAA mtalk4.google.com CNAME mobile-gtalk4.l.google.com SOA ns1.google.com"
"129","21.639664","10.10.10.190","10.10.10.1","DNS","77","Standard query 0x00d2 A mtalk4.google.com"
"130","21.641114","10.10.10.1","10.10.10.190","DNS","259","Standard query response 0x00d2 A mtalk4.google.com CNAME mobile-gtalk4.l.google.com A 64.233.166.188 NS ns3.google.com NS ns4.google.com NS ns1.google.com NS ns2.google.com A 216.239.32.10 A 216.239.34.10 A 216.239.36.10 A 216.239.38.10"
"131","21.658113","10.22.22.2","64.233.166.188","TCP","74","47559  >  5228 [SYN] Seq=0 Win=65535 Len=0 MSS=1460 SACK_PERM=1 TSval=540233 TSecr=0 WS=128"
"132","21.710351","10.22.22.2","107.21.229.36","TCP","74","[TCP Retransmission] 55988  >  443 [SYN] Seq=0 Win=65535 Len=0 MSS=1460 SACK_PERM=1 TSval=540244 TSecr=0 WS=128"
"133","22.667594","10.22.22.2","64.233.166.188","TCP","74","[TCP Retransmission] 47559  >  5228 [SYN] Seq=0 Win=65535 Len=0 MSS=1460 SACK_PERM=1 TSval=540433 TSecr=0 WS=128"
"134","24.666086","10.22.22.2","64.233.166.188","TCP","74","[TCP Retransmission] 47559  >  5228 [SYN] Seq=0 Win=65535 Len=0 MSS=1460 SACK_PERM=1 TSval=540834 TSecr=0 WS=128"
"135","24.950565","10.22.22.2","107.21.218.177","TCP","74","[TCP Retransmission] 60193  >  443 [SYN] Seq=0 Win=65535 Len=0 MSS=1460 SACK_PERM=1 TSval=540890 TSecr=0 WS=128"
"136","26.803893","10.22.22.2","52.86.30.227","TCP","74","[TCP Retransmission] 40091  >  443 [SYN] Seq=0 Win=65535 Len=0 MSS=1460 SACK_PERM=1 TSval=541260 TSecr=0 WS=128"
"137","28.683413","10.22.22.2","64.233.166.188","TCP","74","[TCP Retransmission] 47559  >  5228 [SYN] Seq=0 Win=65535 Len=0 MSS=1460 SACK_PERM=1 TSval=541636 TSecr=0 WS=128"
"138","29.742070","10.22.22.2","107.21.229.36","TCP","74","[TCP Retransmission] 55988  >  443 [SYN] Seq=0 Win=65535 Len=0 MSS=1460 SACK_PERM=1 TSval=541848 TSecr=0 WS=128"
"139","32.983557","10.22.22.2","107.21.218.177","TCP","74","[TCP Retransmission] 60193  >  443 [SYN] Seq=0 Win=65535 Len=0 MSS=1460 SACK_PERM=1 TSval=542496 TSecr=0 WS=128"
"140","34.876418","10.10.10.190","10.10.10.1","DNS","76","Standard query 0x0006 A devices.xbcs.net"
"141","34.876503","10.10.10.1","10.10.10.190","DNS","92","Standard query response 0x0006 A devices.xbcs.net A 184.73.191.189"
"142","34.881158","10.10.10.190","184.73.191.189","TCP","74","3391  >  8899 [SYN] Seq=0 Win=5840 Len=0 MSS=1460 SACK_PERM=1 TSval=4294916009 TSecr=0 WS=2"
"143","34.889202","10.10.10.190","129.132.2.21","NTP","90","NTP Version 3, client"
"144","34.896736","129.143.47.6","10.10.10.190","ICMP","70","Destination unreachable (Communication administratively filtered)"
"145","34.903881","10.10.10.190","130.149.17.8","NTP","90","NTP Version 3, client"
"146","34.918179","130.149.17.8","10.10.10.190","NTP","90","NTP Version 3, server"
"147","34.920921","10.10.10.190","192.53.103.104","NTP","90","NTP Version 3, client"
"148","34.934445","192.53.103.104","10.10.10.190","NTP","90","NTP Version 3, server"
"149","34.980388","184.73.191.189","10.10.10.190","TCP","74","8899  >  3391 [SYN, ACK] Seq=0 Ack=1 Win=17898 Len=0 MSS=1380 SACK_PERM=1 TSval=126003654 TSecr=4294916009 WS=128"
"150","34.983083","10.10.10.190","184.73.191.189","TCP","66","3391  >  8899 [ACK] Seq=1 Ack=1 Win=5840 Len=0 TSval=4294916034 TSecr=126003654"
"151","34.985335","10.10.10.190","184.73.191.189","TCP","261","3391  >  8899 [PSH, ACK] Seq=1 Ack=1 Win=5840 Len=195 TSval=4294916035 TSecr=126003654 [TCP segment of a reassembled PDU]"
"152","35.084292","184.73.191.189","10.10.10.190","TCP","66","8899  >  3391 [ACK] Seq=1 Ack=196 Win=19072 Len=0 TSval=126003758 TSecr=4294916035"
"153","35.084317","184.73.191.189","10.10.10.190","HTTP","91","HTTP/1.1 100 Continue "
"154","35.116032","10.10.10.190","184.73.191.189","TCP","66","3391  >  8899 [ACK] Seq=196 Ack=26 Win=5840 Len=0 TSval=4294916062 TSecr=126003758"
"155","35.116193","10.10.10.190","184.73.191.189","HTTP","615","PUT /ToolService/log/uploadWdLogFile/94103E340CB4 HTTP/1.1 "
"156","35.215658","184.73.191.189","10.10.10.190","HTTP/XML","267","HTTP/1.1 200 OK "
"157","35.249332","10.10.10.190","184.73.191.189","TCP","66","3391  >  8899 [FIN, ACK] Seq=745 Ack=227 Win=5840 Len=0 TSval=4294916094 TSecr=126003889"
"158","35.348296","184.73.191.189","10.10.10.190","TCP","66","8899  >  3391 [FIN, ACK] Seq=227 Ack=746 Win=20096 Len=0 TSval=126004022 TSecr=4294916094"
"159","35.350524","10.10.10.190","184.73.191.189","TCP","66","3391  >  8899 [ACK] Seq=746 Ack=228 Win=5840 Len=0 TSval=4294916126 TSecr=126004022"
"160","36.003801","10.10.10.190","224.0.0.22","IGMPv3","54","Membership Report / Join group 239.255.255.250 for any sources"
"161","36.041173","10.10.10.190","239.255.255.250","SSDP","449","NOTIFY * HTTP/1.1 "
"162","36.046239","10.10.10.190","239.255.255.250","SSDP","447","NOTIFY * HTTP/1.1 "
"163","36.051305","10.10.10.190","239.255.255.250","SSDP","479","NOTIFY * HTTP/1.1 "
"164","36.056983","10.10.10.190","239.255.255.250","SSDP","479","NOTIFY * HTTP/1.1 "
"165","36.062260","10.10.10.190","239.255.255.250","SSDP","477","NOTIFY * HTTP/1.1 "
"166","36.062439","10.10.10.190","239.255.255.250","SSDP","481","NOTIFY * HTTP/1.1 "
"167","36.062658","10.10.10.190","239.255.255.250","SSDP","489","NOTIFY * HTTP/1.1 "
"168","36.062784","10.10.10.190","239.255.255.250","SSDP","471","NOTIFY * HTTP/1.1 "
"169","36.063002","10.10.10.190","239.255.255.250","SSDP","477","NOTIFY * HTTP/1.1 "
"170","36.063128","10.10.10.190","239.255.255.250","SSDP","485","NOTIFY * HTTP/1.1 "
"171","36.459346","10.10.10.190","239.255.255.250","SSDP","449","NOTIFY * HTTP/1.1 "
"172","36.465037","10.10.10.190","239.255.255.250","SSDP","447","NOTIFY * HTTP/1.1 "
"173","36.470518","10.10.10.190","239.255.255.250","SSDP","479","NOTIFY * HTTP/1.1 "
"174","36.476106","10.10.10.190","239.255.255.250","SSDP","479","NOTIFY * HTTP/1.1 "
"175","36.476461","10.10.10.190","239.255.255.250","SSDP","477","NOTIFY * HTTP/1.1 "
"176","36.490562","10.10.10.190","239.255.255.250","SSDP","481","NOTIFY * HTTP/1.1 "
"177","36.498241","10.10.10.190","239.255.255.250","SSDP","489","NOTIFY * HTTP/1.1 "
"178","36.503848","10.10.10.190","239.255.255.250","SSDP","471","NOTIFY * HTTP/1.1 "
"179","36.503961","10.10.10.190","239.255.255.250","SSDP","477","NOTIFY * HTTP/1.1 "
"180","36.504148","10.10.10.190","239.255.255.250","SSDP","485","NOTIFY * HTTP/1.1 "
"181","38.735500","10.10.10.190","224.0.0.22","IGMPv3","54","Membership Report / Join group 239.255.255.250 for any sources"
"182","39.890198","DavidEle_06:08:ba","BelkinIn_34:0c:b5","ARP","42","Who has 10.10.10.190? Tell 10.10.10.1"
"183","39.893304","BelkinIn_34:0c:b5","DavidEle_06:08:ba","ARP","42","10.10.10.190 is at 94:10:3e:34:0c:b5"
"184","45.368378","BelkinIn_34:0c:b5","Broadcast","ARP","42","Who has 10.10.10.30? Tell 10.10.10.190"
"185","46.340426","10.10.10.190","129.132.2.21","NTP","90","NTP Version 3, client"
"186","46.353809","10.10.10.190","130.149.17.8","NTP","90","NTP Version 3, client"
"187","46.368015","130.149.17.8","10.10.10.190","NTP","90","NTP Version 3, server"
"188","46.369172","10.10.10.190","192.53.103.104","NTP","90","NTP Version 3, client"
"189","46.380343","192.53.103.104","10.10.10.190","NTP","90","NTP Version 3, server"
"190","47.502954","10.10.10.190","239.255.255.250","SSDP","449","NOTIFY * HTTP/1.1 "
"191","47.504709","10.10.10.190","239.255.255.250","SSDP","447","NOTIFY * HTTP/1.1 "
"192","47.505955","10.10.10.190","239.255.255.250","SSDP","479","NOTIFY * HTTP/1.1 "
"193","47.508122","10.10.10.190","239.255.255.250","SSDP","479","NOTIFY * HTTP/1.1 "
"194","47.510040","10.10.10.190","239.255.255.250","SSDP","477","NOTIFY * HTTP/1.1 "
"195","47.511703","10.10.10.190","239.255.255.250","SSDP","481","NOTIFY * HTTP/1.1 "
"196","47.513479","10.10.10.190","239.255.255.250","SSDP","489","NOTIFY * HTTP/1.1 "
"197","47.515494","10.10.10.190","239.255.255.250","SSDP","471","NOTIFY * HTTP/1.1 "
"198","47.515840","10.10.10.190","239.255.255.250","SSDP","477","NOTIFY * HTTP/1.1 "
"199","47.516658","10.10.10.190","239.255.255.250","SSDP","485","NOTIFY * HTTP/1.1 "
"200","47.626790","10.10.10.190","239.255.255.250","SSDP","449","NOTIFY * HTTP/1.1 "
"201","47.627928","10.10.10.190","239.255.255.250","SSDP","447","NOTIFY * HTTP/1.1 "
"202","47.629659","10.10.10.190","239.255.255.250","SSDP","479","NOTIFY * HTTP/1.1 "
"203","47.632247","10.10.10.190","239.255.255.250","SSDP","479","NOTIFY * HTTP/1.1 "
"204","47.633004","10.10.10.190","239.255.255.250","SSDP","477","NOTIFY * HTTP/1.1 "
"205","47.633479","10.10.10.190","239.255.255.250","SSDP","481","NOTIFY * HTTP/1.1 "
"206","47.633637","10.10.10.190","239.255.255.250","SSDP","489","NOTIFY * HTTP/1.1 "
"207","47.633957","10.10.10.190","239.255.255.250","SSDP","471","NOTIFY * HTTP/1.1 "
"208","47.634119","10.10.10.190","239.255.255.250","SSDP","477","NOTIFY * HTTP/1.1 "
"209","47.643137","10.10.10.190","239.255.255.250","SSDP","485","NOTIFY * HTTP/1.1 "
"210","66.197456","10.10.10.190","10.10.10.1","ICMP","118","Echo (ping) request  id=0x0602, seq=0/0, ttl=64 (reply in 211)"
"211","66.197504","10.10.10.1","10.10.10.190","ICMP","118","Echo (ping) reply    id=0x0602, seq=0/0, ttl=64 (request in 210)"
"212","67.200294","10.10.10.190","10.10.10.1","ICMP","118","Echo (ping) request  id=0x0602, seq=1/256, ttl=64 (reply in 213)"
"213","67.200332","10.10.10.1","10.10.10.190","ICMP","118","Echo (ping) reply    id=0x0602, seq=1/256, ttl=64 (request in 212)"
"214","68.204167","10.10.10.190","10.10.10.1","ICMP","118","Echo (ping) request  id=0x0602, seq=2/512, ttl=64 (reply in 215)"
"215","68.204206","10.10.10.1","10.10.10.190","ICMP","118","Echo (ping) reply    id=0x0602, seq=2/512, ttl=64 (request in 214)"
"216","71.202197","DavidEle_06:08:ba","BelkinIn_34:0c:b5","ARP","42","Who has 10.10.10.190? Tell 10.10.10.1"
"217","71.207088","BelkinIn_34:0c:b5","DavidEle_06:08:ba","ARP","42","10.10.10.190 is at 94:10:3e:34:0c:b5"
