"No.","Time","Source","Destination","Protocol","Length","Info"
"1","0.000000","BelkinIn_42:80:69","IntelCor_c3:41:78","EAPOL","135","Key (Message 2 of 4)"
"2","0.005661","BelkinIn_42:80:69","IntelCor_c3:41:78","EAPOL","113","Key (Message 4 of 4)"
"3","0.509060","0.0.0.0","255.255.255.255","DHCP","342","DHCP Discover - Transaction ID 0x4ef49334"
"4","3.262848","10.10.10.1","10.10.10.124","ICMP","62","Echo (ping) request  id=0xa61f, seq=0/0, ttl=64 (no response found!)"
"5","3.262901","10.10.10.1","10.10.10.124","DHCP","342","DHCP Offer    - Transaction ID 0x4ef49334"
"6","3.288950","0.0.0.0","255.255.255.255","DHCP","342","DHCP Request  - Transaction ID 0x4ef49334"
"7","3.371342","10.10.10.1","10.10.10.124","DHCP","342","DHCP ACK      - Transaction ID 0x4ef49334"
"8","5.023105","BelkinIn_42:80:69","Broadcast","ARP","60","Who has 10.10.10.1? Tell 10.10.10.124"
"9","5.023126","DavidEle_06:08:ba","BelkinIn_42:80:69","ARP","42","10.10.10.1 is at 00:b5:6d:06:08:ba"
"10","5.356914","BelkinIn_42:80:69","Broadcast","ARP","42","Who has 10.10.10.1? Tell 10.10.10.124"
"11","5.356930","DavidEle_06:08:ba","BelkinIn_42:80:69","ARP","42","10.10.10.1 is at 00:b5:6d:06:08:ba"
"12","5.359870","10.10.10.124","129.132.2.21","NTP","90","NTP Version 3, client"
"13","5.367049","10.10.10.124","4.2.2.2","ICMP","98","Echo (ping) request  id=0x7d07, seq=0/0, ttl=64 (reply in 14)"
"14","5.368921","4.2.2.2","10.10.10.124","ICMP","98","Echo (ping) reply    id=0x7d07, seq=0/0, ttl=52 (request in 13)"
"15","6.381339","10.10.10.124","4.2.2.2","ICMP","98","Echo (ping) request  id=0x7d07, seq=1/256, ttl=64 (reply in 16)"
"16","6.382942","4.2.2.2","10.10.10.124","ICMP","98","Echo (ping) reply    id=0x7d07, seq=1/256, ttl=52 (request in 15)"
"17","6.398286","10.10.10.124","130.149.17.8","NTP","90","NTP Version 3, client"
"18","6.412532","130.149.17.8","10.10.10.124","NTP","90","NTP Version 3, server"
"19","6.477438","10.10.10.124","130.149.17.8","NTP","90","NTP Version 3, client"
"20","6.491583","130.149.17.8","10.10.10.124","NTP","90","NTP Version 3, server"
"21","8.606237","10.10.10.124","224.0.0.22","IGMPv3","54","Membership Report / Join group 239.255.255.250 for any sources"
"22","8.681079","10.10.10.124","239.255.255.250","SSDP","424","NOTIFY * HTTP/1.1 "
"23","8.687403","10.10.10.124","239.255.255.250","SSDP","423","NOTIFY * HTTP/1.1 "
"24","8.687547","10.10.10.124","239.255.255.250","SSDP","448","NOTIFY * HTTP/1.1 "
"25","8.687705","10.10.10.124","239.255.255.250","SSDP","454","NOTIFY * HTTP/1.1 "
"26","8.687857","10.10.10.124","239.255.255.250","SSDP","452","NOTIFY * HTTP/1.1 "
"27","8.688015","10.10.10.124","239.255.255.250","SSDP","456","NOTIFY * HTTP/1.1 "
"28","8.688144","10.10.10.124","239.255.255.250","SSDP","464","NOTIFY * HTTP/1.1 "
"29","8.708017","10.10.10.124","239.255.255.250","SSDP","446","NOTIFY * HTTP/1.1 "
"30","8.708145","10.10.10.124","239.255.255.250","SSDP","452","NOTIFY * HTTP/1.1 "
"31","8.708803","10.10.10.124","239.255.255.250","SSDP","460","NOTIFY * HTTP/1.1 "
"32","8.708941","10.10.10.124","239.255.255.250","SSDP","456","NOTIFY * HTTP/1.1 "
"33","8.709099","10.10.10.124","239.255.255.250","SSDP","450","NOTIFY * HTTP/1.1 "
"34","8.709304","10.10.10.124","239.255.255.250","SSDP","456","NOTIFY * HTTP/1.1 "
"35","8.709441","10.10.10.124","239.255.255.250","SSDP","458","NOTIFY * HTTP/1.1 "
"36","8.801740","10.10.10.124","239.255.255.250","SSDP","424","NOTIFY * HTTP/1.1 "
"37","8.801936","10.10.10.124","239.255.255.250","SSDP","423","NOTIFY * HTTP/1.1 "
"38","8.802099","10.10.10.124","239.255.255.250","SSDP","448","NOTIFY * HTTP/1.1 "
"39","8.820010","10.10.10.124","239.255.255.250","SSDP","454","NOTIFY * HTTP/1.1 "
"40","8.820106","10.10.10.124","239.255.255.250","SSDP","452","NOTIFY * HTTP/1.1 "
"41","8.820301","10.10.10.124","239.255.255.250","SSDP","456","NOTIFY * HTTP/1.1 "
"42","8.820467","10.10.10.124","239.255.255.250","SSDP","464","NOTIFY * HTTP/1.1 "
"43","8.820685","10.10.10.124","239.255.255.250","SSDP","446","NOTIFY * HTTP/1.1 "
"44","8.820748","10.10.10.124","239.255.255.250","SSDP","452","NOTIFY * HTTP/1.1 "
"45","8.820938","10.10.10.124","239.255.255.250","SSDP","460","NOTIFY * HTTP/1.1 "
"46","8.840421","10.10.10.124","239.255.255.250","SSDP","456","NOTIFY * HTTP/1.1 "
"47","8.867542","10.10.10.124","239.255.255.250","SSDP","450","NOTIFY * HTTP/1.1 "
"48","8.867687","10.10.10.124","239.255.255.250","SSDP","456","NOTIFY * HTTP/1.1 "
"49","8.867840","10.10.10.124","239.255.255.250","SSDP","458","NOTIFY * HTTP/1.1 "
"50","8.881733","10.10.10.124","239.255.255.250","SSDP","159","M-SEARCH * HTTP/1.1 "
"51","8.921595","10.10.10.124","239.255.255.250","SSDP","159","M-SEARCH * HTTP/1.1 "
"52","10.238650","10.10.10.124","10.10.10.1","DNS","72","Standard query 0x0002 A api.xbcs.net"
"53","10.242433","10.10.10.1","10.10.10.124","DNS","468","Standard query response 0x0002 A api.xbcs.net CNAME prod1-api-xbcs-net-889336557.us-east-1.elb.amazonaws.com A 50.16.203.253 A 54.225.150.170 A 54.235.111.253 A 107.21.214.151 A 107.22.199.21 A 23.21.60.181 A 23.23.97.224 A 23.23.236.208 NS ns-235.awsdns-29.com NS ns-1793.awsdns-32.co.uk NS ns-934.awsdns-52.net NS ns-1119.awsdns-11.org A 205.251.192.235 A 205.251.195.166 A 205.251.196.95 A 205.251.199.1"
"54","10.246692","10.10.10.124","50.16.203.253","TCP","66","3961  >  8443 [SYN] Seq=0 Win=5840 Len=0 MSS=1460 SACK_PERM=1 WS=2"
"55","10.344502","50.16.203.253","10.10.10.124","TCP","66","8443  >  3961 [SYN, ACK] Seq=0 Ack=1 Win=14600 Len=0 MSS=1380 SACK_PERM=1 WS=256"
"56","10.346001","10.10.10.124","50.16.203.253","TCP","54","3961  >  8443 [ACK] Seq=1 Ack=1 Win=5840 Len=0"
"57","10.384262","DavidEle_06:08:ba","BelkinIn_42:80:69","ARP","42","Who has 10.10.10.124? Tell 10.10.10.1"
"58","10.386572","BelkinIn_42:80:69","DavidEle_06:08:ba","ARP","42","10.10.10.124 is at 94:10:3e:42:80:69"
"59","10.410820","10.10.10.124","50.16.203.253","TCP","171","3961  >  8443 [PSH, ACK] Seq=1 Ack=1 Win=5840 Len=117"
"60","10.508447","50.16.203.253","10.10.10.124","TCP","54","8443  >  3961 [ACK] Seq=1 Ack=118 Win=14848 Len=0"
"61","10.508842","50.16.203.253","10.10.10.124","TCP","1434","8443  >  3961 [ACK] Seq=1 Ack=118 Win=14848 Len=1380"
"62","10.508870","50.16.203.253","10.10.10.124","TCP","1434","8443  >  3961 [ACK] Seq=1381 Ack=118 Win=14848 Len=1380"
"63","10.508876","50.16.203.253","10.10.10.124","TCP","1390","8443  >  3961 [PSH, ACK] Seq=2761 Ack=118 Win=14848 Len=1336"
"64","10.508885","50.16.203.253","10.10.10.124","TCP","857","8443  >  3961 [PSH, ACK] Seq=4097 Ack=118 Win=14848 Len=803"
"65","10.523442","10.10.10.124","50.16.203.253","TCP","54","3961  >  8443 [ACK] Seq=118 Ack=1381 Win=8600 Len=0"
"66","10.523540","10.10.10.124","50.16.203.253","TCP","54","3961  >  8443 [ACK] Seq=118 Ack=2761 Win=11360 Len=0"
"67","10.523653","10.10.10.124","50.16.203.253","TCP","54","3961  >  8443 [ACK] Seq=118 Ack=4097 Win=14120 Len=0"
"68","10.526096","10.10.10.124","50.16.203.253","TCP","54","3961  >  8443 [ACK] Seq=118 Ack=4900 Win=16880 Len=0"
"69","10.581794","10.10.10.124","50.16.203.253","TCP","380","3961  >  8443 [PSH, ACK] Seq=118 Ack=4900 Win=16880 Len=326"
"70","10.681570","50.16.203.253","10.10.10.124","TCP","113","8443  >  3961 [PSH, ACK] Seq=4900 Ack=444 Win=15872 Len=59"
"71","10.682737","10.10.10.124","50.16.203.253","TCP","54","3961  >  8443 [ACK] Seq=444 Ack=4959 Win=16880 Len=0"
"72","10.687508","10.10.10.124","50.16.203.253","TCP","448","3961  >  8443 [PSH, ACK] Seq=444 Ack=4959 Win=16880 Len=394"
"73","10.701033","10.10.10.124","50.16.203.253","TCP","1434","3961  >  8443 [ACK] Seq=838 Ack=4959 Win=16880 Len=1380"
"74","10.798875","50.16.203.253","10.10.10.124","TCP","54","8443  >  3961 [ACK] Seq=4959 Ack=2218 Win=19712 Len=0"
"75","10.800327","10.10.10.124","50.16.203.253","TCP","1434","3961  >  8443 [ACK] Seq=2218 Ack=4959 Win=16880 Len=1380"
"76","10.800563","10.10.10.124","50.16.203.253","TCP","1434","3961  >  8443 [ACK] Seq=3598 Ack=4959 Win=16880 Len=1380"
"77","10.801271","10.10.10.124","50.16.203.253","TCP","1434","3961  >  8443 [ACK] Seq=4978 Ack=4959 Win=16880 Len=1380"
"78","10.898362","50.16.203.253","10.10.10.124","TCP","54","8443  >  3961 [ACK] Seq=4959 Ack=4978 Win=25600 Len=0"
"79","10.900236","10.10.10.124","50.16.203.253","TCP","1434","3961  >  8443 [ACK] Seq=6358 Ack=4959 Win=16880 Len=1380"
"80","10.900498","10.10.10.124","50.16.203.253","TCP","1434","3961  >  8443 [ACK] Seq=7738 Ack=4959 Win=16880 Len=1380"
"81","10.900782","10.10.10.124","50.16.203.253","TCP","1434","3961  >  8443 [ACK] Seq=9118 Ack=4959 Win=16880 Len=1380"
"82","10.936983","50.16.203.253","10.10.10.124","TCP","54","8443  >  3961 [ACK] Seq=4959 Ack=6358 Win=28672 Len=0"
"83","10.938401","10.10.10.124","50.16.203.253","TCP","1434","3961  >  8443 [ACK] Seq=10498 Ack=4959 Win=16880 Len=1380"
"84","10.939156","10.10.10.124","50.16.203.253","TCP","1434","3961  >  8443 [ACK] Seq=11878 Ack=4959 Win=16880 Len=1380"
"85","10.998072","50.16.203.253","10.10.10.124","TCP","54","8443  >  3961 [ACK] Seq=4959 Ack=7738 Win=31488 Len=0"
"86","10.998125","50.16.203.253","10.10.10.124","TCP","54","8443  >  3961 [ACK] Seq=4959 Ack=9118 Win=34304 Len=0"
"87","10.998584","50.16.203.253","10.10.10.124","TCP","54","8443  >  3961 [ACK] Seq=4959 Ack=10498 Win=37376 Len=0"
"88","11.001010","10.10.10.124","50.16.203.253","TCP","1434","3961  >  8443 [ACK] Seq=13258 Ack=4959 Win=16880 Len=1380"
"89","11.001093","10.10.10.124","50.16.203.253","TCP","92","3961  >  8443 [PSH, ACK] Seq=14638 Ack=4959 Win=16880 Len=38"
"90","11.012505","10.10.10.124","50.16.203.253","TCP","1434","3961  >  8443 [ACK] Seq=14676 Ack=4959 Win=16880 Len=1380"
"91","11.024438","10.10.10.124","50.16.203.253","TCP","1434","3961  >  8443 [ACK] Seq=16056 Ack=4959 Win=16880 Len=1380"
"92","11.036216","50.16.203.253","10.10.10.124","TCP","54","8443  >  3961 [ACK] Seq=4959 Ack=11878 Win=40192 Len=0"
"93","11.036929","50.16.203.253","10.10.10.124","TCP","54","8443  >  3961 [ACK] Seq=4959 Ack=13258 Win=42240 Len=0"
"94","11.050031","10.10.10.124","50.16.203.253","TCP","1434","3961  >  8443 [ACK] Seq=17436 Ack=4959 Win=16880 Len=1380"
"95","11.061954","10.10.10.124","50.16.203.253","TCP","1434","3961  >  8443 [ACK] Seq=18816 Ack=4959 Win=16880 Len=1380"
"96","11.075373","10.10.10.124","50.16.203.253","TCP","1434","3961  >  8443 [ACK] Seq=20196 Ack=4959 Win=16880 Len=1380"
"97","11.098806","50.16.203.253","10.10.10.124","TCP","54","8443  >  3961 [ACK] Seq=4959 Ack=14676 Win=42240 Len=0"
"98","11.100223","10.10.10.124","50.16.203.253","TCP","1434","3961  >  8443 [ACK] Seq=21576 Ack=4959 Win=16880 Len=1380"
"99","11.101070","10.10.10.124","50.16.203.253","TCP","1434","3961  >  8443 [ACK] Seq=22956 Ack=4959 Win=16880 Len=1380"
"100","11.101172","10.10.10.124","50.16.203.253","TCP","88","3961  >  8443 [PSH, ACK] Seq=24336 Ack=4959 Win=16880 Len=34"
"101","11.110434","50.16.203.253","10.10.10.124","TCP","54","8443  >  3961 [ACK] Seq=4959 Ack=16056 Win=42240 Len=0"
"102","11.113165","10.10.10.124","50.16.203.253","TCP","1434","3961  >  8443 [ACK] Seq=24370 Ack=4959 Win=16880 Len=1380"
"103","11.122308","50.16.203.253","10.10.10.124","TCP","54","8443  >  3961 [ACK] Seq=4959 Ack=17436 Win=42240 Len=0"
"104","11.125576","10.10.10.124","50.16.203.253","TCP","1434","3961  >  8443 [ACK] Seq=25750 Ack=4959 Win=16880 Len=1380"
"105","11.137308","10.10.10.124","50.16.203.253","TCP","1434","3961  >  8443 [ACK] Seq=27130 Ack=4959 Win=16880 Len=1380"
"106","11.147815","50.16.203.253","10.10.10.124","TCP","54","8443  >  3961 [ACK] Seq=4959 Ack=18816 Win=42240 Len=0"
"107","11.159736","50.16.203.253","10.10.10.124","TCP","54","8443  >  3961 [ACK] Seq=4959 Ack=20196 Win=42240 Len=0"
"108","11.162073","10.10.10.124","50.16.203.253","TCP","1434","3961  >  8443 [ACK] Seq=28510 Ack=4959 Win=16880 Len=1380"
"109","11.173218","50.16.203.253","10.10.10.124","TCP","54","8443  >  3961 [ACK] Seq=4959 Ack=21576 Win=42240 Len=0"
"110","11.173516","10.10.10.124","50.16.203.253","TCP","1434","3961  >  8443 [ACK] Seq=29890 Ack=4959 Win=16880 Len=1380"
"111","11.185463","10.10.10.124","50.16.203.253","TCP","1434","3961  >  8443 [ACK] Seq=31270 Ack=4959 Win=16880 Len=1380"
"112","11.198055","50.16.203.253","10.10.10.124","TCP","54","8443  >  3961 [ACK] Seq=4959 Ack=22956 Win=42240 Len=0"
"113","11.198507","10.10.10.124","50.16.203.253","TCP","1434","3961  >  8443 [ACK] Seq=32650 Ack=4959 Win=16880 Len=1380"
"114","11.198829","50.16.203.253","10.10.10.124","TCP","54","8443  >  3961 [ACK] Seq=4959 Ack=24370 Win=42240 Len=0"
"115","11.200810","10.10.10.124","50.16.203.253","TCP","162","3961  >  8443 [PSH, ACK] Seq=34030 Ack=4959 Win=16880 Len=108"
"116","11.213252","10.10.10.124","50.16.203.253","TCP","1434","3961  >  8443 [ACK] Seq=34138 Ack=4959 Win=16880 Len=1380"
"117","11.223326","50.16.203.253","10.10.10.124","TCP","54","8443  >  3961 [ACK] Seq=4959 Ack=27130 Win=42240 Len=0"
"118","11.226783","10.10.10.124","50.16.203.253","TCP","1434","3961  >  8443 [ACK] Seq=35518 Ack=4959 Win=16880 Len=1380"
"119","11.238079","10.10.10.124","50.16.203.253","TCP","1434","3961  >  8443 [ACK] Seq=36898 Ack=4959 Win=16880 Len=1380"
"120","11.250337","10.10.10.124","50.16.203.253","TCP","1434","3961  >  8443 [ACK] Seq=38278 Ack=4959 Win=16880 Len=1380"
"121","11.259877","50.16.203.253","10.10.10.124","TCP","54","8443  >  3961 [ACK] Seq=4959 Ack=29890 Win=42240 Len=0"
"122","11.283238","50.16.203.253","10.10.10.124","TCP","54","8443  >  3961 [ACK] Seq=4959 Ack=32650 Win=42240 Len=0"
"123","11.298371","50.16.203.253","10.10.10.124","TCP","54","8443  >  3961 [ACK] Seq=4959 Ack=34138 Win=42240 Len=0"
"124","11.300195","10.10.10.124","50.16.203.253","TCP","676","3961  >  8443 [PSH, ACK] Seq=39658 Ack=4959 Win=16880 Len=622"
"125","11.324589","50.16.203.253","10.10.10.124","TCP","54","8443  >  3961 [ACK] Seq=4959 Ack=36898 Win=42240 Len=0"
"126","11.348065","50.16.203.253","10.10.10.124","TCP","54","8443  >  3961 [ACK] Seq=4959 Ack=39658 Win=42240 Len=0"
"127","11.397924","50.16.203.253","10.10.10.124","TCP","54","8443  >  3961 [ACK] Seq=4959 Ack=40280 Win=42240 Len=0"
"128","11.504932","50.16.203.253","10.10.10.124","TCP","1434","8443  >  3961 [ACK] Seq=4959 Ack=40280 Win=42240 Len=1380"
"129","11.504960","50.16.203.253","10.10.10.124","TCP","439","8443  >  3961 [PSH, ACK] Seq=6339 Ack=40280 Win=42240 Len=385"
"130","11.508422","10.10.10.124","50.16.203.253","TCP","54","3961  >  8443 [ACK] Seq=40280 Ack=6724 Win=16880 Len=0"
"131","11.513290","10.10.10.124","50.16.203.253","TCP","91","3961  >  8443 [PSH, ACK] Seq=40280 Ack=6724 Win=16880 Len=37"
"132","11.517758","10.10.10.124","50.16.203.253","TCP","54","3961  >  8443 [FIN, ACK] Seq=40317 Ack=6724 Win=16880 Len=0"
"133","11.610941","50.16.203.253","10.10.10.124","TCP","54","8443  >  3961 [ACK] Seq=6724 Ack=40317 Win=42240 Len=0"
"134","11.610970","50.16.203.253","10.10.10.124","TCP","91","8443  >  3961 [PSH, ACK] Seq=6724 Ack=40317 Win=42240 Len=37"
"135","11.610975","50.16.203.253","10.10.10.124","TCP","54","8443  >  3961 [FIN, ACK] Seq=6761 Ack=40317 Win=42240 Len=0"
"136","11.613626","10.10.10.124","50.16.203.253","TCP","54","3961  >  8443 [RST] Seq=40317 Win=0 Len=0"
"137","11.613840","10.10.10.124","50.16.203.253","TCP","54","3961  >  8443 [RST] Seq=40317 Win=0 Len=0"
"138","12.929306","10.10.10.124","10.10.10.1","DNS","72","Standard query 0x336c A nat.xbcs.net"
"139","12.932978","10.10.10.1","10.10.10.124","DNS","373","Standard query response 0x336c A nat.xbcs.net CNAME prod1-nat-xbcs-net-1543133972.us-east-1.elb.amazonaws.com A 50.19.247.85 A 23.23.244.247 NS ns-1793.awsdns-32.co.uk NS ns-1119.awsdns-11.org NS ns-235.awsdns-29.com NS ns-934.awsdns-52.net A 205.251.192.235 A 205.251.195.166 A 205.251.196.95 A 205.251.199.1"
"140","13.940511","10.10.10.124","50.19.247.85","TCP","66","4168  >  3475 [SYN] Seq=0 Win=5840 Len=0 MSS=1460 SACK_PERM=1 WS=2"
"141","14.040371","50.19.247.85","10.10.10.124","TCP","66","3475  >  4168 [SYN, ACK] Seq=0 Ack=1 Win=14600 Len=0 MSS=1380 SACK_PERM=1 WS=256"
"142","14.042327","10.10.10.124","50.19.247.85","TCP","54","4168  >  3475 [ACK] Seq=1 Ack=1 Win=5840 Len=0"
"143","14.043174","10.10.10.124","50.19.247.85","TCP","403","4168  >  3475 [PSH, ACK] Seq=1 Ack=1 Win=5840 Len=349"
"144","14.142791","50.19.247.85","10.10.10.124","TCP","54","3475  >  4168 [ACK] Seq=1 Ack=350 Win=15872 Len=0"
"145","14.145193","50.19.247.85","10.10.10.124","TCP","67","3475  >  4168 [PSH, ACK] Seq=1 Ack=350 Win=15872 Len=13"
"146","14.146397","10.10.10.124","50.19.247.85","TCP","54","4168  >  3475 [ACK] Seq=350 Ack=14 Win=5840 Len=0"
"147","14.146778","10.10.10.124","50.19.247.85","TCP","54","4168  >  3475 [FIN, ACK] Seq=350 Ack=14 Win=5840 Len=0"
"148","14.247905","50.19.247.85","10.10.10.124","TCP","54","3475  >  4168 [FIN, ACK] Seq=14 Ack=351 Win=15872 Len=0"
"149","14.249472","10.10.10.124","50.19.247.85","TCP","54","4168  >  3475 [ACK] Seq=351 Ack=15 Win=5840 Len=0"
"150","15.161085","10.10.10.124","54.166.254.31","TCP","66","4534  >  3478 [SYN] Seq=0 Win=5840 Len=0 MSS=1460 SACK_PERM=1 WS=2"
"151","15.261808","54.166.254.31","10.10.10.124","TCP","66","3478  >  4534 [SYN, ACK] Seq=0 Ack=1 Win=29200 Len=0 MSS=1380 SACK_PERM=1 WS=128"
"152","15.263152","10.10.10.124","54.166.254.31","TCP","54","4534  >  3478 [ACK] Seq=1 Ack=1 Win=5840 Len=0"
"153","15.268439","10.10.10.124","54.166.254.31","STUN","102","Allocate Request TCP"
"154","15.368565","54.166.254.31","10.10.10.124","TCP","54","3478  >  4534 [ACK] Seq=1 Ack=49 Win=29312 Len=0"
"155","15.368596","54.166.254.31","10.10.10.124","STUN","194","Allocate Error Response error-code: 401 (Unauthorized) Unauthorized realm: belkin.org with nonce"
"156","15.370448","10.10.10.124","54.166.254.31","TCP","54","4534  >  3478 [ACK] Seq=49 Ack=141 Win=5840 Len=0"
"157","15.376061","10.10.10.124","54.166.254.31","STUN","210","Allocate Request TCP user: 94103E428068 realm: belkin.org with nonce"
"158","15.500707","54.166.254.31","10.10.10.124","STUN","158","Allocate Success Response XOR-RELAYED-ADDRESS: 10.181.28.152:10430 lifetime: 330 XOR-MAPPED-ADDRESS: 130.83.40.248:4534"
"159","15.539987","10.10.10.124","54.166.254.31","TCP","54","4534  >  3478 [ACK] Seq=205 Ack=245 Win=5840 Len=0"
"160","16.044681","10.10.10.124","10.10.10.1","DNS","72","Standard query 0x0003 A api.xbcs.net"
"161","16.046128","10.10.10.1","10.10.10.124","DNS","468","Standard query response 0x0003 A api.xbcs.net CNAME prod1-api-xbcs-net-889336557.us-east-1.elb.amazonaws.com A 54.225.150.170 A 54.235.111.253 A 107.21.214.151 A 107.22.199.21 A 23.21.60.181 A 23.23.97.224 A 23.23.236.208 A 50.16.203.253 NS ns-1119.awsdns-11.org NS ns-235.awsdns-29.com NS ns-1793.awsdns-32.co.uk NS ns-934.awsdns-52.net A 205.251.192.235 A 205.251.195.166 A 205.251.196.95 A 205.251.199.1"
"162","16.048773","10.10.10.124","54.225.150.170","TCP","66","3123  >  8443 [SYN] Seq=0 Win=5840 Len=0 MSS=1460 SACK_PERM=1 WS=2"
"163","16.148713","54.225.150.170","10.10.10.124","TCP","66","8443  >  3123 [SYN, ACK] Seq=0 Ack=1 Win=14600 Len=0 MSS=1380 SACK_PERM=1 WS=256"
"164","16.150077","10.10.10.124","54.225.150.170","TCP","54","3123  >  8443 [ACK] Seq=1 Ack=1 Win=5840 Len=0"
"165","16.184112","10.10.10.124","54.225.150.170","TCP","171","3123  >  8443 [PSH, ACK] Seq=1 Ack=1 Win=5840 Len=117"
"166","16.283807","54.225.150.170","10.10.10.124","TCP","54","8443  >  3123 [ACK] Seq=1 Ack=118 Win=14848 Len=0"
"167","16.284210","54.225.150.170","10.10.10.124","TCP","1434","8443  >  3123 [ACK] Seq=1 Ack=118 Win=14848 Len=1380"
"168","16.284247","54.225.150.170","10.10.10.124","TCP","1434","8443  >  3123 [ACK] Seq=1381 Ack=118 Win=14848 Len=1380"
"169","16.284257","54.225.150.170","10.10.10.124","TCP","1390","8443  >  3123 [PSH, ACK] Seq=2761 Ack=118 Win=14848 Len=1336"
"170","16.284270","54.225.150.170","10.10.10.124","TCP","857","8443  >  3123 [PSH, ACK] Seq=4097 Ack=118 Win=14848 Len=803"
"171","16.286680","10.10.10.124","54.225.150.170","TCP","54","3123  >  8443 [ACK] Seq=118 Ack=1381 Win=8600 Len=0"
"172","16.287800","10.10.10.124","54.225.150.170","TCP","54","3123  >  8443 [ACK] Seq=118 Ack=2761 Win=11360 Len=0"
"173","16.288843","10.10.10.124","54.225.150.170","TCP","54","3123  >  8443 [ACK] Seq=118 Ack=4097 Win=14120 Len=0"
"174","16.289136","10.10.10.124","54.225.150.170","TCP","54","3123  >  8443 [ACK] Seq=118 Ack=4900 Win=16880 Len=0"
"175","16.342407","10.10.10.124","54.225.150.170","TCP","380","3123  >  8443 [PSH, ACK] Seq=118 Ack=4900 Win=16880 Len=326"
"176","16.444325","54.225.150.170","10.10.10.124","TCP","113","8443  >  3123 [PSH, ACK] Seq=4900 Ack=444 Win=15872 Len=59"
"177","16.445822","10.10.10.124","54.225.150.170","TCP","54","3123  >  8443 [ACK] Seq=444 Ack=4959 Win=16880 Len=0"
"178","16.449798","10.10.10.124","54.225.150.170","TCP","464","3123  >  8443 [PSH, ACK] Seq=444 Ack=4959 Win=16880 Len=410"
"179","16.462575","10.10.10.124","54.225.150.170","TCP","1434","3123  >  8443 [ACK] Seq=854 Ack=4959 Win=16880 Len=1380"
"180","16.562520","54.225.150.170","10.10.10.124","TCP","54","8443  >  3123 [ACK] Seq=4959 Ack=2234 Win=19712 Len=0"
"181","16.564126","10.10.10.124","54.225.150.170","TCP","1434","3123  >  8443 [ACK] Seq=2234 Ack=4959 Win=16880 Len=1380"
"182","16.564396","10.10.10.124","54.225.150.170","TCP","1434","3123  >  8443 [ACK] Seq=3614 Ack=4959 Win=16880 Len=1380"
"183","16.564688","10.10.10.124","54.225.150.170","TCP","1434","3123  >  8443 [ACK] Seq=4994 Ack=4959 Win=16880 Len=1380"
"184","16.664356","54.225.150.170","10.10.10.124","TCP","54","8443  >  3123 [ACK] Seq=4959 Ack=4994 Win=25600 Len=0"
"185","16.665978","10.10.10.124","54.225.150.170","TCP","1434","3123  >  8443 [ACK] Seq=6374 Ack=4959 Win=16880 Len=1380"
"186","16.666591","10.10.10.124","54.225.150.170","TCP","1434","3123  >  8443 [ACK] Seq=7754 Ack=4959 Win=16880 Len=1380"
"187","16.666886","10.10.10.124","54.225.150.170","TCP","1434","3123  >  8443 [ACK] Seq=9134 Ack=4959 Win=16880 Len=1380"
"188","16.701315","54.225.150.170","10.10.10.124","TCP","54","8443  >  3123 [ACK] Seq=4959 Ack=6374 Win=28672 Len=0"
"189","16.702913","10.10.10.124","54.225.150.170","TCP","1434","3123  >  8443 [ACK] Seq=10514 Ack=4959 Win=16880 Len=1380"
"190","16.703167","10.10.10.124","54.225.150.170","TCP","1434","3123  >  8443 [ACK] Seq=11894 Ack=4959 Win=16880 Len=1380"
"191","16.748091","10.10.10.124","224.0.0.22","IGMPv3","54","Membership Report / Join group 239.255.255.250 for any sources"
"192","16.765909","54.225.150.170","10.10.10.124","TCP","54","8443  >  3123 [ACK] Seq=4959 Ack=7754 Win=31488 Len=0"
"193","16.766429","54.225.150.170","10.10.10.124","TCP","54","8443  >  3123 [ACK] Seq=4959 Ack=9134 Win=34304 Len=0"
"194","16.766686","54.225.150.170","10.10.10.124","TCP","54","8443  >  3123 [ACK] Seq=4959 Ack=10514 Win=37376 Len=0"
"195","16.767530","10.10.10.124","54.225.150.170","TCP","1434","3123  >  8443 [ACK] Seq=13274 Ack=4959 Win=16880 Len=1380"
"196","16.767628","10.10.10.124","54.225.150.170","TCP","92","3123  >  8443 [PSH, ACK] Seq=14654 Ack=4959 Win=16880 Len=38"
"197","16.780632","10.10.10.124","54.225.150.170","TCP","1434","3123  >  8443 [ACK] Seq=14692 Ack=4959 Win=16880 Len=1380"
"198","16.792700","10.10.10.124","54.225.150.170","TCP","1434","3123  >  8443 [ACK] Seq=16072 Ack=4959 Win=16880 Len=1380"
"199","16.802775","54.225.150.170","10.10.10.124","TCP","54","8443  >  3123 [ACK] Seq=4959 Ack=11894 Win=40192 Len=0"
"200","16.803018","54.225.150.170","10.10.10.124","TCP","54","8443  >  3123 [ACK] Seq=4959 Ack=13274 Win=42240 Len=0"
"201","16.816432","10.10.10.124","54.225.150.170","TCP","1434","3123  >  8443 [ACK] Seq=17452 Ack=4959 Win=16880 Len=1380"
"202","16.829716","10.10.10.124","54.225.150.170","TCP","1434","3123  >  8443 [ACK] Seq=18832 Ack=4959 Win=16880 Len=1380"
"203","16.842377","10.10.10.124","54.225.150.170","TCP","1434","3123  >  8443 [ACK] Seq=20212 Ack=4959 Win=16880 Len=1380"
"204","16.867413","54.225.150.170","10.10.10.124","TCP","54","8443  >  3123 [ACK] Seq=4959 Ack=14692 Win=42240 Len=0"
"205","16.869500","10.10.10.124","54.225.150.170","TCP","1434","3123  >  8443 [ACK] Seq=21592 Ack=4959 Win=16880 Len=1380"
"206","16.870364","10.10.10.124","54.225.150.170","TCP","1434","3123  >  8443 [ACK] Seq=22972 Ack=4959 Win=16880 Len=1380"
"207","16.870597","10.10.10.124","54.225.150.170","TCP","88","3123  >  8443 [PSH, ACK] Seq=24352 Ack=4959 Win=16880 Len=34"
"208","16.880514","54.225.150.170","10.10.10.124","TCP","54","8443  >  3123 [ACK] Seq=4959 Ack=16072 Win=42240 Len=0"
"209","16.882080","10.10.10.124","54.225.150.170","TCP","1434","3123  >  8443 [ACK] Seq=24386 Ack=4959 Win=16880 Len=1380"
"210","16.892540","54.225.150.170","10.10.10.124","TCP","54","8443  >  3123 [ACK] Seq=4959 Ack=17452 Win=42240 Len=0"
"211","16.896241","10.10.10.124","54.225.150.170","TCP","1434","3123  >  8443 [ACK] Seq=25766 Ack=4959 Win=16880 Len=1380"
"212","16.907848","10.10.10.124","54.225.150.170","TCP","1434","3123  >  8443 [ACK] Seq=27146 Ack=4959 Win=16880 Len=1380"
"213","16.916314","54.225.150.170","10.10.10.124","TCP","54","8443  >  3123 [ACK] Seq=4959 Ack=18832 Win=42240 Len=0"
"214","16.920871","10.10.10.124","54.225.150.170","TCP","1434","3123  >  8443 [ACK] Seq=28526 Ack=4959 Win=16880 Len=1380"
"215","16.929671","54.225.150.170","10.10.10.124","TCP","54","8443  >  3123 [ACK] Seq=4959 Ack=20212 Win=42240 Len=0"
"216","16.934189","10.10.10.124","54.225.150.170","TCP","1434","3123  >  8443 [ACK] Seq=29906 Ack=4959 Win=16880 Len=1380"
"217","16.942271","54.225.150.170","10.10.10.124","TCP","54","8443  >  3123 [ACK] Seq=4959 Ack=21592 Win=42240 Len=0"
"218","16.946366","10.10.10.124","54.225.150.170","TCP","1434","3123  >  8443 [ACK] Seq=31286 Ack=4959 Win=16880 Len=1380"
"219","16.959161","10.10.10.124","54.225.150.170","TCP","1434","3123  >  8443 [ACK] Seq=32666 Ack=4959 Win=16880 Len=1380"
"220","16.969396","54.225.150.170","10.10.10.124","TCP","54","8443  >  3123 [ACK] Seq=4959 Ack=22972 Win=42240 Len=0"
"221","16.970239","54.225.150.170","10.10.10.124","TCP","54","8443  >  3123 [ACK] Seq=4959 Ack=24386 Win=42240 Len=0"
"222","16.971888","10.10.10.124","54.225.150.170","TCP","1346","3123  >  8443 [PSH, ACK] Seq=34046 Ack=4959 Win=16880 Len=1292"
"223","16.984881","10.10.10.124","54.225.150.170","TCP","1434","3123  >  8443 [ACK] Seq=35338 Ack=4959 Win=16880 Len=1380"
"224","16.996099","54.225.150.170","10.10.10.124","TCP","54","8443  >  3123 [ACK] Seq=4959 Ack=27146 Win=42240 Len=0"
"225","16.998580","10.10.10.124","54.225.150.170","TCP","1434","3123  >  8443 [ACK] Seq=36718 Ack=4959 Win=16880 Len=1380"
"226","17.010474","10.10.10.124","54.225.150.170","TCP","1434","3123  >  8443 [ACK] Seq=38098 Ack=4959 Win=16880 Len=1380"
"227","17.020741","54.225.150.170","10.10.10.124","TCP","54","8443  >  3123 [ACK] Seq=4959 Ack=29906 Win=42240 Len=0"
"228","17.023317","10.10.10.124","54.225.150.170","TCP","1434","3123  >  8443 [ACK] Seq=39478 Ack=4959 Win=16880 Len=1380"
"229","17.036628","10.10.10.124","54.225.150.170","TCP","1434","3123  >  8443 [ACK] Seq=40858 Ack=4959 Win=16880 Len=1380"
"230","17.046402","54.225.150.170","10.10.10.124","TCP","54","8443  >  3123 [ACK] Seq=4959 Ack=32666 Win=42240 Len=0"
"231","17.048494","10.10.10.124","54.225.150.170","TCP","1434","3123  >  8443 [ACK] Seq=42238 Ack=4959 Win=16880 Len=1380"
"232","17.061813","10.10.10.124","54.225.150.170","TCP","1434","3123  >  8443 [ACK] Seq=43618 Ack=4959 Win=16880 Len=1380"
"233","17.071730","54.225.150.170","10.10.10.124","TCP","54","8443  >  3123 [ACK] Seq=4959 Ack=35338 Win=42240 Len=0"
"234","17.073283","10.10.10.124","54.225.150.170","TCP","1272","3123  >  8443 [PSH, ACK] Seq=44998 Ack=4959 Win=16880 Len=1218"
"235","17.085977","10.10.10.124","54.225.150.170","TCP","1434","3123  >  8443 [ACK] Seq=46216 Ack=4959 Win=16880 Len=1380"
"236","17.097574","10.10.10.124","54.225.150.170","TCP","1434","3123  >  8443 [ACK] Seq=47596 Ack=4959 Win=16880 Len=1380"
"237","17.098524","54.225.150.170","10.10.10.124","TCP","54","8443  >  3123 [ACK] Seq=4959 Ack=38098 Win=42240 Len=0"
"238","17.109664","10.10.10.124","54.225.150.170","TCP","1434","3123  >  8443 [ACK] Seq=48976 Ack=4959 Win=16880 Len=1380"
"239","17.122547","10.10.10.124","54.225.150.170","TCP","1434","3123  >  8443 [ACK] Seq=50356 Ack=4959 Win=16880 Len=1380"
"240","17.123202","54.225.150.170","10.10.10.124","TCP","54","8443  >  3123 [ACK] Seq=4959 Ack=40858 Win=42240 Len=0"
"241","17.136392","10.10.10.124","54.225.150.170","TCP","1434","3123  >  8443 [ACK] Seq=51736 Ack=4959 Win=16880 Len=1380"
"242","17.148351","54.225.150.170","10.10.10.124","TCP","54","8443  >  3123 [ACK] Seq=4959 Ack=43618 Win=42240 Len=0"
"243","17.171299","10.10.10.124","10.10.10.1","DNS","72","Standard query 0x0002 A api.xbcs.net"
"244","17.172707","10.10.10.1","10.10.10.124","DNS","468","Standard query response 0x0002 A api.xbcs.net CNAME prod1-api-xbcs-net-889336557.us-east-1.elb.amazonaws.com A 54.235.111.253 A 107.21.214.151 A 107.22.199.21 A 23.21.60.181 A 23.23.97.224 A 23.23.236.208 A 50.16.203.253 A 54.225.150.170 NS ns-1119.awsdns-11.org NS ns-1793.awsdns-32.co.uk NS ns-934.awsdns-52.net NS ns-235.awsdns-29.com A 205.251.192.235 A 205.251.195.166 A 205.251.196.95 A 205.251.199.1"
"245","17.173107","54.225.150.170","10.10.10.124","TCP","54","8443  >  3123 [ACK] Seq=4959 Ack=46216 Win=42240 Len=0"
"246","17.174686","10.10.10.124","54.225.150.170","TCP","184","3123  >  8443 [PSH, ACK] Seq=53116 Ack=4959 Win=16880 Len=130"
"247","17.175976","10.10.10.124","54.235.111.253","TCP","66","3689  >  8443 [SYN] Seq=0 Win=5840 Len=0 MSS=1460 SACK_PERM=1 WS=2"
"248","17.197404","54.225.150.170","10.10.10.124","TCP","54","8443  >  3123 [ACK] Seq=4959 Ack=48976 Win=42240 Len=0"
"249","17.222444","54.225.150.170","10.10.10.124","TCP","54","8443  >  3123 [ACK] Seq=4959 Ack=51736 Win=42240 Len=0"
"250","17.273278","54.225.150.170","10.10.10.124","TCP","54","8443  >  3123 [ACK] Seq=4959 Ack=53116 Win=42240 Len=0"
"251","17.274283","54.225.150.170","10.10.10.124","TCP","54","8443  >  3123 [ACK] Seq=4959 Ack=53246 Win=42240 Len=0"
"252","17.277118","54.235.111.253","10.10.10.124","TCP","66","8443  >  3689 [SYN, ACK] Seq=0 Ack=1 Win=14600 Len=0 MSS=1380 SACK_PERM=1 WS=256"
"253","17.278485","10.10.10.124","54.235.111.253","TCP","54","3689  >  8443 [ACK] Seq=1 Ack=1 Win=5840 Len=0"
"254","17.319372","54.225.150.170","10.10.10.124","TCP","459","8443  >  3123 [PSH, ACK] Seq=4959 Ack=53246 Win=42240 Len=405"
"255","17.326942","10.10.10.124","54.225.150.170","TCP","480","3123  >  8443 [PSH, ACK] Seq=53246 Ack=5364 Win=16880 Len=426"
"256","17.343246","10.10.10.124","54.235.111.253","TCP","171","3689  >  8443 [PSH, ACK] Seq=1 Ack=1 Win=5840 Len=117"
"257","17.345213","10.10.10.124","54.225.150.170","TCP","1434","3123  >  8443 [ACK] Seq=53672 Ack=5364 Win=16880 Len=1380"
"258","17.357765","10.10.10.124","54.225.150.170","TCP","1434","3123  >  8443 [ACK] Seq=55052 Ack=5364 Win=16880 Len=1380"
"259","17.370455","10.10.10.124","54.225.150.170","TCP","1434","3123  >  8443 [ACK] Seq=56432 Ack=5364 Win=16880 Len=1380"
"260","17.384241","10.10.10.124","54.225.150.170","TCP","1434","3123  >  8443 [ACK] Seq=57812 Ack=5364 Win=16880 Len=1380"
"261","17.397295","10.10.10.124","54.225.150.170","TCP","1434","3123  >  8443 [ACK] Seq=59192 Ack=5364 Win=16880 Len=1380"
"262","17.409302","10.10.10.124","54.225.150.170","TCP","1434","3123  >  8443 [ACK] Seq=60572 Ack=5364 Win=16880 Len=1380"
"263","17.421993","10.10.10.124","54.225.150.170","TCP","1434","3123  >  8443 [ACK] Seq=61952 Ack=5364 Win=16880 Len=1380"
"264","17.435657","10.10.10.124","54.225.150.170","TCP","1434","3123  >  8443 [ACK] Seq=63332 Ack=5364 Win=16880 Len=1380"
"265","17.444429","54.235.111.253","10.10.10.124","TCP","54","8443  >  3689 [ACK] Seq=1 Ack=118 Win=14848 Len=0"
"266","17.444746","54.235.111.253","10.10.10.124","TCP","1434","8443  >  3689 [ACK] Seq=1 Ack=118 Win=14848 Len=1380"
"267","17.444775","54.235.111.253","10.10.10.124","TCP","1434","8443  >  3689 [ACK] Seq=1381 Ack=118 Win=14848 Len=1380"
"268","17.444781","54.235.111.253","10.10.10.124","TCP","1390","8443  >  3689 [PSH, ACK] Seq=2761 Ack=118 Win=14848 Len=1336"
"269","17.444791","54.235.111.253","10.10.10.124","TCP","857","8443  >  3689 [PSH, ACK] Seq=4097 Ack=118 Win=14848 Len=803"
"270","17.445039","54.225.150.170","10.10.10.124","TCP","54","8443  >  3123 [ACK] Seq=5364 Ack=55052 Win=42240 Len=0"
"271","17.447975","10.10.10.124","54.235.111.253","TCP","54","3689  >  8443 [ACK] Seq=118 Ack=1381 Win=8600 Len=0"
"272","17.448074","10.10.10.124","54.235.111.253","TCP","54","3689  >  8443 [ACK] Seq=118 Ack=2761 Win=11360 Len=0"
"273","17.448183","10.10.10.124","54.235.111.253","TCP","54","3689  >  8443 [ACK] Seq=118 Ack=4097 Win=14120 Len=0"
"274","17.449874","10.10.10.124","54.235.111.253","TCP","54","3689  >  8443 [ACK] Seq=118 Ack=4900 Win=16880 Len=0"
"275","17.450433","10.10.10.124","54.225.150.170","TCP","1076","3123  >  8443 [PSH, ACK] Seq=64712 Ack=5364 Win=16880 Len=1022"
"276","17.470456","54.225.150.170","10.10.10.124","TCP","54","8443  >  3123 [ACK] Seq=5364 Ack=57812 Win=42240 Len=0"
"277","17.497179","54.225.150.170","10.10.10.124","TCP","54","8443  >  3123 [ACK] Seq=5364 Ack=60572 Win=45312 Len=0"
"278","17.506686","10.10.10.124","54.235.111.253","TCP","380","3689  >  8443 [PSH, ACK] Seq=118 Ack=4900 Win=16880 Len=326"
"279","17.520402","10.10.10.124","54.225.150.170","TCP","1434","3123  >  8443 [ACK] Seq=65734 Ack=5364 Win=16880 Len=1380"
"280","17.521848","54.225.150.170","10.10.10.124","TCP","54","8443  >  3123 [ACK] Seq=5364 Ack=63332 Win=51200 Len=0"
"281","17.534019","10.10.10.124","54.225.150.170","TCP","1434","3123  >  8443 [ACK] Seq=67114 Ack=5364 Win=16880 Len=1380"
"282","17.550199","54.225.150.170","10.10.10.124","TCP","54","8443  >  3123 [ACK] Seq=5364 Ack=65734 Win=56832 Len=0"
"283","17.551701","10.10.10.124","54.225.150.170","TCP","1216","3123  >  8443 [PSH, ACK] Seq=68494 Ack=5364 Win=16880 Len=1162"
"284","17.609926","54.235.111.253","10.10.10.124","TCP","113","8443  >  3689 [PSH, ACK] Seq=4900 Ack=444 Win=15872 Len=59"
"285","17.611227","10.10.10.124","54.235.111.253","TCP","54","3689  >  8443 [ACK] Seq=444 Ack=4959 Win=16880 Len=0"
"286","17.616145","10.10.10.124","54.235.111.253","TCP","432","3689  >  8443 [PSH, ACK] Seq=444 Ack=4959 Win=16880 Len=378"
"287","17.629281","10.10.10.124","54.235.111.253","TCP","1434","3689  >  8443 [ACK] Seq=822 Ack=4959 Win=16880 Len=1380"
"288","17.633875","54.225.150.170","10.10.10.124","TCP","54","8443  >  3123 [ACK] Seq=5364 Ack=68494 Win=62720 Len=0"
"289","17.663996","54.225.150.170","10.10.10.124","TCP","555","8443  >  3123 [PSH, ACK] Seq=5364 Ack=69656 Win=65536 Len=501"
"290","17.671758","10.10.10.124","54.225.150.170","TCP","480","3123  >  8443 [PSH, ACK] Seq=69656 Ack=5865 Win=16880 Len=426"
"291","17.684818","10.10.10.124","54.225.150.170","TCP","1434","3123  >  8443 [ACK] Seq=70082 Ack=5865 Win=16880 Len=1380"
"292","17.697328","10.10.10.124","54.225.150.170","TCP","1434","3123  >  8443 [ACK] Seq=71462 Ack=5865 Win=16880 Len=1380"
"293","17.709132","10.10.10.124","54.225.150.170","TCP","1434","3123  >  8443 [ACK] Seq=72842 Ack=5865 Win=16880 Len=1380"
"294","17.729286","10.10.10.124","54.225.150.170","TCP","1434","3123  >  8443 [ACK] Seq=74222 Ack=5865 Win=16880 Len=1380"
"295","17.730503","54.235.111.253","10.10.10.124","TCP","54","8443  >  3689 [ACK] Seq=4959 Ack=2202 Win=19712 Len=0"
"296","17.732159","10.10.10.124","54.235.111.253","TCP","1434","3689  >  8443 [ACK] Seq=2202 Ack=4959 Win=16880 Len=1380"
"297","17.732399","10.10.10.124","54.235.111.253","TCP","1434","3689  >  8443 [ACK] Seq=3582 Ack=4959 Win=16880 Len=1380"
"298","17.732712","10.10.10.124","54.235.111.253","TCP","1434","3689  >  8443 [ACK] Seq=4962 Ack=4959 Win=16880 Len=1380"
"299","17.751428","10.10.10.124","54.225.150.170","TCP","1434","3123  >  8443 [ACK] Seq=75602 Ack=5865 Win=16880 Len=1380"
"300","17.779025","10.10.10.124","54.225.150.170","TCP","1434","3123  >  8443 [ACK] Seq=76982 Ack=5865 Win=16880 Len=1380"
"301","17.784772","54.225.150.170","10.10.10.124","TCP","54","8443  >  3123 [ACK] Seq=5865 Ack=71462 Win=71168 Len=0"
"302","17.786394","10.10.10.124","54.225.150.170","TCP","580","3123  >  8443 [PSH, ACK] Seq=78362 Ack=5865 Win=16880 Len=526"
"303","17.806845","10.10.10.124","54.225.150.170","TCP","1434","3123  >  8443 [ACK] Seq=78888 Ack=5865 Win=16880 Len=1380"
"304","17.809146","54.225.150.170","10.10.10.124","TCP","54","8443  >  3123 [ACK] Seq=5865 Ack=74222 Win=77056 Len=0"
"305","17.817726","10.10.10.124","54.225.150.170","TCP","1434","3123  >  8443 [ACK] Seq=80268 Ack=5865 Win=16880 Len=1380"
"306","17.830722","10.10.10.124","54.225.150.170","TCP","1434","3123  >  8443 [ACK] Seq=81648 Ack=5865 Win=16880 Len=1380"
"307","17.833552","54.235.111.253","10.10.10.124","TCP","54","8443  >  3689 [ACK] Seq=4959 Ack=4962 Win=25600 Len=0"
"308","17.835143","10.10.10.124","54.235.111.253","TCP","1434","3689  >  8443 [ACK] Seq=6342 Ack=4959 Win=16880 Len=1380"
"309","17.835407","10.10.10.124","54.235.111.253","TCP","1434","3689  >  8443 [ACK] Seq=7722 Ack=4959 Win=16880 Len=1380"
"310","17.835701","10.10.10.124","54.235.111.253","TCP","1434","3689  >  8443 [ACK] Seq=9102 Ack=4959 Win=16880 Len=1380"
"311","17.851308","54.225.150.170","10.10.10.124","TCP","54","8443  >  3123 [ACK] Seq=5865 Ack=76982 Win=82944 Len=0"
"312","17.868161","10.10.10.124","54.225.150.170","TCP","1434","3123  >  8443 [ACK] Seq=83028 Ack=5865 Win=16880 Len=1380"
"313","17.871635","54.235.111.253","10.10.10.124","TCP","54","8443  >  3689 [ACK] Seq=4959 Ack=6342 Win=28672 Len=0"
"314","17.873362","10.10.10.124","54.235.111.253","TCP","1434","3689  >  8443 [ACK] Seq=10482 Ack=4959 Win=16880 Len=1380"
"315","17.873623","10.10.10.124","54.235.111.253","TCP","1434","3689  >  8443 [ACK] Seq=11862 Ack=4959 Win=16880 Len=1380"
"316","17.886196","54.225.150.170","10.10.10.124","TCP","54","8443  >  3123 [ACK] Seq=5865 Ack=78888 Win=83456 Len=0"
"317","17.887648","10.10.10.124","54.225.150.170","TCP","676","3123  >  8443 [PSH, ACK] Seq=84408 Ack=5865 Win=16880 Len=622"
"318","17.900524","10.10.10.124","54.225.150.170","TCP","1434","3123  >  8443 [ACK] Seq=85030 Ack=5865 Win=16880 Len=1380"
"319","17.912254","10.10.10.124","54.225.150.170","TCP","1434","3123  >  8443 [ACK] Seq=86410 Ack=5865 Win=16880 Len=1380"
"320","17.917684","54.225.150.170","10.10.10.124","TCP","54","8443  >  3123 [ACK] Seq=5865 Ack=81648 Win=82944 Len=0"
"321","17.924675","10.10.10.124","54.225.150.170","TCP","1434","3123  >  8443 [ACK] Seq=87790 Ack=5865 Win=16880 Len=1380"
"322","17.936282","54.235.111.253","10.10.10.124","TCP","54","8443  >  3689 [ACK] Seq=4959 Ack=7722 Win=31488 Len=0"
"323","17.936477","54.235.111.253","10.10.10.124","TCP","54","8443  >  3689 [ACK] Seq=4959 Ack=9102 Win=34304 Len=0"
"324","17.936876","54.235.111.253","10.10.10.124","TCP","54","8443  >  3689 [ACK] Seq=4959 Ack=10482 Win=37376 Len=0"
"325","17.938843","10.10.10.124","54.235.111.253","TCP","1434","3689  >  8443 [ACK] Seq=13242 Ack=4959 Win=16880 Len=1380"
"326","17.938946","10.10.10.124","54.235.111.253","TCP","92","3689  >  8443 [PSH, ACK] Seq=14622 Ack=4959 Win=16880 Len=38 [TCP segment of a reassembled PDU]"
"327","17.952106","10.10.10.124","54.235.111.253","TCP","1434","3689  >  8443 [ACK] Seq=14660 Ack=4959 Win=16880 Len=1380"
"328","17.964016","10.10.10.124","54.235.111.253","TCP","1434","3689  >  8443 [ACK] Seq=16040 Ack=4959 Win=16880 Len=1380"
"329","17.964960","10.10.10.124","54.225.150.170","TCP","1434","3123  >  8443 [ACK] Seq=89170 Ack=5865 Win=16880 Len=1380"
"330","17.968059","54.225.150.170","10.10.10.124","TCP","54","8443  >  3123 [ACK] Seq=5865 Ack=84408 Win=82944 Len=0"
