"No.","Time","Source","Destination","Protocol","Length","Info"
"1","0.000000","BelkinIn_35:01:c1","IntelCor_c3:41:78","EAPOL","135","Key (Message 2 of 4)"
"2","0.006477","BelkinIn_35:01:c1","IntelCor_c3:41:78","EAPOL","113","Key (Message 4 of 4)"
"3","1.685807","0.0.0.0","255.255.255.255","DHCP","342","DHCP Discover - Transaction ID 0xd3cdbb24"
"4","1.686001","10.10.10.1","10.10.10.252","DHCP","342","DHCP Offer    - Transaction ID 0xd3cdbb24"
"5","1.717527","0.0.0.0","255.255.255.255","DHCP","342","DHCP Request  - Transaction ID 0xd3cdbb24"
"6","1.782766","10.10.10.1","10.10.10.252","DHCP","342","DHCP ACK      - Transaction ID 0xd3cdbb24"
"7","2.355328","BelkinIn_35:01:c1","Broadcast","ARP","60","Who has 10.10.10.1? Tell 10.10.10.252"
"8","2.355351","DavidEle_06:08:ba","BelkinIn_35:01:c1","ARP","42","10.10.10.1 is at 00:b5:6d:06:08:ba"
"9","5.445297","BelkinIn_35:01:c1","Broadcast","ARP","42","Who has 10.10.10.1? Tell 10.10.10.252"
"10","5.445315","DavidEle_06:08:ba","BelkinIn_35:01:c1","ARP","42","10.10.10.1 is at 00:b5:6d:06:08:ba"
"11","5.447847","10.10.10.252","4.2.2.2","ICMP","98","Echo (ping) request  id=0x3007, seq=0/0, ttl=64 (reply in 12)"
"12","5.449673","4.2.2.2","10.10.10.252","ICMP","98","Echo (ping) reply    id=0x3007, seq=0/0, ttl=52 (request in 11)"
"13","6.444826","10.10.10.252","4.2.2.2","ICMP","98","Echo (ping) request  id=0x3007, seq=1/256, ttl=64 (reply in 14)"
"14","6.446482","4.2.2.2","10.10.10.252","ICMP","98","Echo (ping) reply    id=0x3007, seq=1/256, ttl=52 (request in 13)"
"15","9.436812","10.10.10.252","224.0.0.22","IGMPv3","54","Membership Report / Join group 239.255.255.250 for any sources"
"16","9.640406","10.10.10.252","239.255.255.250","SSDP","423","NOTIFY * HTTP/1.1 "
"17","9.642776","10.10.10.252","239.255.255.250","SSDP","421","NOTIFY * HTTP/1.1 "
"18","9.645497","10.10.10.252","239.255.255.250","SSDP","453","NOTIFY * HTTP/1.1 "
"19","9.648875","10.10.10.252","239.255.255.250","SSDP","453","NOTIFY * HTTP/1.1 "
"20","9.652896","10.10.10.252","239.255.255.250","SSDP","451","NOTIFY * HTTP/1.1 "
"21","9.655861","10.10.10.252","239.255.255.250","SSDP","455","NOTIFY * HTTP/1.1 "
"22","9.662685","10.10.10.252","239.255.255.250","SSDP","457","NOTIFY * HTTP/1.1 "
"23","9.663747","10.10.10.252","239.255.255.250","SSDP","461","NOTIFY * HTTP/1.1 "
"24","9.664720","10.10.10.252","239.255.255.250","SSDP","457","NOTIFY * HTTP/1.1 "
"25","9.665827","10.10.10.252","239.255.255.250","SSDP","463","NOTIFY * HTTP/1.1 "
"26","9.667278","10.10.10.252","239.255.255.250","SSDP","445","NOTIFY * HTTP/1.1 "
"27","9.669123","10.10.10.252","239.255.255.250","SSDP","451","NOTIFY * HTTP/1.1 "
"28","9.670090","10.10.10.252","239.255.255.250","SSDP","459","NOTIFY * HTTP/1.1 "
"29","9.671210","10.10.10.252","239.255.255.250","SSDP","455","NOTIFY * HTTP/1.1 "
"30","9.671367","10.10.10.252","239.255.255.250","SSDP","455","NOTIFY * HTTP/1.1 "
"31","9.671874","10.10.10.252","239.255.255.250","SSDP","457","NOTIFY * HTTP/1.1 "
"32","10.445213","BelkinIn_35:01:c1","DavidEle_06:08:ba","ARP","42","Who has 10.10.10.1? Tell 10.10.10.252"
"33","10.445235","DavidEle_06:08:ba","BelkinIn_35:01:c1","ARP","42","10.10.10.1 is at 00:b5:6d:06:08:ba"
"34","10.982443","10.10.10.252","10.10.10.1","DNS","72","Standard query 0xafe7 A api.xbcs.net"
"35","11.099204","10.10.10.1","10.10.10.252","DNS","468","Standard query response 0xafe7 A api.xbcs.net CNAME prod1-api-xbcs-net-889336557.us-east-1.elb.amazonaws.com A 184.73.254.250 A 23.23.111.129 A 50.17.221.66 A 54.83.204.109 A 54.225.140.113 A 54.243.87.97 A 174.129.213.156 A 174.129.249.52 NS ns-934.awsdns-52.net NS ns-1793.awsdns-32.co.uk NS ns-235.awsdns-29.com NS ns-1119.awsdns-11.org A 205.251.192.235 A 205.251.195.166 A 205.251.196.95 A 205.251.199.1"
"36","11.104404","10.10.10.252","184.73.254.250","TCP","66","4227  >  8443 [SYN] Seq=0 Win=5840 Len=0 MSS=1460 SACK_PERM=1 WS=2"
"37","11.204082","184.73.254.250","10.10.10.252","TCP","66","8443  >  4227 [SYN, ACK] Seq=0 Ack=1 Win=14600 Len=0 MSS=1380 SACK_PERM=1 WS=256"
"38","11.205443","10.10.10.252","184.73.254.250","TCP","54","4227  >  8443 [ACK] Seq=1 Ack=1 Win=5840 Len=0"
"39","11.253551","10.10.10.252","184.73.254.250","TCP","171","4227  >  8443 [PSH, ACK] Seq=1 Ack=1 Win=5840 Len=117"
"40","11.357506","184.73.254.250","10.10.10.252","TCP","54","8443  >  4227 [ACK] Seq=1 Ack=118 Win=14848 Len=0"
"41","11.357797","184.73.254.250","10.10.10.252","TCP","1434","8443  >  4227 [ACK] Seq=1 Ack=118 Win=14848 Len=1380"
"42","11.357821","184.73.254.250","10.10.10.252","TCP","1434","8443  >  4227 [ACK] Seq=1381 Ack=118 Win=14848 Len=1380"
"43","11.357823","184.73.254.250","10.10.10.252","TCP","1390","8443  >  4227 [PSH, ACK] Seq=2761 Ack=118 Win=14848 Len=1336"
"44","11.357828","184.73.254.250","10.10.10.252","TCP","857","8443  >  4227 [PSH, ACK] Seq=4097 Ack=118 Win=14848 Len=803"
"45","11.373035","10.10.10.252","184.73.254.250","TCP","54","4227  >  8443 [ACK] Seq=118 Ack=1381 Win=8600 Len=0"
"46","11.384001","10.10.10.252","184.73.254.250","TCP","54","4227  >  8443 [ACK] Seq=118 Ack=2761 Win=11360 Len=0"
"47","11.385072","10.10.10.252","184.73.254.250","TCP","54","4227  >  8443 [ACK] Seq=118 Ack=4097 Win=14120 Len=0"
"48","11.385177","10.10.10.252","184.73.254.250","TCP","54","4227  >  8443 [ACK] Seq=118 Ack=4900 Win=16880 Len=0"
"49","11.440545","10.10.10.252","184.73.254.250","TCP","380","4227  >  8443 [PSH, ACK] Seq=118 Ack=4900 Win=16880 Len=326"
"50","11.542966","184.73.254.250","10.10.10.252","TCP","113","8443  >  4227 [PSH, ACK] Seq=4900 Ack=444 Win=15872 Len=59"
"51","11.545338","10.10.10.252","184.73.254.250","TCP","54","4227  >  8443 [ACK] Seq=444 Ack=4959 Win=16880 Len=0"
"52","11.550709","10.10.10.252","184.73.254.250","TCP","432","4227  >  8443 [PSH, ACK] Seq=444 Ack=4959 Win=16880 Len=378"
"53","11.564526","10.10.10.252","184.73.254.250","TCP","1434","4227  >  8443 [ACK] Seq=822 Ack=4959 Win=16880 Len=1380"
"54","11.664630","184.73.254.250","10.10.10.252","TCP","54","8443  >  4227 [ACK] Seq=4959 Ack=2202 Win=19712 Len=0"
"55","11.667106","10.10.10.252","184.73.254.250","TCP","1434","4227  >  8443 [ACK] Seq=2202 Ack=4959 Win=16880 Len=1380"
"56","11.670232","10.10.10.252","184.73.254.250","TCP","1434","4227  >  8443 [ACK] Seq=3582 Ack=4959 Win=16880 Len=1380"
"57","11.672889","10.10.10.252","184.73.254.250","TCP","1434","4227  >  8443 [ACK] Seq=4962 Ack=4959 Win=16880 Len=1380"
"58","11.769936","184.73.254.250","10.10.10.252","TCP","54","8443  >  4227 [ACK] Seq=4959 Ack=4962 Win=25600 Len=0"
"59","11.773871","10.10.10.252","184.73.254.250","TCP","1434","4227  >  8443 [ACK] Seq=6342 Ack=4959 Win=16880 Len=1380"
"60","11.775212","10.10.10.252","184.73.254.250","TCP","1434","4227  >  8443 [ACK] Seq=7722 Ack=4959 Win=16880 Len=1380"
"61","11.777788","10.10.10.252","184.73.254.250","TCP","1434","4227  >  8443 [ACK] Seq=9102 Ack=4959 Win=16880 Len=1380"
"62","11.809961","184.73.254.250","10.10.10.252","TCP","54","8443  >  4227 [ACK] Seq=4959 Ack=6342 Win=28672 Len=0"
"63","11.812400","10.10.10.252","184.73.254.250","TCP","1434","4227  >  8443 [ACK] Seq=10482 Ack=4959 Win=16880 Len=1380"
"64","11.814335","10.10.10.252","184.73.254.250","TCP","1434","4227  >  8443 [ACK] Seq=11862 Ack=4959 Win=16880 Len=1380"
"65","11.874161","184.73.254.250","10.10.10.252","TCP","54","8443  >  4227 [ACK] Seq=4959 Ack=7722 Win=31488 Len=0"
"66","11.874916","184.73.254.250","10.10.10.252","TCP","54","8443  >  4227 [ACK] Seq=4959 Ack=9102 Win=34304 Len=0"
"67","11.877239","10.10.10.252","184.73.254.250","TCP","1434","4227  >  8443 [ACK] Seq=13242 Ack=4959 Win=16880 Len=1380"
"68","11.877316","184.73.254.250","10.10.10.252","TCP","54","8443  >  4227 [ACK] Seq=4959 Ack=10482 Win=37376 Len=0"
"69","11.878496","10.10.10.252","184.73.254.250","TCP","92","4227  >  8443 [PSH, ACK] Seq=14622 Ack=4959 Win=16880 Len=38"
"70","11.890734","10.10.10.252","184.73.254.250","TCP","1434","4227  >  8443 [ACK] Seq=14660 Ack=4959 Win=16880 Len=1380"
"71","11.901623","10.10.10.252","184.73.254.250","TCP","1434","4227  >  8443 [ACK] Seq=16040 Ack=4959 Win=16880 Len=1380"
"72","11.912089","184.73.254.250","10.10.10.252","TCP","54","8443  >  4227 [ACK] Seq=4959 Ack=11862 Win=40192 Len=0"
"73","11.913909","184.73.254.250","10.10.10.252","TCP","54","8443  >  4227 [ACK] Seq=4959 Ack=13242 Win=42240 Len=0"
"74","11.926859","10.10.10.252","184.73.254.250","TCP","1434","4227  >  8443 [ACK] Seq=17420 Ack=4959 Win=16880 Len=1380"
"75","11.939952","10.10.10.252","184.73.254.250","TCP","1434","4227  >  8443 [ACK] Seq=18800 Ack=4959 Win=16880 Len=1380"
"76","11.952153","10.10.10.252","184.73.254.250","TCP","1434","4227  >  8443 [ACK] Seq=20180 Ack=4959 Win=16880 Len=1380"
"77","11.976933","184.73.254.250","10.10.10.252","TCP","54","8443  >  4227 [ACK] Seq=4959 Ack=14622 Win=42240 Len=0"
"78","11.977857","184.73.254.250","10.10.10.252","TCP","54","8443  >  4227 [ACK] Seq=4959 Ack=14660 Win=42240 Len=0"
"79","11.979882","10.10.10.252","184.73.254.250","TCP","1434","4227  >  8443 [ACK] Seq=21560 Ack=4959 Win=16880 Len=1380"
"80","11.981410","10.10.10.252","184.73.254.250","TCP","1434","4227  >  8443 [ACK] Seq=22940 Ack=4959 Win=16880 Len=1380"
"81","11.981509","10.10.10.252","184.73.254.250","TCP","88","4227  >  8443 [PSH, ACK] Seq=24320 Ack=4959 Win=16880 Len=34"
"82","11.990514","184.73.254.250","10.10.10.252","TCP","54","8443  >  4227 [ACK] Seq=4959 Ack=16040 Win=42240 Len=0"
"83","11.993278","10.10.10.252","184.73.254.250","TCP","1434","4227  >  8443 [ACK] Seq=24354 Ack=4959 Win=16880 Len=1380"
"84","12.001379","184.73.254.250","10.10.10.252","TCP","54","8443  >  4227 [ACK] Seq=4959 Ack=17420 Win=42240 Len=0"
"85","12.004690","10.10.10.252","184.73.254.250","TCP","1434","4227  >  8443 [ACK] Seq=25734 Ack=4959 Win=16880 Len=1380"
"86","12.017646","10.10.10.252","184.73.254.250","TCP","1434","4227  >  8443 [ACK] Seq=27114 Ack=4959 Win=16880 Len=1380"
"87","12.026511","184.73.254.250","10.10.10.252","TCP","54","8443  >  4227 [ACK] Seq=4959 Ack=18800 Win=42240 Len=0"
"88","12.039641","184.73.254.250","10.10.10.252","TCP","54","8443  >  4227 [ACK] Seq=4959 Ack=20180 Win=42240 Len=0"
"89","12.041638","10.10.10.252","184.73.254.250","TCP","1434","4227  >  8443 [ACK] Seq=28494 Ack=4959 Win=16880 Len=1380"
"90","12.051818","184.73.254.250","10.10.10.252","TCP","54","8443  >  4227 [ACK] Seq=4959 Ack=21560 Win=42240 Len=0"
"91","12.055124","10.10.10.252","184.73.254.250","TCP","1434","4227  >  8443 [ACK] Seq=29874 Ack=4959 Win=16880 Len=1380"
"92","12.066108","10.10.10.252","184.73.254.250","TCP","1434","4227  >  8443 [ACK] Seq=31254 Ack=4959 Win=16880 Len=1380"
"93","12.079553","184.73.254.250","10.10.10.252","TCP","54","8443  >  4227 [ACK] Seq=4959 Ack=22940 Win=42240 Len=0"
"94","12.081034","184.73.254.250","10.10.10.252","TCP","54","8443  >  4227 [ACK] Seq=4959 Ack=24354 Win=42240 Len=0"
"95","12.082340","10.10.10.252","184.73.254.250","TCP","1434","4227  >  8443 [ACK] Seq=32634 Ack=4959 Win=16880 Len=1380"
"96","12.082396","10.10.10.252","184.73.254.250","TCP","310","4227  >  8443 [PSH, ACK] Seq=34014 Ack=4959 Win=16880 Len=256"
"97","12.095222","10.10.10.252","184.73.254.250","TCP","1434","4227  >  8443 [ACK] Seq=34270 Ack=4959 Win=16880 Len=1380"
"98","12.104310","184.73.254.250","10.10.10.252","TCP","54","8443  >  4227 [ACK] Seq=4959 Ack=27114 Win=42240 Len=0"
"99","12.109449","10.10.10.252","184.73.254.250","TCP","1434","4227  >  8443 [ACK] Seq=35650 Ack=4959 Win=16880 Len=1380"
"100","12.120351","10.10.10.252","184.73.254.250","TCP","1434","4227  >  8443 [ACK] Seq=37030 Ack=4959 Win=16880 Len=1380"
"101","12.141290","184.73.254.250","10.10.10.252","TCP","54","8443  >  4227 [ACK] Seq=4959 Ack=29874 Win=42240 Len=0"
"102","12.165964","184.73.254.250","10.10.10.252","TCP","54","8443  >  4227 [ACK] Seq=4959 Ack=32634 Win=42240 Len=0"
"103","12.181953","184.73.254.250","10.10.10.252","TCP","54","8443  >  4227 [ACK] Seq=4959 Ack=34270 Win=42240 Len=0"
"104","12.183542","10.10.10.252","184.73.254.250","TCP","1316","4227  >  8443 [PSH, ACK] Seq=38410 Ack=4959 Win=16880 Len=1262"
"105","12.209252","184.73.254.250","10.10.10.252","TCP","54","8443  >  4227 [ACK] Seq=4959 Ack=37030 Win=42240 Len=0"
"106","12.259044","184.73.254.250","10.10.10.252","TCP","54","8443  >  4227 [ACK] Seq=4959 Ack=38410 Win=42240 Len=0"
"107","12.283344","184.73.254.250","10.10.10.252","TCP","54","8443  >  4227 [ACK] Seq=4959 Ack=39672 Win=42240 Len=0"
"108","12.366621","184.73.254.250","10.10.10.252","TCP","1434","8443  >  4227 [ACK] Seq=4959 Ack=39672 Win=42240 Len=1380"
"109","12.366646","184.73.254.250","10.10.10.252","TCP","295","8443  >  4227 [PSH, ACK] Seq=6339 Ack=39672 Win=42240 Len=241"
"110","12.368694","10.10.10.252","184.73.254.250","TCP","54","4227  >  8443 [ACK] Seq=39672 Ack=6580 Win=16880 Len=0"
"111","12.752945","10.10.10.252","224.0.0.22","IGMPv3","54","Membership Report / Join group 239.255.255.250 for any sources"
"112","16.109852","DavidEle_06:08:ba","BelkinIn_35:01:c1","ARP","42","Who has 10.10.10.252? Tell 10.10.10.1"
"113","16.111683","BelkinIn_35:01:c1","DavidEle_06:08:ba","ARP","42","10.10.10.252 is at 94:10:3e:35:01:c1"
"114","16.326274","10.10.10.252","184.73.254.250","TCP","91","4227  >  8443 [PSH, ACK] Seq=39672 Ack=6580 Win=16880 Len=37"
"115","16.331119","10.10.10.252","184.73.254.250","TCP","54","4227  >  8443 [FIN, ACK] Seq=39709 Ack=6580 Win=16880 Len=0"
"116","16.425769","184.73.254.250","10.10.10.252","TCP","91","8443  >  4227 [PSH, ACK] Seq=6580 Ack=39709 Win=42240 Len=37"
"117","16.425802","184.73.254.250","10.10.10.252","TCP","54","8443  >  4227 [FIN, ACK] Seq=6617 Ack=39709 Win=42240 Len=0"
"118","16.426876","10.10.10.252","184.73.254.250","TCP","54","4227  >  8443 [RST] Seq=39709 Win=0 Len=0"
"119","16.427144","10.10.10.252","184.73.254.250","TCP","54","4227  >  8443 [RST] Seq=39709 Win=0 Len=0"
"120","18.811012","54.196.103.113","10.10.10.252","TCP","54","3478  >  4223 [FIN, ACK] Seq=1 Ack=1 Win=245 Len=0"
"121","18.812099","10.10.10.252","54.196.103.113","TCP","54","4223  >  3478 [RST] Seq=1 Win=0 Len=0"
"122","19.650673","10.10.10.252","10.10.10.1","DNS","72","Standard query 0xc83d A nat.xbcs.net"
"123","19.773309","10.10.10.1","10.10.10.252","DNS","373","Standard query response 0xc83d A nat.xbcs.net CNAME prod1-nat-xbcs-net-1543133972.us-east-1.elb.amazonaws.com A 54.235.195.29 A 23.23.244.163 NS ns-934.awsdns-52.net NS ns-235.awsdns-29.com NS ns-1119.awsdns-11.org NS ns-1793.awsdns-32.co.uk A 205.251.192.235 A 205.251.195.166 A 205.251.196.95 A 205.251.199.1"
"124","20.817856","10.10.10.252","54.235.195.29","TCP","66","3718  >  3475 [SYN] Seq=0 Win=5840 Len=0 MSS=1460 SACK_PERM=1 WS=2"
"125","20.935990","54.235.195.29","10.10.10.252","TCP","66","3475  >  3718 [SYN, ACK] Seq=0 Ack=1 Win=14600 Len=0 MSS=1380 SACK_PERM=1 WS=256"
"126","20.936869","10.10.10.252","54.235.195.29","TCP","54","3718  >  3475 [ACK] Seq=1 Ack=1 Win=5840 Len=0"
"127","20.939272","10.10.10.252","54.235.195.29","TCP","403","3718  >  3475 [PSH, ACK] Seq=1 Ack=1 Win=5840 Len=349"
"128","21.053041","54.235.195.29","10.10.10.252","TCP","54","3475  >  3718 [ACK] Seq=1 Ack=350 Win=15872 Len=0"
"129","21.053702","54.235.195.29","10.10.10.252","TCP","66","3475  >  3718 [PSH, ACK] Seq=1 Ack=350 Win=15872 Len=12"
"130","21.055386","10.10.10.252","54.235.195.29","TCP","54","3718  >  3475 [ACK] Seq=350 Ack=13 Win=5840 Len=0"
"131","21.057207","10.10.10.252","54.235.195.29","TCP","54","3718  >  3475 [FIN, ACK] Seq=350 Ack=13 Win=5840 Len=0"
"132","21.169261","54.235.195.29","10.10.10.252","TCP","54","3475  >  3718 [FIN, ACK] Seq=13 Ack=351 Win=15872 Len=0"
"133","21.170142","10.10.10.252","54.235.195.29","TCP","54","3718  >  3475 [ACK] Seq=351 Ack=14 Win=5840 Len=0"
"134","22.308144","10.10.10.252","54.159.89.38","TCP","66","4357  >  3478 [SYN] Seq=0 Win=5840 Len=0 MSS=1460 SACK_PERM=1 WS=2"
"135","22.408232","54.159.89.38","10.10.10.252","TCP","66","3478  >  4357 [SYN, ACK] Seq=0 Ack=1 Win=29200 Len=0 MSS=1380 SACK_PERM=1 WS=128"
"136","22.409089","10.10.10.252","54.159.89.38","TCP","54","4357  >  3478 [ACK] Seq=1 Ack=1 Win=5840 Len=0"
"137","22.414449","10.10.10.252","54.159.89.38","STUN","102","Allocate Request TCP"
"138","22.514641","54.159.89.38","10.10.10.252","TCP","54","3478  >  4357 [ACK] Seq=1 Ack=49 Win=29312 Len=0"
"139","23.045919","54.159.89.38","10.10.10.252","STUN","194","Allocate Error Response error-code: 401 (Unauthorized) Unauthorized realm: belkin.org with nonce"
"140","23.047467","10.10.10.252","54.159.89.38","TCP","54","4357  >  3478 [ACK] Seq=49 Ack=141 Win=5840 Len=0"
"141","23.053083","10.10.10.252","54.159.89.38","STUN","210","Allocate Request TCP user: 94103E3501C0 realm: belkin.org with nonce"
"142","23.152867","54.159.89.38","10.10.10.252","TCP","54","3478  >  4357 [ACK] Seq=141 Ack=205 Win=30336 Len=0"
"143","29.100824","54.159.89.38","10.10.10.252","STUN","194","Allocate Error Response error-code: 401 (Unauthorized) Unauthorized realm: belkin.org with nonce"
"144","29.107892","10.10.10.252","54.159.89.38","STUN","210","Allocate Request TCP user: 94103E3501C0 realm: belkin.org with nonce"
"145","29.207557","54.159.89.38","10.10.10.252","TCP","54","3478  >  4357 [ACK] Seq=281 Ack=361 Win=31360 Len=0"
"146","29.272802","54.159.89.38","10.10.10.252","STUN","158","Allocate Success Response XOR-RELAYED-ADDRESS: 10.182.103.51:28069 lifetime: 330 XOR-MAPPED-ADDRESS: 130.83.40.252:4357"
"147","29.313112","10.10.10.252","54.159.89.38","TCP","54","4357  >  3478 [ACK] Seq=361 Ack=385 Win=5840 Len=0"
"148","30.564940","10.10.10.252","174.129.249.52","TCP","66","3201  >  8443 [SYN] Seq=0 Win=5840 Len=0 MSS=1460 SACK_PERM=1 WS=2"
"149","30.666110","174.129.249.52","10.10.10.252","TCP","66","8443  >  3201 [SYN, ACK] Seq=0 Ack=1 Win=14600 Len=0 MSS=1380 SACK_PERM=1 WS=256"
"150","30.666906","10.10.10.252","174.129.249.52","TCP","54","3201  >  8443 [ACK] Seq=1 Ack=1 Win=5840 Len=0"
"151","30.863067","10.10.10.252","174.129.249.52","TCP","171","3201  >  8443 [PSH, ACK] Seq=1 Ack=1 Win=5840 Len=117"
"152","30.964149","174.129.249.52","10.10.10.252","TCP","54","8443  >  3201 [ACK] Seq=1 Ack=118 Win=14848 Len=0"
"153","30.964397","174.129.249.52","10.10.10.252","TCP","1434","8443  >  3201 [ACK] Seq=1 Ack=118 Win=14848 Len=1380"
"154","30.964464","174.129.249.52","10.10.10.252","TCP","1434","8443  >  3201 [ACK] Seq=1381 Ack=118 Win=14848 Len=1380"
"155","30.964521","174.129.249.52","10.10.10.252","TCP","1390","8443  >  3201 [PSH, ACK] Seq=2761 Ack=118 Win=14848 Len=1336"
"156","30.964526","174.129.249.52","10.10.10.252","TCP","857","8443  >  3201 [PSH, ACK] Seq=4097 Ack=118 Win=14848 Len=803"
"157","30.967853","10.10.10.252","174.129.249.52","TCP","54","3201  >  8443 [ACK] Seq=118 Ack=1381 Win=8600 Len=0"
"158","30.967927","10.10.10.252","174.129.249.52","TCP","54","3201  >  8443 [ACK] Seq=118 Ack=2761 Win=11360 Len=0"
"159","30.968023","10.10.10.252","174.129.249.52","TCP","54","3201  >  8443 [ACK] Seq=118 Ack=4097 Win=14120 Len=0"
"160","30.969644","10.10.10.252","174.129.249.52","TCP","54","3201  >  8443 [ACK] Seq=118 Ack=4900 Win=16880 Len=0"
"161","31.023256","10.10.10.252","174.129.249.52","TCP","380","3201  >  8443 [PSH, ACK] Seq=118 Ack=4900 Win=16880 Len=326"
"162","31.126669","174.129.249.52","10.10.10.252","TCP","113","8443  >  3201 [PSH, ACK] Seq=4900 Ack=444 Win=15872 Len=59"
"163","31.127623","10.10.10.252","174.129.249.52","TCP","54","3201  >  8443 [ACK] Seq=444 Ack=4959 Win=16880 Len=0"
"164","31.131450","10.10.10.252","174.129.249.52","TCP","432","3201  >  8443 [PSH, ACK] Seq=444 Ack=4959 Win=16880 Len=378"
"165","31.146042","10.10.10.252","174.129.249.52","TCP","1434","3201  >  8443 [ACK] Seq=822 Ack=4959 Win=16880 Len=1380"
"166","31.247664","174.129.249.52","10.10.10.252","TCP","54","8443  >  3201 [ACK] Seq=4959 Ack=2202 Win=19712 Len=0"
"167","31.249530","10.10.10.252","174.129.249.52","TCP","1434","3201  >  8443 [ACK] Seq=2202 Ack=4959 Win=16880 Len=1380"
"168","31.250509","10.10.10.252","174.129.249.52","TCP","1434","3201  >  8443 [ACK] Seq=3582 Ack=4959 Win=16880 Len=1380"
"169","31.251873","10.10.10.252","174.129.249.52","TCP","1434","3201  >  8443 [ACK] Seq=4962 Ack=4959 Win=16880 Len=1380"
"170","31.351712","174.129.249.52","10.10.10.252","TCP","54","8443  >  3201 [ACK] Seq=4959 Ack=4962 Win=25600 Len=0"
"171","31.357626","10.10.10.252","174.129.249.52","TCP","1434","3201  >  8443 [ACK] Seq=6342 Ack=4959 Win=16880 Len=1380"
"172","31.358013","10.10.10.252","174.129.249.52","TCP","1434","3201  >  8443 [ACK] Seq=7722 Ack=4959 Win=16880 Len=1380"
"173","31.359086","10.10.10.252","174.129.249.52","TCP","1434","3201  >  8443 [ACK] Seq=9102 Ack=4959 Win=16880 Len=1380"
"174","31.393088","174.129.249.52","10.10.10.252","TCP","54","8443  >  3201 [ACK] Seq=4959 Ack=6342 Win=28672 Len=0"
"175","31.394239","10.10.10.252","174.129.249.52","TCP","1434","3201  >  8443 [ACK] Seq=10482 Ack=4959 Win=16880 Len=1380"
"176","31.396428","10.10.10.252","174.129.249.52","TCP","1434","3201  >  8443 [ACK] Seq=11862 Ack=4959 Win=16880 Len=1380"
"177","31.458829","174.129.249.52","10.10.10.252","TCP","54","8443  >  3201 [ACK] Seq=4959 Ack=7722 Win=31488 Len=0"
"178","31.459142","174.129.249.52","10.10.10.252","TCP","54","8443  >  3201 [ACK] Seq=4959 Ack=9102 Win=34304 Len=0"
"179","31.459975","10.10.10.252","174.129.249.52","TCP","1434","3201  >  8443 [ACK] Seq=13242 Ack=4959 Win=16880 Len=1380"
"180","31.460235","174.129.249.52","10.10.10.252","TCP","54","8443  >  3201 [ACK] Seq=4959 Ack=10482 Win=37376 Len=0"
"181","31.460361","10.10.10.252","174.129.249.52","TCP","92","3201  >  8443 [PSH, ACK] Seq=14622 Ack=4959 Win=16880 Len=38"
"182","31.474222","10.10.10.252","174.129.249.52","TCP","1434","3201  >  8443 [ACK] Seq=14660 Ack=4959 Win=16880 Len=1380"
"183","31.487230","10.10.10.252","174.129.249.52","TCP","1434","3201  >  8443 [ACK] Seq=16040 Ack=4959 Win=16880 Len=1380"
"184","31.495409","174.129.249.52","10.10.10.252","TCP","54","8443  >  3201 [ACK] Seq=4959 Ack=11862 Win=40192 Len=0"
"185","31.497590","174.129.249.52","10.10.10.252","TCP","54","8443  >  3201 [ACK] Seq=4959 Ack=13242 Win=42240 Len=0"
"186","31.510048","10.10.10.252","174.129.249.52","TCP","1434","3201  >  8443 [ACK] Seq=17420 Ack=4959 Win=16880 Len=1380"
"187","31.561366","174.129.249.52","10.10.10.252","TCP","54","8443  >  3201 [ACK] Seq=4959 Ack=14622 Win=42240 Len=0"
"188","31.561374","174.129.249.52","10.10.10.252","TCP","54","8443  >  3201 [ACK] Seq=4959 Ack=14660 Win=42240 Len=0"
"189","31.563072","10.10.10.252","174.129.249.52","TCP","132","3201  >  8443 [PSH, ACK] Seq=18800 Ack=4959 Win=16880 Len=78"
"190","31.575419","174.129.249.52","10.10.10.252","TCP","54","8443  >  3201 [ACK] Seq=4959 Ack=16040 Win=42240 Len=0"
"191","31.588577","174.129.249.52","10.10.10.252","TCP","54","8443  >  3201 [ACK] Seq=4959 Ack=17420 Win=42240 Len=0"
"192","31.611190","174.129.249.52","10.10.10.252","TCP","54","8443  >  3201 [ACK] Seq=4959 Ack=18800 Win=42240 Len=0"
"193","31.664027","174.129.249.52","10.10.10.252","TCP","54","8443  >  3201 [ACK] Seq=4959 Ack=18878 Win=42240 Len=0"
"194","31.686178","174.129.249.52","10.10.10.252","TCP","1434","8443  >  3201 [ACK] Seq=4959 Ack=18878 Win=42240 Len=1380"
"195","31.686182","174.129.249.52","10.10.10.252","TCP","151","8443  >  3201 [PSH, ACK] Seq=6339 Ack=18878 Win=42240 Len=97"
"196","31.687619","10.10.10.252","174.129.249.52","TCP","54","3201  >  8443 [ACK] Seq=18878 Ack=6436 Win=16880 Len=0"
"197","31.694171","10.10.10.252","174.129.249.52","TCP","91","3201  >  8443 [PSH, ACK] Seq=18878 Ack=6436 Win=16880 Len=37"
"198","31.698910","10.10.10.252","174.129.249.52","TCP","54","3201  >  8443 [FIN, ACK] Seq=18915 Ack=6436 Win=16880 Len=0"
"199","31.795164","174.129.249.52","10.10.10.252","TCP","91","8443  >  3201 [PSH, ACK] Seq=6436 Ack=18915 Win=42240 Len=37"
"200","31.795170","174.129.249.52","10.10.10.252","TCP","54","8443  >  3201 [FIN, ACK] Seq=6473 Ack=18915 Win=42240 Len=0"
"201","31.796445","10.10.10.252","174.129.249.52","TCP","54","3201  >  8443 [RST] Seq=18915 Win=0 Len=0"
"202","31.796550","10.10.10.252","174.129.249.52","TCP","54","3201  >  8443 [RST] Seq=18915 Win=0 Len=0"
"203","45.277917","10.10.10.252","184.73.254.250","TCP","66","4236  >  8443 [SYN] Seq=0 Win=5840 Len=0 MSS=1460 SACK_PERM=1 WS=2"
"204","45.377890","184.73.254.250","10.10.10.252","TCP","66","8443  >  4236 [SYN, ACK] Seq=0 Ack=1 Win=14600 Len=0 MSS=1380 SACK_PERM=1 WS=256"
"205","45.379747","10.10.10.252","184.73.254.250","TCP","54","4236  >  8443 [ACK] Seq=1 Ack=1 Win=5840 Len=0"
"206","45.413385","10.10.10.252","184.73.254.250","TCP","171","4236  >  8443 [PSH, ACK] Seq=1 Ack=1 Win=5840 Len=117"
"207","45.513254","184.73.254.250","10.10.10.252","TCP","54","8443  >  4236 [ACK] Seq=1 Ack=118 Win=14848 Len=0"
"208","45.513624","184.73.254.250","10.10.10.252","TCP","1434","8443  >  4236 [ACK] Seq=1 Ack=118 Win=14848 Len=1380"
"209","45.513651","184.73.254.250","10.10.10.252","TCP","1434","8443  >  4236 [ACK] Seq=1381 Ack=118 Win=14848 Len=1380"
"210","45.513689","184.73.254.250","10.10.10.252","TCP","1390","8443  >  4236 [PSH, ACK] Seq=2761 Ack=118 Win=14848 Len=1336"
"211","45.513704","184.73.254.250","10.10.10.252","TCP","857","8443  >  4236 [PSH, ACK] Seq=4097 Ack=118 Win=14848 Len=803"
"212","45.516796","10.10.10.252","184.73.254.250","TCP","54","4236  >  8443 [ACK] Seq=118 Ack=1381 Win=8600 Len=0"
"213","45.516944","10.10.10.252","184.73.254.250","TCP","54","4236  >  8443 [ACK] Seq=118 Ack=2761 Win=11360 Len=0"
"214","45.519420","10.10.10.252","184.73.254.250","TCP","54","4236  >  8443 [ACK] Seq=118 Ack=4097 Win=14120 Len=0"
"215","45.519562","10.10.10.252","184.73.254.250","TCP","54","4236  >  8443 [ACK] Seq=118 Ack=4900 Win=16880 Len=0"
"216","45.574088","10.10.10.252","184.73.254.250","TCP","380","4236  >  8443 [PSH, ACK] Seq=118 Ack=4900 Win=16880 Len=326"
"217","45.682921","184.73.254.250","10.10.10.252","TCP","113","8443  >  4236 [PSH, ACK] Seq=4900 Ack=444 Win=15872 Len=59"
"218","45.684383","10.10.10.252","184.73.254.250","TCP","54","4236  >  8443 [ACK] Seq=444 Ack=4959 Win=16880 Len=0"
"219","45.688613","10.10.10.252","184.73.254.250","TCP","464","4236  >  8443 [PSH, ACK] Seq=444 Ack=4959 Win=16880 Len=410"
"220","45.705536","10.10.10.252","184.73.254.250","TCP","1434","4236  >  8443 [ACK] Seq=854 Ack=4959 Win=16880 Len=1380"
"221","45.813715","184.73.254.250","10.10.10.252","TCP","54","8443  >  4236 [ACK] Seq=4959 Ack=2234 Win=19712 Len=0"
"222","45.816610","10.10.10.252","184.73.254.250","TCP","1434","4236  >  8443 [ACK] Seq=2234 Ack=4959 Win=16880 Len=1380"
"223","45.819860","10.10.10.252","184.73.254.250","TCP","1434","4236  >  8443 [ACK] Seq=3614 Ack=4959 Win=16880 Len=1380"
"224","45.821156","10.10.10.252","184.73.254.250","TCP","1434","4236  >  8443 [ACK] Seq=4994 Ack=4959 Win=16880 Len=1380"
"225","45.921522","184.73.254.250","10.10.10.252","TCP","54","8443  >  4236 [ACK] Seq=4959 Ack=4994 Win=25600 Len=0"
"226","45.924308","10.10.10.252","184.73.254.250","TCP","1434","4236  >  8443 [ACK] Seq=6374 Ack=4959 Win=16880 Len=1380"
"227","45.927334","10.10.10.252","184.73.254.250","TCP","1434","4236  >  8443 [ACK] Seq=7754 Ack=4959 Win=16880 Len=1380"
"228","45.930268","10.10.10.252","184.73.254.250","TCP","1434","4236  >  8443 [ACK] Seq=9134 Ack=4959 Win=16880 Len=1380"
"229","45.965252","184.73.254.250","10.10.10.252","TCP","54","8443  >  4236 [ACK] Seq=4959 Ack=6374 Win=28672 Len=0"
"230","45.967706","10.10.10.252","184.73.254.250","TCP","1434","4236  >  8443 [ACK] Seq=10514 Ack=4959 Win=16880 Len=1380"
"231","45.969126","10.10.10.252","184.73.254.250","TCP","1434","4236  >  8443 [ACK] Seq=11894 Ack=4959 Win=16880 Len=1380"
"232","46.024508","184.73.254.250","10.10.10.252","TCP","54","8443  >  4236 [ACK] Seq=4959 Ack=7754 Win=31488 Len=0"
"233","46.026882","10.10.10.252","184.73.254.250","TCP","1434","4236  >  8443 [ACK] Seq=13274 Ack=4959 Win=16880 Len=1380"
"234","46.027098","10.10.10.252","184.73.254.250","TCP","92","4236  >  8443 [PSH, ACK] Seq=14654 Ack=4959 Win=16880 Len=38"
"235","46.027456","184.73.254.250","10.10.10.252","TCP","54","8443  >  4236 [ACK] Seq=4959 Ack=9134 Win=34304 Len=0"
"236","46.030369","184.73.254.250","10.10.10.252","TCP","54","8443  >  4236 [ACK] Seq=4959 Ack=10514 Win=37376 Len=0"
"237","46.042060","10.10.10.252","184.73.254.250","TCP","1434","4236  >  8443 [ACK] Seq=14692 Ack=4959 Win=16880 Len=1380"
"238","46.054455","10.10.10.252","184.73.254.250","TCP","1434","4236  >  8443 [ACK] Seq=16072 Ack=4959 Win=16880 Len=1380"
"239","46.066790","10.10.10.252","184.73.254.250","TCP","1434","4236  >  8443 [ACK] Seq=17452 Ack=4959 Win=16880 Len=1380"
"240","46.070211","184.73.254.250","10.10.10.252","TCP","54","8443  >  4236 [ACK] Seq=4959 Ack=11894 Win=40192 Len=0"
"241","46.070255","184.73.254.250","10.10.10.252","TCP","54","8443  >  4236 [ACK] Seq=4959 Ack=13274 Win=41472 Len=0"
"242","46.079415","10.10.10.252","184.73.254.250","TCP","1434","4236  >  8443 [ACK] Seq=18832 Ack=4959 Win=16880 Len=1380"
"243","46.092640","10.10.10.252","184.73.254.250","TCP","1434","4236  >  8443 [ACK] Seq=20212 Ack=4959 Win=16880 Len=1380"
"244","46.104133","10.10.10.252","184.73.254.250","TCP","1434","4236  >  8443 [ACK] Seq=21592 Ack=4959 Win=16880 Len=1380"
"245","46.127010","184.73.254.250","10.10.10.252","TCP","54","8443  >  4236 [ACK] Seq=4959 Ack=14692 Win=42240 Len=0"
"246","46.130524","10.10.10.252","184.73.254.250","TCP","1434","4236  >  8443 [ACK] Seq=22972 Ack=4959 Win=16880 Len=1380"
"247","46.131414","10.10.10.252","184.73.254.250","TCP","88","4236  >  8443 [PSH, ACK] Seq=24352 Ack=4959 Win=16880 Len=34"
"248","46.142085","10.10.10.252","184.73.254.250","TCP","1434","4236  >  8443 [ACK] Seq=24386 Ack=4959 Win=16880 Len=1380"
"249","46.142093","184.73.254.250","10.10.10.252","TCP","54","8443  >  4236 [ACK] Seq=4959 Ack=16072 Win=42240 Len=0"
"250","46.154604","184.73.254.250","10.10.10.252","TCP","54","8443  >  4236 [ACK] Seq=4959 Ack=17452 Win=42240 Len=0"
"251","46.154696","10.10.10.252","184.73.254.250","TCP","1434","4236  >  8443 [ACK] Seq=25766 Ack=4959 Win=16880 Len=1380"
"252","46.166980","10.10.10.252","184.73.254.250","TCP","1434","4236  >  8443 [ACK] Seq=27146 Ack=4959 Win=16880 Len=1380"
"253","46.166987","184.73.254.250","10.10.10.252","TCP","54","8443  >  4236 [ACK] Seq=4959 Ack=18832 Win=42240 Len=0"
"254","46.179571","184.73.254.250","10.10.10.252","TCP","54","8443  >  4236 [ACK] Seq=4959 Ack=20212 Win=42240 Len=0"
"255","46.180373","10.10.10.252","184.73.254.250","TCP","1434","4236  >  8443 [ACK] Seq=28526 Ack=4959 Win=16880 Len=1380"
"256","46.193043","184.73.254.250","10.10.10.252","TCP","54","8443  >  4236 [ACK] Seq=4959 Ack=21592 Win=42240 Len=0"
"257","46.194954","10.10.10.252","184.73.254.250","TCP","1434","4236  >  8443 [ACK] Seq=29906 Ack=4959 Win=16880 Len=1380"
"258","46.204250","184.73.254.250","10.10.10.252","TCP","54","8443  >  4236 [ACK] Seq=4959 Ack=22972 Win=42240 Len=0"
"259","46.206974","10.10.10.252","184.73.254.250","TCP","1434","4236  >  8443 [ACK] Seq=31286 Ack=4959 Win=16880 Len=1380"
"260","46.220894","10.10.10.252","184.73.254.250","TCP","1434","4236  >  8443 [ACK] Seq=32666 Ack=4959 Win=16880 Len=1380"
"261","46.230504","184.73.254.250","10.10.10.252","TCP","54","8443  >  4236 [ACK] Seq=4959 Ack=24352 Win=42240 Len=0"
"262","46.231200","184.73.254.250","10.10.10.252","TCP","54","8443  >  4236 [ACK] Seq=4959 Ack=24386 Win=42240 Len=0"
"263","46.232940","10.10.10.252","184.73.254.250","TCP","1434","4236  >  8443 [ACK] Seq=34046 Ack=4959 Win=16880 Len=1380"
"264","46.233572","10.10.10.252","184.73.254.250","TCP","188","4236  >  8443 [PSH, ACK] Seq=35426 Ack=4959 Win=16880 Len=134"
"265","46.247758","10.10.10.252","184.73.254.250","TCP","1434","4236  >  8443 [ACK] Seq=35560 Ack=4959 Win=16880 Len=1380"
"266","46.254722","184.73.254.250","10.10.10.252","TCP","54","8443  >  4236 [ACK] Seq=4959 Ack=27146 Win=42240 Len=0"
"267","46.259748","10.10.10.252","184.73.254.250","TCP","1434","4236  >  8443 [ACK] Seq=36940 Ack=4959 Win=16880 Len=1380"
"268","46.271982","10.10.10.252","184.73.254.250","TCP","1434","4236  >  8443 [ACK] Seq=38320 Ack=4959 Win=16880 Len=1380"
"269","46.280453","184.73.254.250","10.10.10.252","TCP","54","8443  >  4236 [ACK] Seq=4959 Ack=29906 Win=42240 Len=0"
"270","46.285310","10.10.10.252","184.73.254.250","TCP","1434","4236  >  8443 [ACK] Seq=39700 Ack=4959 Win=16880 Len=1380"
"271","46.298323","10.10.10.252","184.73.254.250","TCP","1434","4236  >  8443 [ACK] Seq=41080 Ack=4959 Win=16880 Len=1380"
"272","46.307032","184.73.254.250","10.10.10.252","TCP","54","8443  >  4236 [ACK] Seq=4959 Ack=32666 Win=42240 Len=0"
"273","46.311379","10.10.10.252","184.73.254.250","TCP","1434","4236  >  8443 [ACK] Seq=42460 Ack=4959 Win=16880 Len=1380"
"274","46.332989","184.73.254.250","10.10.10.252","TCP","54","8443  >  4236 [ACK] Seq=4959 Ack=35426 Win=42240 Len=0"
"275","46.333363","184.73.254.250","10.10.10.252","TCP","54","8443  >  4236 [ACK] Seq=4959 Ack=35560 Win=42240 Len=0"
"276","46.334461","10.10.10.252","184.73.254.250","TCP","654","4236  >  8443 [PSH, ACK] Seq=43840 Ack=4959 Win=16880 Len=600"
"277","46.359888","184.73.254.250","10.10.10.252","TCP","54","8443  >  4236 [ACK] Seq=4959 Ack=38320 Win=42240 Len=0"
"278","46.385327","184.73.254.250","10.10.10.252","TCP","54","8443  >  4236 [ACK] Seq=4959 Ack=41080 Win=42240 Len=0"
"279","46.411411","184.73.254.250","10.10.10.252","TCP","54","8443  >  4236 [ACK] Seq=4959 Ack=43840 Win=42240 Len=0"
"280","46.434452","184.73.254.250","10.10.10.252","TCP","54","8443  >  4236 [ACK] Seq=4959 Ack=44440 Win=42240 Len=0"
"281","46.459210","184.73.254.250","10.10.10.252","TCP","459","8443  >  4236 [PSH, ACK] Seq=4959 Ack=44440 Win=42240 Len=405"
"282","46.496856","10.10.10.252","184.73.254.250","TCP","54","4236  >  8443 [ACK] Seq=44440 Ack=5364 Win=16880 Len=0"
"283","67.139593","10.10.10.252","10.10.10.1","ICMP","98","Echo (ping) request  id=0x5e07, seq=0/0, ttl=64 (reply in 284)"
"284","67.139645","10.10.10.1","10.10.10.252","ICMP","98","Echo (ping) reply    id=0x5e07, seq=0/0, ttl=64 (request in 283)"
"285","68.141218","10.10.10.252","10.10.10.1","ICMP","98","Echo (ping) request  id=0x5e07, seq=1/256, ttl=64 (reply in 286)"
"286","68.141250","10.10.10.1","10.10.10.252","ICMP","98","Echo (ping) reply    id=0x5e07, seq=1/256, ttl=64 (request in 285)"
"287","69.145501","10.10.10.252","10.10.10.1","ICMP","98","Echo (ping) request  id=0x5e07, seq=2/512, ttl=64 (reply in 288)"
"288","69.145540","10.10.10.1","10.10.10.252","ICMP","98","Echo (ping) reply    id=0x5e07, seq=2/512, ttl=64 (request in 287)"
"289","72.141827","DavidEle_06:08:ba","BelkinIn_35:01:c1","ARP","42","Who has 10.10.10.252? Tell 10.10.10.1"
"290","72.144408","BelkinIn_35:01:c1","DavidEle_06:08:ba","ARP","42","10.10.10.252 is at 94:10:3e:35:01:c1"
