"No.","Time","Source","Destination","Protocol","Length","Info"
"1","0.000000","Withings_24:80:2a","IntelCor_c3:41:78","EAPOL","135","Key (Message 2 of 4)"
"2","0.004698","Withings_24:80:2a","IntelCor_c3:41:78","EAPOL","113","Key (Message 4 of 4)"
"3","0.078558","0.0.0.0","255.255.255.255","DHCP","342","DHCP Discover - Transaction ID 0x9867fed9"
"4","0.078734","10.10.10.1","10.10.10.21","DHCP","342","DHCP Offer    - Transaction ID 0x9867fed9"
"5","0.106736","0.0.0.0","255.255.255.255","DHCP","342","DHCP Request  - Transaction ID 0x9877fed9"
"6","0.174372","10.10.10.1","10.10.10.21","DHCP","342","DHCP ACK      - Transaction ID 0x9877fed9"
"7","0.201997","Withings_24:80:2a","Broadcast","ARP","42","Who has 10.10.10.21? Tell 0.0.0.0"
"8","0.415702","Withings_24:80:2a","Broadcast","ARP","42","Who has 10.10.10.21? Tell 0.0.0.0"
"9","0.907349","Withings_24:80:2a","Broadcast","ARP","42","Gratuitous ARP for 10.10.10.21 (Request)"
"10","1.306781","Withings_24:80:2a","Broadcast","ARP","42","Who has 10.10.10.1? Tell 10.10.10.21"
"11","1.306806","DavidEle_06:08:ba","Withings_24:80:2a","ARP","42","10.10.10.1 is at 00:b5:6d:06:08:ba"
"12","1.319324","10.10.10.21","10.10.10.1","DNS","80","Standard query 0x0000 A scalews.withings.net"
"13","1.319451","10.10.10.1","10.10.10.21","DNS","96","Standard query response 0x0000 A scalews.withings.net A 89.30.121.150"
"14","1.342301","10.10.10.21","89.30.121.150","TCP","58","49153  >  80 [SYN] Seq=0 Win=8400 Len=0 MSS=1400"
"15","1.352778","89.30.121.150","10.10.10.21","TCP","58","80  >  49153 [SYN, ACK] Seq=0 Ack=1 Win=14600 Len=0 MSS=1380"
"16","1.395430","10.10.10.21","89.30.121.150","TCP","54","49153  >  80 [ACK] Seq=1 Ack=1 Win=8400 Len=0"
"17","1.395517","10.10.10.21","89.30.121.150","HTTP","239","POST /cgi-bin/once HTTP/1.1  (application/x-www-form-urlencoded)"
"18","1.415943","89.30.121.150","10.10.10.21","HTTP","431","HTTP/1.1 200 OK  (text/plain)"
"19","1.455847","10.10.10.21","89.30.121.150","TCP","54","49153  >  80 [FIN, ACK] Seq=186 Ack=378 Win=8023 Len=0"
"20","1.461415","10.10.10.21","89.30.121.150","TCP","58","49154  >  80 [SYN] Seq=0 Win=8400 Len=0 MSS=1400"
"21","1.465972","89.30.121.150","10.10.10.21","TCP","54","80  >  49153 [FIN, ACK] Seq=378 Ack=187 Win=15544 Len=0"
"22","1.471575","89.30.121.150","10.10.10.21","TCP","58","80  >  49154 [SYN, ACK] Seq=0 Ack=1 Win=14600 Len=0 MSS=1380"
"23","1.508453","10.10.10.21","89.30.121.150","TCP","54","49153  >  80 [ACK] Seq=187 Ack=379 Win=8022 Len=0"
"24","1.508584","10.10.10.21","89.30.121.150","TCP","54","49154  >  80 [ACK] Seq=1 Ack=1 Win=8400 Len=0"
"25","1.509569","10.10.10.21","89.30.121.150","HTTP","237","POST /cgi-bin/once HTTP/1.1  (application/x-www-form-urlencoded)"
"26","1.528145","89.30.121.150","10.10.10.21","HTTP","492","HTTP/1.1 200 OK  (text/plain)"
"27","1.589745","10.10.10.21","89.30.121.150","HTTP","391","POST /cgi-bin/session HTTP/1.1  (application/x-www-form-urlencoded)"
"28","1.638020","89.30.121.150","10.10.10.21","TCP","54","80  >  49154 [ACK] Seq=439 Ack=521 Win=16616 Len=0"
"29","1.677814","89.30.121.150","10.10.10.21","HTTP","662","HTTP/1.1 200 OK  (text/plain)"
"30","1.870735","10.10.10.21","89.30.121.150","TCP","54","49154  >  80 [ACK] Seq=521 Ack=1047 Win=7354 Len=0"
"31","2.145099","10.10.10.21","89.30.121.150","TCP","252","49154  >  80 [PSH, ACK] Seq=521 Ack=1047 Win=7354 Len=198 [TCP segment of a reassembled PDU]"
"32","2.155217","89.30.121.150","10.10.10.21","TCP","54","80  >  49154 [ACK] Seq=1047 Ack=719 Win=17688 Len=0"
"33","2.156076","89.30.121.150","10.10.10.21","HTTP","79","HTTP/1.1 100 Continue "
"34","2.221766","10.10.10.21","89.30.121.150","TCP","121","49154  >  80 [PSH, ACK] Seq=719 Ack=1072 Win=7329 Len=67 [TCP segment of a reassembled PDU]"
"35","2.270069","89.30.121.150","10.10.10.21","TCP","54","80  >  49154 [ACK] Seq=1072 Ack=786 Win=17688 Len=0"
"36","2.300643","10.10.10.21","89.30.121.150","TCP","566","49154  >  80 [PSH, ACK] Seq=786 Ack=1072 Win=7329 Len=512 [TCP segment of a reassembled PDU]"
"37","2.310721","89.30.121.150","10.10.10.21","TCP","54","80  >  49154 [ACK] Seq=1072 Ack=1298 Win=18760 Len=0"
"38","2.353537","10.10.10.21","89.30.121.150","TCP","566","49154  >  80 [PSH, ACK] Seq=1298 Ack=1072 Win=7329 Len=512 [TCP segment of a reassembled PDU]"
"39","2.363671","89.30.121.150","10.10.10.21","TCP","54","80  >  49154 [ACK] Seq=1072 Ack=1810 Win=19832 Len=0"
"40","2.406488","10.10.10.21","89.30.121.150","TCP","566","49154  >  80 [PSH, ACK] Seq=1810 Ack=1072 Win=7329 Len=512 [TCP segment of a reassembled PDU]"
"41","2.416635","89.30.121.150","10.10.10.21","TCP","54","80  >  49154 [ACK] Seq=1072 Ack=2322 Win=20904 Len=0"
"42","2.433671","10.10.10.21","89.30.121.150","TCP","566","49154  >  80 [PSH, ACK] Seq=2322 Ack=1072 Win=7329 Len=512 [TCP segment of a reassembled PDU]"
"43","2.444643","89.30.121.150","10.10.10.21","TCP","54","80  >  49154 [ACK] Seq=1072 Ack=2834 Win=21976 Len=0"
"44","2.461616","10.10.10.21","89.30.121.150","TCP","566","49154  >  80 [PSH, ACK] Seq=2834 Ack=1072 Win=7329 Len=512 [TCP segment of a reassembled PDU]"
"45","2.471699","89.30.121.150","10.10.10.21","TCP","54","80  >  49154 [ACK] Seq=1072 Ack=3346 Win=23048 Len=0"
"46","2.514342","10.10.10.21","89.30.121.150","TCP","566","49154  >  80 [PSH, ACK] Seq=3346 Ack=1072 Win=7329 Len=512 [TCP segment of a reassembled PDU]"
"47","2.524578","89.30.121.150","10.10.10.21","TCP","54","80  >  49154 [ACK] Seq=1072 Ack=3858 Win=24120 Len=0"
"48","2.568891","10.10.10.21","89.30.121.150","TCP","566","49154  >  80 [PSH, ACK] Seq=3858 Ack=1072 Win=7329 Len=512 [TCP segment of a reassembled PDU]"
"49","2.579080","89.30.121.150","10.10.10.21","TCP","54","80  >  49154 [ACK] Seq=1072 Ack=4370 Win=25192 Len=0"
"50","2.597880","10.10.10.21","89.30.121.150","TCP","566","49154  >  80 [PSH, ACK] Seq=4370 Ack=1072 Win=7329 Len=512 [TCP segment of a reassembled PDU]"
"51","2.607895","89.30.121.150","10.10.10.21","TCP","54","80  >  49154 [ACK] Seq=1072 Ack=4882 Win=26264 Len=0"
"52","2.649543","10.10.10.21","89.30.121.150","HTTP","532","POST /cgi-bin/maint HTTP/1.1  (application/x-www-form-urlencoded)"
"53","2.659608","89.30.121.150","10.10.10.21","TCP","54","80  >  49154 [ACK] Seq=1072 Ack=5360 Win=27336 Len=0"
"54","2.678077","89.30.121.150","10.10.10.21","HTTP","431","HTTP/1.1 200 OK  (text/plain)"
"55","2.720544","10.10.10.21","89.30.121.150","HTTP","327","POST /cgi-bin/association HTTP/1.1  (application/x-www-form-urlencoded)"
"56","2.754535","89.30.121.150","10.10.10.21","HTTP","463","HTTP/1.1 200 OK  (text/plain)"
"57","2.806927","10.10.10.21","89.30.121.150","HTTP","276","POST /cgi-bin/session HTTP/1.1  (application/x-www-form-urlencoded)"
"58","2.837985","89.30.121.150","10.10.10.21","HTTP","431","HTTP/1.1 200 OK  (text/plain)"
"59","2.939724","10.10.10.21","89.30.121.150","TCP","54","49154  >  80 [ACK] Seq=5855 Ack=2235 Win=7614 Len=0"
"60","3.272760","10.10.10.21","89.30.121.150","TCP","54","49154  >  80 [FIN, ACK] Seq=5855 Ack=2235 Win=7614 Len=0"
"61","3.282943","89.30.121.150","10.10.10.21","TCP","54","80  >  49154 [FIN, ACK] Seq=2235 Ack=5856 Win=29480 Len=0"
"62","3.311461","10.10.10.21","89.30.121.150","TCP","54","49154  >  80 [ACK] Seq=5856 Ack=2236 Win=7613 Len=0"
"63","4.816700","10.10.10.21","0.0.0.0","DHCP","342","DHCP Release  - Transaction ID 0xb5d8fedc"
"64","6.325449","DavidEle_06:08:ba","Withings_24:80:2a","ARP","42","Who has 10.10.10.21? Tell 10.10.10.1"
"65","7.325395","DavidEle_06:08:ba","Withings_24:80:2a","ARP","42","Who has 10.10.10.21? Tell 10.10.10.1"
"66","8.325451","DavidEle_06:08:ba","Withings_24:80:2a","ARP","42","Who has 10.10.10.21? Tell 10.10.10.1"
